complete-composites-tomcat.csv
Validator,projectName,Batch ID,Refactorings,Code Elements,Start Commit,Smells Before,Smell Before IDs,Smells Before Starting Line,Smell Before Ending Line,Smell Before Reason,End Commit,Smells After,Smell After IDs,Smells After Starting Line,Smell After Ending Line,Smell After Reason
Researcher 1,apache_tomcat,20860,"[""Pull Up Method"", ""Pull Up Method"", ""Pull Up Method"", ""Pull Up Method"", ""Pull Up Method"", ""Pull Up Method""]","[""org.apache.coyote.ajp.AbstractAjpProcessor"", ""org.apache.coyote.ajp.AjpNioProcessor"", ""org.apache.coyote.ajp.AjpNioProcessor.receive()"", ""org.apache.coyote.ajp.AbstractAjpProcessor.receive()"", ""org.apache.coyote.ajp.AjpAprProcessor.receive()"", ""org.apache.coyote.ajp.AjpAprProcessor"", ""org.apache.coyote.ajp.AjpProcessor.receive()"", ""org.apache.coyote.ajp.AjpProcessor""]","[""efe47b403dc6128854b0684a4fdcbed81d91ad1c"", ""efe47b403dc6128854b0684a4fdcbed81d91ad1c"", ""efe47b403dc6128854b0684a4fdcbed81d91ad1c"", ""efe47b403dc6128854b0684a4fdcbed81d91ad1c"", ""efe47b403dc6128854b0684a4fdcbed81d91ad1c""]","[""LongParameterList"", ""SpaghettiCode"", ""ComplexClass"", ""ClassDataShouldBePrivate"", ""GodClass""]","[""3458bc8f70b758b5fef45187f9583b38"", ""7dff2048a8225ab3ed42c4b85a58ba16"", ""57e92d34fa250d5def40de45eee4dab1"", ""f0be238e7d2a9f0851e693a354a0c662"", ""1fbae94e26d0325a9b6a3a0d91a5f4ba""]","[684, 156, 156, 156, 156]","[714, 11291, 11291, 11291, 11291]","[""PARAMETER_COUNT > 1.176043689320363"", ""LONG_METHODS_CONNECTED = 17"", ""CC = 22.0"", ""PUBLIC_FIELD_COUNT = 3.0"", ""CLOC > 500, TCC < 0.4268867393916222""]","[""90709c7830f674ab947415849a2e9ca2b1396c7d"", ""90709c7830f674ab947415849a2e9ca2b1396c7d"", ""90709c7830f674ab947415849a2e9ca2b1396c7d"", ""90709c7830f674ab947415849a2e9ca2b1396c7d"", ""90709c7830f674ab947415849a2e9ca2b1396c7d"", ""90709c7830f674ab947415849a2e9ca2b1396c7d""]","[""ComplexClass"", ""GodClass"", ""ComplexClass"", ""ComplexClass"", ""ComplexClass"", ""FeatureEnvy""]","[""d61244ba9c16ec19104d1c5de3515171"", ""93b8450beed33440992035e1f03ebffc"", ""b73ef563406de70498a97392e4a0aa8f"", ""b9028095ce69f48bb29129cdaec35734"", ""8e84b2b747e5944bb7312a705e6e12b6"", ""21e9f52b3beedaf89007e09b049c7f26""]","[59, 59, 32, 32, 36, 652]","[1731, 1731, 209, 290, 410, 677]","[""CC = 102.0"", ""CLOC > 500, TCC < 0.4808063174919667"", ""CC = 11.0"", ""CC = 14.0"", ""CC = 25.0"", ""CALLS_TO_org.apache.coyote.ajp.AjpMessage > 4""]"
Researcher 1,apache_tomcat,20878,"[""Pull Up Attribute"", ""Pull Up Attribute"", ""Pull Up Method"", ""Pull Up Method""]","[""org.apache.tomcat.util.net.SecureNio2Channel"", ""org.apache.tomcat.util.net.Nio2Channel"", ""org.apache.tomcat.util.net.SecureNio2Channel.setSocket(SocketWrapper)"", ""org.apache.tomcat.util.net.Nio2Channel.setSocket(SocketWrapper)""]","[""efe47b403dc6128854b0684a4fdcbed81d91ad1c"", ""efe47b403dc6128854b0684a4fdcbed81d91ad1c"", ""efe47b403dc6128854b0684a4fdcbed81d91ad1c"", ""efe47b403dc6128854b0684a4fdcbed81d91ad1c"", ""efe47b403dc6128854b0684a4fdcbed81d91ad1c""]","[""LongParameterList"", ""SpaghettiCode"", ""ComplexClass"", ""ClassDataShouldBePrivate"", ""GodClass""]","[""3458bc8f70b758b5fef45187f9583b38"", ""7dff2048a8225ab3ed42c4b85a58ba16"", ""57e92d34fa250d5def40de45eee4dab1"", ""f0be238e7d2a9f0851e693a354a0c662"", ""1fbae94e26d0325a9b6a3a0d91a5f4ba""]","[684, 156, 156, 156, 156]","[714, 11291, 11291, 11291, 11291]","[""PARAMETER_COUNT > 1.176043689320363"", ""LONG_METHODS_CONNECTED = 17"", ""CC = 22.0"", ""PUBLIC_FIELD_COUNT = 3.0"", ""CLOC > 500, TCC < 0.4268867393916222""]","[""6b44dd99441a47955b6b18abc9d5346e16778a49"", ""6b44dd99441a47955b6b18abc9d5346e16778a49"", ""6b44dd99441a47955b6b18abc9d5346e16778a49""]","[""SpaghettiCode"", ""ComplexClass"", ""ClassDataShouldBePrivate""]","[""3c6641c4dee34a5c14c3129e1c9c3d82"", ""21c06b6d38cc28fa15981d8087700f01"", ""cd03fb22ab33c0e7096146a283a51ff2""]","[39, 39, 39]","[-1, -1, -1]","[""LONG_METHODS_CONNECTED = 4"", ""CC = 29.0"", ""PUBLIC_FIELD_COUNT = 9.0""]"
Researcher 1,apache_tomcat,20920,"[""Pull Up Attribute"", ""Pull Up Attribute"", ""Pull Up Method"", ""Pull Up Method"", ""Pull Up Method"", ""Pull Up Method"", ""Pull Up Attribute"", ""Pull Up Attribute""]","[""org.apache.coyote.http11.Http11Nio2Processor"", ""org.apache.coyote.http11.AbstractHttp11Processor"", ""org.apache.coyote.http11.Http11NioProcessor"", ""org.apache.coyote.http11.Http11NioProcessor.setSslSupport(SSLSupport)"", ""org.apache.coyote.http11.AbstractHttp11Processor.setSslSupport(SSLSupport)"", ""org.apache.coyote.http11.Http11Nio2Processor.setSslSupport(SSLSupport)""]","[""db4c995379b44bce61ae08fbd12d892e0e10f22a"", ""db4c995379b44bce61ae08fbd12d892e0e10f22a"", ""db4c995379b44bce61ae08fbd12d892e0e10f22a"", ""db4c995379b44bce61ae08fbd12d892e0e10f22a"", ""db4c995379b44bce61ae08fbd12d892e0e10f22a"", ""db4c995379b44bce61ae08fbd12d892e0e10f22a"", ""db4c995379b44bce61ae08fbd12d892e0e10f22a"", ""db4c995379b44bce61ae08fbd12d892e0e10f22a"", ""db4c995379b44bce61ae08fbd12d892e0e10f22a"", ""db4c995379b44bce61ae08fbd12d892e0e10f22a"", ""db4c995379b44bce61ae08fbd12d892e0e10f22a"", ""db4c995379b44bce61ae08fbd12d892e0e10f22a"", ""db4c995379b44bce61ae08fbd12d892e0e10f22a""]","[""DataClass"", ""LazyClass"", ""SpaghettiCode"", ""ComplexClass"", ""ClassDataShouldBePrivate"", ""GodClass"", ""SpaghettiCode"", ""ComplexClass"", ""ClassDataShouldBePrivate"", ""DataClass"", ""ComplexClass"", ""LazyClass"", ""LazyClass""]","[""ab4c5b92013292bf15d5aa11c1c3f316"", ""e4de97ff7f23e9cb568a159b2c6aeb62"", ""ed0d3618ef64da4e8481edb4d95afd60"", ""d1b59edcfa287445b5529edf26b101cc"", ""4c234dfa03ce4b1114ec30d9f7dfd5cd"", ""c4b6d4ebc00c392c4e0c6a3aad25af8b"", ""b1ab7d1d7de87d017eaa9e62a03fc7dd"", ""e472a181c8be1c4ed98a92d1c87b502d"", ""4df117533277143e584bc252a216e7ca"", ""33369875cc571e0db89790094890a4ae"", ""5fe46fa5516c795ce5b5a8cc923d8b8e"", ""83aa94196a60eaacfdc151e3cd31afba"", ""8e502e30cce4337c43310d1f150bea51""]","[30, 30, 36, 36, 36, 36, 33, 33, 33, 38, 38, 30, 30]","[78, 67, 3176, 3176, 3176, 3176, 877, 877, 877, 346, 346, 127, 70]","[""WOC = 0.25, NOPA = 0.0, NOAM = 6.0, WMC = 8.0"", ""CLOC < 16.0"", ""LONG_METHODS_CONNECTED = 3"", ""CC = 37.0"", ""PUBLIC_FIELD_COUNT = 5.0"", ""CLOC > 500, TCC < 0.4328299889440565"", ""LONG_METHODS_CONNECTED = 4"", ""CC = 25.0"", ""PUBLIC_FIELD_COUNT = 38.0"", ""WOC = 0.02702702702702703, NOPA = 0.0, NOAM = 36.0, WMC = 71.0"", ""CC = 34.0"", ""CLOC < 16.0"", ""CLOC < 16.0""]","[""4d432e7ebcd991c7f8c912d4bc08769319ca8b3c"", ""4d432e7ebcd991c7f8c912d4bc08769319ca8b3c"", ""4d432e7ebcd991c7f8c912d4bc08769319ca8b3c""]","[""BrainClass"", ""ComplexClass"", ""GodClass""]","[""6e4cf2527540f56aa76d957a5540572e"", ""f6d424a61d0579eed598aece1472e4b3"", ""25f2ceb56b13661f988b7e333208c6cb""]","[59, 59, 59]","[1727, 1727, 1727]","[""BRAIN_METHODS = 1, WMC = 314.0, TCC = 0.0"", ""CC = 56.0"", ""CLOC > 500, TCC < 0.48007932503269046""]"
Researcher 2,apache_tomcat,20921,"[""Move Method"", ""Move Method"", ""Move Attribute"", ""Move Attribute"", ""Pull Up Attribute"", ""Pull Up Attribute"", ""Pull Up Method"", ""Pull Up Method"", ""Pull Up Method"", ""Pull Up Method"", ""Move Method"", ""Move Method""]","[""org.apache.coyote.AbstractProcessor"", ""org.apache.coyote.http11.Http11AprProcessor.setClientCertProvider(String)"", ""org.apache.coyote.http11.Http11AprProcessor"", ""org.apache.coyote.AbstractProcessor.setClientCertProvider(String)"", ""org.apache.coyote.ajp.AjpProcessor"", ""org.apache.coyote.ajp.AjpProcessor.setClientCertProvider(String)"", ""org.apache.coyote.ajp.AjpProcessor.getClientCertProvider()"", ""org.apache.coyote.AbstractProcessor.getClientCertProvider()"", ""org.apache.coyote.http11.Http11AprProcessor.getClientCertProvider()""]","[""db4c995379b44bce61ae08fbd12d892e0e10f22a"", ""db4c995379b44bce61ae08fbd12d892e0e10f22a"", ""db4c995379b44bce61ae08fbd12d892e0e10f22a"", ""db4c995379b44bce61ae08fbd12d892e0e10f22a"", ""db4c995379b44bce61ae08fbd12d892e0e10f22a"", ""db4c995379b44bce61ae08fbd12d892e0e10f22a"", ""db4c995379b44bce61ae08fbd12d892e0e10f22a"", ""db4c995379b44bce61ae08fbd12d892e0e10f22a"", ""db4c995379b44bce61ae08fbd12d892e0e10f22a"", ""db4c995379b44bce61ae08fbd12d892e0e10f22a"", ""db4c995379b44bce61ae08fbd12d892e0e10f22a"", ""db4c995379b44bce61ae08fbd12d892e0e10f22a"", ""db4c995379b44bce61ae08fbd12d892e0e10f22a""]","[""DataClass"", ""LazyClass"", ""SpaghettiCode"", ""ComplexClass"", ""ClassDataShouldBePrivate"", ""GodClass"", ""SpaghettiCode"", ""ComplexClass"", ""ClassDataShouldBePrivate"", ""DataClass"", ""ComplexClass"", ""LazyClass"", ""LazyClass""]","[""ab4c5b92013292bf15d5aa11c1c3f316"", ""e4de97ff7f23e9cb568a159b2c6aeb62"", ""ed0d3618ef64da4e8481edb4d95afd60"", ""d1b59edcfa287445b5529edf26b101cc"", ""4c234dfa03ce4b1114ec30d9f7dfd5cd"", ""c4b6d4ebc00c392c4e0c6a3aad25af8b"", ""b1ab7d1d7de87d017eaa9e62a03fc7dd"", ""e472a181c8be1c4ed98a92d1c87b502d"", ""4df117533277143e584bc252a216e7ca"", ""33369875cc571e0db89790094890a4ae"", ""5fe46fa5516c795ce5b5a8cc923d8b8e"", ""83aa94196a60eaacfdc151e3cd31afba"", ""8e502e30cce4337c43310d1f150bea51""]","[30, 30, 36, 36, 36, 36, 33, 33, 33, 38, 38, 30, 30]","[78, 67, 3176, 3176, 3176, 3176, 877, 877, 877, 346, 346, 127, 70]","[""WOC = 0.25, NOPA = 0.0, NOAM = 6.0, WMC = 8.0"", ""CLOC < 16.0"", ""LONG_METHODS_CONNECTED = 3"", ""CC = 37.0"", ""PUBLIC_FIELD_COUNT = 5.0"", ""CLOC > 500, TCC < 0.4328299889440565"", ""LONG_METHODS_CONNECTED = 4"", ""CC = 25.0"", ""PUBLIC_FIELD_COUNT = 38.0"", ""WOC = 0.02702702702702703, NOPA = 0.0, NOAM = 36.0, WMC = 71.0"", ""CC = 34.0"", ""CLOC < 16.0"", ""CLOC < 16.0""]","[""4d432e7ebcd991c7f8c912d4bc08769319ca8b3c"", ""4d432e7ebcd991c7f8c912d4bc08769319ca8b3c""]","[""ComplexClass"", ""GodClass""]","[""8e84b2b747e5944bb7312a705e6e12b6"", ""eed9ea865a5968d35e56bf1cacd66821""]","[36, 55]","[410, 1357]","[""CC = 25.0"", ""CLOC > 500, TCC < 0.43751361778444253""]"
Researcher 2,apache_tomcat,20930,"[""Pull Up Attribute"", ""Pull Up Attribute"", ""Pull Up Method"", ""Pull Up Method"", ""Pull Up Method"", ""Pull Up Method"", ""Pull Up Method"", ""Pull Up Method"", ""Pull Up Attribute"", ""Pull Up Attribute"", ""Pull Up Attribute"", ""Pull Up Attribute"", ""Pull Up Method"", ""Pull Up Method"", ""Pull Up Method"", ""Pull Up Method"", ""Pull Up Method"", ""Pull Up Method"", ""Pull Up Method"", ""Pull Up Method"", ""Pull Up Method"", ""Pull Up Method"", ""Pull Up Method"", ""Pull Up Method"", ""Pull Up Attribute"", ""Pull Up Attribute"", ""Pull Up Attribute"", ""Pull Up Attribute"", ""Pull Up Method"", ""Pull Up Method"", ""Pull Up Attribute"", ""Pull Up Attribute"", ""Pull Up Method"", ""Pull Up Method"", ""Pull Up Method"", ""Pull Up Method"", ""Pull Up Attribute"", ""Pull Up Attribute"", ""Pull Up Attribute"", ""Pull Up Attribute""]","[""org.apache.tomcat.util.net.NioEndpoint"", ""org.apache.tomcat.util.net.AbstractJsseEndpoint"", ""org.apache.tomcat.util.net.NioEndpoint.getSSLContext()"", ""org.apache.tomcat.util.net.AbstractJsseEndpoint.getSSLContext()"", ""org.apache.tomcat.util.net.NioEndpoint.getSslImplementation()"", ""org.apache.tomcat.util.net.AbstractJsseEndpoint.getSslImplementation()"", ""org.apache.tomcat.util.net.NioEndpoint.setSSLContext(SSLContext)"", ""org.apache.tomcat.util.net.AbstractJsseEndpoint.setSSLContext(SSLContext)"", ""org.apache.tomcat.util.net.Nio2Endpoint"", ""org.apache.tomcat.util.net.Nio2Endpoint.getCiphersUsed()"", ""org.apache.tomcat.util.net.AbstractJsseEndpoint.getCiphersUsed()"", ""org.apache.tomcat.util.net.NioEndpoint.getCiphersUsed()"", ""org.apache.tomcat.util.net.Nio2Endpoint.createSSLEngine()"", ""org.apache.tomcat.util.net.AbstractJsseEndpoint.createSSLEngine()"", ""org.apache.tomcat.util.net.Nio2Endpoint.setSSLContext(SSLContext)"", ""org.apache.tomcat.util.net.NioEndpoint.wrap(KeyMResearcher 1ger)"", ""org.apache.tomcat.util.net.AbstractJsseEndpoint.wrap(KeyMResearcher 1ger)"", ""org.apache.tomcat.util.net.Nio2Endpoint.getSslImplementation()"", ""org.apache.tomcat.util.net.Nio2Endpoint.wrap(KeyMResearcher 1ger)"", ""org.apache.tomcat.util.net.NioEndpoint.createSSLEngine()"", ""org.apache.tomcat.util.net.Nio2Endpoint.getSSLContext()""]","[""58d1c0d28fa0c9353a9e186e250ed51dca4f386c"", ""58d1c0d28fa0c9353a9e186e250ed51dca4f386c"", ""58d1c0d28fa0c9353a9e186e250ed51dca4f386c"", ""58d1c0d28fa0c9353a9e186e250ed51dca4f386c"", ""58d1c0d28fa0c9353a9e186e250ed51dca4f386c"", ""58d1c0d28fa0c9353a9e186e250ed51dca4f386c"", ""58d1c0d28fa0c9353a9e186e250ed51dca4f386c"", ""58d1c0d28fa0c9353a9e186e250ed51dca4f386c""]","[""FeatureEnvy"", ""ComplexClass"", ""GodClass"", ""ComplexClass"", ""ComplexClass"", ""FeatureEnvy"", ""ComplexClass"", ""FeatureEnvy""]","[""22d3e65ed480fd00ef17ee652ba341b8"", ""d61244ba9c16ec19104d1c5de3515171"", ""93b8450beed33440992035e1f03ebffc"", ""b73ef563406de70498a97392e4a0aa8f"", ""b9028095ce69f48bb29129cdaec35734"", ""8a2938bea77bcf325d7734948ac43e02"", ""8e84b2b747e5944bb7312a705e6e12b6"", ""f3e1644aee0056e32dffe5962b0d55f8""]","[432, 59, 59, 32, 32, 562, 36, 315]","[458, 1731, 1731, 209, 290, 588, 410, 341]","[""CALLS_TO_org.apache.coyote.ajp.AjpMessage > 4"", ""CC = 102.0"", ""CLOC > 500, TCC < 0.4808063174919667"", ""CC = 11.0"", ""CC = 14.0"", ""CALLS_TO_org.apache.coyote.ajp.AjpMessage > 4"", ""CC = 25.0"", ""CALLS_TO_org.apache.coyote.ajp.AjpMessage > 4""]","[""82c4cf9a9f5551377675524a8846ffbf820ecb91"", ""82c4cf9a9f5551377675524a8846ffbf820ecb91"", ""82c4cf9a9f5551377675524a8846ffbf820ecb91"", ""82c4cf9a9f5551377675524a8846ffbf820ecb91"", ""82c4cf9a9f5551377675524a8846ffbf820ecb91""]","[""FeatureEnvy"", ""SpeculativeGenerality"", ""DataClass"", ""GodClass"", ""GodClass""]","[""2841da7c2eb6e4a6d31274abe962fb9b"", ""829ed3c9f43b2941302d7d70755ec964"", ""8df9ce30ba4e0e03853fef7be6b18faa"", ""9e4965a56a77764db1b07566e735f621"", ""fcb2f8ca230a9bff6a02dca0fd86b6fe""]","[68, 33, 61, 61, 57]","[85, 217, 1714, 1714, 1757]","[""CALLS_TO_org.apache.tomcat.util.net.AbstractEndpoint<S> > 5"", ""IS_ABSTRACT = 1, CHILDREN_COUNT = 2"", ""WOC = 0.18421052631578946, NOPA = 5.0, NOAM = 31.0, WMC = 113.0"", ""CLOC > 500, TCC < 0.4808063174919667"", ""CLOC > 500, TCC < 0.4937743041936207""]"
Researcher 2,apache_tomcat,20959,"[""Extract Method"", ""Extract Method"", ""Extract Method"", ""Extract Method"", ""Extract Method"", ""Extract Method"", ""Extract Method"", ""Extract Method"", ""Extract Method"", ""Extract Method"", ""Pull Up Method"", ""Pull Up Method"", ""Pull Up Method"", ""Pull Up Method"", ""Pull Up Method"", ""Pull Up Method"", ""Extract Method"", ""Extract Method"", ""Inline Method"", ""Inline Method""]","[""org.apache.coyote.ajp.AjpProcessor"", ""org.apache.coyote.ajp.AjpProcessor.dispatch(SocketStatus)"", ""org.apache.coyote.ajp.AjpProcessor.flushBufferedWrite()"", ""org.apache.coyote.http11.Http11Processor"", ""org.apache.coyote.http11.Http11Processor.dispatch(SocketStatus)"", ""org.apache.coyote.http11.Http11Processor.dispatchEndRequest()"", ""org.apache.coyote.ajp.AjpProcessor.dispatchEndRequest()"", ""org.apache.coyote.http2.StreamProcessor"", ""org.apache.coyote.http2.StreamProcessor.dispatch(SocketStatus)"", ""org.apache.coyote.http2.StreamProcessor.flushBufferedWrite()"", ""org.apache.coyote.http11.Http11Processor.flushBufferedWrite()"", ""org.apache.coyote.AbstractProcessor"", ""org.apache.coyote.AbstractProcessor.dispatch(SocketStatus)"", ""org.apache.coyote.http2.StreamProcessor.dispatchEndRequest()"", ""org.apache.coyote.http2.StreamProcessor.process(SocketStatus)"", ""org.apache.coyote.http2.StreamProcessor.run()""]","[""da370005eb4a2b27db285510aa4c2ae4e4a70770"", ""da370005eb4a2b27db285510aa4c2ae4e4a70770"", ""da370005eb4a2b27db285510aa4c2ae4e4a70770"", ""da370005eb4a2b27db285510aa4c2ae4e4a70770""]","[""SpaghettiCode"", ""ComplexClass"", ""ClassDataShouldBePrivate"", ""GodClass""]","[""3c6641c4dee34a5c14c3129e1c9c3d82"", ""21c06b6d38cc28fa15981d8087700f01"", ""cd03fb22ab33c0e7096146a283a51ff2"", ""332ba4f406fbe8385ec9f3f643218e1a""]","[39, 39, 39, 39]","[-1, -1, -1, -1]","[""LONG_METHODS_CONNECTED = 4"", ""CC = 29.0"", ""PUBLIC_FIELD_COUNT = 9.0"", ""CLOC > 500, TCC < 0.48451052296993646""]","[""c4760089e640aa9763aca14f003f6d1c872d5982"", ""c4760089e640aa9763aca14f003f6d1c872d5982"", ""c4760089e640aa9763aca14f003f6d1c872d5982""]","[""ComplexClass"", ""DispersedCoupling"", ""FeatureEnvy""]","[""8738971dbdceb15534f90f05b6301e38"", ""7bd231fb328636d73fe6a5f4d28f59bc"", ""d5030ec8534d65fa05f1532bc7c3f36a""]","[41, 62, 62]","[579, 115, 115]","[""CC = 56.0"", ""CINT > 8.0, CDISP > 0.5, CC > 1.0"", ""CALLS_TO_org.apache.coyote.AbstractProcessor > 5""]"
Researcher 2,apache_tomcat,20985,"[""Move Method"", ""Move Method"", ""Move Method"", ""Move Method"", ""Move Method"", ""Move Method"", ""Inline Method"", ""Inline Method"", ""Inline Method"", ""Inline Method""]","[""org.apache.tomcat.util.net.Nio2Endpoint"", ""org.apache.tomcat.util.net.AbstractEndpoint"", ""org.apache.tomcat.util.net.Nio2Endpoint.processSocket(SocketWrapperBase,SocketEvent,boolean)"", ""org.apache.tomcat.util.net.AbstractEndpoint.processSocket(SocketWrapperBase,SocketEvent,boolean)"", ""org.apache.tomcat.util.net.NioEndpoint"", ""org.apache.tomcat.util.net.NioEndpoint.processSocket(SocketWrapperBase,SocketEvent,boolean)"", ""org.apache.tomcat.util.net.AprEndpoint.processSocket(SocketWrapperBase,SocketEvent,boolean)"", ""org.apache.tomcat.util.net.AprEndpoint"", ""org.apache.tomcat.util.net.Nio2Endpoint.releaseCaches()"", ""org.apache.tomcat.util.net.Nio2Endpoint.unbind()"", ""org.apache.tomcat.util.net.NioEndpoint.unbind()"", ""org.apache.tomcat.util.net.NioEndpoint.releaseCaches()""]","[""da370005eb4a2b27db285510aa4c2ae4e4a70770"", ""da370005eb4a2b27db285510aa4c2ae4e4a70770"", ""da370005eb4a2b27db285510aa4c2ae4e4a70770"", ""da370005eb4a2b27db285510aa4c2ae4e4a70770""]","[""SpaghettiCode"", ""ComplexClass"", ""ClassDataShouldBePrivate"", ""GodClass""]","[""3c6641c4dee34a5c14c3129e1c9c3d82"", ""21c06b6d38cc28fa15981d8087700f01"", ""cd03fb22ab33c0e7096146a283a51ff2"", ""332ba4f406fbe8385ec9f3f643218e1a""]","[39, 39, 39, 39]","[-1, -1, -1, -1]","[""LONG_METHODS_CONNECTED = 4"", ""CC = 29.0"", ""PUBLIC_FIELD_COUNT = 9.0"", ""CLOC > 500, TCC < 0.48451052296993646""]","[""0301f90e3879bade84270d9a5eac0bc66bb9f473"", ""0301f90e3879bade84270d9a5eac0bc66bb9f473"", ""0301f90e3879bade84270d9a5eac0bc66bb9f473"", ""0301f90e3879bade84270d9a5eac0bc66bb9f473"", ""0301f90e3879bade84270d9a5eac0bc66bb9f473""]","[""DataClass"", ""GodClass"", ""ComplexClass"", ""GodClass"", ""FeatureEnvy""]","[""8df9ce30ba4e0e03853fef7be6b18faa"", ""9e4965a56a77764db1b07566e735f621"", ""ee9126f5c7f5cb9b334091481c63d0c9"", ""fcb2f8ca230a9bff6a02dca0fd86b6fe"", ""a9ed27e090d885e87958e2e9ae82410d""]","[61, 61, 57, 57, 467]","[1714, 1714, 1757, 1757, 488]","[""WOC = 0.18421052631578946, NOPA = 5.0, NOAM = 31.0, WMC = 113.0"", ""CLOC > 500, TCC < 0.4808063174919667"", ""CC = 11.0"", ""CLOC > 500, TCC < 0.4937743041936207"", ""CALLS_TO_org.apache.juli.logging.Log > 4""]"
Researcher 2,apache_tomcat,20998,"[""Pull Up Method"", ""Pull Up Method"", ""Pull Up Method"", ""Pull Up Method"", ""Pull Up Method"", ""Pull Up Method"", ""Pull Up Method"", ""Pull Up Method""]","[""org.apache.coyote.http11.Http11Processor.getPopulateRequestAttributesFromSocket()"", ""org.apache.coyote.AbstractProcessor"", ""org.apache.coyote.http11.Http11Processor"", ""org.apache.coyote.AbstractProcessor.getPopulateRequestAttributesFromSocket()"", ""org.apache.coyote.ajp.AjpProcessor.action(ActionCode,Object)"", ""org.apache.coyote.ajp.AjpProcessor"", ""org.apache.coyote.AbstractProcessor.action(ActionCode,Object)"", ""org.apache.coyote.http11.Http11Processor.action(ActionCode,Object)"", ""org.apache.coyote.http2.StreamProcessor.getPopulateRequestAttributesFromSocket()"", ""org.apache.coyote.http2.StreamProcessor""]","[""27bffaa5cbe6756e985818358359876982280d6b"", ""27bffaa5cbe6756e985818358359876982280d6b"", ""27bffaa5cbe6756e985818358359876982280d6b"", ""27bffaa5cbe6756e985818358359876982280d6b"", ""27bffaa5cbe6756e985818358359876982280d6b""]","[""ComplexClass"", ""BrainClass"", ""ComplexClass"", ""GodClass"", ""ComplexClass""]","[""54709accb94981dcd0c4935b8164f64c"", ""6e4cf2527540f56aa76d957a5540572e"", ""f6d424a61d0579eed598aece1472e4b3"", ""25f2ceb56b13661f988b7e333208c6cb"", ""de5fac074cc74a3ccf9f8aa04f469bda""]","[36, 59, 59, 59, 42]","[172, 1727, 1727, 1727, 566]","[""CC = 14.0"", ""BRAIN_METHODS = 1, WMC = 314.0, TCC = 0.0"", ""CC = 56.0"", ""CLOC > 500, TCC < 0.48007932503269046"", ""CC = 16.0""]","[""cd90090fb26128a29472a9a90e6e82d9de03025b"", ""cd90090fb26128a29472a9a90e6e82d9de03025b"", ""cd90090fb26128a29472a9a90e6e82d9de03025b"", ""cd90090fb26128a29472a9a90e6e82d9de03025b"", ""cd90090fb26128a29472a9a90e6e82d9de03025b"", ""cd90090fb26128a29472a9a90e6e82d9de03025b""]","[""SpaghettiCode"", ""ComplexClass"", ""BrainClass"", ""SpaghettiCode"", ""ComplexClass"", ""GodClass""]","[""46a7d13eeecd47a6c995f356bfef20d0"", ""9ce28ef8cb906283fe2a6e976a592653"", ""989f9997d407b2fa7b369c132fce2bf0"", ""48511c040e3b5b9310a556899c3e9c00"", ""88fc4cb4cab531c7b66b1febd2e98004"", ""d0e1bc791a1773d826c1506460e869b1""]","[37, 37, 56, 56, 35, 56]","[746, 746, 1697, 1697, 425, 1697]","[""LONG_METHODS_CONNECTED = 2"", ""CC = 18.0"", ""BRAIN_METHODS = 1, WMC = 259.0, TCC = 0.08067226890756303"", ""LONG_METHODS_CONNECTED = 5"", ""CC = 58.0"", ""CLOC > 500, TCC < 0.42040823562284796""]"
Researcher 2,apache_tomcat,20999,"[""Pull Up Method"", ""Pull Up Method"", ""Pull Up Method"", ""Pull Up Method"", ""Pull Up Method"", ""Pull Up Method"", ""Pull Up Method"", ""Pull Up Method"", ""Pull Up Method"", ""Pull Up Method"", ""Pull Up Method"", ""Pull Up Method""]","[""org.apache.coyote.AbstractProcessor"", ""org.apache.coyote.http2.StreamProcessor.populateSslRequestAttributes()"", ""org.apache.coyote.http2.StreamProcessor"", ""org.apache.coyote.AbstractProcessor.populateSslRequestAttributes()"", ""org.apache.coyote.http2.StreamProcessor.populateRequestAttributeRemoteHost()"", ""org.apache.coyote.AbstractProcessor.populateRequestAttributeRemoteHost()"", ""org.apache.coyote.http11.Http11Processor.populateRequestAttributeRemoteHost()"", ""org.apache.coyote.http11.Http11Processor"", ""org.apache.coyote.ajp.AjpProcessor"", ""org.apache.coyote.ajp.AjpProcessor.isPushSupported()"", ""org.apache.coyote.AbstractProcessor.isPushSupported()"", ""org.apache.coyote.http11.Http11Processor.isPushSupported()"", ""org.apache.coyote.http11.Http11Processor.populateSslRequestAttributes()""]","[""27bffaa5cbe6756e985818358359876982280d6b"", ""27bffaa5cbe6756e985818358359876982280d6b"", ""27bffaa5cbe6756e985818358359876982280d6b"", ""27bffaa5cbe6756e985818358359876982280d6b"", ""27bffaa5cbe6756e985818358359876982280d6b""]","[""ComplexClass"", ""BrainClass"", ""ComplexClass"", ""GodClass"", ""ComplexClass""]","[""54709accb94981dcd0c4935b8164f64c"", ""6e4cf2527540f56aa76d957a5540572e"", ""f6d424a61d0579eed598aece1472e4b3"", ""25f2ceb56b13661f988b7e333208c6cb"", ""de5fac074cc74a3ccf9f8aa04f469bda""]","[36, 59, 59, 59, 42]","[172, 1727, 1727, 1727, 566]","[""CC = 14.0"", ""BRAIN_METHODS = 1, WMC = 314.0, TCC = 0.0"", ""CC = 56.0"", ""CLOC > 500, TCC < 0.48007932503269046"", ""CC = 16.0""]","[""16d54ae9116f23713d101af167fb0e6b511952dd"", ""16d54ae9116f23713d101af167fb0e6b511952dd"", ""16d54ae9116f23713d101af167fb0e6b511952dd"", ""16d54ae9116f23713d101af167fb0e6b511952dd"", ""16d54ae9116f23713d101af167fb0e6b511952dd"", ""16d54ae9116f23713d101af167fb0e6b511952dd""]","[""SpaghettiCode"", ""ComplexClass"", ""BrainClass"", ""SpaghettiCode"", ""ComplexClass"", ""GodClass""]","[""46a7d13eeecd47a6c995f356bfef20d0"", ""9ce28ef8cb906283fe2a6e976a592653"", ""989f9997d407b2fa7b369c132fce2bf0"", ""48511c040e3b5b9310a556899c3e9c00"", ""88fc4cb4cab531c7b66b1febd2e98004"", ""d0e1bc791a1773d826c1506460e869b1""]","[37, 37, 56, 56, 35, 56]","[746, 746, 1697, 1697, 425, 1697]","[""LONG_METHODS_CONNECTED = 2"", ""CC = 18.0"", ""BRAIN_METHODS = 1, WMC = 259.0, TCC = 0.08067226890756303"", ""LONG_METHODS_CONNECTED = 5"", ""CC = 58.0"", ""CLOC > 500, TCC < 0.42040823562284796""]"
Researcher 2,apache_tomcat,21000,"[""Pull Up Method"", ""Pull Up Method"", ""Pull Up Method"", ""Pull Up Method"", ""Pull Up Method"", ""Pull Up Method"", ""Pull Up Method"", ""Pull Up Method"", ""Pull Up Method"", ""Pull Up Method"", ""Pull Up Method"", ""Pull Up Method""]","[""org.apache.coyote.AbstractProcessor"", ""org.apache.coyote.ajp.AjpProcessor.getUpgradeToken()"", ""org.apache.coyote.ajp.AjpProcessor"", ""org.apache.coyote.AbstractProcessor.getUpgradeToken()"", ""org.apache.coyote.http11.Http11Processor.doPush(PushToken)"", ""org.apache.coyote.http11.Http11Processor"", ""org.apache.coyote.AbstractProcessor.doPush(PushToken)"", ""org.apache.coyote.http2.StreamProcessor"", ""org.apache.coyote.http2.StreamProcessor.isUpgrade()"", ""org.apache.coyote.AbstractProcessor.isUpgrade()"", ""org.apache.coyote.ajp.AjpProcessor.isUpgrade()"", ""org.apache.coyote.http2.StreamProcessor.getUpgradeToken()"", ""org.apache.coyote.ajp.AjpProcessor.doPush(PushToken)""]","[""27bffaa5cbe6756e985818358359876982280d6b"", ""27bffaa5cbe6756e985818358359876982280d6b"", ""27bffaa5cbe6756e985818358359876982280d6b""]","[""ComplexClass"", ""ComplexClass"", ""GodClass""]","[""747e210fef8d510433740de3ddb26f11"", ""8e84b2b747e5944bb7312a705e6e12b6"", ""eed9ea865a5968d35e56bf1cacd66821""]","[43, 36, 55]","[529, 410, 1357]","[""CC = 76.0"", ""CC = 25.0"", ""CLOC > 500, TCC < 0.43751361778444253""]","[""bead07d06ec462e3e09396e7a60c3d1b1bbdc3bb"", ""bead07d06ec462e3e09396e7a60c3d1b1bbdc3bb"", ""bead07d06ec462e3e09396e7a60c3d1b1bbdc3bb"", ""bead07d06ec462e3e09396e7a60c3d1b1bbdc3bb"", ""bead07d06ec462e3e09396e7a60c3d1b1bbdc3bb""]","[""SpaghettiCode"", ""ComplexClass"", ""SpaghettiCode"", ""ComplexClass"", ""GodClass""]","[""46a7d13eeecd47a6c995f356bfef20d0"", ""9ce28ef8cb906283fe2a6e976a592653"", ""da9c9846479fb9cde0aeffd9dc96712f"", ""8e84b2b747e5944bb7312a705e6e12b6"", ""eed9ea865a5968d35e56bf1cacd66821""]","[37, 37, 55, 36, 55]","[746, 746, 1357, 410, 1357]","[""LONG_METHODS_CONNECTED = 2"", ""CC = 18.0"", ""LONG_METHODS_CONNECTED = 5"", ""CC = 25.0"", ""CLOC > 500, TCC < 0.43751361778444253""]"
Researcher 3,apache_tomcat,21029,"[""Move Method"", ""Move Method"", ""Move Attribute"", ""Move Attribute"", ""Move Attribute"", ""Move Attribute"", ""Move Method"", ""Move Method"", ""Move Attribute"", ""Move Attribute""]","[""org.apache.catalina.valves.AccessLogValve"", ""org.apache.catalina.valves.ExtendedAccessLogValve"", ""org.apache.catalina.valves.ExtendedAccessLogValve.setCheckExists(boolean)"", ""org.apache.catalina.valves.AccessLogValve.setCheckExists(boolean)"", ""org.apache.catalina.valves.ExtendedAccessLogValve.isCheckExists()"", ""org.apache.catalina.valves.AccessLogValve.isCheckExists()""]","[""27bffaa5cbe6756e985818358359876982280d6b"", ""27bffaa5cbe6756e985818358359876982280d6b"", ""27bffaa5cbe6756e985818358359876982280d6b""]","[""ComplexClass"", ""ComplexClass"", ""GodClass""]","[""747e210fef8d510433740de3ddb26f11"", ""8e84b2b747e5944bb7312a705e6e12b6"", ""eed9ea865a5968d35e56bf1cacd66821""]","[43, 36, 55]","[529, 410, 1357]","[""CC = 76.0"", ""CC = 25.0"", ""CLOC > 500, TCC < 0.43751361778444253""]","[""9e53b887d55746cb2250f4bfe682679e64a69e62"", ""9e53b887d55746cb2250f4bfe682679e64a69e62"", ""9e53b887d55746cb2250f4bfe682679e64a69e62""]","[""SpaghettiCode"", ""ComplexClass"", ""ComplexClass""]","[""0f2aaceeb825f7bd86d8b4a2e9b7136e"", ""95aaa00126977a0167249eabdbbb4bd3"", ""ae976a0720eb899d55efe2994cfa3c52""]","[46, 46, 60]","[884, 884, 2121]","[""LONG_METHODS_CONNECTED = 4"", ""CC = 30.0"", ""CC = 12.0""]"
Researcher 3,apache_tomcat,21056,"[""Pull Up Method"", ""Pull Up Method"", ""Pull Up Method"", ""Pull Up Method"", ""Pull Up Attribute"", ""Pull Up Attribute"", ""Pull Up Method"", ""Pull Up Method"", ""Pull Up Attribute"", ""Pull Up Attribute"", ""Pull Up Method"", ""Pull Up Method"", ""Pull Up Method"", ""Pull Up Method"", ""Pull Up Method"", ""Pull Up Method"", ""Pull Up Method"", ""Pull Up Method"", ""Pull Up Attribute"", ""Pull Up Attribute"", ""Pull Up Method"", ""Pull Up Method"", ""Pull Up Method"", ""Pull Up Method"", ""Pull Up Attribute"", ""Pull Up Attribute"", ""Pull Up Attribute"", ""Pull Up Attribute"", ""Pull Up Method"", ""Pull Up Method"", ""Pull Up Attribute"", ""Pull Up Attribute"", ""Pull Up Method"", ""Pull Up Method"", ""Pull Up Method"", ""Pull Up Method"", ""Pull Up Method"", ""Pull Up Method"", ""Pull Up Method"", ""Pull Up Method"", ""Pull Up Attribute"", ""Pull Up Attribute"", ""Pull Up Method"", ""Pull Up Method"", ""Pull Up Attribute"", ""Pull Up Attribute"", ""Pull Up Method"", ""Pull Up Method"", ""Pull Up Method"", ""Pull Up Method"", ""Pull Up Method"", ""Pull Up Method"", ""Pull Up Attribute"", ""Pull Up Attribute"", ""Pull Up Method"", ""Pull Up Method"", ""Pull Up Method"", ""Pull Up Method"", ""Pull Up Method"", ""Pull Up Method"", ""Pull Up Attribute"", ""Pull Up Attribute"", ""Pull Up Method"", ""Pull Up Method"", ""Pull Up Attribute"", ""Pull Up Attribute"", ""Pull Up Attribute"", ""Pull Up Attribute"", ""Pull Up Method"", ""Pull Up Method"", ""Pull Up Method"", ""Pull Up Method"", ""Pull Up Method"", ""Pull Up Method"", ""Pull Up Attribute"", ""Pull Up Attribute"", ""Pull Up Method"", ""Pull Up Method"", ""Pull Up Method"", ""Pull Up Method"", ""Pull Up Method"", ""Pull Up Method"", ""Pull Up Method"", ""Pull Up Method"", ""Pull Up Attribute"", ""Pull Up Attribute"", ""Pull Up Method"", ""Pull Up Method"", ""Pull Up Method"", ""Pull Up Method"", ""Pull Up Attribute"", ""Pull Up Attribute"", ""Pull Up Attribute"", ""Pull Up Attribute"", ""Pull Up Method"", ""Pull Up Method"", ""Pull Up Method"", ""Pull Up Method"", ""Pull Up Method"", ""Pull Up Method"", ""Pull Up Method"", ""Pull Up Method"", ""Pull Up Method"", ""Pull Up Method"", ""Pull Up Method"", ""Pull Up Method"", ""Pull Up Method"", ""Pull Up Method"", ""Pull Up Attribute"", ""Pull Up Attribute"", ""Pull Up Method"", ""Pull Up Method"", ""Pull Up Method"", ""Pull Up Method"", ""Pull Up Method"", ""Pull Up Method"", ""Pull Up Method"", ""Pull Up Method"", ""Pull Up Method"", ""Pull Up Method"", ""Pull Up Method"", ""Pull Up Method"", ""Pull Up Attribute"", ""Pull Up Attribute"", ""Pull Up Attribute"", ""Pull Up Attribute"", ""Pull Up Method"", ""Pull Up Method"", ""Pull Up Attribute"", ""Pull Up Attribute"", ""Pull Up Attribute"", ""Pull Up Attribute"", ""Pull Up Attribute"", ""Pull Up Attribute"", ""Pull Up Method"", ""Pull Up Method"", ""Pull Up Method"", ""Pull Up Method"", ""Pull Up Attribute"", ""Pull Up Attribute"", ""Pull Up Method"", ""Pull Up Method"", ""Pull Up Method"", ""Pull Up Method"", ""Pull Up Method"", ""Pull Up Method"", ""Pull Up Attribute"", ""Pull Up Attribute"", ""Pull Up Method"", ""Pull Up Method"", ""Pull Up Method"", ""Pull Up Method"", ""Pull Up Attribute"", ""Pull Up Attribute"", ""Pull Up Attribute"", ""Pull Up Attribute"", ""Pull Up Attribute"", ""Pull Up Attribute"", ""Pull Up Attribute"", ""Pull Up Attribute"", ""Pull Up Attribute"", ""Pull Up Attribute"", ""Pull Up Method"", ""Pull Up Method"", ""Pull Up Attribute"", ""Pull Up Attribute"", ""Pull Up Method"", ""Pull Up Method"", ""Pull Up Method"", ""Pull Up Method"", ""Pull Up Attribute"", ""Pull Up Attribute"", ""Pull Up Method"", ""Pull Up Method"", ""Pull Up Attribute"", ""Pull Up Attribute"", ""Pull Up Attribute"", ""Pull Up Attribute"", ""Pull Up Method"", ""Pull Up Method"", ""Pull Up Attribute"", ""Pull Up Attribute"", ""Pull Up Method"", ""Pull Up Method"", ""Pull Up Method"", ""Pull Up Method"", ""Pull Up Method"", ""Pull Up Method"", ""Pull Up Method"", ""Pull Up Method"", ""Pull Up Method"", ""Pull Up Method"", ""Pull Up Attribute"", ""Pull Up Attribute"", ""Pull Up Method"", ""Pull Up Method"", ""Pull Up Attribute"", ""Pull Up Attribute"", ""Pull Up Method"", ""Pull Up Method"", ""Pull Up Method"", ""Pull Up Method"", ""Pull Up Attribute"", ""Pull Up Attribute"", ""Pull Up Method"", ""Pull Up Method"", ""Pull Up Method"", ""Pull Up Method"", ""Pull Up Method"", ""Pull Up Method"", ""Pull Up Attribute"", ""Pull Up Attribute"", ""Pull Up Method"", ""Pull Up Method"", ""Pull Up Method"", ""Pull Up Method"", ""Pull Up Attribute"", ""Pull Up Attribute"", ""Pull Up Attribute"", ""Pull Up Attribute"", ""Pull Up Method"", ""Pull Up Method"", ""Pull Up Attribute"", ""Pull Up Attribute"", ""Pull Up Method"", ""Pull Up Method"", ""Pull Up Method"", ""Pull Up Method"", ""Pull Up Method"", ""Pull Up Method"", ""Pull Up Method"", ""Pull Up Method"", ""Pull Up Attribute"", ""Pull Up Attribute"", ""Pull Up Method"", ""Pull Up Method"", ""Pull Up Method"", ""Pull Up Method""]","[""org.apache.tomcat.util.net.JIoEndpoint"", ""org.apache.tomcat.util.net.JIoEndpoint.isPaused()"", ""org.apache.tomcat.util.net.AbstractEndpoint"", ""org.apache.tomcat.util.net.AbstractEndpoint.isPaused()"", ""org.apache.tomcat.util.net.AprEndpoint"", ""org.apache.tomcat.util.net.AprEndpoint.setSSLEnabled(boolean)"", ""org.apache.tomcat.util.net.AbstractEndpoint.setSSLEnabled(boolean)"", ""org.apache.tomcat.util.net.NioEndpoint"", ""org.apache.tomcat.util.net.NioEndpoint.getDaemon()"", ""org.apache.tomcat.util.net.AbstractEndpoint.getDaemon()"", ""org.apache.tomcat.util.net.JIoEndpoint.setBacklog(int)"", ""org.apache.tomcat.util.net.AbstractEndpoint.setBacklog(int)"", ""org.apache.tomcat.util.net.NioEndpoint.getAddress()"", ""org.apache.tomcat.util.net.AbstractEndpoint.getAddress()"", ""org.apache.tomcat.util.net.AprEndpoint.getExecutor()"", ""org.apache.tomcat.util.net.AbstractEndpoint.getExecutor()"", ""org.apache.tomcat.util.net.AprEndpoint.getDaemon()"", ""org.apache.tomcat.util.net.AprEndpoint.getCurrentThreadsBusy()"", ""org.apache.tomcat.util.net.AbstractEndpoint.getCurrentThreadsBusy()"", ""org.apache.tomcat.util.net.AprEndpoint.setPort(int)"", ""org.apache.tomcat.util.net.AbstractEndpoint.setPort(int)"", ""org.apache.tomcat.util.net.AprEndpoint.getMaxThreads()"", ""org.apache.tomcat.util.net.AbstractEndpoint.getMaxThreads()"", ""org.apache.tomcat.util.net.AprEndpoint.getKeepAliveTimeout()"", ""org.apache.tomcat.util.net.AbstractEndpoint.getKeepAliveTimeout()"", ""org.apache.tomcat.util.net.AprEndpoint.setMaxThreads(int)"", ""org.apache.tomcat.util.net.AbstractEndpoint.setMinSpareThreads(int)"", ""org.apache.tomcat.util.net.NioEndpoint.setMaxKeepAliveRequests(int)"", ""org.apache.tomcat.util.net.AbstractEndpoint.setMaxKeepAliveRequests(int)"", ""org.apache.tomcat.util.net.JIoEndpoint.setMinSpareThreads(int)"", ""org.apache.tomcat.util.net.NioEndpoint.getName()"", ""org.apache.tomcat.util.net.AbstractEndpoint.getName()"", ""org.apache.tomcat.util.net.AprEndpoint.isSSLEnabled()"", ""org.apache.tomcat.util.net.AbstractEndpoint.isSSLEnabled()"", ""org.apache.tomcat.util.net.AprEndpoint.getPort()"", ""org.apache.tomcat.util.net.AbstractEndpoint.getPort()"", ""org.apache.tomcat.util.net.NioEndpoint.setName(String)"", ""org.apache.tomcat.util.net.AbstractEndpoint.setName(String)"", ""org.apache.tomcat.util.net.NioEndpoint.getMaxKeepAliveRequests()"", ""org.apache.tomcat.util.net.AbstractEndpoint.getMaxKeepAliveRequests()"", ""org.apache.tomcat.util.net.NioEndpoint.getKeepAliveTimeout()"", ""org.apache.tomcat.util.net.NioEndpoint.getSocketProperties()"", ""org.apache.tomcat.util.net.AbstractEndpoint.getSocketProperties()"", ""org.apache.tomcat.util.net.JIoEndpoint.getPort()"", ""org.apache.tomcat.util.net.JIoEndpoint.getMaxThreads()"", ""org.apache.tomcat.util.net.NioEndpoint.setThreadPriority(int)"", ""org.apache.tomcat.util.net.AbstractEndpoint.setThreadPriority(int)"", ""org.apache.tomcat.util.net.AprEndpoint.isRunning()"", ""org.apache.tomcat.util.net.AbstractEndpoint.isRunning()"", ""org.apache.tomcat.util.net.JIoEndpoint.getCurrentThreadsBusy()"", ""org.apache.tomcat.util.net.NioEndpoint.getTcpNoDelay()"", ""org.apache.tomcat.util.net.AbstractEndpoint.getTcpNoDelay()"", ""org.apache.tomcat.util.net.AprEndpoint.getBacklog()"", ""org.apache.tomcat.util.net.AbstractEndpoint.getBacklog()"", ""org.apache.tomcat.util.net.NioEndpoint.getExecutor()"", ""org.apache.tomcat.util.net.NioEndpoint.getBacklog()"", ""org.apache.tomcat.util.net.NioEndpoint.setExecutor(Executor)"", ""org.apache.tomcat.util.net.AbstractEndpoint.setExecutor(Executor)"", ""org.apache.tomcat.util.net.JIoEndpoint.isRunning()"", ""org.apache.tomcat.util.net.AprEndpoint.setKeepAliveTimeout(int)"", ""org.apache.tomcat.util.net.AbstractEndpoint.setKeepAliveTimeout(int)"", ""org.apache.tomcat.util.net.NioEndpoint.setPort(int)"", ""org.apache.tomcat.util.net.JIoEndpoint.getMinSpareThreads()"", ""org.apache.tomcat.util.net.AbstractEndpoint.getMinSpareThreads()"", ""org.apache.tomcat.util.net.NioEndpoint.setBacklog(int)"", ""org.apache.tomcat.util.net.AprEndpoint.setBacklog(int)"", ""org.apache.tomcat.util.net.AprEndpoint.getName()"", ""org.apache.tomcat.util.net.JIoEndpoint.setTcpNoDelay(boolean)"", ""org.apache.tomcat.util.net.AbstractEndpoint.setTcpNoDelay(boolean)"", ""org.apache.tomcat.util.net.NioEndpoint.setMinSpareThreads(int)"", ""org.apache.tomcat.util.net.JIoEndpoint.getBacklog()"", ""org.apache.tomcat.util.net.NioEndpoint.getSoTimeout()"", ""org.apache.tomcat.util.net.AbstractEndpoint.getSoTimeout()"", ""org.apache.tomcat.util.net.JIoEndpoint.getAddress()"", ""org.apache.tomcat.util.net.NioEndpoint.getThreadPriority()"", ""org.apache.tomcat.util.net.AbstractEndpoint.getThreadPriority()"", ""org.apache.tomcat.util.net.NioEndpoint.setSoTimeout(int)"", ""org.apache.tomcat.util.net.AbstractEndpoint.setSoTimeout(int)"", ""org.apache.tomcat.util.net.NioEndpoint.setTcpNoDelay(boolean)"", ""org.apache.tomcat.util.net.NioEndpoint.getCurrentThreadCount()"", ""org.apache.tomcat.util.net.AbstractEndpoint.getCurrentThreadCount()"", ""org.apache.tomcat.util.net.JIoEndpoint.getDaemon()"", ""org.apache.tomcat.util.net.JIoEndpoint.getTcpNoDelay()"", ""org.apache.tomcat.util.net.NioEndpoint.setMaxThreads(int)"", ""org.apache.tomcat.util.net.JIoEndpoint.getName()"", ""org.apache.tomcat.util.net.NioEndpoint.getMaxThreads()"", ""org.apache.tomcat.util.net.NioEndpoint.setAddress(InetAddress)"", ""org.apache.tomcat.util.net.AbstractEndpoint.setAddress(InetAddress)"", ""org.apache.tomcat.util.net.JIoEndpoint.getExecutor()"", ""org.apache.tomcat.util.net.NioEndpoint.unlockAccept()"", ""org.apache.tomcat.util.net.AbstractEndpoint.unlockAccept()"", ""org.apache.tomcat.util.net.JIoEndpoint.setSoTimeout(int)"", ""org.apache.tomcat.util.net.NioEndpoint.setDaemon(boolean)"", ""org.apache.tomcat.util.net.AbstractEndpoint.setDaemon(boolean)"", ""org.apache.tomcat.util.net.JIoEndpoint.setMaxThreads(int)"", ""org.apache.tomcat.util.net.AbstractEndpoint.setMaxThreads(int)"", ""org.apache.tomcat.util.net.NioEndpoint.setSoLinger(int)"", ""org.apache.tomcat.util.net.AbstractEndpoint.setSoLinger(int)"", ""org.apache.tomcat.util.net.AprEndpoint.getAddress()"", ""org.apache.tomcat.util.net.JIoEndpoint.getCurrentThreadCount()"", ""org.apache.tomcat.util.net.JIoEndpoint.setPort(int)"", ""org.apache.tomcat.util.net.JIoEndpoint.setName(String)"", ""org.apache.tomcat.util.net.JIoEndpoint.setDaemon(boolean)"", ""org.apache.tomcat.util.net.JIoEndpoint.setAddress(InetAddress)"", ""org.apache.tomcat.util.net.NioEndpoint.getMinSpareThreads()"", ""org.apache.tomcat.util.net.JIoEndpoint.getSoTimeout()"", ""org.apache.tomcat.util.net.NioEndpoint.getCurrentThreadsBusy()"", ""org.apache.tomcat.util.net.JIoEndpoint.getSoLinger()"", ""org.apache.tomcat.util.net.AbstractEndpoint.getSoLinger()"", ""org.apache.tomcat.util.net.AprEndpoint.setDaemon(boolean)"", ""org.apache.tomcat.util.net.NioEndpoint.getPort()"", ""org.apache.tomcat.util.net.NioEndpoint.setKeepAliveTimeout(int)"", ""org.apache.tomcat.util.net.AprEndpoint.setAddress(InetAddress)"", ""org.apache.tomcat.util.net.AprEndpoint.getCurrentThreadCount()"", ""org.apache.tomcat.util.net.AprEndpoint.isPaused()"", ""org.apache.tomcat.util.net.AprEndpoint.setName(String)"", ""org.apache.tomcat.util.net.NioEndpoint.getSoLinger()""]","[""27bffaa5cbe6756e985818358359876982280d6b"", ""27bffaa5cbe6756e985818358359876982280d6b"", ""27bffaa5cbe6756e985818358359876982280d6b""]","[""ComplexClass"", ""ComplexClass"", ""GodClass""]","[""747e210fef8d510433740de3ddb26f11"", ""8e84b2b747e5944bb7312a705e6e12b6"", ""eed9ea865a5968d35e56bf1cacd66821""]","[43, 36, 55]","[529, 410, 1357]","[""CC = 76.0"", ""CC = 25.0"", ""CLOC > 500, TCC < 0.43751361778444253""]","[""a9ddfecf6b580242dd374ce521a9079f2bb88dbc"", ""a9ddfecf6b580242dd374ce521a9079f2bb88dbc"", ""a9ddfecf6b580242dd374ce521a9079f2bb88dbc"", ""a9ddfecf6b580242dd374ce521a9079f2bb88dbc"", ""a9ddfecf6b580242dd374ce521a9079f2bb88dbc"", ""a9ddfecf6b580242dd374ce521a9079f2bb88dbc"", ""a9ddfecf6b580242dd374ce521a9079f2bb88dbc"", ""a9ddfecf6b580242dd374ce521a9079f2bb88dbc""]","[""DataClass"", ""IntensiveCoupling"", ""SpaghettiCode"", ""ComplexClass"", ""ClassDataShouldBePrivate"", ""GodClass"", ""ClassDataShouldBePrivate"", ""GodClass""]","[""7e6020f0518b0219c9ed17dfc0dc0348"", ""28bfb30dbb118c0140223909a412ccb3"", ""e90aca5cca29487b02cfb2b82d9dfebc"", ""511ff13113da1166168186547f368e78"", ""f23f5615cb8b5a00b821898546fdbb0f"", ""5f2019a2c1b44046cea2370af44847cd"", ""6a0b983a10c7299c74fe6704429a9c45"", ""9e4965a56a77764db1b07566e735f621""]","[32, 541, 51, 51, 51, 51, 61, 61]","[387, 619, 2375, 2375, 2375, 2375, 1714, 1714]","[""WOC = 0.13157894736842105, NOPA = 0.0, NOAM = 33.0, WMC = 79.0"", ""CINT = 14.0, CDISP = 0.35714285714285715, CC > 1.0"", ""LONG_METHODS_CONNECTED = 2"", ""CC = 46.0"", ""PUBLIC_FIELD_COUNT = 11.0"", ""CLOC > 500, TCC < 0.48007932503269046"", ""PUBLIC_FIELD_COUNT = 5.0"", ""CLOC > 500, TCC < 0.4808063174919667""]"
Researcher 3,apache_tomcat,21085,"[""Move Method"", ""Move Method"", ""Move Method"", ""Move Method""]","[""org.apache.catalina.core.StandardService.getDomain()"", ""org.apache.catalina.mbeans.MBeanUtils"", ""org.apache.catalina.core.StandardService"", ""org.apache.catalina.mbeans.MBeanUtils.getDomain(Service)"", ""org.apache.catalina.core.StandardThreadExecutor"", ""org.apache.catalina.core.StandardThreadExecutor.getDomain()"", ""org.apache.catalina.mbeans.MBeanUtils.getDomain(Container)""]","[""27bffaa5cbe6756e985818358359876982280d6b"", ""27bffaa5cbe6756e985818358359876982280d6b"", ""27bffaa5cbe6756e985818358359876982280d6b""]","[""ComplexClass"", ""ComplexClass"", ""GodClass""]","[""747e210fef8d510433740de3ddb26f11"", ""8e84b2b747e5944bb7312a705e6e12b6"", ""eed9ea865a5968d35e56bf1cacd66821""]","[43, 36, 55]","[529, 410, 1357]","[""CC = 76.0"", ""CC = 25.0"", ""CLOC > 500, TCC < 0.43751361778444253""]","[""4a2830c5ba1765d10aa8c1c0bc6aab722d655f64"", ""4a2830c5ba1765d10aa8c1c0bc6aab722d655f64"", ""4a2830c5ba1765d10aa8c1c0bc6aab722d655f64""]","[""ComplexClass"", ""GodClass"", ""DataClass""]","[""ceab1ab5b16de5e0e9a938f4e60bc165"", ""be93f9d2a4fc3290071c3a4bf97ba9f8"", ""8cad86557f6a309603cfb91ae6ee4c9a""]","[63, 63, 32]","[1677, 1677, 334]","[""CC = 15.0"", ""CLOC > 500, TCC < 0.4351686601894036"", ""WOC = 0.25, NOPA = 0.0, NOAM = 24.0, WMC = 52.0""]"
Researcher 3,apache_tomcat,21087,"[""Move Attribute"", ""Move Attribute"", ""Move Method"", ""Move Method""]","[""org.apache.catalina.connector.CoyoteAdapter"", ""org.apache.catalina.core.ContainerBase"", ""org.apache.catalina.connector.CoyoteAdapter.getAccessLog()"", ""org.apache.catalina.core.ContainerBase.getAccessLog()""]","[""a1c58dacce5637f09df7f5d46560de3275482530"", ""a1c58dacce5637f09df7f5d46560de3275482530"", ""a1c58dacce5637f09df7f5d46560de3275482530"", ""a1c58dacce5637f09df7f5d46560de3275482530"", ""a1c58dacce5637f09df7f5d46560de3275482530"", ""a1c58dacce5637f09df7f5d46560de3275482530"", ""a1c58dacce5637f09df7f5d46560de3275482530"", ""a1c58dacce5637f09df7f5d46560de3275482530"", ""a1c58dacce5637f09df7f5d46560de3275482530""]","[""FeatureEnvy"", ""SpeculativeGenerality"", ""LazyClass"", ""DataClass"", ""RefusedBequest"", ""GodClass"", ""RefusedBequest"", ""GodClass"", ""FeatureEnvy""]","[""a04f992406a65e1d892c6b0c644db2cd"", ""829ed3c9f43b2941302d7d70755ec964"", ""db5a64fd9e676c8968368f7376df10a2"", ""8df9ce30ba4e0e03853fef7be6b18faa"", ""fbaff18c8082cf2d3b46b81f8388724a"", ""9e4965a56a77764db1b07566e735f621"", ""b37a8c78721cb5a965b9b6f04a7fdf40"", ""fcb2f8ca230a9bff6a02dca0fd86b6fe"", ""214f312f570e756090121261dc157864""]","[524, 33, 19, 61, 60, 61, 62, 57, 578]","[541, 217, 21, 1714, 1752, 1714, 2087, 1757, 594]","[""CALLS_TO_org.apache.tomcat.util.net.AbstractEndpoint<org.apache.tomcat.util.net.Nio2Channel> > 5"", ""IS_ABSTRACT = 1, CHILDREN_COUNT = 2"", ""CLOC < 10.0"", ""WOC = 0.18421052631578946, NOPA = 5.0, NOAM = 31.0, WMC = 113.0"", ""OVERRIDE_RATIO = 1.0"", ""CLOC > 500, TCC < 0.4808063174919667"", ""OVERRIDE_RATIO = 1.0"", ""CLOC > 500, TCC < 0.4937743041936207"", ""CALLS_TO_org.apache.tomcat.util.net.AbstractEndpoint<org.apache.tomcat.util.net.NioChannel> > 4""]","[""cf3a84c91268b26dcd5a08e364923e16008c0a32"", ""cf3a84c91268b26dcd5a08e364923e16008c0a32"", ""cf3a84c91268b26dcd5a08e364923e16008c0a32""]","[""SpaghettiCode"", ""ComplexClass"", ""ComplexClass""]","[""b62e582013e43ccca5d8c56e17364f45"", ""2cbb7bee225286264be8cc30e67fc258"", ""554990670b77e3e4d544709616fce84b""]","[54, 54, 72]","[1373, 1373, 1597]","[""LONG_METHODS_CONNECTED = 6"", ""CC = 29.0"", ""CC = 11.0""]"
Researcher 3,apache_tomcat,21090,"[""Pull Up Method"", ""Pull Up Method"", ""Pull Up Method"", ""Pull Up Method"", ""Pull Up Method"", ""Pull Up Method""]","[""org.apache.coyote.http11.Http11Processor"", ""org.apache.coyote.http11.AbstractHttp11Processor"", ""org.apache.coyote.http11.Http11Processor.initializeFilters()"", ""org.apache.coyote.http11.AbstractHttp11Processor.initializeFilters()"", ""org.apache.coyote.http11.Http11AprProcessor.initializeFilters()"", ""org.apache.coyote.http11.Http11AprProcessor"", ""org.apache.coyote.http11.Http11NioProcessor"", ""org.apache.coyote.http11.Http11NioProcessor.initializeFilters()""]","[""a1c58dacce5637f09df7f5d46560de3275482530"", ""a1c58dacce5637f09df7f5d46560de3275482530"", ""a1c58dacce5637f09df7f5d46560de3275482530"", ""a1c58dacce5637f09df7f5d46560de3275482530"", ""a1c58dacce5637f09df7f5d46560de3275482530"", ""a1c58dacce5637f09df7f5d46560de3275482530"", ""a1c58dacce5637f09df7f5d46560de3275482530"", ""a1c58dacce5637f09df7f5d46560de3275482530"", ""a1c58dacce5637f09df7f5d46560de3275482530""]","[""FeatureEnvy"", ""SpeculativeGenerality"", ""LazyClass"", ""DataClass"", ""RefusedBequest"", ""GodClass"", ""RefusedBequest"", ""GodClass"", ""FeatureEnvy""]","[""a04f992406a65e1d892c6b0c644db2cd"", ""829ed3c9f43b2941302d7d70755ec964"", ""db5a64fd9e676c8968368f7376df10a2"", ""8df9ce30ba4e0e03853fef7be6b18faa"", ""fbaff18c8082cf2d3b46b81f8388724a"", ""9e4965a56a77764db1b07566e735f621"", ""b37a8c78721cb5a965b9b6f04a7fdf40"", ""fcb2f8ca230a9bff6a02dca0fd86b6fe"", ""214f312f570e756090121261dc157864""]","[524, 33, 19, 61, 60, 61, 62, 57, 578]","[541, 217, 21, 1714, 1752, 1714, 2087, 1757, 594]","[""CALLS_TO_org.apache.tomcat.util.net.AbstractEndpoint<org.apache.tomcat.util.net.Nio2Channel> > 5"", ""IS_ABSTRACT = 1, CHILDREN_COUNT = 2"", ""CLOC < 10.0"", ""WOC = 0.18421052631578946, NOPA = 5.0, NOAM = 31.0, WMC = 113.0"", ""OVERRIDE_RATIO = 1.0"", ""CLOC > 500, TCC < 0.4808063174919667"", ""OVERRIDE_RATIO = 1.0"", ""CLOC > 500, TCC < 0.4937743041936207"", ""CALLS_TO_org.apache.tomcat.util.net.AbstractEndpoint<org.apache.tomcat.util.net.NioChannel> > 4""]","[""c8e1569ea59ed17b8b2ea3a4c704e4dd2dadff2f"", ""c8e1569ea59ed17b8b2ea3a4c704e4dd2dadff2f"", ""c8e1569ea59ed17b8b2ea3a4c704e4dd2dadff2f"", ""c8e1569ea59ed17b8b2ea3a4c704e4dd2dadff2f"", ""c8e1569ea59ed17b8b2ea3a4c704e4dd2dadff2f"", ""c8e1569ea59ed17b8b2ea3a4c704e4dd2dadff2f"", ""c8e1569ea59ed17b8b2ea3a4c704e4dd2dadff2f""]","[""SpaghettiCode"", ""ComplexClass"", ""SpaghettiCode"", ""ComplexClass"", ""DataClass"", ""SpaghettiCode"", ""ComplexClass""]","[""0cabdda96d0636b7051219df0571a026"", ""747e210fef8d510433740de3ddb26f11"", ""48511c040e3b5b9310a556899c3e9c00"", ""88fc4cb4cab531c7b66b1febd2e98004"", ""869165866f1d6b93085473871257b218"", ""87bfa6d38f55ba2ea710a1ea8f1b5f3f"", ""de5fac074cc74a3ccf9f8aa04f469bda""]","[63, 43, 56, 35, 41, 42, 42]","[1805, 529, 1697, 425, 826, 566, 566]","[""LONG_METHODS_CONNECTED = 5"", ""CC = 76.0"", ""LONG_METHODS_CONNECTED = 5"", ""CC = 58.0"", ""WOC = 0.16129032258064516, NOPA = 0.0, NOAM = 26.0, WMC = 97.0"", ""LONG_METHODS_CONNECTED = 2"", ""CC = 16.0""]"
Researcher 3,apache_tomcat,21123,"[""Move Method"", ""Move Method"", ""Move Method"", ""Move Method"", ""Move Method"", ""Move Method"", ""Move Method"", ""Move Method"", ""Move Method"", ""Move Method"", ""Move Method"", ""Move Method""]","[""org.apache.coyote.ajp.AjpAprProcessor"", ""org.apache.coyote.ajp.AjpAprProcessor.getExecutor()"", ""org.apache.coyote.AbstractProcessor"", ""org.apache.coyote.AbstractProcessor.getExecutor()"", ""org.apache.coyote.http11.Http11Processor.getExecutor()"", ""org.apache.coyote.http11.Http11Processor"", ""org.apache.coyote.http11.Http11NioProcessor"", ""org.apache.coyote.http11.Http11NioProcessor.getExecutor()"", ""org.apache.coyote.ajp.AjpNioProcessor"", ""org.apache.coyote.ajp.AjpNioProcessor.getExecutor()"", ""org.apache.coyote.ajp.AjpProcessor.getExecutor()"", ""org.apache.coyote.ajp.AjpProcessor"", ""org.apache.coyote.http11.Http11AprProcessor"", ""org.apache.coyote.http11.Http11AprProcessor.getExecutor()""]","[""679401356aed7c50a455fa73c0d0b24a06117384"", ""679401356aed7c50a455fa73c0d0b24a06117384"", ""679401356aed7c50a455fa73c0d0b24a06117384"", ""679401356aed7c50a455fa73c0d0b24a06117384"", ""679401356aed7c50a455fa73c0d0b24a06117384"", ""679401356aed7c50a455fa73c0d0b24a06117384"", ""679401356aed7c50a455fa73c0d0b24a06117384"", ""679401356aed7c50a455fa73c0d0b24a06117384"", ""679401356aed7c50a455fa73c0d0b24a06117384"", ""679401356aed7c50a455fa73c0d0b24a06117384"", ""679401356aed7c50a455fa73c0d0b24a06117384"", ""679401356aed7c50a455fa73c0d0b24a06117384"", ""679401356aed7c50a455fa73c0d0b24a06117384"", ""679401356aed7c50a455fa73c0d0b24a06117384"", ""679401356aed7c50a455fa73c0d0b24a06117384"", ""679401356aed7c50a455fa73c0d0b24a06117384"", ""679401356aed7c50a455fa73c0d0b24a06117384""]","[""DispersedCoupling"", ""LongMethod"", ""BrainClass"", ""SpaghettiCode"", ""ComplexClass"", ""GodClass"", ""SpaghettiCode"", ""ComplexClass"", ""DispersedCoupling"", ""LongMethod"", ""FeatureEnvy"", ""SpaghettiCode"", ""ComplexClass"", ""GodClass"", ""DispersedCoupling"", ""LongMethod"", ""FeatureEnvy""]","[""3b1942063d8d0f25e3e0c96f39a2d912"", ""7cc0e656fa02e44a71330e9c3da909e9"", ""989f9997d407b2fa7b369c132fce2bf0"", ""48511c040e3b5b9310a556899c3e9c00"", ""88fc4cb4cab531c7b66b1febd2e98004"", ""d0e1bc791a1773d826c1506460e869b1"", ""cea0562618edec357888576da010fca9"", ""8738971dbdceb15534f90f05b6301e38"", ""8618470922917a36f436bd922872bb97"", ""f9a126b1ee1b349f44d3b16395728ef5"", ""a539ae1623ed3672a5405c6143ad931d"", ""da9c9846479fb9cde0aeffd9dc96712f"", ""8e84b2b747e5944bb7312a705e6e12b6"", ""eed9ea865a5968d35e56bf1cacd66821"", ""9ad7f1344721c7bd398ceac26bb17edf"", ""2273a1ba03714c3f97972b4895b6bd9b"", ""c2e4955a0896339690be814dafb0adf3""]","[620, 620, 56, 56, 35, 56, 43, 41, 403, 403, 403, 55, 36, 55, 1697, 1697, 1697]","[665, 665, 1697, 1697, 425, 1697, 494, 579, 448, 448, 448, 1357, 410, 1357, 1742, 1742, 1742]","[""CINT > 8.0, CDISP > 0.5, CC > 1.0"", ""MLOC > 6.692972548249224"", ""BRAIN_METHODS = 1, WMC = 259.0, TCC = 0.08067226890756303"", ""LONG_METHODS_CONNECTED = 5"", ""CC = 58.0"", ""CLOC > 500, TCC < 0.42040823562284796"", ""LONG_METHODS_CONNECTED = 2"", ""CC = 56.0"", ""CINT > 8.0, CDISP > 0.5, CC > 1.0"", ""MLOC > 6.692972548249224"", ""CALLS_TO_org.apache.coyote.AbstractProcessor > 7"", ""LONG_METHODS_CONNECTED = 5"", ""CC = 25.0"", ""CLOC > 500, TCC < 0.43751361778444253"", ""CINT > 8.0, CDISP > 0.5, CC > 1.0"", ""MLOC > 6.692972548249224"", ""CALLS_TO_org.apache.coyote.AbstractProcessor > 7""]","[""25fcc8979a5338b0955619816f21051ee558e1e4"", ""25fcc8979a5338b0955619816f21051ee558e1e4"", ""25fcc8979a5338b0955619816f21051ee558e1e4"", ""25fcc8979a5338b0955619816f21051ee558e1e4"", ""25fcc8979a5338b0955619816f21051ee558e1e4"", ""25fcc8979a5338b0955619816f21051ee558e1e4"", ""25fcc8979a5338b0955619816f21051ee558e1e4"", ""25fcc8979a5338b0955619816f21051ee558e1e4"", ""25fcc8979a5338b0955619816f21051ee558e1e4"", ""25fcc8979a5338b0955619816f21051ee558e1e4"", ""25fcc8979a5338b0955619816f21051ee558e1e4""]","[""SpeculativeGenerality"", ""LazyClass"", ""SpaghettiCode"", ""ComplexClass"", ""SpaghettiCode"", ""ComplexClass"", ""ComplexClass"", ""ComplexClass"", ""SpaghettiCode"", ""ComplexClass"", ""ComplexClass""]","[""43664f1e7e3a665c5bd086fc05f10ae3"", ""2b389e326bb1a56421eb9605069bae9d"", ""0cabdda96d0636b7051219df0571a026"", ""747e210fef8d510433740de3ddb26f11"", ""48511c040e3b5b9310a556899c3e9c00"", ""88fc4cb4cab531c7b66b1febd2e98004"", ""b73ef563406de70498a97392e4a0aa8f"", ""b9028095ce69f48bb29129cdaec35734"", ""87bfa6d38f55ba2ea710a1ea8f1b5f3f"", ""de5fac074cc74a3ccf9f8aa04f469bda"", ""8e84b2b747e5944bb7312a705e6e12b6""]","[24, 23, 63, 43, 56, 35, 32, 32, 42, 42, 36]","[103, 35, 1805, 529, 1697, 425, 209, 290, 566, 566, 410]","[""IS_ABSTRACT = 1, CHILDREN_COUNT = 2"", ""CLOC < 9.0"", ""LONG_METHODS_CONNECTED = 5"", ""CC = 76.0"", ""LONG_METHODS_CONNECTED = 5"", ""CC = 58.0"", ""CC = 11.0"", ""CC = 14.0"", ""LONG_METHODS_CONNECTED = 2"", ""CC = 16.0"", ""CC = 25.0""]"
Researcher 3,apache_tomcat,21124,"[""Pull Up Method"", ""Pull Up Method"", ""Pull Up Method"", ""Pull Up Method"", ""Pull Up Method"", ""Pull Up Method""]","[""org.apache.coyote.http11.AbstractHttp11Processor"", ""org.apache.coyote.http11.Http11AprProcessor.parseHost(MessageBytes)"", ""org.apache.coyote.http11.Http11AprProcessor"", ""org.apache.coyote.http11.AbstractHttp11Processor.parseHost(MessageBytes)"", ""org.apache.coyote.http11.Http11NioProcessor.parseHost(MessageBytes)"", ""org.apache.coyote.http11.Http11NioProcessor"", ""org.apache.coyote.http11.Http11Processor"", ""org.apache.coyote.http11.Http11Processor.parseHost(MessageBytes)""]","[""679401356aed7c50a455fa73c0d0b24a06117384"", ""679401356aed7c50a455fa73c0d0b24a06117384"", ""679401356aed7c50a455fa73c0d0b24a06117384"", ""679401356aed7c50a455fa73c0d0b24a06117384"", ""679401356aed7c50a455fa73c0d0b24a06117384"", ""679401356aed7c50a455fa73c0d0b24a06117384"", ""679401356aed7c50a455fa73c0d0b24a06117384"", ""679401356aed7c50a455fa73c0d0b24a06117384"", ""679401356aed7c50a455fa73c0d0b24a06117384"", ""679401356aed7c50a455fa73c0d0b24a06117384"", ""679401356aed7c50a455fa73c0d0b24a06117384"", ""679401356aed7c50a455fa73c0d0b24a06117384"", ""679401356aed7c50a455fa73c0d0b24a06117384"", ""679401356aed7c50a455fa73c0d0b24a06117384"", ""679401356aed7c50a455fa73c0d0b24a06117384"", ""679401356aed7c50a455fa73c0d0b24a06117384"", ""679401356aed7c50a455fa73c0d0b24a06117384""]","[""DispersedCoupling"", ""LongMethod"", ""BrainClass"", ""SpaghettiCode"", ""ComplexClass"", ""GodClass"", ""SpaghettiCode"", ""ComplexClass"", ""DispersedCoupling"", ""LongMethod"", ""FeatureEnvy"", ""SpaghettiCode"", ""ComplexClass"", ""GodClass"", ""DispersedCoupling"", ""LongMethod"", ""FeatureEnvy""]","[""3b1942063d8d0f25e3e0c96f39a2d912"", ""7cc0e656fa02e44a71330e9c3da909e9"", ""989f9997d407b2fa7b369c132fce2bf0"", ""48511c040e3b5b9310a556899c3e9c00"", ""88fc4cb4cab531c7b66b1febd2e98004"", ""d0e1bc791a1773d826c1506460e869b1"", ""cea0562618edec357888576da010fca9"", ""8738971dbdceb15534f90f05b6301e38"", ""8618470922917a36f436bd922872bb97"", ""f9a126b1ee1b349f44d3b16395728ef5"", ""a539ae1623ed3672a5405c6143ad931d"", ""da9c9846479fb9cde0aeffd9dc96712f"", ""8e84b2b747e5944bb7312a705e6e12b6"", ""eed9ea865a5968d35e56bf1cacd66821"", ""9ad7f1344721c7bd398ceac26bb17edf"", ""2273a1ba03714c3f97972b4895b6bd9b"", ""c2e4955a0896339690be814dafb0adf3""]","[620, 620, 56, 56, 35, 56, 43, 41, 403, 403, 403, 55, 36, 55, 1697, 1697, 1697]","[665, 665, 1697, 1697, 425, 1697, 494, 579, 448, 448, 448, 1357, 410, 1357, 1742, 1742, 1742]","[""CINT > 8.0, CDISP > 0.5, CC > 1.0"", ""MLOC > 6.692972548249224"", ""BRAIN_METHODS = 1, WMC = 259.0, TCC = 0.08067226890756303"", ""LONG_METHODS_CONNECTED = 5"", ""CC = 58.0"", ""CLOC > 500, TCC < 0.42040823562284796"", ""LONG_METHODS_CONNECTED = 2"", ""CC = 56.0"", ""CINT > 8.0, CDISP > 0.5, CC > 1.0"", ""MLOC > 6.692972548249224"", ""CALLS_TO_org.apache.coyote.AbstractProcessor > 7"", ""LONG_METHODS_CONNECTED = 5"", ""CC = 25.0"", ""CLOC > 500, TCC < 0.43751361778444253"", ""CINT > 8.0, CDISP > 0.5, CC > 1.0"", ""MLOC > 6.692972548249224"", ""CALLS_TO_org.apache.coyote.AbstractProcessor > 7""]","[""1edfc986ba6be3a7d0bf81f86a7b3dd9a83a5e05"", ""1edfc986ba6be3a7d0bf81f86a7b3dd9a83a5e05"", ""1edfc986ba6be3a7d0bf81f86a7b3dd9a83a5e05"", ""1edfc986ba6be3a7d0bf81f86a7b3dd9a83a5e05"", ""1edfc986ba6be3a7d0bf81f86a7b3dd9a83a5e05"", ""1edfc986ba6be3a7d0bf81f86a7b3dd9a83a5e05"", ""1edfc986ba6be3a7d0bf81f86a7b3dd9a83a5e05"", ""1edfc986ba6be3a7d0bf81f86a7b3dd9a83a5e05"", ""1edfc986ba6be3a7d0bf81f86a7b3dd9a83a5e05"", ""1edfc986ba6be3a7d0bf81f86a7b3dd9a83a5e05"", ""1edfc986ba6be3a7d0bf81f86a7b3dd9a83a5e05""]","[""SpaghettiCode"", ""ComplexClass"", ""SpaghettiCode"", ""ComplexClass"", ""SpaghettiCode"", ""ComplexClass"", ""SpaghettiCode"", ""ComplexClass"", ""DispersedCoupling"", ""LongMethod"", ""FeatureEnvy""]","[""0cabdda96d0636b7051219df0571a026"", ""747e210fef8d510433740de3ddb26f11"", ""48511c040e3b5b9310a556899c3e9c00"", ""88fc4cb4cab531c7b66b1febd2e98004"", ""cba2db9e3891a45839c1ec0129fdced1"", ""f6d424a61d0579eed598aece1472e4b3"", ""87bfa6d38f55ba2ea710a1ea8f1b5f3f"", ""de5fac074cc74a3ccf9f8aa04f469bda"", ""6ac6b18773f4c44e6a42dcabc972dc3a"", ""ec56599a8a27782db18da52b429f527d"", ""703e8eed391557ab7fdf21cfdd831ba3""]","[63, 43, 56, 35, 52, 59, 42, 42, 1492, 1492, 1492]","[1805, 529, 1697, 425, 1303, 1727, 566, 566, 1559, 1559, 1559]","[""LONG_METHODS_CONNECTED = 5"", ""CC = 76.0"", ""LONG_METHODS_CONNECTED = 5"", ""CC = 58.0"", ""LONG_METHODS_CONNECTED = 4"", ""CC = 56.0"", ""LONG_METHODS_CONNECTED = 2"", ""CC = 16.0"", ""CINT > 8.0, CDISP > 0.5, CC > 1.0"", ""MLOC > 6.874321358438148"", ""CALLS_TO_org.apache.coyote.Request > 6""]"
Researcher 3,apache_tomcat,21125,"[""Pull Up Attribute"", ""Pull Up Attribute"", ""Pull Up Method"", ""Pull Up Method"", ""Pull Up Attribute"", ""Pull Up Attribute"", ""Pull Up Attribute"", ""Pull Up Attribute"", ""Pull Up Method"", ""Pull Up Method"", ""Pull Up Attribute"", ""Pull Up Attribute""]","[""org.apache.coyote.ajp.AbstractAjpProcessor"", ""org.apache.coyote.AbstractProcessor"", ""org.apache.coyote.ajp.AbstractAjpProcessor.getRequest()"", ""org.apache.coyote.AbstractProcessor.getRequest()"", ""org.apache.coyote.http11.AbstractHttp11Processor"", ""org.apache.coyote.http11.AbstractHttp11Processor.getRequest()""]","[""679401356aed7c50a455fa73c0d0b24a06117384"", ""679401356aed7c50a455fa73c0d0b24a06117384"", ""679401356aed7c50a455fa73c0d0b24a06117384"", ""679401356aed7c50a455fa73c0d0b24a06117384"", ""679401356aed7c50a455fa73c0d0b24a06117384"", ""679401356aed7c50a455fa73c0d0b24a06117384"", ""679401356aed7c50a455fa73c0d0b24a06117384"", ""679401356aed7c50a455fa73c0d0b24a06117384"", ""679401356aed7c50a455fa73c0d0b24a06117384"", ""679401356aed7c50a455fa73c0d0b24a06117384"", ""679401356aed7c50a455fa73c0d0b24a06117384"", ""679401356aed7c50a455fa73c0d0b24a06117384"", ""679401356aed7c50a455fa73c0d0b24a06117384"", ""679401356aed7c50a455fa73c0d0b24a06117384"", ""679401356aed7c50a455fa73c0d0b24a06117384"", ""679401356aed7c50a455fa73c0d0b24a06117384"", ""679401356aed7c50a455fa73c0d0b24a06117384""]","[""DispersedCoupling"", ""LongMethod"", ""BrainClass"", ""SpaghettiCode"", ""ComplexClass"", ""GodClass"", ""SpaghettiCode"", ""ComplexClass"", ""DispersedCoupling"", ""LongMethod"", ""FeatureEnvy"", ""SpaghettiCode"", ""ComplexClass"", ""GodClass"", ""DispersedCoupling"", ""LongMethod"", ""FeatureEnvy""]","[""3b1942063d8d0f25e3e0c96f39a2d912"", ""7cc0e656fa02e44a71330e9c3da909e9"", ""989f9997d407b2fa7b369c132fce2bf0"", ""48511c040e3b5b9310a556899c3e9c00"", ""88fc4cb4cab531c7b66b1febd2e98004"", ""d0e1bc791a1773d826c1506460e869b1"", ""cea0562618edec357888576da010fca9"", ""8738971dbdceb15534f90f05b6301e38"", ""8618470922917a36f436bd922872bb97"", ""f9a126b1ee1b349f44d3b16395728ef5"", ""a539ae1623ed3672a5405c6143ad931d"", ""da9c9846479fb9cde0aeffd9dc96712f"", ""8e84b2b747e5944bb7312a705e6e12b6"", ""eed9ea865a5968d35e56bf1cacd66821"", ""9ad7f1344721c7bd398ceac26bb17edf"", ""2273a1ba03714c3f97972b4895b6bd9b"", ""c2e4955a0896339690be814dafb0adf3""]","[620, 620, 56, 56, 35, 56, 43, 41, 403, 403, 403, 55, 36, 55, 1697, 1697, 1697]","[665, 665, 1697, 1697, 425, 1697, 494, 579, 448, 448, 448, 1357, 410, 1357, 1742, 1742, 1742]","[""CINT > 8.0, CDISP > 0.5, CC > 1.0"", ""MLOC > 6.692972548249224"", ""BRAIN_METHODS = 1, WMC = 259.0, TCC = 0.08067226890756303"", ""LONG_METHODS_CONNECTED = 5"", ""CC = 58.0"", ""CLOC > 500, TCC < 0.42040823562284796"", ""LONG_METHODS_CONNECTED = 2"", ""CC = 56.0"", ""CINT > 8.0, CDISP > 0.5, CC > 1.0"", ""MLOC > 6.692972548249224"", ""CALLS_TO_org.apache.coyote.AbstractProcessor > 7"", ""LONG_METHODS_CONNECTED = 5"", ""CC = 25.0"", ""CLOC > 500, TCC < 0.43751361778444253"", ""CINT > 8.0, CDISP > 0.5, CC > 1.0"", ""MLOC > 6.692972548249224"", ""CALLS_TO_org.apache.coyote.AbstractProcessor > 7""]","[""934193fb96482d841049ebad019ffc340c5a9623"", ""934193fb96482d841049ebad019ffc340c5a9623"", ""934193fb96482d841049ebad019ffc340c5a9623"", ""934193fb96482d841049ebad019ffc340c5a9623"", ""934193fb96482d841049ebad019ffc340c5a9623""]","[""SpaghettiCode"", ""ComplexClass"", ""SpeculativeGenerality"", ""SpaghettiCode"", ""ComplexClass""]","[""74220dccc32e5b93281bddbb8675b14e"", ""d61244ba9c16ec19104d1c5de3515171"", ""43664f1e7e3a665c5bd086fc05f10ae3"", ""cba2db9e3891a45839c1ec0129fdced1"", ""f6d424a61d0579eed598aece1472e4b3""]","[48, 59, 24, 52, 59]","[936, 1731, 103, 1303, 1727]","[""LONG_METHODS_CONNECTED = 4"", ""CC = 102.0"", ""IS_ABSTRACT = 1, CHILDREN_COUNT = 2"", ""LONG_METHODS_CONNECTED = 4"", ""CC = 56.0""]"
Wilian,apache_tomcat,21126,"[""Pull Up Method"", ""Pull Up Method"", ""Pull Up Method"", ""Pull Up Method"", ""Pull Up Method"", ""Pull Up Method""]","[""org.apache.coyote.ajp.AjpProcessor.asyncDispatch(SocketStatus)"", ""org.apache.coyote.ajp.AbstractAjpProcessor"", ""org.apache.coyote.ajp.AjpProcessor"", ""org.apache.coyote.ajp.AbstractAjpProcessor.asyncDispatch(SocketStatus)"", ""org.apache.coyote.ajp.AjpAprProcessor.asyncDispatch(SocketStatus)"", ""org.apache.coyote.ajp.AjpAprProcessor"", ""org.apache.coyote.ajp.AjpNioProcessor"", ""org.apache.coyote.ajp.AjpNioProcessor.asyncDispatch(SocketStatus)""]","[""673ab7cedb92440ca8081f17d0aa77476e397e89"", ""673ab7cedb92440ca8081f17d0aa77476e397e89"", ""673ab7cedb92440ca8081f17d0aa77476e397e89"", ""673ab7cedb92440ca8081f17d0aa77476e397e89"", ""673ab7cedb92440ca8081f17d0aa77476e397e89"", ""673ab7cedb92440ca8081f17d0aa77476e397e89"", ""673ab7cedb92440ca8081f17d0aa77476e397e89"", ""673ab7cedb92440ca8081f17d0aa77476e397e89"", ""673ab7cedb92440ca8081f17d0aa77476e397e89"", ""673ab7cedb92440ca8081f17d0aa77476e397e89""]","[""SpeculativeGenerality"", ""ComplexClass"", ""SpaghettiCode"", ""ComplexClass"", ""ClassDataShouldBePrivate"", ""GodClass"", ""DataClass"", ""GodClass"", ""ComplexClass"", ""GodClass""]","[""52aeb60b9a6ecf4f6f028d33c4fc2aec"", ""cc0870820d88e1787a11df68dee603f3"", ""e90aca5cca29487b02cfb2b82d9dfebc"", ""511ff13113da1166168186547f368e78"", ""f23f5615cb8b5a00b821898546fdbb0f"", ""5f2019a2c1b44046cea2370af44847cd"", ""8df9ce30ba4e0e03853fef7be6b18faa"", ""9e4965a56a77764db1b07566e735f621"", ""ee9126f5c7f5cb9b334091481c63d0c9"", ""fcb2f8ca230a9bff6a02dca0fd86b6fe""]","[47, 41, 51, 51, 51, 51, 61, 61, 57, 57]","[1078, 957, 2375, 2375, 2375, 2375, 1714, 1714, 1757, 1757]","[""IS_ABSTRACT = 1, CHILDREN_COUNT = 2"", ""CC = 17.0"", ""LONG_METHODS_CONNECTED = 2"", ""CC = 46.0"", ""PUBLIC_FIELD_COUNT = 11.0"", ""CLOC > 500, TCC < 0.48007932503269046"", ""WOC = 0.18421052631578946, NOPA = 5.0, NOAM = 31.0, WMC = 113.0"", ""CLOC > 500, TCC < 0.4808063174919667"", ""CC = 11.0"", ""CLOC > 500, TCC < 0.4937743041936207""]","[""bd8ce43d1b96f33c672c81d8851409e3bc827cef"", ""bd8ce43d1b96f33c672c81d8851409e3bc827cef"", ""bd8ce43d1b96f33c672c81d8851409e3bc827cef"", ""bd8ce43d1b96f33c672c81d8851409e3bc827cef"", ""bd8ce43d1b96f33c672c81d8851409e3bc827cef"", ""bd8ce43d1b96f33c672c81d8851409e3bc827cef""]","[""SpaghettiCode"", ""ComplexClass"", ""ComplexClass"", ""ComplexClass"", ""DispersedCoupling"", ""ComplexClass""]","[""74220dccc32e5b93281bddbb8675b14e"", ""d61244ba9c16ec19104d1c5de3515171"", ""b73ef563406de70498a97392e4a0aa8f"", ""b9028095ce69f48bb29129cdaec35734"", ""7315562d9b9c48989d83ee85e0dadba5"", ""8e84b2b747e5944bb7312a705e6e12b6""]","[48, 59, 32, 32, 631, 36]","[936, 1731, 209, 290, 664, 410]","[""LONG_METHODS_CONNECTED = 4"", ""CC = 102.0"", ""CC = 11.0"", ""CC = 14.0"", ""CINT > 8.0, CDISP > 0.5, CC > 1.0"", ""CC = 25.0""]"
Wilian,apache_tomcat,21128,"[""Pull Up Attribute"", ""Pull Up Attribute"", ""Pull Up Method"", ""Pull Up Method"", ""Pull Up Attribute"", ""Pull Up Attribute"", ""Pull Up Attribute"", ""Pull Up Attribute"", ""Pull Up Method"", ""Pull Up Method"", ""Pull Up Attribute"", ""Pull Up Attribute"", ""Pull Up Attribute"", ""Pull Up Attribute"", ""Pull Up Method"", ""Pull Up Method"", ""Pull Up Method"", ""Pull Up Method"", ""Pull Up Method"", ""Pull Up Method"", ""Pull Up Method"", ""Pull Up Method"", ""Pull Up Method"", ""Pull Up Method"", ""Pull Up Attribute"", ""Pull Up Attribute"", ""Pull Up Method"", ""Pull Up Method""]","[""org.apache.coyote.ajp.AjpNioProcessor"", ""org.apache.coyote.ajp.AbstractAjpProcessor"", ""org.apache.coyote.ajp.AbstractAjpProcessor.asyncPostProcess()"", ""org.apache.coyote.AbstractProcessor"", ""org.apache.coyote.AbstractProcessor.asyncPostProcess()"", ""org.apache.coyote.ajp.AjpProcessor"", ""org.apache.coyote.ajp.AbstractAjpProcessor.setAdapter(Adapter)"", ""org.apache.coyote.AbstractProcessor.setAdapter(Adapter)"", ""org.apache.coyote.http11.AbstractHttp11Processor"", ""org.apache.coyote.ajp.AbstractAjpProcessor.getAdapter()"", ""org.apache.coyote.AbstractProcessor.getAdapter()"", ""org.apache.coyote.http11.AbstractHttp11Processor.getAdapter()"", ""org.apache.coyote.http11.AbstractHttp11Processor.setAdapter(Adapter)"", ""org.apache.coyote.http11.AbstractHttp11Processor.asyncPostProcess()"", ""org.apache.coyote.http11.AbstractHttp11Processor.isAsync()"", ""org.apache.coyote.AbstractProcessor.isAsync()"", ""org.apache.coyote.ajp.AbstractAjpProcessor.isAsync()""]","[""673ab7cedb92440ca8081f17d0aa77476e397e89"", ""673ab7cedb92440ca8081f17d0aa77476e397e89"", ""673ab7cedb92440ca8081f17d0aa77476e397e89"", ""673ab7cedb92440ca8081f17d0aa77476e397e89"", ""673ab7cedb92440ca8081f17d0aa77476e397e89"", ""673ab7cedb92440ca8081f17d0aa77476e397e89"", ""673ab7cedb92440ca8081f17d0aa77476e397e89"", ""673ab7cedb92440ca8081f17d0aa77476e397e89"", ""673ab7cedb92440ca8081f17d0aa77476e397e89"", ""673ab7cedb92440ca8081f17d0aa77476e397e89""]","[""SpeculativeGenerality"", ""ComplexClass"", ""SpaghettiCode"", ""ComplexClass"", ""ClassDataShouldBePrivate"", ""GodClass"", ""DataClass"", ""GodClass"", ""ComplexClass"", ""GodClass""]","[""52aeb60b9a6ecf4f6f028d33c4fc2aec"", ""cc0870820d88e1787a11df68dee603f3"", ""e90aca5cca29487b02cfb2b82d9dfebc"", ""511ff13113da1166168186547f368e78"", ""f23f5615cb8b5a00b821898546fdbb0f"", ""5f2019a2c1b44046cea2370af44847cd"", ""8df9ce30ba4e0e03853fef7be6b18faa"", ""9e4965a56a77764db1b07566e735f621"", ""ee9126f5c7f5cb9b334091481c63d0c9"", ""fcb2f8ca230a9bff6a02dca0fd86b6fe""]","[47, 41, 51, 51, 51, 51, 61, 61, 57, 57]","[1078, 957, 2375, 2375, 2375, 2375, 1714, 1714, 1757, 1757]","[""IS_ABSTRACT = 1, CHILDREN_COUNT = 2"", ""CC = 17.0"", ""LONG_METHODS_CONNECTED = 2"", ""CC = 46.0"", ""PUBLIC_FIELD_COUNT = 11.0"", ""CLOC > 500, TCC < 0.48007932503269046"", ""WOC = 0.18421052631578946, NOPA = 5.0, NOAM = 31.0, WMC = 113.0"", ""CLOC > 500, TCC < 0.4808063174919667"", ""CC = 11.0"", ""CLOC > 500, TCC < 0.4937743041936207""]","[""cb1033993b2b6b5c0a0a885a00f3995d98c177d8"", ""cb1033993b2b6b5c0a0a885a00f3995d98c177d8"", ""cb1033993b2b6b5c0a0a885a00f3995d98c177d8"", ""cb1033993b2b6b5c0a0a885a00f3995d98c177d8""]","[""SpaghettiCode"", ""ComplexClass"", ""ComplexClass"", ""ComplexClass""]","[""74220dccc32e5b93281bddbb8675b14e"", ""d61244ba9c16ec19104d1c5de3515171"", ""b73ef563406de70498a97392e4a0aa8f"", ""8e84b2b747e5944bb7312a705e6e12b6""]","[48, 59, 32, 36]","[936, 1731, 209, 410]","[""LONG_METHODS_CONNECTED = 4"", ""CC = 102.0"", ""CC = 11.0"", ""CC = 25.0""]"
Wilian,apache_tomcat,21129,"[""Pull Up Method"", ""Pull Up Method"", ""Pull Up Method"", ""Pull Up Method""]","[""org.apache.coyote.http11.AbstractHttp11Processor"", ""org.apache.coyote.http11.Http11AprProcessor"", ""org.apache.coyote.http11.Http11AprProcessor.asyncDispatch(SocketStatus)"", ""org.apache.coyote.http11.AbstractHttp11Processor.asyncDispatch(SocketStatus)"", ""org.apache.coyote.http11.Http11Processor"", ""org.apache.coyote.http11.Http11Processor.asyncDispatch(SocketStatus)""]","[""f9704c21618f8246001353d948176c7cd5b11bf1"", ""f9704c21618f8246001353d948176c7cd5b11bf1"", ""f9704c21618f8246001353d948176c7cd5b11bf1"", ""f9704c21618f8246001353d948176c7cd5b11bf1"", ""f9704c21618f8246001353d948176c7cd5b11bf1"", ""f9704c21618f8246001353d948176c7cd5b11bf1"", ""f9704c21618f8246001353d948176c7cd5b11bf1"", ""f9704c21618f8246001353d948176c7cd5b11bf1"", ""f9704c21618f8246001353d948176c7cd5b11bf1"", ""f9704c21618f8246001353d948176c7cd5b11bf1"", ""f9704c21618f8246001353d948176c7cd5b11bf1"", ""f9704c21618f8246001353d948176c7cd5b11bf1""]","[""ComplexClass"", ""BrainClass"", ""SpaghettiCode"", ""ComplexClass"", ""GodClass"", ""SpaghettiCode"", ""ComplexClass"", ""GodClass"", ""IntensiveCoupling"", ""LongMethod"", ""IntensiveCoupling"", ""LongMethod""]","[""9ce28ef8cb906283fe2a6e976a592653"", ""989f9997d407b2fa7b369c132fce2bf0"", ""48511c040e3b5b9310a556899c3e9c00"", ""88fc4cb4cab531c7b66b1febd2e98004"", ""d0e1bc791a1773d826c1506460e869b1"", ""da9c9846479fb9cde0aeffd9dc96712f"", ""8e84b2b747e5944bb7312a705e6e12b6"", ""eed9ea865a5968d35e56bf1cacd66821"", ""8411b38206d0b85b67f23aa90b288aa9"", ""19e36edf3aa620c308f01bed82ca7f2d"", ""038ebd414204dfe41b852e9296a8303c"", ""23af6b5c5cdd061bc1b80079b34fa377""]","[37, 56, 56, 35, 56, 55, 36, 55, 650, 650, 357, 357]","[746, 1697, 1697, 425, 1697, 1357, 410, 1357, 886, 886, 593, 593]","[""CC = 18.0"", ""BRAIN_METHODS = 1, WMC = 259.0, TCC = 0.08067226890756303"", ""LONG_METHODS_CONNECTED = 5"", ""CC = 58.0"", ""CLOC > 500, TCC < 0.42040823562284796"", ""LONG_METHODS_CONNECTED = 5"", ""CC = 25.0"", ""CLOC > 500, TCC < 0.43751361778444253"", ""CINT = 56.0, CDISP = 0.26785714285714285, CC > 1.0"", ""MLOC > 6.641009277894996"", ""CINT = 56.0, CDISP = 0.26785714285714285, CC > 1.0"", ""MLOC > 6.641009277894996""]","[""3fde687fde4ea8292ef357b04dde5951ccf3476e"", ""3fde687fde4ea8292ef357b04dde5951ccf3476e"", ""3fde687fde4ea8292ef357b04dde5951ccf3476e"", ""3fde687fde4ea8292ef357b04dde5951ccf3476e"", ""3fde687fde4ea8292ef357b04dde5951ccf3476e"", ""3fde687fde4ea8292ef357b04dde5951ccf3476e"", ""3fde687fde4ea8292ef357b04dde5951ccf3476e"", ""3fde687fde4ea8292ef357b04dde5951ccf3476e""]","[""SpaghettiCode"", ""ComplexClass"", ""SpaghettiCode"", ""ComplexClass"", ""SpaghettiCode"", ""ComplexClass"", ""GodClass"", ""DispersedCoupling""]","[""0cabdda96d0636b7051219df0571a026"", ""747e210fef8d510433740de3ddb26f11"", ""48511c040e3b5b9310a556899c3e9c00"", ""88fc4cb4cab531c7b66b1febd2e98004"", ""cba2db9e3891a45839c1ec0129fdced1"", ""f6d424a61d0579eed598aece1472e4b3"", ""25f2ceb56b13661f988b7e333208c6cb"", ""9ae238d665150e86926844fc4a2be2a3""]","[63, 43, 56, 35, 52, 59, 59, 1208]","[1805, 529, 1697, 425, 1303, 1727, 1727, 1242]","[""LONG_METHODS_CONNECTED = 5"", ""CC = 76.0"", ""LONG_METHODS_CONNECTED = 5"", ""CC = 58.0"", ""LONG_METHODS_CONNECTED = 4"", ""CC = 56.0"", ""CLOC > 500, TCC < 0.48007932503269046"", ""CINT > 8.0, CDISP > 0.5, CC > 1.0""]"
Researcher 2,apache_tomcat,20801,"[""Extract Method"", ""Extract Method"", ""Extract Method"", ""Extract Method""]","[""org.apache.catalina.javax.websocketWsInputStream"", ""org.apache.catalina.javax.websocketWsInputStream.read(byte,int,int)"", ""org.apache.catalina.javax.websocketWsInputStream.makePayloadDataAvailable()"", ""org.apache.catalina.javax.websocketWsInputStream.read()""]","[""b976fd86d019f78e26e74d2002dc1d5d870b85b1"", ""b976fd86d019f78e26e74d2002dc1d5d870b85b1"", ""b976fd86d019f78e26e74d2002dc1d5d870b85b1"", ""b976fd86d019f78e26e74d2002dc1d5d870b85b1"", ""b976fd86d019f78e26e74d2002dc1d5d870b85b1"", ""b976fd86d019f78e26e74d2002dc1d5d870b85b1"", ""b976fd86d019f78e26e74d2002dc1d5d870b85b1"", ""b976fd86d019f78e26e74d2002dc1d5d870b85b1""]","[""SpaghettiCode"", ""ComplexClass"", ""IntensiveCoupling"", ""MessageChain"", ""LongMethod"", ""FeatureEnvy"", ""DispersedCoupling"", ""LongParameterList""]","[""f2bda320e16b6b816f81473bd6ccd306"", ""37000e4947a027b193dceebdc65cedbc"", ""1dfe7be046e4568e69543715a7d4e6aa"", ""ccfc47c4e9369ca8bd15f39ae02c1c3e"", ""9a6762f2bd507d96147f2187501ac3b0"", ""e74121593e3d8e2abe3cddaace2c9043"", ""fae65a5766509d65b268df68fcd0bb3e"", ""f3e48c4d2d44eb9655a0dcd9588f5276""]","[51, 51, 536, 536, 519, 510, 626, 626]","[1260, 1260, 952, 952, 641, 666, 728, 728]","[""LONG_METHODS_CONNECTED = 2"", ""CC = 11.0"", ""CINT = 28.0, CDISP = 0.4642857142857143, CC > 1.0"", ""MAX_CALL_CHAIN = 4.0"", ""MLOC > 8.104169696969771"", ""CALLS_TO_org.apache.derby.impl.sql.compile.QueryTreeNode > 5"", ""CINT > 8.0, CDISP > 0.5, CC > 1.0"", ""PARAMETER_COUNT > 1.1833717550365601""]","[""1d82b675de58f50191ebf99f05bdcdf093c7d420"", ""1d82b675de58f50191ebf99f05bdcdf093c7d420"", ""1d82b675de58f50191ebf99f05bdcdf093c7d420""]","[""ComplexClass"", ""IntensiveCoupling"", ""MessageChain""]","[""e7e9dd27b950a8327c8bf43426789157"", ""14b7dcc500c30eda55d96b1d507068f6"", ""21e3c39534f2cf0523878895bcbfa02a""]","[24, 119, 119]","[146, 145, 145]","[""CC = 11.0"", ""CINT = 9.0, CDISP = 0.4444444444444444, CC > 1.0"", ""MAX_CALL_CHAIN = 4.0""]"
Researcher 2,apache_tomcat,20805,"[""Extract Method"", ""Extract Method"", ""Inline Method"", ""Inline Method"", ""Extract Method"", ""Extract Method"", ""Inline Method"", ""Inline Method""]","[""org.apache.catalina.startup.WebAnnotationSet.loadApplicationServletAnnotations(Context)"", ""org.apache.catalina.startup.WebAnnotationSet"", ""org.apache.catalina.startup.WebAnnotationSet.loadClass(Context,String)"", ""org.apache.catalina.startup.WebAnnotationSet.loadApplicationFilterAnnotations(Context)"", ""org.apache.catalina.startup.WebAnnotationSet.loadClassAnnotation(Context,String)"", ""org.apache.catalina.startup.WebAnnotationSet.addResource(Context,Resource)"", ""org.apache.catalina.startup.WebAnnotationSet.addResource(Context,Resource,String,String)"", ""org.apache.catalina.startup.WebAnnotationSet.loadApplicationListenerAnnotations(Context)""]","[""525fa450031af1ac2f10fbf7bc029e248be66a93"", ""525fa450031af1ac2f10fbf7bc029e248be66a93"", ""525fa450031af1ac2f10fbf7bc029e248be66a93"", ""525fa450031af1ac2f10fbf7bc029e248be66a93"", ""525fa450031af1ac2f10fbf7bc029e248be66a93"", ""525fa450031af1ac2f10fbf7bc029e248be66a93"", ""525fa450031af1ac2f10fbf7bc029e248be66a93"", ""525fa450031af1ac2f10fbf7bc029e248be66a93"", ""525fa450031af1ac2f10fbf7bc029e248be66a93"", ""525fa450031af1ac2f10fbf7bc029e248be66a93"", ""525fa450031af1ac2f10fbf7bc029e248be66a93"", ""525fa450031af1ac2f10fbf7bc029e248be66a93"", ""525fa450031af1ac2f10fbf7bc029e248be66a93""]","[""SpaghettiCode"", ""ComplexClass"", ""GodClass"", ""IntensiveCoupling"", ""LongMethod"", ""FeatureEnvy"", ""IntensiveCoupling"", ""LongMethod"", ""FeatureEnvy"", ""IntensiveCoupling"", ""LongMethod"", ""IntensiveCoupling"", ""LongMethod""]","[""3c975593f6a50cd5c71bebac179ea33b"", ""9124dcd8703db100c93c87b7ced0241e"", ""c6588047bdedfb938b8a3825b3c180c7"", ""a082fa4997a23a6aa24ee3b5ead8ea35"", ""cf70ff395df70b585e1537293a1639eb"", ""37a18c6d7edffa23560ed9664677c01f"", ""7d1b20bc9e785c56a214c57f31bd09c2"", ""76a9718ea3196dfc78dd8ae9b86e7758"", ""c7b78fc959dc4adfbc4494c636a98454"", ""524904b2d7c8f0f04b50e0f9062c5713"", ""4b30af0c6c2d4906205b4ab53e35e4a1"", ""524904b2d7c8f0f04b50e0f9062c5713"", ""4b30af0c6c2d4906205b4ab53e35e4a1""]","[83, 83, 83, 629, 629, 629, 2010, 2010, 2010, 268, 268, 268, 268]","[2533, 2533, 2533, 812, 812, 812, 2193, 2193, 2193, 621, 621, 621, 621]","[""LONG_METHODS_CONNECTED = 6"", ""CC = 47.0"", ""CLOC > 500, TCC < 0.4276029126892707"", ""CINT = 31.0, CDISP = 0.4838709677419355, CC > 1.0"", ""MLOC > 7.8383512722588975"", ""CALLS_TO_org.apache.derby.iapi.sql.dictionary.ConglomerateDescriptor > 4"", ""CINT = 36.0, CDISP = 0.4166666666666667, CC > 1.0"", ""MLOC > 7.8383512722588975"", ""CALLS_TO_org.apache.derby.iapi.sql.dictionary.TableDescriptor > 7"", ""CINT = 38.0, CDISP = 0.3684210526315789, CC > 1.0"", ""MLOC > 7.837528831130841"", ""CINT = 38.0, CDISP = 0.3684210526315789, CC > 1.0"", ""MLOC > 7.837528831130841""]","[""67a926c90e61206a6209214508dfee492fda4248"", ""67a926c90e61206a6209214508dfee492fda4248"", ""67a926c90e61206a6209214508dfee492fda4248"", ""67a926c90e61206a6209214508dfee492fda4248"", ""67a926c90e61206a6209214508dfee492fda4248""]","[""ComplexClass"", ""IntensiveCoupling"", ""LongParameterList"", ""LongMethod"", ""FeatureEnvy""]","[""42b702c4678590679c1b46ea81067630"", ""7f83da5aeacd503e62a7d753c20b6378"", ""e0c72f2c807fbe1161c8c0b6bffc1c32"", ""ae6b45a4118eab7ca670b7eeefd41d23"", ""3805965e4b7e60dac1eb102cb28073e7""]","[40, 304, 304, 304, 304]","[436, 405, 405, 405, 405]","[""CC = 13.0"", ""CINT = 21.0, CDISP = 0.42857142857142855, CC > 1.0"", ""PARAMETER_COUNT > 0.9482039469588349"", ""MLOC > 6.861233891552117"", ""CALLS_TO_org.apache.catalina.Context > 5""]"
Researcher 2,apache_tomcat,20819,"[""Extract Method"", ""Extract Method"", ""Extract Method"", ""Extract Method""]","[""org.apache.catalina.startup.ContextConfig"", ""org.apache.catalina.startup.ContextConfig.processAnnotationsJndi(URL,WebXml,boolean)"", ""org.apache.catalina.startup.ContextConfig.processAnnotationsWebResource(WebResource,WebXml,boolean)"", ""org.apache.catalina.startup.ContextConfig.webConfig()""]","[""525fa450031af1ac2f10fbf7bc029e248be66a93"", ""525fa450031af1ac2f10fbf7bc029e248be66a93"", ""525fa450031af1ac2f10fbf7bc029e248be66a93"", ""525fa450031af1ac2f10fbf7bc029e248be66a93"", ""525fa450031af1ac2f10fbf7bc029e248be66a93"", ""525fa450031af1ac2f10fbf7bc029e248be66a93"", ""525fa450031af1ac2f10fbf7bc029e248be66a93"", ""525fa450031af1ac2f10fbf7bc029e248be66a93"", ""525fa450031af1ac2f10fbf7bc029e248be66a93"", ""525fa450031af1ac2f10fbf7bc029e248be66a93"", ""525fa450031af1ac2f10fbf7bc029e248be66a93"", ""525fa450031af1ac2f10fbf7bc029e248be66a93"", ""525fa450031af1ac2f10fbf7bc029e248be66a93""]","[""SpaghettiCode"", ""ComplexClass"", ""GodClass"", ""IntensiveCoupling"", ""LongMethod"", ""FeatureEnvy"", ""IntensiveCoupling"", ""LongMethod"", ""FeatureEnvy"", ""IntensiveCoupling"", ""LongMethod"", ""IntensiveCoupling"", ""LongMethod""]","[""3c975593f6a50cd5c71bebac179ea33b"", ""9124dcd8703db100c93c87b7ced0241e"", ""c6588047bdedfb938b8a3825b3c180c7"", ""a082fa4997a23a6aa24ee3b5ead8ea35"", ""cf70ff395df70b585e1537293a1639eb"", ""37a18c6d7edffa23560ed9664677c01f"", ""7d1b20bc9e785c56a214c57f31bd09c2"", ""76a9718ea3196dfc78dd8ae9b86e7758"", ""c7b78fc959dc4adfbc4494c636a98454"", ""524904b2d7c8f0f04b50e0f9062c5713"", ""4b30af0c6c2d4906205b4ab53e35e4a1"", ""524904b2d7c8f0f04b50e0f9062c5713"", ""4b30af0c6c2d4906205b4ab53e35e4a1""]","[83, 83, 83, 629, 629, 629, 2010, 2010, 2010, 268, 268, 268, 268]","[2533, 2533, 2533, 812, 812, 812, 2193, 2193, 2193, 621, 621, 621, 621]","[""LONG_METHODS_CONNECTED = 6"", ""CC = 47.0"", ""CLOC > 500, TCC < 0.4276029126892707"", ""CINT = 31.0, CDISP = 0.4838709677419355, CC > 1.0"", ""MLOC > 7.8383512722588975"", ""CALLS_TO_org.apache.derby.iapi.sql.dictionary.ConglomerateDescriptor > 4"", ""CINT = 36.0, CDISP = 0.4166666666666667, CC > 1.0"", ""MLOC > 7.8383512722588975"", ""CALLS_TO_org.apache.derby.iapi.sql.dictionary.TableDescriptor > 7"", ""CINT = 38.0, CDISP = 0.3684210526315789, CC > 1.0"", ""MLOC > 7.837528831130841"", ""CINT = 38.0, CDISP = 0.3684210526315789, CC > 1.0"", ""MLOC > 7.837528831130841""]","[""527baba1736d3111596fb19dba367460fdb2808c"", ""527baba1736d3111596fb19dba367460fdb2808c"", ""527baba1736d3111596fb19dba367460fdb2808c"", ""527baba1736d3111596fb19dba367460fdb2808c"", ""527baba1736d3111596fb19dba367460fdb2808c"", ""527baba1736d3111596fb19dba367460fdb2808c"", ""527baba1736d3111596fb19dba367460fdb2808c"", ""527baba1736d3111596fb19dba367460fdb2808c""]","[""SpaghettiCode"", ""ComplexClass"", ""ClassDataShouldBePrivate"", ""GodClass"", ""DispersedCoupling"", ""FeatureEnvy"", ""IntensiveCoupling"", ""LongMethod""]","[""e793f4451c1a592370615b3c5a198607"", ""af28c6e13bdd320b850068a72aab2231"", ""55bb1fc1b4d1c0b2288663665fb615fd"", ""7628ef6afa559ce2cc0d3adb2b511c2c"", ""3ba8cbe38c5a4514a972d0fb2fda56a0"", ""94306d7bb45dad919435a418b4f5239f"", ""a22dfa2c16fc0555324d356795c1f69b"", ""89b84e10d5903f2487fe6ee7ece233f5""]","[111, 111, 111, 111, 1885, 1885, 1134, 1134]","[2610, 2610, 2610, 2610, 1917, 1917, 1313, 1313]","[""LONG_METHODS_CONNECTED = 12"", ""CC = 14.0"", ""PUBLIC_FIELD_COUNT = 2.0"", ""CLOC > 500, TCC < 0.48007932503269046"", ""CINT > 8.0, CDISP > 0.5, CC > 1.0"", ""CALLS_TO_org.apache.catalina.WebResource > 8"", ""CINT = 28.0, CDISP = 0.2857142857142857, CC > 1.0"", ""MLOC > 6.83012326656397""]"
Researcher 2,apache_tomcat,20827,"[""Inline Method"", ""Inline Method"", ""Extract Method"", ""Extract Method"", ""Inline Method"", ""Inline Method"", ""Extract Method"", ""Extract Method"", ""Rename Method"", ""Rename Method""]","[""org.apache.tomcat.util.net.AprEndpoint.Poller"", ""org.apache.tomcat.util.net.AprEndpoint.Poller.doPoll(long)"", ""org.apache.tomcat.util.net.AprEndpoint.Poller.run()"", ""org.apache.tomcat.util.net.AprEndpoint.Poller.addToPoller(long,int)"", ""org.apache.tomcat.util.net.AprEndpoint.Poller.doTimeout(long)"", ""org.apache.tomcat.util.net.AprEndpoint.Poller.removeFromPoller(long)"", ""org.apache.tomcat.util.net.AprEndpoint.Poller.getKeepAliveCount()"", ""org.apache.tomcat.util.net.AprEndpoint.Poller.getConnectionCount()""]","[""022cb5be9c6b398e5aac501450b19249b37e8b18"", ""022cb5be9c6b398e5aac501450b19249b37e8b18"", ""022cb5be9c6b398e5aac501450b19249b37e8b18"", ""022cb5be9c6b398e5aac501450b19249b37e8b18"", ""022cb5be9c6b398e5aac501450b19249b37e8b18"", ""022cb5be9c6b398e5aac501450b19249b37e8b18"", ""022cb5be9c6b398e5aac501450b19249b37e8b18"", ""022cb5be9c6b398e5aac501450b19249b37e8b18""]","[""SpaghettiCode"", ""ComplexClass"", ""DispersedCoupling"", ""LongParameterList"", ""FeatureEnvy"", ""DispersedCoupling"", ""LongParameterList"", ""FeatureEnvy""]","[""00634620d072b4d938de5eb2778a505d"", ""07cb91662fea60a4bb09072493dce69f"", ""c96a7d3c3fccc1dfb6a401b7584df3fd"", ""80bbc671e3effeca1083267add522964"", ""f072693fb1317c1a894e42e7089da09d"", ""c96a7d3c3fccc1dfb6a401b7584df3fd"", ""80bbc671e3effeca1083267add522964"", ""f072693fb1317c1a894e42e7089da09d""]","[72, 72, 114, 133, 114, 114, 133, 114]","[1391, 1391, 177, 157, 177, 177, 157, 177]","[""LONG_METHODS_CONNECTED = 3"", ""CC = 25.0"", ""CINT > 8.0, CDISP > 0.5, CC > 1.0"", ""PARAMETER_COUNT > 1.180098316698937"", ""CALLS_TO_org.apache.derby.catalog.Dependable > 5"", ""CINT > 8.0, CDISP > 0.5, CC > 1.0"", ""PARAMETER_COUNT > 1.180098316698937"", ""CALLS_TO_org.apache.derby.catalog.Dependable > 5""]","[""ebced56615fd7db95b22ffbc20a81be1281e2d25"", ""ebced56615fd7db95b22ffbc20a81be1281e2d25"", ""ebced56615fd7db95b22ffbc20a81be1281e2d25"", ""ebced56615fd7db95b22ffbc20a81be1281e2d25"", ""ebced56615fd7db95b22ffbc20a81be1281e2d25""]","[""BrainMethod"", ""IntensiveCoupling"", ""LongMethod"", ""FeatureEnvy"", ""ComplexClass""]","[""f1855a271dc7e0601c0cffb197137b12"", ""31f5d75549c374b465126de83e9fcae3"", ""77c94ec633d7391cd6557423bded2668"", ""7f52a0284a728acec7dea3ec48a1f849"", ""ad7eb915ee3e90266d6cf8ee7fc1ac44""]","[1585, 1585, 1585, 1585, 1248]","[1896, 1896, 1896, 1896, 1897]","[""MLOC > 89.359676119047, CC > 7.8403777564238055, MAX_NESTING > 5.0, NOAV > 6.0"", ""CINT = 33.0, CDISP = 0.36363636363636365, CC > 1.0"", ""MLOC > 6.875267202033578"", ""CALLS_TO_org.apache.tomcat.util.net.AprEndpoint.SocketList > 16"", ""CC = 73.0""]"
Researcher 2,apache_tomcat,20880,"[""Extract Method"", ""Extract Method"", ""Extract Method"", ""Extract Method"", ""Extract Method"", ""Extract Method""]","[""org.apache.catalina.mResearcher 1ger.MResearcher 1gerServlet"", ""org.apache.catalina.mResearcher 1ger.MResearcher 1gerServlet.deploy(PrintWriter,String,ContextName,String,boolean,StringMResearcher 1ger)"", ""org.apache.catalina.mResearcher 1ger.MResearcher 1gerServlet.writeDeployResult(PrintWriter,StringMResearcher 1ger,String,String)"", ""org.apache.catalina.mResearcher 1ger.MResearcher 1gerServlet.deploy(PrintWriter,ContextName,String,boolean,HttpServletRequest,StringMResearcher 1ger)"", ""org.apache.catalina.mResearcher 1ger.MResearcher 1gerServlet.deploy(PrintWriter,ContextName,String,StringMResearcher 1ger)""]","[""0be8cb5366ea646682c203026357c3f37afccd93"", ""0be8cb5366ea646682c203026357c3f37afccd93"", ""0be8cb5366ea646682c203026357c3f37afccd93"", ""0be8cb5366ea646682c203026357c3f37afccd93"", ""0be8cb5366ea646682c203026357c3f37afccd93"", ""0be8cb5366ea646682c203026357c3f37afccd93"", ""0be8cb5366ea646682c203026357c3f37afccd93"", ""0be8cb5366ea646682c203026357c3f37afccd93""]","[""DispersedCoupling"", ""LongParameterList"", ""SpaghettiCode"", ""ComplexClass"", ""ClassDataShouldBePrivate"", ""GodClass"", ""LongParameterList"", ""FeatureEnvy""]","[""78dfb92faceb184119e4cc201bad6ff6"", ""ce2c3ce83792f5ecc19aa981810204dd"", ""7dff2048a8225ab3ed42c4b85a58ba16"", ""57e92d34fa250d5def40de45eee4dab1"", ""f0be238e7d2a9f0851e693a354a0c662"", ""1fbae94e26d0325a9b6a3a0d91a5f4ba"", ""225f2988cb5c540d34117ab6608a5188"", ""e807910acbdd19b233a15728429012b8""]","[10382, 10382, 156, 156, 156, 156, 8835, 8835]","[10457, 10457, 11291, 11291, 11291, 11291, 8918, 8918]","[""CINT > 8.0, CDISP > 0.5, CC > 1.0"", ""PARAMETER_COUNT > 1.1759726007573748"", ""LONG_METHODS_CONNECTED = 17"", ""CC = 22.0"", ""PUBLIC_FIELD_COUNT = 3.0"", ""CLOC > 500, TCC < 0.4268867393916222"", ""PARAMETER_COUNT > 1.1759932578858818"", ""CALLS_TO_org.apache.derby.iapi.services.io.FormatableBitSet > 4""]","[""d8fc6df4135e3a200cbea1f4329e7fd156a166e2"", ""d8fc6df4135e3a200cbea1f4329e7fd156a166e2"", ""d8fc6df4135e3a200cbea1f4329e7fd156a166e2"", ""d8fc6df4135e3a200cbea1f4329e7fd156a166e2"", ""d8fc6df4135e3a200cbea1f4329e7fd156a166e2"", ""d8fc6df4135e3a200cbea1f4329e7fd156a166e2"", ""d8fc6df4135e3a200cbea1f4329e7fd156a166e2"", ""d8fc6df4135e3a200cbea1f4329e7fd156a166e2"", ""d8fc6df4135e3a200cbea1f4329e7fd156a166e2"", ""d8fc6df4135e3a200cbea1f4329e7fd156a166e2"", ""d8fc6df4135e3a200cbea1f4329e7fd156a166e2"", ""d8fc6df4135e3a200cbea1f4329e7fd156a166e2""]","[""IntensiveCoupling"", ""LongParameterList"", ""IntensiveCoupling"", ""LongParameterList"", ""LongMethod"", ""IntensiveCoupling"", ""LongParameterList"", ""LongMethod"", ""LongParameterList"", ""SpaghettiCode"", ""ComplexClass"", ""GodClass""]","[""58ddd7493e52b3561904cd4d14f9878f"", ""e3259baa723c50aeb1698aab27013034"", ""071ce4624b3d32b9e1709e4402d25726"", ""d61e572d856d2fd4bbf5b5266c885a0e"", ""b9bc1061056c0cc2d5846208bf569556"", ""da95219f5cf1ebeddebc6c8e350d38c5"", ""a44303e26a436e23bbf0faa0611ffa11"", ""094fa40f0f61aaee5d8086dbb640fafb"", ""53aaf790fcf791228fb42bf1d0ebebfe"", ""1434b7ffac84302178b2297ac9cfa81c"", ""d03dd66d53ec9c8d381aad5a4618109e"", ""d81c7d5588186f700b84773711c8d4d5""]","[727, 729, 785, 796, 796, 631, 631, 631, 900, 66, 66, 66]","[782, 793, 897, 912, 912, 726, 726, 726, 915, 1686, 1686, 1686]","[""CINT = 13.0, CDISP = 0.38461538461538464, CC > 1.0"", ""PARAMETER_COUNT > 0.9462862423472285"", ""CINT = 17.0, CDISP = 0.47058823529411764, CC > 1.0"", ""PARAMETER_COUNT > 0.9462862423472285"", ""MLOC > 6.874321358438148"", ""CINT = 17.0, CDISP = 0.4117647058823529, CC > 1.0"", ""PARAMETER_COUNT > 0.9462862423472285"", ""MLOC > 6.874321358438148"", ""PARAMETER_COUNT > 0.9414614907882141"", ""LONG_METHODS_CONNECTED = 8"", ""CC = 39.0"", ""CLOC > 500, TCC < 0.4808063174919667""]"
Researcher 2,apache_tomcat,20910,"[""Extract Method"", ""Extract Method"", ""Extract Method"", ""Extract Method"", ""Inline Method"", ""Inline Method""]","[""org.apache.tomcat.util.net.SocketWrapperBase.write(boolean,byte,int,int)"", ""org.apache.tomcat.util.net.SocketWrapperBase"", ""org.apache.tomcat.util.net.SocketWrapperBase.writeBlocking(byte,int,int)"", ""org.apache.tomcat.util.net.SocketWrapperBase.writeNonBlocking(byte,int,int)"", ""org.apache.tomcat.util.net.SocketWrapperBase.flush(boolean,boolean)"", ""org.apache.tomcat.util.net.SocketWrapperBase.flush(boolean)""]","[""14621ff2721d9ae552d5e8ed54fa777b413392c8"", ""14621ff2721d9ae552d5e8ed54fa777b413392c8"", ""14621ff2721d9ae552d5e8ed54fa777b413392c8"", ""14621ff2721d9ae552d5e8ed54fa777b413392c8"", ""14621ff2721d9ae552d5e8ed54fa777b413392c8"", ""14621ff2721d9ae552d5e8ed54fa777b413392c8"", ""14621ff2721d9ae552d5e8ed54fa777b413392c8"", ""14621ff2721d9ae552d5e8ed54fa777b413392c8"", ""14621ff2721d9ae552d5e8ed54fa777b413392c8""]","[""IntensiveCoupling"", ""LongParameterList"", ""LongMethod"", ""FeatureEnvy"", ""SpaghettiCode"", ""ComplexClass"", ""IntensiveCoupling"", ""LongMethod"", ""FeatureEnvy""]","[""a692bb7de25e381270cb937b1c7c2a79"", ""2903e54b6db0254b2cc748a2b5de3c84"", ""4a44c2f26043b58f2a84f2514edb4705"", ""6f43e33c3431a87e08ab46518c26ca0b"", ""6705cc6be1b7c1ed9f03ade53b54b598"", ""bd4f854964b76208fd23f0e78a2a9fc3"", ""3e8347502e464aa3cdb572ace722ec61"", ""5c008872266ae321b171582f5c2422bc"", ""a9a50702f0c6b2764f7ef91c6519c2a6""]","[238, 216, 216, 216, 40, 41, 88, 88, 88]","[452, 374, 374, 374, 472, 481, 236, 214, 214]","[""CINT = 9.0, CDISP = 0.3333333333333333, CC > 1.0"", ""PARAMETER_COUNT > 1.1758515579639652"", ""MLOC > 7.946705051286362"", ""CALLS_TO_java.sql.PreparedStatement > 13"", ""LONG_METHODS_CONNECTED = 2"", ""CC = 13.0"", ""CINT = 9.0, CDISP = 0.3333333333333333, CC > 1.0"", ""MLOC > 8.252503728956935"", ""CALLS_TO_org.apache.derbyTesting.functionTests.tests.store.BaseTest > 4""]","[""5a37fdb716f0ff812926667caa836177aa3bef7b""]","[""FeatureEnvy""]","[""410599a1ec35b3e4d95f5831d6aaee0d""]",[400],[433],"[""CALLS_TO_org.apache.tomcat.util.net.SocketWrapperBase<E> > 6""]"
Researcher 2,apache_tomcat,20956,"[""Extract Method"", ""Extract Method"", ""Rename Method"", ""Rename Method"", ""Extract Method"", ""Extract Method"", ""Extract Method"", ""Extract Method"", ""Extract Method"", ""Extract Method""]","[""org.apache.catalina.authenticator.jaspic.provider.modules.FormAuthModule"", ""org.apache.catalina.authenticator.jaspic.provider.modules.FormAuthModule.validate(MessageInfo,Subject)"", ""org.apache.catalina.authenticator.jaspic.provider.modules.FormAuthModule.handleNoLoginAction(Request,HttpServletResponse)"", ""org.apache.catalina.authenticator.jaspic.provider.modules.FormAuthModule.matchRequest(Request)"", ""org.apache.catalina.authenticator.jaspic.provider.modules.FormAuthModule.isMatchingSavedRequest(Request)"", ""org.apache.catalina.authenticator.jaspic.provider.modules.FormAuthModule.handleLoginAction(Request,HttpServletResponse)"", ""org.apache.catalina.authenticator.jaspic.provider.modules.FormAuthModule.isLoginActionRequest(Request)"", ""org.apache.catalina.authenticator.jaspic.provider.modules.FormAuthModule.submitSavedRequest(Subject,Request,HttpServletResponse)""]","[""4ee7918f4c0dd9a7b1718bc42224066bb7a8e299"", ""4ee7918f4c0dd9a7b1718bc42224066bb7a8e299"", ""4ee7918f4c0dd9a7b1718bc42224066bb7a8e299"", ""4ee7918f4c0dd9a7b1718bc42224066bb7a8e299"", ""4ee7918f4c0dd9a7b1718bc42224066bb7a8e299"", ""4ee7918f4c0dd9a7b1718bc42224066bb7a8e299"", ""4ee7918f4c0dd9a7b1718bc42224066bb7a8e299"", ""4ee7918f4c0dd9a7b1718bc42224066bb7a8e299"", ""4ee7918f4c0dd9a7b1718bc42224066bb7a8e299"", ""4ee7918f4c0dd9a7b1718bc42224066bb7a8e299"", ""4ee7918f4c0dd9a7b1718bc42224066bb7a8e299"", ""4ee7918f4c0dd9a7b1718bc42224066bb7a8e299"", ""4ee7918f4c0dd9a7b1718bc42224066bb7a8e299"", ""4ee7918f4c0dd9a7b1718bc42224066bb7a8e299"", ""4ee7918f4c0dd9a7b1718bc42224066bb7a8e299"", ""4ee7918f4c0dd9a7b1718bc42224066bb7a8e299"", ""4ee7918f4c0dd9a7b1718bc42224066bb7a8e299"", ""4ee7918f4c0dd9a7b1718bc42224066bb7a8e299"", ""4ee7918f4c0dd9a7b1718bc42224066bb7a8e299"", ""4ee7918f4c0dd9a7b1718bc42224066bb7a8e299""]","[""DispersedCoupling"", ""LongParameterList"", ""FeatureEnvy"", ""LongParameterList"", ""FeatureEnvy"", ""DispersedCoupling"", ""LongParameterList"", ""FeatureEnvy"", ""LongParameterList"", ""FeatureEnvy"", ""IntensiveCoupling"", ""LongParameterList"", ""FeatureEnvy"", ""SpaghettiCode"", ""ComplexClass"", ""GodClass"", ""DispersedCoupling"", ""LongParameterList"", ""LongMethod"", ""FeatureEnvy""]","[""b9864d00bf01b5ce29dcae259381112a"", ""224f586896403e259fd36381910d0ea1"", ""1dedb8dfb2502a982c03a023338b036b"", ""ed290148dbaddc393f7b017f18799960"", ""c6e68d67cf5faa071adf545411ad1c11"", ""eaafffaede170f18fca7f55fc6b7735c"", ""773a3ba1189fd2394908e484634003af"", ""d75b4dd47bd9ecfad3693951b273cfeb"", ""0a13a4de9dbcde1e431b103fb39841c0"", ""75d6de9858b7a071dde2ce5a7ab6b9be"", ""ad5d16e176311d76db7ba38ecd2b1771"", ""86b18bab076febc41c558adb8c85619f"", ""f806d02e754a7da7838eb35e42c1a4c0"", ""e8ea4a9a374e0ea3d899d04fa8d25a46"", ""09ccd218baea0722d85c3c413650a9f7"", ""b6af47c56bb323d8c5e7b3d7602900b0"", ""d37416fd3e3bb71caf25d2eb0faf9427"", ""0efa7b50fbfd8e4343beb41b32ddf50e"", ""8eaafbe8c2aba548e1f52a0be69525cc"", ""340a94716de9aa4b50d88e7dd0c80f0c""]","[437, 437, 437, 3115, 3119, 402, 406, 402, 381, 373, 3087, 3087, 3087, 35, 35, 39, 946, 946, 946, 946]","[487, 483, 487, 3128, 3136, 436, 436, 436, 405, 401, 3114, 3114, 3114, 3503, 3503, 3192, 1021, 1021, 1021, 1021]","[""CINT > 8.0, CDISP > 0.5, CC > 1.0"", ""PARAMETER_COUNT > 1.176066888985522"", ""CALLS_TO_org.apache.derby.jdbc.ClientBaseDataSource > 4"", ""PARAMETER_COUNT > 1.176066888985522"", ""CALLS_TO_org.apache.derby.jdbc.ClientBaseDataSource > 4"", ""CINT > 8.0, CDISP > 0.5, CC > 1.0"", ""PARAMETER_COUNT > 1.176066888985522"", ""CALLS_TO_org.apache.derby.jdbc.ClientBaseDataSource > 4"", ""PARAMETER_COUNT > 1.176066888985522"", ""CALLS_TO_org.apache.derby.jdbc.ClientBaseDataSource > 4"", ""CINT = 11.0, CDISP = 0.45454545454545453, CC > 1.0"", ""PARAMETER_COUNT > 1.176066888985522"", ""CALLS_TO_java.sql.PreparedStatement > 4"", ""LONG_METHODS_CONNECTED = 6"", ""CC = 11.0"", ""CLOC > 500, TCC < 0.407300078351677"", ""CINT > 8.0, CDISP > 0.5, CC > 1.0"", ""PARAMETER_COUNT > 1.1953917533880227"", ""MLOC > 7.578442423129675"", ""CALLS_TO_org.apache.derbyTesting.functionTests.tests.replicationTests.Utils > 7""]","[""6022c2d1937db51d05ce40ff208e9c9636c99335"", ""6022c2d1937db51d05ce40ff208e9c9636c99335""]","[""ComplexClass"", ""IntensiveCoupling""]","[""998f9be5d0893a1f2c562489ce132175"", ""4bf80d4f492d0b75ab6302f21b998c6d""]","[57, 104]","[632, 149]","[""CC = 13.0"", ""CINT = 15.0, CDISP = 0.4666666666666667, CC > 1.0""]"
Researcher 2,apache_tomcat,20959,"[""Extract Method"", ""Extract Method"", ""Extract Method"", ""Extract Method"", ""Extract Method"", ""Extract Method"", ""Extract Method"", ""Extract Method"", ""Extract Method"", ""Extract Method"", ""Pull Up Method"", ""Pull Up Method"", ""Pull Up Method"", ""Pull Up Method"", ""Pull Up Method"", ""Pull Up Method"", ""Extract Method"", ""Extract Method"", ""Inline Method"", ""Inline Method""]","[""org.apache.coyote.ajp.AjpProcessor"", ""org.apache.coyote.ajp.AjpProcessor.dispatch(SocketStatus)"", ""org.apache.coyote.ajp.AjpProcessor.flushBufferedWrite()"", ""org.apache.coyote.http11.Http11Processor"", ""org.apache.coyote.http11.Http11Processor.dispatch(SocketStatus)"", ""org.apache.coyote.http11.Http11Processor.dispatchEndRequest()"", ""org.apache.coyote.ajp.AjpProcessor.dispatchEndRequest()"", ""org.apache.coyote.http2.StreamProcessor"", ""org.apache.coyote.http2.StreamProcessor.dispatch(SocketStatus)"", ""org.apache.coyote.http2.StreamProcessor.flushBufferedWrite()"", ""org.apache.coyote.http11.Http11Processor.flushBufferedWrite()"", ""org.apache.coyote.AbstractProcessor"", ""org.apache.coyote.AbstractProcessor.dispatch(SocketStatus)"", ""org.apache.coyote.http2.StreamProcessor.dispatchEndRequest()"", ""org.apache.coyote.http2.StreamProcessor.process(SocketStatus)"", ""org.apache.coyote.http2.StreamProcessor.run()""]","[""6a53c94a2678153fb26f462b4df0c52b2da0922d"", ""6a53c94a2678153fb26f462b4df0c52b2da0922d"", ""6a53c94a2678153fb26f462b4df0c52b2da0922d""]","[""IntensiveCoupling"", ""LongMethod"", ""FeatureEnvy""]","[""782b4fb174d940a349329d1c7e9a0df2"", ""e5a38d3d384127bd322cc0a31ccf9647"", ""19356a3300620d11f8dfe371326d36b2""]","[51, 51, 51]","[151, 151, 151]","[""CINT = 18.0, CDISP = 0.2777777777777778, CC > 1.0"", ""MLOC > 7.93721962278708"", ""CALLS_TO_java.sql.ResultSet > 5""]","[""c4760089e640aa9763aca14f003f6d1c872d5982"", ""c4760089e640aa9763aca14f003f6d1c872d5982"", ""c4760089e640aa9763aca14f003f6d1c872d5982""]","[""ComplexClass"", ""DispersedCoupling"", ""FeatureEnvy""]","[""8738971dbdceb15534f90f05b6301e38"", ""7bd231fb328636d73fe6a5f4d28f59bc"", ""d5030ec8534d65fa05f1532bc7c3f36a""]","[41, 62, 62]","[579, 115, 115]","[""CC = 56.0"", ""CINT > 8.0, CDISP > 0.5, CC > 1.0"", ""CALLS_TO_org.apache.coyote.AbstractProcessor > 5""]"
Researcher 2,apache_tomcat,20971,"[""Extract Method"", ""Extract Method"", ""Extract Method"", ""Extract Method"", ""Move Attribute"", ""Move Attribute""]","[""org.apache.tomcat.util.net.openssl.OpenSSLEngine.pendingReadableBytesInSSL()"", ""org.apache.tomcat.util.net.openssl.OpenSSLEngine"", ""org.apache.tomcat.util.net.openssl.OpenSSLEngine.checkLastError()"", ""org.apache.tomcat.util.net.openssl.OpenSSLEngine.handshake()"", ""org.apache.tomcat.util.net.openssl.OpenSSLEngine.OpenSSLSession""]","[""02ac42cee63d0e7815c8075f85dbddcc31a6049f"", ""02ac42cee63d0e7815c8075f85dbddcc31a6049f"", ""02ac42cee63d0e7815c8075f85dbddcc31a6049f"", ""02ac42cee63d0e7815c8075f85dbddcc31a6049f"", ""02ac42cee63d0e7815c8075f85dbddcc31a6049f"", ""02ac42cee63d0e7815c8075f85dbddcc31a6049f"", ""02ac42cee63d0e7815c8075f85dbddcc31a6049f"", ""02ac42cee63d0e7815c8075f85dbddcc31a6049f"", ""02ac42cee63d0e7815c8075f85dbddcc31a6049f"", ""02ac42cee63d0e7815c8075f85dbddcc31a6049f"", ""02ac42cee63d0e7815c8075f85dbddcc31a6049f"", ""02ac42cee63d0e7815c8075f85dbddcc31a6049f"", ""02ac42cee63d0e7815c8075f85dbddcc31a6049f"", ""02ac42cee63d0e7815c8075f85dbddcc31a6049f""]","[""ShotgunSurgery"", ""LongParameterList"", ""LongMethod"", ""FeatureEnvy"", ""LongParameterList"", ""LongParameterList"", ""ShotgunSurgery"", ""LongParameterList"", ""LongMethod"", ""FeatureEnvy"", ""LongParameterList"", ""SpaghettiCode"", ""ComplexClass"", ""GodClass""]","[""43ea9b1f1d8a1e26ab71c1cf2f3f665a"", ""4d5cce9bb4ad006853395da36a34a345"", ""c17487b31b941f3a3b9d73d9bb90965d"", ""fbc8669d4cf364da716b01b58260f1b6"", ""45f0ce5f59dca40c6d9a7e35d5221ac2"", ""146c7a004f99e59a8838fbf98ce74e65"", ""b318fee72c983c211f98f1540ec2b9bd"", ""b1b80f600e171f34f3a65c292c9c7351"", ""b7dd96a9a341ada7d7fb58161720b13c"", ""c6d8ccdd9a2317424b7bc3f6b82a90db"", ""a0da2e3c89e2a8c4c3b779366fa2b7ae"", ""e8ea4a9a374e0ea3d899d04fa8d25a46"", ""09ccd218baea0722d85c3c413650a9f7"", ""b6af47c56bb323d8c5e7b3d7602900b0""]","[2160, 2160, 2160, 2160, 2789, 1531, 2170, 2024, 2024, 2024, 2167, 35, 35, 39]","[2298, 2298, 2298, 2298, 2845, 1546, 2287, 2085, 2085, 2085, 2224, 3503, 3503, 3192]","[""CM > 8.0, CC > 6.0"", ""PARAMETER_COUNT > 1.1802749581157237"", ""MLOC > 7.873706514240143"", ""CALLS_TO_org.apache.derbyTesting.functionTests.tests.replicationTests.Utils > 14"", ""PARAMETER_COUNT > 1.1944720985066999"", ""PARAMETER_COUNT > 1.1765482829468539"", ""CM > 8.0, CC > 6.0"", ""PARAMETER_COUNT > 1.1755934486158597"", ""MLOC > 7.939657038407848"", ""CALLS_TO_org.apache.derbyTesting.functionTests.tests.replicationTests.Utils > 9"", ""PARAMETER_COUNT > 1.1755934486158597"", ""LONG_METHODS_CONNECTED = 6"", ""CC = 11.0"", ""CLOC > 500, TCC < 0.407300078351677""]","[""4ad57e2e7ab291a5eec021edc7cf1808b2eb7e8a"", ""4ad57e2e7ab291a5eec021edc7cf1808b2eb7e8a"", ""4ad57e2e7ab291a5eec021edc7cf1808b2eb7e8a"", ""4ad57e2e7ab291a5eec021edc7cf1808b2eb7e8a"", ""4ad57e2e7ab291a5eec021edc7cf1808b2eb7e8a""]","[""DataClass"", ""ComplexClass"", ""SpaghettiCode"", ""ComplexClass"", ""GodClass""]","[""de7dce7c645e04cc573214b1f2903f3a"", ""d6c01d35ed82472c45da7937ae014890"", ""34ecc864453c184cc405232aaf01ccda"", ""78aa4e899089452c1f6040c86adc75ff"", ""150a03581d7f600c8aa6f60d1778c798""]","[1076, 1076, 56, 56, 56]","[1338, 1338, 1355, 1355, 1355]","[""WOC = 0.19047619047619047, NOPA = 0.0, NOAM = 17.0, WMC = 60.0"", ""CC = 11.0"", ""LONG_METHODS_CONNECTED = 3"", ""CC = 19.0"", ""CLOC > 500, TCC < 0.4877410010384323""]"
Researcher 2,apache_tomcat,20979,"[""Extract Method"", ""Extract Method"", ""Inline Method"", ""Inline Method""]","[""org.apache.catalina.loader.WebappClassLoaderBase"", ""org.apache.catalina.loader.WebappClassLoaderBase.findClassInternal(String)"", ""org.apache.catalina.loader.WebappClassLoaderBase.findResourceInternal(String,String)"", ""org.apache.catalina.loader.WebappClassLoaderBase.findResourceInternal(String,String,boolean)""]","[""02ac42cee63d0e7815c8075f85dbddcc31a6049f"", ""02ac42cee63d0e7815c8075f85dbddcc31a6049f"", ""02ac42cee63d0e7815c8075f85dbddcc31a6049f"", ""02ac42cee63d0e7815c8075f85dbddcc31a6049f"", ""02ac42cee63d0e7815c8075f85dbddcc31a6049f"", ""02ac42cee63d0e7815c8075f85dbddcc31a6049f"", ""02ac42cee63d0e7815c8075f85dbddcc31a6049f"", ""02ac42cee63d0e7815c8075f85dbddcc31a6049f"", ""02ac42cee63d0e7815c8075f85dbddcc31a6049f"", ""02ac42cee63d0e7815c8075f85dbddcc31a6049f"", ""02ac42cee63d0e7815c8075f85dbddcc31a6049f"", ""02ac42cee63d0e7815c8075f85dbddcc31a6049f"", ""02ac42cee63d0e7815c8075f85dbddcc31a6049f"", ""02ac42cee63d0e7815c8075f85dbddcc31a6049f""]","[""ShotgunSurgery"", ""LongParameterList"", ""LongMethod"", ""FeatureEnvy"", ""LongParameterList"", ""LongParameterList"", ""ShotgunSurgery"", ""LongParameterList"", ""LongMethod"", ""FeatureEnvy"", ""LongParameterList"", ""SpaghettiCode"", ""ComplexClass"", ""GodClass""]","[""43ea9b1f1d8a1e26ab71c1cf2f3f665a"", ""4d5cce9bb4ad006853395da36a34a345"", ""c17487b31b941f3a3b9d73d9bb90965d"", ""fbc8669d4cf364da716b01b58260f1b6"", ""45f0ce5f59dca40c6d9a7e35d5221ac2"", ""146c7a004f99e59a8838fbf98ce74e65"", ""b318fee72c983c211f98f1540ec2b9bd"", ""b1b80f600e171f34f3a65c292c9c7351"", ""b7dd96a9a341ada7d7fb58161720b13c"", ""c6d8ccdd9a2317424b7bc3f6b82a90db"", ""a0da2e3c89e2a8c4c3b779366fa2b7ae"", ""e8ea4a9a374e0ea3d899d04fa8d25a46"", ""09ccd218baea0722d85c3c413650a9f7"", ""b6af47c56bb323d8c5e7b3d7602900b0""]","[2160, 2160, 2160, 2160, 2789, 1531, 2170, 2024, 2024, 2024, 2167, 35, 35, 39]","[2298, 2298, 2298, 2298, 2845, 1546, 2287, 2085, 2085, 2085, 2224, 3503, 3503, 3192]","[""CM > 8.0, CC > 6.0"", ""PARAMETER_COUNT > 1.1802749581157237"", ""MLOC > 7.873706514240143"", ""CALLS_TO_org.apache.derbyTesting.functionTests.tests.replicationTests.Utils > 14"", ""PARAMETER_COUNT > 1.1944720985066999"", ""PARAMETER_COUNT > 1.1765482829468539"", ""CM > 8.0, CC > 6.0"", ""PARAMETER_COUNT > 1.1755934486158597"", ""MLOC > 7.939657038407848"", ""CALLS_TO_org.apache.derbyTesting.functionTests.tests.replicationTests.Utils > 9"", ""PARAMETER_COUNT > 1.1755934486158597"", ""LONG_METHODS_CONNECTED = 6"", ""CC = 11.0"", ""CLOC > 500, TCC < 0.407300078351677""]","[""bd3cd71dd8a40b02e1728d98a9c241ef630573ef"", ""bd3cd71dd8a40b02e1728d98a9c241ef630573ef"", ""bd3cd71dd8a40b02e1728d98a9c241ef630573ef"", ""bd3cd71dd8a40b02e1728d98a9c241ef630573ef"", ""bd3cd71dd8a40b02e1728d98a9c241ef630573ef"", ""bd3cd71dd8a40b02e1728d98a9c241ef630573ef"", ""bd3cd71dd8a40b02e1728d98a9c241ef630573ef"", ""bd3cd71dd8a40b02e1728d98a9c241ef630573ef""]","[""SpeculativeGenerality"", ""SpaghettiCode"", ""ComplexClass"", ""ClassDataShouldBePrivate"", ""GodClass"", ""LongMethod"", ""LongMethod"", ""FeatureEnvy""]","[""315b85560519662faced99d8f6a865d0"", ""150e7f295d6b57a51b21f452bcc99534"", ""19d25e573db4517abc68bc2a9834b1cf"", ""37af1467227348e6e941788a0fdd369b"", ""c8928c11f3e5d89b82873272b7dbc61d"", ""eaaad366039bfe5c06a1976fb5290151"", ""0b20f467d1ade5535518ce08f3c82e95"", ""5835e52bb096b422fe2a13e86af81e31""]","[83, 83, 83, 83, 83, 2361, 2541, 2541]","[2736, 2736, 2736, 2736, 2736, 2504, 2622, 2622]","[""IS_ABSTRACT = 1, CHILDREN_COUNT = 2"", ""LONG_METHODS_CONNECTED = 10"", ""CC = 25.0"", ""PUBLIC_FIELD_COUNT = 1.0"", ""CLOC > 500, TCC < 0.49176697471028613"", ""MLOC > 6.681869954934875"", ""MLOC > 6.682777062493791"", ""CALLS_TO_org.apache.catalina.WebResource > 4""]"
Researcher 2,apache_tomcat,20989,"[""Extract Method"", ""Extract Method"", ""Extract Method"", ""Extract Method"", ""Extract Method"", ""Extract Method"", ""Extract Method"", ""Extract Method""]","[""org.apache.catalina.authenticator.AuthenticatorBase"", ""org.apache.catalina.authenticator.AuthenticatorBase.invoke(Request,Response)"", ""org.apache.catalina.authenticator.AuthenticatorBase.getJaspicState(AuthConfigProvider,Request,Response)"", ""org.apache.catalina.authenticator.AuthenticatorBase.secureResponseJspic(Request,Response,JaspicState)"", ""org.apache.catalina.authenticator.AuthenticatorBase.authenticate(Request,HttpServletResponse)""]","[""4772c7ee2b0f7c59edf32db2f21294904e286293"", ""4772c7ee2b0f7c59edf32db2f21294904e286293"", ""4772c7ee2b0f7c59edf32db2f21294904e286293"", ""4772c7ee2b0f7c59edf32db2f21294904e286293"", ""4772c7ee2b0f7c59edf32db2f21294904e286293""]","[""ComplexClass"", ""FeatureEnvy"", ""LongParameterList"", ""LongMethod"", ""FeatureEnvy""]","[""e8d9194cc60f5200210ad0fe56099360"", ""999a3e2cc81fdbcc5e3aad75ceaa780f"", ""500c9d9660e79f8c4c826d7953865480"", ""aa85c78c4551f37c6cfc71d75b757ff2"", ""e83403b13dd661ab36c0226b2eddb5d0""]","[32, 745, 560, 616, 616]","[1073, 799, 596, 688, 685]","[""CC = 12.0"", ""CALLS_TO_org.apache.derby.client.am.Lob > 7"", ""PARAMETER_COUNT > 1.2572991429168812"", ""MLOC > 7.936971062789272"", ""CALLS_TO_org.apache.derby.client.am.Lob > 5""]","[""172e6c6fae7a228abb60c772cbe0492d4eafc817"", ""172e6c6fae7a228abb60c772cbe0492d4eafc817"", ""172e6c6fae7a228abb60c772cbe0492d4eafc817"", ""172e6c6fae7a228abb60c772cbe0492d4eafc817"", ""172e6c6fae7a228abb60c772cbe0492d4eafc817"", ""172e6c6fae7a228abb60c772cbe0492d4eafc817""]","[""IntensiveCoupling"", ""LongMethod"", ""FeatureEnvy"", ""SpaghettiCode"", ""ComplexClass"", ""ClassDataShouldBePrivate""]","[""5672e333724547bc3c4a854ef0ef4ad2"", ""3d8180d5a94019843cb6081683378390"", ""a314cadcea0af9490f09076037a2d684"", ""d1d157669b8e7233fa765352543f8264"", ""c6ef764e97029a8aa7876a2452f2d665"", ""8426367e24f008c7276c469be1024a24""]","[404, 404, 404, 52, 52, 69]","[583, 583, 583, 906, 906, 1194]","[""CINT = 31.0, CDISP = 0.45161290322580644, CC > 1.0"", ""MLOC > 6.859328599096234"", ""CALLS_TO_org.apache.catalina.Session > 4"", ""LONG_METHODS_CONNECTED = 2"", ""CC = 43.0"", ""PUBLIC_FIELD_COUNT = 2.0""]"
Researcher 2,apache_tomcat,20990,"[""Extract Method"", ""Extract Method"", ""Extract Method"", ""Extract Method"", ""Extract Method"", ""Extract Method""]","[""org.apache.coyote.http2.Http2UpgradeHandler.init(WebConnection)"", ""org.apache.coyote.http2.Http2UpgradeHandler"", ""org.apache.coyote.http2.Http2UpgradeHandler.processStreamOnContainerThread(Stream)"", ""org.apache.coyote.http2.Http2UpgradeHandler.push(Request,Stream)"", ""org.apache.coyote.http2.Http2UpgradeHandler.headersEnd(int)""]","[""1ed2c9984c48870c8a111712fa7e0488337adef9"", ""1ed2c9984c48870c8a111712fa7e0488337adef9"", ""1ed2c9984c48870c8a111712fa7e0488337adef9"", ""1ed2c9984c48870c8a111712fa7e0488337adef9""]","[""LongMethod"", ""FeatureEnvy"", ""ComplexClass"", ""ClassDataShouldBePrivate""]","[""f4c5ce01f72da97f84b6d211eecfe4f3"", ""dddb913b3235cdf1cc972793e01b3f5f"", ""b467c2257dd606f02504ebafd4b38fb6"", ""1164016028210d3d059215ce8a98036f""]","[205, 205, 48, 48]","[263, 263, 900, 900]","[""MLOC > 7.907439690916514"", ""CALLS_TO_java.sql.PreparedStatement > 5"", ""CC = 11.0"", ""PUBLIC_FIELD_COUNT = 3.0""]","[""66008c86384b8018385e64f0013779b19c19d8db"", ""66008c86384b8018385e64f0013779b19c19d8db"", ""66008c86384b8018385e64f0013779b19c19d8db"", ""66008c86384b8018385e64f0013779b19c19d8db"", ""66008c86384b8018385e64f0013779b19c19d8db"", ""66008c86384b8018385e64f0013779b19c19d8db""]","[""SpaghettiCode"", ""ComplexClass"", ""GodClass"", ""DispersedCoupling"", ""LongMethod"", ""FeatureEnvy""]","[""0bada4f61d4b25c2456f5bb7fa2934ba"", ""0095e6a35482ab134ef7267eed5d42b1"", ""cf5053ff7da90130354eaf88136ca66f"", ""ed134661cd074a4c4a601cfc12803edc"", ""2b6c31bb60d8ca9bec3e179acee410ef"", ""20407e84b5f3e3ced21449b85720d08c""]","[60, 60, 60, 171, 171, 171]","[1530, 1530, 1530, 256, 256, 256]","[""LONG_METHODS_CONNECTED = 6"", ""CC = 14.0"", ""CLOC > 500, TCC < 0.49286836990116256"", ""CINT > 8.0, CDISP > 0.5, CC > 1.0"", ""MLOC > 6.652768889982851"", ""CALLS_TO_org.apache.juli.logging.Log > 8""]"
Researcher 2,apache_tomcat,20992,"[""Extract Method"", ""Extract Method"", ""Extract Method"", ""Extract Method"", ""Extract Method"", ""Extract Method"", ""Extract Method"", ""Extract Method""]","[""org.apache.coyote.http11.Http11Processor"", ""org.apache.coyote.http11.Http11Processor.endRequest()"", ""org.apache.coyote.http11.Http11Processor.finishResponse()"", ""org.apache.coyote.http11.Http11Processor.action(ActionCode,Object)"", ""org.apache.coyote.http11.Http11Processor.flush()"", ""org.apache.coyote.http11.Http11Processor.ack()""]","[""23cf182504855cd40fac0786d361d35147434ab0"", ""23cf182504855cd40fac0786d361d35147434ab0"", ""23cf182504855cd40fac0786d361d35147434ab0"", ""23cf182504855cd40fac0786d361d35147434ab0"", ""23cf182504855cd40fac0786d361d35147434ab0"", ""23cf182504855cd40fac0786d361d35147434ab0"", ""23cf182504855cd40fac0786d361d35147434ab0"", ""23cf182504855cd40fac0786d361d35147434ab0"", ""23cf182504855cd40fac0786d361d35147434ab0""]","[""LongMethod"", ""FeatureEnvy"", ""LongMethod"", ""FeatureEnvy"", ""SpaghettiCode"", ""ComplexClass"", ""ClassDataShouldBePrivate"", ""LongMethod"", ""FeatureEnvy""]","[""e71370120323dddac1b1cf867172c642"", ""4df371135739f16a705a2777db9af1dc"", ""d534cb5aacd49396ed206a68f274e620"", ""b5879760f3b9498161a8634191b24c16"", ""6c576a3429113d029326616fedb3a0a6"", ""b467c2257dd606f02504ebafd4b38fb6"", ""1164016028210d3d059215ce8a98036f"", ""98191bc10d2cfc7cc37e8ec656bcb9dd"", ""2896660216e2df5f41bbf65cabe4cb80""]","[591, 591, 643, 643, 48, 48, 48, 439, 437]","[641, 641, 697, 708, 900, 900, 900, 518, 512]","[""MLOC > 7.905675008811491"", ""CALLS_TO_java.sql.PreparedStatement > 6"", ""MLOC > 7.905675008811491"", ""CALLS_TO_org.apache.derbyTesting.junit.BaseJDBCTestCase > 9"", ""LONG_METHODS_CONNECTED = 4"", ""CC = 11.0"", ""PUBLIC_FIELD_COUNT = 3.0"", ""MLOC > 7.905675008811491"", ""CALLS_TO_java.sql.PreparedStatement > 6""]","[""e9e9db27dbfb138a663c27a131146d16e6e9bc36"", ""e9e9db27dbfb138a663c27a131146d16e6e9bc36"", ""e9e9db27dbfb138a663c27a131146d16e6e9bc36"", ""e9e9db27dbfb138a663c27a131146d16e6e9bc36"", ""e9e9db27dbfb138a663c27a131146d16e6e9bc36"", ""e9e9db27dbfb138a663c27a131146d16e6e9bc36"", ""e9e9db27dbfb138a663c27a131146d16e6e9bc36""]","[""BrainClass"", ""SpaghettiCode"", ""ComplexClass"", ""GodClass"", ""IntensiveCoupling"", ""LongMethod"", ""FeatureEnvy""]","[""989f9997d407b2fa7b369c132fce2bf0"", ""48511c040e3b5b9310a556899c3e9c00"", ""88fc4cb4cab531c7b66b1febd2e98004"", ""d0e1bc791a1773d826c1506460e869b1"", ""8411b38206d0b85b67f23aa90b288aa9"", ""19e36edf3aa620c308f01bed82ca7f2d"", ""84ea868f9fe33d22a3b22a6bbf95ded5""]","[56, 56, 35, 56, 650, 650, 649]","[1697, 1697, 425, 1697, 886, 886, 937]","[""BRAIN_METHODS = 1, WMC = 259.0, TCC = 0.08067226890756303"", ""LONG_METHODS_CONNECTED = 5"", ""CC = 58.0"", ""CLOC > 500, TCC < 0.42040823562284796"", ""CINT = 56.0, CDISP = 0.26785714285714285, CC > 1.0"", ""MLOC > 6.641009277894996"", ""CALLS_TO_org.apache.coyote.AsyncStateMachine > 14""]"
Researcher 2,apache_tomcat,21001,"[""Extract Method"", ""Extract Method"", ""Rename Method"", ""Rename Method""]","[""org.apache.tomcat.util.net.SocketWrapperBase"", ""org.apache.tomcat.util.net.SocketWrapperBase.writeNonBlockingInternal(ByteBuffer)"", ""org.apache.tomcat.util.net.SocketWrapperBase.writeByteBufferNonBlocking(ByteBuffer)"", ""org.apache.tomcat.util.net.SocketWrapperBase.writeBlockingInternal(ByteBuffer)"", ""org.apache.tomcat.util.net.SocketWrapperBase.writeByteBufferBlocking(ByteBuffer)""]","[""7f17ba1a4e0e76bdd1aa0734b515ec5386e43824"", ""7f17ba1a4e0e76bdd1aa0734b515ec5386e43824""]","[""LongMethod"", ""FeatureEnvy""]","[""1e637023974d8258035d75d1a4179827"", ""28aaa76bed9f0810c8aa56e71f64e2d2""]","[61, 61]","[112, 112]","[""MLOC > 8.078322630861376"", ""CALLS_TO_java.sql.Statement > 9""]","[""b3335c3774d64349a9f23bb543dfac9e52fe3945""]","[""FeatureEnvy""]","[""ea9d537757667912a03f3e1d106c764c""]",[522],[537],"[""CALLS_TO_org.apache.tomcat.util.net.SocketWrapperBase<E> > 4""]"
Researcher 2,apache_tomcat,21006,"[""Extract Method"", ""Extract Method"", ""Extract Method"", ""Extract Method""]","[""org.apache.coyote.http2.Http2Parser.readContinuationFrame(int,int,int)"", ""org.apache.coyote.http2.Http2Parser"", ""org.apache.coyote.http2.Http2Parser.onHeadersComplete(int)"", ""org.apache.coyote.http2.Http2Parser.readHeadersFrame(int,int,int)""]","[""7f17ba1a4e0e76bdd1aa0734b515ec5386e43824"", ""7f17ba1a4e0e76bdd1aa0734b515ec5386e43824""]","[""LongMethod"", ""FeatureEnvy""]","[""1e637023974d8258035d75d1a4179827"", ""28aaa76bed9f0810c8aa56e71f64e2d2""]","[61, 61]","[112, 112]","[""MLOC > 8.078322630861376"", ""CALLS_TO_java.sql.Statement > 9""]","[""a6717dc1070c264b4b67323edcc58fcbd5d6477e"", ""a6717dc1070c264b4b67323edcc58fcbd5d6477e"", ""a6717dc1070c264b4b67323edcc58fcbd5d6477e"", ""a6717dc1070c264b4b67323edcc58fcbd5d6477e""]","[""SpaghettiCode"", ""ComplexClass"", ""IntensiveCoupling"", ""LongMethod""]","[""e69bf8a42b0cf2911c52a011e06f53f6"", ""7f3afa175faffef5f01d5e5b854dd9f9"", ""b3814b4ba8b082dacd28ffee19e9403e"", ""7d8a68f117d4babb164d320843eb3775""]","[29, 29, 197, 197]","[613, 613, 255, 255]","[""LONG_METHODS_CONNECTED = 3"", ""CC = 14.0"", ""CINT = 16.0, CDISP = 0.4375, CC > 1.0"", ""MLOC > 6.62315583781148""]"
Researcher 2,apache_tomcat,21024,"[""Move Attribute"", ""Move Attribute"", ""Extract Method"", ""Extract Method""]","[""org.apache.tomcat.util.net.NioEndpoint.Poller"", ""org.apache.tomcat.util.net.NioEndpoint"", ""org.apache.tomcat.util.net.NioEndpoint.Poller.add(NioChannel)"", ""org.apache.tomcat.util.net.NioEndpoint.Poller.add(NioChannel,int)""]","[""f3e70a15395d82cfd5c9f3c63a349d624453839f"", ""f3e70a15395d82cfd5c9f3c63a349d624453839f"", ""f3e70a15395d82cfd5c9f3c63a349d624453839f""]","[""ComplexClass"", ""DispersedCoupling"", ""FeatureEnvy""]","[""47101af5e75e953c3cdc0916e9053c46"", ""de0d710f7b2d2e60f8ef55b1e462ccfe"", ""e76314c86667892af366d614118cfd37""]","[42, 74, 74]","[380, 171, 171]","[""CC = 13.0"", ""CINT > 8.0, CDISP > 0.5, CC > 1.0"", ""CALLS_TO_org.apache.derby.iapi.sql.conn.LanguageConnectionContext > 4""]","[""b00d3c5fc243e5e223cc3ac1a296d08236b5ac3b"", ""b00d3c5fc243e5e223cc3ac1a296d08236b5ac3b""]","[""ComplexClass"", ""GodClass""]","[""3ee14b5219fdaa400bd29acd911c66cb"", ""9e4965a56a77764db1b07566e735f621""]","[861, 61]","[1400, 1714]","[""CC = 20.0"", ""CLOC > 500, TCC < 0.4808063174919667""]"
Researcher 2,apache_tomcat,21028,"[""Move Method"", ""Move Method"", ""Extract Method"", ""Extract Method""]","[""org.apache.catalina.valves.FastCommonAccessLogValve.backgroundProcess()"", ""org.apache.catalina.valves.AccessLogValve"", ""org.apache.catalina.valves.FastCommonAccessLogValve"", ""org.apache.catalina.valves.AccessLogValve.backgroundProcess()"", ""org.apache.catalina.valves.AccessLogValve.invoke(Request,Response)"", ""org.apache.catalina.valves.AccessLogValve.log(String)""]","[""7bd158f81cb9b77b681c43bdf9c13d03a3301282"", ""7bd158f81cb9b77b681c43bdf9c13d03a3301282"", ""7bd158f81cb9b77b681c43bdf9c13d03a3301282""]","[""FeatureEnvy"", ""FeatureEnvy"", ""FeatureEnvy""]","[""23c3a05cece65df2b4f4038d5378a449"", ""b627cea3eaa1c6d6314180a4827d6912"", ""bab811cfa8c57adde80d6086d0b3735f""]","[77, 127, 150]","[95, 148, 169]","[""{\""MaxCallChain\"": 1.0, \""LocalityRatio\"": 0.0, \""ParameterCount\"": 2.0, \""CyclomaticComplexity\"": 2.0, \""MethodLinesOfCode\"": 12.0}"", ""{\""MaxCallChain\"": 1.0, \""LocalityRatio\"": 0.0, \""ParameterCount\"": 1.0, \""CyclomaticComplexity\"": 5.0, \""MethodLinesOfCode\"": 14.0}"", ""{\""MaxCallChain\"": 2.0, \""LocalityRatio\"": 0.0, \""ParameterCount\"": 1.0, \""CyclomaticComplexity\"": 5.0, \""MethodLinesOfCode\"": 12.0}""]","[""7f2b061699ee61c732a8bc22666b4c987fefdd64"", ""7f2b061699ee61c732a8bc22666b4c987fefdd64""]","[""ComplexClass"", ""LazyClass""]","[""ae976a0720eb899d55efe2994cfa3c52"", ""27f702ff1822f5ab5b9be04865b7ff6f""]","[60, 22]","[2121, -1]","[""CC = 12.0"", ""CLOC < 9.0""]"
Researcher 2,apache_tomcat,21034,"[""Extract Method"", ""Extract Method"", ""Extract Method"", ""Extract Method""]","[""org.apache.tomcat.util.net.NioBlockingSelector.BlockPoller"", ""org.apache.tomcat.util.net.NioBlockingSelector.BlockPoller.remove(KeyAttachment,int)"", ""org.apache.tomcat.util.net.NioBlockingSelector.BlockPoller.wakeup()"", ""org.apache.tomcat.util.net.NioBlockingSelector.BlockPoller.cancelKey(NioChannel,SelectionKey)""]","[""7bd158f81cb9b77b681c43bdf9c13d03a3301282"", ""7bd158f81cb9b77b681c43bdf9c13d03a3301282"", ""7bd158f81cb9b77b681c43bdf9c13d03a3301282""]","[""FeatureEnvy"", ""FeatureEnvy"", ""FeatureEnvy""]","[""23c3a05cece65df2b4f4038d5378a449"", ""b627cea3eaa1c6d6314180a4827d6912"", ""bab811cfa8c57adde80d6086d0b3735f""]","[77, 127, 150]","[95, 148, 169]","[""{\""MaxCallChain\"": 1.0, \""LocalityRatio\"": 0.0, \""ParameterCount\"": 2.0, \""CyclomaticComplexity\"": 2.0, \""MethodLinesOfCode\"": 12.0}"", ""{\""MaxCallChain\"": 1.0, \""LocalityRatio\"": 0.0, \""ParameterCount\"": 1.0, \""CyclomaticComplexity\"": 5.0, \""MethodLinesOfCode\"": 14.0}"", ""{\""MaxCallChain\"": 2.0, \""LocalityRatio\"": 0.0, \""ParameterCount\"": 1.0, \""CyclomaticComplexity\"": 5.0, \""MethodLinesOfCode\"": 12.0}""]","[""7a235aff138fa285938d1804906f5557e0f193c9"", ""7a235aff138fa285938d1804906f5557e0f193c9"", ""7a235aff138fa285938d1804906f5557e0f193c9""]","[""SpaghettiCode"", ""ComplexClass"", ""LongMethod""]","[""73d14287dae0b87a331b8c91d30a176d"", ""ebcefec461273a312c9c55a100ba36fe"", ""2e6ffbfda095d4995199585aa53af510""]","[215, 215, 277]","[405, 405, 316]","[""LONG_METHODS_CONNECTED = 2"", ""CC = 15.0"", ""MLOC > 6.874321358438148""]"
Researcher 2,apache_tomcat,21045,"[""Rename Method"", ""Rename Method"", ""Rename Method"", ""Rename Method"", ""Rename Method"", ""Rename Method"", ""Extract Method"", ""Extract Method"", ""Rename Method"", ""Rename Method""]","[""org.apache.catalina.mbeans.JmxRemoteLifecycleListener.setRmiServerPort(int)"", ""org.apache.catalina.mbeans.JmxRemoteLifecycleListener"", ""org.apache.catalina.mbeans.JmxRemoteLifecycleListener.setRmiServerPortPlatform(int)"", ""org.apache.catalina.mbeans.JmxRemoteLifecycleListener.setRmiRegistryPort(int)"", ""org.apache.catalina.mbeans.JmxRemoteLifecycleListener.setRmiRegistryPortPlatform(int)"", ""org.apache.catalina.mbeans.JmxRemoteLifecycleListener.getRmiRegistryPort()"", ""org.apache.catalina.mbeans.JmxRemoteLifecycleListener.getRmiRegistryPortPlatform()"", ""org.apache.catalina.mbeans.JmxRemoteLifecycleListener.lifecycleEvent(LifecycleEvent)"", ""org.apache.catalina.mbeans.JmxRemoteLifecycleListener.createServer(int,int,HashMap,MBeanServer)"", ""org.apache.catalina.mbeans.JmxRemoteLifecycleListener.getRmiServerPort()"", ""org.apache.catalina.mbeans.JmxRemoteLifecycleListener.getRmiServerPortPlatform()""]","[""4f15aaddb54af30b64a863944f7244b2a94cb7cc"", ""4f15aaddb54af30b64a863944f7244b2a94cb7cc"", ""4f15aaddb54af30b64a863944f7244b2a94cb7cc"", ""4f15aaddb54af30b64a863944f7244b2a94cb7cc"", ""4f15aaddb54af30b64a863944f7244b2a94cb7cc"", ""4f15aaddb54af30b64a863944f7244b2a94cb7cc"", ""4f15aaddb54af30b64a863944f7244b2a94cb7cc""]","[""FeatureEnvy"", ""GodClass"", ""ComplexClass"", ""SpaghettiCode"", ""FeatureEnvy"", ""LongMethod"", ""LongParameterList""]","[""8680b2f02c6c2978cb47189e1bb6d0fe"", ""435c46db3ec0be0a0625124d241a74d7"", ""28ac281746c42a4abd28bd447a2eab4b"", ""def3ad3e0d30fdf4561eef514f2acb93"", ""42f74072fd925565af08480ffc330394"", ""611614be3c4e7dd9a7333730835cf7c3"", ""922ffdf7c990ca82433f72d7f88931dc""]","[1218, 59, 190, 50, 574, 574, 574]","[1237, 1594, 236, 683, 661, 661, 661]","[""{\""MethodLinesOfCode\"": 15.0, \""MaxCallChain\"": 3.0, \""ParameterCount\"": 1.0, \""CyclomaticComplexity\"": 4.0, \""LocalityRatio\"": 0.16666666666666666}"", ""{\""IsAbstract\"": 0.0, \""ClassLinesOfCode\"": 635.0, \""OverrideRatio\"": null, \""PublicFieldCount\"": 0.0, \""TightClassCohesion\"": 0.2178030303030303}"", ""{\""IsAbstract\"": 0.0, \""ClassLinesOfCode\"": 270.0, \""OverrideRatio\"": null, \""PublicFieldCount\"": 0.0, \""TightClassCohesion\"": 0.4380952380952381}"", ""{\""IsAbstract\"": 0.0, \""ClassLinesOfCode\"": 344.0, \""OverrideRatio\"": null, \""PublicFieldCount\"": 0.0, \""TightClassCohesion\"": 0.21645021645021645}"", ""{\""MethodLinesOfCode\"": 39.0, \""LocalityRatio\"": 0.3, \""ParameterCount\"": 4.0, \""CyclomaticComplexity\"": 12.0, \""MaxCallChain\"": 1.0}"", ""{\""MethodLinesOfCode\"": 39.0, \""LocalityRatio\"": 0.3, \""ParameterCount\"": 4.0, \""CyclomaticComplexity\"": 12.0, \""MaxCallChain\"": 1.0}"", ""{\""MethodLinesOfCode\"": 39.0, \""LocalityRatio\"": 0.3, \""ParameterCount\"": 4.0, \""CyclomaticComplexity\"": 12.0, \""MaxCallChain\"": 1.0}""]","[""ea6f489a8f66179eac32abb91440ecf37fcbcaed""]","[""DataClass""]","[""f264500597b7a351d35b289f680be352""]",[49],[366],"[""WOC = 0.1111111111111111, NOPA = 0.0, NOAM = 8.0, WMC = 30.0""]"
Researcher 2,apache_tomcat,21048,"[""Extract Method"", ""Extract Method"", ""Extract Method"", ""Extract Method""]","[""org.apache.catalina.tribes.membership.McastServiceImpl.send(boolean)"", ""org.apache.catalina.tribes.membership.McastServiceImpl"", ""org.apache.catalina.tribes.membership.McastServiceImpl.send(boolean,DatagramPacket)"", ""org.apache.catalina.tribes.membership.McastServiceImpl.receive()"", ""org.apache.catalina.tribes.membership.McastServiceImpl.memberDataReceived(byte)""]","[""aa04d8a9ab856ebb2297e81c7a0a19b2c3fbdbac"", ""aa04d8a9ab856ebb2297e81c7a0a19b2c3fbdbac"", ""aa04d8a9ab856ebb2297e81c7a0a19b2c3fbdbac"", ""aa04d8a9ab856ebb2297e81c7a0a19b2c3fbdbac"", ""aa04d8a9ab856ebb2297e81c7a0a19b2c3fbdbac""]","[""MessageChain"", ""LongParameterList"", ""LongParameterList"", ""MessageChain"", ""FeatureEnvy""]","[""62cc50869154bbb0e6cca7f4699aec84"", ""f4e337df9bfe2e5cd3d353298c5604a2"", ""c79d330f7cd88f2371d2a0452ce100ff"", ""3ded568c6141fb4178b91dc4bdabba86"", ""1d10f7e587072e4dd136e16ebee0884a""]","[275, 275, 293, 293, 367]","[284, 284, 306, 306, 393]","[""{\""MaxCallChain\"": 6.0, \""LocalityRatio\"": 1.0, \""ParameterCount\"": 4.0, \""CyclomaticComplexity\"": 1.0, \""MethodLinesOfCode\"": 3.0}"", ""{\""MaxCallChain\"": 6.0, \""LocalityRatio\"": 1.0, \""ParameterCount\"": 4.0, \""CyclomaticComplexity\"": 1.0, \""MethodLinesOfCode\"": 3.0}"", ""{\""MaxCallChain\"": 9.0, \""LocalityRatio\"": 1.0, \""ParameterCount\"": 4.0, \""CyclomaticComplexity\"": 1.0, \""MethodLinesOfCode\"": 3.0}"", ""{\""MaxCallChain\"": 9.0, \""LocalityRatio\"": 1.0, \""ParameterCount\"": 4.0, \""CyclomaticComplexity\"": 1.0, \""MethodLinesOfCode\"": 3.0}"", ""{\""MaxCallChain\"": 2.0, \""LocalityRatio\"": 0.0, \""ParameterCount\"": 2.0, \""CyclomaticComplexity\"": 6.0, \""MethodLinesOfCode\"": 16.0}""]","[""79514526610c922e98af9ba12cdb8eb4389ddf89"", ""79514526610c922e98af9ba12cdb8eb4389ddf89"", ""79514526610c922e98af9ba12cdb8eb4389ddf89""]","[""FeatureEnvy"", ""IntensiveCoupling"", ""FeatureEnvy""]","[""afa5c1196085ea7b02811120eafd3a22"", ""29bef1a0e33b6817b07ef9281fa5f3e1"", ""36a36998609f5190f98b79e49301045f""]","[485, 332, 332]","[506, 371, 371]","[""CALLS_TO_org.apache.juli.logging.Log > 4"", ""CINT = 9.0, CDISP = 0.3333333333333333, CC > 1.0"", ""CALLS_TO_org.apache.catalina.tribes.io.XByteBuffer > 4""]"
Researcher 2,apache_tomcat,21053,"[""Extract Method"", ""Extract Method"", ""Extract Method"", ""Extract Method"", ""Extract Method"", ""Extract Method""]","[""org.apache.catalina.startup.TldConfig.tldScanJar(File)"", ""org.apache.catalina.startup.TldConfig"", ""org.apache.catalina.startup.TldConfig.processTldsInFileSystem(String)"", ""org.apache.catalina.startup.TldConfig.getJarPaths()"", ""org.apache.catalina.startup.TldConfig.scanJar(JarURLConnection)"", ""org.apache.catalina.startup.TldConfig.execute()""]","[""aa04d8a9ab856ebb2297e81c7a0a19b2c3fbdbac"", ""aa04d8a9ab856ebb2297e81c7a0a19b2c3fbdbac"", ""aa04d8a9ab856ebb2297e81c7a0a19b2c3fbdbac"", ""aa04d8a9ab856ebb2297e81c7a0a19b2c3fbdbac"", ""aa04d8a9ab856ebb2297e81c7a0a19b2c3fbdbac""]","[""MessageChain"", ""LongParameterList"", ""LongParameterList"", ""MessageChain"", ""FeatureEnvy""]","[""62cc50869154bbb0e6cca7f4699aec84"", ""f4e337df9bfe2e5cd3d353298c5604a2"", ""c79d330f7cd88f2371d2a0452ce100ff"", ""3ded568c6141fb4178b91dc4bdabba86"", ""1d10f7e587072e4dd136e16ebee0884a""]","[275, 275, 293, 293, 367]","[284, 284, 306, 306, 393]","[""{\""MaxCallChain\"": 6.0, \""LocalityRatio\"": 1.0, \""ParameterCount\"": 4.0, \""CyclomaticComplexity\"": 1.0, \""MethodLinesOfCode\"": 3.0}"", ""{\""MaxCallChain\"": 6.0, \""LocalityRatio\"": 1.0, \""ParameterCount\"": 4.0, \""CyclomaticComplexity\"": 1.0, \""MethodLinesOfCode\"": 3.0}"", ""{\""MaxCallChain\"": 9.0, \""LocalityRatio\"": 1.0, \""ParameterCount\"": 4.0, \""CyclomaticComplexity\"": 1.0, \""MethodLinesOfCode\"": 3.0}"", ""{\""MaxCallChain\"": 9.0, \""LocalityRatio\"": 1.0, \""ParameterCount\"": 4.0, \""CyclomaticComplexity\"": 1.0, \""MethodLinesOfCode\"": 3.0}"", ""{\""MaxCallChain\"": 2.0, \""LocalityRatio\"": 0.0, \""ParameterCount\"": 2.0, \""CyclomaticComplexity\"": 6.0, \""MethodLinesOfCode\"": 16.0}""]","[""d14348025f94341c5a61f9f1e961c60321fd87c5"", ""d14348025f94341c5a61f9f1e961c60321fd87c5"", ""d14348025f94341c5a61f9f1e961c60321fd87c5"", ""d14348025f94341c5a61f9f1e961c60321fd87c5""]","[""ComplexClass"", ""IntensiveCoupling"", ""LongMethod"", ""FeatureEnvy""]","[""99da0d5b25545ee1e391134b5f467b13"", ""9b416092d6e5bafe342020ce90437121"", ""37fe48847364ea501b27cd769cf8d51a"", ""0916c91a123582dcc620ae619cf44777""]","[52, 370, 370, 370]","[640, 430, 430, 430]","[""CC = 11.0"", ""CINT = 9.0, CDISP = 0.4444444444444444, CC > 1.0"", ""MLOC > 6.384466823010099"", ""CALLS_TO_org.apache.juli.logging.Log > 6""]"
Researcher 2,apache_tomcat,21054,"[""Extract Method"", ""Extract Method"", ""Inline Method"", ""Inline Method""]","[""org.apache.catalina.startup.TldConfig.scanJar(JarURLConnection)"", ""org.apache.catalina.startup.TldConfig"", ""org.apache.catalina.startup.TldConfig.tldScanJar(File)"", ""org.apache.catalina.startup.TldConfig.processTldsInFileSystem(String)"", ""org.apache.catalina.startup.TldConfig.execute()""]","[""af38917c2e2edbd1ff8f3443ca851fb179503b37"", ""af38917c2e2edbd1ff8f3443ca851fb179503b37"", ""af38917c2e2edbd1ff8f3443ca851fb179503b37"", ""af38917c2e2edbd1ff8f3443ca851fb179503b37"", ""af38917c2e2edbd1ff8f3443ca851fb179503b37"", ""af38917c2e2edbd1ff8f3443ca851fb179503b37"", ""af38917c2e2edbd1ff8f3443ca851fb179503b37""]","[""ComplexClass"", ""IntensiveCoupling"", ""MessageChain"", ""FeatureEnvy"", ""IntensiveCoupling"", ""MessageChain"", ""FeatureEnvy""]","[""e7e9dd27b950a8327c8bf43426789157"", ""363c88ae4960c54634a9fd4a0cc27974"", ""19875db0dfedc3d7962f3b89c91713bb"", ""4747c24343dcb99dbded06e017586b86"", ""49f0379414e127c204f619844a3d58ac"", ""5706cbf87918b4799509c0ded1a9b654"", ""57a9f101d78a75def9c48e40c72feef2""]","[24, 112, 112, 112, 68, 68, 68]","[146, 159, 159, 159, 109, 109, 109]","[""CC = 11.0"", ""CINT = 11.0, CDISP = 0.45454545454545453, CC > 1.0"", ""MAX_CALL_CHAIN = 4.0"", ""CALLS_TO_org.apache.catalina.websocket.WsFrame > 10"", ""CINT = 11.0, CDISP = 0.45454545454545453, CC > 1.0"", ""MAX_CALL_CHAIN = 4.0"", ""CALLS_TO_org.apache.catalina.websocket.WsFrame > 10""]","[""8ecc444737d18d87d293964e0e66442ec75f8943"", ""8ecc444737d18d87d293964e0e66442ec75f8943"", ""8ecc444737d18d87d293964e0e66442ec75f8943""]","[""ComplexClass"", ""IntensiveCoupling"", ""FeatureEnvy""]","[""99da0d5b25545ee1e391134b5f467b13"", ""ab5388b2c806344630b29a2b668f537c"", ""e075b9858d25acbdf1cf9e15ac182f2b""]","[52, 288, 377]","[640, 335, 426]","[""CC = 11.0"", ""CINT = 9.0, CDISP = 0.4444444444444444, CC > 1.0"", ""CALLS_TO_org.apache.juli.logging.Log > 4""]"
Researcher 2,apache_tomcat,21058,"[""Extract Method"", ""Extract Method"", ""Extract Method"", ""Extract Method"", ""Extract Method"", ""Extract Method"", ""Extract Method"", ""Extract Method"", ""Extract Method"", ""Extract Method""]","[""org.apache.catalina.startup.ContextConfig.applicationWebConfig()"", ""org.apache.catalina.startup.ContextConfig"", ""org.apache.catalina.startup.ContextConfig.getContextWebXmlSource()"", ""org.apache.catalina.startup.ContextConfig.getHostWebXmlSource()"", ""org.apache.catalina.startup.ContextConfig.getWebXmlSource(String,String)"", ""org.apache.catalina.startup.ContextConfig.defaultWebConfig()"", ""org.apache.catalina.startup.ContextConfig.parseWebXml(InputSource,WebXml)""]","[""87b68476a7262d77504a2298fcc6c43950cfbaa3"", ""87b68476a7262d77504a2298fcc6c43950cfbaa3"", ""87b68476a7262d77504a2298fcc6c43950cfbaa3"", ""87b68476a7262d77504a2298fcc6c43950cfbaa3"", ""87b68476a7262d77504a2298fcc6c43950cfbaa3"", ""87b68476a7262d77504a2298fcc6c43950cfbaa3"", ""87b68476a7262d77504a2298fcc6c43950cfbaa3"", ""87b68476a7262d77504a2298fcc6c43950cfbaa3"", ""87b68476a7262d77504a2298fcc6c43950cfbaa3""]","[""ComplexClass"", ""IntensiveCoupling"", ""LongMethod"", ""FeatureEnvy"", ""IntensiveCoupling"", ""LongMethod"", ""FeatureEnvy"", ""FeatureEnvy"", ""FeatureEnvy""]","[""42b702c4678590679c1b46ea81067630"", ""b93aaf0a5215460d38438fb453481c7f"", ""12b9f0fa68a8a2c2cc924b8d3a3e8beb"", ""87ab908c332d3342b138608fdbe043e5"", ""b93aaf0a5215460d38438fb453481c7f"", ""12b9f0fa68a8a2c2cc924b8d3a3e8beb"", ""87ab908c332d3342b138608fdbe043e5"", ""dede91246995e8e40f8934d9b1d4ef86"", ""dede91246995e8e40f8934d9b1d4ef86""]","[40, 253, 253, 253, 253, 253, 253, 89, 89]","[436, 364, 364, 364, 364, 364, 364, 132, 132]","[""CC = 13.0"", ""CINT = 21.0, CDISP = 0.38095238095238093, CC > 1.0"", ""MLOC > 6.860470910676364"", ""CALLS_TO_org.apache.catalina.deploy.NamingResources > 5"", ""CINT = 21.0, CDISP = 0.38095238095238093, CC > 1.0"", ""MLOC > 6.860470910676364"", ""CALLS_TO_org.apache.catalina.deploy.NamingResources > 5"", ""CALLS_TO_org.apache.catalina.Wrapper > 4"", ""CALLS_TO_org.apache.catalina.Wrapper > 4""]","[""a5b512b26cec25323c7639a7cc8990c790ea5c38"", ""a5b512b26cec25323c7639a7cc8990c790ea5c38"", ""a5b512b26cec25323c7639a7cc8990c790ea5c38"", ""a5b512b26cec25323c7639a7cc8990c790ea5c38"", ""a5b512b26cec25323c7639a7cc8990c790ea5c38"", ""a5b512b26cec25323c7639a7cc8990c790ea5c38"", ""a5b512b26cec25323c7639a7cc8990c790ea5c38""]","[""IntensiveCoupling"", ""FeatureEnvy"", ""MessageChain"", ""SpaghettiCode"", ""ComplexClass"", ""GodClass"", ""FeatureEnvy""]","[""3021c2abb12061a9d55a4231a02a5106"", ""bec820a615c557d23e8c0224d376a8ef"", ""2902cb0149d35d995f8bc8258f2b4d12"", ""e793f4451c1a592370615b3c5a198607"", ""af28c6e13bdd320b850068a72aab2231"", ""7628ef6afa559ce2cc0d3adb2b511c2c"", ""0adc7e04fe92a233fae0040fff0b315e""]","[1733, 1733, 1791, 111, 111, 111, 1299]","[1789, 1789, 1830, 2610, 2610, 2610, 1340]","[""CINT = 9.0, CDISP = 0.4444444444444444, CC > 1.0"", ""CALLS_TO_org.apache.juli.logging.Log > 5"", ""MAX_CALL_CHAIN = 5.0"", ""LONG_METHODS_CONNECTED = 12"", ""CC = 14.0"", ""CLOC > 500, TCC < 0.48007932503269046"", ""CALLS_TO_org.apache.tomcat.util.digester.Digester > 4""]"
Researcher 2,apache_tomcat,21069,"[""Extract Method"", ""Extract Method"", ""Extract Method"", ""Extract Method""]","[""org.apache.catalina.loader.WebappClassLoader.clearReferences()"", ""org.apache.catalina.loader.WebappClassLoader"", ""org.apache.catalina.loader.WebappClassLoader.clearReferencesJdbc()"", ""org.apache.catalina.loader.WebappClassLoader.clearReferencesStaticFinal()""]","[""87b68476a7262d77504a2298fcc6c43950cfbaa3"", ""87b68476a7262d77504a2298fcc6c43950cfbaa3"", ""87b68476a7262d77504a2298fcc6c43950cfbaa3"", ""87b68476a7262d77504a2298fcc6c43950cfbaa3"", ""87b68476a7262d77504a2298fcc6c43950cfbaa3"", ""87b68476a7262d77504a2298fcc6c43950cfbaa3"", ""87b68476a7262d77504a2298fcc6c43950cfbaa3"", ""87b68476a7262d77504a2298fcc6c43950cfbaa3"", ""87b68476a7262d77504a2298fcc6c43950cfbaa3""]","[""ComplexClass"", ""IntensiveCoupling"", ""LongMethod"", ""FeatureEnvy"", ""IntensiveCoupling"", ""LongMethod"", ""FeatureEnvy"", ""FeatureEnvy"", ""FeatureEnvy""]","[""42b702c4678590679c1b46ea81067630"", ""b93aaf0a5215460d38438fb453481c7f"", ""12b9f0fa68a8a2c2cc924b8d3a3e8beb"", ""87ab908c332d3342b138608fdbe043e5"", ""b93aaf0a5215460d38438fb453481c7f"", ""12b9f0fa68a8a2c2cc924b8d3a3e8beb"", ""87ab908c332d3342b138608fdbe043e5"", ""dede91246995e8e40f8934d9b1d4ef86"", ""dede91246995e8e40f8934d9b1d4ef86""]","[40, 253, 253, 253, 253, 253, 253, 89, 89]","[436, 364, 364, 364, 364, 364, 364, 132, 132]","[""CC = 13.0"", ""CINT = 21.0, CDISP = 0.38095238095238093, CC > 1.0"", ""MLOC > 6.860470910676364"", ""CALLS_TO_org.apache.catalina.deploy.NamingResources > 5"", ""CINT = 21.0, CDISP = 0.38095238095238093, CC > 1.0"", ""MLOC > 6.860470910676364"", ""CALLS_TO_org.apache.catalina.deploy.NamingResources > 5"", ""CALLS_TO_org.apache.catalina.Wrapper > 4"", ""CALLS_TO_org.apache.catalina.Wrapper > 4""]","[""271d83a3c4503223c4d06459f5231a776865b2ac"", ""271d83a3c4503223c4d06459f5231a776865b2ac"", ""271d83a3c4503223c4d06459f5231a776865b2ac"", ""271d83a3c4503223c4d06459f5231a776865b2ac"", ""271d83a3c4503223c4d06459f5231a776865b2ac"", ""271d83a3c4503223c4d06459f5231a776865b2ac"", ""271d83a3c4503223c4d06459f5231a776865b2ac""]","[""BrainClass"", ""SpaghettiCode"", ""ComplexClass"", ""ClassDataShouldBePrivate"", ""GodClass"", ""LongMethod"", ""FeatureEnvy""]","[""e72b059394d80d481ecb7b467a2421fa"", ""6262ce80aa9081f6fa082b972e7310d7"", ""196cb4a294ca464d557135e06a49eab4"", ""a1f05753fa578a8d7787c84655b4fa0d"", ""29a5efe23f2d2eb4f62c633efd95ac9c"", ""d46b2ca3e762db063150be51c9832af9"", ""514a7bb2d01a92204556b33cae669fc6""]","[73, 73, 73, 73, 73, 1827, 1827]","[3168, 3168, 3168, 3168, 3168, 1901, 1901]","[""BRAIN_METHODS = 1, WMC = 458.0, TCC = 0.10048309178743961"", ""LONG_METHODS_CONNECTED = 13"", ""CC = 13.0"", ""PUBLIC_FIELD_COUNT = 1.0"", ""CLOC > 500, TCC < 0.48007932503269046"", ""MLOC > 6.874321358438148"", ""CALLS_TO_org.apache.juli.logging.Log > 6""]"
Researcher 2,apache_tomcat,21097,"[""Extract Method"", ""Extract Method"", ""Extract Method"", ""Extract Method"", ""Extract Method"", ""Extract Method"", ""Extract Method"", ""Extract Method""]","[""org.apache.catalina.session.MResearcher 1gerBase"", ""org.apache.catalina.session.MResearcher 1gerBase.destroyInternal()"", ""org.apache.catalina.session.MResearcher 1gerBase.closeRandomFile()"", ""org.apache.catalina.session.MResearcher 1gerBase.getRandom()"", ""org.apache.catalina.session.MResearcher 1gerBase.createRandomSeed()"", ""org.apache.catalina.session.MResearcher 1gerBase.getRandomBytes(byte)"", ""org.apache.catalina.session.MResearcher 1gerBase.setRandomFile(String)""]","[""4618e42968e29d1049b2c6fb70189fcc1b1a4c0e"", ""4618e42968e29d1049b2c6fb70189fcc1b1a4c0e"", ""4618e42968e29d1049b2c6fb70189fcc1b1a4c0e"", ""4618e42968e29d1049b2c6fb70189fcc1b1a4c0e"", ""4618e42968e29d1049b2c6fb70189fcc1b1a4c0e"", ""4618e42968e29d1049b2c6fb70189fcc1b1a4c0e"", ""4618e42968e29d1049b2c6fb70189fcc1b1a4c0e"", ""4618e42968e29d1049b2c6fb70189fcc1b1a4c0e""]","[""SpaghettiCode"", ""ComplexClass"", ""ClassDataShouldBePrivate"", ""GodClass"", ""LongMethod"", ""FeatureEnvy"", ""IntensiveCoupling"", ""LongMethod""]","[""e793f4451c1a592370615b3c5a198607"", ""af28c6e13bdd320b850068a72aab2231"", ""55bb1fc1b4d1c0b2288663665fb615fd"", ""7628ef6afa559ce2cc0d3adb2b511c2c"", ""0e7acc496b3a08fe9f6425241c96707e"", ""9cd424f8d7a789655e0ee223c762f9bb"", ""a22dfa2c16fc0555324d356795c1f69b"", ""89b84e10d5903f2487fe6ee7ece233f5""]","[111, 111, 111, 111, 1918, 1918, 1134, 1134]","[2610, 2610, 2610, 2610, 1970, 1970, 1313, 1313]","[""LONG_METHODS_CONNECTED = 12"", ""CC = 14.0"", ""PUBLIC_FIELD_COUNT = 2.0"", ""CLOC > 500, TCC < 0.48007932503269046"", ""MLOC > 6.818674884437523"", ""CALLS_TO_org.apache.tomcat.util.res.StringMResearcher 1ger > 4"", ""CINT = 28.0, CDISP = 0.2857142857142857, CC > 1.0"", ""MLOC > 6.83012326656397""]","[""9de5b036c094f0378d06bdec7ae96db75ae3a06a"", ""9de5b036c094f0378d06bdec7ae96db75ae3a06a""]","[""ComplexClass"", ""GodClass""]","[""97466b0eeb7ea8ea87f90c54e7598338"", ""f6e13883eac9613daecf0410be900853""]","[56, 60]","[1434, 1506]","[""CC = 14.0"", ""CLOC > 500, TCC < 0.4406466403853435""]"
Researcher 2,apache_tomcat,21116,"[""Extract Method"", ""Extract Method"", ""Extract Method"", ""Extract Method"", ""Extract Method"", ""Extract Method"", ""Extract Method"", ""Extract Method""]","[""org.apache.tomcat.util.net.jsse.JSSESocketFactory.init()"", ""org.apache.tomcat.util.net.jsse.JSSESocketFactory"", ""org.apache.tomcat.util.net.jsse.JSSESocketFactory.getTrustMResearcher 1gers()"", ""org.apache.tomcat.util.net.jsse.JSSESocketFactory.createSSLContext()"", ""org.apache.tomcat.util.net.jsse.JSSESocketFactory.configureSessionContext(SSLSessionContext)"", ""org.apache.tomcat.util.net.jsse.JSSESocketFactory.getKeyMResearcher 1gers()""]","[""33c0210cf9f81765dc4db22c6a5e040a57f76290"", ""33c0210cf9f81765dc4db22c6a5e040a57f76290"", ""33c0210cf9f81765dc4db22c6a5e040a57f76290"", ""33c0210cf9f81765dc4db22c6a5e040a57f76290"", ""33c0210cf9f81765dc4db22c6a5e040a57f76290""]","[""DispersedCoupling"", ""FeatureEnvy"", ""DispersedCoupling"", ""LongMethod"", ""ComplexClass""]","[""4dc068d39900157ee5482529ae4fdfcd"", ""9f393b389188e24ede7a693de1ffeeb7"", ""699b2703b566f6cf998ebd48363579b6"", ""77c94ec633d7391cd6557423bded2668"", ""ad7eb915ee3e90266d6cf8ee7fc1ac44""]","[1337, 1337, 1233, 1585, 1248]","[1373, 1373, 1335, 1896, 1897]","[""CINT > 8.0, CDISP > 0.5, CC > 1.0"", ""CALLS_TO_org.apache.tomcat.util.net.AprEndpoint > 4"", ""CINT > 8.0, CDISP > 0.5, CC > 1.0"", ""MLOC > 6.875267202033578"", ""CC = 73.0""]","[""9011d1d577d4b20d3b6934f494c1c99473017c4c"", ""9011d1d577d4b20d3b6934f494c1c99473017c4c"", ""9011d1d577d4b20d3b6934f494c1c99473017c4c"", ""9011d1d577d4b20d3b6934f494c1c99473017c4c""]","[""ComplexClass"", ""FeatureEnvy"", ""FeatureEnvy"", ""IntensiveCoupling""]","[""43043e0c060de51d1e98626fffad5b9d"", ""408ac31e5478a5b286a4b52231c62ce3"", ""b55f609c6bd43c31864e7fe610a3f544"", ""c32821c330e476aff5202930b25afb6f""]","[70, 492, 524, 423]","[800, 506, 543, 465]","[""CC = 15.0"", ""CALLS_TO_org.apache.tomcat.util.net.AbstractEndpoint > 4"", ""CALLS_TO_org.apache.tomcat.util.net.AbstractEndpoint > 4"", ""CINT = 9.0, CDISP = 0.3333333333333333, CC > 1.0""]"