complete-composites-argouml.csv
Validator,projectName,Batch ID,Refactorings,Code Elements,Start Commit,Smells Before,Smell Before IDs,Smells Before Starting Line,Smell Before Ending Line,Smell Before Reason,End Commit,Smells After,Smell After IDs,Smells After Starting Line,Smell After Ending Line,Smell After Reason
Researcher 2,argouml,21197,"[""Extract Method"", ""Extract Method"", ""Extract Method"", ""Extract Method""]","[""uci.gef.Fig"", ""uci.gef.Fig.endTrans"", ""uci.gef.Fig.damage"", ""uci.gef.Fig.startTrans""]","[""33c0210cf9f81765dc4db22c6a5e040a57f76290"", ""33c0210cf9f81765dc4db22c6a5e040a57f76290"", ""33c0210cf9f81765dc4db22c6a5e040a57f76290"", ""33c0210cf9f81765dc4db22c6a5e040a57f76290"", ""33c0210cf9f81765dc4db22c6a5e040a57f76290""]","[""DispersedCoupling"", ""FeatureEnvy"", ""DispersedCoupling"", ""LongMethod"", ""ComplexClass""]","[""4dc068d39900157ee5482529ae4fdfcd"", ""9f393b389188e24ede7a693de1ffeeb7"", ""699b2703b566f6cf998ebd48363579b6"", ""77c94ec633d7391cd6557423bded2668"", ""ad7eb915ee3e90266d6cf8ee7fc1ac44""]","[1337, 1337, 1233, 1585, 1248]","[1373, 1373, 1335, 1896, 1897]","[""CINT > 8.0, CDISP > 0.5, CC > 1.0"", ""CALLS_TO_org.apache.tomcat.util.net.AprEndpoint > 4"", ""CINT > 8.0, CDISP > 0.5, CC > 1.0"", ""MLOC > 6.875267202033578"", ""CC = 73.0""]","[""8f98e628eceb8e2fdd33630396d222ee7ccd33fb"", ""8f98e628eceb8e2fdd33630396d222ee7ccd33fb""]","[""ClassDataShouldBePrivate"", ""FeatureEnvy""]","[""5e17a93cc482175c5e49910f49c9eee7"", ""127b5ce2e77c04f3d131ca1063a00ab3""]","[32, 296]","[599, 296]","[""{\""IsAbstract\"": 0.0, \""ClassLinesOfCode\"": 306.0, \""OverrideRatio\"": null, \""PublicFieldCount\"": 1.0, \""TightClassCohesion\"": 0.07654127481713689}"", ""{\""MaxCallChain\"": 1.0, \""LocalityRatio\"": 0.0, \""ParameterCount\"": 0.0, \""CyclomaticComplexity\"": 2.0, \""MethodLinesOfCode\"": 3.0}""]"
Researcher 2,argouml,21205,"[""Extract Method"", ""Extract Method"", ""Extract Method"", ""Extract Method"", ""Extract Method"", ""Extract Method""]","[""uci.uml.ui.GoModelToAssociation"", ""uci.uml.ui.GoModelToAssociation.getChild"", ""uci.uml.ui.GoModelToAssociation.getChildren"", ""uci.uml.ui.GoModelToAssociation.getChildCount"", ""uci.uml.ui.GoModelToAssociation.getIndexOfChild""]","[""d93a871fbf3705ee00a7dabb4279ecec924a3ec4"", ""d93a871fbf3705ee00a7dabb4279ecec924a3ec4"", ""d93a871fbf3705ee00a7dabb4279ecec924a3ec4"", ""d93a871fbf3705ee00a7dabb4279ecec924a3ec4"", ""d93a871fbf3705ee00a7dabb4279ecec924a3ec4"", ""d93a871fbf3705ee00a7dabb4279ecec924a3ec4"", ""d93a871fbf3705ee00a7dabb4279ecec924a3ec4"", ""d93a871fbf3705ee00a7dabb4279ecec924a3ec4"", ""d93a871fbf3705ee00a7dabb4279ecec924a3ec4"", ""d93a871fbf3705ee00a7dabb4279ecec924a3ec4"", ""d93a871fbf3705ee00a7dabb4279ecec924a3ec4"", ""d93a871fbf3705ee00a7dabb4279ecec924a3ec4"", ""d93a871fbf3705ee00a7dabb4279ecec924a3ec4""]","[""SpaghettiCode"", ""ComplexClass"", ""GodClass"", ""DispersedCoupling"", ""LongParameterList"", ""LongMethod"", ""FeatureEnvy"", ""IntensiveCoupling"", ""LongParameterList"", ""LongMethod"", ""FeatureEnvy"", ""DispersedCoupling"", ""LongParameterList""]","[""1434b7ffac84302178b2297ac9cfa81c"", ""d03dd66d53ec9c8d381aad5a4618109e"", ""d81c7d5588186f700b84773711c8d4d5"", ""dacd321dc007b9bc92e4add0d899e42d"", ""d61e572d856d2fd4bbf5b5266c885a0e"", ""b9bc1061056c0cc2d5846208bf569556"", ""b92a47e72645797f84db3ac2d12335fb"", ""da95219f5cf1ebeddebc6c8e350d38c5"", ""a44303e26a436e23bbf0faa0611ffa11"", ""094fa40f0f61aaee5d8086dbb640fafb"", ""3467b8fcc3100f36d115ca1f643edd70"", ""7682cffb41ac656aa44c581e6f5c0e53"", ""e3259baa723c50aeb1698aab27013034""]","[66, 66, 66, 796, 796, 796, 802, 631, 631, 631, 621, 735, 729]","[1686, 1686, 1686, 912, 912, 912, 926, 726, 726, 726, 732, 799, 793]","[""LONG_METHODS_CONNECTED = 8"", ""CC = 39.0"", ""CLOC > 500, TCC < 0.4808063174919667"", ""CINT > 8.0, CDISP > 0.5, CC > 1.0"", ""PARAMETER_COUNT > 0.9462862423472285"", ""MLOC > 6.874321358438148"", ""CALLS_TO_org.apache.tomcat.util.res.StringMResearcher 1ger > 9"", ""CINT = 17.0, CDISP = 0.4117647058823529, CC > 1.0"", ""PARAMETER_COUNT > 0.9462862423472285"", ""MLOC > 6.874321358438148"", ""CALLS_TO_org.apache.tomcat.util.res.StringMResearcher 1ger > 8"", ""CINT > 8.0, CDISP > 0.5, CC > 1.0"", ""PARAMETER_COUNT > 0.9462862423472285""]","[""418a515a9002b3481ee69e40ac8672b44f2f1435"", ""418a515a9002b3481ee69e40ac8672b44f2f1435""]","[""FeatureEnvy"", ""FeatureEnvy""]","[""1b73f3863216eb745add1525031293bd"", ""10e306299afdee6f46dda2edcef0f568""]","[113, 48]","[125, 60]","[""{\""MethodLinesOfCode\"": 8.0, \""MaxCallChain\"": 1.0, \""ParameterCount\"": 1.0, \""CyclomaticComplexity\"": 3.0, \""LocalityRatio\"": 0.0}"", ""{\""LocalityRatio\"": 0.0, \""ParameterCount\"": 2.0, \""CyclomaticComplexity\"": 5.0, \""MethodLinesOfCode\"": 12.0, \""MaxCallChain\"": 1.0}""]"
Researcher 2,argouml,21224,"[""Move Attribute"", ""Move Attribute"", ""Extract Method"", ""Extract Method"", ""Extract Method"", ""Extract Method"", ""Move Attribute"", ""Move Attribute"", ""Move Attribute"", ""Move Attribute""]","[""org.argouml.kernel.Project"", ""org.argouml.uml.ui.ActionSaveProject"", ""org.argouml.uml.ui.ActionSaveProject.trySave"", ""org.argouml.uml.ui.ActionSaveProjectAs.trySave"", ""org.argouml.uml.ui.ActionSaveProjectAs"", ""org.argouml.uml.ui.ActionSaveProjectAs.getNewFile""]","[""ff21649bd0b06e248d90ca820202f822081f3989""]","[""FeatureEnvy""]","[""40115cc62b44acb1a07d7ed5777ea927""]",[352],[400],"[""CALLS_TO_org.apache.tomcat.util.buf.ByteBufferHolder > 4""]","[""383f04328166cf23d65bff714448c792fa94b0bb"", ""383f04328166cf23d65bff714448c792fa94b0bb"", ""383f04328166cf23d65bff714448c792fa94b0bb"", ""383f04328166cf23d65bff714448c792fa94b0bb"", ""383f04328166cf23d65bff714448c792fa94b0bb"", ""383f04328166cf23d65bff714448c792fa94b0bb"", ""383f04328166cf23d65bff714448c792fa94b0bb""]","[""FeatureEnvy"", ""SpaghettiCode"", ""ComplexClass"", ""ClassDataShouldBePrivate"", ""GodClass"", ""FeatureEnvy"", ""FeatureEnvy""]","[""a2a8d5517d5c62ac85abfb13418dc01d"", ""3e037ad8bbc199a4f9436d1f811550cc"", ""a5d8c6dd6c4e101438d79cf43379cee4"", ""f4068142930528628c266503eab3f2e4"", ""a923c9e6dc2c6f22c48a86a9a3ec4282"", ""3521172f9a72572b9e37677f8f421114"", ""55cbc78063eaa4fcf136ab9bada74fbc""]","[69, 60, 832, 60, 63, 71, 74]","[180, 926, 887, 926, 1027, 141, 104]","[""{\""MethodLinesOfCode\"": 45.0, \""LocalityRatio\"": 0.0, \""CyclomaticComplexity\"": 8.0, \""ParameterCount\"": 1.0, \""MaxCallChain\"": 2.0}"", ""{\""IsAbstract\"": 0.0, \""ClassLinesOfCode\"": 500.0, \""OverrideRatio\"": null, \""TightClassCohesion\"": 0.050921861281826165, \""PublicFieldCount\"": 14.0}"", ""{\""IsAbstract\"": 0.0, \""ClassLinesOfCode\"": 500.0, \""OverrideRatio\"": null, \""TightClassCohesion\"": 0.050921861281826165, \""PublicFieldCount\"": 14.0}"", ""{\""IsAbstract\"": 0.0, \""ClassLinesOfCode\"": 500.0, \""OverrideRatio\"": null, \""TightClassCohesion\"": 0.050921861281826165, \""PublicFieldCount\"": 14.0}"", ""{\""IsAbstract\"": 0.0, \""ClassLinesOfCode\"": 552.0, \""OverrideRatio\"": null, \""TightClassCohesion\"": 0.04886128364389234, \""PublicFieldCount\"": 14.0}"", ""{\""MethodLinesOfCode\"": 48.0, \""LocalityRatio\"": 0.0, \""CyclomaticComplexity\"": 13.0, \""ParameterCount\"": 1.0, \""MaxCallChain\"": 3.0}"", ""{\""LocalityRatio\"": 0.0, \""MaxCallChain\"": 3.0, \""ParameterCount\"": 0.0, \""CyclomaticComplexity\"": 5.0, \""MethodLinesOfCode\"": 19.0}""]"
Researcher 2,argouml,21227,"[""Extract Method"", ""Extract Method"", ""Extract Method"", ""Extract Method""]","[""org.argouml.uml.MMUtil.buildOperation"", ""org.argouml.uml.MMUtil"", ""org.argouml.uml.MMUtil.buildAttribute""]","[""ff21649bd0b06e248d90ca820202f822081f3989""]","[""FeatureEnvy""]","[""40115cc62b44acb1a07d7ed5777ea927""]",[352],[400],"[""CALLS_TO_org.apache.tomcat.util.buf.ByteBufferHolder > 4""]","[""84a6b1c3b22087230526dab3331cabc35692a0dd""]","[""FeatureEnvy""]","[""8fd3987138b3c9f043c7f54b3a070772""]",[446],[458],"[""{\""LocalityRatio\"": 0.0, \""MaxCallChain\"": 2.0, \""ParameterCount\"": 1.0, \""CyclomaticComplexity\"": 1.0, \""MethodLinesOfCode\"": 10.0}""]"
Researcher 2,argouml,21229,"[""Extract Method"", ""Extract Method"", ""Extract Method"", ""Extract Method"", ""Extract Method"", ""Extract Method""]","[""org.argouml.uml.ui.UMLTextField"", ""org.argouml.uml.ui.UMLTextField.insertUpdate"", ""org.argouml.uml.ui.UMLTextField.handleEvent"", ""org.argouml.uml.ui.UMLTextField.removeUpdate"", ""org.argouml.uml.ui.UMLTextField.changedUpdate""]","[""711d8e3637b6e2416c6ea543816135104b9b8e3d"", ""711d8e3637b6e2416c6ea543816135104b9b8e3d"", ""711d8e3637b6e2416c6ea543816135104b9b8e3d"", ""711d8e3637b6e2416c6ea543816135104b9b8e3d"", ""711d8e3637b6e2416c6ea543816135104b9b8e3d""]","[""SpaghettiCode"", ""ComplexClass"", ""IntensiveCoupling"", ""LongMethod"", ""FeatureEnvy""]","[""f1aa4a5142718ec018119ca7c9f27b25"", ""998f9be5d0893a1f2c562489ce132175"", ""4bf80d4f492d0b75ab6302f21b998c6d"", ""4ffb846832700db72bad394eb844eba9"", ""05fb0610b4ce15504db6da9308fafc3d""]","[61, 57, 104, 104, 104]","[669, 632, 149, 161, 190]","[""LONG_METHODS_CONNECTED = 4"", ""CC = 13.0"", ""CINT = 15.0, CDISP = 0.4666666666666667, CC > 1.0"", ""MLOC > 6.68791252093383"", ""CALLS_TO_org.apache.juli.logging.Log > 12""]","[""ea6f470330a40effd56a11bc16ded2a6b1321a45"", ""ea6f470330a40effd56a11bc16ded2a6b1321a45""]","[""FeatureEnvy"", ""ComplexClass""]","[""13ee35f59e5553be6e97c1161069ae42"", ""a67f6edd26d5a27278a780960d3cf395""]","[408, 118]","[422, 225]","[""{\""LocalityRatio\"": 0.2, \""MaxCallChain\"": 2.0, \""ParameterCount\"": 0.0, \""CyclomaticComplexity\"": 2.0, \""MethodLinesOfCode\"": 7.0}"", ""{\""IsAbstract\"": 0.0, \""ClassLinesOfCode\"": 73.0, \""OverrideRatio\"": 0.0, \""TightClassCohesion\"": 0.22727272727272727, \""PublicFieldCount\"": 0.0}""]"
Researcher 2,argouml,21234,"[""Inline Method"", ""Inline Method"", ""Extract Method"", ""Extract Method""]","[""org.argouml.uml.generator.ParserDisplay.findMsgRoot"", ""org.argouml.uml.generator.ParserDisplay.parseMessage"", ""org.argouml.uml.generator.ParserDisplay"", ""org.argouml.uml.generator.ParserDisplay.walk""]","[""711d8e3637b6e2416c6ea543816135104b9b8e3d"", ""711d8e3637b6e2416c6ea543816135104b9b8e3d"", ""711d8e3637b6e2416c6ea543816135104b9b8e3d"", ""711d8e3637b6e2416c6ea543816135104b9b8e3d"", ""711d8e3637b6e2416c6ea543816135104b9b8e3d""]","[""SpaghettiCode"", ""ComplexClass"", ""IntensiveCoupling"", ""LongMethod"", ""FeatureEnvy""]","[""f1aa4a5142718ec018119ca7c9f27b25"", ""998f9be5d0893a1f2c562489ce132175"", ""4bf80d4f492d0b75ab6302f21b998c6d"", ""4ffb846832700db72bad394eb844eba9"", ""05fb0610b4ce15504db6da9308fafc3d""]","[61, 57, 104, 104, 104]","[669, 632, 149, 161, 190]","[""LONG_METHODS_CONNECTED = 4"", ""CC = 13.0"", ""CINT = 15.0, CDISP = 0.4666666666666667, CC > 1.0"", ""MLOC > 6.68791252093383"", ""CALLS_TO_org.apache.juli.logging.Log > 12""]","[""374354d3d64336b9d84479fdb02a3f45cfe962ee"", ""374354d3d64336b9d84479fdb02a3f45cfe962ee"", ""374354d3d64336b9d84479fdb02a3f45cfe962ee"", ""374354d3d64336b9d84479fdb02a3f45cfe962ee"", ""374354d3d64336b9d84479fdb02a3f45cfe962ee"", ""374354d3d64336b9d84479fdb02a3f45cfe962ee"", ""374354d3d64336b9d84479fdb02a3f45cfe962ee"", ""374354d3d64336b9d84479fdb02a3f45cfe962ee""]","[""MessageChain"", ""FeatureEnvy"", ""LongMethod"", ""SpaghettiCode"", ""RefusedBequest"", ""ComplexClass"", ""GodClass"", ""FeatureEnvy""]","[""763fe0e97efe23dd0121aef4553a329d"", ""f05aa7c02f5dde47e413ec2a69dc1ff6"", ""9564b7174e3906bee951df4fdd892061"", ""9c9e7c4c4af966339524749e7a9c7325"", ""5bda39f7c09bbe35f1bbecd8528d2a4a"", ""79aece39a8460563d30615760079c868"", ""11d217c5c4502de050a99b907d368f44"", ""a3c49f5d6cf64d1ff5c57072dcc67718""]","[2015, 2015, 2015, 155, 155, 182, 155, 2609]","[2581, 2581, 2581, 2109, 2109, 295, 2109, 2618]","[""{\""MethodLinesOfCode\"": 311.0, \""MaxCallChain\"": 4.0, \""ParameterCount\"": 2.0, \""CyclomaticComplexity\"": 107.0, \""LocalityRatio\"": 0.07111111111111111}"", ""{\""MethodLinesOfCode\"": 311.0, \""MaxCallChain\"": 4.0, \""ParameterCount\"": 2.0, \""CyclomaticComplexity\"": 107.0, \""LocalityRatio\"": 0.07111111111111111}"", ""{\""MethodLinesOfCode\"": 311.0, \""MaxCallChain\"": 4.0, \""ParameterCount\"": 2.0, \""CyclomaticComplexity\"": 107.0, \""LocalityRatio\"": 0.07111111111111111}"", ""{\""IsAbstract\"": 0.0, \""ClassLinesOfCode\"": 963.0, \""OverrideRatio\"": 0.5333333333333333, \""TightClassCohesion\"": 0.0026455026455026454, \""PublicFieldCount\"": 0.0}"", ""{\""IsAbstract\"": 0.0, \""ClassLinesOfCode\"": 963.0, \""OverrideRatio\"": 0.5333333333333333, \""TightClassCohesion\"": 0.0026455026455026454, \""PublicFieldCount\"": 0.0}"", ""{\""IsAbstract\"": 0.0, \""ClassLinesOfCode\"": 963.0, \""OverrideRatio\"": 0.5333333333333333, \""TightClassCohesion\"": 0.0026455026455026454, \""PublicFieldCount\"": 0.0}"", ""{\""IsAbstract\"": 0.0, \""ClassLinesOfCode\"": 963.0, \""OverrideRatio\"": 0.5333333333333333, \""TightClassCohesion\"": 0.0026455026455026454, \""PublicFieldCount\"": 0.0}"", ""{\""MethodLinesOfCode\"": 8.0, \""MaxCallChain\"": 2.0, \""ParameterCount\"": 2.0, \""CyclomaticComplexity\"": 3.0, \""LocalityRatio\"": 0.0}""]"
Researcher 2,argouml,21244,"[""Extract Method"", ""Extract Method"", ""Extract Method"", ""Extract Method""]","[""org.argouml.model.ModelFacade"", ""org.argouml.model.ModelFacade.isConstructor"", ""org.argouml.model.ModelFacade.isStereotype"", ""org.argouml.model.ModelFacade.isSingleton""]","[""679401356aed7c50a455fa73c0d0b24a06117384"", ""679401356aed7c50a455fa73c0d0b24a06117384"", ""679401356aed7c50a455fa73c0d0b24a06117384"", ""679401356aed7c50a455fa73c0d0b24a06117384"", ""679401356aed7c50a455fa73c0d0b24a06117384"", ""679401356aed7c50a455fa73c0d0b24a06117384"", ""679401356aed7c50a455fa73c0d0b24a06117384"", ""679401356aed7c50a455fa73c0d0b24a06117384"", ""679401356aed7c50a455fa73c0d0b24a06117384"", ""679401356aed7c50a455fa73c0d0b24a06117384"", ""679401356aed7c50a455fa73c0d0b24a06117384"", ""679401356aed7c50a455fa73c0d0b24a06117384"", ""679401356aed7c50a455fa73c0d0b24a06117384"", ""679401356aed7c50a455fa73c0d0b24a06117384"", ""679401356aed7c50a455fa73c0d0b24a06117384"", ""679401356aed7c50a455fa73c0d0b24a06117384"", ""679401356aed7c50a455fa73c0d0b24a06117384""]","[""DispersedCoupling"", ""LongMethod"", ""BrainClass"", ""SpaghettiCode"", ""ComplexClass"", ""GodClass"", ""SpaghettiCode"", ""ComplexClass"", ""DispersedCoupling"", ""LongMethod"", ""FeatureEnvy"", ""SpaghettiCode"", ""ComplexClass"", ""GodClass"", ""DispersedCoupling"", ""LongMethod"", ""FeatureEnvy""]","[""3b1942063d8d0f25e3e0c96f39a2d912"", ""7cc0e656fa02e44a71330e9c3da909e9"", ""989f9997d407b2fa7b369c132fce2bf0"", ""48511c040e3b5b9310a556899c3e9c00"", ""88fc4cb4cab531c7b66b1febd2e98004"", ""d0e1bc791a1773d826c1506460e869b1"", ""cea0562618edec357888576da010fca9"", ""8738971dbdceb15534f90f05b6301e38"", ""8618470922917a36f436bd922872bb97"", ""f9a126b1ee1b349f44d3b16395728ef5"", ""a539ae1623ed3672a5405c6143ad931d"", ""da9c9846479fb9cde0aeffd9dc96712f"", ""8e84b2b747e5944bb7312a705e6e12b6"", ""eed9ea865a5968d35e56bf1cacd66821"", ""9ad7f1344721c7bd398ceac26bb17edf"", ""2273a1ba03714c3f97972b4895b6bd9b"", ""c2e4955a0896339690be814dafb0adf3""]","[620, 620, 56, 56, 35, 56, 43, 41, 403, 403, 403, 55, 36, 55, 1697, 1697, 1697]","[665, 665, 1697, 1697, 425, 1697, 494, 579, 448, 448, 448, 1357, 410, 1357, 1742, 1742, 1742]","[""CINT > 8.0, CDISP > 0.5, CC > 1.0"", ""MLOC > 6.692972548249224"", ""BRAIN_METHODS = 1, WMC = 259.0, TCC = 0.08067226890756303"", ""LONG_METHODS_CONNECTED = 5"", ""CC = 58.0"", ""CLOC > 500, TCC < 0.42040823562284796"", ""LONG_METHODS_CONNECTED = 2"", ""CC = 56.0"", ""CINT > 8.0, CDISP > 0.5, CC > 1.0"", ""MLOC > 6.692972548249224"", ""CALLS_TO_org.apache.coyote.AbstractProcessor > 7"", ""LONG_METHODS_CONNECTED = 5"", ""CC = 25.0"", ""CLOC > 500, TCC < 0.43751361778444253"", ""CINT > 8.0, CDISP > 0.5, CC > 1.0"", ""MLOC > 6.692972548249224"", ""CALLS_TO_org.apache.coyote.AbstractProcessor > 7""]","[""c3531170e1ad18e30167615e72bbc41ba25033d0""]","[""FeatureEnvy""]","[""eb287d6b96aa109217c8d0f1aa056ec3""]",[291],[312],"[""{\""MaxCallChain\"": 1.0, \""MethodLinesOfCode\"": 11.0, \""ParameterCount\"": 2.0, \""CyclomaticComplexity\"": 4.0, \""LocalityRatio\"": 0.0}""]"
Researcher 2,argouml,21281,"[""Inline Method"", ""Inline Method"", ""Extract Method"", ""Extract Method""]","[""org.argouml.ui.explorer.PerspectiveConfigurator.PerspectiveConfigurator"", ""org.argouml.ui.explorer.PerspectiveConfigurator"", ""org.argouml.ui.explorer.PerspectiveConfigurator.initPersPanel"", ""org.argouml.ui.explorer.PerspectiveConfigurator.makeListeners""]","[""679401356aed7c50a455fa73c0d0b24a06117384"", ""679401356aed7c50a455fa73c0d0b24a06117384"", ""679401356aed7c50a455fa73c0d0b24a06117384"", ""679401356aed7c50a455fa73c0d0b24a06117384"", ""679401356aed7c50a455fa73c0d0b24a06117384"", ""679401356aed7c50a455fa73c0d0b24a06117384"", ""679401356aed7c50a455fa73c0d0b24a06117384"", ""679401356aed7c50a455fa73c0d0b24a06117384"", ""679401356aed7c50a455fa73c0d0b24a06117384"", ""679401356aed7c50a455fa73c0d0b24a06117384"", ""679401356aed7c50a455fa73c0d0b24a06117384"", ""679401356aed7c50a455fa73c0d0b24a06117384"", ""679401356aed7c50a455fa73c0d0b24a06117384"", ""679401356aed7c50a455fa73c0d0b24a06117384"", ""679401356aed7c50a455fa73c0d0b24a06117384"", ""679401356aed7c50a455fa73c0d0b24a06117384"", ""679401356aed7c50a455fa73c0d0b24a06117384""]","[""DispersedCoupling"", ""LongMethod"", ""BrainClass"", ""SpaghettiCode"", ""ComplexClass"", ""GodClass"", ""SpaghettiCode"", ""ComplexClass"", ""DispersedCoupling"", ""LongMethod"", ""FeatureEnvy"", ""SpaghettiCode"", ""ComplexClass"", ""GodClass"", ""DispersedCoupling"", ""LongMethod"", ""FeatureEnvy""]","[""3b1942063d8d0f25e3e0c96f39a2d912"", ""7cc0e656fa02e44a71330e9c3da909e9"", ""989f9997d407b2fa7b369c132fce2bf0"", ""48511c040e3b5b9310a556899c3e9c00"", ""88fc4cb4cab531c7b66b1febd2e98004"", ""d0e1bc791a1773d826c1506460e869b1"", ""cea0562618edec357888576da010fca9"", ""8738971dbdceb15534f90f05b6301e38"", ""8618470922917a36f436bd922872bb97"", ""f9a126b1ee1b349f44d3b16395728ef5"", ""a539ae1623ed3672a5405c6143ad931d"", ""da9c9846479fb9cde0aeffd9dc96712f"", ""8e84b2b747e5944bb7312a705e6e12b6"", ""eed9ea865a5968d35e56bf1cacd66821"", ""9ad7f1344721c7bd398ceac26bb17edf"", ""2273a1ba03714c3f97972b4895b6bd9b"", ""c2e4955a0896339690be814dafb0adf3""]","[620, 620, 56, 56, 35, 56, 43, 41, 403, 403, 403, 55, 36, 55, 1697, 1697, 1697]","[665, 665, 1697, 1697, 425, 1697, 494, 579, 448, 448, 448, 1357, 410, 1357, 1742, 1742, 1742]","[""CINT > 8.0, CDISP > 0.5, CC > 1.0"", ""MLOC > 6.692972548249224"", ""BRAIN_METHODS = 1, WMC = 259.0, TCC = 0.08067226890756303"", ""LONG_METHODS_CONNECTED = 5"", ""CC = 58.0"", ""CLOC > 500, TCC < 0.42040823562284796"", ""LONG_METHODS_CONNECTED = 2"", ""CC = 56.0"", ""CINT > 8.0, CDISP > 0.5, CC > 1.0"", ""MLOC > 6.692972548249224"", ""CALLS_TO_org.apache.coyote.AbstractProcessor > 7"", ""LONG_METHODS_CONNECTED = 5"", ""CC = 25.0"", ""CLOC > 500, TCC < 0.43751361778444253"", ""CINT > 8.0, CDISP > 0.5, CC > 1.0"", ""MLOC > 6.692972548249224"", ""CALLS_TO_org.apache.coyote.AbstractProcessor > 7""]","[""cd71660946aed51c6e2d62ef97b0cdadc18949b2""]","[""FeatureEnvy""]","[""2e5497cb02344b071bb8acc15459b7ff""]",[288],[317],"[""{\""MethodLinesOfCode\"": 16.0, \""MaxCallChain\"": 2.0, \""ParameterCount\"": 0.0, \""CyclomaticComplexity\"": 1.0, \""LocalityRatio\"": 0.0}""]"
Researcher 2,argouml,21285,"[""Extract Method"", ""Extract Method"", ""Extract Method"", ""Extract Method""]","[""org.argouml.kernel.Project.addMember"", ""org.argouml.kernel.Project"", ""org.argouml.kernel.Project.addModelMember"", ""org.argouml.kernel.Project.addDiagramMember""]","[""679401356aed7c50a455fa73c0d0b24a06117384"", ""679401356aed7c50a455fa73c0d0b24a06117384"", ""679401356aed7c50a455fa73c0d0b24a06117384"", ""679401356aed7c50a455fa73c0d0b24a06117384"", ""679401356aed7c50a455fa73c0d0b24a06117384"", ""679401356aed7c50a455fa73c0d0b24a06117384"", ""679401356aed7c50a455fa73c0d0b24a06117384"", ""679401356aed7c50a455fa73c0d0b24a06117384"", ""679401356aed7c50a455fa73c0d0b24a06117384"", ""679401356aed7c50a455fa73c0d0b24a06117384"", ""679401356aed7c50a455fa73c0d0b24a06117384"", ""679401356aed7c50a455fa73c0d0b24a06117384"", ""679401356aed7c50a455fa73c0d0b24a06117384"", ""679401356aed7c50a455fa73c0d0b24a06117384"", ""679401356aed7c50a455fa73c0d0b24a06117384"", ""679401356aed7c50a455fa73c0d0b24a06117384"", ""679401356aed7c50a455fa73c0d0b24a06117384""]","[""DispersedCoupling"", ""LongMethod"", ""BrainClass"", ""SpaghettiCode"", ""ComplexClass"", ""GodClass"", ""SpaghettiCode"", ""ComplexClass"", ""DispersedCoupling"", ""LongMethod"", ""FeatureEnvy"", ""SpaghettiCode"", ""ComplexClass"", ""GodClass"", ""DispersedCoupling"", ""LongMethod"", ""FeatureEnvy""]","[""3b1942063d8d0f25e3e0c96f39a2d912"", ""7cc0e656fa02e44a71330e9c3da909e9"", ""989f9997d407b2fa7b369c132fce2bf0"", ""48511c040e3b5b9310a556899c3e9c00"", ""88fc4cb4cab531c7b66b1febd2e98004"", ""d0e1bc791a1773d826c1506460e869b1"", ""cea0562618edec357888576da010fca9"", ""8738971dbdceb15534f90f05b6301e38"", ""8618470922917a36f436bd922872bb97"", ""f9a126b1ee1b349f44d3b16395728ef5"", ""a539ae1623ed3672a5405c6143ad931d"", ""da9c9846479fb9cde0aeffd9dc96712f"", ""8e84b2b747e5944bb7312a705e6e12b6"", ""eed9ea865a5968d35e56bf1cacd66821"", ""9ad7f1344721c7bd398ceac26bb17edf"", ""2273a1ba03714c3f97972b4895b6bd9b"", ""c2e4955a0896339690be814dafb0adf3""]","[620, 620, 56, 56, 35, 56, 43, 41, 403, 403, 403, 55, 36, 55, 1697, 1697, 1697]","[665, 665, 1697, 1697, 425, 1697, 494, 579, 448, 448, 448, 1357, 410, 1357, 1742, 1742, 1742]","[""CINT > 8.0, CDISP > 0.5, CC > 1.0"", ""MLOC > 6.692972548249224"", ""BRAIN_METHODS = 1, WMC = 259.0, TCC = 0.08067226890756303"", ""LONG_METHODS_CONNECTED = 5"", ""CC = 58.0"", ""CLOC > 500, TCC < 0.42040823562284796"", ""LONG_METHODS_CONNECTED = 2"", ""CC = 56.0"", ""CINT > 8.0, CDISP > 0.5, CC > 1.0"", ""MLOC > 6.692972548249224"", ""CALLS_TO_org.apache.coyote.AbstractProcessor > 7"", ""LONG_METHODS_CONNECTED = 5"", ""CC = 25.0"", ""CLOC > 500, TCC < 0.43751361778444253"", ""CINT > 8.0, CDISP > 0.5, CC > 1.0"", ""MLOC > 6.692972548249224"", ""CALLS_TO_org.apache.coyote.AbstractProcessor > 7""]","[""3dace6eaedf427e3f1074e22c6cff91936c445ed"", ""3dace6eaedf427e3f1074e22c6cff91936c445ed""]","[""ComplexClass"", ""FeatureEnvy""]","[""a5d8c6dd6c4e101438d79cf43379cee4"", ""5a891a9d873e4efa2b77b61f934508ac""]","[832, 371]","[887, 400]","[""{\""IsAbstract\"": 0.0, \""ClassLinesOfCode\"": 500.0, \""OverrideRatio\"": null, \""TightClassCohesion\"": 0.050921861281826165, \""PublicFieldCount\"": 14.0}"", ""{\""MethodLinesOfCode\"": 16.0, \""LocalityRatio\"": 0.2, \""ParameterCount\"": 1.0, \""CyclomaticComplexity\"": 5.0, \""MaxCallChain\"": 1.0}""]"
Researcher 2,argouml,21292,"[""Extract Method"", ""Extract Method"", ""Extract Method"", ""Extract Method"", ""Inline Method"", ""Inline Method"", ""Extract Method"", ""Extract Method""]","[""org.argouml.uml.diagram.static_structure.layout.ClassdiagramLayouter"", ""org.argouml.uml.diagram.static_structure.layout.ClassdiagramLayouter.layout"", ""org.argouml.uml.diagram.static_structure.layout.ClassdiagramLayouter.setupLinks"", ""org.argouml.uml.diagram.static_structure.layout.ClassdiagramLayouter.rankAndWeightNodes"", ""org.argouml.uml.diagram.static_structure.layout.ClassdiagramLayouter.add"", ""org.argouml.uml.diagram.static_structure.layout.ClassdiagramLayouter.placeNodes""]","[""9d297a3c281b50f29bc8bb79df3c94a6599b7db4"", ""9d297a3c281b50f29bc8bb79df3c94a6599b7db4"", ""9d297a3c281b50f29bc8bb79df3c94a6599b7db4"", ""9d297a3c281b50f29bc8bb79df3c94a6599b7db4"", ""9d297a3c281b50f29bc8bb79df3c94a6599b7db4"", ""9d297a3c281b50f29bc8bb79df3c94a6599b7db4"", ""9d297a3c281b50f29bc8bb79df3c94a6599b7db4""]","[""FeatureEnvy"", ""SpaghettiCode"", ""ComplexClass"", ""GodClass"", ""IntensiveCoupling"", ""FeatureEnvy"", ""DataClass""]","[""a042a084ef60246682dd3cd4e41345af"", ""34ecc864453c184cc405232aaf01ccda"", ""78aa4e899089452c1f6040c86adc75ff"", ""150a03581d7f600c8aa6f60d1778c798"", ""68a33cfbd5b3d5bdf4f4c116a83add7c"", ""bb198e52a292104d159d3449e6958955"", ""de7dce7c645e04cc573214b1f2903f3a""]","[623, 56, 56, 56, 919, 919, 1076]","[646, 1355, 1355, 1355, 945, 945, 1338]","[""CALLS_TO_org.apache.tomcat.jni.SSL > 4"", ""LONG_METHODS_CONNECTED = 3"", ""CC = 19.0"", ""CLOC > 500, TCC < 0.4877410010384323"", ""CINT = 9.0, CDISP = 0.4444444444444444, CC > 1.0"", ""CALLS_TO_org.apache.tomcat.jni.SSL > 5"", ""WOC = 0.19047619047619047, NOPA = 0.0, NOAM = 17.0, WMC = 60.0""]","[""6fa7891e91d42cfd4c7439e7138d38e828d0b39c"", ""6fa7891e91d42cfd4c7439e7138d38e828d0b39c"", ""6fa7891e91d42cfd4c7439e7138d38e828d0b39c"", ""6fa7891e91d42cfd4c7439e7138d38e828d0b39c""]","[""FeatureEnvy"", ""FeatureEnvy"", ""FeatureEnvy"", ""FeatureEnvy""]","[""f928491ee351ca1f8175ef7314db7f68"", ""70a4a315f916607ab65bc53c5afcefc1"", ""1f4103957696d65c7c6b2a6e8a078bb9"", ""dee448d90da5daac08229888dc597fed""]","[578, 108, 492, 514]","[625, 116, 512, 567]","[""{\""LocalityRatio\"": 0.0, \""MaxCallChain\"": 2.0, \""ParameterCount\"": 0.0, \""CyclomaticComplexity\"": 9.0, \""MethodLinesOfCode\"": 29.0}"", ""{\""MethodLinesOfCode\"": 2.0, \""MaxCallChain\"": 1.0, \""ParameterCount\"": 1.0, \""CyclomaticComplexity\"": 1.0, \""LocalityRatio\"": 0.0}"", ""{\""LocalityRatio\"": 0.2727272727272727, \""MaxCallChain\"": 1.0, \""ParameterCount\"": 0.0, \""CyclomaticComplexity\"": 3.0, \""MethodLinesOfCode\"": 12.0}"", ""{\""LocalityRatio\"": 0.0, \""MaxCallChain\"": 2.0, \""ParameterCount\"": 0.0, \""CyclomaticComplexity\"": 7.0, \""MethodLinesOfCode\"": 28.0}""]"
Researcher 2,argouml,21307,"[""Extract Method"", ""Extract Method"", ""Extract Method"", ""Extract Method""]","[""org.argouml.uml.ui.ActionGenerateOne.actionPerformed"", ""org.argouml.uml.ui.ActionGenerateOne"", ""org.argouml.uml.ui.ActionGenerateOne.getCandidates"", ""org.argouml.uml.ui.ActionGenerateOne.shouldBeEnabled""]","[""9d297a3c281b50f29bc8bb79df3c94a6599b7db4"", ""9d297a3c281b50f29bc8bb79df3c94a6599b7db4"", ""9d297a3c281b50f29bc8bb79df3c94a6599b7db4"", ""9d297a3c281b50f29bc8bb79df3c94a6599b7db4"", ""9d297a3c281b50f29bc8bb79df3c94a6599b7db4"", ""9d297a3c281b50f29bc8bb79df3c94a6599b7db4"", ""9d297a3c281b50f29bc8bb79df3c94a6599b7db4""]","[""FeatureEnvy"", ""SpaghettiCode"", ""ComplexClass"", ""GodClass"", ""IntensiveCoupling"", ""FeatureEnvy"", ""DataClass""]","[""a042a084ef60246682dd3cd4e41345af"", ""34ecc864453c184cc405232aaf01ccda"", ""78aa4e899089452c1f6040c86adc75ff"", ""150a03581d7f600c8aa6f60d1778c798"", ""68a33cfbd5b3d5bdf4f4c116a83add7c"", ""bb198e52a292104d159d3449e6958955"", ""de7dce7c645e04cc573214b1f2903f3a""]","[623, 56, 56, 56, 919, 919, 1076]","[646, 1355, 1355, 1355, 945, 945, 1338]","[""CALLS_TO_org.apache.tomcat.jni.SSL > 4"", ""LONG_METHODS_CONNECTED = 3"", ""CC = 19.0"", ""CLOC > 500, TCC < 0.4877410010384323"", ""CINT = 9.0, CDISP = 0.4444444444444444, CC > 1.0"", ""CALLS_TO_org.apache.tomcat.jni.SSL > 5"", ""WOC = 0.19047619047619047, NOPA = 0.0, NOAM = 17.0, WMC = 60.0""]","[""20b9b773f1b9af8d47e5930085f150bbb3251f6a""]","[""FeatureEnvy""]","[""f7e9f824ee7dc5419dbef31a80e6150e""]",[80],[98],"[""{\""MethodLinesOfCode\"": 11.0, \""LocalityRatio\"": 0.0, \""ParameterCount\"": 0.0, \""CyclomaticComplexity\"": 4.0, \""MaxCallChain\"": 2.0}""]"
Researcher 2,argouml,21309,"[""Move Method"", ""Move Method"", ""Pull Up Method"", ""Pull Up Method"", ""Extract Method"", ""Extract Method""]","[""org.argouml.uml.diagram.static_structure.ui.FigInterface"", ""org.argouml.uml.diagram.static_structure.ui.FigClassifierBox"", ""org.argouml.uml.diagram.static_structure.ui.FigClass"", ""org.argouml.uml.diagram.static_structure.ui.FigClassifierBox.unhighlight""]","[""a5cdfa2c956e5cc59fa391e98007be2593f5fb6e"", ""a5cdfa2c956e5cc59fa391e98007be2593f5fb6e"", ""a5cdfa2c956e5cc59fa391e98007be2593f5fb6e"", ""a5cdfa2c956e5cc59fa391e98007be2593f5fb6e"", ""a5cdfa2c956e5cc59fa391e98007be2593f5fb6e"", ""a5cdfa2c956e5cc59fa391e98007be2593f5fb6e"", ""a5cdfa2c956e5cc59fa391e98007be2593f5fb6e"", ""a5cdfa2c956e5cc59fa391e98007be2593f5fb6e"", ""a5cdfa2c956e5cc59fa391e98007be2593f5fb6e""]","[""SpeculativeGenerality"", ""SpaghettiCode"", ""ComplexClass"", ""ClassDataShouldBePrivate"", ""GodClass"", ""LongMethod"", ""IntensiveCoupling"", ""LongMethod"", ""FeatureEnvy""]","[""315b85560519662faced99d8f6a865d0"", ""150e7f295d6b57a51b21f452bcc99534"", ""19d25e573db4517abc68bc2a9834b1cf"", ""37af1467227348e6e941788a0fdd369b"", ""c8928c11f3e5d89b82873272b7dbc61d"", ""eaaad366039bfe5c06a1976fb5290151"", ""c453d719418eef2bfeaa6ab5f8b2a6ef"", ""3d7b7ee88b2065b9160ab7dc8f405b73"", ""4fe3650c563ef81db7ce72a81387c0fe""]","[83, 83, 83, 83, 83, 2361, 2520, 2520, 2520]","[2736, 2736, 2736, 2736, 2736, 2504, 2655, 2655, 2655]","[""IS_ABSTRACT = 1, CHILDREN_COUNT = 2"", ""LONG_METHODS_CONNECTED = 10"", ""CC = 25.0"", ""PUBLIC_FIELD_COUNT = 1.0"", ""CLOC > 500, TCC < 0.49176697471028613"", ""MLOC > 6.681869954934875"", ""CINT = 11.0, CDISP = 0.45454545454545453, CC > 1.0"", ""MLOC > 6.681111331220257"", ""CALLS_TO_org.apache.catalina.WebResource > 8""]","[""ef0be8b931051ed1898d9d97d2aa6c41cddf85dc"", ""ef0be8b931051ed1898d9d97d2aa6c41cddf85dc"", ""ef0be8b931051ed1898d9d97d2aa6c41cddf85dc"", ""ef0be8b931051ed1898d9d97d2aa6c41cddf85dc"", ""ef0be8b931051ed1898d9d97d2aa6c41cddf85dc""]","[""SpeculativeGenerality"", ""SpaghettiCode"", ""GodClass"", ""ComplexClass"", ""FeatureEnvy""]","[""a9a79f630b94403c2fd07a4891b57e41"", ""866b4958f5a10a7c9cfe18c97a3c4a6a"", ""b14a6f7604d4eea35fdd16570684ee79"", ""7ba0a413ae55ba2d264757ed22947732"", ""d19f1baad939b13aa006a79fe90743c0""]","[34, 54, 74, 435, 190]","[98, 511, 1461, 501, 206]","[""{\""IsAbstract\"": 1.0, \""ClassLinesOfCode\"": 20.0, \""OverrideRatio\"": 0.011764705882352941, \""TightClassCohesion\"": 1.0, \""PublicFieldCount\"": 0.0}"", ""{\""IsAbstract\"": 0.0, \""ClassLinesOfCode\"": 293.0, \""OverrideRatio\"": 0.225, \""TightClassCohesion\"": 0.21904761904761905, \""PublicFieldCount\"": 1.0}"", ""{\""IsAbstract\"": 0.0, \""ClassLinesOfCode\"": 546.0, \""OverrideRatio\"": 0.5454545454545454, \""PublicFieldCount\"": 0.0, \""TightClassCohesion\"": 0.013071895424836602}"", ""{\""IsAbstract\"": 0.0, \""ClassLinesOfCode\"": 293.0, \""OverrideRatio\"": 0.225, \""TightClassCohesion\"": 0.21904761904761905, \""PublicFieldCount\"": 1.0}"", ""{\""LocalityRatio\"": 0.0, \""MethodLinesOfCode\"": 10.0, \""ParameterCount\"": 0.0, \""CyclomaticComplexity\"": 3.0, \""MaxCallChain\"": 1.0}""]"
Researcher 2,argouml,21334,"[""Extract Method"", ""Extract Method"", ""Extract Method"", ""Extract Method"", ""Extract Method"", ""Extract Method""]","[""org.argouml.uml.cognitive.critics.CrUML"", ""org.argouml.uml.cognitive.critics.CrUML.setResource"", ""org.argouml.uml.cognitive.critics.CrUML.getLocalizedString"", ""org.argouml.uml.cognitive.critics.CrUML.setupHeadAndDesc"", ""org.argouml.uml.cognitive.critics.CrUML.getClassSimpleName""]","[""a5cdfa2c956e5cc59fa391e98007be2593f5fb6e"", ""a5cdfa2c956e5cc59fa391e98007be2593f5fb6e"", ""a5cdfa2c956e5cc59fa391e98007be2593f5fb6e"", ""a5cdfa2c956e5cc59fa391e98007be2593f5fb6e"", ""a5cdfa2c956e5cc59fa391e98007be2593f5fb6e"", ""a5cdfa2c956e5cc59fa391e98007be2593f5fb6e"", ""a5cdfa2c956e5cc59fa391e98007be2593f5fb6e"", ""a5cdfa2c956e5cc59fa391e98007be2593f5fb6e"", ""a5cdfa2c956e5cc59fa391e98007be2593f5fb6e""]","[""SpeculativeGenerality"", ""SpaghettiCode"", ""ComplexClass"", ""ClassDataShouldBePrivate"", ""GodClass"", ""LongMethod"", ""IntensiveCoupling"", ""LongMethod"", ""FeatureEnvy""]","[""315b85560519662faced99d8f6a865d0"", ""150e7f295d6b57a51b21f452bcc99534"", ""19d25e573db4517abc68bc2a9834b1cf"", ""37af1467227348e6e941788a0fdd369b"", ""c8928c11f3e5d89b82873272b7dbc61d"", ""eaaad366039bfe5c06a1976fb5290151"", ""c453d719418eef2bfeaa6ab5f8b2a6ef"", ""3d7b7ee88b2065b9160ab7dc8f405b73"", ""4fe3650c563ef81db7ce72a81387c0fe""]","[83, 83, 83, 83, 83, 2361, 2520, 2520, 2520]","[2736, 2736, 2736, 2736, 2736, 2504, 2655, 2655, 2655]","[""IS_ABSTRACT = 1, CHILDREN_COUNT = 2"", ""LONG_METHODS_CONNECTED = 10"", ""CC = 25.0"", ""PUBLIC_FIELD_COUNT = 1.0"", ""CLOC > 500, TCC < 0.49176697471028613"", ""MLOC > 6.681869954934875"", ""CINT = 11.0, CDISP = 0.45454545454545453, CC > 1.0"", ""MLOC > 6.681111331220257"", ""CALLS_TO_org.apache.catalina.WebResource > 8""]","[""864f697d41aca1afee5777ece73ccc0d79558398"", ""864f697d41aca1afee5777ece73ccc0d79558398""]","[""FeatureEnvy"", ""FeatureEnvy""]","[""08945554b902e57e7067e3f58faf0008"", ""0230d13f142d1eac91e39135281798d4""]","[77, 230]","[89, 240]","[""{\""MaxCallChain\"": 2.0, \""LocalityRatio\"": 0.0, \""ParameterCount\"": 1.0, \""CyclomaticComplexity\"": 1.0, \""MethodLinesOfCode\"": 3.0}"", ""{\""LocalityRatio\"": 0.0, \""MaxCallChain\"": 2.0, \""ParameterCount\"": 0.0, \""CyclomaticComplexity\"": 1.0, \""MethodLinesOfCode\"": 3.0}""]"
Researcher 2,argouml,21346,"[""Extract Method"", ""Extract Method"", ""Extract Method"", ""Extract Method"", ""Extract Method"", ""Extract Method"", ""Extract Method"", ""Extract Method"", ""Extract Method"", ""Extract Method""]","[""org.argouml.uml.reveng.java.Modeller.addInterface"", ""org.argouml.uml.reveng.java.Modeller"", ""org.argouml.uml.reveng.java.Modeller.warnClassifierNotFound"", ""org.argouml.uml.reveng.java.Modeller.addOperation"", ""org.argouml.uml.reveng.java.Modeller.addClass"", ""org.argouml.uml.reveng.java.Modeller.addImport"", ""org.argouml.uml.reveng.java.Modeller.addAttribute""]","[""134d7d3a332a009fc15a19c5488cf8ac9440c986"", ""134d7d3a332a009fc15a19c5488cf8ac9440c986"", ""134d7d3a332a009fc15a19c5488cf8ac9440c986"", ""134d7d3a332a009fc15a19c5488cf8ac9440c986"", ""134d7d3a332a009fc15a19c5488cf8ac9440c986"", ""134d7d3a332a009fc15a19c5488cf8ac9440c986""]","[""SpaghettiCode"", ""ComplexClass"", ""IntensiveCoupling"", ""LongMethod"", ""FeatureEnvy"", ""DispersedCoupling""]","[""d1d157669b8e7233fa765352543f8264"", ""c6ef764e97029a8aa7876a2452f2d665"", ""5672e333724547bc3c4a854ef0ef4ad2"", ""3d8180d5a94019843cb6081683378390"", ""a314cadcea0af9490f09076037a2d684"", ""3247fe7603657dfa01b424a233103ab2""]","[52, 52, 404, 404, 404, 608]","[906, 906, 583, 583, 583, 645]","[""LONG_METHODS_CONNECTED = 2"", ""CC = 43.0"", ""CINT = 31.0, CDISP = 0.45161290322580644, CC > 1.0"", ""MLOC > 6.859328599096234"", ""CALLS_TO_org.apache.catalina.Session > 4"", ""CINT > 8.0, CDISP > 0.5, CC > 1.0""]","[""d8e97464593f0c2cfa7c01fe867de38f4a786334"", ""d8e97464593f0c2cfa7c01fe867de38f4a786334"", ""d8e97464593f0c2cfa7c01fe867de38f4a786334"", ""d8e97464593f0c2cfa7c01fe867de38f4a786334"", ""d8e97464593f0c2cfa7c01fe867de38f4a786334"", ""d8e97464593f0c2cfa7c01fe867de38f4a786334"", ""d8e97464593f0c2cfa7c01fe867de38f4a786334"", ""d8e97464593f0c2cfa7c01fe867de38f4a786334"", ""d8e97464593f0c2cfa7c01fe867de38f4a786334"", ""d8e97464593f0c2cfa7c01fe867de38f4a786334"", ""d8e97464593f0c2cfa7c01fe867de38f4a786334"", ""d8e97464593f0c2cfa7c01fe867de38f4a786334"", ""d8e97464593f0c2cfa7c01fe867de38f4a786334"", ""d8e97464593f0c2cfa7c01fe867de38f4a786334"", ""d8e97464593f0c2cfa7c01fe867de38f4a786334""]","[""ComplexClass"", ""GodClass"", ""SpaghettiCode"", ""LongMethod"", ""FeatureEnvy"", ""LongParameterList"", ""LongParameterList"", ""FeatureEnvy"", ""LongMethod"", ""LongParameterList"", ""FeatureEnvy"", ""LongMethod"", ""LongParameterList"", ""FeatureEnvy"", ""LongMethod""]","[""f115fb103a1cf4b6e04238ac1a700167"", ""05918aa8340a2eafff3348a283602bef"", ""a3cbd540320f21ec7a49563159229e47"", ""39a7856b5b9901d0123a2a5353314896"", ""4c36813556c6118a4b289664b0377510"", ""17d4cab56a6303f7e59568423e1a2c5a"", ""3f15355f6e2af06ae8f203548f11ef94"", ""69a83853ec036b12ee61ffa323a84886"", ""f084250039d22e126f219406d78c3b09"", ""07b6f2d9ab4d059dcd3e82035757d74a"", ""348730801d8f7e5e91e2ef911c851000"", ""d9a8d4ab5d507cb354c444bd9e8afe40"", ""88e3c70b1d90322c98b0011fc1c7fe53"", ""0a620d155fb64db112b62b9853818557"", ""695a6e5c6bcfe93627953906876c1343""]","[1073, 45, 46, 302, 302, 595, 430, 430, 430, 927, 927, 927, 800, 800, 800]","[1251, 1812, 1259, 407, 407, 652, 540, 540, 540, 1051, 1051, 1051, 945, 945, 945]","[""{\""IsAbstract\"": 0.0, \""ClassLinesOfCode\"": 418.0, \""OverrideRatio\"": null, \""TightClassCohesion\"": 0.696969696969697, \""PublicFieldCount\"": 0.0}"", ""{\""IsAbstract\"": 0.0, \""ClassLinesOfCode\"": 583.0, \""OverrideRatio\"": null, \""TightClassCohesion\"": 0.3508771929824561, \""PublicFieldCount\"": 0.0}"", ""{\""IsAbstract\"": 0.0, \""ClassLinesOfCode\"": 418.0, \""OverrideRatio\"": null, \""TightClassCohesion\"": 0.696969696969697, \""PublicFieldCount\"": 0.0}"", ""{\""LocalityRatio\"": 0.08888888888888889, \""MaxCallChain\"": 3.0, \""ParameterCount\"": 2.0, \""CyclomaticComplexity\"": 13.0, \""MethodLinesOfCode\"": 42.0}"", ""{\""LocalityRatio\"": 0.08888888888888889, \""MaxCallChain\"": 3.0, \""ParameterCount\"": 2.0, \""CyclomaticComplexity\"": 13.0, \""MethodLinesOfCode\"": 42.0}"", ""{\""LocalityRatio\"": 0.47368421052631576, \""MaxCallChain\"": 3.0, \""ParameterCount\"": 5.0, \""CyclomaticComplexity\"": 6.0, \""MethodLinesOfCode\"": 21.0}"", ""{\""LocalityRatio\"": 0.3404255319148936, \""MaxCallChain\"": 3.0, \""ParameterCount\"": 6.0, \""CyclomaticComplexity\"": 12.0, \""MethodLinesOfCode\"": 44.0}"", ""{\""LocalityRatio\"": 0.3404255319148936, \""MaxCallChain\"": 3.0, \""ParameterCount\"": 6.0, \""CyclomaticComplexity\"": 12.0, \""MethodLinesOfCode\"": 44.0}"", ""{\""LocalityRatio\"": 0.3404255319148936, \""MaxCallChain\"": 3.0, \""ParameterCount\"": 6.0, \""CyclomaticComplexity\"": 12.0, \""MethodLinesOfCode\"": 44.0}"", ""{\""LocalityRatio\"": 0.19642857142857142, \""MaxCallChain\"": 2.0, \""ParameterCount\"": 5.0, \""CyclomaticComplexity\"": 11.0, \""MethodLinesOfCode\"": 48.0}"", ""{\""LocalityRatio\"": 0.19642857142857142, \""MaxCallChain\"": 2.0, \""ParameterCount\"": 5.0, \""CyclomaticComplexity\"": 11.0, \""MethodLinesOfCode\"": 48.0}"", ""{\""LocalityRatio\"": 0.19642857142857142, \""MaxCallChain\"": 2.0, \""ParameterCount\"": 5.0, \""CyclomaticComplexity\"": 11.0, \""MethodLinesOfCode\"": 48.0}"", ""{\""LocalityRatio\"": 0.15789473684210525, \""MaxCallChain\"": 3.0, \""ParameterCount\"": 6.0, \""CyclomaticComplexity\"": 13.0, \""MethodLinesOfCode\"": 62.0}"", ""{\""LocalityRatio\"": 0.15789473684210525, \""MaxCallChain\"": 3.0, \""ParameterCount\"": 6.0, \""CyclomaticComplexity\"": 13.0, \""MethodLinesOfCode\"": 62.0}"", ""{\""LocalityRatio\"": 0.15789473684210525, \""MaxCallChain\"": 3.0, \""ParameterCount\"": 6.0, \""CyclomaticComplexity\"": 13.0, \""MethodLinesOfCode\"": 62.0}""]"
Researcher 2,argouml,21347,"[""Extract Method"", ""Extract Method"", ""Extract Method"", ""Extract Method""]","[""org.argouml.uml.reveng.DiagramInterface.addClass"", ""org.argouml.uml.reveng.DiagramInterface"", ""org.argouml.uml.reveng.DiagramInterface.addClassifier"", ""org.argouml.uml.reveng.DiagramInterface.addInterface""]","[""855e3829b0a43cf2d265e9ba06eb30277daa80a6"", ""855e3829b0a43cf2d265e9ba06eb30277daa80a6"", ""855e3829b0a43cf2d265e9ba06eb30277daa80a6"", ""855e3829b0a43cf2d265e9ba06eb30277daa80a6"", ""855e3829b0a43cf2d265e9ba06eb30277daa80a6"", ""855e3829b0a43cf2d265e9ba06eb30277daa80a6"", ""855e3829b0a43cf2d265e9ba06eb30277daa80a6""]","[""DispersedCoupling"", ""LongMethod"", ""FeatureEnvy"", ""SpaghettiCode"", ""ComplexClass"", ""GodClass"", ""DispersedCoupling""]","[""ed134661cd074a4c4a601cfc12803edc"", ""2b6c31bb60d8ca9bec3e179acee410ef"", ""20407e84b5f3e3ced21449b85720d08c"", ""0bada4f61d4b25c2456f5bb7fa2934ba"", ""0095e6a35482ab134ef7267eed5d42b1"", ""cf5053ff7da90130354eaf88136ca66f"", ""6f4c13bcd43270ecf497571fd931c14d""]","[171, 171, 171, 60, 60, 60, 1242]","[256, 256, 256, 1530, 1530, 1530, 1261]","[""CINT > 8.0, CDISP > 0.5, CC > 1.0"", ""MLOC > 6.652768889982851"", ""CALLS_TO_org.apache.juli.logging.Log > 8"", ""LONG_METHODS_CONNECTED = 6"", ""CC = 14.0"", ""CLOC > 500, TCC < 0.49286836990116256"", ""CINT > 8.0, CDISP > 0.5, CC > 1.0""]","[""d8e97464593f0c2cfa7c01fe867de38f4a786334""]","[""FeatureEnvy""]","[""742124027a04d22f99ecf25ff8931f81""]",[280],[336],"[""{\""MaxCallChain\"": 2.0, \""MethodLinesOfCode\"": 24.0, \""ParameterCount\"": 2.0, \""CyclomaticComplexity\"": 7.0, \""LocalityRatio\"": 0.0}""]"
Researcher 2,argouml,21363,"[""Extract Method"", ""Extract Method"", ""Extract Method"", ""Extract Method""]","[""org.argouml.uml.reveng.java.ClassifierContext.get"", ""org.argouml.uml.reveng.java.ClassifierContext"", ""org.argouml.uml.reveng.java.ClassifierContext.getInterface""]","[""06dbc1d72c8d455e4ae7475793dd12a2ed174204"", ""06dbc1d72c8d455e4ae7475793dd12a2ed174204"", ""06dbc1d72c8d455e4ae7475793dd12a2ed174204"", ""06dbc1d72c8d455e4ae7475793dd12a2ed174204"", ""06dbc1d72c8d455e4ae7475793dd12a2ed174204"", ""06dbc1d72c8d455e4ae7475793dd12a2ed174204"", ""06dbc1d72c8d455e4ae7475793dd12a2ed174204"", ""06dbc1d72c8d455e4ae7475793dd12a2ed174204"", ""06dbc1d72c8d455e4ae7475793dd12a2ed174204""]","[""BrainClass"", ""SpaghettiCode"", ""ComplexClass"", ""GodClass"", ""DispersedCoupling"", ""FeatureEnvy"", ""IntensiveCoupling"", ""LongMethod"", ""FeatureEnvy""]","[""989f9997d407b2fa7b369c132fce2bf0"", ""48511c040e3b5b9310a556899c3e9c00"", ""88fc4cb4cab531c7b66b1febd2e98004"", ""d0e1bc791a1773d826c1506460e869b1"", ""6d9cb1fb1f851de8e13c5475b40f59b7"", ""3f95f010469744da12b3e0a04e393cb2"", ""8411b38206d0b85b67f23aa90b288aa9"", ""19e36edf3aa620c308f01bed82ca7f2d"", ""84ea868f9fe33d22a3b22a6bbf95ded5""]","[56, 56, 35, 56, 1756, 1756, 650, 650, 649]","[1697, 1697, 425, 1697, 1797, 1797, 886, 886, 937]","[""BRAIN_METHODS = 1, WMC = 259.0, TCC = 0.08067226890756303"", ""LONG_METHODS_CONNECTED = 5"", ""CC = 58.0"", ""CLOC > 500, TCC < 0.42040823562284796"", ""CINT > 8.0, CDISP > 0.5, CC > 1.0"", ""CALLS_TO_org.apache.coyote.AbstractProcessor > 7"", ""CINT = 56.0, CDISP = 0.26785714285714285, CC > 1.0"", ""MLOC > 6.641009277894996"", ""CALLS_TO_org.apache.coyote.AsyncStateMachine > 14""]","[""069ff0417a1895204d53a9584513399d131a778e""]","[""FeatureEnvy""]","[""7e80d343d5527e8cdd785e88b8083259""]",[74],[96],"[""{\""MethodLinesOfCode\"": 6.0, \""MaxCallChain\"": 3.0, \""ParameterCount\"": 1.0, \""CyclomaticComplexity\"": 3.0, \""LocalityRatio\"": 0.0}""]"
Researcher 2,argouml,21364,"[""Extract Method"", ""Extract Method"", ""Extract Method"", ""Extract Method""]","[""org.argouml.uml.reveng.java.PackageContext"", ""org.argouml.uml.reveng.java.PackageContext.get"", ""org.argouml.uml.reveng.java.PackageContext.getInterface""]","[""0e0324a9f3a4ded831d80bc31dab82da51bc4d3c""]","[""FeatureEnvy""]","[""ea9d537757667912a03f3e1d106c764c""]",[522],[537],"[""CALLS_TO_org.apache.tomcat.util.net.SocketWrapperBase<E> > 4""]","[""069ff0417a1895204d53a9584513399d131a778e"", ""069ff0417a1895204d53a9584513399d131a778e"", ""069ff0417a1895204d53a9584513399d131a778e""]","[""ComplexClass"", ""FeatureEnvy"", ""LongMethod""]","[""1954b522261380fa57ee8fb27bbed6e6"", ""075948c61acbf4b216d31e8b56ff30e7"", ""30d4237575310a67549a4ddfbdae8eaf""]","[61, 128, 128]","[126, 233, 233]","[""{\""IsAbstract\"": 0.0, \""ClassLinesOfCode\"": 78.0, \""OverrideRatio\"": 0.3333333333333333, \""TightClassCohesion\"": 1.0, \""PublicFieldCount\"": 0.0}"", ""{\""MethodLinesOfCode\"": 34.0, \""MaxCallChain\"": 2.0, \""ParameterCount\"": 1.0, \""CyclomaticComplexity\"": 13.0, \""LocalityRatio\"": 0.05128205128205128}"", ""{\""MethodLinesOfCode\"": 34.0, \""MaxCallChain\"": 2.0, \""ParameterCount\"": 1.0, \""CyclomaticComplexity\"": 13.0, \""LocalityRatio\"": 0.05128205128205128}""]"
Researcher 2,argouml,21365,"[""Extract Method"", ""Extract Method"", ""Extract Method"", ""Extract Method"", ""Extract Method"", ""Extract Method""]","[""org.argouml.ui.ProjectBrowser.targetRemoved"", ""org.argouml.ui.ProjectBrowser"", ""org.argouml.ui.ProjectBrowser.targetChanged"", ""org.argouml.ui.ProjectBrowser.targetSet"", ""org.argouml.ui.ProjectBrowser.targetAdded""]","[""0e0324a9f3a4ded831d80bc31dab82da51bc4d3c""]","[""FeatureEnvy""]","[""ea9d537757667912a03f3e1d106c764c""]",[522],[537],"[""CALLS_TO_org.apache.tomcat.util.net.SocketWrapperBase<E> > 4""]","[""2270b6acd7c35821e9547e7e4b112ee9f130948a"", ""2270b6acd7c35821e9547e7e4b112ee9f130948a"", ""2270b6acd7c35821e9547e7e4b112ee9f130948a"", ""2270b6acd7c35821e9547e7e4b112ee9f130948a""]","[""SpaghettiCode"", ""GodClass"", ""ComplexClass"", ""FeatureEnvy""]","[""cb2ef2a2e951cbe52513ae8661470346"", ""e570dc0e9fcda9ac95bf7d128a766681"", ""ee06e837a5b800cbc3c482617e9f41af"", ""d0c8032ed989bb1d70534bd7e872a05c""]","[76, 102, 231, 1025]","[809, 1525, 320, 1055]","[""{\""IsAbstract\"": 0.0, \""ClassLinesOfCode\"": 304.0, \""OverrideRatio\"": null, \""TightClassCohesion\"": 0.06825396825396825, \""PublicFieldCount\"": 1.0}"", ""{\""IsAbstract\"": 0.0, \""ClassLinesOfCode\"": 508.0, \""OverrideRatio\"": 0.029411764705882353, \""TightClassCohesion\"": 0.04048582995951417, \""PublicFieldCount\"": 0.0}"", ""{\""IsAbstract\"": 0.0, \""ClassLinesOfCode\"": 280.0, \""OverrideRatio\"": null, \""TightClassCohesion\"": 0.023809523809523808, \""PublicFieldCount\"": 1.0}"", ""{\""MethodLinesOfCode\"": 17.0, \""LocalityRatio\"": 0.0625, \""ParameterCount\"": 1.0, \""CyclomaticComplexity\"": 6.0, \""MaxCallChain\"": 2.0}""]"
Researcher 2,argouml,21379,"[""Extract Method"", ""Extract Method"", ""Extract Method"", ""Extract Method""]","[""org.argouml.model.mdr.ExtensionMechanismsHelperMDRImpl"", ""org.argouml.model.mdr.ExtensionMechanismsHelperMDRImpl.isValidStereoType"", ""org.argouml.model.mdr.ExtensionMechanismsHelperMDRImpl.hasStereoType""]","[""cd5c80bda95c6b2c3dc38db0ae32359c2c36dbcd"", ""cd5c80bda95c6b2c3dc38db0ae32359c2c36dbcd"", ""cd5c80bda95c6b2c3dc38db0ae32359c2c36dbcd"", ""cd5c80bda95c6b2c3dc38db0ae32359c2c36dbcd"", ""cd5c80bda95c6b2c3dc38db0ae32359c2c36dbcd""]","[""SpaghettiCode"", ""ComplexClass"", ""IntensiveCoupling"", ""LongMethod"", ""FeatureEnvy""]","[""e69bf8a42b0cf2911c52a011e06f53f6"", ""7f3afa175faffef5f01d5e5b854dd9f9"", ""b3814b4ba8b082dacd28ffee19e9403e"", ""7d8a68f117d4babb164d320843eb3775"", ""e4341ddae6f156a625c2ad6d3d5bfe07""]","[29, 29, 197, 197, 197]","[613, 613, 255, 255, 263]","[""LONG_METHODS_CONNECTED = 3"", ""CC = 14.0"", ""CINT = 16.0, CDISP = 0.4375, CC > 1.0"", ""MLOC > 6.62315583781148"", ""CALLS_TO_org.apache.coyote.http2.ByteUtil > 4""]","[""4ca71a9b89c139d60a17bef27eeb257ce2a66309""]","[""FeatureEnvy""]","[""5eaff5c35c973d4617fd9fcd96f58739""]",[231],[257],"[""{\""MaxCallChain\"": 2.0, \""ParameterCount\"": 2.0, \""CyclomaticComplexity\"": 4.0, \""MethodLinesOfCode\"": 11.0, \""LocalityRatio\"": 0.375}""]"
Researcher 2,argouml,21381,"[""Extract Method"", ""Extract Method"", ""Extract Method"", ""Extract Method""]","[""org.argouml.model.AbstractExtensionMechanismsHelperDecorator"", ""org.argouml.model.AbstractExtensionMechanismsHelperDecorator.isValidStereoType"", ""org.argouml.model.AbstractExtensionMechanismsHelperDecorator.hasStereoType""]","[""523ee1b1c6ee00168d1d7d163450580884d82a90"", ""523ee1b1c6ee00168d1d7d163450580884d82a90""]","[""ComplexClass"", ""FeatureEnvy""]","[""3ee14b5219fdaa400bd29acd911c66cb"", ""292060290f31a74ea424575bb9c84272""]","[861, 994]","[1400, 1025]","[""CC = 20.0"", ""CALLS_TO_org.apache.tomcat.util.net.NioChannel > 4""]","[""9fdf8d7a3376c5eb9efc186c3b8426f85af22b84""]","[""SpeculativeGenerality""]","[""691020b8b9f6b5c8b481a2cf4e8ef0e9""]",[29],[149],"[""{\""IsAbstract\"": 1.0, \""ClassLinesOfCode\"": 49.0, \""OverrideRatio\"": null, \""PublicFieldCount\"": 0.0, \""TightClassCohesion\"": 1.0}""]"
Researcher 2,argouml,21389,"[""Extract Method"", ""Extract Method"", ""Extract Method"", ""Extract Method""]","[""org.argouml.kernel.MemberList"", ""org.argouml.kernel.MemberList.iterator"", ""org.argouml.kernel.MemberList.buildTempList"", ""org.argouml.kernel.MemberList.listIterator""]","[""523ee1b1c6ee00168d1d7d163450580884d82a90"", ""523ee1b1c6ee00168d1d7d163450580884d82a90""]","[""ComplexClass"", ""FeatureEnvy""]","[""3ee14b5219fdaa400bd29acd911c66cb"", ""292060290f31a74ea424575bb9c84272""]","[861, 994]","[1400, 1025]","[""CC = 20.0"", ""CALLS_TO_org.apache.tomcat.util.net.NioChannel > 4""]","[""20c69332d05f553879adb7f7c6741a7c40654a73""]","[""FeatureEnvy""]","[""48526e399ddeac248cae6d0ff99cca81""]",[126],[136],"[""{\""MethodLinesOfCode\"": 8.0, \""MaxCallChain\"": 1.0, \""ParameterCount\"": 0.0, \""CyclomaticComplexity\"": 3.0, \""LocalityRatio\"": 0.25}""]"
Researcher 2,argouml,21394,"[""Extract Method"", ""Extract Method"", ""Extract Method"", ""Extract Method""]","[""org.argouml.uml.diagram.sequence2.ui.FigMessage"", ""org.argouml.uml.diagram.sequence2.ui.FigMessage.setOwner"", ""org.argouml.uml.diagram.sequence2.ui.FigMessage.updateArrow"", ""org.argouml.uml.diagram.sequence2.ui.FigMessage.setFig""]","[""f92b381e00706323dafac79fa1ce36a72ae3369b"", ""f92b381e00706323dafac79fa1ce36a72ae3369b"", ""f92b381e00706323dafac79fa1ce36a72ae3369b"", ""f92b381e00706323dafac79fa1ce36a72ae3369b"", ""f92b381e00706323dafac79fa1ce36a72ae3369b"", ""f92b381e00706323dafac79fa1ce36a72ae3369b""]","[""SpaghettiCode"", ""ComplexClass"", ""ComplexClass"", ""IntensiveCoupling"", ""LongMethod"", ""FeatureEnvy""]","[""0715078c9b7fab8785a95a5943f74f2e"", ""ae976a0720eb899d55efe2994cfa3c52"", ""7cbfe928b59a2c0aebc08997b55b24ca"", ""c64213c30f39a8e1b0a28c363e7d4df3"", ""0a9a367abe1d1517c9f1a7140369d828"", ""85af709020503a74db15acd3426ae9b9""]","[46, 60, 43, 526, 526, 534]","[1132, 2121, 856, 671, 671, 571]","[""LONG_METHODS_CONNECTED = 3"", ""CC = 12.0"", ""CC = 14.0"", ""CINT = 21.0, CDISP = 0.2857142857142857, CC > 1.0"", ""MLOC > 6.408526237186925"", ""CALLS_TO_org.apache.catalina.connector.Request > 5""]","[""b8c0f145375a24e5e9c963d41beef239a6a80fe7""]","[""FeatureEnvy""]","[""e4035223958dcabc5345831961c0cdfa""]",[84],[108],"[""{\""MethodLinesOfCode\"": 13.0, \""LocalityRatio\"": 0.1111111111111111, \""ParameterCount\"": 0.0, \""CyclomaticComplexity\"": 5.0, \""MaxCallChain\"": 2.0}""]"
Researcher 2,argouml,21408,"[""Extract Method"", ""Extract Method"", ""Extract Method"", ""Extract Method""]","[""org.argouml.uml.diagram.ui.FigEdgeModelElement"", ""org.argouml.uml.diagram.ui.FigEdgeModelElement.mouseClicked"", ""org.argouml.uml.diagram.ui.FigEdgeModelElement.isReadOnly"", ""org.argouml.uml.diagram.ui.FigEdgeModelElement.keyTyped""]","[""f92b381e00706323dafac79fa1ce36a72ae3369b"", ""f92b381e00706323dafac79fa1ce36a72ae3369b"", ""f92b381e00706323dafac79fa1ce36a72ae3369b"", ""f92b381e00706323dafac79fa1ce36a72ae3369b"", ""f92b381e00706323dafac79fa1ce36a72ae3369b"", ""f92b381e00706323dafac79fa1ce36a72ae3369b""]","[""SpaghettiCode"", ""ComplexClass"", ""ComplexClass"", ""IntensiveCoupling"", ""LongMethod"", ""FeatureEnvy""]","[""0715078c9b7fab8785a95a5943f74f2e"", ""ae976a0720eb899d55efe2994cfa3c52"", ""7cbfe928b59a2c0aebc08997b55b24ca"", ""c64213c30f39a8e1b0a28c363e7d4df3"", ""0a9a367abe1d1517c9f1a7140369d828"", ""85af709020503a74db15acd3426ae9b9""]","[46, 60, 43, 526, 526, 534]","[1132, 2121, 856, 671, 671, 571]","[""LONG_METHODS_CONNECTED = 3"", ""CC = 12.0"", ""CC = 14.0"", ""CINT = 21.0, CDISP = 0.2857142857142857, CC > 1.0"", ""MLOC > 6.408526237186925"", ""CALLS_TO_org.apache.catalina.connector.Request > 5""]","[""5b01195751b3f0ab927abb6ebe9ed25406f12ce2"", ""5b01195751b3f0ab927abb6ebe9ed25406f12ce2"", ""5b01195751b3f0ab927abb6ebe9ed25406f12ce2""]","[""SpaghettiCode"", ""ComplexClass"", ""FeatureEnvy""]","[""b382507af93598da91b2be37f12270db"", ""8222cb176c2dd7db08983118a33498bb"", ""f88450357fba2ae1c12675d5bcc52771""]","[90, 247, 708]","[1080, 294, 717]","[""{\""IsAbstract\"": 1.0, \""ClassLinesOfCode\"": 429.0, \""OverrideRatio\"": null, \""PublicFieldCount\"": 0.0, \""TightClassCohesion\"": 0.012775842044134728}"", ""{\""IsAbstract\"": 1.0, \""ClassLinesOfCode\"": 360.0, \""OverrideRatio\"": null, \""PublicFieldCount\"": 1.0, \""TightClassCohesion\"": 0.00641025641025641}"", ""{\""LocalityRatio\"": 0.2, \""MethodLinesOfCode\"": 8.0, \""ParameterCount\"": 1.0, \""CyclomaticComplexity\"": 4.0, \""MaxCallChain\"": 1.0}""]"
Researcher 2,argouml,21420,"[""Extract Method"", ""Extract Method"", ""Extract Method"", ""Extract Method"", ""Extract Method"", ""Extract Method""]","[""org.argouml.uml.diagram.ui.FigSingleLineText.setOwner"", ""org.argouml.uml.diagram.ui.FigSingleLineText"", ""org.argouml.uml.diagram.ui.FigSingleLineText.addModelListener"", ""org.argouml.uml.diagram.ui.FigSingleLineText.FigSingleLineText"", ""org.argouml.uml.diagram.ui.FigSingleLineText.initialize"", ""org.argouml.uml.diagram.ui.FigSingleLineText.notationChanged"", ""org.argouml.uml.diagram.ui.FigSingleLineText.renderingChanged""]","[""b3396c0369f54524ca50f3a7e3b73b4a43a358a7"", ""b3396c0369f54524ca50f3a7e3b73b4a43a358a7"", ""b3396c0369f54524ca50f3a7e3b73b4a43a358a7"", ""b3396c0369f54524ca50f3a7e3b73b4a43a358a7""]","[""SpaghettiCode"", ""ComplexClass"", ""LongMethod"", ""FeatureEnvy""]","[""73d14287dae0b87a331b8c91d30a176d"", ""ebcefec461273a312c9c55a100ba36fe"", ""2e6ffbfda095d4995199585aa53af510"", ""f50afa95679f26028d2e2a25501fcf26""]","[215, 215, 277, 237]","[405, 405, 316, 269]","[""LONG_METHODS_CONNECTED = 2"", ""CC = 15.0"", ""MLOC > 6.874321358438148"", ""CALLS_TO_org.apache.tomcat.util.net.NioEndpoint.KeyAttachment > 5""]","[""36c3e043ac6aa73eff786f685ea46e891ea19d83"", ""36c3e043ac6aa73eff786f685ea46e891ea19d83""]","[""FeatureEnvy"", ""LongParameterList""]","[""706bdc0e9a4789d2fa557d1f8190e947"", ""bf07e7826852cad4c992d3d45d6e5392""]","[241, 120]","[243, 134]","[""{\""LocalityRatio\"": 0.0, \""MaxCallChain\"": 2.0, \""ParameterCount\"": 0.0, \""CyclomaticComplexity\"": 1.0, \""MethodLinesOfCode\"": 2.0}"", ""{\""LocalityRatio\"": null, \""ParameterCount\"": 6.0, \""CyclomaticComplexity\"": 1.0, \""MethodLinesOfCode\"": 2.0, \""MaxCallChain\"": 0.0}""]"
Researcher 2,argouml,21421,"[""Extract Method"", ""Extract Method"", ""Extract Method"", ""Extract Method""]","[""org.argouml.uml.diagram.ui.FigGeneralization.setOwner"", ""org.argouml.uml.diagram.ui.FigGeneralization"", ""org.argouml.uml.diagram.ui.FigGeneralization.fixup"", ""org.argouml.uml.diagram.ui.FigGeneralization.FigGeneralization"", ""org.argouml.uml.diagram.ui.FigGeneralization.initialize""]","[""5045d222a0018885c3b9dd8ea1dafe8476a5a7bb"", ""5045d222a0018885c3b9dd8ea1dafe8476a5a7bb""]","[""LongMethod"", ""FeatureEnvy""]","[""6533e6170002e4f79fba8d167b8e0d88"", ""56749bb02b21a1dce101835607bb691e""]","[194, 142]","[265, 205]","[""MLOC > 6.874321358438148"", ""CALLS_TO_org.apache.catalina.util.StringMResearcher 1ger > 4""]","[""36c3e043ac6aa73eff786f685ea46e891ea19d83""]","[""FeatureEnvy""]","[""fd4af3a5e58871b6c8a093283f8be69f""]",[188],[216],"[""{\""LocalityRatio\"": 0.1, \""MaxCallChain\"": 2.0, \""ParameterCount\"": 1.0, \""CyclomaticComplexity\"": 4.0, \""MethodLinesOfCode\"": 10.0}""]"
Researcher 2,argouml,21427,"[""Inline Method"", ""Inline Method"", ""Extract Method"", ""Extract Method""]","[""org.argouml.uml.diagram.ui.FigAssociationEnd.FigAssociationEnd"", ""org.argouml.uml.diagram.ui.FigAssociationEnd.constructFigs"", ""org.argouml.uml.diagram.ui.FigAssociationEnd"", ""org.argouml.uml.diagram.ui.FigAssociationEnd.initNotationProviders"", ""org.argouml.uml.diagram.ui.FigAssociationEnd.initializeNotationProvidersInternal""]","[""5045d222a0018885c3b9dd8ea1dafe8476a5a7bb"", ""5045d222a0018885c3b9dd8ea1dafe8476a5a7bb""]","[""LongMethod"", ""FeatureEnvy""]","[""6533e6170002e4f79fba8d167b8e0d88"", ""56749bb02b21a1dce101835607bb691e""]","[194, 142]","[265, 205]","[""MLOC > 6.874321358438148"", ""CALLS_TO_org.apache.catalina.util.StringMResearcher 1ger > 4""]","[""fc2a12c74b4a1ac9c5dafe443cd44d506b526597""]","[""FeatureEnvy""]","[""749e9f40a7fb05d14ff94b33b70030ae""]",[109],[122],"[""{\""LocalityRatio\"": 0.0, \""ParameterCount\"": 2.0, \""CyclomaticComplexity\"": 2.0, \""MethodLinesOfCode\"": 5.0, \""MaxCallChain\"": 2.0}""]"
Researcher 2,argouml,21448,"[""Extract Method"", ""Extract Method"", ""Extract Method"", ""Extract Method""]","[""org.argouml.core.propertypanels.ui.UMLEventParameterListModel"", ""org.argouml.core.propertypanels.ui.UMLEventParameterListModel.buildModelList"", ""org.argouml.core.propertypanels.ui.UMLEventParameterListModel.getModelElements"", ""org.argouml.core.propertypanels.ui.UMLEventParameterListModel.isValidElement""]","[""3d6627f677f62732d68be82498b61f79dea8931f"", ""3d6627f677f62732d68be82498b61f79dea8931f"", ""3d6627f677f62732d68be82498b61f79dea8931f"", ""3d6627f677f62732d68be82498b61f79dea8931f"", ""3d6627f677f62732d68be82498b61f79dea8931f""]","[""SpaghettiCode"", ""ComplexClass"", ""IntensiveCoupling"", ""LongMethod"", ""FeatureEnvy""]","[""e581a925b9095264e18731606b08721e"", ""8b70f59f6f48ac6334fb951029b693ba"", ""29bef1a0e33b6817b07ef9281fa5f3e1"", ""b9ff3d8caad500a921606615abe5041a"", ""36a36998609f5190f98b79e49301045f""]","[41, 34, 332, 313, 332]","[668, 546, 371, 355, 371]","[""LONG_METHODS_CONNECTED = 3"", ""CC = 11.0"", ""CINT = 9.0, CDISP = 0.3333333333333333, CC > 1.0"", ""MLOC > 6.388925039042194"", ""CALLS_TO_org.apache.catalina.tribes.io.XByteBuffer > 4""]","[""2c22e7e48d789d525366db8fead7d5c1865e48cd""]","[""FeatureEnvy""]","[""7cb653a3bab62b2fb53511a5887bf0be""]",[61],[64],"[""{\""MaxCallChain\"": 2.0, \""LocalityRatio\"": 0.0, \""ParameterCount\"": 0.0, \""CyclomaticComplexity\"": 1.0, \""MethodLinesOfCode\"": 3.0}""]"
Researcher 2,argouml,21449,"[""Extract Method"", ""Extract Method"", ""Extract Method"", ""Extract Method""]","[""org.argouml.core.propertypanels.ui.UMLUseCaseExtensionPointListModel"", ""org.argouml.core.propertypanels.ui.UMLUseCaseExtensionPointListModel.buildModelList"", ""org.argouml.core.propertypanels.ui.UMLUseCaseExtensionPointListModel.getModelElements"", ""org.argouml.core.propertypanels.ui.UMLUseCaseExtensionPointListModel.isValidElement""]","[""ac6776b5541298fc063d3899a0a582750846f0dd"", ""ac6776b5541298fc063d3899a0a582750846f0dd"", ""ac6776b5541298fc063d3899a0a582750846f0dd"", ""ac6776b5541298fc063d3899a0a582750846f0dd""]","[""FeatureEnvy"", ""ComplexClass"", ""LongMethod"", ""IntensiveCoupling""]","[""e075b9858d25acbdf1cf9e15ac182f2b"", ""99da0d5b25545ee1e391134b5f467b13"", ""a820c49fdee4a130f2bf5d153f6a5b0f"", ""ab5388b2c806344630b29a2b668f537c""]","[377, 52, 579, 288]","[426, 640, 659, 335]","[""CALLS_TO_org.apache.juli.logging.Log > 4"", ""CC = 11.0"", ""MLOC > 6.386551724137945"", ""CINT = 9.0, CDISP = 0.4444444444444444, CC > 1.0""]","[""2c22e7e48d789d525366db8fead7d5c1865e48cd""]","[""FeatureEnvy""]","[""c50b439fbe35b3b8fad80d836efc56d0""]",[74],[77],"[""{\""MaxCallChain\"": 2.0, \""LocalityRatio\"": 0.0, \""ParameterCount\"": 0.0, \""CyclomaticComplexity\"": 1.0, \""MethodLinesOfCode\"": 3.0}""]"
Researcher 2,argouml,21309,"[""Move Method"", ""Move Method"", ""Pull Up Method"", ""Pull Up Method"", ""Extract Method"", ""Extract Method""]","[""org.argouml.uml.diagram.static_structure.ui.FigInterface"", ""org.argouml.uml.diagram.static_structure.ui.FigClassifierBox"", ""org.argouml.uml.diagram.static_structure.ui.FigClass"", ""org.argouml.uml.diagram.static_structure.ui.FigClassifierBox.unhighlight""]","[""8cfd8918febb5bc6c8f2280472ff298402371c99"", ""8cfd8918febb5bc6c8f2280472ff298402371c99"", ""8cfd8918febb5bc6c8f2280472ff298402371c99"", ""8cfd8918febb5bc6c8f2280472ff298402371c99"", ""8cfd8918febb5bc6c8f2280472ff298402371c99"", ""8cfd8918febb5bc6c8f2280472ff298402371c99"", ""8cfd8918febb5bc6c8f2280472ff298402371c99"", ""8cfd8918febb5bc6c8f2280472ff298402371c99"", ""8cfd8918febb5bc6c8f2280472ff298402371c99""]","[""SpaghettiCode"", ""ComplexClass"", ""BrainClass"", ""SpaghettiCode"", ""ComplexClass"", ""GodClass"", ""SpaghettiCode"", ""ComplexClass"", ""GodClass""]","[""46a7d13eeecd47a6c995f356bfef20d0"", ""9ce28ef8cb906283fe2a6e976a592653"", ""989f9997d407b2fa7b369c132fce2bf0"", ""48511c040e3b5b9310a556899c3e9c00"", ""88fc4cb4cab531c7b66b1febd2e98004"", ""d0e1bc791a1773d826c1506460e869b1"", ""da9c9846479fb9cde0aeffd9dc96712f"", ""8e84b2b747e5944bb7312a705e6e12b6"", ""eed9ea865a5968d35e56bf1cacd66821""]","[37, 37, 56, 56, 35, 56, 55, 36, 55]","[746, 746, 1697, 1697, 425, 1697, 1357, 410, 1357]","[""LONG_METHODS_CONNECTED = 2"", ""CC = 18.0"", ""BRAIN_METHODS = 1, WMC = 259.0, TCC = 0.08067226890756303"", ""LONG_METHODS_CONNECTED = 5"", ""CC = 58.0"", ""CLOC > 500, TCC < 0.42040823562284796"", ""LONG_METHODS_CONNECTED = 5"", ""CC = 25.0"", ""CLOC > 500, TCC < 0.43751361778444253""]","[""ef0be8b931051ed1898d9d97d2aa6c41cddf85dc"", ""ef0be8b931051ed1898d9d97d2aa6c41cddf85dc"", ""ef0be8b931051ed1898d9d97d2aa6c41cddf85dc"", ""ef0be8b931051ed1898d9d97d2aa6c41cddf85dc"", ""ef0be8b931051ed1898d9d97d2aa6c41cddf85dc""]","[""SpeculativeGenerality"", ""SpaghettiCode"", ""GodClass"", ""ComplexClass"", ""FeatureEnvy""]","[""a9a79f630b94403c2fd07a4891b57e41"", ""866b4958f5a10a7c9cfe18c97a3c4a6a"", ""b14a6f7604d4eea35fdd16570684ee79"", ""7ba0a413ae55ba2d264757ed22947732"", ""d19f1baad939b13aa006a79fe90743c0""]","[34, 54, 74, 435, 190]","[98, 511, 1461, 501, 206]","[""{\""IsAbstract\"": 1.0, \""ClassLinesOfCode\"": 20.0, \""OverrideRatio\"": 0.011764705882352941, \""TightClassCohesion\"": 1.0, \""PublicFieldCount\"": 0.0}"", ""{\""IsAbstract\"": 0.0, \""ClassLinesOfCode\"": 293.0, \""OverrideRatio\"": 0.225, \""TightClassCohesion\"": 0.21904761904761905, \""PublicFieldCount\"": 1.0}"", ""{\""IsAbstract\"": 0.0, \""ClassLinesOfCode\"": 546.0, \""OverrideRatio\"": 0.5454545454545454, \""PublicFieldCount\"": 0.0, \""TightClassCohesion\"": 0.013071895424836602}"", ""{\""IsAbstract\"": 0.0, \""ClassLinesOfCode\"": 293.0, \""OverrideRatio\"": 0.225, \""TightClassCohesion\"": 0.21904761904761905, \""PublicFieldCount\"": 1.0}"", ""{\""LocalityRatio\"": 0.0, \""MethodLinesOfCode\"": 10.0, \""ParameterCount\"": 0.0, \""CyclomaticComplexity\"": 3.0, \""MaxCallChain\"": 1.0}""]"