removal-patterns-feature-envy.csv
Validator,projectName,Batch ID,Refactorings,Code Elements,Start Commit,Smells Before,Smell Before IDs,Smells Before Starting Line,Smell Before Ending Line,Smell Before Reason,End Commit,Smells After,Smell After IDs,Smells After Starting Line,Smell After Ending Line,Smell After Reason
Researcher 2,prestodb_presto,21468,"[""Extract Method"", ""Extract Method"", ""Extract Method"", ""Extract Method"", ""Extract Method"", ""Extract Method""]","[""com.facebook.presto.block.CursorAssertions"", ""com.facebook.presto.block.CursorAssertions.assertCurrentValue"", ""com.facebook.presto.block.CursorAssertions.assertNextPosition"", ""com.facebook.presto.block.CursorAssertions.assertNextValue""]","[""ce2597b43a9045ffd668ee5b46a1b6dc61dd3c02"", ""ce2597b43a9045ffd668ee5b46a1b6dc61dd3c02"", ""ce2597b43a9045ffd668ee5b46a1b6dc61dd3c02"", ""ce2597b43a9045ffd668ee5b46a1b6dc61dd3c02""]","[""IntensiveCoupling"", ""LongMethod"", ""FeatureEnvy"", ""ComplexClass""]","[""9b416092d6e5bafe342020ce90437121"", ""37fe48847364ea501b27cd769cf8d51a"", ""0916c91a123582dcc620ae619cf44777"", ""99da0d5b25545ee1e391134b5f467b13""]","[370, 370, 370, 52]","[430, 430, 430, 640]","[""CINT = 9.0, CDISP = 0.4444444444444444, CC > 1.0"", ""MLOC > 6.384466823010099"", ""CALLS_TO_org.apache.juli.logging.Log > 6"", ""CC = 11.0""]","[""5769228215a1c0e4a430de3f5eabc8ff0eb0e173"", ""5769228215a1c0e4a430de3f5eabc8ff0eb0e173"", ""5769228215a1c0e4a430de3f5eabc8ff0eb0e173""]","[""ComplexClass"", ""LongMethod"", ""FeatureEnvy""]","[""56573ad23203d7d2fa1003b3728dace3"", ""7813146d3838ec2c1ee39cc1de8b0fde"", ""d73ff9dc27ba41f76708ed17dc73671a""]","[85, 85, 123]","[143, 143, 131]","[""{\""IsAbstract\"": 0.0, \""ClassLinesOfCode\"": 81.0, \""OverrideRatio\"": null, \""PublicFieldCount\"": 0.0, \""TightClassCohesion\"": 0.0}"", ""{\""MaxCallChain\"": 2.0, \""ParameterCount\"": 3.0, \""CyclomaticComplexity\"": 11.0, \""MethodLinesOfCode\"": 41.0, \""LocalityRatio\"": 0.0}"", ""{\""LocalityRatio\"": 0.0, \""MethodLinesOfCode\"": 4.0, \""ParameterCount\"": 3.0, \""CyclomaticComplexity\"": 1.0, \""MaxCallChain\"": 3.0}""]"
Researcher 2,prestodb_presto,21490,"[""Extract Method"", ""Extract Method"", ""Extract Method"", ""Extract Method"", ""Extract Method"", ""Extract Method""]","[""com.facebook.presto.execution.TaskOutput"", ""com.facebook.presto.execution.TaskOutput.updateState"", ""com.facebook.presto.execution.TaskOutput.transitionToDoneState"", ""com.facebook.presto.execution.TaskOutput.queryFailed"", ""com.facebook.presto.execution.TaskOutput.cancel""]","[""ce2597b43a9045ffd668ee5b46a1b6dc61dd3c02"", ""ce2597b43a9045ffd668ee5b46a1b6dc61dd3c02"", ""ce2597b43a9045ffd668ee5b46a1b6dc61dd3c02"", ""ce2597b43a9045ffd668ee5b46a1b6dc61dd3c02""]","[""IntensiveCoupling"", ""LongMethod"", ""FeatureEnvy"", ""ComplexClass""]","[""9b416092d6e5bafe342020ce90437121"", ""37fe48847364ea501b27cd769cf8d51a"", ""0916c91a123582dcc620ae619cf44777"", ""99da0d5b25545ee1e391134b5f467b13""]","[370, 370, 370, 52]","[430, 430, 430, 640]","[""CINT = 9.0, CDISP = 0.4444444444444444, CC > 1.0"", ""MLOC > 6.384466823010099"", ""CALLS_TO_org.apache.juli.logging.Log > 6"", ""CC = 11.0""]","[""cc0ab72aca7a4e141bf299b6d43feb3866b1cacf""]","[""FeatureEnvy""]","[""f88209fa019de1c4831e73edf07f39d8""]",[146],[169],"[""{\""ParameterCount\"": 1.0, \""MaxCallChain\"": 2.0, \""LocalityRatio\"": 0.0, \""CyclomaticComplexity\"": 5.0, \""MethodLinesOfCode\"": 12.0}""]"
Researcher 2,prestodb_presto,21510,"[""Extract Method"", ""Extract Method"", ""Extract Method"", ""Extract Method"", ""Extract Method"", ""Extract Method"", ""Extract Method"", ""Extract Method"", ""Extract Method"", ""Extract Method"", ""Extract Method"", ""Extract Method""]","[""com.facebook.presto.sql.Researcher 1lyzer.AggregationResearcher 1lyzer.Visitor"", ""com.facebook.presto.sql.Researcher 1lyzer.AggregationResearcher 1lyzer.Visitor.visitCast"", ""com.facebook.presto.sql.Researcher 1lyzer.AggregationResearcher 1lyzer.Visitor.process"", ""com.facebook.presto.sql.Researcher 1lyzer.AggregationResearcher 1lyzer.Visitor.visitSimpleCaseExpression"", ""com.facebook.presto.sql.Researcher 1lyzer.AggregationResearcher 1lyzer.Visitor.visitNullIfExpression"", ""com.facebook.presto.sql.Researcher 1lyzer.AggregationResearcher 1lyzer.Visitor.visitSearchedCaseExpression"", ""com.facebook.presto.sql.Researcher 1lyzer.AggregationResearcher 1lyzer.Visitor.visitBetweenPredicate"", ""com.facebook.presto.sql.Researcher 1lyzer.AggregationResearcher 1lyzer.Visitor.visitExtract""]","[""88aa08565cb1b36fd646a807edd8d3f22d288159"", ""88aa08565cb1b36fd646a807edd8d3f22d288159"", ""88aa08565cb1b36fd646a807edd8d3f22d288159"", ""88aa08565cb1b36fd646a807edd8d3f22d288159"", ""88aa08565cb1b36fd646a807edd8d3f22d288159"", ""88aa08565cb1b36fd646a807edd8d3f22d288159"", ""88aa08565cb1b36fd646a807edd8d3f22d288159"", ""88aa08565cb1b36fd646a807edd8d3f22d288159"", ""88aa08565cb1b36fd646a807edd8d3f22d288159""]","[""IntensiveCoupling"", ""LongMethod"", ""FeatureEnvy"", ""SpaghettiCode"", ""ComplexClass"", ""GodClass"", ""DispersedCoupling"", ""MessageChain"", ""LongMethod""]","[""8301b005bbdb7852b5b41884ec5d0af4"", ""fae8b4d3758417d358f669cab5af5734"", ""77d3c6b3c4dba9d71879c9ef9e768e31"", ""e793f4451c1a592370615b3c5a198607"", ""af28c6e13bdd320b850068a72aab2231"", ""7628ef6afa559ce2cc0d3adb2b511c2c"", ""db26ea279a2edcedb8a1597d6e2b7f3d"", ""e8e398bee1705c5c759b9f0fe40386ec"", ""1f030d467c7959ea865581f36b9788e5""]","[296, 296, 296, 111, 111, 111, 563, 563, 563]","[387, 387, 387, 2610, 2610, 2610, 662, 662, 662]","[""CINT = 19.0, CDISP = 0.42105263157894735, CC > 1.0"", ""MLOC > 6.392367569056964"", ""CALLS_TO_org.apache.juli.logging.Log > 10"", ""LONG_METHODS_CONNECTED = 12"", ""CC = 14.0"", ""CLOC > 500, TCC < 0.48007932503269046"", ""CINT > 8.0, CDISP > 0.5, CC > 1.0"", ""MAX_CALL_CHAIN = 4.0"", ""MLOC > 6.392367569056964""]","[""a0158b2e568375b4823de59aeaea1ebfa502208e"", ""a0158b2e568375b4823de59aeaea1ebfa502208e""]","[""FeatureEnvy"", ""FeatureEnvy""]","[""27da239690500cb3133b8c86ec4931f4"", ""8703e5d93a76cc0bdf02494b93aba6c7""]","[376, 352]","[394, 374]","[""{\""LocalityRatio\"": 0.1111111111111111, \""MaxCallChain\"": 2.0, \""ParameterCount\"": 2.0, \""CyclomaticComplexity\"": 5.0, \""MethodLinesOfCode\"": 10.0}"", ""{\""LocalityRatio\"": 0.09090909090909091, \""MaxCallChain\"": 2.0, \""ParameterCount\"": 2.0, \""CyclomaticComplexity\"": 6.0, \""MethodLinesOfCode\"": 12.0}""]"
Researcher 2,prestodb_presto,21511,"[""Extract Method"", ""Extract Method"", ""Extract Method"", ""Extract Method""]","[""com.facebook.presto.metadata.MetadataMResearcher 1ger"", ""com.facebook.presto.metadata.MetadataMResearcher 1ger.getColumnHandles"", ""com.facebook.presto.metadata.MetadataMResearcher 1ger.lookupConnectorFor"", ""com.facebook.presto.metadata.MetadataMResearcher 1ger.getTableMetadata""]","[""6791dd2eaa72580a6a5ad580def8da26ca7e2d8a"", ""6791dd2eaa72580a6a5ad580def8da26ca7e2d8a"", ""6791dd2eaa72580a6a5ad580def8da26ca7e2d8a"", ""6791dd2eaa72580a6a5ad580def8da26ca7e2d8a"", ""6791dd2eaa72580a6a5ad580def8da26ca7e2d8a"", ""6791dd2eaa72580a6a5ad580def8da26ca7e2d8a"", ""6791dd2eaa72580a6a5ad580def8da26ca7e2d8a"", ""6791dd2eaa72580a6a5ad580def8da26ca7e2d8a""]","[""IntensiveCoupling"", ""LongMethod"", ""FeatureEnvy"", ""BrainClass"", ""SpaghettiCode"", ""ComplexClass"", ""ClassDataShouldBePrivate"", ""GodClass""]","[""ab7957ef3183e132a4a3a2f4809a02c4"", ""53f4fd3c264a75094d813c6f79c5b62d"", ""49f864b08bd7248d0bfabcfc5226db21"", ""e72b059394d80d481ecb7b467a2421fa"", ""6262ce80aa9081f6fa082b972e7310d7"", ""196cb4a294ca464d557135e06a49eab4"", ""a1f05753fa578a8d7787c84655b4fa0d"", ""29a5efe23f2d2eb4f62c633efd95ac9c""]","[1631, 1631, 1631, 73, 73, 73, 73, 73]","[1779, 1779, 1779, 3168, 3168, 3168, 3168, 3168]","[""CINT = 11.0, CDISP = 0.45454545454545453, CC > 1.0"", ""MLOC > 6.513289260658364"", ""CALLS_TO_org.apache.juli.logging.Log > 9"", ""BRAIN_METHODS = 1, WMC = 458.0, TCC = 0.10048309178743961"", ""LONG_METHODS_CONNECTED = 13"", ""CC = 13.0"", ""PUBLIC_FIELD_COUNT = 1.0"", ""CLOC > 500, TCC < 0.48007932503269046""]","[""0c9ba26e66961382832a4f806247031271473b4c""]","[""FeatureEnvy""]","[""02e0f7bf8b62b18e2d530d56f857446b""]",[215],[238],"[""{\""LocalityRatio\"": 0.0, \""MaxCallChain\"": 1.0, \""ParameterCount\"": 1.0, \""CyclomaticComplexity\"": 7.0, \""MethodLinesOfCode\"": 12.0}""]"
Researcher 3,prestodb_presto,21531,"[""Extract Method"", ""Extract Method"", ""Extract Method"", ""Extract Method"", ""Inline Method"", ""Inline Method"", ""Extract Method"", ""Extract Method""]","[""com.facebook.presto.hive.GenericHiveRecordCursor"", ""com.facebook.presto.hive.GenericHiveRecordCursor.parseRecord"", ""com.facebook.presto.hive.GenericHiveRecordCursor.parseLongColumn"", ""com.facebook.presto.hive.GenericHiveRecordCursor.parseStringColumn"", ""com.facebook.presto.hive.GenericHiveRecordCursor.GenericHiveRecordCursor"", ""com.facebook.presto.hive.GenericHiveRecordCursor.parseColumn"", ""com.facebook.presto.hive.GenericHiveRecordCursor.parseBooleanColumn""]","[""99c03e7258281ef8dbbc2e492faa021d2f1434c0"", ""99c03e7258281ef8dbbc2e492faa021d2f1434c0"", ""99c03e7258281ef8dbbc2e492faa021d2f1434c0""]","[""ComplexClass"", ""GodClass"", ""FeatureEnvy""]","[""97466b0eeb7ea8ea87f90c54e7598338"", ""f6e13883eac9613daecf0410be900853"", ""d39097c0b6e52fdc1ed9b41a6df510f5""]","[56, 60, 547]","[1434, 1506, 593]","[""CC = 14.0"", ""CLOC > 500, TCC < 0.4406466403853435"", ""CALLS_TO_org.apache.juli.logging.Log > 4""]","[""b4bbb4be66ca2aa33be81929068de389c47f702f"", ""b4bbb4be66ca2aa33be81929068de389c47f702f"", ""b4bbb4be66ca2aa33be81929068de389c47f702f"", ""b4bbb4be66ca2aa33be81929068de389c47f702f"", ""b4bbb4be66ca2aa33be81929068de389c47f702f"", ""b4bbb4be66ca2aa33be81929068de389c47f702f""]","[""LongMethod"", ""LongParameterList"", ""FeatureEnvy"", ""FeatureEnvy"", ""FeatureEnvy"", ""ComplexClass""]","[""eb7e3e7828f0d79b06c08a6a0c2b90c7"", ""32da4ee312d93b65144679c42d860028"", ""f3ceeb18dfdee868574f1864abf848a7"", ""d8a79e261d6121a0851dbee18d37fe26"", ""f1cab8e3813f3e9d4a72a47a7c7ecec1"", ""ba55680371bff4ba1ff04509c6ced1a7""]","[61, 61, 61, 247, 315, 167]","[130, 130, 130, 265, 346, 216]","[""{\""LocalityRatio\"": 0.0, \""MaxCallChain\"": 2.0, \""ParameterCount\"": 5.0, \""CyclomaticComplexity\"": 6.0, \""MethodLinesOfCode\"": 46.0}"", ""{\""LocalityRatio\"": 0.0, \""MaxCallChain\"": 2.0, \""ParameterCount\"": 5.0, \""CyclomaticComplexity\"": 6.0, \""MethodLinesOfCode\"": 46.0}"", ""{\""LocalityRatio\"": 0.0, \""MaxCallChain\"": 2.0, \""ParameterCount\"": 5.0, \""CyclomaticComplexity\"": 6.0, \""MethodLinesOfCode\"": 46.0}"", ""{\""LocalityRatio\"": 0.0, \""MaxCallChain\"": 1.0, \""ParameterCount\"": 1.0, \""CyclomaticComplexity\"": 2.0, \""MethodLinesOfCode\"": 10.0}"", ""{\""LocalityRatio\"": 0.0, \""MaxCallChain\"": 2.0, \""ParameterCount\"": 1.0, \""CyclomaticComplexity\"": 5.0, \""MethodLinesOfCode\"": 17.0}"", ""{\""IsAbstract\"": 0.0, \""ClassLinesOfCode\"": 167.0, \""OverrideRatio\"": null, \""TightClassCohesion\"": 0.0, \""PublicFieldCount\"": 0.0}""]"
Researcher 3,prestodb_presto,21534,"[""Move Attribute"", ""Move Attribute"", ""Extract Method"", ""Extract Method"", ""Inline Method"", ""Inline Method""]","[""com.facebook.presto.cli.TableNameCompleter"", ""com.facebook.presto.cli.QueryRunner"", ""com.facebook.presto.cli.QueryRunner.startQuery"", ""com.facebook.presto.cli.QueryRunner.startInternalQuery"", ""com.facebook.presto.cli.TableNameCompleter.complete"", ""com.facebook.presto.cli.TableNameCompleter.loadTableNames""]","[""eaa253e3acd5e89214ab70303fe7e6b0eec7e86d"", ""eaa253e3acd5e89214ab70303fe7e6b0eec7e86d"", ""eaa253e3acd5e89214ab70303fe7e6b0eec7e86d"", ""eaa253e3acd5e89214ab70303fe7e6b0eec7e86d"", ""eaa253e3acd5e89214ab70303fe7e6b0eec7e86d""]","[""IntensiveCoupling"", ""LongMethod"", ""FeatureEnvy"", ""SpaghettiCode"", ""ComplexClass""]","[""c32821c330e476aff5202930b25afb6f"", ""eb5ee0b397f8b452fa4309bb7698a2b7"", ""16472631ea891face307069ddd870fe4"", ""62d2f5c8f73f04e52fcfce2007ff5726"", ""43043e0c060de51d1e98626fffad5b9d""]","[423, 433, 433, 69, 70]","[465, 520, 520, 811, 800]","[""CINT = 9.0, CDISP = 0.3333333333333333, CC > 1.0"", ""MLOC > 6.853962658310414"", ""CALLS_TO_org.apache.tomcat.util.net.AbstractEndpoint > 13"", ""LONG_METHODS_CONNECTED = 3"", ""CC = 15.0""]","[""fca48c5c0df337611bf5aa81f47cc258850c99b0""]","[""FeatureEnvy""]","[""13cd8fd1d6e1c1390893ee78a4295774""]",[30],[65],"[""{\""LocalityRatio\"": 0.20689655172413793, \""ParameterCount\"": 3.0, \""CyclomaticComplexity\"": 6.0, \""MethodLinesOfCode\"": 28.0, \""MaxCallChain\"": 4.0}""]"
Researcher 3,prestodb_presto,21543,"[""Extract Method"", ""Extract Method"", ""Inline Method"", ""Inline Method"", ""Inline Method"", ""Inline Method""]","[""com.facebook.presto.execution.SqlTaskExecution"", ""com.facebook.presto.execution.SqlTaskExecution.addSources"", ""com.facebook.presto.execution.SqlTaskExecution.updateSources"", ""com.facebook.presto.execution.SqlTaskExecution.addSplit"", ""com.facebook.presto.execution.SqlTaskExecution.noMoreSplits""]","[""c74faab2b72f3d28e18672df1b245ca2d489a8d6"", ""c74faab2b72f3d28e18672df1b245ca2d489a8d6"", ""c74faab2b72f3d28e18672df1b245ca2d489a8d6""]","[""ComplexClass"", ""DispersedCoupling"", ""FeatureEnvy""]","[""f7c42172b4c2c5b3b53a856fc8311b83"", ""eee96590201347ce0d96ddf7b5573348"", ""738a3c71a045abfedbbc81b42fee380f""]","[27, 94, 90]","[161, 122, 130]","[""CC = 11.0"", ""CINT > 8.0, CDISP > 0.5, CC > 1.0"", ""CALLS_TO_ch.bind.philib.cache.lru.newimpl.StagedCacheEntry<K,V> > 4""]","[""fd84099f0158b4c7ceb9f3d2bd80a92836d37663"", ""fd84099f0158b4c7ceb9f3d2bd80a92836d37663""]","[""FeatureEnvy"", ""FeatureEnvy""]","[""9359c337a30a219ee29387c2518684d4"", ""fbc3986373d7ac6c575ea0a9553e2604""]","[301, 270]","[363, 292]","[""{\""LocalityRatio\"": 0.15789473684210525, \""MaxCallChain\"": 2.0, \""ParameterCount\"": 1.0, \""CyclomaticComplexity\"": 9.0, \""MethodLinesOfCode\"": 29.0}"", ""{\""MaxCallChain\"": 2.0, \""LocalityRatio\"": 0.2222222222222222, \""ParameterCount\"": 1.0, \""CyclomaticComplexity\"": 5.0, \""MethodLinesOfCode\"": 14.0}""]"
Researcher 3,prestodb_presto,21570,"[""Extract Method"", ""Extract Method"", ""Extract Method"", ""Extract Method""]","[""com.facebook.presto.spi.block.VariableWidthBlockBuilder"", ""com.facebook.presto.spi.block.VariableWidthBlockBuilder.append"", ""com.facebook.presto.spi.block.VariableWidthBlockBuilder.entryAdded"", ""com.facebook.presto.spi.block.VariableWidthBlockBuilder.appendNull""]","[""c74faab2b72f3d28e18672df1b245ca2d489a8d6"", ""c74faab2b72f3d28e18672df1b245ca2d489a8d6"", ""c74faab2b72f3d28e18672df1b245ca2d489a8d6""]","[""ComplexClass"", ""DispersedCoupling"", ""FeatureEnvy""]","[""f7c42172b4c2c5b3b53a856fc8311b83"", ""eee96590201347ce0d96ddf7b5573348"", ""738a3c71a045abfedbbc81b42fee380f""]","[27, 94, 90]","[161, 122, 130]","[""CC = 11.0"", ""CINT > 8.0, CDISP > 0.5, CC > 1.0"", ""CALLS_TO_ch.bind.philib.cache.lru.newimpl.StagedCacheEntry<K,V> > 4""]","[""a9ec889a381067ba84df344ea9a2ee639acc3b59""]","[""FeatureEnvy""]","[""7616143be50818a5d6190200d2774f93""]",[183],[189],"[""{\""MaxCallChain\"": 1.0, \""ParameterCount\"": 1.0, \""CyclomaticComplexity\"": 2.0, \""MethodLinesOfCode\"": 4.0, \""LocalityRatio\"": 0.0}""]"
Researcher 3,prestodb_presto,21571,"[""Extract Method"", ""Extract Method"", ""Extract Method"", ""Extract Method"", ""Extract Method"", ""Extract Method"", ""Extract Method"", ""Extract Method""]","[""com.facebook.presto.operator.TestExchangeOperator.testFinish"", ""com.facebook.presto.operator.TestExchangeOperator"", ""com.facebook.presto.operator.TestExchangeOperator.newRemoteSplit"", ""com.facebook.presto.operator.TestExchangeOperator.testSimple"", ""com.facebook.presto.operator.TestExchangeOperator.testWaitForNoMoreSplits"", ""com.facebook.presto.operator.TestExchangeOperator.testWaitForClose""]","[""31d625e7f02c59778dbf702abb366ddf6fda14b2"", ""31d625e7f02c59778dbf702abb366ddf6fda14b2"", ""31d625e7f02c59778dbf702abb366ddf6fda14b2""]","[""ClassDataShouldBePrivate"", ""FeatureEnvy"", ""FeatureEnvy""]","[""5e17a93cc482175c5e49910f49c9eee7"", ""6efd8d1b46082deee92a3801cac5bd8a"", ""e07e2ce7f1c877e241dea60e29676c7e""]","[32, 321, 304]","[599, 330, 319]","[""{\""IsAbstract\"": 0.0, \""ClassLinesOfCode\"": 306.0, \""OverrideRatio\"": null, \""PublicFieldCount\"": 1.0, \""TightClassCohesion\"": 0.07654127481713689}"", ""{\""MaxCallChain\"": 1.0, \""ParameterCount\"": 0.0, \""CyclomaticComplexity\"": 2.0, \""MethodLinesOfCode\"": 4.0, \""LocalityRatio\"": 0.0}"", ""{\""MaxCallChain\"": 1.0, \""ParameterCount\"": 0.0, \""CyclomaticComplexity\"": 2.0, \""MethodLinesOfCode\"": 4.0, \""LocalityRatio\"": 0.0}""]","[""d56e491885b9f2ac1a841084d0f05d74a7b2990e""]","[""FeatureEnvy""]","[""560f39234d8cdc4770e4091a0cf20b1a""]",[152],[155],"[""{\""MethodLinesOfCode\"": 2.0, \""LocalityRatio\"": 0.0, \""ParameterCount\"": 1.0, \""CyclomaticComplexity\"": 1.0, \""MaxCallChain\"": 1.0}""]"
Researcher 3,prestodb_presto,21588,"[""Extract Method"", ""Extract Method"", ""Extract Method"", ""Extract Method"", ""Extract Method"", ""Extract Method"", ""Extract Method"", ""Extract Method""]","[""com.facebook.presto.metadata.HandleResolver"", ""com.facebook.presto.metadata.HandleResolver.getSplitClass"", ""com.facebook.presto.metadata.HandleResolver.resolverFor"", ""com.facebook.presto.metadata.HandleResolver.getTableHandleClass"", ""com.facebook.presto.metadata.HandleResolver.getIndexHandleClass"", ""com.facebook.presto.metadata.HandleResolver.getColumnHandleClass""]","[""d71c355b885c06ea0421a0d30fa2e6df0de3edaf"", ""d71c355b885c06ea0421a0d30fa2e6df0de3edaf"", ""d71c355b885c06ea0421a0d30fa2e6df0de3edaf""]","[""FeatureEnvy"", ""FeatureEnvy"", ""FeatureEnvy""]","[""10e306299afdee6f46dda2edcef0f568"", ""a2c9fdbd3a7eed6a741501b71ed6447e"", ""336c7fa2e64f6fff41d8477a1470baa5""]","[48, 62, 77]","[60, 75, 91]","[""{\""LocalityRatio\"": 0.0, \""ParameterCount\"": 2.0, \""CyclomaticComplexity\"": 5.0, \""MethodLinesOfCode\"": 12.0, \""MaxCallChain\"": 1.0}"", ""{\""LocalityRatio\"": 0.0, \""ParameterCount\"": 1.0, \""CyclomaticComplexity\"": 2.0, \""MethodLinesOfCode\"": 6.0, \""MaxCallChain\"": 1.0}"", ""{\""LocalityRatio\"": 0.0, \""ParameterCount\"": 2.0, \""CyclomaticComplexity\"": 2.0, \""MethodLinesOfCode\"": 6.0, \""MaxCallChain\"": 1.0}""]","[""a1c516de0fe6a7a36dd6398cfb8a4cf4a0828050""]","[""FeatureEnvy""]","[""0cb77e62f14507d7e6ac27bbcf6dc238""]",[112],[117],"[""{\""MethodLinesOfCode\"": 4.0, \""MaxCallChain\"": 1.0, \""ParameterCount\"": 1.0, \""CyclomaticComplexity\"": 1.0, \""LocalityRatio\"": 0.0}""]"
Researcher 3,prestodb_presto,21598,"[""Move Attribute"", ""Move Attribute"", ""Move Attribute"", ""Move Attribute"", ""Move Attribute"", ""Move Attribute"", ""Move Attribute"", ""Move Attribute"", ""Move Method"", ""Move Method"", ""Move Method"", ""Move Method"", ""Move Attribute"", ""Move Attribute"", ""Move Attribute"", ""Move Attribute"", ""Move Attribute"", ""Move Attribute"", ""Move Attribute"", ""Move Attribute"", ""Extract Method"", ""Extract Method""]","[""com.facebook.presto.jdbc.ColumnInfo"", ""com.facebook.presto.jdbc.PrestoResultSet"", ""com.facebook.presto.jdbc.PrestoResultSet.setTypeInfo"", ""com.facebook.presto.jdbc.PrestoResultSet.getType""]","[""62274771c06c9cea723358313967e2fab49df3d2"", ""62274771c06c9cea723358313967e2fab49df3d2"", ""62274771c06c9cea723358313967e2fab49df3d2"", ""62274771c06c9cea723358313967e2fab49df3d2"", ""62274771c06c9cea723358313967e2fab49df3d2"", ""62274771c06c9cea723358313967e2fab49df3d2"", ""62274771c06c9cea723358313967e2fab49df3d2"", ""62274771c06c9cea723358313967e2fab49df3d2"", ""62274771c06c9cea723358313967e2fab49df3d2"", ""62274771c06c9cea723358313967e2fab49df3d2""]","[""ComplexClass"", ""RefusedBequest"", ""FeatureEnvy"", ""LongMethod"", ""ComplexClass"", ""ClassDataShouldBePrivate"", ""GodClass"", ""SpaghettiCode"", ""FeatureEnvy"", ""LongMethod""]","[""eb6f681a8804161475b30ddb4aedf84a"", ""d0e1755bf8ec872571493be8f885537b"", ""a2a8d5517d5c62ac85abfb13418dc01d"", ""e682bf6727361d545af9ef1efb9d111e"", ""a5d8c6dd6c4e101438d79cf43379cee4"", ""f4068142930528628c266503eab3f2e4"", ""a923c9e6dc2c6f22c48a86a9a3ec4282"", ""3e037ad8bbc199a4f9436d1f811550cc"", ""3521172f9a72572b9e37677f8f421114"", ""93b10e13c7d3b58a54ba63d749417dd9""]","[71, 42, 69, 69, 832, 60, 63, 60, 71, 71]","[141, 146, 180, 180, 887, 926, 1027, 926, 141, 141]","[""{\""IsAbstract\"": 0.0, \""ClassLinesOfCode\"": 60.0, \""OverrideRatio\"": 0.6, \""TightClassCohesion\"": 0.0, \""PublicFieldCount\"": 0.0}"", ""{\""IsAbstract\"": 0.0, \""ClassLinesOfCode\"": 60.0, \""OverrideRatio\"": 0.6, \""TightClassCohesion\"": 0.0, \""PublicFieldCount\"": 0.0}"", ""{\""MethodLinesOfCode\"": 45.0, \""LocalityRatio\"": 0.0, \""CyclomaticComplexity\"": 8.0, \""ParameterCount\"": 1.0, \""MaxCallChain\"": 2.0}"", ""{\""MethodLinesOfCode\"": 45.0, \""LocalityRatio\"": 0.0, \""CyclomaticComplexity\"": 8.0, \""ParameterCount\"": 1.0, \""MaxCallChain\"": 2.0}"", ""{\""IsAbstract\"": 0.0, \""ClassLinesOfCode\"": 500.0, \""OverrideRatio\"": null, \""TightClassCohesion\"": 0.050921861281826165, \""PublicFieldCount\"": 14.0}"", ""{\""IsAbstract\"": 0.0, \""ClassLinesOfCode\"": 500.0, \""OverrideRatio\"": null, \""TightClassCohesion\"": 0.050921861281826165, \""PublicFieldCount\"": 14.0}"", ""{\""IsAbstract\"": 0.0, \""ClassLinesOfCode\"": 552.0, \""OverrideRatio\"": null, \""TightClassCohesion\"": 0.04886128364389234, \""PublicFieldCount\"": 14.0}"", ""{\""IsAbstract\"": 0.0, \""ClassLinesOfCode\"": 500.0, \""OverrideRatio\"": null, \""TightClassCohesion\"": 0.050921861281826165, \""PublicFieldCount\"": 14.0}"", ""{\""MethodLinesOfCode\"": 48.0, \""LocalityRatio\"": 0.0, \""CyclomaticComplexity\"": 13.0, \""ParameterCount\"": 1.0, \""MaxCallChain\"": 3.0}"", ""{\""MethodLinesOfCode\"": 48.0, \""LocalityRatio\"": 0.0, \""CyclomaticComplexity\"": 13.0, \""ParameterCount\"": 1.0, \""MaxCallChain\"": 3.0}""]","[""8c1ee328325048f77abf8864c479a4fa0a39d864"", ""8c1ee328325048f77abf8864c479a4fa0a39d864""]","[""ComplexClass"", ""GodClass""]","[""287be708dec2f47a71469cb71db38bde"", ""b3094a21139809cf5e12ec71fbff8485""]","[70, 70]","[142, 1881]","[""{\""IsAbstract\"": 0.0, \""ClassLinesOfCode\"": 221.0, \""OverrideRatio\"": null, \""PublicFieldCount\"": 0.0, \""TightClassCohesion\"": 0.10457516339869281}"", ""{\""IsAbstract\"": 0.0, \""ClassLinesOfCode\"": 863.0, \""OverrideRatio\"": null, \""TightClassCohesion\"": 0.00026986183074265976, \""PublicFieldCount\"": 0.0}""]"
Researcher 3,prestodb_presto,21602,"[""Extract Superclass"", ""Extract Superclass"", ""Extract Method"", ""Extract Method""]","[""com.facebook.presto.hive.orc.TestOrcReader"", ""com.facebook.presto.hive.orc.AbstractTestOrcReader"", ""com.facebook.presto.hive.orc.TestOrcReader.writeOrcColumn"", ""com.facebook.presto.hive.orc.TestOrcReader.createOrcRecordWriter""]","[""62274771c06c9cea723358313967e2fab49df3d2"", ""62274771c06c9cea723358313967e2fab49df3d2"", ""62274771c06c9cea723358313967e2fab49df3d2"", ""62274771c06c9cea723358313967e2fab49df3d2"", ""62274771c06c9cea723358313967e2fab49df3d2"", ""62274771c06c9cea723358313967e2fab49df3d2"", ""62274771c06c9cea723358313967e2fab49df3d2"", ""62274771c06c9cea723358313967e2fab49df3d2"", ""62274771c06c9cea723358313967e2fab49df3d2"", ""62274771c06c9cea723358313967e2fab49df3d2""]","[""ComplexClass"", ""RefusedBequest"", ""FeatureEnvy"", ""LongMethod"", ""ComplexClass"", ""ClassDataShouldBePrivate"", ""GodClass"", ""SpaghettiCode"", ""FeatureEnvy"", ""LongMethod""]","[""eb6f681a8804161475b30ddb4aedf84a"", ""d0e1755bf8ec872571493be8f885537b"", ""a2a8d5517d5c62ac85abfb13418dc01d"", ""e682bf6727361d545af9ef1efb9d111e"", ""a5d8c6dd6c4e101438d79cf43379cee4"", ""f4068142930528628c266503eab3f2e4"", ""a923c9e6dc2c6f22c48a86a9a3ec4282"", ""3e037ad8bbc199a4f9436d1f811550cc"", ""3521172f9a72572b9e37677f8f421114"", ""93b10e13c7d3b58a54ba63d749417dd9""]","[71, 42, 69, 69, 832, 60, 63, 60, 71, 71]","[141, 146, 180, 180, 887, 926, 1027, 926, 141, 141]","[""{\""IsAbstract\"": 0.0, \""ClassLinesOfCode\"": 60.0, \""OverrideRatio\"": 0.6, \""TightClassCohesion\"": 0.0, \""PublicFieldCount\"": 0.0}"", ""{\""IsAbstract\"": 0.0, \""ClassLinesOfCode\"": 60.0, \""OverrideRatio\"": 0.6, \""TightClassCohesion\"": 0.0, \""PublicFieldCount\"": 0.0}"", ""{\""MethodLinesOfCode\"": 45.0, \""LocalityRatio\"": 0.0, \""CyclomaticComplexity\"": 8.0, \""ParameterCount\"": 1.0, \""MaxCallChain\"": 2.0}"", ""{\""MethodLinesOfCode\"": 45.0, \""LocalityRatio\"": 0.0, \""CyclomaticComplexity\"": 8.0, \""ParameterCount\"": 1.0, \""MaxCallChain\"": 2.0}"", ""{\""IsAbstract\"": 0.0, \""ClassLinesOfCode\"": 500.0, \""OverrideRatio\"": null, \""TightClassCohesion\"": 0.050921861281826165, \""PublicFieldCount\"": 14.0}"", ""{\""IsAbstract\"": 0.0, \""ClassLinesOfCode\"": 500.0, \""OverrideRatio\"": null, \""TightClassCohesion\"": 0.050921861281826165, \""PublicFieldCount\"": 14.0}"", ""{\""IsAbstract\"": 0.0, \""ClassLinesOfCode\"": 552.0, \""OverrideRatio\"": null, \""TightClassCohesion\"": 0.04886128364389234, \""PublicFieldCount\"": 14.0}"", ""{\""IsAbstract\"": 0.0, \""ClassLinesOfCode\"": 500.0, \""OverrideRatio\"": null, \""TightClassCohesion\"": 0.050921861281826165, \""PublicFieldCount\"": 14.0}"", ""{\""MethodLinesOfCode\"": 48.0, \""LocalityRatio\"": 0.0, \""CyclomaticComplexity\"": 13.0, \""ParameterCount\"": 1.0, \""MaxCallChain\"": 3.0}"", ""{\""MethodLinesOfCode\"": 48.0, \""LocalityRatio\"": 0.0, \""CyclomaticComplexity\"": 13.0, \""ParameterCount\"": 1.0, \""MaxCallChain\"": 3.0}""]","[""9a58158917c68c860e826d259f70108b62451d3c"", ""9a58158917c68c860e826d259f70108b62451d3c""]","[""LazyClass"", ""SpeculativeGenerality""]","[""e7df03144aad3a2d5bf8a0872a32045d"", ""ce3adf1478e7e58d8ff97bf6d79ec627""]","[18, 64]","[26, 601]","[""{\""IsAbstract\"": 0.0, \""ClassLinesOfCode\"": 4.0, \""OverrideRatio\"": 0.0, \""PublicFieldCount\"": 0.0, \""TightClassCohesion\"": 1.0}"", ""{\""IsAbstract\"": 1.0, \""ClassLinesOfCode\"": 293.0, \""OverrideRatio\"": null, \""PublicFieldCount\"": 0.0, \""TightClassCohesion\"": 0.3216374269005848}""]"
Researcher 1 ,prestodb_presto,21607,"[""Extract Method"", ""Extract Method"", ""Extract Method"", ""Extract Method""]","[""com.facebook.presto.raptor.storage.OrcStorageMResearcher 1ger.getStagingFile"", ""com.facebook.presto.raptor.storage.OrcStorageMResearcher 1ger"", ""com.facebook.presto.raptor.storage.OrcStorageMResearcher 1ger.getFileSystemPath"", ""com.facebook.presto.raptor.storage.OrcStorageMResearcher 1ger.getStorageFile""]","[""c819f4ae726e3ed9a36faa0e6ce9de54c54b0e4f"", ""c819f4ae726e3ed9a36faa0e6ce9de54c54b0e4f""]","[""FeatureEnvy"", ""FeatureEnvy""]","[""0424761e514c6a7b26f9f13601719e43"", ""8fd3987138b3c9f043c7f54b3a070772""]","[425, 446]","[443, 458]","[""{\""LocalityRatio\"": 0.0, \""MaxCallChain\"": 1.0, \""ParameterCount\"": 1.0, \""CyclomaticComplexity\"": 1.0, \""MethodLinesOfCode\"": 14.0}"", ""{\""LocalityRatio\"": 0.0, \""MaxCallChain\"": 2.0, \""ParameterCount\"": 1.0, \""CyclomaticComplexity\"": 1.0, \""MethodLinesOfCode\"": 10.0}""]","[""d0141e6ce04233446a960c7dd8d2262f15806513"", ""d0141e6ce04233446a960c7dd8d2262f15806513""]","[""FeatureEnvy"", ""MessageChain""]","[""52d9875b9c4ae8214e1b5299bf96f19e"", ""f1d15b21a61c9cce80a0990230607d52""]","[352, 352]","[376, 376]","[""{\""LocalityRatio\"": 0.0, \""MaxCallChain\"": 5.0, \""ParameterCount\"": 2.0, \""CyclomaticComplexity\"": 1.0, \""MethodLinesOfCode\"": 3.0}"", ""{\""LocalityRatio\"": 0.0, \""MaxCallChain\"": 5.0, \""ParameterCount\"": 2.0, \""CyclomaticComplexity\"": 1.0, \""MethodLinesOfCode\"": 3.0}""]"
Researcher 1,prestodb_presto,21616,"[""Extract Method"", ""Extract Method"", ""Extract Method"", ""Extract Method""]","[""com.facebook.presto.server.PluginMResearcher 1ger"", ""com.facebook.presto.server.PluginMResearcher 1ger.buildClassLoaderFromCoordinates"", ""com.facebook.presto.server.PluginMResearcher 1ger.createClassLoader"", ""com.facebook.presto.server.PluginMResearcher 1ger.buildClassLoaderFromPom""]","[""28064debf6bb6fde03757eacd1842e902d32ea5e"", ""28064debf6bb6fde03757eacd1842e902d32ea5e"", ""28064debf6bb6fde03757eacd1842e902d32ea5e"", ""28064debf6bb6fde03757eacd1842e902d32ea5e""]","[""ComplexClass"", ""FeatureEnvy"", ""FeatureEnvy"", ""FeatureEnvy""]","[""a67f6edd26d5a27278a780960d3cf395"", ""56424829adf93d9faf1749de87f558ab"", ""754c4bd8fd9c1ff9da4e04110221d318"", ""d740329e17a27b9c12b3b31236c72f13""]","[118, 235, 232, 228]","[225, 237, 234, 231]","[""{\""IsAbstract\"": 0.0, \""ClassLinesOfCode\"": 73.0, \""OverrideRatio\"": 0.0, \""TightClassCohesion\"": 0.22727272727272727, \""PublicFieldCount\"": 0.0}"", ""{\""MaxCallChain\"": 2.0, \""LocalityRatio\"": 0.0, \""ParameterCount\"": 1.0, \""CyclomaticComplexity\"": 1.0, \""MethodLinesOfCode\"": 2.0}"", ""{\""MaxCallChain\"": 2.0, \""LocalityRatio\"": 0.0, \""ParameterCount\"": 1.0, \""CyclomaticComplexity\"": 1.0, \""MethodLinesOfCode\"": 2.0}"", ""{\""MaxCallChain\"": 2.0, \""LocalityRatio\"": 0.0, \""ParameterCount\"": 1.0, \""CyclomaticComplexity\"": 1.0, \""MethodLinesOfCode\"": 2.0}""]","[""ce4ce3998e5f2545e54cf3d7a2a656d6e260c362""]","[""FeatureEnvy""]","[""a2b18590e41fdc3f3b2872953cdf41bb""]",[277],[281],"[""{\""MaxCallChain\"": 2.0, \""MethodLinesOfCode\"": 3.0, \""ParameterCount\"": 1.0, \""CyclomaticComplexity\"": 1.0, \""LocalityRatio\"": 0.0}""]"
Researcher 3,prestodb_presto,21640,"[""Extract Method"", ""Extract Method"", ""Extract Method"", ""Extract Method""]","[""com.facebook.presto.operator.LookupJoinOperator.needsInput"", ""com.facebook.presto.operator.LookupJoinOperator"", ""com.facebook.presto.operator.LookupJoinOperator.tryGetLookupSource"", ""com.facebook.presto.operator.LookupJoinOperator.getOutput""]","[""3364ba863cbdd62747f092e05f2e84c5e1e1c1b2"", ""3364ba863cbdd62747f092e05f2e84c5e1e1c1b2"", ""3364ba863cbdd62747f092e05f2e84c5e1e1c1b2"", ""3364ba863cbdd62747f092e05f2e84c5e1e1c1b2"", ""3364ba863cbdd62747f092e05f2e84c5e1e1c1b2"", ""3364ba863cbdd62747f092e05f2e84c5e1e1c1b2"", ""3364ba863cbdd62747f092e05f2e84c5e1e1c1b2"", ""3364ba863cbdd62747f092e05f2e84c5e1e1c1b2"", ""3364ba863cbdd62747f092e05f2e84c5e1e1c1b2""]","[""FeatureEnvy"", ""FeatureEnvy"", ""LongMethod"", ""MessageChain"", ""GodClass"", ""RefusedBequest"", ""ComplexClass"", ""SpaghettiCode"", ""FeatureEnvy""]","[""1d2398afbcb32d86043052acd7602308"", ""f05aa7c02f5dde47e413ec2a69dc1ff6"", ""9564b7174e3906bee951df4fdd892061"", ""763fe0e97efe23dd0121aef4553a329d"", ""11d217c5c4502de050a99b907d368f44"", ""5bda39f7c09bbe35f1bbecd8528d2a4a"", ""79aece39a8460563d30615760079c868"", ""9c9e7c4c4af966339524749e7a9c7325"", ""a3c49f5d6cf64d1ff5c57072dcc67718""]","[2823, 2015, 2015, 2015, 155, 155, 182, 155, 2609]","[2855, 2581, 2581, 2581, 2109, 2109, 295, 2109, 2618]","[""{\""MethodLinesOfCode\"": 25.0, \""MaxCallChain\"": 1.0, \""ParameterCount\"": 1.0, \""CyclomaticComplexity\"": 9.0, \""LocalityRatio\"": 0.0}"", ""{\""MethodLinesOfCode\"": 311.0, \""MaxCallChain\"": 4.0, \""ParameterCount\"": 2.0, \""CyclomaticComplexity\"": 107.0, \""LocalityRatio\"": 0.07111111111111111}"", ""{\""MethodLinesOfCode\"": 311.0, \""MaxCallChain\"": 4.0, \""ParameterCount\"": 2.0, \""CyclomaticComplexity\"": 107.0, \""LocalityRatio\"": 0.07111111111111111}"", ""{\""MethodLinesOfCode\"": 311.0, \""MaxCallChain\"": 4.0, \""ParameterCount\"": 2.0, \""CyclomaticComplexity\"": 107.0, \""LocalityRatio\"": 0.07111111111111111}"", ""{\""IsAbstract\"": 0.0, \""ClassLinesOfCode\"": 963.0, \""OverrideRatio\"": 0.5333333333333333, \""TightClassCohesion\"": 0.0026455026455026454, \""PublicFieldCount\"": 0.0}"", ""{\""IsAbstract\"": 0.0, \""ClassLinesOfCode\"": 963.0, \""OverrideRatio\"": 0.5333333333333333, \""TightClassCohesion\"": 0.0026455026455026454, \""PublicFieldCount\"": 0.0}"", ""{\""IsAbstract\"": 0.0, \""ClassLinesOfCode\"": 963.0, \""OverrideRatio\"": 0.5333333333333333, \""TightClassCohesion\"": 0.0026455026455026454, \""PublicFieldCount\"": 0.0}"", ""{\""IsAbstract\"": 0.0, \""ClassLinesOfCode\"": 963.0, \""OverrideRatio\"": 0.5333333333333333, \""TightClassCohesion\"": 0.0026455026455026454, \""PublicFieldCount\"": 0.0}"", ""{\""MethodLinesOfCode\"": 8.0, \""MaxCallChain\"": 2.0, \""ParameterCount\"": 2.0, \""CyclomaticComplexity\"": 3.0, \""LocalityRatio\"": 0.0}""]","[""b7f4914d81a7a618acf2eba52af1093fc23cfba9""]","[""FeatureEnvy""]","[""8d2251a95a6af0529c12c6ab90b8c820""]",[295],[302],"[""{\""ParameterCount\"": 0.0, \""MaxCallChain\"": 1.0, \""LocalityRatio\"": 0.0, \""CyclomaticComplexity\"": 2.0, \""MethodLinesOfCode\"": 4.0}""]"
Researcher 1,prestodb_presto,21645,"[""Extract Method"", ""Extract Method"", ""Extract Method"", ""Extract Method"", ""Extract Method"", ""Extract Method""]","[""com.facebook.presto.hive.metastore.CachingHiveMetastore.createTable"", ""com.facebook.presto.hive.metastore.CachingHiveMetastore"", ""com.facebook.presto.hive.metastore.CachingHiveMetastore.invalidateTable"", ""com.facebook.presto.hive.metastore.CachingHiveMetastore.renameTable"", ""com.facebook.presto.hive.metastore.CachingHiveMetastore.dropTable""]","[""3364ba863cbdd62747f092e05f2e84c5e1e1c1b2"", ""3364ba863cbdd62747f092e05f2e84c5e1e1c1b2"", ""3364ba863cbdd62747f092e05f2e84c5e1e1c1b2"", ""3364ba863cbdd62747f092e05f2e84c5e1e1c1b2"", ""3364ba863cbdd62747f092e05f2e84c5e1e1c1b2"", ""3364ba863cbdd62747f092e05f2e84c5e1e1c1b2"", ""3364ba863cbdd62747f092e05f2e84c5e1e1c1b2"", ""3364ba863cbdd62747f092e05f2e84c5e1e1c1b2"", ""3364ba863cbdd62747f092e05f2e84c5e1e1c1b2""]","[""FeatureEnvy"", ""FeatureEnvy"", ""LongMethod"", ""MessageChain"", ""GodClass"", ""RefusedBequest"", ""ComplexClass"", ""SpaghettiCode"", ""FeatureEnvy""]","[""1d2398afbcb32d86043052acd7602308"", ""f05aa7c02f5dde47e413ec2a69dc1ff6"", ""9564b7174e3906bee951df4fdd892061"", ""763fe0e97efe23dd0121aef4553a329d"", ""11d217c5c4502de050a99b907d368f44"", ""5bda39f7c09bbe35f1bbecd8528d2a4a"", ""79aece39a8460563d30615760079c868"", ""9c9e7c4c4af966339524749e7a9c7325"", ""a3c49f5d6cf64d1ff5c57072dcc67718""]","[2823, 2015, 2015, 2015, 155, 155, 182, 155, 2609]","[2855, 2581, 2581, 2581, 2109, 2109, 295, 2109, 2618]","[""{\""MethodLinesOfCode\"": 25.0, \""MaxCallChain\"": 1.0, \""ParameterCount\"": 1.0, \""CyclomaticComplexity\"": 9.0, \""LocalityRatio\"": 0.0}"", ""{\""MethodLinesOfCode\"": 311.0, \""MaxCallChain\"": 4.0, \""ParameterCount\"": 2.0, \""CyclomaticComplexity\"": 107.0, \""LocalityRatio\"": 0.07111111111111111}"", ""{\""MethodLinesOfCode\"": 311.0, \""MaxCallChain\"": 4.0, \""ParameterCount\"": 2.0, \""CyclomaticComplexity\"": 107.0, \""LocalityRatio\"": 0.07111111111111111}"", ""{\""MethodLinesOfCode\"": 311.0, \""MaxCallChain\"": 4.0, \""ParameterCount\"": 2.0, \""CyclomaticComplexity\"": 107.0, \""LocalityRatio\"": 0.07111111111111111}"", ""{\""IsAbstract\"": 0.0, \""ClassLinesOfCode\"": 963.0, \""OverrideRatio\"": 0.5333333333333333, \""TightClassCohesion\"": 0.0026455026455026454, \""PublicFieldCount\"": 0.0}"", ""{\""IsAbstract\"": 0.0, \""ClassLinesOfCode\"": 963.0, \""OverrideRatio\"": 0.5333333333333333, \""TightClassCohesion\"": 0.0026455026455026454, \""PublicFieldCount\"": 0.0}"", ""{\""IsAbstract\"": 0.0, \""ClassLinesOfCode\"": 963.0, \""OverrideRatio\"": 0.5333333333333333, \""TightClassCohesion\"": 0.0026455026455026454, \""PublicFieldCount\"": 0.0}"", ""{\""IsAbstract\"": 0.0, \""ClassLinesOfCode\"": 963.0, \""OverrideRatio\"": 0.5333333333333333, \""TightClassCohesion\"": 0.0026455026455026454, \""PublicFieldCount\"": 0.0}"", ""{\""MethodLinesOfCode\"": 8.0, \""MaxCallChain\"": 2.0, \""ParameterCount\"": 2.0, \""CyclomaticComplexity\"": 3.0, \""LocalityRatio\"": 0.0}""]","[""7e49bff71f42fda77e15fc1c2c8c3f4223a7e3ff"", ""7e49bff71f42fda77e15fc1c2c8c3f4223a7e3ff"", ""7e49bff71f42fda77e15fc1c2c8c3f4223a7e3ff"", ""7e49bff71f42fda77e15fc1c2c8c3f4223a7e3ff"", ""7e49bff71f42fda77e15fc1c2c8c3f4223a7e3ff"", ""7e49bff71f42fda77e15fc1c2c8c3f4223a7e3ff""]","[""MessageChain"", ""FeatureEnvy"", ""FeatureEnvy"", ""MessageChain"", ""LongParameterList"", ""MessageChain""]","[""cf878044683f8f5f72d632306985b5af"", ""4bd6a1c79bac9ca3d1d434e03887f821"", ""c0891b0f7c0bee1ec63a5acd6b28acb8"", ""1bac580759a9304d9008089f6899e2d2"", ""8a6b0cabbd452cd60d48cb25d1e67528"", ""8fc476ba472063e900a651dffb3da39f""]","[395, 395, 432, 432, 465, 465]","[430, 430, 463, 463, 508, 508]","[""{\""MaxCallChain\"": 5.0, \""LocalityRatio\"": 0.0, \""ParameterCount\"": 1.0, \""CyclomaticComplexity\"": 7.0, \""MethodLinesOfCode\"": 25.0}"", ""{\""MaxCallChain\"": 5.0, \""LocalityRatio\"": 0.0, \""ParameterCount\"": 1.0, \""CyclomaticComplexity\"": 7.0, \""MethodLinesOfCode\"": 25.0}"", ""{\""MaxCallChain\"": 4.0, \""LocalityRatio\"": 0.0, \""ParameterCount\"": 2.0, \""CyclomaticComplexity\"": 6.0, \""MethodLinesOfCode\"": 20.0}"", ""{\""MaxCallChain\"": 4.0, \""LocalityRatio\"": 0.0, \""ParameterCount\"": 2.0, \""CyclomaticComplexity\"": 6.0, \""MethodLinesOfCode\"": 20.0}"", ""{\""MaxCallChain\"": 5.0, \""LocalityRatio\"": 0.0, \""ParameterCount\"": 4.0, \""CyclomaticComplexity\"": 8.0, \""MethodLinesOfCode\"": 30.0}"", ""{\""MaxCallChain\"": 5.0, \""LocalityRatio\"": 0.0, \""ParameterCount\"": 4.0, \""CyclomaticComplexity\"": 8.0, \""MethodLinesOfCode\"": 30.0}""]"
Researcher 3,prestodb_presto,21653,"[""Extract Method"", ""Extract Method"", ""Inline Method"", ""Inline Method""]","[""com.facebook.presto.hive.HiveMetadata"", ""com.facebook.presto.hive.HiveMetadata.commitCreateTable"", ""com.facebook.presto.hive.HiveMetadata.createTable"", ""com.facebook.presto.hive.HiveMetadata.getTargetPath"", ""com.facebook.presto.hive.HiveMetadata.beginCreateTable""]","[""1acec9b7a2c6cc7c3748c5f158bf55025b621e22"", ""1acec9b7a2c6cc7c3748c5f158bf55025b621e22""]","[""FeatureEnvy"", ""FeatureEnvy""]","[""ed78783f7d3b6955b423e59be1be647d"", ""4e0027355c1cbf4585bdc66ea6226fda""]","[162, 265]","[182, 285]","[""{\""MethodLinesOfCode\"": 11.0, \""LocalityRatio\"": 0.0, \""ParameterCount\"": 1.0, \""CyclomaticComplexity\"": 4.0, \""MaxCallChain\"": 1.0}"", ""{\""MethodLinesOfCode\"": 11.0, \""LocalityRatio\"": 0.0, \""ParameterCount\"": 1.0, \""CyclomaticComplexity\"": 4.0, \""MaxCallChain\"": 1.0}""]","[""c67be7691a39f797522a8a19cde3a2011b0ecfe4"", ""c67be7691a39f797522a8a19cde3a2011b0ecfe4"", ""c67be7691a39f797522a8a19cde3a2011b0ecfe4"", ""c67be7691a39f797522a8a19cde3a2011b0ecfe4"", ""c67be7691a39f797522a8a19cde3a2011b0ecfe4""]","[""LongParameterList"", ""LongMethod"", ""FeatureEnvy"", ""FeatureEnvy"", ""FeatureEnvy""]","[""b7580bc0ef6d081856cf5e4563ca6cf4"", ""41d6b8402c3607782d70930843ac1163"", ""96ed35e8247d01ee34a6dece61ea48da"", ""02d5f7c036fe3c2ae9d6b8c90cb36cc2"", ""77029d929f834d5432f9d675da49501e""]","[353, 353, 353, 338, 514]","[403, 403, 403, 420, 587]","[""{\""MethodLinesOfCode\"": 35.0, \""LocalityRatio\"": 0.0, \""ParameterCount\"": 6.0, \""CyclomaticComplexity\"": 4.0, \""MaxCallChain\"": 2.0}"", ""{\""MethodLinesOfCode\"": 35.0, \""LocalityRatio\"": 0.0, \""ParameterCount\"": 6.0, \""CyclomaticComplexity\"": 4.0, \""MaxCallChain\"": 2.0}"", ""{\""MethodLinesOfCode\"": 35.0, \""LocalityRatio\"": 0.0, \""ParameterCount\"": 6.0, \""CyclomaticComplexity\"": 4.0, \""MaxCallChain\"": 2.0}"", ""{\""LocalityRatio\"": 0.24, \""MaxCallChain\"": 3.0, \""ParameterCount\"": 2.0, \""CyclomaticComplexity\"": 9.0, \""MethodLinesOfCode\"": 36.0}"", ""{\""MaxCallChain\"": 5.0, \""LocalityRatio\"": 0.1111111111111111, \""ParameterCount\"": 3.0, \""CyclomaticComplexity\"": 6.0, \""MethodLinesOfCode\"": 46.0}""]"
Researcher 3,prestodb_presto,21658,"[""Move Method"", ""Move Method"", ""Move Method"", ""Move Method"", ""Extract Method"", ""Extract Method""]","[""com.facebook.presto.kafka.TestKafkaPlugin.TestingTypeMResearcher 1ger"", ""com.facebook.presto.metadata.FunctionRegistry"", ""com.facebook.presto.type.TypeRegistry"", ""com.facebook.presto.metadata.FunctionRegistry.getCoercion""]","[""4d40851796d952fad48f4a8952291b6ea9863eb9"", ""4d40851796d952fad48f4a8952291b6ea9863eb9""]","[""FeatureEnvy"", ""FeatureEnvy""]","[""1787f71327aac4a697152eb261f25981"", ""89740d83b9c85b84660de6d9a504cbaa""]","[100, 150]","[120, 297]","[""{\""MaxCallChain\"": 2.0, \""ParameterCount\"": 1.0, \""CyclomaticComplexity\"": 1.0, \""MethodLinesOfCode\"": 7.0, \""LocalityRatio\"": 0.3333333333333333}"", ""{\""LocalityRatio\"": 0.0, \""MethodLinesOfCode\"": 125.0, \""ParameterCount\"": 0.0, \""CyclomaticComplexity\"": 1.0, \""MaxCallChain\"": 2.0}""]","[""0daae668786ccfd02a11de7555305a98b04507cd"", ""0daae668786ccfd02a11de7555305a98b04507cd"", ""0daae668786ccfd02a11de7555305a98b04507cd""]","[""ComplexClass"", ""SpaghettiCode"", ""FeatureEnvy""]","[""0d18610ca1ba3f8c70ecda4c0fd1667b"", ""695817d8f47c2dbffe89b393438e4fe3"", ""e8085f304459e105dda7a953a165b9f1""]","[437, 170, 472]","[481, 928, 481]","[""{\""IsAbstract\"": 0.0, \""ClassLinesOfCode\"": 442.0, \""OverrideRatio\"": null, \""PublicFieldCount\"": 0.0, \""TightClassCohesion\"": 0.21904761904761905}"", ""{\""IsAbstract\"": 0.0, \""ClassLinesOfCode\"": 454.0, \""OverrideRatio\"": null, \""TightClassCohesion\"": 0.22857142857142856, \""PublicFieldCount\"": 0.0}"", ""{\""MaxCallChain\"": 3.0, \""ParameterCount\"": 2.0, \""CyclomaticComplexity\"": 2.0, \""MethodLinesOfCode\"": 6.0, \""LocalityRatio\"": 0.25}""]"
Researcher 3,prestodb_presto,21666,"[""Extract Method"", ""Extract Method"", ""Extract Method"", ""Extract Method""]","[""com.facebook.presto.operator.TestHttpPageBufferClient.TestingClientCallback.clientFinished"", ""com.facebook.presto.operator.TestHttpPageBufferClient.TestingClientCallback"", ""com.facebook.presto.operator.TestHttpPageBufferClient.TestingClientCallback.awaitDone"", ""com.facebook.presto.operator.TestHttpPageBufferClient.TestingClientCallback.requestComplete""]","[""4d40851796d952fad48f4a8952291b6ea9863eb9"", ""4d40851796d952fad48f4a8952291b6ea9863eb9""]","[""FeatureEnvy"", ""FeatureEnvy""]","[""1787f71327aac4a697152eb261f25981"", ""89740d83b9c85b84660de6d9a504cbaa""]","[100, 150]","[120, 297]","[""{\""MaxCallChain\"": 2.0, \""ParameterCount\"": 1.0, \""CyclomaticComplexity\"": 1.0, \""MethodLinesOfCode\"": 7.0, \""LocalityRatio\"": 0.3333333333333333}"", ""{\""LocalityRatio\"": 0.0, \""MethodLinesOfCode\"": 125.0, \""ParameterCount\"": 0.0, \""CyclomaticComplexity\"": 1.0, \""MaxCallChain\"": 2.0}""]","[""58477b33480a22827898f96920285f7d2c267182""]","[""FeatureEnvy""]","[""e410f04162c330e4414f17db6048bce1""]",[486],[498],"[""{\""MaxCallChain\"": 2.0, \""LocalityRatio\"": 0.0, \""CyclomaticComplexity\"": 3.0, \""ParameterCount\"": 0.0, \""MethodLinesOfCode\"": 8.0}""]"
Researcher 3,prestodb_presto,21669,"[""Extract Method"", ""Extract Method"", ""Extract Method"", ""Extract Method""]","[""com.facebook.presto.sql.ExpressionUtils"", ""com.facebook.presto.sql.ExpressionUtils.extractConjuncts"", ""com.facebook.presto.sql.ExpressionUtils.extractPredicates"", ""com.facebook.presto.sql.ExpressionUtils.extractDisjuncts""]","[""e94ccd80ebbf5390aca1ffc6a5485aef121f892a"", ""e94ccd80ebbf5390aca1ffc6a5485aef121f892a"", ""e94ccd80ebbf5390aca1ffc6a5485aef121f892a""]","[""FeatureEnvy"", ""ComplexClass"", ""SpaghettiCode""]","[""e4ab4458200054539605803ed4cdf7f1"", ""a5d8c6dd6c4e101438d79cf43379cee4"", ""3e037ad8bbc199a4f9436d1f811550cc""]","[363, 832, 60]","[396, 887, 926]","[""{\""MaxCallChain\"": 2.0, \""MethodLinesOfCode\"": 18.0, \""ParameterCount\"": 1.0, \""CyclomaticComplexity\"": 7.0, \""LocalityRatio\"": 0.1}"", ""{\""IsAbstract\"": 0.0, \""ClassLinesOfCode\"": 500.0, \""OverrideRatio\"": null, \""TightClassCohesion\"": 0.050921861281826165, \""PublicFieldCount\"": 14.0}"", ""{\""IsAbstract\"": 0.0, \""ClassLinesOfCode\"": 500.0, \""OverrideRatio\"": null, \""TightClassCohesion\"": 0.050921861281826165, \""PublicFieldCount\"": 14.0}""]","[""b2ef00c02e78f5e233fe972c7841036cde6a0615"", ""b2ef00c02e78f5e233fe972c7841036cde6a0615""]","[""FeatureEnvy"", ""MessageChain""]","[""19e1a1862adda31dabb3276cdd78402b"", ""9549aaa4fea9c35778643e389b41f526""]","[65, 65]","[76, 76]","[""{\""MethodLinesOfCode\"": 5.0, \""LocalityRatio\"": 0.0, \""ParameterCount\"": 2.0, \""CyclomaticComplexity\"": 2.0, \""MaxCallChain\"": 5.0}"", ""{\""MethodLinesOfCode\"": 5.0, \""LocalityRatio\"": 0.0, \""ParameterCount\"": 2.0, \""CyclomaticComplexity\"": 2.0, \""MaxCallChain\"": 5.0}""]"
Researcher 3,prestodb_presto,21693,"[""Extract Method"", ""Extract Method"", ""Push Down Method"", ""Push Down Method""]","[""com.facebook.presto.spi.block.AbstractInterleavedBlock.getRegion"", ""com.facebook.presto.spi.block.AbstractInterleavedBlock"", ""com.facebook.presto.spi.block.AbstractInterleavedBlock.getRegionAlwaysReturnInterleavedBlock"", ""com.facebook.presto.spi.block.InterleavedBlockBuilder""]","[""ea5fa858462fc993283af6e8d9eeeed3f4f0a222"", ""ea5fa858462fc993283af6e8d9eeeed3f4f0a222"", ""ea5fa858462fc993283af6e8d9eeeed3f4f0a222"", ""ea5fa858462fc993283af6e8d9eeeed3f4f0a222"", ""ea5fa858462fc993283af6e8d9eeeed3f4f0a222""]","[""ComplexClass"", ""SpaghettiCode"", ""LongMethod"", ""FeatureEnvy"", ""FeatureEnvy""]","[""f813034155dffe070ab69d7e587262c2"", ""c3739bf94b5e84952e76956c104896a8"", ""9dcfe89a29b29160c2e908c34b453d99"", ""e154e8cdd5802a692bdd5bd4bdc2d210"", ""70a4a315f916607ab65bc53c5afcefc1""]","[120, 39, 120, 120, 108]","[380, 684, 380, 380, 116]","[""{\""IsAbstract\"": 0.0, \""ClassLinesOfCode\"": 185.0, \""OverrideRatio\"": null, \""TightClassCohesion\"": 0.7777777777777778, \""PublicFieldCount\"": 0.0}"", ""{\""IsAbstract\"": 0.0, \""ClassLinesOfCode\"": 241.0, \""OverrideRatio\"": null, \""TightClassCohesion\"": 0.6666666666666666, \""PublicFieldCount\"": 0.0}"", ""{\""MaxCallChain\"": 2.0, \""MethodLinesOfCode\"": 114.0, \""ParameterCount\"": 0.0, \""CyclomaticComplexity\"": 43.0, \""LocalityRatio\"": 0.2696629213483146}"", ""{\""MaxCallChain\"": 2.0, \""MethodLinesOfCode\"": 114.0, \""ParameterCount\"": 0.0, \""CyclomaticComplexity\"": 43.0, \""LocalityRatio\"": 0.2696629213483146}"", ""{\""MethodLinesOfCode\"": 2.0, \""MaxCallChain\"": 1.0, \""ParameterCount\"": 1.0, \""CyclomaticComplexity\"": 1.0, \""LocalityRatio\"": 0.0}""]","[""28fe1b962dd767878b0ee8d15eedbdaa9ba50bf8""]","[""SpeculativeGenerality""]","[""be37310ab7fa0f99628f7350fa5ef5ea""]",[21],[294],"[""{\""IsAbstract\"": 1.0, \""ClassLinesOfCode\"": 150.0, \""OverrideRatio\"": null, \""PublicFieldCount\"": 0.0, \""TightClassCohesion\"": 0.6758893280632411}""]"
Researcher 3,elastic_elasticsearch,22092,"[""Extract Method"", ""Extract Method"", ""Inline Method"", ""Inline Method"", ""Extract Method"", ""Extract Method"", ""Extract Method"", ""Extract Method"", ""Extract Method"", ""Extract Method"", ""Extract Method"", ""Extract Method""]","[""org.elasticsearch.painless.node.SEach.Researcher 1lyze"", ""org.elasticsearch.painless.node.SEach"", ""org.elasticsearch.painless.node.SEach.Researcher 1lyzeArray"", ""org.elasticsearch.painless.node.SEach.write"", ""org.elasticsearch.painless.node.SEach.writeArray"", ""org.elasticsearch.painless.node.SEach.Researcher 1lyzeIterable"", ""org.elasticsearch.painless.node.SEach.writeIterable""]","[""636f6e618c73c73e2d17e96264ad188d2cd6947b"", ""636f6e618c73c73e2d17e96264ad188d2cd6947b"", ""636f6e618c73c73e2d17e96264ad188d2cd6947b""]","[""LazyClass"", ""FeatureEnvy"", ""FeatureEnvy""]","[""2ece048cd42fb948924aa48b6e72cdef"", ""a17f2e7689d9c50baa9a75a3d35ee53d"", ""75d0879829a494db4a574cb7321abc3f""]","[29, 48, 56]","[60, 51, 58]","[""{\""IsAbstract\"": 0.0, \""ClassLinesOfCode\"": 7.0, \""OverrideRatio\"": 0.06976744186046512, \""TightClassCohesion\"": 1.0, \""PublicFieldCount\"": 0.0}"", ""{\""MaxCallChain\"": 3.0, \""LocalityRatio\"": 0.0, \""ParameterCount\"": 0.0, \""CyclomaticComplexity\"": 1.0, \""MethodLinesOfCode\"": 2.0}"", ""{\""MaxCallChain\"": 3.0, \""LocalityRatio\"": 0.0, \""ParameterCount\"": 1.0, \""CyclomaticComplexity\"": 1.0, \""MethodLinesOfCode\"": 2.0}""]","[""b3804c47f7e8ffdf2a98a34ac34dd48b8e97e39a"", ""b3804c47f7e8ffdf2a98a34ac34dd48b8e97e39a""]","[""RefusedBequest"", ""FeatureEnvy""]","[""22b3d450cd1c055de920187537e04403"", ""edf144aafe1ed83f334428b036619f95""]","[39, 67]","[277, 150]","[""{\""IsAbstract\"": 0.0, \""ClassLinesOfCode\"": 148.0, \""OverrideRatio\"": 0.6666666666666666, \""PublicFieldCount\"": 0.0, \""TightClassCohesion\"": 1.0}"", ""{\""MaxCallChain\"": 2.0, \""MethodLinesOfCode\"": 49.0, \""ParameterCount\"": 1.0, \""CyclomaticComplexity\"": 13.0, \""LocalityRatio\"": 0.0}""]"
Researcher 3,elastic_elasticsearch,22117,"[""Extract Method"", ""Extract Method"", ""Extract Method"", ""Extract Method""]","[""org.elasticsearch.index.engine.robin.RobinEngine"", ""org.elasticsearch.index.engine.robin.RobinEngine.start"", ""org.elasticsearch.index.engine.robin.RobinEngine.buildNrtResource"", ""org.elasticsearch.index.engine.robin.RobinEngine.createWriter""]","[""636f6e618c73c73e2d17e96264ad188d2cd6947b"", ""636f6e618c73c73e2d17e96264ad188d2cd6947b"", ""636f6e618c73c73e2d17e96264ad188d2cd6947b""]","[""LazyClass"", ""FeatureEnvy"", ""FeatureEnvy""]","[""2ad98f86f2063da38cf21c8a4cee0480"", ""3fd028886f76bc75c113f4a7fed48022"", ""90f1d42a3d32a0513443a91594be7c10""]","[35, 62, 69]","[72, 64, 71]","[""{\""IsAbstract\"": 0.0, \""ClassLinesOfCode\"": 7.0, \""OverrideRatio\"": 0.07692307692307693, \""PublicFieldCount\"": 0.0, \""TightClassCohesion\"": 1.0}"", ""{\""MaxCallChain\"": 3.0, \""LocalityRatio\"": 0.0, \""ParameterCount\"": 0.0, \""CyclomaticComplexity\"": 1.0, \""MethodLinesOfCode\"": 2.0}"", ""{\""MaxCallChain\"": 3.0, \""LocalityRatio\"": 0.0, \""ParameterCount\"": 1.0, \""CyclomaticComplexity\"": 1.0, \""MethodLinesOfCode\"": 2.0}""]","[""5cdba0383b08b24e6d829975b308e60bc81fc459"", ""5cdba0383b08b24e6d829975b308e60bc81fc459""]","[""FeatureEnvy"", ""FeatureEnvy""]","[""54bd71cabbcfc6a400f1b5e9365a0f59"", ""2a67daf2947244988e208668ccc463c4""]","[491, 468]","[496, 489]","[""{\""LocalityRatio\"": 0.0, \""MethodLinesOfCode\"": 5.0, \""ParameterCount\"": 1.0, \""CyclomaticComplexity\"": 1.0, \""MaxCallChain\"": 2.0}"", ""{\""LocalityRatio\"": 0.0, \""MethodLinesOfCode\"": 17.0, \""ParameterCount\"": 0.0, \""CyclomaticComplexity\"": 3.0, \""MaxCallChain\"": 2.0}""]"
Researcher 3,elastic_elasticsearch,22118,"[""Extract Method"", ""Extract Method"", ""Extract Method"", ""Extract Method"", ""Extract Method"", ""Extract Method"", ""Extract Method"", ""Extract Method"", ""Extract Method"", ""Extract Method"", ""Extract Method"", ""Extract Method"", ""Extract Method"", ""Extract Method"", ""Extract Method"", ""Extract Method"", ""Extract Method"", ""Extract Method""]","[""org.elasticsearch.search.builder.SearchSourceFacetsBuilder"", ""org.elasticsearch.search.builder.SearchSourceFacetsBuilder.histogramFacetGlobal"", ""org.elasticsearch.search.builder.SearchSourceFacetsBuilder.histogramFacet"", ""org.elasticsearch.search.builder.SearchSourceFacetsBuilder.termsFacet"", ""org.elasticsearch.search.builder.SearchSourceFacetsBuilder.statisticalFacetGlobal"", ""org.elasticsearch.search.builder.SearchSourceFacetsBuilder.statisticalFacet"", ""org.elasticsearch.search.builder.SearchSourceFacetsBuilder.termsFacetGlobal"", ""org.elasticsearch.search.builder.SearchSourceFacetsBuilder.queryFacetGlobal"", ""org.elasticsearch.search.builder.SearchSourceFacetsBuilder.queryFacet""]","[""4d1e8fd647305f12dd6904353d381cf63ff05240"", ""4d1e8fd647305f12dd6904353d381cf63ff05240"", ""4d1e8fd647305f12dd6904353d381cf63ff05240"", ""4d1e8fd647305f12dd6904353d381cf63ff05240"", ""4d1e8fd647305f12dd6904353d381cf63ff05240"", ""4d1e8fd647305f12dd6904353d381cf63ff05240""]","[""FeatureEnvy"", ""MessageChain"", ""FeatureEnvy"", ""MessageChain"", ""MessageChain"", ""FeatureEnvy""]","[""d73ff9dc27ba41f76708ed17dc73671a"", ""0b3cb6fe4c1ad7d606151dececc4de91"", ""f90a9ac42e7d553862e790cc43260cc5"", ""f38d13680759d7cc009784e32e1d0afe"", ""8ef493d3a3b1331a3a13370cd2289fb2"", ""3b300f853b312277fbd30a35663d8d20""]","[123, 47, 109, 33, 13, 95]","[131, 55, 121, 45, 25, 107]","[""{\""LocalityRatio\"": 0.0, \""MethodLinesOfCode\"": 4.0, \""ParameterCount\"": 3.0, \""CyclomaticComplexity\"": 1.0, \""MaxCallChain\"": 3.0}"", ""{\""LocalityRatio\"": null, \""MethodLinesOfCode\"": 4.0, \""ParameterCount\"": 3.0, \""CyclomaticComplexity\"": 1.0, \""MaxCallChain\"": 4.0}"", ""{\""LocalityRatio\"": 0.0, \""MethodLinesOfCode\"": 7.0, \""ParameterCount\"": 3.0, \""CyclomaticComplexity\"": 1.0, \""MaxCallChain\"": 3.0}"", ""{\""LocalityRatio\"": null, \""MethodLinesOfCode\"": 7.0, \""ParameterCount\"": 3.0, \""CyclomaticComplexity\"": 1.0, \""MaxCallChain\"": 4.0}"", ""{\""LocalityRatio\"": null, \""MethodLinesOfCode\"": 7.0, \""ParameterCount\"": 3.0, \""CyclomaticComplexity\"": 1.0, \""MaxCallChain\"": 4.0}"", ""{\""LocalityRatio\"": 0.0, \""MethodLinesOfCode\"": 7.0, \""ParameterCount\"": 3.0, \""CyclomaticComplexity\"": 1.0, \""MaxCallChain\"": 3.0}""]","[""64479a11c338f350def6fa8a5f8c7456e9e6d50e"", ""64479a11c338f350def6fa8a5f8c7456e9e6d50e"", ""64479a11c338f350def6fa8a5f8c7456e9e6d50e"", ""64479a11c338f350def6fa8a5f8c7456e9e6d50e"", ""64479a11c338f350def6fa8a5f8c7456e9e6d50e""]","[""FeatureEnvy"", ""LongParameterList"", ""ComplexClass"", ""FeatureEnvy"", ""LongParameterList""]","[""db554121558bd447dd42f5ddcab2ba94"", ""0cb1b787be19e5a3a3e11f54f892ebc5"", ""373c3df41816c192897a6a4bc23d70a5"", ""3c7bfb1287861b1445e3822a72cad36a"", ""5588ae553bc453f55db3fd91897f4f1e""]","[126, 126, 134, 114, 114]","[132, 132, 205, 120, 120]","[""{\""MaxCallChain\"": 1.0, \""MethodLinesOfCode\"": 5.0, \""ParameterCount\"": 4.0, \""CyclomaticComplexity\"": 2.0, \""LocalityRatio\"": 0.0}"", ""{\""MaxCallChain\"": 1.0, \""MethodLinesOfCode\"": 5.0, \""ParameterCount\"": 4.0, \""CyclomaticComplexity\"": 2.0, \""LocalityRatio\"": 0.0}"", ""{\""IsAbstract\"": 0.0, \""ClassLinesOfCode\"": 163.0, \""OverrideRatio\"": null, \""PublicFieldCount\"": 0.0, \""TightClassCohesion\"": 0.21818181818181817}"", ""{\""MaxCallChain\"": 1.0, \""MethodLinesOfCode\"": 5.0, \""ParameterCount\"": 4.0, \""CyclomaticComplexity\"": 2.0, \""LocalityRatio\"": 0.0}"", ""{\""MaxCallChain\"": 1.0, \""MethodLinesOfCode\"": 5.0, \""ParameterCount\"": 4.0, \""CyclomaticComplexity\"": 2.0, \""LocalityRatio\"": 0.0}""]"
Researcher 3,elastic_elasticsearch,22156,"[""Extract Method"", ""Extract Method"", ""Extract Method"", ""Extract Method""]","[""org.elasticsearch.index.mapper.DocumentMapper.addFieldMapperListener"", ""org.elasticsearch.index.mapper.DocumentMapper"", ""org.elasticsearch.index.mapper.DocumentMapper.traverse"", ""org.elasticsearch.index.mapper.DocumentMapper.addObjectMapperListener""]","[""a7b57b9957285d34583686d29ef4de46d68c6081"", ""a7b57b9957285d34583686d29ef4de46d68c6081"", ""a7b57b9957285d34583686d29ef4de46d68c6081""]","[""FeatureEnvy"", ""FeatureEnvy"", ""FeatureEnvy""]","[""cdd667621357cc270319f583c8362ccf"", ""b257a226cc7a7ef30d7ad4be92856df8"", ""1d42153528827d208d8fb31998aae05f""]","[84, 142, 116]","[101, 150, 133]","[""{\""MethodLinesOfCode\"": 11.0, \""MaxCallChain\"": 3.0, \""ParameterCount\"": 0.0, \""CyclomaticComplexity\"": 4.0, \""LocalityRatio\"": 0.14285714285714285}"", ""{\""MethodLinesOfCode\"": 6.0, \""MaxCallChain\"": 1.0, \""ParameterCount\"": 1.0, \""CyclomaticComplexity\"": 2.0, \""LocalityRatio\"": 0.0}"", ""{\""MethodLinesOfCode\"": 10.0, \""MaxCallChain\"": 1.0, \""ParameterCount\"": 0.0, \""CyclomaticComplexity\"": 4.0, \""LocalityRatio\"": 0.3333333333333333}""]","[""ad392bb11e82043259967305456d2a0c9886d02f"", ""ad392bb11e82043259967305456d2a0c9886d02f"", ""ad392bb11e82043259967305456d2a0c9886d02f""]","[""SpaghettiCode"", ""ComplexClass"", ""FeatureEnvy""]","[""756157b778fa39c2878172d7c6a76126"", ""80224655c7f55fb4140ccb12fd3052ad"", ""3a53d0df0d946bcc6fb107c19478abeb""]","[51, 441, 571]","[644, 525, 573]","[""{\""IsAbstract\"": 0.0, \""ClassLinesOfCode\"": 342.0, \""OverrideRatio\"": null, \""TightClassCohesion\"": 0.0944741532976827, \""PublicFieldCount\"": 0.0}"", ""{\""IsAbstract\"": 0.0, \""ClassLinesOfCode\"": 342.0, \""OverrideRatio\"": null, \""TightClassCohesion\"": 0.0944741532976827, \""PublicFieldCount\"": 0.0}"", ""{\""MethodLinesOfCode\"": 2.0, \""LocalityRatio\"": 0.0, \""ParameterCount\"": 1.0, \""CyclomaticComplexity\"": 1.0, \""MaxCallChain\"": 1.0}""]"
Researcher 3,elastic_elasticsearch,22162,"[""Extract Method"", ""Extract Method"", ""Extract Method"", ""Extract Method""]","[""org.elasticsearch.threadpool.ThreadPool.build"", ""org.elasticsearch.threadpool.ThreadPool"", ""org.elasticsearch.threadpool.ThreadPool.newQueue"", ""org.elasticsearch.threadpool.ThreadPool.newRejectedExecutionHandler""]","[""61a1b478e83c6c26b299b0df4f1d7fd29b32678d"", ""61a1b478e83c6c26b299b0df4f1d7fd29b32678d"", ""61a1b478e83c6c26b299b0df4f1d7fd29b32678d"", ""61a1b478e83c6c26b299b0df4f1d7fd29b32678d"", ""61a1b478e83c6c26b299b0df4f1d7fd29b32678d"", ""61a1b478e83c6c26b299b0df4f1d7fd29b32678d""]","[""FeatureEnvy"", ""FeatureEnvy"", ""FeatureEnvy"", ""FeatureEnvy"", ""FeatureEnvy"", ""FeatureEnvy""]","[""27da239690500cb3133b8c86ec4931f4"", ""8703e5d93a76cc0bdf02494b93aba6c7"", ""4ad4651a8ab1d9576ead4a627e8f3c86"", ""98ca843acd4ef997706b1d9c78f3c3aa"", ""199b11659ab3b2df2df7661094be95af"", ""a2610de45c93b802b055646aae1c99d7""]","[376, 352, 155, 175, 135, 165]","[394, 374, 163, 185, 143, 173]","[""{\""LocalityRatio\"": 0.1111111111111111, \""MaxCallChain\"": 2.0, \""ParameterCount\"": 2.0, \""CyclomaticComplexity\"": 5.0, \""MethodLinesOfCode\"": 10.0}"", ""{\""LocalityRatio\"": 0.09090909090909091, \""MaxCallChain\"": 2.0, \""ParameterCount\"": 2.0, \""CyclomaticComplexity\"": 6.0, \""MethodLinesOfCode\"": 12.0}"", ""{\""LocalityRatio\"": 0.2, \""MaxCallChain\"": 2.0, \""ParameterCount\"": 2.0, \""CyclomaticComplexity\"": 2.0, \""MethodLinesOfCode\"": 5.0}"", ""{\""LocalityRatio\"": 0.14285714285714285, \""MaxCallChain\"": 2.0, \""ParameterCount\"": 2.0, \""CyclomaticComplexity\"": 2.0, \""MethodLinesOfCode\"": 5.0}"", ""{\""LocalityRatio\"": 0.3333333333333333, \""MaxCallChain\"": 2.0, \""ParameterCount\"": 2.0, \""CyclomaticComplexity\"": 2.0, \""MethodLinesOfCode\"": 5.0}"", ""{\""LocalityRatio\"": 0.3333333333333333, \""MaxCallChain\"": 2.0, \""ParameterCount\"": 2.0, \""CyclomaticComplexity\"": 2.0, \""MethodLinesOfCode\"": 5.0}""]","[""b7ff23ff93006ed894d663cf9e97a3fbda151522"", ""b7ff23ff93006ed894d663cf9e97a3fbda151522"", ""b7ff23ff93006ed894d663cf9e97a3fbda151522"", ""b7ff23ff93006ed894d663cf9e97a3fbda151522"", ""b7ff23ff93006ed894d663cf9e97a3fbda151522""]","[""GodClass"", ""ClassDataShouldBePrivate"", ""ComplexClass"", ""FeatureEnvy"", ""FeatureEnvy""]","[""92653d7118218612cb276e3bd6b72d09"", ""57e45139c729dee02b1a300a56b13b1f"", ""da3210a49879ed4d4ad7df2e4178ecb9"", ""85fb89deb4377036ec2daaa5e3d88668"", ""ea3ff837e372adb96b57bfbda4b76c03""]","[57, 52, 220, 481, 497]","[855, 547, 288, 495, 505]","[""{\""IsAbstract\"": 0.0, \""ClassLinesOfCode\"": 515.0, \""OverrideRatio\"": 0.0, \""TightClassCohesion\"": 0.5164835164835165, \""PublicFieldCount\"": 2.0}"", ""{\""IsAbstract\"": 0.0, \""ClassLinesOfCode\"": 324.0, \""OverrideRatio\"": 0.14285714285714285, \""TightClassCohesion\"": 0.5128205128205128, \""PublicFieldCount\"": 2.0}"", ""{\""IsAbstract\"": 0.0, \""ClassLinesOfCode\"": 324.0, \""OverrideRatio\"": 0.14285714285714285, \""TightClassCohesion\"": 0.5128205128205128, \""PublicFieldCount\"": 2.0}"", ""{\""ParameterCount\"": 2.0, \""MaxCallChain\"": 1.0, \""LocalityRatio\"": 0.0, \""CyclomaticComplexity\"": 5.0, \""MethodLinesOfCode\"": 10.0}"", ""{\""ParameterCount\"": 2.0, \""MaxCallChain\"": 1.0, \""LocalityRatio\"": 0.0, \""CyclomaticComplexity\"": 3.0, \""MethodLinesOfCode\"": 6.0}""]"
Researcher 3,elastic_elasticsearch,22419,"[""Extract Method"", ""Extract Method"", ""Extract Method"", ""Extract Method"", ""Extract Method"", ""Extract Method"", ""Extract Method"", ""Extract Method"", ""Extract Method"", ""Extract Method"", ""Extract Method"", ""Extract Method"", ""Extract Method"", ""Extract Method"", ""Extract Method"", ""Extract Method"", ""Extract Method"", ""Extract Method"", ""Extract Method"", ""Extract Method"", ""Extract Method"", ""Extract Method"", ""Extract Method"", ""Extract Method"", ""Extract Method"", ""Extract Method"", ""Extract Method"", ""Extract Method"", ""Extract Method"", ""Extract Method"", ""Extract Method"", ""Extract Method""]","[""org.elasticsearch.common.DefaultCacheRecycler"", ""org.elasticsearch.common.DefaultCacheRecycler.pushDoubleObjectMap"", ""org.elasticsearch.common.DefaultCacheRecycler.push"", ""org.elasticsearch.common.DefaultCacheRecycler.pushIntArray"", ""org.elasticsearch.common.DefaultCacheRecycler.pushObjectArray"", ""org.elasticsearch.common.DefaultCacheRecycler.pushHashSet"", ""org.elasticsearch.common.DefaultCacheRecycler.pushLongIntMap"", ""org.elasticsearch.common.DefaultCacheRecycler.pushObjectIntMap"", ""org.elasticsearch.common.DefaultCacheRecycler.pushIntObjectMap"", ""org.elasticsearch.common.DefaultCacheRecycler.pushFloatIntMap"", ""org.elasticsearch.common.DefaultCacheRecycler.pushByteIntMap"", ""org.elasticsearch.common.DefaultCacheRecycler.pushShortIntMap"", ""org.elasticsearch.common.DefaultCacheRecycler.pushLongLongMap"", ""org.elasticsearch.common.DefaultCacheRecycler.pushDoubleIntMap"", ""org.elasticsearch.common.DefaultCacheRecycler.pushLongObjectMap"", ""org.elasticsearch.common.DefaultCacheRecycler.pushHashMap"", ""org.elasticsearch.common.DefaultCacheRecycler.pushIntIntMap"", ""org.elasticsearch.common.DefaultCacheRecycler.pushObjectFloatMap""]","[""7859fe3340a1f50ba55167185021cb7402bfed55"", ""7859fe3340a1f50ba55167185021cb7402bfed55""]","[""FeatureEnvy"", ""FeatureEnvy""]","[""486e28112756d4b8a6deb5d8af18b6bc"", ""87885b59526f7d5f986504a225d9f1d1""]","[144, 121]","[156, 142]","[""{\""MethodLinesOfCode\"": 8.0, \""LocalityRatio\"": 0.3333333333333333, \""ParameterCount\"": 1.0, \""CyclomaticComplexity\"": 3.0, \""MaxCallChain\"": 2.0}"", ""{\""MethodLinesOfCode\"": 14.0, \""LocalityRatio\"": 0.08333333333333333, \""ParameterCount\"": 1.0, \""CyclomaticComplexity\"": 5.0, \""MaxCallChain\"": 2.0}""]","[""a1c62759c90dc5cd52349f17888431632a606850""]","[""FeatureEnvy""]","[""1768f6bfc0b29e5767d8e17b0b09d01c""]",[544],[551],"[""{\""LocalityRatio\"": 0.0, \""MaxCallChain\"": 1.0, \""ParameterCount\"": 2.0, \""CyclomaticComplexity\"": 2.0, \""MethodLinesOfCode\"": 6.0}""]"
Researcher 3,elastic_elasticsearch,22425,"[""Extract Method"", ""Extract Method"", ""Inline Method"", ""Inline Method"", ""Inline Method"", ""Inline Method"", ""Extract Method"", ""Extract Method"", ""Extract Method"", ""Extract Method"", ""Inline Method"", ""Inline Method"", ""Inline Method"", ""Inline Method"", ""Inline Method"", ""Inline Method"", ""Inline Method"", ""Inline Method"", ""Inline Method"", ""Inline Method"", ""Inline Method"", ""Inline Method"", ""Inline Method"", ""Inline Method"", ""Extract Method"", ""Extract Method""]","[""jsr166e.ConcurrentHashMapV8"", ""jsr166e.ConcurrentHashMapV8.initTable"", ""jsr166e.ConcurrentHashMapV8.transfer"", ""jsr166e.ConcurrentHashMapV8.readObject"", ""jsr166e.ConcurrentHashMapV8.replaceWithTreeBin"", ""jsr166e.ConcurrentHashMapV8.internalMerge"", ""jsr166e.ConcurrentHashMapV8.merge"", ""jsr166e.ConcurrentHashMapV8.internalReplace"", ""jsr166e.ConcurrentHashMapV8.clear"", ""jsr166e.ConcurrentHashMapV8.internalClear"", ""jsr166e.ConcurrentHashMapV8.internalPut"", ""jsr166e.ConcurrentHashMapV8.internalGet"", ""jsr166e.ConcurrentHashMapV8.get"", ""jsr166e.ConcurrentHashMapV8.computeIfPresent"", ""jsr166e.ConcurrentHashMapV8.internalCompute"", ""jsr166e.ConcurrentHashMapV8.computeIfAbsent"", ""jsr166e.ConcurrentHashMapV8.internalComputeIfAbsent"", ""jsr166e.ConcurrentHashMapV8.internalPutAll"", ""jsr166e.ConcurrentHashMapV8.putAll"", ""jsr166e.ConcurrentHashMapV8.compute"", ""jsr166e.ConcurrentHashMapV8.replaceNode""]","[""edded26a57ffcaa32a49025c585bc38aef6627c1"", ""edded26a57ffcaa32a49025c585bc38aef6627c1"", ""edded26a57ffcaa32a49025c585bc38aef6627c1"", ""edded26a57ffcaa32a49025c585bc38aef6627c1"", ""edded26a57ffcaa32a49025c585bc38aef6627c1"", ""edded26a57ffcaa32a49025c585bc38aef6627c1"", ""edded26a57ffcaa32a49025c585bc38aef6627c1""]","[""ComplexClass"", ""FeatureEnvy"", ""FeatureEnvy"", ""LongMethod"", ""LongParameterList"", ""LongParameterList"", ""FeatureEnvy""]","[""ba55680371bff4ba1ff04509c6ced1a7"", ""549f84dc04fbaf96ac65be2c83b0339f"", ""f3ceeb18dfdee868574f1864abf848a7"", ""eb7e3e7828f0d79b06c08a6a0c2b90c7"", ""32da4ee312d93b65144679c42d860028"", ""07c51a270e222a1b117368777e71f055"", ""4f08f7166a2ab4dd8f43d95dbaf3aaa1""]","[167, 167, 61, 61, 61, 226, 226]","[216, 216, 130, 130, 130, 258, 258]","[""{\""IsAbstract\"": 0.0, \""ClassLinesOfCode\"": 167.0, \""OverrideRatio\"": null, \""TightClassCohesion\"": 0.0, \""PublicFieldCount\"": 0.0}"", ""{\""LocalityRatio\"": 0.0, \""MaxCallChain\"": 2.0, \""ParameterCount\"": 0.0, \""CyclomaticComplexity\"": 11.0, \""MethodLinesOfCode\"": 30.0}"", ""{\""LocalityRatio\"": 0.0, \""MaxCallChain\"": 2.0, \""ParameterCount\"": 5.0, \""CyclomaticComplexity\"": 6.0, \""MethodLinesOfCode\"": 46.0}"", ""{\""LocalityRatio\"": 0.0, \""MaxCallChain\"": 2.0, \""ParameterCount\"": 5.0, \""CyclomaticComplexity\"": 6.0, \""MethodLinesOfCode\"": 46.0}"", ""{\""LocalityRatio\"": 0.0, \""MaxCallChain\"": 2.0, \""ParameterCount\"": 5.0, \""CyclomaticComplexity\"": 6.0, \""MethodLinesOfCode\"": 46.0}"", ""{\""LocalityRatio\"": 0.0, \""MaxCallChain\"": 1.0, \""ParameterCount\"": 4.0, \""CyclomaticComplexity\"": 8.0, \""MethodLinesOfCode\"": 21.0}"", ""{\""LocalityRatio\"": 0.0, \""MaxCallChain\"": 1.0, \""ParameterCount\"": 4.0, \""CyclomaticComplexity\"": 8.0, \""MethodLinesOfCode\"": 21.0}""]","[""fe6fb7135b7a0d74b179789838feae8bc1d3c71f"", ""fe6fb7135b7a0d74b179789838feae8bc1d3c71f"", ""fe6fb7135b7a0d74b179789838feae8bc1d3c71f"", ""fe6fb7135b7a0d74b179789838feae8bc1d3c71f"", ""fe6fb7135b7a0d74b179789838feae8bc1d3c71f"", ""fe6fb7135b7a0d74b179789838feae8bc1d3c71f"", ""fe6fb7135b7a0d74b179789838feae8bc1d3c71f"", ""fe6fb7135b7a0d74b179789838feae8bc1d3c71f"", ""fe6fb7135b7a0d74b179789838feae8bc1d3c71f"", ""fe6fb7135b7a0d74b179789838feae8bc1d3c71f"", ""fe6fb7135b7a0d74b179789838feae8bc1d3c71f"", ""fe6fb7135b7a0d74b179789838feae8bc1d3c71f"", ""fe6fb7135b7a0d74b179789838feae8bc1d3c71f"", ""fe6fb7135b7a0d74b179789838feae8bc1d3c71f"", ""fe6fb7135b7a0d74b179789838feae8bc1d3c71f"", ""fe6fb7135b7a0d74b179789838feae8bc1d3c71f"", ""fe6fb7135b7a0d74b179789838feae8bc1d3c71f"", ""fe6fb7135b7a0d74b179789838feae8bc1d3c71f"", ""fe6fb7135b7a0d74b179789838feae8bc1d3c71f"", ""fe6fb7135b7a0d74b179789838feae8bc1d3c71f""]","[""FeatureEnvy"", ""LongMethod"", ""LongMethod"", ""FeatureEnvy"", ""FeatureEnvy"", ""LongMethod"", ""FeatureEnvy"", ""FeatureEnvy"", ""LongMethod"", ""FeatureEnvy"", ""LongMethod"", ""LongMethod"", ""FeatureEnvy"", ""ComplexClass"", ""GodClass"", ""FeatureEnvy"", ""LongMethod"", ""FeatureEnvy"", ""FeatureEnvy"", ""FeatureEnvy""]","[""b33158a68d93bdc584e32954a3d53399"", ""9af68bca3b373d87978daed0c0ef01e0"", ""016796058cfa1ee165099dce2370b1b1"", ""5b013c086af1679db8e1626e088f5bb0"", ""f24f6fbb4eac396257d5c47619c1ac17"", ""699fedb0c332c8244b7561406f943751"", ""fc70514046c2d0b4100d26ca813843f5"", ""bd6f027e82be28daefdcd8f5d27d0e1b"", ""bf1fbe4957568574bae6daee82a1bea6"", ""c3adebfbdc8d6e7e9fb4694a0e8f67c5"", ""06aba32c6a64f41e5564a961413aad16"", ""11f5a646a0716f354a3e4d7acab10f7a"", ""1c07a3738029f35bb402ab4184ae5399"", ""3ff2442e97a5070a6d510b84094ab4bc"", ""d4b01863468bae561683d613180eac42"", ""35e09543a42b20d49bed5bdaf9b04668"", ""e5ab1d038c8b91b5df1630581299e6ba"", ""fa96b0c09f9013a8532a31c3adf00c44"", ""9846d0a2a1fd81b98daf93a0cc5523e4"", ""86971001e64638047af0ad7004a7fe1c""]","[2749, 1789, 1082, 1082, 3231, 3231, 1876, 1980, 1980, 2710, 1699, 1915, 2794, 1078, 31, 2666, 1596, 2543, 2655, 2871]","[2792, 1913, 1156, 1156, 3311, 3311, 1899, 2128, 2128, 2747, 1787, 2022, 2823, 1173, 3282, 2708, 1697, 2556, 2664, 2876]","[""{\""MaxCallChain\"": 1.0, \""MethodLinesOfCode\"": 2.0, \""ParameterCount\"": 2.0, \""CyclomaticComplexity\"": 1.0, \""LocalityRatio\"": 0.0}"", ""{\""LocalityRatio\"": 0.0, \""MaxCallChain\"": 2.0, \""ParameterCount\"": 2.0, \""CyclomaticComplexity\"": 26.0, \""MethodLinesOfCode\"": 73.0}"", ""{\""LocalityRatio\"": 0.0, \""MaxCallChain\"": 2.0, \""ParameterCount\"": 3.0, \""CyclomaticComplexity\"": 20.0, \""MethodLinesOfCode\"": 48.0}"", ""{\""LocalityRatio\"": 0.0, \""MaxCallChain\"": 2.0, \""ParameterCount\"": 3.0, \""CyclomaticComplexity\"": 20.0, \""MethodLinesOfCode\"": 48.0}"", ""{\""MaxCallChain\"": 2.0, \""MethodLinesOfCode\"": 55.0, \""ParameterCount\"": 1.0, \""CyclomaticComplexity\"": 15.0, \""LocalityRatio\"": 0.0}"", ""{\""MaxCallChain\"": 2.0, \""MethodLinesOfCode\"": 55.0, \""ParameterCount\"": 1.0, \""CyclomaticComplexity\"": 15.0, \""LocalityRatio\"": 0.0}"", ""{\""MaxCallChain\"": 1.0, \""MethodLinesOfCode\"": 18.0, \""ParameterCount\"": 0.0, \""CyclomaticComplexity\"": 5.0, \""LocalityRatio\"": 0.0}"", ""{\""MethodLinesOfCode\"": 111.0, \""LocalityRatio\"": 0.0, \""ParameterCount\"": 2.0, \""CyclomaticComplexity\"": 33.0, \""MaxCallChain\"": 1.0}"", ""{\""MethodLinesOfCode\"": 111.0, \""LocalityRatio\"": 0.0, \""ParameterCount\"": 2.0, \""CyclomaticComplexity\"": 33.0, \""MaxCallChain\"": 1.0}"", ""{\""MaxCallChain\"": 1.0, \""MethodLinesOfCode\"": 2.0, \""ParameterCount\"": 2.0, \""CyclomaticComplexity\"": 1.0, \""LocalityRatio\"": 0.0}"", ""{\""LocalityRatio\"": 0.0, \""MaxCallChain\"": 2.0, \""ParameterCount\"": 2.0, \""CyclomaticComplexity\"": 19.0, \""MethodLinesOfCode\"": 50.0}"", ""{\""LocalityRatio\"": 0.0, \""MaxCallChain\"": 2.0, \""ParameterCount\"": 3.0, \""CyclomaticComplexity\"": 22.0, \""MethodLinesOfCode\"": 62.0}"", ""{\""MaxCallChain\"": 1.0, \""MethodLinesOfCode\"": 2.0, \""ParameterCount\"": 3.0, \""CyclomaticComplexity\"": 1.0, \""LocalityRatio\"": 0.0}"", ""{\""IsAbstract\"": 0.0, \""ClassLinesOfCode\"": 1620.0, \""OverrideRatio\"": null, \""PublicFieldCount\"": 0.0, \""TightClassCohesion\"": 0.0}"", ""{\""IsAbstract\"": 0.0, \""ClassLinesOfCode\"": 1620.0, \""OverrideRatio\"": null, \""PublicFieldCount\"": 0.0, \""TightClassCohesion\"": 0.0}"", ""{\""MaxCallChain\"": 1.0, \""MethodLinesOfCode\"": 2.0, \""ParameterCount\"": 2.0, \""CyclomaticComplexity\"": 1.0, \""LocalityRatio\"": 0.0}"", ""{\""LocalityRatio\"": 0.0, \""MaxCallChain\"": 2.0, \""ParameterCount\"": 2.0, \""CyclomaticComplexity\"": 22.0, \""MethodLinesOfCode\"": 58.0}"", ""{\""MaxCallChain\"": 1.0, \""MethodLinesOfCode\"": 2.0, \""ParameterCount\"": 1.0, \""CyclomaticComplexity\"": 1.0, \""LocalityRatio\"": 0.0}"", ""{\""MaxCallChain\"": 1.0, \""MethodLinesOfCode\"": 2.0, \""ParameterCount\"": 1.0, \""CyclomaticComplexity\"": 1.0, \""LocalityRatio\"": 0.0}"", ""{\""MaxCallChain\"": 1.0, \""MethodLinesOfCode\"": 2.0, \""ParameterCount\"": 0.0, \""CyclomaticComplexity\"": 1.0, \""LocalityRatio\"": 0.0}""]"
Researcher 3,elastic_elasticsearch,22436,"[""Extract Method"", ""Extract Method"", ""Extract Method"", ""Extract Method""]","[""org.elasticsearch.test.TestCluster.getRandomNodeAndClient"", ""org.elasticsearch.test.TestCluster"", ""org.elasticsearch.test.TestCluster.masterClient""]","[""edded26a57ffcaa32a49025c585bc38aef6627c1"", ""edded26a57ffcaa32a49025c585bc38aef6627c1"", ""edded26a57ffcaa32a49025c585bc38aef6627c1"", ""edded26a57ffcaa32a49025c585bc38aef6627c1"", ""edded26a57ffcaa32a49025c585bc38aef6627c1"", ""edded26a57ffcaa32a49025c585bc38aef6627c1"", ""edded26a57ffcaa32a49025c585bc38aef6627c1""]","[""ComplexClass"", ""FeatureEnvy"", ""FeatureEnvy"", ""LongMethod"", ""LongParameterList"", ""LongParameterList"", ""FeatureEnvy""]","[""ba55680371bff4ba1ff04509c6ced1a7"", ""549f84dc04fbaf96ac65be2c83b0339f"", ""f3ceeb18dfdee868574f1864abf848a7"", ""eb7e3e7828f0d79b06c08a6a0c2b90c7"", ""32da4ee312d93b65144679c42d860028"", ""07c51a270e222a1b117368777e71f055"", ""4f08f7166a2ab4dd8f43d95dbaf3aaa1""]","[167, 167, 61, 61, 61, 226, 226]","[216, 216, 130, 130, 130, 258, 258]","[""{\""IsAbstract\"": 0.0, \""ClassLinesOfCode\"": 167.0, \""OverrideRatio\"": null, \""TightClassCohesion\"": 0.0, \""PublicFieldCount\"": 0.0}"", ""{\""LocalityRatio\"": 0.0, \""MaxCallChain\"": 2.0, \""ParameterCount\"": 0.0, \""CyclomaticComplexity\"": 11.0, \""MethodLinesOfCode\"": 30.0}"", ""{\""LocalityRatio\"": 0.0, \""MaxCallChain\"": 2.0, \""ParameterCount\"": 5.0, \""CyclomaticComplexity\"": 6.0, \""MethodLinesOfCode\"": 46.0}"", ""{\""LocalityRatio\"": 0.0, \""MaxCallChain\"": 2.0, \""ParameterCount\"": 5.0, \""CyclomaticComplexity\"": 6.0, \""MethodLinesOfCode\"": 46.0}"", ""{\""LocalityRatio\"": 0.0, \""MaxCallChain\"": 2.0, \""ParameterCount\"": 5.0, \""CyclomaticComplexity\"": 6.0, \""MethodLinesOfCode\"": 46.0}"", ""{\""LocalityRatio\"": 0.0, \""MaxCallChain\"": 1.0, \""ParameterCount\"": 4.0, \""CyclomaticComplexity\"": 8.0, \""MethodLinesOfCode\"": 21.0}"", ""{\""LocalityRatio\"": 0.0, \""MaxCallChain\"": 1.0, \""ParameterCount\"": 4.0, \""CyclomaticComplexity\"": 8.0, \""MethodLinesOfCode\"": 21.0}""]","[""30d7faeba29362e0116532e6f71c34342c717709""]","[""FeatureEnvy""]","[""d4e9669f5057438b4f049b1a31969688""]",[161],[171],"[""{\""MethodLinesOfCode\"": 8.0, \""LocalityRatio\"": 0.25, \""ParameterCount\"": 0.0, \""CyclomaticComplexity\"": 3.0, \""MaxCallChain\"": 2.0}""]"
Researcher 3,elastic_elasticsearch,22441,"[""Extract Method"", ""Extract Method"", ""Extract Method"", ""Extract Method""]","[""org.elasticsearch.index.mapper.core.DateFieldMapper"", ""org.elasticsearch.index.mapper.core.DateFieldMapper.rangeFilter"", ""org.elasticsearch.index.mapper.core.DateFieldMapper.parseToMilliseconds"", ""org.elasticsearch.index.mapper.core.DateFieldMapper.rangeQuery""]","[""2ee01f8e0ead27d5bf1b981e4ed6e7a12264ce88"", ""2ee01f8e0ead27d5bf1b981e4ed6e7a12264ce88"", ""2ee01f8e0ead27d5bf1b981e4ed6e7a12264ce88"", ""2ee01f8e0ead27d5bf1b981e4ed6e7a12264ce88""]","[""FeatureEnvy"", ""MessageChain"", ""LongParameterList"", ""FeatureEnvy""]","[""13cd8fd1d6e1c1390893ee78a4295774"", ""cce5322154b33302366b9d93674ffc12"", ""01a6927bb55e1840284ece05f0511d73"", ""bc2be97c91881e5f8893e9b185a97cd1""]","[30, 30, 86, 86]","[65, 65, 93, 93]","[""{\""LocalityRatio\"": 0.20689655172413793, \""ParameterCount\"": 3.0, \""CyclomaticComplexity\"": 6.0, \""MethodLinesOfCode\"": 28.0, \""MaxCallChain\"": 4.0}"", ""{\""LocalityRatio\"": 0.20689655172413793, \""ParameterCount\"": 3.0, \""CyclomaticComplexity\"": 6.0, \""MethodLinesOfCode\"": 28.0, \""MaxCallChain\"": 4.0}"", ""{\""LocalityRatio\"": 0.3333333333333333, \""ParameterCount\"": 4.0, \""CyclomaticComplexity\"": 2.0, \""MethodLinesOfCode\"": 5.0, \""MaxCallChain\"": 1.0}"", ""{\""LocalityRatio\"": 0.3333333333333333, \""ParameterCount\"": 4.0, \""CyclomaticComplexity\"": 2.0, \""MethodLinesOfCode\"": 5.0, \""MaxCallChain\"": 1.0}""]","[""2d523ace87617b25918dba13c4dd64c12a909f75"", ""2d523ace87617b25918dba13c4dd64c12a909f75"", ""2d523ace87617b25918dba13c4dd64c12a909f75"", ""2d523ace87617b25918dba13c4dd64c12a909f75""]","[""ComplexClass"", ""LongParameterList"", ""FeatureEnvy"", ""LongParameterList""]","[""410de94376601b13e8eacb184bda2683"", ""5677fb44b19695b6eadeb4874f03da1d"", ""2e4f4c353aec02099332623e6232dcad"", ""0bab72dfce66fe0a5c81885be627a229""]","[321, 329, 306, 311]","[384, 336, 309, 318]","[""{\""IsAbstract\"": 0.0, \""ClassLinesOfCode\"": 230.0, \""OverrideRatio\"": 0.6521739130434783, \""PublicFieldCount\"": 0.0, \""TightClassCohesion\"": 0.19166666666666668}"", ""{\""MaxCallChain\"": 2.0, \""MethodLinesOfCode\"": 5.0, \""ParameterCount\"": 6.0, \""CyclomaticComplexity\"": 1.0, \""LocalityRatio\"": 0.3}"", ""{\""MethodLinesOfCode\"": 4.0, \""LocalityRatio\"": 0.3333333333333333, \""ParameterCount\"": 3.0, \""CyclomaticComplexity\"": 1.0, \""MaxCallChain\"": 2.0}"", ""{\""MaxCallChain\"": 2.0, \""MethodLinesOfCode\"": 5.0, \""ParameterCount\"": 5.0, \""CyclomaticComplexity\"": 1.0, \""LocalityRatio\"": 0.0}""]"
Researcher 3,elastic_elasticsearch,22452,"[""Extract Method"", ""Extract Method"", ""Extract Method"", ""Extract Method""]","[""org.elasticsearch.search.suggest.completion.CompletionPostingsFormatTest"", ""org.elasticsearch.search.suggest.completion.CompletionPostingsFormatTest.testProviderBackwardCompatibilityForVersion1"", ""org.elasticsearch.search.suggest.completion.CompletionPostingsFormatTest.writeData"", ""org.elasticsearch.search.suggest.completion.CompletionPostingsFormatTest.testCompletionPostingsFormat""]","[""2ee01f8e0ead27d5bf1b981e4ed6e7a12264ce88"", ""2ee01f8e0ead27d5bf1b981e4ed6e7a12264ce88"", ""2ee01f8e0ead27d5bf1b981e4ed6e7a12264ce88"", ""2ee01f8e0ead27d5bf1b981e4ed6e7a12264ce88""]","[""FeatureEnvy"", ""MessageChain"", ""LongParameterList"", ""FeatureEnvy""]","[""13cd8fd1d6e1c1390893ee78a4295774"", ""cce5322154b33302366b9d93674ffc12"", ""01a6927bb55e1840284ece05f0511d73"", ""bc2be97c91881e5f8893e9b185a97cd1""]","[30, 30, 86, 86]","[65, 65, 93, 93]","[""{\""LocalityRatio\"": 0.20689655172413793, \""ParameterCount\"": 3.0, \""CyclomaticComplexity\"": 6.0, \""MethodLinesOfCode\"": 28.0, \""MaxCallChain\"": 4.0}"", ""{\""LocalityRatio\"": 0.20689655172413793, \""ParameterCount\"": 3.0, \""CyclomaticComplexity\"": 6.0, \""MethodLinesOfCode\"": 28.0, \""MaxCallChain\"": 4.0}"", ""{\""LocalityRatio\"": 0.3333333333333333, \""ParameterCount\"": 4.0, \""CyclomaticComplexity\"": 2.0, \""MethodLinesOfCode\"": 5.0, \""MaxCallChain\"": 1.0}"", ""{\""LocalityRatio\"": 0.3333333333333333, \""ParameterCount\"": 4.0, \""CyclomaticComplexity\"": 2.0, \""MethodLinesOfCode\"": 5.0, \""MaxCallChain\"": 1.0}""]","[""6e1a04b3706e131ebac1a4be25d665d3c23f159f"", ""6e1a04b3706e131ebac1a4be25d665d3c23f159f"", ""6e1a04b3706e131ebac1a4be25d665d3c23f159f""]","[""FeatureEnvy"", ""FeatureEnvy"", ""FeatureEnvy""]","[""5cad123fc66543e3d124ba2704e1ff98"", ""adcacfd6f820b576b93de8630b511783"", ""42437c4720718f3de0598bcaa2ee9576""]","[103, 303, 62]","[141, 326, 101]","[""{\""ParameterCount\"": 0.0, \""MethodLinesOfCode\"": 31.0, \""LocalityRatio\"": 0.0, \""CyclomaticComplexity\"": 1.0, \""MaxCallChain\"": 2.0}"", ""{\""MethodLinesOfCode\"": 18.0, \""MaxCallChain\"": 2.0, \""ParameterCount\"": 2.0, \""CyclomaticComplexity\"": 1.0, \""LocalityRatio\"": 0.0}"", ""{\""ParameterCount\"": 0.0, \""MethodLinesOfCode\"": 33.0, \""LocalityRatio\"": 0.0, \""CyclomaticComplexity\"": 1.0, \""MaxCallChain\"": 3.0}""]"
Researcher 1 ,elastic_elasticsearch,22458,"[""Extract Method"", ""Extract Method"", ""Extract Method"", ""Extract Method""]","[""org.elasticsearch.cluster.routing.IndexShardRoutingTable"", ""org.elasticsearch.cluster.routing.IndexShardRoutingTable.getActiveAttribute"", ""org.elasticsearch.cluster.routing.IndexShardRoutingTable.collectAttributeShards"", ""org.elasticsearch.cluster.routing.IndexShardRoutingTable.getInitializingAttribute""]","[""2ee01f8e0ead27d5bf1b981e4ed6e7a12264ce88"", ""2ee01f8e0ead27d5bf1b981e4ed6e7a12264ce88"", ""2ee01f8e0ead27d5bf1b981e4ed6e7a12264ce88"", ""2ee01f8e0ead27d5bf1b981e4ed6e7a12264ce88""]","[""FeatureEnvy"", ""MessageChain"", ""LongParameterList"", ""FeatureEnvy""]","[""13cd8fd1d6e1c1390893ee78a4295774"", ""cce5322154b33302366b9d93674ffc12"", ""01a6927bb55e1840284ece05f0511d73"", ""bc2be97c91881e5f8893e9b185a97cd1""]","[30, 30, 86, 86]","[65, 65, 93, 93]","[""{\""LocalityRatio\"": 0.20689655172413793, \""ParameterCount\"": 3.0, \""CyclomaticComplexity\"": 6.0, \""MethodLinesOfCode\"": 28.0, \""MaxCallChain\"": 4.0}"", ""{\""LocalityRatio\"": 0.20689655172413793, \""ParameterCount\"": 3.0, \""CyclomaticComplexity\"": 6.0, \""MethodLinesOfCode\"": 28.0, \""MaxCallChain\"": 4.0}"", ""{\""LocalityRatio\"": 0.3333333333333333, \""ParameterCount\"": 4.0, \""CyclomaticComplexity\"": 2.0, \""MethodLinesOfCode\"": 5.0, \""MaxCallChain\"": 1.0}"", ""{\""LocalityRatio\"": 0.3333333333333333, \""ParameterCount\"": 4.0, \""CyclomaticComplexity\"": 2.0, \""MethodLinesOfCode\"": 5.0, \""MaxCallChain\"": 1.0}""]","[""65c4282bb93989f2416e4351fa4fec36c8faf370"", ""65c4282bb93989f2416e4351fa4fec36c8faf370"", ""65c4282bb93989f2416e4351fa4fec36c8faf370"", ""65c4282bb93989f2416e4351fa4fec36c8faf370""]","[""ClassDataShouldBePrivate"", ""FeatureEnvy"", ""FeatureEnvy"", ""FeatureEnvy""]","[""61356cbb90e605d476a6c79c80107ed5"", ""f9f051fbce62a6d803e791a51270b8bc"", ""7022d2b1931fc1351346d4a0255e2966"", ""11a045c4065992ce34bad869c290440f""]","[38, 419, 456, 455]","[550, 444, 474, 480]","[""{\""IsAbstract\"": 0.0, \""ClassLinesOfCode\"": 254.0, \""OverrideRatio\"": null, \""TightClassCohesion\"": 0.292436974789916, \""PublicFieldCount\"": 3.0}"", ""{\""LocalityRatio\"": 0.0, \""MaxCallChain\"": 5.0, \""ParameterCount\"": 2.0, \""CyclomaticComplexity\"": 6.0, \""MethodLinesOfCode\"": 17.0}"", ""{\""ParameterCount\"": 3.0, \""MethodLinesOfCode\"": 14.0, \""LocalityRatio\"": 0.0, \""CyclomaticComplexity\"": 6.0, \""MaxCallChain\"": 3.0}"", ""{\""MethodLinesOfCode\"": 17.0, \""LocalityRatio\"": 0.0, \""CyclomaticComplexity\"": 6.0, \""ParameterCount\"": 2.0, \""MaxCallChain\"": 5.0}""]"
Researcher 3,elastic_elasticsearch,22461,"[""Extract Method"", ""Extract Method"", ""Extract Method"", ""Extract Method"", ""Extract Method"", ""Extract Method"", ""Extract Method"", ""Extract Method"", ""Extract Method"", ""Extract Method""]","[""org.elasticsearch.common.xcontent.support.AbstractXContentParser.shortValue"", ""org.elasticsearch.common.xcontent.support.AbstractXContentParser"", ""org.elasticsearch.common.xcontent.support.AbstractXContentParser.doubleValue"", ""org.elasticsearch.common.xcontent.support.AbstractXContentParser.intValue"", ""org.elasticsearch.common.xcontent.support.AbstractXContentParser.longValue"", ""org.elasticsearch.common.xcontent.support.AbstractXContentParser.floatValue""]","[""0aff4b9a95cbe60d50a5d8c0dd498ece62021367"", ""0aff4b9a95cbe60d50a5d8c0dd498ece62021367"", ""0aff4b9a95cbe60d50a5d8c0dd498ece62021367""]","[""FeatureEnvy"", ""FeatureEnvy"", ""FeatureEnvy""]","[""fbc3986373d7ac6c575ea0a9553e2604"", ""d94fb655ba5e641417fdc3f06f207c19"", ""aebaf993a0e357a9e7b2330903a1cf31""]","[270, 194, 380]","[292, 229, 404]","[""{\""MaxCallChain\"": 2.0, \""LocalityRatio\"": 0.2222222222222222, \""ParameterCount\"": 1.0, \""CyclomaticComplexity\"": 5.0, \""MethodLinesOfCode\"": 14.0}"", ""{\""LocalityRatio\"": 0.11764705882352941, \""ParameterCount\"": 2.0, \""CyclomaticComplexity\"": 5.0, \""MethodLinesOfCode\"": 16.0, \""MaxCallChain\"": 3.0}"", ""{\""MaxCallChain\"": 1.0, \""MethodLinesOfCode\"": 10.0, \""ParameterCount\"": 1.0, \""CyclomaticComplexity\"": 5.0, \""LocalityRatio\"": 0.0}""]","[""541059a4d13042819fcdf3e563b2ea60ba0bb604"", ""541059a4d13042819fcdf3e563b2ea60ba0bb604"", ""541059a4d13042819fcdf3e563b2ea60ba0bb604"", ""541059a4d13042819fcdf3e563b2ea60ba0bb604""]","[""SpeculativeGenerality"", ""ComplexClass"", ""FeatureEnvy"", ""FeatureEnvy""]","[""0cbe74ceabbac518c4eeb9c20a4566b5"", ""d2bb06d569da46956fbf59fca5639525"", ""9aaa62e500376de8c5ae11a0909673a9"", ""f4ca3ba0ae3d7422e02b2382e323c72c""]","[30, 218, 96, 107]","[154, 244, 103, 114]","[""{\""IsAbstract\"": 1.0, \""ClassLinesOfCode\"": 76.0, \""OverrideRatio\"": null, \""TightClassCohesion\"": 0.0, \""PublicFieldCount\"": 0.0}"", ""{\""IsAbstract\"": 1.0, \""ClassLinesOfCode\"": 141.0, \""OverrideRatio\"": null, \""PublicFieldCount\"": 0.0, \""TightClassCohesion\"": 0.0}"", ""{\""MaxCallChain\"": 2.0, \""MethodLinesOfCode\"": 6.0, \""ParameterCount\"": 0.0, \""CyclomaticComplexity\"": 2.0, \""LocalityRatio\"": 0.25}"", ""{\""MaxCallChain\"": 2.0, \""MethodLinesOfCode\"": 6.0, \""ParameterCount\"": 0.0, \""CyclomaticComplexity\"": 2.0, \""LocalityRatio\"": 0.25}""]"
Researcher 1,elastic_elasticsearch,22478,"[""Extract Method"", ""Extract Method"", ""Extract Method"", ""Extract Method""]","[""org.elasticsearch.cloud.aws.AwsS3Service.client"", ""org.elasticsearch.cloud.aws.AwsS3Service"", ""org.elasticsearch.cloud.aws.AwsS3Service.getClient"", ""org.elasticsearch.cloud.aws.AwsS3Service.getDefaultEndpoint""]","[""0aff4b9a95cbe60d50a5d8c0dd498ece62021367"", ""0aff4b9a95cbe60d50a5d8c0dd498ece62021367"", ""0aff4b9a95cbe60d50a5d8c0dd498ece62021367""]","[""FeatureEnvy"", ""FeatureEnvy"", ""FeatureEnvy""]","[""fbc3986373d7ac6c575ea0a9553e2604"", ""d94fb655ba5e641417fdc3f06f207c19"", ""aebaf993a0e357a9e7b2330903a1cf31""]","[270, 194, 380]","[292, 229, 404]","[""{\""MaxCallChain\"": 2.0, \""LocalityRatio\"": 0.2222222222222222, \""ParameterCount\"": 1.0, \""CyclomaticComplexity\"": 5.0, \""MethodLinesOfCode\"": 14.0}"", ""{\""LocalityRatio\"": 0.11764705882352941, \""ParameterCount\"": 2.0, \""CyclomaticComplexity\"": 5.0, \""MethodLinesOfCode\"": 16.0, \""MaxCallChain\"": 3.0}"", ""{\""MaxCallChain\"": 1.0, \""MethodLinesOfCode\"": 10.0, \""ParameterCount\"": 1.0, \""CyclomaticComplexity\"": 5.0, \""LocalityRatio\"": 0.0}""]","[""7f271fd37aff3ad4c03a0d1cc418ed3dca592cbb"", ""7f271fd37aff3ad4c03a0d1cc418ed3dca592cbb""]","[""ComplexClass"", ""FeatureEnvy""]","[""226cf19655e5b1763118c9cb4fdf3d8c"", ""af9b8a256ad847c4505d42c38e27b4ef""]","[49, 81]","[138, 130]","[""{\""IsAbstract\"": 0.0, \""ClassLinesOfCode\"": 80.0, \""OverrideRatio\"": null, \""PublicFieldCount\"": 0.0, \""TightClassCohesion\"": 0.0}"", ""{\""LocalityRatio\"": 0.0, \""MethodLinesOfCode\"": 30.0, \""ParameterCount\"": 3.0, \""CyclomaticComplexity\"": 8.0, \""MaxCallChain\"": 2.0}""]"
Researcher 3,elastic_elasticsearch,22482,"[""Extract Method"", ""Extract Method"", ""Extract Method"", ""Extract Method"", ""Extract Method"", ""Extract Method"", ""Inline Method"", ""Inline Method"", ""Extract Method"", ""Extract Method"", ""Extract Method"", ""Extract Method"", ""Extract Method"", ""Extract Method""]","[""org.elasticsearch.index.engine.internal.InternalEngine"", ""org.elasticsearch.index.engine.internal.InternalEngine.index"", ""org.elasticsearch.index.engine.internal.InternalEngine.maybeFailEngine"", ""org.elasticsearch.index.engine.internal.InternalEngine.maybeMerge"", ""org.elasticsearch.index.engine.internal.InternalEngine.recover"", ""org.elasticsearch.index.engine.internal.InternalEngine.wrapIfClosed"", ""org.elasticsearch.index.engine.internal.InternalEngine.close"", ""org.elasticsearch.index.engine.internal.InternalEngine.innerClose"", ""org.elasticsearch.index.engine.internal.InternalEngine.create"", ""org.elasticsearch.index.engine.internal.InternalEngine.optimize"", ""org.elasticsearch.index.engine.internal.InternalEngine.delete""]","[""a31569dabf5280132935692de5e9a9e6cd2cae1c"", ""a31569dabf5280132935692de5e9a9e6cd2cae1c""]","[""FeatureEnvy"", ""FeatureEnvy""]","[""f81f69c3be0d360d861e22282082eeb4"", ""2aa0c0b1cb42b239f70fcf62cf7c34a2""]","[157, 174]","[172, 184]","[""{\""MethodLinesOfCode\"": 9.0, \""MaxCallChain\"": 1.0, \""ParameterCount\"": 3.0, \""CyclomaticComplexity\"": 2.0, \""LocalityRatio\"": 0.2}"", ""{\""MethodLinesOfCode\"": 8.0, \""MaxCallChain\"": 1.0, \""ParameterCount\"": 0.0, \""CyclomaticComplexity\"": 2.0, \""LocalityRatio\"": 0.25}""]","[""be14968c44f09a0ae988c9768afeeddd114aac3e"", ""be14968c44f09a0ae988c9768afeeddd114aac3e"", ""be14968c44f09a0ae988c9768afeeddd114aac3e"", ""be14968c44f09a0ae988c9768afeeddd114aac3e"", ""be14968c44f09a0ae988c9768afeeddd114aac3e"", ""be14968c44f09a0ae988c9768afeeddd114aac3e"", ""be14968c44f09a0ae988c9768afeeddd114aac3e"", ""be14968c44f09a0ae988c9768afeeddd114aac3e"", ""be14968c44f09a0ae988c9768afeeddd114aac3e"", ""be14968c44f09a0ae988c9768afeeddd114aac3e"", ""be14968c44f09a0ae988c9768afeeddd114aac3e""]","[""FeatureEnvy"", ""LongMethod"", ""MessageChain"", ""SpaghettiCode"", ""ComplexClass"", ""GodClass"", ""FeatureEnvy"", ""FeatureEnvy"", ""FeatureEnvy"", ""LongMethod"", ""FeatureEnvy""]","[""bd8c935133607670e11812e79d2ba57a"", ""4c2eaf9ffc15e7290ad5ae01cb30e274"", ""9df38f635be6a9a627b7ea4c9730216b"", ""bf978d8ed433b6669c0f01864db689fb"", ""329b916d29085650159d702f4fcd675b"", ""4a9283e7e746bedfbaef677cc5836cb7"", ""88529b3d031b910643dab46258cb059e"", ""75d1f95e4d0b55c204028e0b9d0d213b"", ""8814114484b3c0c54d83d4d61caeffb9"", ""d9b05f3aa542c5186e91bf091c44ba92"", ""77cea1f98bcfd446c2fe00374d4f2964""]","[960, 960, 960, 92, 316, 91, 386, 1216, 621, 1038, 1038]","[1021, 1021, 1021, 1610, 376, 1531, 390, 1224, 653, 1105, 1105]","[""{\""MethodLinesOfCode\"": 39.0, \""MaxCallChain\"": 4.0, \""ParameterCount\"": 1.0, \""CyclomaticComplexity\"": 15.0, \""LocalityRatio\"": 0.16129032258064516}"", ""{\""MethodLinesOfCode\"": 39.0, \""MaxCallChain\"": 4.0, \""ParameterCount\"": 1.0, \""CyclomaticComplexity\"": 15.0, \""LocalityRatio\"": 0.16129032258064516}"", ""{\""MethodLinesOfCode\"": 39.0, \""MaxCallChain\"": 4.0, \""ParameterCount\"": 1.0, \""CyclomaticComplexity\"": 15.0, \""LocalityRatio\"": 0.16129032258064516}"", ""{\""IsAbstract\"": 0.0, \""ClassLinesOfCode\"": 962.0, \""OverrideRatio\"": 0.0, \""PublicFieldCount\"": 0.0, \""TightClassCohesion\"": 0.5889328063241107}"", ""{\""IsAbstract\"": 0.0, \""ClassLinesOfCode\"": 962.0, \""OverrideRatio\"": 0.0, \""PublicFieldCount\"": 0.0, \""TightClassCohesion\"": 0.5889328063241107}"", ""{\""IsAbstract\"": 0.0, \""ClassLinesOfCode\"": 893.0, \""OverrideRatio\"": 0.0, \""TightClassCohesion\"": 0.5335968379446641, \""PublicFieldCount\"": 0.0}"", ""{\""MaxCallChain\"": 2.0, \""MethodLinesOfCode\"": 3.0, \""ParameterCount\"": 1.0, \""CyclomaticComplexity\"": 2.0, \""LocalityRatio\"": 0.3333333333333333}"", ""{\""MethodLinesOfCode\"": 6.0, \""MaxCallChain\"": 2.0, \""ParameterCount\"": 0.0, \""CyclomaticComplexity\"": 1.0, \""LocalityRatio\"": 0.2}"", ""{\""MethodLinesOfCode\"": 24.0, \""MaxCallChain\"": 2.0, \""ParameterCount\"": 1.0, \""CyclomaticComplexity\"": 6.0, \""LocalityRatio\"": 0.05263157894736842}"", ""{\""MethodLinesOfCode\"": 48.0, \""MaxCallChain\"": 2.0, \""ParameterCount\"": 1.0, \""CyclomaticComplexity\"": 10.0, \""LocalityRatio\"": 0.0}"", ""{\""MethodLinesOfCode\"": 48.0, \""MaxCallChain\"": 2.0, \""ParameterCount\"": 1.0, \""CyclomaticComplexity\"": 10.0, \""LocalityRatio\"": 0.0}""]"
Researcher 3,elastic_elasticsearch,22509,"[""Extract Method"", ""Extract Method"", ""Extract Method"", ""Extract Method""]","[""org.elasticsearch.gateway.GatewayService.clusterChanged"", ""org.elasticsearch.gateway.GatewayService"", ""org.elasticsearch.gateway.GatewayService.checkStateMeetsSettingsAndMaybeRecover"", ""org.elasticsearch.gateway.GatewayService.doStart""]","[""7cb7b66dbdaa0af03ea0abda4d5187f773b89bba"", ""7cb7b66dbdaa0af03ea0abda4d5187f773b89bba"", ""7cb7b66dbdaa0af03ea0abda4d5187f773b89bba"", ""7cb7b66dbdaa0af03ea0abda4d5187f773b89bba""]","[""FeatureEnvy"", ""FeatureEnvy"", ""FeatureEnvy"", ""FeatureEnvy""]","[""5ac1b049ac023ee9698c0380ae6ffc58"", ""7ed113ba428513647f321cb64d0f7f87"", ""60e447baf4a07e7e70bac0818892c32d"", ""bfcf99bdaeecda90e260694dfb2e60df""]","[127, 220, 188, 151]","[149, 250, 218, 186]","[""{\""MethodLinesOfCode\"": 13.0, \""LocalityRatio\"": 0.2, \""ParameterCount\"": 0.0, \""CyclomaticComplexity\"": 1.0, \""MaxCallChain\"": 2.0}"", ""{\""MethodLinesOfCode\"": 17.0, \""LocalityRatio\"": 0.18181818181818182, \""ParameterCount\"": 0.0, \""CyclomaticComplexity\"": 1.0, \""MaxCallChain\"": 2.0}"", ""{\""MethodLinesOfCode\"": 15.0, \""LocalityRatio\"": 0.3333333333333333, \""ParameterCount\"": 0.0, \""CyclomaticComplexity\"": 1.0, \""MaxCallChain\"": 2.0}"", ""{\""MethodLinesOfCode\"": 20.0, \""LocalityRatio\"": 0.2727272727272727, \""ParameterCount\"": 0.0, \""CyclomaticComplexity\"": 1.0, \""MaxCallChain\"": 2.0}""]","[""f48096950324ead67e28c53f31321bf6ca53178f"", ""f48096950324ead67e28c53f31321bf6ca53178f"", ""f48096950324ead67e28c53f31321bf6ca53178f""]","[""FeatureEnvy"", ""FeatureEnvy"", ""FeatureEnvy""]","[""442cd219662c7d565d5c57dc9d85ce04"", ""ca981915fb9ad46feb34db8420801f37"", ""1c2e477720d7df6c88e2cdb5f427992a""]","[152, 148, 93]","[201, 182, 117]","[""{\""MaxCallChain\"": 3.0, \""ParameterCount\"": 1.0, \""CyclomaticComplexity\"": 12.0, \""MethodLinesOfCode\"": 34.0, \""LocalityRatio\"": 0.025}"", ""{\""MaxCallChain\"": 2.0, \""MethodLinesOfCode\"": 27.0, \""ParameterCount\"": 2.0, \""CyclomaticComplexity\"": 9.0, \""LocalityRatio\"": 0.03125}"", ""{\""MethodLinesOfCode\"": 16.0, \""MaxCallChain\"": 3.0, \""ParameterCount\"": 0.0, \""CyclomaticComplexity\"": 6.0, \""LocalityRatio\"": 0.125}""]"
Researcher 3,elastic_elasticsearch,22536,"[""Move Attribute"", ""Move Attribute"", ""Extract Method"", ""Extract Method"", ""Extract Method"", ""Extract Method"", ""Extract Method"", ""Extract Method""]","[""org.elasticsearch.index.query.MoreLikeThisQueryBuilder.Item"", ""org.elasticsearch.index.query.MoreLikeThisQueryBuilder"", ""org.elasticsearch.index.query.MoreLikeThisQueryBuilder.likeText"", ""org.elasticsearch.index.query.MoreLikeThisQueryBuilder.like"", ""org.elasticsearch.index.query.MoreLikeThisQueryBuilder.ids"", ""org.elasticsearch.index.query.MoreLikeThisQueryBuilder.docs""]","[""4b5a354bf47542dfa7fee82919742e167d1b3d40"", ""4b5a354bf47542dfa7fee82919742e167d1b3d40"", ""4b5a354bf47542dfa7fee82919742e167d1b3d40"", ""4b5a354bf47542dfa7fee82919742e167d1b3d40""]","[""FeatureEnvy"", ""FeatureEnvy"", ""FeatureEnvy"", ""FeatureEnvy""]","[""e7a6ee2f4384b951567351f86d6d30f2"", ""bfc8fd140e7f184d32f33ae960a4e0ef"", ""cd0c85624cbfd02980d79a3f198ba730"", ""745867ea222af9bee665f1d6c860bfb5""]","[92, 106, 99, 113]","[97, 111, 104, 118]","[""{\""LocalityRatio\"": 0.0, \""MethodLinesOfCode\"": 4.0, \""ParameterCount\"": 1.0, \""CyclomaticComplexity\"": 1.0, \""MaxCallChain\"": 1.0}"", ""{\""LocalityRatio\"": 0.0, \""MethodLinesOfCode\"": 4.0, \""ParameterCount\"": 1.0, \""CyclomaticComplexity\"": 1.0, \""MaxCallChain\"": 1.0}"", ""{\""LocalityRatio\"": 0.0, \""MethodLinesOfCode\"": 4.0, \""ParameterCount\"": 1.0, \""CyclomaticComplexity\"": 1.0, \""MaxCallChain\"": 1.0}"", ""{\""LocalityRatio\"": 0.0, \""MethodLinesOfCode\"": 4.0, \""ParameterCount\"": 1.0, \""CyclomaticComplexity\"": 1.0, \""MaxCallChain\"": 1.0}""]","[""4da407a869c9ce9f23aec7492d9650ec532a8d98"", ""4da407a869c9ce9f23aec7492d9650ec532a8d98"", ""4da407a869c9ce9f23aec7492d9650ec532a8d98""]","[""ComplexClass"", ""ComplexClass"", ""FeatureEnvy""]","[""cabc42d4899190de92f8845907b3c22f"", ""c8bd67811e215cf6c86f3c9bf9c8ad33"", ""9e1e91405d89555401bf991dcb6b3414""]","[66, 275, 171]","[119, 343, 177]","[""{\""IsAbstract\"": 0.0, \""ClassLinesOfCode\"": 52.0, \""OverrideRatio\"": 0.08, \""PublicFieldCount\"": 0.0, \""TightClassCohesion\"": 0.3}"", ""{\""IsAbstract\"": 0.0, \""ClassLinesOfCode\"": 162.0, \""OverrideRatio\"": 0.3333333333333333, \""TightClassCohesion\"": 0.010526315789473684, \""PublicFieldCount\"": 0.0}"", ""{\""MaxCallChain\"": 1.0, \""LocalityRatio\"": 0.0, \""ParameterCount\"": 1.0, \""CyclomaticComplexity\"": 2.0, \""MethodLinesOfCode\"": 5.0}""]"
Researcher 3,elastic_elasticsearch,22544,"[""Extract Method"", ""Extract Method"", ""Extract Method"", ""Extract Method""]","[""org.elasticsearch.gateway.GatewayAllocator.buildShardStates"", ""org.elasticsearch.gateway.GatewayAllocator"", ""org.elasticsearch.gateway.GatewayAllocator.logListActionFailures"", ""org.elasticsearch.gateway.GatewayAllocator.buildShardStores""]","[""c2be7f160293ab4425d032b43aaff22e8eb6d193"", ""c2be7f160293ab4425d032b43aaff22e8eb6d193"", ""c2be7f160293ab4425d032b43aaff22e8eb6d193"", ""c2be7f160293ab4425d032b43aaff22e8eb6d193""]","[""ComplexClass"", ""GodClass"", ""LongMethod"", ""FeatureEnvy""]","[""1e9a1b11e2c6b448f7f161e1dc5a2007"", ""b3094a21139809cf5e12ec71fbff8485"", ""3cda0dade1029b227c53cbd844deb4dd"", ""01a54614f4dcb86ee7c8df84ea2fa3e2""]","[1799, 70, 1799, 1799]","[1880, 1881, 1880, 1880]","[""{\""IsAbstract\"": 0.0, \""ClassLinesOfCode\"": 863.0, \""OverrideRatio\"": null, \""TightClassCohesion\"": 0.00026986183074265976, \""PublicFieldCount\"": 0.0}"", ""{\""IsAbstract\"": 0.0, \""ClassLinesOfCode\"": 863.0, \""OverrideRatio\"": null, \""TightClassCohesion\"": 0.00026986183074265976, \""PublicFieldCount\"": 0.0}"", ""{\""LocalityRatio\"": 0.0, \""ParameterCount\"": 2.0, \""CyclomaticComplexity\"": 14.0, \""MethodLinesOfCode\"": 79.0, \""MaxCallChain\"": 1.0}"", ""{\""LocalityRatio\"": 0.0, \""ParameterCount\"": 2.0, \""CyclomaticComplexity\"": 14.0, \""MethodLinesOfCode\"": 79.0, \""MaxCallChain\"": 1.0}""]","[""9362ba200d13f4424fc8c9908a7eafc908bc1510"", ""9362ba200d13f4424fc8c9908a7eafc908bc1510"", ""9362ba200d13f4424fc8c9908a7eafc908bc1510"", ""9362ba200d13f4424fc8c9908a7eafc908bc1510""]","[""FeatureEnvy"", ""ComplexClass"", ""FeatureEnvy"", ""FeatureEnvy""]","[""e9b2f83a6fb3737e4c95440a60257d1f"", ""03eaf2de5f0bc04c8fe20531c57900b4"", ""d704cc87d661f17a68c26e144bedd2b3"", ""22a798b5c6f4cedf6698fcb5022d6cbc""]","[370, 100, 414, 423]","[421, 368, 423, 473]","[""{\""MethodLinesOfCode\"": 35.0, \""LocalityRatio\"": 0.0, \""ParameterCount\"": 2.0, \""CyclomaticComplexity\"": 10.0, \""MaxCallChain\"": 3.0}"", ""{\""IsAbstract\"": 0.0, \""ClassLinesOfCode\"": 254.0, \""OverrideRatio\"": 0.0, \""PublicFieldCount\"": 0.0, \""TightClassCohesion\"": 0.3333333333333333}"", ""{\""MaxCallChain\"": 2.0, \""MethodLinesOfCode\"": 6.0, \""ParameterCount\"": 3.0, \""CyclomaticComplexity\"": 3.0, \""LocalityRatio\"": 0.0}"", ""{\""MethodLinesOfCode\"": 33.0, \""LocalityRatio\"": 0.0, \""ParameterCount\"": 2.0, \""CyclomaticComplexity\"": 13.0, \""MaxCallChain\"": 3.0}""]"
Researcher 3,elastic_elasticsearch,22552,"[""Extract Method"", ""Extract Method"", ""Extract Method"", ""Extract Method"", ""Extract Method"", ""Extract Method"", ""Extract Method"", ""Extract Method"", ""Extract Method"", ""Extract Method"", ""Extract Method"", ""Extract Method""]","[""org.elasticsearch.search.aggregations.reducers.DerivativeTests"", ""org.elasticsearch.search.aggregations.reducers.DerivativeTests.partiallyUnmapped"", ""org.elasticsearch.search.aggregations.reducers.DerivativeTests.checkBucketKeyAndDocCount"", ""org.elasticsearch.search.aggregations.reducers.DerivativeTests.singleValuedField_secondDerivative"", ""org.elasticsearch.search.aggregations.reducers.DerivativeTests.singleValuedField_WithSubAggregation"", ""org.elasticsearch.search.aggregations.reducers.DerivativeTests.singleValuedField"", ""org.elasticsearch.search.aggregations.reducers.DerivativeTests.singleValuedFieldWithGaps_insertZeros"", ""org.elasticsearch.search.aggregations.reducers.DerivativeTests.singleValuedFieldWithGaps""]","[""c2be7f160293ab4425d032b43aaff22e8eb6d193"", ""c2be7f160293ab4425d032b43aaff22e8eb6d193"", ""c2be7f160293ab4425d032b43aaff22e8eb6d193"", ""c2be7f160293ab4425d032b43aaff22e8eb6d193""]","[""ComplexClass"", ""GodClass"", ""LongMethod"", ""FeatureEnvy""]","[""1e9a1b11e2c6b448f7f161e1dc5a2007"", ""b3094a21139809cf5e12ec71fbff8485"", ""3cda0dade1029b227c53cbd844deb4dd"", ""01a54614f4dcb86ee7c8df84ea2fa3e2""]","[1799, 70, 1799, 1799]","[1880, 1881, 1880, 1880]","[""{\""IsAbstract\"": 0.0, \""ClassLinesOfCode\"": 863.0, \""OverrideRatio\"": null, \""TightClassCohesion\"": 0.00026986183074265976, \""PublicFieldCount\"": 0.0}"", ""{\""IsAbstract\"": 0.0, \""ClassLinesOfCode\"": 863.0, \""OverrideRatio\"": null, \""TightClassCohesion\"": 0.00026986183074265976, \""PublicFieldCount\"": 0.0}"", ""{\""LocalityRatio\"": 0.0, \""ParameterCount\"": 2.0, \""CyclomaticComplexity\"": 14.0, \""MethodLinesOfCode\"": 79.0, \""MaxCallChain\"": 1.0}"", ""{\""LocalityRatio\"": 0.0, \""ParameterCount\"": 2.0, \""CyclomaticComplexity\"": 14.0, \""MethodLinesOfCode\"": 79.0, \""MaxCallChain\"": 1.0}""]","[""3063f06fc7506a9be7331553bf77614d9ca2dd35"", ""3063f06fc7506a9be7331553bf77614d9ca2dd35"", ""3063f06fc7506a9be7331553bf77614d9ca2dd35"", ""3063f06fc7506a9be7331553bf77614d9ca2dd35"", ""3063f06fc7506a9be7331553bf77614d9ca2dd35"", ""3063f06fc7506a9be7331553bf77614d9ca2dd35"", ""3063f06fc7506a9be7331553bf77614d9ca2dd35"", ""3063f06fc7506a9be7331553bf77614d9ca2dd35"", ""3063f06fc7506a9be7331553bf77614d9ca2dd35"", ""3063f06fc7506a9be7331553bf77614d9ca2dd35"", ""3063f06fc7506a9be7331553bf77614d9ca2dd35"", ""3063f06fc7506a9be7331553bf77614d9ca2dd35"", ""3063f06fc7506a9be7331553bf77614d9ca2dd35"", ""3063f06fc7506a9be7331553bf77614d9ca2dd35""]","[""SpaghettiCode"", ""ComplexClass"", ""FeatureEnvy"", ""MessageChain"", ""LongMethod"", ""MessageChain"", ""FeatureEnvy"", ""MessageChain"", ""FeatureEnvy"", ""LongParameterList"", ""FeatureEnvy"", ""MessageChain"", ""FeatureEnvy"", ""MessageChain""]","[""d3adc08135302907ec504f94b261c7c2"", ""c5ec9c75716f4797ab86c073e8909872"", ""e0a63afcf1425b6aec81189ed0a1c75a"", ""68425ab33344a02b559160d82c333833"", ""4de8f26b576408faa4dcdf9b3c0998ae"", ""e13e1de118af64bee382007043b38f35"", ""e36e643fbb18bc88dff5a2b111a077b1"", ""d0bc029ff41c112bf8f1a1a872843a02"", ""8feb83acfe66be526eca63de3b5bf351"", ""3cb6f399f18562e96ca413c0a2d78700"", ""7466fcf21fc191ae62404b1e3dc1503a"", ""ad244728241b17394cac6c132c3f239a"", ""0c2e7e1d971ed27c945b2ef818ea6c69"", ""5ba19b55588b627d77c1a1861ae4fe55""]","[48, 63, 248, 248, 248, 390, 390, 174, 174, 381, 504, 504, 358, 358]","[618, 172, 308, 308, 308, 502, 502, 205, 205, 386, 616, 616, 388, 388]","[""{\""IsAbstract\"": 0.0, \""ClassLinesOfCode\"": 398.0, \""OverrideRatio\"": 0.01818181818181818, \""TightClassCohesion\"": 0.9444444444444444, \""PublicFieldCount\"": 0.0}"", ""{\""IsAbstract\"": 0.0, \""ClassLinesOfCode\"": 398.0, \""OverrideRatio\"": 0.01818181818181818, \""TightClassCohesion\"": 0.9444444444444444, \""PublicFieldCount\"": 0.0}"", ""{\""MethodLinesOfCode\"": 43.0, \""MaxCallChain\"": 8.0, \""ParameterCount\"": 0.0, \""CyclomaticComplexity\"": 8.0, \""LocalityRatio\"": 0.0}"", ""{\""MethodLinesOfCode\"": 43.0, \""MaxCallChain\"": 8.0, \""ParameterCount\"": 0.0, \""CyclomaticComplexity\"": 8.0, \""LocalityRatio\"": 0.0}"", ""{\""MethodLinesOfCode\"": 43.0, \""MaxCallChain\"": 8.0, \""ParameterCount\"": 0.0, \""CyclomaticComplexity\"": 8.0, \""LocalityRatio\"": 0.0}"", ""{\""MethodLinesOfCode\"": 92.0, \""MaxCallChain\"": 8.0, \""ParameterCount\"": 0.0, \""CyclomaticComplexity\"": 1.0, \""LocalityRatio\"": 0.0}"", ""{\""MethodLinesOfCode\"": 92.0, \""MaxCallChain\"": 8.0, \""ParameterCount\"": 0.0, \""CyclomaticComplexity\"": 1.0, \""LocalityRatio\"": 0.0}"", ""{\""MethodLinesOfCode\"": 20.0, \""MaxCallChain\"": 7.0, \""ParameterCount\"": 0.0, \""CyclomaticComplexity\"": 3.0, \""LocalityRatio\"": 0.0}"", ""{\""MethodLinesOfCode\"": 20.0, \""MaxCallChain\"": 7.0, \""ParameterCount\"": 0.0, \""CyclomaticComplexity\"": 3.0, \""LocalityRatio\"": 0.0}"", ""{\""MaxCallChain\"": 2.0, \""MethodLinesOfCode\"": 4.0, \""ParameterCount\"": 4.0, \""CyclomaticComplexity\"": 1.0, \""LocalityRatio\"": null}"", ""{\""MethodLinesOfCode\"": 92.0, \""MaxCallChain\"": 8.0, \""ParameterCount\"": 0.0, \""CyclomaticComplexity\"": 1.0, \""LocalityRatio\"": 0.0}"", ""{\""MethodLinesOfCode\"": 92.0, \""MaxCallChain\"": 8.0, \""ParameterCount\"": 0.0, \""CyclomaticComplexity\"": 1.0, \""LocalityRatio\"": 0.0}"", ""{\""MethodLinesOfCode\"": 20.0, \""MaxCallChain\"": 7.0, \""ParameterCount\"": 0.0, \""CyclomaticComplexity\"": 3.0, \""LocalityRatio\"": 0.0}"", ""{\""MethodLinesOfCode\"": 20.0, \""MaxCallChain\"": 7.0, \""ParameterCount\"": 0.0, \""CyclomaticComplexity\"": 3.0, \""LocalityRatio\"": 0.0}""]"
Researcher 3,elastic_elasticsearch,22572,"[""Extract Method"", ""Extract Method"", ""Extract Method"", ""Extract Method"", ""Extract Method"", ""Extract Method""]","[""org.elasticsearch.search.aggregations.reducers.moving.avg.MovAvgTests"", ""org.elasticsearch.search.aggregations.reducers.moving.avg.MovAvgTests.setupSimple"", ""org.elasticsearch.search.aggregations.reducers.moving.avg.MovAvgTests.linear"", ""org.elasticsearch.search.aggregations.reducers.moving.avg.MovAvgTests.doubleExp"", ""org.elasticsearch.search.aggregations.reducers.moving.avg.MovAvgTests.simple""]","[""c2be7f160293ab4425d032b43aaff22e8eb6d193"", ""c2be7f160293ab4425d032b43aaff22e8eb6d193"", ""c2be7f160293ab4425d032b43aaff22e8eb6d193"", ""c2be7f160293ab4425d032b43aaff22e8eb6d193""]","[""ComplexClass"", ""GodClass"", ""LongMethod"", ""FeatureEnvy""]","[""1e9a1b11e2c6b448f7f161e1dc5a2007"", ""b3094a21139809cf5e12ec71fbff8485"", ""3cda0dade1029b227c53cbd844deb4dd"", ""01a54614f4dcb86ee7c8df84ea2fa3e2""]","[1799, 70, 1799, 1799]","[1880, 1881, 1880, 1880]","[""{\""IsAbstract\"": 0.0, \""ClassLinesOfCode\"": 863.0, \""OverrideRatio\"": null, \""TightClassCohesion\"": 0.00026986183074265976, \""PublicFieldCount\"": 0.0}"", ""{\""IsAbstract\"": 0.0, \""ClassLinesOfCode\"": 863.0, \""OverrideRatio\"": null, \""TightClassCohesion\"": 0.00026986183074265976, \""PublicFieldCount\"": 0.0}"", ""{\""LocalityRatio\"": 0.0, \""ParameterCount\"": 2.0, \""CyclomaticComplexity\"": 14.0, \""MethodLinesOfCode\"": 79.0, \""MaxCallChain\"": 1.0}"", ""{\""LocalityRatio\"": 0.0, \""ParameterCount\"": 2.0, \""CyclomaticComplexity\"": 14.0, \""MethodLinesOfCode\"": 79.0, \""MaxCallChain\"": 1.0}""]","[""114d10e5a96b071121ac7862e176b1e15112aadb""]","[""FeatureEnvy""]","[""6b0e49af94ceb70c64250bbdf46a4893""]",[213],[226],"[""{\""LocalityRatio\"": 0.0, \""MaxCallChain\"": 1.0, \""ParameterCount\"": 1.0, \""CyclomaticComplexity\"": 2.0, \""MethodLinesOfCode\"": 6.0}""]"
Researcher 3,elastic_elasticsearch,22618,"[""Inline Method"", ""Inline Method"", ""Extract Method"", ""Extract Method"", ""Extract Method"", ""Extract Method""]","[""org.elasticsearch.common.network.NetworkService"", ""org.elasticsearch.common.network.NetworkService.resolvePublishHostAddress"", ""org.elasticsearch.common.network.NetworkService.resolveInetAddress""]","[""efa020e56785bd6e18b406c3dd030913bba3e3cb"", ""efa020e56785bd6e18b406c3dd030913bba3e3cb"", ""efa020e56785bd6e18b406c3dd030913bba3e3cb"", ""efa020e56785bd6e18b406c3dd030913bba3e3cb""]","[""ComplexClass"", ""GodClass"", ""LongParameterList"", ""FeatureEnvy""]","[""4b953f0d8f4c79f04a30a54bb145ed3b"", ""cebabe998ea0b93d1c8d92ab02ad8622"", ""84bee587fea38cb7da7a66260d15eba3"", ""930c164d25bfa99a6f0d445bfaa83670""]","[422, 106, 483, 483]","[450, 1133, 520, 520]","[""{\""IsAbstract\"": 0.0, \""ClassLinesOfCode\"": 543.0, \""OverrideRatio\"": null, \""TightClassCohesion\"": 0.0, \""PublicFieldCount\"": 0.0}"", ""{\""IsAbstract\"": 0.0, \""ClassLinesOfCode\"": 543.0, \""OverrideRatio\"": null, \""TightClassCohesion\"": 0.0, \""PublicFieldCount\"": 0.0}"", ""{\""LocalityRatio\"": 0.3333333333333333, \""MaxCallChain\"": 3.0, \""ParameterCount\"": 5.0, \""CyclomaticComplexity\"": 2.0, \""MethodLinesOfCode\"": 20.0}"", ""{\""LocalityRatio\"": 0.3333333333333333, \""MaxCallChain\"": 3.0, \""ParameterCount\"": 5.0, \""CyclomaticComplexity\"": 2.0, \""MethodLinesOfCode\"": 20.0}""]","[""68307aa9f3636bdccd1f1ca90f1d0fd640a019a5"", ""68307aa9f3636bdccd1f1ca90f1d0fd640a019a5"", ""68307aa9f3636bdccd1f1ca90f1d0fd640a019a5""]","[""ComplexClass"", ""FeatureEnvy"", ""FeatureEnvy""]","[""328056293a7431be672dbfb4c15b2969"", ""7342db55a166e412a08234f08640990c"", ""2f4f07e625bd94f4f13f95b7f2317242""]","[129, 125, 129]","[192, 127, 192]","[""{\""IsAbstract\"": 0.0, \""ClassLinesOfCode\"": 88.0, \""OverrideRatio\"": 0.2, \""PublicFieldCount\"": 0.0, \""TightClassCohesion\"": 0.09523809523809523}"", ""{\""LocalityRatio\"": 0.3333333333333333, \""MaxCallChain\"": 3.0, \""ParameterCount\"": 2.0, \""CyclomaticComplexity\"": 1.0, \""MethodLinesOfCode\"": 2.0}"", ""{\""LocalityRatio\"": 0.0, \""MaxCallChain\"": 2.0, \""ParameterCount\"": 3.0, \""CyclomaticComplexity\"": 19.0, \""MethodLinesOfCode\"": 43.0}""]"
Researcher 3,elastic_elasticsearch,22621,"[""Extract Method"", ""Extract Method"", ""Extract Method"", ""Extract Method""]","[""org.elasticsearch.cluster.routing.ShardRoutingHelper.relocate"", ""org.elasticsearch.cluster.routing.ShardRoutingHelper"", ""org.elasticsearch.cluster.routing.ShardRoutingHelper.initialize""]","[""efa020e56785bd6e18b406c3dd030913bba3e3cb"", ""efa020e56785bd6e18b406c3dd030913bba3e3cb"", ""efa020e56785bd6e18b406c3dd030913bba3e3cb"", ""efa020e56785bd6e18b406c3dd030913bba3e3cb""]","[""ComplexClass"", ""GodClass"", ""LongParameterList"", ""FeatureEnvy""]","[""4b953f0d8f4c79f04a30a54bb145ed3b"", ""cebabe998ea0b93d1c8d92ab02ad8622"", ""84bee587fea38cb7da7a66260d15eba3"", ""930c164d25bfa99a6f0d445bfaa83670""]","[422, 106, 483, 483]","[450, 1133, 520, 520]","[""{\""IsAbstract\"": 0.0, \""ClassLinesOfCode\"": 543.0, \""OverrideRatio\"": null, \""TightClassCohesion\"": 0.0, \""PublicFieldCount\"": 0.0}"", ""{\""IsAbstract\"": 0.0, \""ClassLinesOfCode\"": 543.0, \""OverrideRatio\"": null, \""TightClassCohesion\"": 0.0, \""PublicFieldCount\"": 0.0}"", ""{\""LocalityRatio\"": 0.3333333333333333, \""MaxCallChain\"": 3.0, \""ParameterCount\"": 5.0, \""CyclomaticComplexity\"": 2.0, \""MethodLinesOfCode\"": 20.0}"", ""{\""LocalityRatio\"": 0.3333333333333333, \""MaxCallChain\"": 3.0, \""ParameterCount\"": 5.0, \""CyclomaticComplexity\"": 2.0, \""MethodLinesOfCode\"": 20.0}""]","[""d2507c4ac0477f28b441f83eeac07786fb8f42b4"", ""d2507c4ac0477f28b441f83eeac07786fb8f42b4""]","[""FeatureEnvy"", ""FeatureEnvy""]","[""6c58691de4b2c9f3a98e76b559bcfe1b"", ""796f461fb914dc952323cc7a7272c0a7""]","[27, 35]","[29, 37]","[""{\""MethodLinesOfCode\"": 2.0, \""LocalityRatio\"": 0.0, \""ParameterCount\"": 2.0, \""CyclomaticComplexity\"": 1.0, \""MaxCallChain\"": 1.0}"", ""{\""MethodLinesOfCode\"": 2.0, \""LocalityRatio\"": 0.0, \""ParameterCount\"": 2.0, \""CyclomaticComplexity\"": 1.0, \""MaxCallChain\"": 1.0}""]"
Researcher 3,elastic_elasticsearch,22627,"[""Extract Method"", ""Extract Method"", ""Extract Method"", ""Extract Method"", ""Extract Method"", ""Extract Method""]","[""org.elasticsearch.node.internal.InternalSettingsPreparer.prepareSettings"", ""org.elasticsearch.node.internal.InternalSettingsPreparer"", ""org.elasticsearch.node.internal.InternalSettingsPreparer.useSystemProperties"", ""org.elasticsearch.node.internal.InternalSettingsPreparer.replacePromptPlaceholders"", ""org.elasticsearch.node.internal.InternalSettingsPreparer.finalizeSettings""]","[""632a171eb045f933f03c22c66914ed83cf507c96"", ""632a171eb045f933f03c22c66914ed83cf507c96"", ""632a171eb045f933f03c22c66914ed83cf507c96""]","[""FeatureEnvy"", ""FeatureEnvy"", ""MessageChain""]","[""0d12c8a6f705786cbfcd0855b260472c"", ""94a12ef049320c0f9153b532eaa4fe6d"", ""e4b39e41b114515f9c07fad994765044""]","[198, 171, 171]","[205, 196, 196]","[""{\""MethodLinesOfCode\"": 4.0, \""MaxCallChain\"": 3.0, \""ParameterCount\"": 1.0, \""CyclomaticComplexity\"": 1.0, \""LocalityRatio\"": 0.0}"", ""{\""MethodLinesOfCode\"": 4.0, \""MaxCallChain\"": 5.0, \""ParameterCount\"": 1.0, \""CyclomaticComplexity\"": 1.0, \""LocalityRatio\"": 0.0}"", ""{\""MethodLinesOfCode\"": 4.0, \""MaxCallChain\"": 5.0, \""ParameterCount\"": 1.0, \""CyclomaticComplexity\"": 1.0, \""LocalityRatio\"": 0.0}""]","[""1ff49eb8de157bb5eb6a43859ff7fcdf167d866d"", ""1ff49eb8de157bb5eb6a43859ff7fcdf167d866d"", ""1ff49eb8de157bb5eb6a43859ff7fcdf167d866d""]","[""FeatureEnvy"", ""FeatureEnvy"", ""FeatureEnvy""]","[""14522ffa1626dc84b8a8e826beb428fc"", ""27e6241971eb229a3a9093adfcdda004"", ""3cb97d6ccd3a719c0c492fe3bad415e8""]","[163, 140, 241]","[210, 142, 272]","[""{\""LocalityRatio\"": 0.08333333333333333, \""MethodLinesOfCode\"": 24.0, \""ParameterCount\"": 3.0, \""CyclomaticComplexity\"": 10.0, \""MaxCallChain\"": 3.0}"", ""{\""LocalityRatio\"": 0.0, \""MethodLinesOfCode\"": 2.0, \""ParameterCount\"": 1.0, \""CyclomaticComplexity\"": 1.0, \""MaxCallChain\"": 1.0}"", ""{\""LocalityRatio\"": 0.13333333333333333, \""MethodLinesOfCode\"": 21.0, \""ParameterCount\"": 2.0, \""CyclomaticComplexity\"": 8.0, \""MaxCallChain\"": 2.0}""]"
Researcher 3,elastic_elasticsearch,22634,"[""Move Attribute"", ""Move Attribute"", ""Extract Method"", ""Extract Method"", ""Move Attribute"", ""Move Attribute""]","[""org.elasticsearch.index.query.functionscore.FunctionScoreQueryParser"", ""org.elasticsearch.index.query.functionscore.FunctionScoreQueryBuilder"", ""org.elasticsearch.index.query.functionscore.FunctionScoreQueryParser.parse"", ""org.elasticsearch.index.query.functionscore.FunctionScoreQueryParser.parseFiltersAndFunctions""]","[""c09942375251bd1519bc930f8aed8de8d3f7892a"", ""c09942375251bd1519bc930f8aed8de8d3f7892a""]","[""MessageChain"", ""FeatureEnvy""]","[""47691ff3679743b9612acb9c971bc61c"", ""b04379b38c41513c700275eafd58a5f7""]","[265, 145]","[284, 163]","[""{\""LocalityRatio\"": 0.5, \""MethodLinesOfCode\"": 11.0, \""ParameterCount\"": 1.0, \""CyclomaticComplexity\"": 3.0, \""MaxCallChain\"": 4.0}"", ""{\""ParameterCount\"": 1.0, \""MethodLinesOfCode\"": 11.0, \""LocalityRatio\"": 0.16666666666666666, \""CyclomaticComplexity\"": 3.0, \""MaxCallChain\"": 4.0}""]","[""7eedd84dc38edd097ee8b43ad71859f11bc52501"", ""7eedd84dc38edd097ee8b43ad71859f11bc52501""]","[""ComplexClass"", ""FeatureEnvy""]","[""d73fbb9b7eff52681ed2c0852d81dae2"", ""f5f811d997b882d11cdb24d83577e096""]","[77, 165]","[191, 212]","[""{\""IsAbstract\"": 0.0, \""ClassLinesOfCode\"": 159.0, \""OverrideRatio\"": null, \""TightClassCohesion\"": 0.2, \""PublicFieldCount\"": 0.0}"", ""{\""LocalityRatio\"": 0.0, \""MaxCallChain\"": 2.0, \""ParameterCount\"": 3.0, \""CyclomaticComplexity\"": 12.0, \""MethodLinesOfCode\"": 30.0}""]"
Researcher 3,elastic_elasticsearch,22652,"[""Extract Method"", ""Extract Method"", ""Extract Method"", ""Extract Method""]","[""org.elasticsearch.ingest.processor.ConfigurationUtils"", ""org.elasticsearch.ingest.processor.ConfigurationUtils.readOptionalStringList"", ""org.elasticsearch.ingest.processor.ConfigurationUtils.readStringList""]","[""121dd8c13250f0f6ab683aa6012b9fd6d421dd1e"", ""121dd8c13250f0f6ab683aa6012b9fd6d421dd1e""]","[""FeatureEnvy"", ""FeatureEnvy""]","[""f0bffc21bd6f9a44d52ff1c72a3296d1"", ""e126756a0f06c0c49df6fd20f4b66958""]","[132, 160]","[143, 195]","[""{\""MaxCallChain\"": 1.0, \""MethodLinesOfCode\"": 7.0, \""ParameterCount\"": 0.0, \""CyclomaticComplexity\"": 3.0, \""LocalityRatio\"": 0.0}"", ""{\""MaxCallChain\"": 1.0, \""MethodLinesOfCode\"": 19.0, \""ParameterCount\"": 0.0, \""CyclomaticComplexity\"": 9.0, \""LocalityRatio\"": 0.4444444444444444}""]","[""2b31f4fff7ef8e79e398a82981de485e78d22bc0""]","[""FeatureEnvy""]","[""832e53209282ee001e50336245871a06""]",[76],[94],"[""{\""LocalityRatio\"": 0.0, \""MethodLinesOfCode\"": 9.0, \""ParameterCount\"": 2.0, \""CyclomaticComplexity\"": 3.0, \""MaxCallChain\"": 2.0}""]"
Wilian,elastic_elasticsearch,22691,"[""Extract Method"", ""Extract Method"", ""Inline Method"", ""Inline Method""]","[""org.elasticsearch.cluster.action.shard.ShardStateAction.shardFailed"", ""org.elasticsearch.cluster.action.shard.ShardStateAction"", ""org.elasticsearch.cluster.action.shard.ShardStateAction.sendShardFailed""]","[""13ba24bbe3914571dd6206c81dff4c2de6d186c4"", ""13ba24bbe3914571dd6206c81dff4c2de6d186c4"", ""13ba24bbe3914571dd6206c81dff4c2de6d186c4"", ""13ba24bbe3914571dd6206c81dff4c2de6d186c4"", ""13ba24bbe3914571dd6206c81dff4c2de6d186c4"", ""13ba24bbe3914571dd6206c81dff4c2de6d186c4"", ""13ba24bbe3914571dd6206c81dff4c2de6d186c4""]","[""MessageChain"", ""FeatureEnvy"", ""FeatureEnvy"", ""MessageChain"", ""LongParameterList"", ""MessageChain"", ""FeatureEnvy""]","[""cf878044683f8f5f72d632306985b5af"", ""4bd6a1c79bac9ca3d1d434e03887f821"", ""aef7304652f298ec8d97397196ceff3d"", ""8fc476ba472063e900a651dffb3da39f"", ""8a6b0cabbd452cd60d48cb25d1e67528"", ""1bac580759a9304d9008089f6899e2d2"", ""c0891b0f7c0bee1ec63a5acd6b28acb8""]","[395, 395, 465, 465, 465, 432, 432]","[430, 430, 508, 508, 508, 463, 463]","[""{\""MaxCallChain\"": 5.0, \""LocalityRatio\"": 0.0, \""ParameterCount\"": 1.0, \""CyclomaticComplexity\"": 7.0, \""MethodLinesOfCode\"": 25.0}"", ""{\""MaxCallChain\"": 5.0, \""LocalityRatio\"": 0.0, \""ParameterCount\"": 1.0, \""CyclomaticComplexity\"": 7.0, \""MethodLinesOfCode\"": 25.0}"", ""{\""MaxCallChain\"": 5.0, \""LocalityRatio\"": 0.0, \""ParameterCount\"": 4.0, \""CyclomaticComplexity\"": 8.0, \""MethodLinesOfCode\"": 30.0}"", ""{\""MaxCallChain\"": 5.0, \""LocalityRatio\"": 0.0, \""ParameterCount\"": 4.0, \""CyclomaticComplexity\"": 8.0, \""MethodLinesOfCode\"": 30.0}"", ""{\""MaxCallChain\"": 5.0, \""LocalityRatio\"": 0.0, \""ParameterCount\"": 4.0, \""CyclomaticComplexity\"": 8.0, \""MethodLinesOfCode\"": 30.0}"", ""{\""MaxCallChain\"": 4.0, \""LocalityRatio\"": 0.0, \""ParameterCount\"": 2.0, \""CyclomaticComplexity\"": 6.0, \""MethodLinesOfCode\"": 20.0}"", ""{\""MaxCallChain\"": 4.0, \""LocalityRatio\"": 0.0, \""ParameterCount\"": 2.0, \""CyclomaticComplexity\"": 6.0, \""MethodLinesOfCode\"": 20.0}""]","[""f17f9a5f360a0266d0fcc9bf2ff445b28baaa3df""]","[""LongParameterList""]","[""ec3eab37ba6abe4ad74612aef8c1c16c""]",[86],[100],"[""{\""MaxCallChain\"": 4.0, \""LocalityRatio\"": 0.1, \""ParameterCount\"": 4.0, \""CyclomaticComplexity\"": 2.0, \""MethodLinesOfCode\"": 10.0}""]"
Wilian,elastic_elasticsearch,22703,"[""Extract Method"", ""Extract Method"", ""Inline Method"", ""Inline Method""]","[""org.elasticsearch.rest.CorsRegexIT"", ""org.elasticsearch.rest.CorsRegexIT.testThatPreFlightRequestWorksOnMatch"", ""org.elasticsearch.rest.CorsRegexIT.assertResponseWithOriginheader"", ""org.elasticsearch.rest.CorsRegexIT.testThatPreFlightRequestReturnsNullOnNonMatch""]","[""b415a20ae89afa779c96677beb34dea7e51ac0da"", ""b415a20ae89afa779c96677beb34dea7e51ac0da"", ""b415a20ae89afa779c96677beb34dea7e51ac0da"", ""b415a20ae89afa779c96677beb34dea7e51ac0da"", ""b415a20ae89afa779c96677beb34dea7e51ac0da"", ""b415a20ae89afa779c96677beb34dea7e51ac0da""]","[""SpaghettiCode"", ""MessageChain"", ""FeatureEnvy"", ""LongMethod"", ""FeatureEnvy"", ""FeatureEnvy""]","[""05b2fdea1baebc88a6987849eddfb795"", ""04d7b4fdc890082946a073a3939a8af3"", ""77029d929f834d5432f9d675da49501e"", ""272ca7ddde43043f14958d00c0aa0973"", ""ba8473241d263ffd76087aba7f77d8ec"", ""02d5f7c036fe3c2ae9d6b8c90cb36cc2""]","[80, 514, 514, 514, 518, 338]","[704, 587, 587, 587, 539, 420]","[""{\""IsAbstract\"": 0.0, \""ClassLinesOfCode\"": 327.0, \""OverrideRatio\"": null, \""PublicFieldCount\"": 0.0, \""TightClassCohesion\"": 0.37318840579710144}"", ""{\""MaxCallChain\"": 5.0, \""LocalityRatio\"": 0.1111111111111111, \""ParameterCount\"": 3.0, \""CyclomaticComplexity\"": 6.0, \""MethodLinesOfCode\"": 46.0}"", ""{\""MaxCallChain\"": 5.0, \""LocalityRatio\"": 0.1111111111111111, \""ParameterCount\"": 3.0, \""CyclomaticComplexity\"": 6.0, \""MethodLinesOfCode\"": 46.0}"", ""{\""MaxCallChain\"": 5.0, \""LocalityRatio\"": 0.1111111111111111, \""ParameterCount\"": 3.0, \""CyclomaticComplexity\"": 6.0, \""MethodLinesOfCode\"": 46.0}"", ""{\""MethodLinesOfCode\"": 13.0, \""LocalityRatio\"": 0.42857142857142855, \""ParameterCount\"": 3.0, \""CyclomaticComplexity\"": 5.0, \""MaxCallChain\"": 2.0}"", ""{\""LocalityRatio\"": 0.24, \""MaxCallChain\"": 3.0, \""ParameterCount\"": 2.0, \""CyclomaticComplexity\"": 9.0, \""MethodLinesOfCode\"": 36.0}""]","[""592f5499cdf725a633022d2bc2a66e4e5f703e89"", ""592f5499cdf725a633022d2bc2a66e4e5f703e89""]","[""MessageChain"", ""MessageChain""]","[""8e15bfd0bdbd94dfed8e454ed211baed"", ""4cd2ec04e5d5bb628074ef22a4087309""]","[85, 91]","[89, 94]","[""{\""ParameterCount\"": 0.0, \""MaxCallChain\"": 6.0, \""LocalityRatio\"": 0.14285714285714285, \""CyclomaticComplexity\"": 1.0, \""MethodLinesOfCode\"": 4.0}"", ""{\""ParameterCount\"": 0.0, \""MaxCallChain\"": 6.0, \""LocalityRatio\"": 0.14285714285714285, \""CyclomaticComplexity\"": 1.0, \""MethodLinesOfCode\"": 3.0}""]"
Wilian,elastic_elasticsearch,22739,"[""Inline Method"", ""Inline Method"", ""Extract Method"", ""Extract Method""]","[""org.elasticsearch.index.reindex.AbstractAsyncBulkByScrollAction"", ""org.elasticsearch.index.reindex.AbstractAsyncBulkByScrollAction.initialSearch"", ""org.elasticsearch.index.reindex.AbstractAsyncBulkByScrollAction.start"", ""org.elasticsearch.index.reindex.AbstractAsyncBulkByScrollAction.onScrollResponse""]","[""b415a20ae89afa779c96677beb34dea7e51ac0da"", ""b415a20ae89afa779c96677beb34dea7e51ac0da"", ""b415a20ae89afa779c96677beb34dea7e51ac0da"", ""b415a20ae89afa779c96677beb34dea7e51ac0da"", ""b415a20ae89afa779c96677beb34dea7e51ac0da"", ""b415a20ae89afa779c96677beb34dea7e51ac0da""]","[""SpaghettiCode"", ""MessageChain"", ""FeatureEnvy"", ""LongMethod"", ""FeatureEnvy"", ""FeatureEnvy""]","[""05b2fdea1baebc88a6987849eddfb795"", ""04d7b4fdc890082946a073a3939a8af3"", ""77029d929f834d5432f9d675da49501e"", ""272ca7ddde43043f14958d00c0aa0973"", ""ba8473241d263ffd76087aba7f77d8ec"", ""02d5f7c036fe3c2ae9d6b8c90cb36cc2""]","[80, 514, 514, 514, 518, 338]","[704, 587, 587, 587, 539, 420]","[""{\""IsAbstract\"": 0.0, \""ClassLinesOfCode\"": 327.0, \""OverrideRatio\"": null, \""PublicFieldCount\"": 0.0, \""TightClassCohesion\"": 0.37318840579710144}"", ""{\""MaxCallChain\"": 5.0, \""LocalityRatio\"": 0.1111111111111111, \""ParameterCount\"": 3.0, \""CyclomaticComplexity\"": 6.0, \""MethodLinesOfCode\"": 46.0}"", ""{\""MaxCallChain\"": 5.0, \""LocalityRatio\"": 0.1111111111111111, \""ParameterCount\"": 3.0, \""CyclomaticComplexity\"": 6.0, \""MethodLinesOfCode\"": 46.0}"", ""{\""MaxCallChain\"": 5.0, \""LocalityRatio\"": 0.1111111111111111, \""ParameterCount\"": 3.0, \""CyclomaticComplexity\"": 6.0, \""MethodLinesOfCode\"": 46.0}"", ""{\""MethodLinesOfCode\"": 13.0, \""LocalityRatio\"": 0.42857142857142855, \""ParameterCount\"": 3.0, \""CyclomaticComplexity\"": 5.0, \""MaxCallChain\"": 2.0}"", ""{\""LocalityRatio\"": 0.24, \""MaxCallChain\"": 3.0, \""ParameterCount\"": 2.0, \""CyclomaticComplexity\"": 9.0, \""MethodLinesOfCode\"": 36.0}""]","[""da96b6e41d1b44eec8bfa170d8d0d8647e57dfef"", ""da96b6e41d1b44eec8bfa170d8d0d8647e57dfef"", ""da96b6e41d1b44eec8bfa170d8d0d8647e57dfef"", ""da96b6e41d1b44eec8bfa170d8d0d8647e57dfef"", ""da96b6e41d1b44eec8bfa170d8d0d8647e57dfef"", ""da96b6e41d1b44eec8bfa170d8d0d8647e57dfef""]","[""ComplexClass"", ""SpeculativeGenerality"", ""FeatureEnvy"", ""FeatureEnvy"", ""LongMethod"", ""MessageChain""]","[""973cb3ad02d1948c5c400767c8eb23d8"", ""83dc529c09be336af30911daccd87af6"", ""e2edcfbbfeba80758f037dfbb7813770"", ""44f8bcbe124879fdda7c367880718ba1"", ""08b16ce6eda8ca5211e792b00c9d4cec"", ""459b0c0f345bc4fc37e6638d216af7f1""]","[239, 69, 110, 160, 160, 160]","[288, 419, 112, 220, 220, 220]","[""{\""IsAbstract\"": 1.0, \""ClassLinesOfCode\"": 208.0, \""OverrideRatio\"": null, \""PublicFieldCount\"": 0.0, \""TightClassCohesion\"": 0.0}"", ""{\""IsAbstract\"": 1.0, \""ClassLinesOfCode\"": 208.0, \""OverrideRatio\"": null, \""PublicFieldCount\"": 0.0, \""TightClassCohesion\"": 0.0}"", ""{\""MethodLinesOfCode\"": 2.0, \""LocalityRatio\"": 0.0, \""ParameterCount\"": 0.0, \""CyclomaticComplexity\"": 1.0, \""MaxCallChain\"": 1.0}"", ""{\""MethodLinesOfCode\"": 39.0, \""LocalityRatio\"": 0.0, \""ParameterCount\"": 1.0, \""CyclomaticComplexity\"": 9.0, \""MaxCallChain\"": 4.0}"", ""{\""MethodLinesOfCode\"": 39.0, \""LocalityRatio\"": 0.0, \""ParameterCount\"": 1.0, \""CyclomaticComplexity\"": 9.0, \""MaxCallChain\"": 4.0}"", ""{\""MethodLinesOfCode\"": 39.0, \""LocalityRatio\"": 0.0, \""ParameterCount\"": 1.0, \""CyclomaticComplexity\"": 9.0, \""MaxCallChain\"": 4.0}""]"
Wilian,elastic_elasticsearch,22740,"[""Extract Method"", ""Extract Method"", ""Extract Method"", ""Extract Method"", ""Extract Method"", ""Extract Method"", ""Extract Method"", ""Extract Method"", ""Extract Method"", ""Extract Method"", ""Extract Method"", ""Extract Method""]","[""org.elasticsearch.index.search.stats.ShardSearchStats"", ""org.elasticsearch.index.search.stats.ShardSearchStats.onFetchPhase"", ""org.elasticsearch.index.search.stats.ShardSearchStats.computeStats"", ""org.elasticsearch.index.search.stats.ShardSearchStats.onPreFetchPhase"", ""org.elasticsearch.index.search.stats.ShardSearchStats.onQueryPhase"", ""org.elasticsearch.index.search.stats.ShardSearchStats.onFailedQueryPhase"", ""org.elasticsearch.index.search.stats.ShardSearchStats.onPreQueryPhase"", ""org.elasticsearch.index.search.stats.ShardSearchStats.onFailedFetchPhase""]","[""e061c4fe6016bf4286a7ab44ae42b72de1c4d92f"", ""e061c4fe6016bf4286a7ab44ae42b72de1c4d92f"", ""e061c4fe6016bf4286a7ab44ae42b72de1c4d92f"", ""e061c4fe6016bf4286a7ab44ae42b72de1c4d92f""]","[""LazyClass"", ""SpaghettiCode"", ""ComplexClass"", ""FeatureEnvy""]","[""f2bf85b6f0b5046d32f0359709708a86"", ""695817d8f47c2dbffe89b393438e4fe3"", ""0d18610ca1ba3f8c70ecda4c0fd1667b"", ""e8085f304459e105dda7a953a165b9f1""]","[67, 170, 437, 472]","[87, 928, 481, 481]","[""{\""IsAbstract\"": 0.0, \""ClassLinesOfCode\"": 10.0, \""OverrideRatio\"": null, \""PublicFieldCount\"": 0.0, \""TightClassCohesion\"": 0.0}"", ""{\""IsAbstract\"": 0.0, \""ClassLinesOfCode\"": 454.0, \""OverrideRatio\"": null, \""TightClassCohesion\"": 0.22857142857142856, \""PublicFieldCount\"": 0.0}"", ""{\""IsAbstract\"": 0.0, \""ClassLinesOfCode\"": 442.0, \""OverrideRatio\"": null, \""PublicFieldCount\"": 0.0, \""TightClassCohesion\"": 0.21904761904761905}"", ""{\""MaxCallChain\"": 3.0, \""ParameterCount\"": 2.0, \""CyclomaticComplexity\"": 2.0, \""MethodLinesOfCode\"": 6.0, \""LocalityRatio\"": 0.25}""]","[""91dd9b330136028f34dadda552a468a0009d87e9"", ""91dd9b330136028f34dadda552a468a0009d87e9"", ""91dd9b330136028f34dadda552a468a0009d87e9""]","[""MessageChain"", ""FeatureEnvy"", ""ClassDataShouldBePrivate""]","[""b92416e6f579af0d86140e63120f9fb9"", ""7bb46ed1312dc367bdafa99235ad3a93"", ""25ac1cc6d40e4c5612eb0168f6e64aa4""]","[139, 139, 36]","[146, 146, 209]","[""{\""MaxCallChain\"": 4.0, \""LocalityRatio\"": 0.0, \""ParameterCount\"": 2.0, \""CyclomaticComplexity\"": 3.0, \""MethodLinesOfCode\"": 5.0}"", ""{\""MaxCallChain\"": 4.0, \""LocalityRatio\"": 0.0, \""ParameterCount\"": 2.0, \""CyclomaticComplexity\"": 3.0, \""MethodLinesOfCode\"": 5.0}"", ""{\""IsAbstract\"": 0.0, \""ClassLinesOfCode\"": 98.0, \""OverrideRatio\"": null, \""TightClassCohesion\"": 0.6410256410256411, \""PublicFieldCount\"": 6.0}""]"