removal-patterns-feature-envy-2.csv
Validator,projectName,Batch ID,Refactorings,Code Elements,Start Commit,Smells Before,Smell Before IDs,Smells Before Starting Line,Smell Before Ending Line,Smell Before Reason,End Commit,Smells After,Smell After IDs,Smells After Starting Line,Smell After Ending Line,Smell After Reason
Researcher 1,apache_ant,20034,"[""Extract Method"", ""Extract Method"", ""Extract Method"", ""Extract Method"", ""Extract Method"", ""Extract Method"", ""Extract Method"", ""Extract Method"", ""Extract Method"", ""Extract Method"", ""Extract Method"", ""Extract Method"", ""Extract Method"", ""Extract Method"", ""Extract Method"", ""Extract Method"", ""Extract Method"", ""Extract Method""]","[""org.apache.tools.ant.taskdefs.UnzipTest.testPatternSetIncludeAndExclude"", ""org.apache.tools.ant.taskdefs.UnzipTest"", ""org.apache.tools.ant.taskdefs.UnzipTest.assertFileMissing"", ""org.apache.tools.ant.taskdefs.UnzipTest.testPatternSetIncludeOnly"", ""org.apache.tools.ant.taskdefs.UnzipTest.testRealTest"", ""org.apache.tools.ant.taskdefs.UnzipTest.assertLogoUncorrupted"", ""org.apache.tools.ant.taskdefs.UnzipTest.testPatternSetExcludeOnly"", ""org.apache.tools.ant.taskdefs.UnzipTest.testTestZipTask"", ""org.apache.tools.ant.taskdefs.UnzipTest.testPatternSetSlashOnly"", ""org.apache.tools.ant.taskdefs.UnzipTest.assertFileExists"", ""org.apache.tools.ant.taskdefs.UnzipTest.testTestUncompressedZipTask""]","[""5c2af90369a64d60eaaca8c1a47176fc42747256"", ""5c2af90369a64d60eaaca8c1a47176fc42747256"", ""5c2af90369a64d60eaaca8c1a47176fc42747256"", ""5c2af90369a64d60eaaca8c1a47176fc42747256"", ""5c2af90369a64d60eaaca8c1a47176fc42747256"", ""5c2af90369a64d60eaaca8c1a47176fc42747256"", ""5c2af90369a64d60eaaca8c1a47176fc42747256"", ""5c2af90369a64d60eaaca8c1a47176fc42747256"", ""5c2af90369a64d60eaaca8c1a47176fc42747256"", ""5c2af90369a64d60eaaca8c1a47176fc42747256""]","[""FeatureEnvy"", ""FeatureEnvy"", ""MessageChain"", ""MessageChain"", ""FeatureEnvy"", ""FeatureEnvy"", ""FeatureEnvy"", ""FeatureEnvy"", ""MessageChain"", ""FeatureEnvy""]","[""447cef9168d0b658f052c0621aa84c2f"", ""633e446f4857881160ee56ff12b950ec"", ""53b72c6fd465556f6b26ca9bb736e5b7"", ""ba3de64b07077f6e984f56c4cfbe005c"", ""98a963a9d3dade58c2a0133673039b95"", ""2f5db2e85a59bba0ae73d4f1fd54c808"", ""141e10b8c3656550f17a08f76a09ad5e"", ""8710f4f4a5012bf044d39fa43e4488af"", ""4a683d49040ea42cb04b4e985341200f"", ""de446273b9d88149a32b157c6a4caa49""]","[65, 86, 86, 75, 75, 58, 51, 97, 116, 116]","[70, 92, 92, 81, 81, 63, 56, 103, 122, 122]","[""{\""LocalityRatio\"": 0.0, \""MethodLinesOfCode\"": 4.0, \""ParameterCount\"": 0.0, \""CyclomaticComplexity\"": 1.0, \""MaxCallChain\"": 3.0}"", ""{\""LocalityRatio\"": 0.0, \""MethodLinesOfCode\"": 4.0, \""ParameterCount\"": 0.0, \""CyclomaticComplexity\"": 1.0, \""MaxCallChain\"": 4.0}"", ""{\""LocalityRatio\"": 0.0, \""MethodLinesOfCode\"": 4.0, \""ParameterCount\"": 0.0, \""CyclomaticComplexity\"": 1.0, \""MaxCallChain\"": 4.0}"", ""{\""LocalityRatio\"": 0.0, \""MethodLinesOfCode\"": 4.0, \""ParameterCount\"": 0.0, \""CyclomaticComplexity\"": 1.0, \""MaxCallChain\"": 4.0}"", ""{\""LocalityRatio\"": 0.0, \""MethodLinesOfCode\"": 4.0, \""ParameterCount\"": 0.0, \""CyclomaticComplexity\"": 1.0, \""MaxCallChain\"": 4.0}"", ""{\""LocalityRatio\"": 0.0, \""MethodLinesOfCode\"": 4.0, \""ParameterCount\"": 0.0, \""CyclomaticComplexity\"": 1.0, \""MaxCallChain\"": 3.0}"", ""{\""LocalityRatio\"": 0.0, \""MethodLinesOfCode\"": 4.0, \""ParameterCount\"": 0.0, \""CyclomaticComplexity\"": 1.0, \""MaxCallChain\"": 3.0}"", ""{\""LocalityRatio\"": 0.0, \""MethodLinesOfCode\"": 4.0, \""ParameterCount\"": 0.0, \""CyclomaticComplexity\"": 1.0, \""MaxCallChain\"": 3.0}"", ""{\""LocalityRatio\"": 0.0, \""MethodLinesOfCode\"": 4.0, \""ParameterCount\"": 0.0, \""CyclomaticComplexity\"": 1.0, \""MaxCallChain\"": 4.0}"", ""{\""LocalityRatio\"": 0.0, \""MethodLinesOfCode\"": 4.0, \""ParameterCount\"": 0.0, \""CyclomaticComplexity\"": 1.0, \""MaxCallChain\"": 4.0}""]","[""fdc903238f666ea1f4f60385d40463c8ca3494d2"", ""fdc903238f666ea1f4f60385d40463c8ca3494d2""]","[""FeatureEnvy"", ""MessageChain""]","[""9a3b7be21cbf51d2405322a9d691cbd8"", ""92cee561dc5a752a30f0250b5bd5b68a""]","[58, 140]","[66, 148]","[""{\""MethodLinesOfCode\"": 3.0, \""MaxCallChain\"": 3.0, \""ParameterCount\"": 0.0, \""CyclomaticComplexity\"": 1.0, \""LocalityRatio\"": 0.0}"", ""{\""MethodLinesOfCode\"": 2.0, \""MaxCallChain\"": 4.0, \""ParameterCount\"": 2.0, \""CyclomaticComplexity\"": 1.0, \""LocalityRatio\"": null}""]"
Researcher 1,apache_ant,20036,"[""Extract Method"", ""Extract Method"", ""Extract Method"", ""Extract Method"", ""Extract Method"", ""Extract Method""]","[""org.apache.tools.ant.taskdefs.RecorderEntry"", ""org.apache.tools.ant.taskdefs.RecorderEntry.targetFinished"", ""org.apache.tools.ant.taskdefs.RecorderEntry.flush"", ""org.apache.tools.ant.taskdefs.RecorderEntry.taskFinished"", ""org.apache.tools.ant.taskdefs.RecorderEntry.cleanup"", ""org.apache.tools.ant.taskdefs.RecorderEntry.closeFile""]","[""0a9a3cc1f80e139aa4ca8bba7080bdbf728ed311"", ""0a9a3cc1f80e139aa4ca8bba7080bdbf728ed311"", ""0a9a3cc1f80e139aa4ca8bba7080bdbf728ed311""]","[""FeatureEnvy"", ""FeatureEnvy"", ""FeatureEnvy""]","[""15763079d907d1b631c7ba5a637aacca"", ""72d0f696816f6fd84a37e22c37208632"", ""ac6a4a09ca5bd1538eaee60503f16c39""]","[142, 157, 253]","[149, 160, 263]","[""{\""MethodLinesOfCode\"": 5.0, \""MaxCallChain\"": 1.0, \""ParameterCount\"": 1.0, \""CyclomaticComplexity\"": 1.0, \""LocalityRatio\"": 0.42857142857142855}"", ""{\""MethodLinesOfCode\"": 3.0, \""MaxCallChain\"": 1.0, \""ParameterCount\"": 1.0, \""CyclomaticComplexity\"": 1.0, \""LocalityRatio\"": 0.3333333333333333}"", ""{\""MethodLinesOfCode\"": 6.0, \""MaxCallChain\"": 1.0, \""ParameterCount\"": 0.0, \""CyclomaticComplexity\"": 2.0, \""LocalityRatio\"": 0.0}""]","[""f40450a1ea9d49a2fe1a3c01da37f89fc7bfed7f"", ""f40450a1ea9d49a2fe1a3c01da37f89fc7bfed7f""]","[""FeatureEnvy"", ""FeatureEnvy""]","[""6128ca655fa81084ffc700e3dd991231"", ""f09e03798764c7786e5cc6c58ffb577a""]","[204, 288]","[208, 298]","[""{\""LocalityRatio\"": 0.0, \""MaxCallChain\"": 1.0, \""ParameterCount\"": 0.0, \""CyclomaticComplexity\"": 2.0, \""MethodLinesOfCode\"": 3.0}"", ""{\""LocalityRatio\"": 0.0, \""MaxCallChain\"": 1.0, \""ParameterCount\"": 0.0, \""CyclomaticComplexity\"": 2.0, \""MethodLinesOfCode\"": 4.0}""]"
Researcher 1,apache_ant,20040,"[""Extract Method"", ""Extract Method"", ""Extract Method"", ""Extract Method""]","[""org.apache.tools.ant.DirectoryScanner"", ""org.apache.tools.ant.DirectoryScanner.setExcludes"", ""org.apache.tools.ant.DirectoryScanner.normalizePattern"", ""org.apache.tools.ant.DirectoryScanner.setIncludes""]","[""6bdc259c2e818e1c86f944cbd8950e670294d944"", ""6bdc259c2e818e1c86f944cbd8950e670294d944"", ""6bdc259c2e818e1c86f944cbd8950e670294d944"", ""6bdc259c2e818e1c86f944cbd8950e670294d944""]","[""ComplexClass"", ""SpaghettiCode"", ""FeatureEnvy"", ""FeatureEnvy""]","[""ca4874f5988c54bf0909731795c24fab"", ""de1bf3821c9b0e18c73a4e3572622515"", ""cbaf0ea052e7ea1ef5e4f496ddfb3f92"", ""53768e317cf02166aa5b55ba54a4d951""]","[277, 60, 718, 691]","[409, 959, 741, 714]","[""{\""IsAbstract\"": 0.0, \""ClassLinesOfCode\"": 331.0, \""OverrideRatio\"": null, \""PublicFieldCount\"": 0.0, \""TightClassCohesion\"": 0.14285714285714285}"", ""{\""IsAbstract\"": 0.0, \""ClassLinesOfCode\"": 331.0, \""OverrideRatio\"": null, \""PublicFieldCount\"": 0.0, \""TightClassCohesion\"": 0.14285714285714285}"", ""{\""MaxCallChain\"": 2.0, \""LocalityRatio\"": 0.0, \""ParameterCount\"": 1.0, \""CyclomaticComplexity\"": 4.0, \""MethodLinesOfCode\"": 10.0}"", ""{\""MaxCallChain\"": 2.0, \""LocalityRatio\"": 0.0, \""ParameterCount\"": 1.0, \""CyclomaticComplexity\"": 4.0, \""MethodLinesOfCode\"": 10.0}""]","[""28d39b09a766fbb0dd3ca9b65ac06edf89075e8e"", ""28d39b09a766fbb0dd3ca9b65ac06edf89075e8e"", ""28d39b09a766fbb0dd3ca9b65ac06edf89075e8e""]","[""SpaghettiCode"", ""ComplexClass"", ""FeatureEnvy""]","[""de1bf3821c9b0e18c73a4e3572622515"", ""ca4874f5988c54bf0909731795c24fab"", ""bd18618201294b857c310e5038b2eb6e""]","[60, 277, 648]","[959, 409, 664]","[""{\""IsAbstract\"": 0.0, \""ClassLinesOfCode\"": 331.0, \""OverrideRatio\"": null, \""PublicFieldCount\"": 0.0, \""TightClassCohesion\"": 0.14285714285714285}"", ""{\""IsAbstract\"": 0.0, \""ClassLinesOfCode\"": 331.0, \""OverrideRatio\"": null, \""PublicFieldCount\"": 0.0, \""TightClassCohesion\"": 0.14285714285714285}"", ""{\""ParameterCount\"": 1.0, \""MaxCallChain\"": 2.0, \""LocalityRatio\"": 0.0, \""CyclomaticComplexity\"": 2.0, \""MethodLinesOfCode\"": 5.0}""]"
Researcher 1,apache_ant,20051,"[""Extract Method"", ""Extract Method"", ""Move Method"", ""Move Method"", ""Move Method"", ""Move Method""]","[""org.apache.tools.ant.types.Path"", ""org.apache.tools.ant.types.Path.list"", ""org.apache.tools.ant.types.Path.getCollection"", ""org.apache.tools.ant.types.FileSet"", ""org.apache.tools.ant.types.Resource""]","[""ec980be7345681968c93f0609e9a3fecb39b9753"", ""ec980be7345681968c93f0609e9a3fecb39b9753"", ""ec980be7345681968c93f0609e9a3fecb39b9753"", ""ec980be7345681968c93f0609e9a3fecb39b9753""]","[""ComplexClass"", ""MessageChain"", ""FeatureEnvy"", ""LongMethod""]","[""a0dc03307806c4c2130809917dd2d71f"", ""bbfef81d07731700d64f698963ac37d9"", ""18dd9e596c16728ae45b950d5f5f6584"", ""ae1c2466c52034a04902d877ef2d3326""]","[265, 311, 277, 277]","[320, 374, 356, 356]","[""{\""IsAbstract\"": 0.0, \""ClassLinesOfCode\"": 163.0, \""OverrideRatio\"": null, \""PublicFieldCount\"": 0.0, \""TightClassCohesion\"": 0.3382352941176471}"", ""{\""LocalityRatio\"": 0.21621621621621623, \""MaxCallChain\"": 4.0, \""ParameterCount\"": 0.0, \""CyclomaticComplexity\"": 15.0, \""MethodLinesOfCode\"": 41.0}"", ""{\""LocalityRatio\"": 0.2619047619047619, \""MethodLinesOfCode\"": 58.0, \""ParameterCount\"": 0.0, \""CyclomaticComplexity\"": 18.0, \""MaxCallChain\"": 2.0}"", ""{\""LocalityRatio\"": 0.2619047619047619, \""MethodLinesOfCode\"": 58.0, \""ParameterCount\"": 0.0, \""CyclomaticComplexity\"": 18.0, \""MaxCallChain\"": 2.0}""]","[""fbb9886634198d8377104bef9ec697fadeb134df""]","[""FeatureEnvy""]","[""c5a0b3af73ae665fe07c93d0cafe9602""]",[293],[317],"[""{\""LocalityRatio\"": 0.0, \""MaxCallChain\"": 2.0, \""ParameterCount\"": 0.0, \""CyclomaticComplexity\"": 6.0, \""MethodLinesOfCode\"": 12.0}""]"
Researcher 1,apache_ant,20052,"[""Extract Method"", ""Extract Method"", ""Extract Method"", ""Extract Method""]","[""org.apache.tools.ant.ComponentHelper.initTasks"", ""org.apache.tools.ant.ComponentHelper"", ""org.apache.tools.ant.ComponentHelper.getClassLoader"", ""org.apache.tools.ant.ComponentHelper.initTypes""]","[""ec980be7345681968c93f0609e9a3fecb39b9753"", ""ec980be7345681968c93f0609e9a3fecb39b9753"", ""ec980be7345681968c93f0609e9a3fecb39b9753"", ""ec980be7345681968c93f0609e9a3fecb39b9753""]","[""ComplexClass"", ""MessageChain"", ""FeatureEnvy"", ""LongMethod""]","[""a0dc03307806c4c2130809917dd2d71f"", ""bbfef81d07731700d64f698963ac37d9"", ""18dd9e596c16728ae45b950d5f5f6584"", ""ae1c2466c52034a04902d877ef2d3326""]","[265, 311, 277, 277]","[320, 374, 356, 356]","[""{\""IsAbstract\"": 0.0, \""ClassLinesOfCode\"": 163.0, \""OverrideRatio\"": null, \""PublicFieldCount\"": 0.0, \""TightClassCohesion\"": 0.3382352941176471}"", ""{\""LocalityRatio\"": 0.21621621621621623, \""MaxCallChain\"": 4.0, \""ParameterCount\"": 0.0, \""CyclomaticComplexity\"": 15.0, \""MethodLinesOfCode\"": 41.0}"", ""{\""LocalityRatio\"": 0.2619047619047619, \""MethodLinesOfCode\"": 58.0, \""ParameterCount\"": 0.0, \""CyclomaticComplexity\"": 18.0, \""MaxCallChain\"": 2.0}"", ""{\""LocalityRatio\"": 0.2619047619047619, \""MethodLinesOfCode\"": 58.0, \""ParameterCount\"": 0.0, \""CyclomaticComplexity\"": 18.0, \""MaxCallChain\"": 2.0}""]","[""954f6058d772148440655e920c59b4cdfc651924"", ""954f6058d772148440655e920c59b4cdfc651924"", ""954f6058d772148440655e920c59b4cdfc651924"", ""954f6058d772148440655e920c59b4cdfc651924""]","[""FeatureEnvy"", ""ComplexClass"", ""FeatureEnvy"", ""FeatureEnvy""]","[""e0dfca7b9e3444fbb1e9711b05b97c97"", ""5ab91a9bf3888ca1d826260e55ada4f8"", ""bce6fcc9c7c40ef7d0be8b9c11dd289f"", ""685780a2f50527d176c2553acc9ddc96""]","[556, 771, 745, 599]","[597, 913, 752, 638]","[""{\""MaxCallChain\"": 2.0, \""MethodLinesOfCode\"": 12.0, \""ParameterCount\"": 0.0, \""CyclomaticComplexity\"": 3.0, \""LocalityRatio\"": 0.0}"", ""{\""IsAbstract\"": 0.0, \""ClassLinesOfCode\"": 400.0, \""OverrideRatio\"": null, \""PublicFieldCount\"": 0.0, \""TightClassCohesion\"": 0.16304347826086957}"", ""{\""MethodLinesOfCode\"": 5.0, \""MaxCallChain\"": 1.0, \""ParameterCount\"": 1.0, \""CyclomaticComplexity\"": 2.0, \""LocalityRatio\"": 0.0}"", ""{\""MaxCallChain\"": 2.0, \""MethodLinesOfCode\"": 12.0, \""ParameterCount\"": 0.0, \""CyclomaticComplexity\"": 3.0, \""LocalityRatio\"": 0.0}""]"
Researcher 1,apache_ant,20055,"[""Extract Method"", ""Extract Method"", ""Extract Method"", ""Extract Method"", ""Extract Method"", ""Extract Method"", ""Extract Method"", ""Extract Method"", ""Extract Method"", ""Extract Method"", ""Extract Method"", ""Extract Method""]","[""org.apache.tools.ant.taskdefs.UntarTest"", ""org.apache.tools.ant.taskdefs.UntarTest.testRealGzipTest"", ""org.apache.tools.ant.taskdefs.UntarTest.testLogoExtraction"", ""org.apache.tools.ant.taskdefs.UntarTest.testTestBzip2TarTask"", ""org.apache.tools.ant.taskdefs.UntarTest.testTestGzipTarTask"", ""org.apache.tools.ant.taskdefs.UntarTest.testRealBzip2Test"", ""org.apache.tools.ant.taskdefs.UntarTest.testTestTarTask"", ""org.apache.tools.ant.taskdefs.UntarTest.testRealTest""]","[""e84f6000f4fe0a42dae2cd2f8baaca89a5b2195f"", ""e84f6000f4fe0a42dae2cd2f8baaca89a5b2195f"", ""e84f6000f4fe0a42dae2cd2f8baaca89a5b2195f"", ""e84f6000f4fe0a42dae2cd2f8baaca89a5b2195f"", ""e84f6000f4fe0a42dae2cd2f8baaca89a5b2195f""]","[""FeatureEnvy"", ""LongMethod"", ""ComplexClass"", ""SpaghettiCode"", ""FeatureEnvy""]","[""e0dfca7b9e3444fbb1e9711b05b97c97"", ""1194c9f7d419ac0d5e23ae3071afbd4c"", ""5ab91a9bf3888ca1d826260e55ada4f8"", ""f55564c15acfd5e8566aefaf2f6dcd81"", ""685780a2f50527d176c2553acc9ddc96""]","[556, 703, 771, 41, 599]","[597, 746, 913, 964, 638]","[""{\""MaxCallChain\"": 2.0, \""MethodLinesOfCode\"": 12.0, \""ParameterCount\"": 0.0, \""CyclomaticComplexity\"": 3.0, \""LocalityRatio\"": 0.0}"", ""{\""MaxCallChain\"": 2.0, \""MethodLinesOfCode\"": 31.0, \""ParameterCount\"": 0.0, \""CyclomaticComplexity\"": 7.0, \""LocalityRatio\"": 0.0}"", ""{\""IsAbstract\"": 0.0, \""ClassLinesOfCode\"": 400.0, \""OverrideRatio\"": null, \""PublicFieldCount\"": 0.0, \""TightClassCohesion\"": 0.16304347826086957}"", ""{\""IsAbstract\"": 0.0, \""ClassLinesOfCode\"": 400.0, \""OverrideRatio\"": null, \""PublicFieldCount\"": 0.0, \""TightClassCohesion\"": 0.16304347826086957}"", ""{\""MaxCallChain\"": 2.0, \""MethodLinesOfCode\"": 12.0, \""ParameterCount\"": 0.0, \""CyclomaticComplexity\"": 3.0, \""LocalityRatio\"": 0.0}""]","[""582bc0f7f6adc7d9dc188b2b853e81be7e9fac4a""]","[""FeatureEnvy""]","[""2cf7c18043d87b025bcaea2fc6ae2324""]",[80],[84],"[""{\""MaxCallChain\"": 3.0, \""LocalityRatio\"": 0.0, \""ParameterCount\"": 1.0, \""CyclomaticComplexity\"": 1.0, \""MethodLinesOfCode\"": 3.0}""]"
Researcher 1,apache_ant,20058,"[""Extract Method"", ""Extract Method"", ""Extract Method"", ""Extract Method""]","[""org.apache.tools.ant.types.ArchiveFileSet"", ""org.apache.tools.ant.types.ArchiveFileSet.setFileMode"", ""org.apache.tools.ant.types.ArchiveFileSet.integerSetFileMode"", ""org.apache.tools.ant.types.ArchiveFileSet.setDirMode"", ""org.apache.tools.ant.types.ArchiveFileSet.integerSetDirMode""]","[""6b537c31e7acf1b47295b0dcdcba94bab4a6f974"", ""6b537c31e7acf1b47295b0dcdcba94bab4a6f974"", ""6b537c31e7acf1b47295b0dcdcba94bab4a6f974"", ""6b537c31e7acf1b47295b0dcdcba94bab4a6f974"", ""6b537c31e7acf1b47295b0dcdcba94bab4a6f974"", ""6b537c31e7acf1b47295b0dcdcba94bab4a6f974""]","[""FeatureEnvy"", ""FeatureEnvy"", ""FeatureEnvy"", ""FeatureEnvy"", ""FeatureEnvy"", ""FeatureEnvy""]","[""a1cc01a61435bd1058d86e99e08f3ada"", ""b10cda56d53fb8b4bd4256cf54dee941"", ""324e42b2faafaf64c0bfd4f8d097056f"", ""1d1e17aab3b1aedce92c8d9c86d5c316"", ""4310200fcc84d4a8c2c233a12c3c576f"", ""48d89843958d144276e2c550db3dd8f4""]","[47, 53, 41, 59, 65, 71]","[51, 57, 45, 63, 69, 75]","[""{\""MethodLinesOfCode\"": 3.0, \""LocalityRatio\"": 0.0, \""ParameterCount\"": 0.0, \""CyclomaticComplexity\"": 1.0, \""MaxCallChain\"": 3.0}"", ""{\""MethodLinesOfCode\"": 3.0, \""LocalityRatio\"": 0.0, \""ParameterCount\"": 0.0, \""CyclomaticComplexity\"": 1.0, \""MaxCallChain\"": 3.0}"", ""{\""MethodLinesOfCode\"": 3.0, \""LocalityRatio\"": 0.0, \""ParameterCount\"": 0.0, \""CyclomaticComplexity\"": 1.0, \""MaxCallChain\"": 3.0}"", ""{\""MethodLinesOfCode\"": 3.0, \""LocalityRatio\"": 0.0, \""ParameterCount\"": 0.0, \""CyclomaticComplexity\"": 1.0, \""MaxCallChain\"": 3.0}"", ""{\""MethodLinesOfCode\"": 3.0, \""LocalityRatio\"": 0.0, \""ParameterCount\"": 0.0, \""CyclomaticComplexity\"": 1.0, \""MaxCallChain\"": 3.0}"", ""{\""MethodLinesOfCode\"": 3.0, \""LocalityRatio\"": 0.0, \""ParameterCount\"": 0.0, \""CyclomaticComplexity\"": 1.0, \""MaxCallChain\"": 3.0}""]","[""b5fcf10604f56a8061d10f332570342b34cc7a9d"", ""b5fcf10604f56a8061d10f332570342b34cc7a9d""]","[""RefusedBequest"", ""SpeculativeGenerality""]","[""8949facac350c41879403d2a2116a082"", ""c71064a3bb5218762c03e4e2f54590fb""]","[27, 27]","[420, 420]","[""{\""IsAbstract\"": 1.0, \""ClassLinesOfCode\"": 136.0, \""OverrideRatio\"": 1.0, \""PublicFieldCount\"": 0.0, \""TightClassCohesion\"": 0.12307692307692308}"", ""{\""IsAbstract\"": 1.0, \""ClassLinesOfCode\"": 136.0, \""OverrideRatio\"": 1.0, \""PublicFieldCount\"": 0.0, \""TightClassCohesion\"": 0.12307692307692308}""]"
Researcher 1,apache_ant,20061,"[""Extract Method"", ""Extract Method"", ""Extract Method"", ""Extract Method"", ""Extract Method"", ""Extract Method""]","[""org.apache.tools.ant.taskdefs.GUnzipTest"", ""org.apache.tools.ant.taskdefs.GUnzipTest.testTestGzipTask"", ""org.apache.tools.ant.taskdefs.GUnzipTest.testRealTest"", ""org.apache.tools.ant.taskdefs.GUnzipTest.testDocumentationClaimsOnCopy""]","[""1400dc3c1b536c70697f83be990b0725121cba90"", ""1400dc3c1b536c70697f83be990b0725121cba90"", ""1400dc3c1b536c70697f83be990b0725121cba90"", ""1400dc3c1b536c70697f83be990b0725121cba90""]","[""SpeculativeGenerality"", ""RefusedBequest"", ""FeatureEnvy"", ""FeatureEnvy""]","[""c71064a3bb5218762c03e4e2f54590fb"", ""8949facac350c41879403d2a2116a082"", ""ff2a3ec436312aa13fd66a3432536347"", ""486cb433b746d8d163c0ca6fac4d21aa""]","[27, 27, 306, 349]","[420, 420, 316, 359]","[""{\""IsAbstract\"": 1.0, \""ClassLinesOfCode\"": 136.0, \""OverrideRatio\"": 1.0, \""PublicFieldCount\"": 0.0, \""TightClassCohesion\"": 0.12307692307692308}"", ""{\""IsAbstract\"": 1.0, \""ClassLinesOfCode\"": 136.0, \""OverrideRatio\"": 1.0, \""PublicFieldCount\"": 0.0, \""TightClassCohesion\"": 0.12307692307692308}"", ""{\""MaxCallChain\"": 1.0, \""LocalityRatio\"": 0.0, \""ParameterCount\"": 1.0, \""CyclomaticComplexity\"": 1.0, \""MethodLinesOfCode\"": 3.0}"", ""{\""MaxCallChain\"": 1.0, \""LocalityRatio\"": 0.0, \""ParameterCount\"": 1.0, \""CyclomaticComplexity\"": 1.0, \""MethodLinesOfCode\"": 3.0}""]","[""e3707fdec844ab18d5a75404f061041efb8670d9""]","[""FeatureEnvy""]","[""761c220ff525513735fffb0a9076e054""]",[49],[53],"[""{\""LocalityRatio\"": 0.0, \""ParameterCount\"": 0.0, \""CyclomaticComplexity\"": 1.0, \""MethodLinesOfCode\"": 3.0, \""MaxCallChain\"": 3.0}""]"
Researcher 1,apache_ant,20062,"[""Extract Method"", ""Extract Method"", ""Extract Method"", ""Extract Method""]","[""org.apache.tools.ant.taskdefs.BUnzip2Test"", ""org.apache.tools.ant.taskdefs.BUnzip2Test.testDocumentationClaimsOnCopy"", ""org.apache.tools.ant.taskdefs.BUnzip2Test.testRealTest""]","[""c21b522b7be6c4c060da7aab1d8e276492a27454"", ""c21b522b7be6c4c060da7aab1d8e276492a27454"", ""c21b522b7be6c4c060da7aab1d8e276492a27454""]","[""FeatureEnvy"", ""FeatureEnvy"", ""FeatureEnvy""]","[""605f53dc72cfd708a4b89e4bd74334ee"", ""761c220ff525513735fffb0a9076e054"", ""56d92fb267a8cc42f7394c35b649a2ca""]","[55, 49, 61]","[59, 53, 65]","[""{\""LocalityRatio\"": 0.0, \""ParameterCount\"": 0.0, \""CyclomaticComplexity\"": 1.0, \""MethodLinesOfCode\"": 3.0, \""MaxCallChain\"": 3.0}"", ""{\""LocalityRatio\"": 0.0, \""ParameterCount\"": 0.0, \""CyclomaticComplexity\"": 1.0, \""MethodLinesOfCode\"": 3.0, \""MaxCallChain\"": 3.0}"", ""{\""LocalityRatio\"": 0.0, \""ParameterCount\"": 0.0, \""CyclomaticComplexity\"": 1.0, \""MethodLinesOfCode\"": 3.0, \""MaxCallChain\"": 3.0}""]","[""e3707fdec844ab18d5a75404f061041efb8670d9""]","[""FeatureEnvy""]","[""2bddc8ce95966c5b914d030a604b3563""]",[45],[50],"[""{\""LocalityRatio\"": 0.0, \""ParameterCount\"": 0.0, \""CyclomaticComplexity\"": 1.0, \""MethodLinesOfCode\"": 3.0, \""MaxCallChain\"": 3.0}""]"
Researcher 1,apache_ant,20067,"[""Extract Method"", ""Extract Method"", ""Extract Method"", ""Extract Method"", ""Extract Method"", ""Extract Method""]","[""org.apache.tools.ant.DirectoryScanner"", ""org.apache.tools.ant.DirectoryScanner.accountForIncludedFile"", ""org.apache.tools.ant.DirectoryScanner.processIncluded"", ""org.apache.tools.ant.DirectoryScanner.slowScan"", ""org.apache.tools.ant.DirectoryScanner.processSlowScan"", ""org.apache.tools.ant.DirectoryScanner.accountForIncludedDir""]","[""c21b522b7be6c4c060da7aab1d8e276492a27454"", ""c21b522b7be6c4c060da7aab1d8e276492a27454""]","[""FeatureEnvy"", ""FeatureEnvy""]","[""60a76f730f7f3403ae4f4f34c7e0212d"", ""2bddc8ce95966c5b914d030a604b3563""]","[52, 45]","[57, 50]","[""{\""LocalityRatio\"": 0.0, \""ParameterCount\"": 0.0, \""CyclomaticComplexity\"": 1.0, \""MethodLinesOfCode\"": 3.0, \""MaxCallChain\"": 3.0}"", ""{\""LocalityRatio\"": 0.0, \""ParameterCount\"": 0.0, \""CyclomaticComplexity\"": 1.0, \""MethodLinesOfCode\"": 3.0, \""MaxCallChain\"": 3.0}""]","[""21a1b3cfb48abc9e87a97e1bdab451abe49b44eb"", ""21a1b3cfb48abc9e87a97e1bdab451abe49b44eb"", ""21a1b3cfb48abc9e87a97e1bdab451abe49b44eb"", ""21a1b3cfb48abc9e87a97e1bdab451abe49b44eb"", ""21a1b3cfb48abc9e87a97e1bdab451abe49b44eb""]","[""LongParameterList"", ""FeatureEnvy"", ""FeatureEnvy"", ""ComplexClass"", ""SpaghettiCode""]","[""543d84eb35b73c5a216c631a65eda1f7"", ""889d038d4ee316dfff576bdf3202ebeb"", ""fb0197250471c23656c6a2129d285f84"", ""ca4874f5988c54bf0909731795c24fab"", ""de1bf3821c9b0e18c73a4e3572622515""]","[1134, 1134, 954, 277, 60]","[1148, 1148, 1016, 409, 959]","[""{\""LocalityRatio\"": 0.25, \""MethodLinesOfCode\"": 11.0, \""ParameterCount\"": 5.0, \""CyclomaticComplexity\"": 4.0, \""MaxCallChain\"": 1.0}"", ""{\""LocalityRatio\"": 0.25, \""MethodLinesOfCode\"": 11.0, \""ParameterCount\"": 5.0, \""CyclomaticComplexity\"": 4.0, \""MaxCallChain\"": 1.0}"", ""{\""LocalityRatio\"": 0.45454545454545453, \""ParameterCount\"": 0.0, \""CyclomaticComplexity\"": 9.0, \""MethodLinesOfCode\"": 31.0, \""MaxCallChain\"": 1.0}"", ""{\""IsAbstract\"": 0.0, \""ClassLinesOfCode\"": 331.0, \""OverrideRatio\"": null, \""PublicFieldCount\"": 0.0, \""TightClassCohesion\"": 0.14285714285714285}"", ""{\""IsAbstract\"": 0.0, \""ClassLinesOfCode\"": 331.0, \""OverrideRatio\"": null, \""PublicFieldCount\"": 0.0, \""TightClassCohesion\"": 0.14285714285714285}""]"
Researcher 1,apache_ant,20073,"[""Extract Method"", ""Extract Method"", ""Extract Method"", ""Extract Method"", ""Extract Method"", ""Extract Method"", ""Extract Method"", ""Extract Method"", ""Extract Method"", ""Extract Method""]","[""org.apache.tools.ant.types.ArchiveFileSet"", ""org.apache.tools.ant.types.ArchiveFileSet.setDirMode"", ""org.apache.tools.ant.types.ArchiveFileSet.checkArchiveAttributesAllowed"", ""org.apache.tools.ant.types.ArchiveFileSet.setFileMode"", ""org.apache.tools.ant.types.ArchiveFileSet.setFullpath"", ""org.apache.tools.ant.types.ArchiveFileSet.setPrefix"", ""org.apache.tools.ant.types.ArchiveFileSet.setSrcResource""]","[""19397fb959cb8afa2a87b3e68eaf23994384aab4"", ""19397fb959cb8afa2a87b3e68eaf23994384aab4"", ""19397fb959cb8afa2a87b3e68eaf23994384aab4"", ""19397fb959cb8afa2a87b3e68eaf23994384aab4"", ""19397fb959cb8afa2a87b3e68eaf23994384aab4"", ""19397fb959cb8afa2a87b3e68eaf23994384aab4""]","[""SpaghettiCode"", ""ComplexClass"", ""FeatureEnvy"", ""FeatureEnvy"", ""LongMethod"", ""FeatureEnvy""]","[""de1bf3821c9b0e18c73a4e3572622515"", ""ca4874f5988c54bf0909731795c24fab"", ""89e3bb37b006d9b5da5cc63c710e27e1"", ""fb0197250471c23656c6a2129d285f84"", ""0d602f4cc9670495ac121a2e189c846b"", ""4c9c38a1e9220ad41efe2064f35ed390""]","[60, 277, 822, 954, 954, 1135]","[959, 409, 840, 1016, 1016, 1161]","[""{\""IsAbstract\"": 0.0, \""ClassLinesOfCode\"": 331.0, \""OverrideRatio\"": null, \""PublicFieldCount\"": 0.0, \""TightClassCohesion\"": 0.14285714285714285}"", ""{\""IsAbstract\"": 0.0, \""ClassLinesOfCode\"": 331.0, \""OverrideRatio\"": null, \""PublicFieldCount\"": 0.0, \""TightClassCohesion\"": 0.14285714285714285}"", ""{\""LocalityRatio\"": 0.4, \""MaxCallChain\"": 1.0, \""ParameterCount\"": 2.0, \""CyclomaticComplexity\"": 3.0, \""MethodLinesOfCode\"": 8.0}"", ""{\""LocalityRatio\"": 0.45454545454545453, \""ParameterCount\"": 0.0, \""CyclomaticComplexity\"": 9.0, \""MethodLinesOfCode\"": 31.0, \""MaxCallChain\"": 1.0}"", ""{\""LocalityRatio\"": 0.45454545454545453, \""ParameterCount\"": 0.0, \""CyclomaticComplexity\"": 9.0, \""MethodLinesOfCode\"": 31.0, \""MaxCallChain\"": 1.0}"", ""{\""LocalityRatio\"": 0.45454545454545453, \""ParameterCount\"": 3.0, \""CyclomaticComplexity\"": 5.0, \""MethodLinesOfCode\"": 13.0, \""MaxCallChain\"": 1.0}""]","[""3095d02ef04fd87f7718d969f4c35e204f7111e4"", ""3095d02ef04fd87f7718d969f4c35e204f7111e4"", ""3095d02ef04fd87f7718d969f4c35e204f7111e4"", ""3095d02ef04fd87f7718d969f4c35e204f7111e4"", ""3095d02ef04fd87f7718d969f4c35e204f7111e4""]","[""FeatureEnvy"", ""FeatureEnvy"", ""FeatureEnvy"", ""RefusedBequest"", ""SpeculativeGenerality""]","[""818cea3bb674603e5dd19dbff5e71dfb"", ""d4ee25a91b733c67d8c66519e84c3686"", ""82d8adc1415b3968a24fba11ec42d79b"", ""8949facac350c41879403d2a2116a082"", ""c71064a3bb5218762c03e4e2f54590fb""]","[200, 479, 174, 27, 27]","[212, 495, 186, 420, 420]","[""{\""MaxCallChain\"": 1.0, \""MethodLinesOfCode\"": 5.0, \""ParameterCount\"": 1.0, \""CyclomaticComplexity\"": 2.0, \""LocalityRatio\"": 0.0}"", ""{\""MaxCallChain\"": 2.0, \""LocalityRatio\"": 0.0, \""ParameterCount\"": 0.0, \""CyclomaticComplexity\"": 2.0, \""MethodLinesOfCode\"": 3.0}"", ""{\""MaxCallChain\"": 1.0, \""MethodLinesOfCode\"": 5.0, \""ParameterCount\"": 1.0, \""CyclomaticComplexity\"": 2.0, \""LocalityRatio\"": 0.0}"", ""{\""IsAbstract\"": 1.0, \""ClassLinesOfCode\"": 136.0, \""OverrideRatio\"": 1.0, \""PublicFieldCount\"": 0.0, \""TightClassCohesion\"": 0.12307692307692308}"", ""{\""IsAbstract\"": 1.0, \""ClassLinesOfCode\"": 136.0, \""OverrideRatio\"": 1.0, \""PublicFieldCount\"": 0.0, \""TightClassCohesion\"": 0.12307692307692308}""]"
Researcher 1,apache_ant,20074,"[""Extract Method"", ""Extract Method"", ""Extract Method"", ""Extract Method"", ""Extract Method"", ""Extract Method"", ""Extract Method"", ""Extract Method""]","[""org.apache.tools.ant.types.TarFileSet"", ""org.apache.tools.ant.types.TarFileSet.setGroup"", ""org.apache.tools.ant.types.TarFileSet.checkTarFileSetAttributesAllowed"", ""org.apache.tools.ant.types.TarFileSet.setUid"", ""org.apache.tools.ant.types.TarFileSet.setUserName"", ""org.apache.tools.ant.types.TarFileSet.setGid""]","[""63294f1f7bc2274753642305e85b416555d3400a"", ""63294f1f7bc2274753642305e85b416555d3400a"", ""63294f1f7bc2274753642305e85b416555d3400a"", ""63294f1f7bc2274753642305e85b416555d3400a"", ""63294f1f7bc2274753642305e85b416555d3400a"", ""63294f1f7bc2274753642305e85b416555d3400a"", ""63294f1f7bc2274753642305e85b416555d3400a""]","[""FeatureEnvy"", ""FeatureEnvy"", ""FeatureEnvy"", ""FeatureEnvy"", ""SpeculativeGenerality"", ""RefusedBequest"", ""FeatureEnvy""]","[""818cea3bb674603e5dd19dbff5e71dfb"", ""1e0bffd73163bc3de72932be41b1a7e9"", ""486cb433b746d8d163c0ca6fac4d21aa"", ""82d8adc1415b3968a24fba11ec42d79b"", ""c71064a3bb5218762c03e4e2f54590fb"", ""8949facac350c41879403d2a2116a082"", ""ff2a3ec436312aa13fd66a3432536347""]","[200, 133, 349, 174, 27, 27, 306]","[212, 145, 359, 186, 420, 420, 316]","[""{\""MaxCallChain\"": 1.0, \""MethodLinesOfCode\"": 5.0, \""ParameterCount\"": 1.0, \""CyclomaticComplexity\"": 2.0, \""LocalityRatio\"": 0.0}"", ""{\""LocalityRatio\"": 0.0, \""MaxCallChain\"": 1.0, \""ParameterCount\"": 1.0, \""CyclomaticComplexity\"": 2.0, \""MethodLinesOfCode\"": 5.0}"", ""{\""MaxCallChain\"": 1.0, \""LocalityRatio\"": 0.0, \""ParameterCount\"": 1.0, \""CyclomaticComplexity\"": 1.0, \""MethodLinesOfCode\"": 3.0}"", ""{\""MaxCallChain\"": 1.0, \""MethodLinesOfCode\"": 5.0, \""ParameterCount\"": 1.0, \""CyclomaticComplexity\"": 2.0, \""LocalityRatio\"": 0.0}"", ""{\""IsAbstract\"": 1.0, \""ClassLinesOfCode\"": 136.0, \""OverrideRatio\"": 1.0, \""PublicFieldCount\"": 0.0, \""TightClassCohesion\"": 0.12307692307692308}"", ""{\""IsAbstract\"": 1.0, \""ClassLinesOfCode\"": 136.0, \""OverrideRatio\"": 1.0, \""PublicFieldCount\"": 0.0, \""TightClassCohesion\"": 0.12307692307692308}"", ""{\""MaxCallChain\"": 1.0, \""LocalityRatio\"": 0.0, \""ParameterCount\"": 1.0, \""CyclomaticComplexity\"": 1.0, \""MethodLinesOfCode\"": 3.0}""]","[""3095d02ef04fd87f7718d969f4c35e204f7111e4""]","[""FeatureEnvy""]","[""dda9a2b8d5201ffb9ebf871d1e1e955b""]",[252],[266],"[""{\""MaxCallChain\"": 2.0, \""LocalityRatio\"": 0.0, \""ParameterCount\"": 0.0, \""CyclomaticComplexity\"": 2.0, \""MethodLinesOfCode\"": 3.0}""]"
Researcher 1,apache_ant,20084,"[""Inline Method"", ""Inline Method"", ""Extract Method"", ""Extract Method"", ""Extract Method"", ""Extract Method"", ""Inline Method"", ""Inline Method"", ""Inline Method"", ""Inline Method"", ""Inline Method"", ""Inline Method"", ""Extract Method"", ""Extract Method"", ""Inline Method"", ""Inline Method"", ""Inline Method"", ""Inline Method"", ""Inline Method"", ""Inline Method"", ""Inline Method"", ""Inline Method"", ""Extract Method"", ""Extract Method"", ""Inline Method"", ""Inline Method""]","[""org.apache.tools.bzip2.CBZip2OutputStream.sendMTFValues7"", ""org.apache.tools.bzip2.CBZip2OutputStream"", ""org.apache.tools.bzip2.CBZip2OutputStream.sendMTFValues"", ""org.apache.tools.bzip2.CBZip2OutputStream.hbMakeCodeLengths"", ""org.apache.tools.bzip2.CBZip2OutputStream.fullGtU"", ""org.apache.tools.bzip2.CBZip2OutputStream.simpleSort"", ""org.apache.tools.bzip2.CBZip2OutputStream.sendMTFValues6"", ""org.apache.tools.bzip2.CBZip2OutputStream.sendMTFValues1"", ""org.apache.tools.bzip2.CBZip2OutputStream.sendMTFValues3"", ""org.apache.tools.bzip2.CBZip2OutputStream.generateMTFValues"", ""org.apache.tools.bzip2.CBZip2OutputStream.makeMaps"", ""org.apache.tools.bzip2.CBZip2OutputStream.sendMTFValues0"", ""org.apache.tools.bzip2.CBZip2OutputStream.sendMTFValues4"", ""org.apache.tools.bzip2.CBZip2OutputStream.sendMTFValues5"", ""org.apache.tools.bzip2.CBZip2OutputStream.write0"", ""org.apache.tools.bzip2.CBZip2OutputStream.write"", ""org.apache.tools.bzip2.CBZip2OutputStream.vswap"", ""org.apache.tools.bzip2.CBZip2OutputStream.sendMTFValues2""]","[""63294f1f7bc2274753642305e85b416555d3400a"", ""63294f1f7bc2274753642305e85b416555d3400a"", ""63294f1f7bc2274753642305e85b416555d3400a"", ""63294f1f7bc2274753642305e85b416555d3400a""]","[""FeatureEnvy"", ""FeatureEnvy"", ""FeatureEnvy"", ""FeatureEnvy""]","[""244dbca07913d5a714dee050fe0ddb14"", ""8eb5906797a0fa0f691bdb771df5c510"", ""7c9e89019887c2c646aab828498ada33"", ""42cca1d881ba332ee7acac8f7c9e7b7a""]","[149, 93, 65, 121]","[158, 102, 74, 130]","[""{\""MaxCallChain\"": 1.0, \""MethodLinesOfCode\"": 4.0, \""ParameterCount\"": 1.0, \""CyclomaticComplexity\"": 1.0, \""LocalityRatio\"": 0.0}"", ""{\""MaxCallChain\"": 1.0, \""MethodLinesOfCode\"": 4.0, \""ParameterCount\"": 1.0, \""CyclomaticComplexity\"": 1.0, \""LocalityRatio\"": 0.0}"", ""{\""MaxCallChain\"": 1.0, \""MethodLinesOfCode\"": 4.0, \""ParameterCount\"": 1.0, \""CyclomaticComplexity\"": 1.0, \""LocalityRatio\"": 0.0}"", ""{\""MaxCallChain\"": 1.0, \""MethodLinesOfCode\"": 4.0, \""ParameterCount\"": 1.0, \""CyclomaticComplexity\"": 1.0, \""LocalityRatio\"": 0.0}""]","[""ad9edf5f5ea4a8f2a974726eeb8e656c177357df"", ""ad9edf5f5ea4a8f2a974726eeb8e656c177357df"", ""ad9edf5f5ea4a8f2a974726eeb8e656c177357df"", ""ad9edf5f5ea4a8f2a974726eeb8e656c177357df"", ""ad9edf5f5ea4a8f2a974726eeb8e656c177357df"", ""ad9edf5f5ea4a8f2a974726eeb8e656c177357df"", ""ad9edf5f5ea4a8f2a974726eeb8e656c177357df"", ""ad9edf5f5ea4a8f2a974726eeb8e656c177357df"", ""ad9edf5f5ea4a8f2a974726eeb8e656c177357df""]","[""LongParameterList"", ""LongMethod"", ""LongMethod"", ""LongMethod"", ""LongMethod"", ""LongMethod"", ""ComplexClass"", ""GodClass"", ""SpaghettiCode""]","[""97dfd74eacf73ec739fc779616c6c01b"", ""7383cb87bd0e24b8a9cd6b7556ae472e"", ""19b1844ac6e9bfb5d0c2452d0189cc62"", ""9e91d50b8768ee5eda632f3be51c4313"", ""0b37f7ede41d4196bd17d905385c0555"", ""decb97f54ef1a54035cdca8498f71ffd"", ""920c4699127973744962b413f67c6f68"", ""ec700876c69075690f78887b760efe31"", ""42700f9613ede2fd69aff7f323e6cbb7""]","[368, 368, 1369, 562, 884, 1532, 70, 29, 29]","[517, 517, 1491, 874, 957, 1628, 215, 1629, 1629]","[""{\""MaxCallChain\"": 0.0, \""LocalityRatio\"": null, \""ParameterCount\"": 5.0, \""CyclomaticComplexity\"": 20.0, \""MethodLinesOfCode\"": 88.0}"", ""{\""MaxCallChain\"": 0.0, \""LocalityRatio\"": null, \""ParameterCount\"": 5.0, \""CyclomaticComplexity\"": 20.0, \""MethodLinesOfCode\"": 88.0}"", ""{\""MethodLinesOfCode\"": 91.0, \""MaxCallChain\"": 0.0, \""ParameterCount\"": 2.0, \""CyclomaticComplexity\"": 18.0, \""LocalityRatio\"": null}"", ""{\""MethodLinesOfCode\"": 184.0, \""LocalityRatio\"": 1.0, \""ParameterCount\"": 0.0, \""CyclomaticComplexity\"": 60.0, \""MaxCallChain\"": 1.0}"", ""{\""MethodLinesOfCode\"": 49.0, \""MaxCallChain\"": 1.0, \""ParameterCount\"": 3.0, \""CyclomaticComplexity\"": 15.0, \""LocalityRatio\"": 1.0}"", ""{\""MethodLinesOfCode\"": 71.0, \""LocalityRatio\"": 1.0, \""ParameterCount\"": 0.0, \""CyclomaticComplexity\"": 16.0, \""MaxCallChain\"": 1.0}"", ""{\""IsAbstract\"": 0.0, \""ClassLinesOfCode\"": 966.0, \""OverrideRatio\"": 0.5, \""PublicFieldCount\"": 0.0, \""TightClassCohesion\"": 0.2}"", ""{\""IsAbstract\"": 0.0, \""ClassLinesOfCode\"": 966.0, \""OverrideRatio\"": 0.5, \""PublicFieldCount\"": 0.0, \""TightClassCohesion\"": 0.2}"", ""{\""IsAbstract\"": 0.0, \""ClassLinesOfCode\"": 966.0, \""OverrideRatio\"": 0.5, \""PublicFieldCount\"": 0.0, \""TightClassCohesion\"": 0.2}""]"
Researcher 1,apache_ant,20094,"[""Extract Method"", ""Extract Method"", ""Move Method"", ""Move Method"", ""Extract Interface"", ""Extract Interface"", ""Extract Method"", ""Extract Method""]","[""org.apache.tools.ant.PropertyHelper"", ""org.apache.tools.ant.PropertyHelper.parseProperties"", ""org.apache.tools.ant.PropertyHelper.getExpanders"", ""org.apache.tools.ant.types.PatternSet"", ""org.apache.tools.ant.property.GetProperty"", ""org.apache.tools.ant.PropertyHelper.containsProperties""]","[""380870c2b26a9f3289569dc2451178df3f05613e"", ""380870c2b26a9f3289569dc2451178df3f05613e"", ""380870c2b26a9f3289569dc2451178df3f05613e"", ""380870c2b26a9f3289569dc2451178df3f05613e"", ""380870c2b26a9f3289569dc2451178df3f05613e"", ""380870c2b26a9f3289569dc2451178df3f05613e"", ""380870c2b26a9f3289569dc2451178df3f05613e"", ""380870c2b26a9f3289569dc2451178df3f05613e"", ""380870c2b26a9f3289569dc2451178df3f05613e"", ""380870c2b26a9f3289569dc2451178df3f05613e"", ""380870c2b26a9f3289569dc2451178df3f05613e""]","[""LongMethod"", ""LongParameterList"", ""FeatureEnvy"", ""LongMethod"", ""LongMethod"", ""LongMethod"", ""FeatureEnvy"", ""GodClass"", ""ComplexClass"", ""RefusedBequest"", ""SpaghettiCode""]","[""7383cb87bd0e24b8a9cd6b7556ae472e"", ""97dfd74eacf73ec739fc779616c6c01b"", ""23f368bf8781d3a874b2b77e09c6e65a"", ""d4b98b83d7d671013d518b262a6aa949"", ""804a2af0cb7b4df49399d8e8e1d6d367"", ""decb97f54ef1a54035cdca8498f71ffd"", ""d71528af55d65e6407433fe3b32ca97b"", ""ec700876c69075690f78887b760efe31"", ""920c4699127973744962b413f67c6f68"", ""603f393a4256bd7ee0a5e67d79b355b8"", ""42700f9613ede2fd69aff7f323e6cbb7""]","[368, 368, 1277, 1277, 1026, 1532, 1341, 29, 70, 29, 29]","[517, 517, 1339, 1339, 1142, 1628, 1386, 1629, 215, 2108, 1629]","[""{\""MaxCallChain\"": 0.0, \""LocalityRatio\"": null, \""ParameterCount\"": 5.0, \""CyclomaticComplexity\"": 20.0, \""MethodLinesOfCode\"": 88.0}"", ""{\""MaxCallChain\"": 0.0, \""LocalityRatio\"": null, \""ParameterCount\"": 5.0, \""CyclomaticComplexity\"": 20.0, \""MethodLinesOfCode\"": 88.0}"", ""{\""MaxCallChain\"": 1.0, \""LocalityRatio\"": 0.0, \""ParameterCount\"": 2.0, \""CyclomaticComplexity\"": 9.0, \""MethodLinesOfCode\"": 39.0}"", ""{\""MaxCallChain\"": 1.0, \""LocalityRatio\"": 0.0, \""ParameterCount\"": 2.0, \""CyclomaticComplexity\"": 9.0, \""MethodLinesOfCode\"": 39.0}"", ""{\""MaxCallChain\"": 1.0, \""LocalityRatio\"": 0.5, \""ParameterCount\"": 2.0, \""CyclomaticComplexity\"": 14.0, \""MethodLinesOfCode\"": 68.0}"", ""{\""MethodLinesOfCode\"": 71.0, \""LocalityRatio\"": 1.0, \""ParameterCount\"": 0.0, \""CyclomaticComplexity\"": 16.0, \""MaxCallChain\"": 1.0}"", ""{\""MaxCallChain\"": 1.0, \""LocalityRatio\"": 0.0, \""ParameterCount\"": 1.0, \""CyclomaticComplexity\"": 4.0, \""MethodLinesOfCode\"": 30.0}"", ""{\""IsAbstract\"": 0.0, \""ClassLinesOfCode\"": 966.0, \""OverrideRatio\"": 0.5, \""PublicFieldCount\"": 0.0, \""TightClassCohesion\"": 0.2}"", ""{\""IsAbstract\"": 0.0, \""ClassLinesOfCode\"": 966.0, \""OverrideRatio\"": 0.5, \""PublicFieldCount\"": 0.0, \""TightClassCohesion\"": 0.2}"", ""{\""IsAbstract\"": 0.0, \""ClassLinesOfCode\"": 1043.0, \""OverrideRatio\"": 0.6666666666666666, \""PublicFieldCount\"": 0.0, \""TightClassCohesion\"": 0.42857142857142855}"", ""{\""IsAbstract\"": 0.0, \""ClassLinesOfCode\"": 966.0, \""OverrideRatio\"": 0.5, \""PublicFieldCount\"": 0.0, \""TightClassCohesion\"": 0.2}""]","[""902b72ec83e985a35e2e9fc26e41e2319cc7ea1e""]","[""LazyClass""]","[""7c3e569c52739f089ae03630e8ff85c7""]",[20],[28],"[""{\""IsAbstract\"": 0.0, \""ClassLinesOfCode\"": 2.0, \""OverrideRatio\"": null, \""TightClassCohesion\"": 1.0, \""PublicFieldCount\"": 0.0}""]"
Researcher 1,apache_ant,20101,"[""Extract Method"", ""Extract Method"", ""Extract Method"", ""Extract Method"", ""Extract Method"", ""Extract Method"", ""Extract Method"", ""Extract Method"", ""Extract Method"", ""Extract Method"", ""Extract Method"", ""Extract Method"", ""Extract Method"", ""Extract Method"", ""Extract Method"", ""Extract Method""]","[""org.apache.tools.ant.DirectoryScanner"", ""org.apache.tools.ant.DirectoryScanner.couldHoldIncluded"", ""org.apache.tools.ant.DirectoryScanner.matchPath"", ""org.apache.tools.ant.DirectoryScanner.isIncluded"", ""org.apache.tools.ant.DirectoryScanner.causesIllegalSymlinkLoop"", ""org.apache.tools.ant.DirectoryScanner.isMorePowerfulThanExcludes"", ""org.apache.tools.ant.DirectoryScanner.isExcluded"", ""org.apache.tools.ant.DirectoryScanner.shouldSkipPattern""]","[""380870c2b26a9f3289569dc2451178df3f05613e"", ""380870c2b26a9f3289569dc2451178df3f05613e"", ""380870c2b26a9f3289569dc2451178df3f05613e"", ""380870c2b26a9f3289569dc2451178df3f05613e"", ""380870c2b26a9f3289569dc2451178df3f05613e"", ""380870c2b26a9f3289569dc2451178df3f05613e"", ""380870c2b26a9f3289569dc2451178df3f05613e"", ""380870c2b26a9f3289569dc2451178df3f05613e"", ""380870c2b26a9f3289569dc2451178df3f05613e"", ""380870c2b26a9f3289569dc2451178df3f05613e"", ""380870c2b26a9f3289569dc2451178df3f05613e""]","[""LongMethod"", ""LongParameterList"", ""FeatureEnvy"", ""LongMethod"", ""LongMethod"", ""LongMethod"", ""FeatureEnvy"", ""GodClass"", ""ComplexClass"", ""RefusedBequest"", ""SpaghettiCode""]","[""7383cb87bd0e24b8a9cd6b7556ae472e"", ""97dfd74eacf73ec739fc779616c6c01b"", ""23f368bf8781d3a874b2b77e09c6e65a"", ""d4b98b83d7d671013d518b262a6aa949"", ""804a2af0cb7b4df49399d8e8e1d6d367"", ""decb97f54ef1a54035cdca8498f71ffd"", ""d71528af55d65e6407433fe3b32ca97b"", ""ec700876c69075690f78887b760efe31"", ""920c4699127973744962b413f67c6f68"", ""603f393a4256bd7ee0a5e67d79b355b8"", ""42700f9613ede2fd69aff7f323e6cbb7""]","[368, 368, 1277, 1277, 1026, 1532, 1341, 29, 70, 29, 29]","[517, 517, 1339, 1339, 1142, 1628, 1386, 1629, 215, 2108, 1629]","[""{\""MaxCallChain\"": 0.0, \""LocalityRatio\"": null, \""ParameterCount\"": 5.0, \""CyclomaticComplexity\"": 20.0, \""MethodLinesOfCode\"": 88.0}"", ""{\""MaxCallChain\"": 0.0, \""LocalityRatio\"": null, \""ParameterCount\"": 5.0, \""CyclomaticComplexity\"": 20.0, \""MethodLinesOfCode\"": 88.0}"", ""{\""MaxCallChain\"": 1.0, \""LocalityRatio\"": 0.0, \""ParameterCount\"": 2.0, \""CyclomaticComplexity\"": 9.0, \""MethodLinesOfCode\"": 39.0}"", ""{\""MaxCallChain\"": 1.0, \""LocalityRatio\"": 0.0, \""ParameterCount\"": 2.0, \""CyclomaticComplexity\"": 9.0, \""MethodLinesOfCode\"": 39.0}"", ""{\""MaxCallChain\"": 1.0, \""LocalityRatio\"": 0.5, \""ParameterCount\"": 2.0, \""CyclomaticComplexity\"": 14.0, \""MethodLinesOfCode\"": 68.0}"", ""{\""MethodLinesOfCode\"": 71.0, \""LocalityRatio\"": 1.0, \""ParameterCount\"": 0.0, \""CyclomaticComplexity\"": 16.0, \""MaxCallChain\"": 1.0}"", ""{\""MaxCallChain\"": 1.0, \""LocalityRatio\"": 0.0, \""ParameterCount\"": 1.0, \""CyclomaticComplexity\"": 4.0, \""MethodLinesOfCode\"": 30.0}"", ""{\""IsAbstract\"": 0.0, \""ClassLinesOfCode\"": 966.0, \""OverrideRatio\"": 0.5, \""PublicFieldCount\"": 0.0, \""TightClassCohesion\"": 0.2}"", ""{\""IsAbstract\"": 0.0, \""ClassLinesOfCode\"": 966.0, \""OverrideRatio\"": 0.5, \""PublicFieldCount\"": 0.0, \""TightClassCohesion\"": 0.2}"", ""{\""IsAbstract\"": 0.0, \""ClassLinesOfCode\"": 1043.0, \""OverrideRatio\"": 0.6666666666666666, \""PublicFieldCount\"": 0.0, \""TightClassCohesion\"": 0.42857142857142855}"", ""{\""IsAbstract\"": 0.0, \""ClassLinesOfCode\"": 966.0, \""OverrideRatio\"": 0.5, \""PublicFieldCount\"": 0.0, \""TightClassCohesion\"": 0.2}""]","[""8b58203e3120ecbeb7c53ce127fb41316f7eea92"", ""8b58203e3120ecbeb7c53ce127fb41316f7eea92"", ""8b58203e3120ecbeb7c53ce127fb41316f7eea92"", ""8b58203e3120ecbeb7c53ce127fb41316f7eea92"", ""8b58203e3120ecbeb7c53ce127fb41316f7eea92""]","[""FeatureEnvy"", ""FeatureEnvy"", ""SpaghettiCode"", ""ComplexClass"", ""GodClass""]","[""abee259ac69326809cada2438a28d206"", ""7109c9deb536e5c1d35e7e7c4e9f86c0"", ""de1bf3821c9b0e18c73a4e3572622515"", ""ca4874f5988c54bf0909731795c24fab"", ""d141913ce4ea5148e28db8a3e47315dd""]","[1014, 281, 60, 277, 45]","[1034, 413, 959, 409, 1901]","[""{\""LocalityRatio\"": 0.25, \""MethodLinesOfCode\"": 7.0, \""ParameterCount\"": 1.0, \""CyclomaticComplexity\"": 4.0, \""MaxCallChain\"": 2.0}"", ""{\""LocalityRatio\"": 0.10344827586206896, \""MaxCallChain\"": 2.0, \""ParameterCount\"": 2.0, \""CyclomaticComplexity\"": 27.0, \""MethodLinesOfCode\"": 72.0}"", ""{\""IsAbstract\"": 0.0, \""ClassLinesOfCode\"": 331.0, \""OverrideRatio\"": null, \""PublicFieldCount\"": 0.0, \""TightClassCohesion\"": 0.14285714285714285}"", ""{\""IsAbstract\"": 0.0, \""ClassLinesOfCode\"": 331.0, \""OverrideRatio\"": null, \""PublicFieldCount\"": 0.0, \""TightClassCohesion\"": 0.14285714285714285}"", ""{\""IsAbstract\"": 0.0, \""ClassLinesOfCode\"": 553.0, \""OverrideRatio\"": null, \""PublicFieldCount\"": 0.0, \""TightClassCohesion\"": 0.06628787878787878}""]"
Researcher 1,apache_ant,20122,"[""Extract Method"", ""Extract Method"", ""Extract Method"", ""Extract Method"", ""Extract Method"", ""Extract Method"", ""Extract Method"", ""Extract Method"", ""Extract Method"", ""Extract Method""]","[""org.apache.tools.ant.taskdefs.compilers.DefaultCompilerAdapter"", ""org.apache.tools.ant.taskdefs.compilers.DefaultCompilerAdapter.assumeJava15"", ""org.apache.tools.ant.taskdefs.compilers.DefaultCompilerAdapter.assumeJavaXY"", ""org.apache.tools.ant.taskdefs.compilers.DefaultCompilerAdapter.assumeJava16"", ""org.apache.tools.ant.taskdefs.compilers.DefaultCompilerAdapter.assumeJava18"", ""org.apache.tools.ant.taskdefs.compilers.DefaultCompilerAdapter.assumeJava14"", ""org.apache.tools.ant.taskdefs.compilers.DefaultCompilerAdapter.assumeJava17""]","[""f9de93c35b4a4327c0cf29afd25ecf9c486f7647"", ""f9de93c35b4a4327c0cf29afd25ecf9c486f7647""]","[""FeatureEnvy"", ""FeatureEnvy""]","[""a976778684e2bcb2fd83b0321e2d0e9c"", ""1ca7b6867fe21d960bca51770743b007""]","[470, 513]","[511, 529]","[""{\""ParameterCount\"": 1.0, \""MaxCallChain\"": 3.0, \""LocalityRatio\"": 0.09523809523809523, \""CyclomaticComplexity\"": 6.0, \""MethodLinesOfCode\"": 19.0}"", ""{\""ParameterCount\"": 1.0, \""MaxCallChain\"": 1.0, \""LocalityRatio\"": 0.2, \""CyclomaticComplexity\"": 4.0, \""MethodLinesOfCode\"": 8.0}""]","[""df7e0ca089cfb7acae1c006307eb3842e5637cf6"", ""df7e0ca089cfb7acae1c006307eb3842e5637cf6"", ""df7e0ca089cfb7acae1c006307eb3842e5637cf6""]","[""FeatureEnvy"", ""ComplexClass"", ""SpaghettiCode""]","[""c6aefaa0b5997737c66d86e605dcb507"", ""bd48fc65fd272f3036c59c83a07ad945"", ""3c447cd410a545e0a192e3a3ed1b62fa""]","[630, 202, 64]","[642, 286, 403]","[""{\""MethodLinesOfCode\"": 2.0, \""MaxCallChain\"": 2.0, \""ParameterCount\"": 2.0, \""CyclomaticComplexity\"": 1.0, \""LocalityRatio\"": 0.0}"", ""{\""IsAbstract\"": 1.0, \""ClassLinesOfCode\"": 173.0, \""OverrideRatio\"": null, \""PublicFieldCount\"": 0.0, \""TightClassCohesion\"": 1.0}"", ""{\""IsAbstract\"": 1.0, \""ClassLinesOfCode\"": 173.0, \""OverrideRatio\"": null, \""PublicFieldCount\"": 0.0, \""TightClassCohesion\"": 1.0}""]"
Researcher 1,apache_ant,20139,"[""Extract Method"", ""Extract Method"", ""Extract Method"", ""Extract Method"", ""Extract Method"", ""Extract Method"", ""Extract Method"", ""Extract Method"", ""Extract Method"", ""Extract Method"", ""Extract Method"", ""Extract Method"", ""Extract Method"", ""Extract Method""]","[""org.apache.tools.zip.ZipOutputStream"", ""org.apache.tools.zip.ZipOutputStream.handleSizesAndCrc"", ""org.apache.tools.zip.ZipOutputStream.checkIfNeedsZip64"", ""org.apache.tools.zip.ZipOutputStream.writeLocalFileHeader"", ""org.apache.tools.zip.ZipOutputStream.createLocalFileHeader"", ""org.apache.tools.zip.ZipOutputStream.writeVersionNeededToExtractAndGeneralPurposeBits"", ""org.apache.tools.zip.ZipOutputStream.isDeflatedToOutputStream"", ""org.apache.tools.zip.ZipOutputStream.closeEntry"", ""org.apache.tools.zip.ZipOutputStream.preClose"", ""org.apache.tools.zip.ZipOutputStream.writeCentralFileHeader"", ""org.apache.tools.zip.ZipOutputStream.createCentralFileHeader"", ""org.apache.tools.zip.ZipOutputStream.write"", ""org.apache.tools.zip.ZipOutputStream.writeCounted""]","[""f9de93c35b4a4327c0cf29afd25ecf9c486f7647"", ""f9de93c35b4a4327c0cf29afd25ecf9c486f7647""]","[""FeatureEnvy"", ""FeatureEnvy""]","[""a976778684e2bcb2fd83b0321e2d0e9c"", ""1ca7b6867fe21d960bca51770743b007""]","[470, 513]","[511, 529]","[""{\""ParameterCount\"": 1.0, \""MaxCallChain\"": 3.0, \""LocalityRatio\"": 0.09523809523809523, \""CyclomaticComplexity\"": 6.0, \""MethodLinesOfCode\"": 19.0}"", ""{\""ParameterCount\"": 1.0, \""MaxCallChain\"": 1.0, \""LocalityRatio\"": 0.2, \""CyclomaticComplexity\"": 4.0, \""MethodLinesOfCode\"": 8.0}""]","[""2c04d7e833b4e5dab1a3c5ddfe14b572aea8c112"", ""2c04d7e833b4e5dab1a3c5ddfe14b572aea8c112"", ""2c04d7e833b4e5dab1a3c5ddfe14b572aea8c112"", ""2c04d7e833b4e5dab1a3c5ddfe14b572aea8c112"", ""2c04d7e833b4e5dab1a3c5ddfe14b572aea8c112"", ""2c04d7e833b4e5dab1a3c5ddfe14b572aea8c112"", ""2c04d7e833b4e5dab1a3c5ddfe14b572aea8c112"", ""2c04d7e833b4e5dab1a3c5ddfe14b572aea8c112""]","[""FeatureEnvy"", ""FeatureEnvy"", ""LongParameterList"", ""LongMethod"", ""FeatureEnvy"", ""GodClass"", ""RefusedBequest"", ""FeatureEnvy""]","[""6d9ee3485eec01e64ea10b56769b8f62"", ""007410d2d2beaa35d20e24821d9a3c06"", ""4975edc973e3bb38dd949b76389fbf65"", ""874b9d9f6934a3754751b5cb08dd1f1e"", ""4a639aca45921dffb7da09063abff4ee"", ""f0995a4475beb0ca3613949ec5088fb2"", ""9a16e86dd2361a43afd7b8f4348b0711"", ""8f2f794a2126bae56f5f52c4a381547f""]","[1031, 1181, 1181, 1181, 524, 50, 35, 474]","[1088, 1266, 1266, 1266, 573, 1674, 835, 496]","[""{\""ParameterCount\"": 3.0, \""MaxCallChain\"": 3.0, \""LocalityRatio\"": 0.12903225806451613, \""CyclomaticComplexity\"": 4.0, \""MethodLinesOfCode\"": 28.0}"", ""{\""ParameterCount\"": 4.0, \""MaxCallChain\"": 2.0, \""LocalityRatio\"": 0.0625, \""CyclomaticComplexity\"": 3.0, \""MethodLinesOfCode\"": 37.0}"", ""{\""ParameterCount\"": 4.0, \""MaxCallChain\"": 2.0, \""LocalityRatio\"": 0.0625, \""CyclomaticComplexity\"": 3.0, \""MethodLinesOfCode\"": 37.0}"", ""{\""ParameterCount\"": 4.0, \""MaxCallChain\"": 2.0, \""LocalityRatio\"": 0.0625, \""CyclomaticComplexity\"": 3.0, \""MethodLinesOfCode\"": 37.0}"", ""{\""MethodLinesOfCode\"": 18.0, \""LocalityRatio\"": 0.0, \""ParameterCount\"": 3.0, \""CyclomaticComplexity\"": 6.0, \""MaxCallChain\"": 2.0}"", ""{\""IsAbstract\"": 0.0, \""ClassLinesOfCode\"": 532.0, \""OverrideRatio\"": 0.6666666666666666, \""PublicFieldCount\"": 0.0, \""TightClassCohesion\"": 0.08771929824561403}"", ""{\""IsAbstract\"": 0.0, \""ClassLinesOfCode\"": 266.0, \""OverrideRatio\"": 0.8333333333333334, \""TightClassCohesion\"": 0.17142857142857143, \""PublicFieldCount\"": 0.0}"", ""{\""LocalityRatio\"": 0.2857142857142857, \""MethodLinesOfCode\"": 10.0, \""ParameterCount\"": 3.0, \""CyclomaticComplexity\"": 5.0, \""MaxCallChain\"": 1.0}""]"
Researcher 1,apache_ant,20143,"[""Extract Method"", ""Extract Method"", ""Move Attribute"", ""Move Attribute"", ""Move Attribute"", ""Move Attribute"", ""Move Attribute"", ""Move Attribute"", ""Move Attribute"", ""Move Attribute""]","[""org.apache.tools.ant.Project.copyFile"", ""org.apache.tools.ant.Project"", ""org.apache.tools.ant.taskdefs.Copydir"", ""org.apache.tools.ant.taskdefs.Javac"", ""org.apache.tools.ant.taskdefs.Rmic"", ""org.apache.tools.ant.taskdefs.Copyfile""]","[""f9de93c35b4a4327c0cf29afd25ecf9c486f7647"", ""f9de93c35b4a4327c0cf29afd25ecf9c486f7647""]","[""FeatureEnvy"", ""FeatureEnvy""]","[""a976778684e2bcb2fd83b0321e2d0e9c"", ""1ca7b6867fe21d960bca51770743b007""]","[470, 513]","[511, 529]","[""{\""ParameterCount\"": 1.0, \""MaxCallChain\"": 3.0, \""LocalityRatio\"": 0.09523809523809523, \""CyclomaticComplexity\"": 6.0, \""MethodLinesOfCode\"": 19.0}"", ""{\""ParameterCount\"": 1.0, \""MaxCallChain\"": 1.0, \""LocalityRatio\"": 0.2, \""CyclomaticComplexity\"": 4.0, \""MethodLinesOfCode\"": 8.0}""]","[""764d1e985b968dda43e19fd1db74f47d564f1f81"", ""764d1e985b968dda43e19fd1db74f47d564f1f81"", ""764d1e985b968dda43e19fd1db74f47d564f1f81"", ""764d1e985b968dda43e19fd1db74f47d564f1f81""]","[""LazyClass"", ""ComplexClass"", ""FeatureEnvy"", ""SpaghettiCode""]","[""bb7bed9812db2f99d5bf76ffdc199872"", ""42c92728a089050e8b5c72bc18321250"", ""5b9cd2563773a037ca3cdf9e683e5af7"", ""e47d3a6acffc89588f039ee1d36906c2""]","[62, 109, 519, 62]","[92, 168, 575, 537]","[""{\""IsAbstract\"": 0.0, \""ClassLinesOfCode\"": 14.0, \""OverrideRatio\"": 0.4, \""PublicFieldCount\"": 2.0, \""TightClassCohesion\"": 0.6666666666666666}"", ""{\""IsAbstract\"": 0.0, \""ClassLinesOfCode\"": 83.0, \""OverrideRatio\"": 0.3333333333333333, \""PublicFieldCount\"": 0.0, \""TightClassCohesion\"": 0.26666666666666666}"", ""{\""MethodLinesOfCode\"": 30.0, \""LocalityRatio\"": 0.09523809523809523, \""ParameterCount\"": 2.0, \""CyclomaticComplexity\"": 7.0, \""MaxCallChain\"": 1.0}"", ""{\""IsAbstract\"": 0.0, \""ClassLinesOfCode\"": 154.0, \""OverrideRatio\"": 0.14285714285714285, \""PublicFieldCount\"": 0.0, \""TightClassCohesion\"": 0.044444444444444446}""]"
Researcher 1,apache_ant,20146,"[""Extract Method"", ""Extract Method"", ""Extract Method"", ""Extract Method""]","[""org.apache.tools.ant.taskdefs.MatchingTask.createInclude"", ""org.apache.tools.ant.taskdefs.MatchingTask"", ""org.apache.tools.ant.taskdefs.MatchingTask.addPatternToList"", ""org.apache.tools.ant.taskdefs.MatchingTask.createExclude""]","[""2b925503d71972d8b782eedd6cdf75711377d7b0"", ""2b925503d71972d8b782eedd6cdf75711377d7b0"", ""2b925503d71972d8b782eedd6cdf75711377d7b0"", ""2b925503d71972d8b782eedd6cdf75711377d7b0"", ""2b925503d71972d8b782eedd6cdf75711377d7b0"", ""2b925503d71972d8b782eedd6cdf75711377d7b0""]","[""FeatureEnvy"", ""FeatureEnvy"", ""FeatureEnvy"", ""SpaghettiCode"", ""ComplexClass"", ""GodClass""]","[""7109c9deb536e5c1d35e7e7c4e9f86c0"", ""9d57af4cf7b2a6f7fd9b714aede0c0d0"", ""5111cf1d0ccdd53694a1974410cb7444"", ""de1bf3821c9b0e18c73a4e3572622515"", ""ca4874f5988c54bf0909731795c24fab"", ""d141913ce4ea5148e28db8a3e47315dd""]","[281, 1384, 1278, 60, 277, 45]","[413, 1406, 1300, 959, 409, 1901]","[""{\""LocalityRatio\"": 0.10344827586206896, \""MaxCallChain\"": 2.0, \""ParameterCount\"": 2.0, \""CyclomaticComplexity\"": 27.0, \""MethodLinesOfCode\"": 72.0}"", ""{\""MaxCallChain\"": 2.0, \""MethodLinesOfCode\"": 8.0, \""ParameterCount\"": 1.0, \""CyclomaticComplexity\"": 4.0, \""LocalityRatio\"": 0.42857142857142855}"", ""{\""MaxCallChain\"": 2.0, \""MethodLinesOfCode\"": 8.0, \""ParameterCount\"": 1.0, \""CyclomaticComplexity\"": 4.0, \""LocalityRatio\"": 0.42857142857142855}"", ""{\""IsAbstract\"": 0.0, \""ClassLinesOfCode\"": 331.0, \""OverrideRatio\"": null, \""PublicFieldCount\"": 0.0, \""TightClassCohesion\"": 0.14285714285714285}"", ""{\""IsAbstract\"": 0.0, \""ClassLinesOfCode\"": 331.0, \""OverrideRatio\"": null, \""PublicFieldCount\"": 0.0, \""TightClassCohesion\"": 0.14285714285714285}"", ""{\""IsAbstract\"": 0.0, \""ClassLinesOfCode\"": 553.0, \""OverrideRatio\"": null, \""PublicFieldCount\"": 0.0, \""TightClassCohesion\"": 0.06628787878787878}""]","[""3dd76dec2e98f14defbecd0e4af5398c39a4991e""]","[""FeatureEnvy""]","[""44bc0e47a1d426768443935e8aaf718f""]",[239],[246],"[""{\""MaxCallChain\"": 1.0, \""ParameterCount\"": 1.0, \""CyclomaticComplexity\"": 1.0, \""MethodLinesOfCode\"": 4.0, \""LocalityRatio\"": 0.0}""]"
Researcher 1,apache_ant,20153,"[""Extract Method"", ""Extract Method"", ""Extract Method"", ""Extract Method"", ""Extract Method"", ""Extract Method""]","[""org.apache.tools.ant.taskdefs.Javac.doClassicCompile"", ""org.apache.tools.ant.taskdefs.Javac"", ""org.apache.tools.ant.taskdefs.Javac.setupJavacCommand"", ""org.apache.tools.ant.taskdefs.Javac.doModernCompile"", ""org.apache.tools.ant.taskdefs.Javac.doJikesCompile"", ""org.apache.tools.ant.taskdefs.Javac.logAndAddFilesToCompile""]","[""132fb32522052091d672208e63b418926e297bb2"", ""132fb32522052091d672208e63b418926e297bb2"", ""132fb32522052091d672208e63b418926e297bb2"", ""132fb32522052091d672208e63b418926e297bb2"", ""132fb32522052091d672208e63b418926e297bb2"", ""132fb32522052091d672208e63b418926e297bb2"", ""132fb32522052091d672208e63b418926e297bb2""]","[""FeatureEnvy"", ""FeatureEnvy"", ""FeatureEnvy"", ""FeatureEnvy"", ""SpaghettiCode"", ""ComplexClass"", ""FeatureEnvy""]","[""3c6f2e85b3cf76b947c22e557ce29b8d"", ""c6fe7ec310383d516015d0e55cb5e714"", ""966baa795ed44ba443ce26e5d182b6c1"", ""d89fffdaa3da045d021f5d6bf99abc29"", ""3c447cd410a545e0a192e3a3ed1b62fa"", ""bd48fc65fd272f3036c59c83a07ad945"", ""09b52cbf9e86964701770ed3f497ae65""]","[585, 600, 615, 630, 64, 202, 645]","[598, 613, 628, 643, 403, 286, 658]","[""{\""LocalityRatio\"": 0.0, \""MaxCallChain\"": 2.0, \""ParameterCount\"": 0.0, \""CyclomaticComplexity\"": 1.0, \""MethodLinesOfCode\"": 2.0}"", ""{\""LocalityRatio\"": 0.0, \""MaxCallChain\"": 2.0, \""ParameterCount\"": 0.0, \""CyclomaticComplexity\"": 1.0, \""MethodLinesOfCode\"": 2.0}"", ""{\""LocalityRatio\"": 0.0, \""MaxCallChain\"": 2.0, \""ParameterCount\"": 0.0, \""CyclomaticComplexity\"": 1.0, \""MethodLinesOfCode\"": 2.0}"", ""{\""LocalityRatio\"": 0.0, \""MaxCallChain\"": 2.0, \""ParameterCount\"": 0.0, \""CyclomaticComplexity\"": 1.0, \""MethodLinesOfCode\"": 2.0}"", ""{\""IsAbstract\"": 1.0, \""ClassLinesOfCode\"": 173.0, \""OverrideRatio\"": null, \""PublicFieldCount\"": 0.0, \""TightClassCohesion\"": 1.0}"", ""{\""IsAbstract\"": 1.0, \""ClassLinesOfCode\"": 173.0, \""OverrideRatio\"": null, \""PublicFieldCount\"": 0.0, \""TightClassCohesion\"": 1.0}"", ""{\""LocalityRatio\"": 0.0, \""MaxCallChain\"": 2.0, \""ParameterCount\"": 0.0, \""CyclomaticComplexity\"": 1.0, \""MethodLinesOfCode\"": 2.0}""]","[""6667e4cdd6d4914852b49e767b9f836a4d6941f2"", ""6667e4cdd6d4914852b49e767b9f836a4d6941f2"", ""6667e4cdd6d4914852b49e767b9f836a4d6941f2"", ""6667e4cdd6d4914852b49e767b9f836a4d6941f2"", ""6667e4cdd6d4914852b49e767b9f836a4d6941f2"", ""6667e4cdd6d4914852b49e767b9f836a4d6941f2"", ""6667e4cdd6d4914852b49e767b9f836a4d6941f2""]","[""FeatureEnvy"", ""FeatureEnvy"", ""ComplexClass"", ""SpaghettiCode"", ""FeatureEnvy"", ""FeatureEnvy"", ""LongMethod""]","[""ca4882cc39a574053e08661783292cff"", ""ecfdb35f67e737b060e7704838f6a411"", ""fd985f56466c13e8d342103aa50b7ddc"", ""e47d3a6acffc89588f039ee1d36906c2"", ""5c34a1d72a534d3b09a2fb0aca4e8c38"", ""0a2e287f23d55d380680480e2e75e807"", ""5283265bfb6d096a02f49a490d954f14""]","[508, 473, 246, 62, 521, 601, 601]","[599, 519, 307, 537, 540, 757, 757]","[""{\""MethodLinesOfCode\"": 38.0, \""MaxCallChain\"": 2.0, \""ParameterCount\"": 0.0, \""CyclomaticComplexity\"": 9.0, \""LocalityRatio\"": 0.06451612903225806}"", ""{\""MethodLinesOfCode\"": 28.0, \""MaxCallChain\"": 2.0, \""ParameterCount\"": 0.0, \""CyclomaticComplexity\"": 8.0, \""LocalityRatio\"": 0.05263157894736842}"", ""{\""IsAbstract\"": 0.0, \""ClassLinesOfCode\"": 254.0, \""OverrideRatio\"": 0.07692307692307693, \""TightClassCohesion\"": 0.06666666666666667, \""PublicFieldCount\"": 0.0}"", ""{\""IsAbstract\"": 0.0, \""ClassLinesOfCode\"": 154.0, \""OverrideRatio\"": 0.14285714285714285, \""PublicFieldCount\"": 0.0, \""TightClassCohesion\"": 0.044444444444444446}"", ""{\""MethodLinesOfCode\"": 5.0, \""MaxCallChain\"": 1.0, \""ParameterCount\"": 1.0, \""CyclomaticComplexity\"": 1.0, \""LocalityRatio\"": 0.0}"", ""{\""MethodLinesOfCode\"": 49.0, \""MaxCallChain\"": 2.0, \""ParameterCount\"": 0.0, \""CyclomaticComplexity\"": 13.0, \""LocalityRatio\"": 0.05405405405405406}"", ""{\""MethodLinesOfCode\"": 49.0, \""MaxCallChain\"": 2.0, \""ParameterCount\"": 0.0, \""CyclomaticComplexity\"": 13.0, \""LocalityRatio\"": 0.05405405405405406}""]"
Researcher 1,apache_ant,20154,"[""Inline Method"", ""Inline Method"", ""Extract Method"", ""Extract Method""]","[""org.apache.tools.ant.AntClassLoader.getResourceAsStream"", ""org.apache.tools.ant.AntClassLoader.setup"", ""org.apache.tools.ant.AntClassLoader"", ""org.apache.tools.ant.AntClassLoader.findClass""]","[""4cbbf3629a15a78615a3ce63ffe6f3fc028b172d"", ""4cbbf3629a15a78615a3ce63ffe6f3fc028b172d"", ""4cbbf3629a15a78615a3ce63ffe6f3fc028b172d"", ""4cbbf3629a15a78615a3ce63ffe6f3fc028b172d"", ""4cbbf3629a15a78615a3ce63ffe6f3fc028b172d"", ""4cbbf3629a15a78615a3ce63ffe6f3fc028b172d"", ""4cbbf3629a15a78615a3ce63ffe6f3fc028b172d"", ""4cbbf3629a15a78615a3ce63ffe6f3fc028b172d"", ""4cbbf3629a15a78615a3ce63ffe6f3fc028b172d""]","[""FeatureEnvy"", ""LongMethod"", ""LongMethod"", ""FeatureEnvy"", ""FeatureEnvy"", ""FeatureEnvy"", ""SpaghettiCode"", ""RefusedBequest"", ""FeatureEnvy""]","[""6ed6c3140948d4b4d0090f2eba270bf3"", ""94da8fb9079e24d623568bfb13aaf691"", ""af2b3cb3b6775e35a435eddc56cecbaf"", ""3e5e6e1a639b269178304afa0a924828"", ""05e43343fc8e02c28899f49be01e9069"", ""4a639aca45921dffb7da09063abff4ee"", ""70c3fd64a3c1de6f76936bfe97b421f1"", ""9a16e86dd2361a43afd7b8f4348b0711"", ""8f2f794a2126bae56f5f52c4a381547f""]","[810, 810, 684, 684, 1402, 524, 35, 35, 474]","[908, 908, 788, 788, 1429, 573, 835, 835, 496]","[""{\""LocalityRatio\"": 0.34545454545454546, \""MethodLinesOfCode\"": 47.0, \""ParameterCount\"": 1.0, \""CyclomaticComplexity\"": 3.0, \""MaxCallChain\"": 3.0}"", ""{\""LocalityRatio\"": 0.34545454545454546, \""MethodLinesOfCode\"": 47.0, \""ParameterCount\"": 1.0, \""CyclomaticComplexity\"": 3.0, \""MaxCallChain\"": 3.0}"", ""{\""LocalityRatio\"": 0.29411764705882354, \""MethodLinesOfCode\"": 45.0, \""ParameterCount\"": 1.0, \""CyclomaticComplexity\"": 7.0, \""MaxCallChain\"": 3.0}"", ""{\""LocalityRatio\"": 0.29411764705882354, \""MethodLinesOfCode\"": 45.0, \""ParameterCount\"": 1.0, \""CyclomaticComplexity\"": 7.0, \""MaxCallChain\"": 3.0}"", ""{\""MethodLinesOfCode\"": 11.0, \""LocalityRatio\"": 0.3333333333333333, \""ParameterCount\"": 3.0, \""CyclomaticComplexity\"": 3.0, \""MaxCallChain\"": 2.0}"", ""{\""MethodLinesOfCode\"": 18.0, \""LocalityRatio\"": 0.0, \""ParameterCount\"": 3.0, \""CyclomaticComplexity\"": 6.0, \""MaxCallChain\"": 2.0}"", ""{\""IsAbstract\"": 0.0, \""ClassLinesOfCode\"": 266.0, \""OverrideRatio\"": 0.8333333333333334, \""TightClassCohesion\"": 0.17142857142857143, \""PublicFieldCount\"": 0.0}"", ""{\""IsAbstract\"": 0.0, \""ClassLinesOfCode\"": 266.0, \""OverrideRatio\"": 0.8333333333333334, \""TightClassCohesion\"": 0.17142857142857143, \""PublicFieldCount\"": 0.0}"", ""{\""LocalityRatio\"": 0.2857142857142857, \""MethodLinesOfCode\"": 10.0, \""ParameterCount\"": 3.0, \""CyclomaticComplexity\"": 5.0, \""MaxCallChain\"": 1.0}""]","[""655df7f9e198a141defc9dcfb45f7f14cd7749f8"", ""655df7f9e198a141defc9dcfb45f7f14cd7749f8""]","[""FeatureEnvy"", ""FeatureEnvy""]","[""ce5d23c36cd40943ece0c74d239ca04d"", ""be65067659e2298f4da8e2f596cff08b""]","[143, 297]","[167, 341]","[""{\""LocalityRatio\"": 0.4, \""MaxCallChain\"": 1.0, \""ParameterCount\"": 1.0, \""CyclomaticComplexity\"": 3.0, \""MethodLinesOfCode\"": 8.0}"", ""{\""LocalityRatio\"": 0.4444444444444444, \""MaxCallChain\"": 1.0, \""ParameterCount\"": 1.0, \""CyclomaticComplexity\"": 7.0, \""MethodLinesOfCode\"": 19.0}""]"
Researcher 1,apache_ant,20169,"[""Extract Method"", ""Extract Method"", ""Extract Method"", ""Extract Method"", ""Extract Method"", ""Extract Method""]","[""org.apache.tools.ant.taskdefs.optional.metamata.MParse.execute"", ""org.apache.tools.ant.taskdefs.optional.metamata.MParse"", ""org.apache.tools.ant.taskdefs.optional.metamata.MParse.cleanUp"", ""org.apache.tools.ant.taskdefs.optional.metamata.MParse.createStreamHandler"", ""org.apache.tools.ant.taskdefs.optional.metamata.MParse._execute""]","[""8d02bfc707ffeb41a31153bba6adbccebb06106b"", ""8d02bfc707ffeb41a31153bba6adbccebb06106b"", ""8d02bfc707ffeb41a31153bba6adbccebb06106b"", ""8d02bfc707ffeb41a31153bba6adbccebb06106b"", ""8d02bfc707ffeb41a31153bba6adbccebb06106b""]","[""ClassDataShouldBePrivate"", ""LazyClass"", ""ComplexClass"", ""FeatureEnvy"", ""SpaghettiCode""]","[""b717b5a1ae47c2ecfd4cf70ad9054775"", ""bb7bed9812db2f99d5bf76ffdc199872"", ""42c92728a089050e8b5c72bc18321250"", ""5b9cd2563773a037ca3cdf9e683e5af7"", ""e47d3a6acffc89588f039ee1d36906c2""]","[62, 62, 109, 519, 62]","[92, 92, 168, 575, 537]","[""{\""IsAbstract\"": 0.0, \""ClassLinesOfCode\"": 14.0, \""OverrideRatio\"": 0.4, \""PublicFieldCount\"": 2.0, \""TightClassCohesion\"": 0.6666666666666666}"", ""{\""IsAbstract\"": 0.0, \""ClassLinesOfCode\"": 14.0, \""OverrideRatio\"": 0.4, \""PublicFieldCount\"": 2.0, \""TightClassCohesion\"": 0.6666666666666666}"", ""{\""IsAbstract\"": 0.0, \""ClassLinesOfCode\"": 83.0, \""OverrideRatio\"": 0.3333333333333333, \""PublicFieldCount\"": 0.0, \""TightClassCohesion\"": 0.26666666666666666}"", ""{\""MethodLinesOfCode\"": 30.0, \""LocalityRatio\"": 0.09523809523809523, \""ParameterCount\"": 2.0, \""CyclomaticComplexity\"": 7.0, \""MaxCallChain\"": 1.0}"", ""{\""IsAbstract\"": 0.0, \""ClassLinesOfCode\"": 154.0, \""OverrideRatio\"": 0.14285714285714285, \""PublicFieldCount\"": 0.0, \""TightClassCohesion\"": 0.044444444444444446}""]","[""7435b27b914764c3845b4821363ffeb4ddfe89cd"", ""7435b27b914764c3845b4821363ffeb4ddfe89cd""]","[""FeatureEnvy"", ""FeatureEnvy""]","[""848f019bd86b65a9ca7ed1e2ccc8aea3"", ""e61b1a71d716dd64b5e0f32b4994db27""]","[224, 199]","[240, 222]","[""{\""MaxCallChain\"": 1.0, \""LocalityRatio\"": 0.0, \""ParameterCount\"": 0.0, \""CyclomaticComplexity\"": 4.0, \""MethodLinesOfCode\"": 12.0}"", ""{\""MaxCallChain\"": 2.0, \""LocalityRatio\"": 0.0, \""ParameterCount\"": 1.0, \""CyclomaticComplexity\"": 4.0, \""MethodLinesOfCode\"": 16.0}""]"
Researcher 1,apache_ant,20170,"[""Extract Method"", ""Extract Method"", ""Extract Method"", ""Extract Method"", ""Extract Method"", ""Extract Method"", ""Extract Method"", ""Extract Method"", ""Extract Method"", ""Extract Method"", ""Extract Method"", ""Extract Method""]","[""org.apache.tools.ant.taskdefs.Javadoc.setBottom"", ""org.apache.tools.ant.taskdefs.Javadoc"", ""org.apache.tools.ant.taskdefs.Javadoc.add12ArgIfNotEmpty"", ""org.apache.tools.ant.taskdefs.Javadoc.setWindowtitle"", ""org.apache.tools.ant.taskdefs.Javadoc.setFooter"", ""org.apache.tools.ant.taskdefs.Javadoc.setCharset"", ""org.apache.tools.ant.taskdefs.Javadoc.setDoctitle"", ""org.apache.tools.ant.taskdefs.Javadoc.setHeader""]","[""8d02bfc707ffeb41a31153bba6adbccebb06106b"", ""8d02bfc707ffeb41a31153bba6adbccebb06106b"", ""8d02bfc707ffeb41a31153bba6adbccebb06106b"", ""8d02bfc707ffeb41a31153bba6adbccebb06106b"", ""8d02bfc707ffeb41a31153bba6adbccebb06106b""]","[""ClassDataShouldBePrivate"", ""LazyClass"", ""ComplexClass"", ""FeatureEnvy"", ""SpaghettiCode""]","[""b717b5a1ae47c2ecfd4cf70ad9054775"", ""bb7bed9812db2f99d5bf76ffdc199872"", ""42c92728a089050e8b5c72bc18321250"", ""5b9cd2563773a037ca3cdf9e683e5af7"", ""e47d3a6acffc89588f039ee1d36906c2""]","[62, 62, 109, 519, 62]","[92, 92, 168, 575, 537]","[""{\""IsAbstract\"": 0.0, \""ClassLinesOfCode\"": 14.0, \""OverrideRatio\"": 0.4, \""PublicFieldCount\"": 2.0, \""TightClassCohesion\"": 0.6666666666666666}"", ""{\""IsAbstract\"": 0.0, \""ClassLinesOfCode\"": 14.0, \""OverrideRatio\"": 0.4, \""PublicFieldCount\"": 2.0, \""TightClassCohesion\"": 0.6666666666666666}"", ""{\""IsAbstract\"": 0.0, \""ClassLinesOfCode\"": 83.0, \""OverrideRatio\"": 0.3333333333333333, \""PublicFieldCount\"": 0.0, \""TightClassCohesion\"": 0.26666666666666666}"", ""{\""MethodLinesOfCode\"": 30.0, \""LocalityRatio\"": 0.09523809523809523, \""ParameterCount\"": 2.0, \""CyclomaticComplexity\"": 7.0, \""MaxCallChain\"": 1.0}"", ""{\""IsAbstract\"": 0.0, \""ClassLinesOfCode\"": 154.0, \""OverrideRatio\"": 0.14285714285714285, \""PublicFieldCount\"": 0.0, \""TightClassCohesion\"": 0.044444444444444446}""]","[""068f7348847e10c8deca027f67e7142c559cdfa0"", ""068f7348847e10c8deca027f67e7142c559cdfa0"", ""068f7348847e10c8deca027f67e7142c559cdfa0""]","[""FeatureEnvy"", ""ComplexClass"", ""SpaghettiCode""]","[""65e12b9e3d4f4b1b890990c861f643b3"", ""53d808d9cd20d4adab33fb5b3845d235"", ""248b1c935ae8620a3c5984a641085097""]","[178, 453, 64]","[189, 756, 889]","[""{\""MaxCallChain\"": 2.0, \""MethodLinesOfCode\"": 6.0, \""ParameterCount\"": 2.0, \""CyclomaticComplexity\"": 3.0, \""LocalityRatio\"": 0.0}"", ""{\""IsAbstract\"": 0.0, \""ClassLinesOfCode\"": 558.0, \""OverrideRatio\"": 0.4, \""TightClassCohesion\"": 0.044897959183673466, \""PublicFieldCount\"": 0.0}"", ""{\""IsAbstract\"": 0.0, \""ClassLinesOfCode\"": 455.0, \""OverrideRatio\"": 0.10526315789473684, \""TightClassCohesion\"": 0.1161524500907441, \""PublicFieldCount\"": 0.0}""]"
Researcher 1,apache_ant,20171,"[""Extract Method"", ""Extract Method"", ""Extract Method"", ""Extract Method""]","[""org.apache.tools.ant.AntClassLoader.getResourceAsStream"", ""org.apache.tools.ant.AntClassLoader"", ""org.apache.tools.ant.AntClassLoader.loadResource"", ""org.apache.tools.ant.AntClassLoader.loadClass"", ""org.apache.tools.ant.AntClassLoader.isSystemFirst""]","[""4ec8012f430c57460a1f91c85db450f7e04d0f02"", ""4ec8012f430c57460a1f91c85db450f7e04d0f02""]","[""FeatureEnvy"", ""FeatureEnvy""]","[""fcd9cd7c20ae709b8b38bf62aae2e253"", ""c0c30ae1fa6f213117cc8113c2d38fe2""]","[102, 111]","[109, 118]","[""{\""LocalityRatio\"": 0.0, \""MaxCallChain\"": 1.0, \""ParameterCount\"": 0.0, \""CyclomaticComplexity\"": 1.0, \""MethodLinesOfCode\"": 4.0}"", ""{\""LocalityRatio\"": 0.0, \""MaxCallChain\"": 1.0, \""ParameterCount\"": 0.0, \""CyclomaticComplexity\"": 1.0, \""MethodLinesOfCode\"": 4.0}""]","[""b31472d21fcd29fc5104562036e9dd98da76f9de"", ""b31472d21fcd29fc5104562036e9dd98da76f9de"", ""b31472d21fcd29fc5104562036e9dd98da76f9de""]","[""FeatureEnvy"", ""FeatureEnvy"", ""FeatureEnvy""]","[""c0590af4fbc034f7e53294c6c9734f95"", ""e604280fa14e94e3a4b1bc6b9184e5d7"", ""6364168defe44571102322dc31d417bf""]","[267, 316, 358]","[287, 387, 381]","[""{\""MethodLinesOfCode\"": 7.0, \""MaxCallChain\"": 1.0, \""ParameterCount\"": 1.0, \""CyclomaticComplexity\"": 2.0, \""LocalityRatio\"": 0.3333333333333333}"", ""{\""MaxCallChain\"": 1.0, \""MethodLinesOfCode\"": 32.0, \""ParameterCount\"": 2.0, \""CyclomaticComplexity\"": 11.0, \""LocalityRatio\"": 0.2222222222222222}"", ""{\""MethodLinesOfCode\"": 13.0, \""MaxCallChain\"": 1.0, \""ParameterCount\"": 1.0, \""CyclomaticComplexity\"": 5.0, \""LocalityRatio\"": 0.0}""]"
Researcher 1,apache_ant,20194,"[""Inline Method"", ""Inline Method"", ""Extract Method"", ""Extract Method""]","[""org.apache.tools.ant.taskdefs.exec.Execute.waitFor"", ""org.apache.tools.ant.taskdefs.exec.Execute"", ""org.apache.tools.ant.taskdefs.exec.Execute.execute"", ""org.apache.tools.ant.taskdefs.exec.Execute.getLauncher""]","[""1f870a7a50901acd02ed55d93eb34d62364566c0"", ""1f870a7a50901acd02ed55d93eb34d62364566c0"", ""1f870a7a50901acd02ed55d93eb34d62364566c0"", ""1f870a7a50901acd02ed55d93eb34d62364566c0"", ""1f870a7a50901acd02ed55d93eb34d62364566c0"", ""1f870a7a50901acd02ed55d93eb34d62364566c0"", ""1f870a7a50901acd02ed55d93eb34d62364566c0"", ""1f870a7a50901acd02ed55d93eb34d62364566c0""]","[""LongMethod"", ""FeatureEnvy"", ""ComplexClass"", ""SpaghettiCode"", ""FeatureEnvy"", ""LongMethod"", ""LongMethod"", ""FeatureEnvy""]","[""d694a6676caa1947fed30f7216407910"", ""dc102be58c9360d1a8dbabc710cb4957"", ""fd985f56466c13e8d342103aa50b7ddc"", ""e47d3a6acffc89588f039ee1d36906c2"", ""ca4882cc39a574053e08661783292cff"", ""7149b07033922d1be6285378c170ca45"", ""5283265bfb6d096a02f49a490d954f14"", ""0a2e287f23d55d380680480e2e75e807""]","[426, 426, 246, 62, 508, 508, 601, 601]","[506, 506, 307, 537, 599, 599, 757, 757]","[""{\""MethodLinesOfCode\"": 35.0, \""MaxCallChain\"": 2.0, \""ParameterCount\"": 0.0, \""CyclomaticComplexity\"": 9.0, \""LocalityRatio\"": 0.029411764705882353}"", ""{\""MethodLinesOfCode\"": 35.0, \""MaxCallChain\"": 2.0, \""ParameterCount\"": 0.0, \""CyclomaticComplexity\"": 9.0, \""LocalityRatio\"": 0.029411764705882353}"", ""{\""IsAbstract\"": 0.0, \""ClassLinesOfCode\"": 254.0, \""OverrideRatio\"": 0.07692307692307693, \""TightClassCohesion\"": 0.06666666666666667, \""PublicFieldCount\"": 0.0}"", ""{\""IsAbstract\"": 0.0, \""ClassLinesOfCode\"": 154.0, \""OverrideRatio\"": 0.14285714285714285, \""PublicFieldCount\"": 0.0, \""TightClassCohesion\"": 0.044444444444444446}"", ""{\""MethodLinesOfCode\"": 38.0, \""MaxCallChain\"": 2.0, \""ParameterCount\"": 0.0, \""CyclomaticComplexity\"": 9.0, \""LocalityRatio\"": 0.06451612903225806}"", ""{\""MethodLinesOfCode\"": 38.0, \""MaxCallChain\"": 2.0, \""ParameterCount\"": 0.0, \""CyclomaticComplexity\"": 9.0, \""LocalityRatio\"": 0.06451612903225806}"", ""{\""MethodLinesOfCode\"": 49.0, \""MaxCallChain\"": 2.0, \""ParameterCount\"": 0.0, \""CyclomaticComplexity\"": 13.0, \""LocalityRatio\"": 0.05405405405405406}"", ""{\""MethodLinesOfCode\"": 49.0, \""MaxCallChain\"": 2.0, \""ParameterCount\"": 0.0, \""CyclomaticComplexity\"": 13.0, \""LocalityRatio\"": 0.05405405405405406}""]","[""0ededf8ae2c3d65541f77fb90c5a7c5b40612ac4""]","[""FeatureEnvy""]","[""11b7f981ac96cd8b9e6ffc1359684e19""]",[278],[328],"[""{\""LocalityRatio\"": 0.11764705882352941, \""MaxCallChain\"": 2.0, \""ParameterCount\"": 0.0, \""CyclomaticComplexity\"": 6.0, \""MethodLinesOfCode\"": 25.0}""]"
Researcher 1,apache_ant,20223,"[""Move Attribute"", ""Move Attribute"", ""Move Attribute"", ""Move Attribute"", ""Extract Method"", ""Extract Method"", ""Move Attribute"", ""Move Attribute"", ""Extract Method"", ""Extract Method"", ""Move Attribute"", ""Move Attribute"", ""Inline Method"", ""Inline Method""]","[""org.apache.tools.ant.taskdefs.archive.Expand"", ""org.apache.tools.ant.taskdefs.optional.Cab"", ""org.apache.tools.ant.taskdefs.optional.net.FTP"", ""org.apache.tools.ant.taskdefs.archive.Expand.execute"", ""org.apache.tools.ant.taskdefs.archive.Expand.validate"", ""org.apache.tools.ant.taskdefs.optional.sitraka.Coverage"", ""org.apache.tools.ant.taskdefs.archive.Expand.expandFile"", ""org.apache.tools.ant.taskdefs.archive.Expand.expandArchive"", ""org.apache.tools.ant.taskdefs.Checksum""]","[""403c32e5c5322f65e184f6d21496d0295d74f6e1"", ""403c32e5c5322f65e184f6d21496d0295d74f6e1"", ""403c32e5c5322f65e184f6d21496d0295d74f6e1""]","[""FeatureEnvy"", ""FeatureEnvy"", ""FeatureEnvy""]","[""ce5d23c36cd40943ece0c74d239ca04d"", ""a27ef478050542ae936468fe73c56ede"", ""be65067659e2298f4da8e2f596cff08b""]","[143, 102, 297]","[167, 117, 341]","[""{\""LocalityRatio\"": 0.4, \""MaxCallChain\"": 1.0, \""ParameterCount\"": 1.0, \""CyclomaticComplexity\"": 3.0, \""MethodLinesOfCode\"": 8.0}"", ""{\""LocalityRatio\"": 0.0, \""MaxCallChain\"": 1.0, \""ParameterCount\"": 0.0, \""CyclomaticComplexity\"": 2.0, \""MethodLinesOfCode\"": 6.0}"", ""{\""LocalityRatio\"": 0.4444444444444444, \""MaxCallChain\"": 1.0, \""ParameterCount\"": 1.0, \""CyclomaticComplexity\"": 7.0, \""MethodLinesOfCode\"": 19.0}""]","[""10def2afa482c645a7a01907ce2e352c3e3db2a1"", ""10def2afa482c645a7a01907ce2e352c3e3db2a1""]","[""SpeculativeGenerality"", ""ComplexClass""]","[""dc8e94e945cc9f12091241560756124f"", ""05b0f97d97cb2e92d9c91d24f8659c36""]","[28, 193]","[286, 302]","[""{\""IsAbstract\"": 1.0, \""ClassLinesOfCode\"": 100.0, \""OverrideRatio\"": 0.07142857142857142, \""TightClassCohesion\"": 0.2, \""PublicFieldCount\"": 0.0}"", ""{\""IsAbstract\"": 0.0, \""ClassLinesOfCode\"": 100.0, \""OverrideRatio\"": 0.07142857142857142, \""TightClassCohesion\"": 0.2, \""PublicFieldCount\"": 0.0}""]"
Researcher 1,apache_ant,20227,"[""Extract Method"", ""Extract Method"", ""Extract Method"", ""Extract Method"", ""Inline Method"", ""Inline Method""]","[""org.apache.ant.antcore.execution.ExecutionFrame.executeTasks"", ""org.apache.ant.antcore.execution.ExecutionFrame"", ""org.apache.ant.antcore.execution.ExecutionFrame.createTypeInstance"", ""org.apache.ant.antcore.execution.ExecutionFrame.configureElement"", ""org.apache.ant.antcore.execution.ExecutionFrame.createNestedElement""]","[""403c32e5c5322f65e184f6d21496d0295d74f6e1"", ""403c32e5c5322f65e184f6d21496d0295d74f6e1"", ""403c32e5c5322f65e184f6d21496d0295d74f6e1""]","[""FeatureEnvy"", ""FeatureEnvy"", ""FeatureEnvy""]","[""ce5d23c36cd40943ece0c74d239ca04d"", ""a27ef478050542ae936468fe73c56ede"", ""be65067659e2298f4da8e2f596cff08b""]","[143, 102, 297]","[167, 117, 341]","[""{\""LocalityRatio\"": 0.4, \""MaxCallChain\"": 1.0, \""ParameterCount\"": 1.0, \""CyclomaticComplexity\"": 3.0, \""MethodLinesOfCode\"": 8.0}"", ""{\""LocalityRatio\"": 0.0, \""MaxCallChain\"": 1.0, \""ParameterCount\"": 0.0, \""CyclomaticComplexity\"": 2.0, \""MethodLinesOfCode\"": 6.0}"", ""{\""LocalityRatio\"": 0.4444444444444444, \""MaxCallChain\"": 1.0, \""ParameterCount\"": 1.0, \""CyclomaticComplexity\"": 7.0, \""MethodLinesOfCode\"": 19.0}""]","[""b7e43ad8c5906ae2b6d6b42f8b2715dc7d2e7a16"", ""b7e43ad8c5906ae2b6d6b42f8b2715dc7d2e7a16"", ""b7e43ad8c5906ae2b6d6b42f8b2715dc7d2e7a16""]","[""FeatureEnvy"", ""FeatureEnvy"", ""FeatureEnvy""]","[""8db909fb8caa8906ad3cf137149d60e7"", ""b0e17e5906755af7314c3a9c5a0dd9fc"", ""87674e752fcb1edf9d08a26ddc91166f""]","[702, 466, 1120]","[750, 521, 1164]","[""{\""MethodLinesOfCode\"": 19.0, \""LocalityRatio\"": 0.2, \""ParameterCount\"": 2.0, \""CyclomaticComplexity\"": 5.0, \""MaxCallChain\"": 2.0}"", ""{\""MethodLinesOfCode\"": 29.0, \""LocalityRatio\"": 0.25, \""ParameterCount\"": 1.0, \""CyclomaticComplexity\"": 8.0, \""MaxCallChain\"": 2.0}"", ""{\""MaxCallChain\"": 2.0, \""ParameterCount\"": 3.0, \""CyclomaticComplexity\"": 6.0, \""MethodLinesOfCode\"": 20.0, \""LocalityRatio\"": 0.07692307692307693}""]"
Researcher 1,apache_ant,20250,"[""Extract Method"", ""Extract Method"", ""Extract Method"", ""Extract Method"", ""Extract Method"", ""Extract Method""]","[""org.apache.myrmidon.components.builder.DefaultProjectBuilder.buildTarget"", ""org.apache.myrmidon.components.builder.DefaultProjectBuilder"", ""org.apache.myrmidon.components.builder.DefaultProjectBuilder.buildDependsList"", ""org.apache.myrmidon.components.builder.DefaultProjectBuilder.verifyName"", ""org.apache.myrmidon.components.builder.DefaultProjectBuilder.buildCondition""]","[""b5ad58c4d736b7f0a97aaa78b258dcceb9c21c89"", ""b5ad58c4d736b7f0a97aaa78b258dcceb9c21c89"", ""b5ad58c4d736b7f0a97aaa78b258dcceb9c21c89""]","[""FeatureEnvy"", ""LongMethod"", ""ComplexClass""]","[""0dfa84337996d21d95836a381f0c6938"", ""7076b970cde38ee0ed87d4de5dfe10bd"", ""9852a670a4dcaff4b2918743650a885d""]","[113, 113, 113]","[187, 187, 187]","[""{\""MethodLinesOfCode\"": 49.0, \""MaxCallChain\"": 3.0, \""ParameterCount\"": 0.0, \""CyclomaticComplexity\"": 11.0, \""LocalityRatio\"": 0.0}"", ""{\""MethodLinesOfCode\"": 49.0, \""MaxCallChain\"": 3.0, \""ParameterCount\"": 0.0, \""CyclomaticComplexity\"": 11.0, \""LocalityRatio\"": 0.0}"", ""{\""IsAbstract\"": 0.0, \""ClassLinesOfCode\"": 71.0, \""OverrideRatio\"": 0.10526315789473684, \""PublicFieldCount\"": 0.0, \""TightClassCohesion\"": 0.2857142857142857}""]","[""6e89cb024f5e360f9a4a9a3d9e8b8483c7e1ecee""]","[""FeatureEnvy""]","[""66af34bd0380a28e09556c5969e746fe""]",[409],[443],"[""{\""LocalityRatio\"": 0.0, \""ParameterCount\"": 2.0, \""CyclomaticComplexity\"": 5.0, \""MethodLinesOfCode\"": 16.0, \""MaxCallChain\"": 2.0}""]"
Researcher 1,apache_ant,20257,"[""Extract Method"", ""Extract Method"", ""Extract Method"", ""Extract Method""]","[""org.apache.tools.ant.taskdefs.optional.PropertyFile.Entry"", ""org.apache.tools.ant.taskdefs.optional.PropertyFile.Entry.executeString"", ""org.apache.tools.ant.taskdefs.optional.PropertyFile.Entry.getCurrentValue"", ""org.apache.tools.ant.taskdefs.optional.PropertyFile.Entry.executeDate""]","[""7a06ef0e04703753fb1ff2134c4cd8323e8dc3b8"", ""7a06ef0e04703753fb1ff2134c4cd8323e8dc3b8"", ""7a06ef0e04703753fb1ff2134c4cd8323e8dc3b8"", ""7a06ef0e04703753fb1ff2134c4cd8323e8dc3b8"", ""7a06ef0e04703753fb1ff2134c4cd8323e8dc3b8"", ""7a06ef0e04703753fb1ff2134c4cd8323e8dc3b8"", ""7a06ef0e04703753fb1ff2134c4cd8323e8dc3b8"", ""7a06ef0e04703753fb1ff2134c4cd8323e8dc3b8""]","[""FeatureEnvy"", ""FeatureEnvy"", ""FeatureEnvy"", ""FeatureEnvy"", ""ComplexClass"", ""SpaghettiCode"", ""FeatureEnvy"", ""FeatureEnvy""]","[""a54c3571f76d3965ba9f7c408fce6d98"", ""97883af280110be88a02d8b6980b2350"", ""ee719e35cfed64bc87ea0a7e5ed526f3"", ""b5a10bb6059a1a40aad245fbaf7b81ba"", ""53d808d9cd20d4adab33fb5b3845d235"", ""248b1c935ae8620a3c5984a641085097"", ""f7bf81bfb6c243bba5f3e1c1b9fa7d74"", ""182176d8f1a4ca6c8681ddf81397777f""]","[555, 389, 395, 401, 453, 64, 407, 413]","[560, 394, 400, 406, 756, 889, 412, 418]","[""{\""MaxCallChain\"": 2.0, \""MethodLinesOfCode\"": 4.0, \""ParameterCount\"": 1.0, \""CyclomaticComplexity\"": 2.0, \""LocalityRatio\"": 0.0}"", ""{\""MaxCallChain\"": 2.0, \""MethodLinesOfCode\"": 4.0, \""ParameterCount\"": 1.0, \""CyclomaticComplexity\"": 2.0, \""LocalityRatio\"": 0.0}"", ""{\""MaxCallChain\"": 2.0, \""MethodLinesOfCode\"": 4.0, \""ParameterCount\"": 1.0, \""CyclomaticComplexity\"": 2.0, \""LocalityRatio\"": 0.0}"", ""{\""MaxCallChain\"": 2.0, \""MethodLinesOfCode\"": 4.0, \""ParameterCount\"": 1.0, \""CyclomaticComplexity\"": 2.0, \""LocalityRatio\"": 0.0}"", ""{\""IsAbstract\"": 0.0, \""ClassLinesOfCode\"": 558.0, \""OverrideRatio\"": 0.4, \""TightClassCohesion\"": 0.044897959183673466, \""PublicFieldCount\"": 0.0}"", ""{\""IsAbstract\"": 0.0, \""ClassLinesOfCode\"": 455.0, \""OverrideRatio\"": 0.10526315789473684, \""TightClassCohesion\"": 0.1161524500907441, \""PublicFieldCount\"": 0.0}"", ""{\""MaxCallChain\"": 2.0, \""MethodLinesOfCode\"": 4.0, \""ParameterCount\"": 1.0, \""CyclomaticComplexity\"": 2.0, \""LocalityRatio\"": 0.0}"", ""{\""MaxCallChain\"": 2.0, \""MethodLinesOfCode\"": 4.0, \""ParameterCount\"": 1.0, \""CyclomaticComplexity\"": 2.0, \""LocalityRatio\"": 0.0}""]","[""6cbeee38fa5502baa5d75036ad2c0418cf808d56""]","[""FeatureEnvy""]","[""d031e2744dd150659337a78f51b03e2c""]",[411],[507],"[""{\""MethodLinesOfCode\"": 50.0, \""LocalityRatio\"": 0.0, \""ParameterCount\"": 1.0, \""CyclomaticComplexity\"": 18.0, \""MaxCallChain\"": 2.0}""]"
Researcher 1,apache_ant,20261,"[""Extract Method"", ""Extract Method"", ""Move Method"", ""Move Method""]","[""org.apache.tools.ant.SymbolTable.checkClass"", ""org.apache.tools.ant.SymbolTable"", ""org.apache.tools.ant.SymbolTable.Role""]","[""ad4c56763e91150e9a6cadce4e62f50e7276311e"", ""ad4c56763e91150e9a6cadce4e62f50e7276311e"", ""ad4c56763e91150e9a6cadce4e62f50e7276311e"", ""ad4c56763e91150e9a6cadce4e62f50e7276311e""]","[""FeatureEnvy"", ""ComplexClass"", ""LongMethod"", ""FeatureEnvy""]","[""ce5d23c36cd40943ece0c74d239ca04d"", ""90c5635885c9bf137bf215887f7975a8"", ""4ce4ae74122e43eca6d58feae4f7c3ef"", ""e604280fa14e94e3a4b1bc6b9184e5d7""]","[143, 316, 316, 316]","[167, 387, 387, 387]","[""{\""LocalityRatio\"": 0.4, \""MaxCallChain\"": 1.0, \""ParameterCount\"": 1.0, \""CyclomaticComplexity\"": 3.0, \""MethodLinesOfCode\"": 8.0}"", ""{\""IsAbstract\"": 0.0, \""ClassLinesOfCode\"": 163.0, \""OverrideRatio\"": 0.043478260869565216, \""TightClassCohesion\"": 0.2777777777777778, \""PublicFieldCount\"": 0.0}"", ""{\""MaxCallChain\"": 1.0, \""MethodLinesOfCode\"": 32.0, \""ParameterCount\"": 2.0, \""CyclomaticComplexity\"": 11.0, \""LocalityRatio\"": 0.2222222222222222}"", ""{\""MaxCallChain\"": 1.0, \""MethodLinesOfCode\"": 32.0, \""ParameterCount\"": 2.0, \""CyclomaticComplexity\"": 11.0, \""LocalityRatio\"": 0.2222222222222222}""]","[""8dfa7abd4d64b0cbef6166a28440f39f46d6efd1""]","[""FeatureEnvy""]","[""6774b1e03ff4b55b43869c25e3913c15""]",[268],[333],"[""{\""MaxCallChain\"": 2.0, \""MethodLinesOfCode\"": 39.0, \""ParameterCount\"": 1.0, \""CyclomaticComplexity\"": 8.0, \""LocalityRatio\"": 0.0}""]"
Researcher 1,apache_ant,20295,"[""Extract Method"", ""Extract Method"", ""Inline Method"", ""Inline Method""]","[""org.apache.tools.ant.taskdefs.Javadoc"", ""org.apache.tools.ant.taskdefs.Javadoc.execute"", ""org.apache.tools.ant.taskdefs.Javadoc.parsePackages"", ""org.apache.tools.ant.taskdefs.Javadoc.evaluatePackages""]","[""88a9e0bdb35bb01aca2d84e6faefbddb5b009718"", ""88a9e0bdb35bb01aca2d84e6faefbddb5b009718""]","[""FeatureEnvy"", ""FeatureEnvy""]","[""37b6429fa9dd6e4e239155e5edb8f118"", ""11b7f981ac96cd8b9e6ffc1359684e19""]","[346, 278]","[356, 328]","[""{\""LocalityRatio\"": 0.3333333333333333, \""MaxCallChain\"": 2.0, \""ParameterCount\"": 1.0, \""CyclomaticComplexity\"": 2.0, \""MethodLinesOfCode\"": 5.0}"", ""{\""LocalityRatio\"": 0.11764705882352941, \""MaxCallChain\"": 2.0, \""ParameterCount\"": 0.0, \""CyclomaticComplexity\"": 6.0, \""MethodLinesOfCode\"": 25.0}""]","[""9fe0f5be4e42e49babd57ab69bd3fa6d5e64adf1"", ""9fe0f5be4e42e49babd57ab69bd3fa6d5e64adf1"", ""9fe0f5be4e42e49babd57ab69bd3fa6d5e64adf1"", ""9fe0f5be4e42e49babd57ab69bd3fa6d5e64adf1"", ""9fe0f5be4e42e49babd57ab69bd3fa6d5e64adf1""]","[""GodClass"", ""ComplexClass"", ""FeatureEnvy"", ""LongMethod"", ""FeatureEnvy""]","[""977278b19bb89a3a1b36e34474c32f2f"", ""53d808d9cd20d4adab33fb5b3845d235"", ""d9249517d922a5612a436922a58dfc2f"", ""fcf8bef4a1e83b270987053993f3592d"", ""52d08ce5a8ff2246c61ee1116e2edcf2""]","[65, 453, 453, 453, 1781]","[996, 756, 756, 756, 1864]","[""{\""IsAbstract\"": 0.0, \""ClassLinesOfCode\"": 558.0, \""OverrideRatio\"": 0.4, \""TightClassCohesion\"": 0.044897959183673466, \""PublicFieldCount\"": 0.0}"", ""{\""IsAbstract\"": 0.0, \""ClassLinesOfCode\"": 558.0, \""OverrideRatio\"": 0.4, \""TightClassCohesion\"": 0.044897959183673466, \""PublicFieldCount\"": 0.0}"", ""{\""MethodLinesOfCode\"": 195.0, \""LocalityRatio\"": 0.006329113924050633, \""CyclomaticComplexity\"": 72.0, \""ParameterCount\"": 0.0, \""MaxCallChain\"": 3.0}"", ""{\""MethodLinesOfCode\"": 195.0, \""LocalityRatio\"": 0.006329113924050633, \""CyclomaticComplexity\"": 72.0, \""ParameterCount\"": 0.0, \""MaxCallChain\"": 3.0}"", ""{\""MethodLinesOfCode\"": 5.0, \""LocalityRatio\"": 0.0, \""ParameterCount\"": 2.0, \""CyclomaticComplexity\"": 1.0, \""MaxCallChain\"": 1.0}""]"
Researcher 1,apache_ant,20299,"[""Extract Method"", ""Extract Method"", ""Extract Method"", ""Extract Method"", ""Extract Method"", ""Extract Method"", ""Extract Method"", ""Extract Method"", ""Extract Method"", ""Extract Method"", ""Extract Method"", ""Extract Method""]","[""org.apache.tools.ant.taskdefs.optional.ejb.EjbJar"", ""org.apache.tools.ant.taskdefs.optional.ejb.EjbJar.createWeblogic"", ""org.apache.tools.ant.taskdefs.optional.ejb.EjbJar.addDeploymentTool"", ""org.apache.tools.ant.taskdefs.optional.ejb.EjbJar.createWeblogictoplink"", ""org.apache.tools.ant.taskdefs.optional.ejb.EjbJar.createWebsphere"", ""org.apache.tools.ant.taskdefs.optional.ejb.EjbJar.createJboss"", ""org.apache.tools.ant.taskdefs.optional.ejb.EjbJar.createIplanet"", ""org.apache.tools.ant.taskdefs.optional.ejb.EjbJar.createJonas""]","[""88a9e0bdb35bb01aca2d84e6faefbddb5b009718"", ""88a9e0bdb35bb01aca2d84e6faefbddb5b009718""]","[""FeatureEnvy"", ""FeatureEnvy""]","[""37b6429fa9dd6e4e239155e5edb8f118"", ""11b7f981ac96cd8b9e6ffc1359684e19""]","[346, 278]","[356, 328]","[""{\""LocalityRatio\"": 0.3333333333333333, \""MaxCallChain\"": 2.0, \""ParameterCount\"": 1.0, \""CyclomaticComplexity\"": 2.0, \""MethodLinesOfCode\"": 5.0}"", ""{\""LocalityRatio\"": 0.11764705882352941, \""MaxCallChain\"": 2.0, \""ParameterCount\"": 0.0, \""CyclomaticComplexity\"": 6.0, \""MethodLinesOfCode\"": 25.0}""]","[""6bd8d6e938a45868902ecd1092858e8372933c7c"", ""6bd8d6e938a45868902ecd1092858e8372933c7c""]","[""ClassDataShouldBePrivate"", ""FeatureEnvy""]","[""ca3d844f7b39fb65cef64bf84e9ba6d1"", ""81556f1e3f859d94bcc292194067badb""]","[74, 229]","[428, 239]","[""{\""IsAbstract\"": 0.0, \""ClassLinesOfCode\"": 97.0, \""OverrideRatio\"": 0.08333333333333333, \""PublicFieldCount\"": 8.0, \""TightClassCohesion\"": 0.5494505494505495}"", ""{\""LocalityRatio\"": 0.0, \""MaxCallChain\"": 1.0, \""ParameterCount\"": 1.0, \""CyclomaticComplexity\"": 1.0, \""MethodLinesOfCode\"": 3.0}""]"
Researcher 1,apache_ant,20305,"[""Extract Method"", ""Extract Method"", ""Extract Method"", ""Extract Method"", ""Extract Method"", ""Extract Method"", ""Extract Method"", ""Extract Method"", ""Extract Method"", ""Extract Method"", ""Extract Method"", ""Extract Method"", ""Move Attribute"", ""Move Attribute"", ""Extract Method"", ""Extract Method""]","[""org.apache.tools.ant.taskdefs.optional.sos.SOSTest.testGetProjectFlags"", ""org.apache.tools.ant.taskdefs.optional.sos.SOSTest"", ""org.apache.tools.ant.taskdefs.optional.sos.SOSTest.checkCommandLines"", ""org.apache.tools.ant.taskdefs.optional.sos.SOSTest.testGetFileFlags"", ""org.apache.tools.ant.taskdefs.optional.sos.SOSTest.testLabelFlags"", ""org.apache.tools.ant.taskdefs.optional.sos.SOSTest.testCheckinFileFlags"", ""org.apache.tools.ant.taskdefs.optional.sos.SOSTest.testCheckoutProjectFlags"", ""org.apache.tools.ant.taskdefs.optional.sos.SOSTest.testCheckinProjectFlags"", ""org.apache.tools.ant.DirectoryScanner"", ""org.apache.tools.ant.taskdefs.optional.sos.SOSTest.testCheckoutFileFlags""]","[""6584b1cf3e65148be573d992b00b2f4b1ca46c45"", ""6584b1cf3e65148be573d992b00b2f4b1ca46c45"", ""6584b1cf3e65148be573d992b00b2f4b1ca46c45"", ""6584b1cf3e65148be573d992b00b2f4b1ca46c45"", ""6584b1cf3e65148be573d992b00b2f4b1ca46c45"", ""6584b1cf3e65148be573d992b00b2f4b1ca46c45""]","[""SpaghettiCode"", ""ComplexClass"", ""ComplexClass"", ""SpaghettiCode"", ""FeatureEnvy"", ""ComplexClass""]","[""163133e3bfd26ebb6d7022be012d5bda"", ""bca366e915c027f1fb618a46b22154ac"", ""da489ef75cc35c307e4a8b3128667e27"", ""c8bda739ecf5fa7588613378570a4af7"", ""7539b16d551d1b76cb4c09b3fefb0882"", ""05b0f97d97cb2e92d9c91d24f8659c36""]","[81, 423, 212, 76, 97, 193]","[969, 494, 308, 423, 149, 302]","[""{\""IsAbstract\"": 0.0, \""ClassLinesOfCode\"": 347.0, \""OverrideRatio\"": 0.09090909090909091, \""PublicFieldCount\"": 0.0, \""TightClassCohesion\"": 0.0718954248366013}"", ""{\""IsAbstract\"": 0.0, \""ClassLinesOfCode\"": 347.0, \""OverrideRatio\"": 0.09090909090909091, \""PublicFieldCount\"": 0.0, \""TightClassCohesion\"": 0.0718954248366013}"", ""{\""IsAbstract\"": 0.0, \""ClassLinesOfCode\"": 155.0, \""OverrideRatio\"": 0.07142857142857142, \""PublicFieldCount\"": 0.0, \""TightClassCohesion\"": 0.022222222222222223}"", ""{\""IsAbstract\"": 0.0, \""ClassLinesOfCode\"": 155.0, \""OverrideRatio\"": 0.07142857142857142, \""PublicFieldCount\"": 0.0, \""TightClassCohesion\"": 0.022222222222222223}"", ""{\""LocalityRatio\"": 0.16666666666666666, \""MaxCallChain\"": 1.0, \""ParameterCount\"": 0.0, \""CyclomaticComplexity\"": 9.0, \""MethodLinesOfCode\"": 20.0}"", ""{\""IsAbstract\"": 0.0, \""ClassLinesOfCode\"": 100.0, \""OverrideRatio\"": 0.07142857142857142, \""TightClassCohesion\"": 0.2, \""PublicFieldCount\"": 0.0}""]","[""04408cb596d6a5a0bc1261a75adaf46ebf9d644a"", ""04408cb596d6a5a0bc1261a75adaf46ebf9d644a"", ""04408cb596d6a5a0bc1261a75adaf46ebf9d644a"", ""04408cb596d6a5a0bc1261a75adaf46ebf9d644a"", ""04408cb596d6a5a0bc1261a75adaf46ebf9d644a"", ""04408cb596d6a5a0bc1261a75adaf46ebf9d644a"", ""04408cb596d6a5a0bc1261a75adaf46ebf9d644a"", ""04408cb596d6a5a0bc1261a75adaf46ebf9d644a""]","[""FeatureEnvy"", ""FeatureEnvy"", ""ComplexClass"", ""FeatureEnvy"", ""FeatureEnvy"", ""FeatureEnvy"", ""FeatureEnvy"", ""FeatureEnvy""]","[""13d681acb310d9f22109c630bddaa78e"", ""a088e6ce0d5ede7d20a515be96200c84"", ""ca4874f5988c54bf0909731795c24fab"", ""6bd9ee540799ab0ad1ea03b3f0bc4550"", ""a3016c8d1f1c2705b7805a4c0e816e2d"", ""5aac4c7f587ec953f608203b1e36bc0c"", ""d16a2b5af00e381c652d2e91095de2f0"", ""bfa7b11f8b8aef4bdb4f163cd1b48626""]","[269, 475, 277, 427, 161, 113, 318, 583]","[316, 516, 409, 473, 202, 159, 360, 623]","[""{\""LocalityRatio\"": 0.0, \""MaxCallChain\"": 2.0, \""ParameterCount\"": 0.0, \""CyclomaticComplexity\"": 4.0, \""MethodLinesOfCode\"": 27.0}"", ""{\""LocalityRatio\"": 0.0, \""MaxCallChain\"": 2.0, \""ParameterCount\"": 0.0, \""CyclomaticComplexity\"": 4.0, \""MethodLinesOfCode\"": 23.0}"", ""{\""IsAbstract\"": 0.0, \""ClassLinesOfCode\"": 331.0, \""OverrideRatio\"": null, \""PublicFieldCount\"": 0.0, \""TightClassCohesion\"": 0.14285714285714285}"", ""{\""LocalityRatio\"": 0.0, \""MaxCallChain\"": 2.0, \""ParameterCount\"": 0.0, \""CyclomaticComplexity\"": 4.0, \""MethodLinesOfCode\"": 26.0}"", ""{\""LocalityRatio\"": 0.0, \""MaxCallChain\"": 2.0, \""ParameterCount\"": 0.0, \""CyclomaticComplexity\"": 4.0, \""MethodLinesOfCode\"": 24.0}"", ""{\""LocalityRatio\"": 0.0, \""MaxCallChain\"": 2.0, \""ParameterCount\"": 0.0, \""CyclomaticComplexity\"": 4.0, \""MethodLinesOfCode\"": 27.0}"", ""{\""LocalityRatio\"": 0.0, \""MaxCallChain\"": 2.0, \""ParameterCount\"": 0.0, \""CyclomaticComplexity\"": 4.0, \""MethodLinesOfCode\"": 24.0}"", ""{\""LocalityRatio\"": 0.0, \""MaxCallChain\"": 1.0, \""ParameterCount\"": 0.0, \""CyclomaticComplexity\"": 4.0, \""MethodLinesOfCode\"": 23.0}""]"
Researcher 1,apache_derby,20380,"[""Extract Method"", ""Extract Method"", ""Extract Method"", ""Extract Method"", ""Extract Method"", ""Extract Method""]","[""org.apache.derby.impl.drda.DRDAConnThread.parseSQLDTA(DRDAStatement)"", ""org.apache.derby.impl.drda.DRDAConnThread"", ""org.apache.derby.impl.drda.DRDAConnThread.skipRemainder(boolean)"", ""org.apache.derby.impl.drda.DRDAConnThread.processCommands()"", ""org.apache.derby.impl.drda.DRDAConnThread.errorInChain(SQLException)""]","[""6885f5ccadd471cc33c19bdcca4271aa3086d3ca"", ""6885f5ccadd471cc33c19bdcca4271aa3086d3ca""]","[""FeatureEnvy"", ""LongMethod""]","[""6774b1e03ff4b55b43869c25e3913c15"", ""15c5a0b1b17d203141cbbf2a3e53fc8d""]","[268, 268]","[333, 333]","[""{\""MaxCallChain\"": 2.0, \""MethodLinesOfCode\"": 39.0, \""ParameterCount\"": 1.0, \""CyclomaticComplexity\"": 8.0, \""LocalityRatio\"": 0.0}"", ""{\""MaxCallChain\"": 2.0, \""MethodLinesOfCode\"": 39.0, \""ParameterCount\"": 1.0, \""CyclomaticComplexity\"": 8.0, \""LocalityRatio\"": 0.0}""]","[""d79abcf32a77e90643667b3a117c7e00356e920f"", ""d79abcf32a77e90643667b3a117c7e00356e920f"", ""d79abcf32a77e90643667b3a117c7e00356e920f"", ""d79abcf32a77e90643667b3a117c7e00356e920f"", ""d79abcf32a77e90643667b3a117c7e00356e920f"", ""d79abcf32a77e90643667b3a117c7e00356e920f"", ""d79abcf32a77e90643667b3a117c7e00356e920f"", ""d79abcf32a77e90643667b3a117c7e00356e920f"", ""d79abcf32a77e90643667b3a117c7e00356e920f"", ""d79abcf32a77e90643667b3a117c7e00356e920f"", ""d79abcf32a77e90643667b3a117c7e00356e920f""]","[""FeatureEnvy"", ""BrainMethod"", ""IntensiveCoupling"", ""LongMethod"", ""BrainMethod"", ""IntensiveCoupling"", ""LongMethod"", ""BrainClass"", ""SpaghettiCode"", ""ComplexClass"", ""GodClass""]","[""c8dc287dbbca9bf6954cbc22e7e4ff82"", ""11af7b5dbdfc75e0ec0db6b18202a135"", ""90a7e279d688654dc0ee04ad582319ea"", ""839d9502b3079f87bb178b1e44b378a4"", ""11af7b5dbdfc75e0ec0db6b18202a135"", ""90a7e279d688654dc0ee04ad582319ea"", ""839d9502b3079f87bb178b1e44b378a4"", ""afa1ef84f4ae9b8403f3d6881eeeb8f3"", ""ae79c0fc0252a34072318cb0f7f5dccb"", ""5e97adcd4e3b0a96cc5f4721bdf6484b"", ""e0f0444ec29d618a4dfb33f3b6d7d6e4""]","[2143, 546, 546, 546, 546, 546, 546, 61, 69, 69, 69]","[2161, 863, 863, 863, 863, 863, 863, 7610, 8321, 8321, 8321]","[""CALLS_TO_org.apache.derby.impl.drda.DDMReader > 5"", ""MLOC > 100.44741483028392, CC > 6.762430136436645, MAX_NESTING > 5.0, NOAV > 6.0"", ""CINT = 52.0, CDISP = 0.11538461538461539, CC > 1.0"", ""MLOC > 6.417051904733773"", ""MLOC > 100.44741483028392, CC > 6.762430136436645, MAX_NESTING > 5.0, NOAV > 6.0"", ""CINT = 52.0, CDISP = 0.11538461538461539, CC > 1.0"", ""MLOC > 6.417051904733773"", ""BRAIN_METHODS = 1, WMC = 1153.0, TCC = 0.0"", ""LONG_METHODS_CONNECTED = 30"", ""CC = 18.0"", ""CLOC > 500, TCC < 0.42461234036739287""]"
Researcher 1,apache_derby,20395,"[""Extract Method"", ""Extract Method"", ""Extract Method"", ""Extract Method"", ""Extract Method"", ""Extract Method""]","[""org.apache.derbyTesting.functionTests.tests.store.OnlineCompressTest"", ""org.apache.derbyTesting.functionTests.tests.store.OnlineCompressTest.row_count_based_tests(Connection,boolean,boolean,String,String,int)"", ""org.apache.derbyTesting.functionTests.tests.store.OnlineCompressTest.getSpaceInfo(Connection,String,String,boolean)"", ""org.apache.derbyTesting.functionTests.tests.store.OnlineCompressTest.callCompress(Connection,String,String,boolean,boolean,boolean,boolean)"", ""org.apache.derbyTesting.functionTests.tests.store.OnlineCompressTest.callCompress(Connection,String,String,boolean,boolean,boolean)""]","[""6885f5ccadd471cc33c19bdcca4271aa3086d3ca"", ""6885f5ccadd471cc33c19bdcca4271aa3086d3ca""]","[""FeatureEnvy"", ""LongMethod""]","[""6774b1e03ff4b55b43869c25e3913c15"", ""15c5a0b1b17d203141cbbf2a3e53fc8d""]","[268, 268]","[333, 333]","[""{\""MaxCallChain\"": 2.0, \""MethodLinesOfCode\"": 39.0, \""ParameterCount\"": 1.0, \""CyclomaticComplexity\"": 8.0, \""LocalityRatio\"": 0.0}"", ""{\""MaxCallChain\"": 2.0, \""MethodLinesOfCode\"": 39.0, \""ParameterCount\"": 1.0, \""CyclomaticComplexity\"": 8.0, \""LocalityRatio\"": 0.0}""]","[""965be700e2859b4ad642d59ded025cdb02e69b58"", ""965be700e2859b4ad642d59ded025cdb02e69b58"", ""965be700e2859b4ad642d59ded025cdb02e69b58""]","[""LongParameterList"", ""LongParameterList"", ""ComplexClass""]","[""50be1fc52ae104803b99be8ef46b926e"", ""4d2134068e41abf2d2a1797e6e7bcfc2"", ""1b77f0afeb08c596744e8459ce7c017e""]","[98, 45, 37]","[156, 74, 945]","[""PARAMETER_COUNT > 1.3093888866239987"", ""PARAMETER_COUNT > 1.3010977289898278"", ""CC = 11.0""]"
Researcher 1,apache_derby,20517,"[""Extract Method"", ""Extract Method"", ""Extract Method"", ""Extract Method""]","[""org.apache.derby.impl.services.cache.ConcurrentCache"", ""org.apache.derby.impl.services.cache.ConcurrentCache.find(Object)"", ""org.apache.derby.impl.services.cache.ConcurrentCache.initIdentity(CacheEntry,Object,Object,boolean)"", ""org.apache.derby.impl.services.cache.ConcurrentCache.create(Object,Object)""]","[""70fb06d172886bfc858232e08ecce80c0f380633"", ""70fb06d172886bfc858232e08ecce80c0f380633"", ""70fb06d172886bfc858232e08ecce80c0f380633"", ""70fb06d172886bfc858232e08ecce80c0f380633"", ""70fb06d172886bfc858232e08ecce80c0f380633"", ""70fb06d172886bfc858232e08ecce80c0f380633"", ""70fb06d172886bfc858232e08ecce80c0f380633"", ""70fb06d172886bfc858232e08ecce80c0f380633""]","[""GodClass"", ""ComplexClass"", ""SpaghettiCode"", ""FeatureEnvy"", ""LongMethod"", ""FeatureEnvy"", ""LongParameterList"", ""LongMethod""]","[""977278b19bb89a3a1b36e34474c32f2f"", ""53d808d9cd20d4adab33fb5b3845d235"", ""248b1c935ae8620a3c5984a641085097"", ""d9249517d922a5612a436922a58dfc2f"", ""fcf8bef4a1e83b270987053993f3592d"", ""2b0eadf14ac2a9ad045a9e84b8cee74f"", ""e8594ca446ef926a0b4285133c656868"", ""f1b677b5ed108ab76dff2fc4bf36cc7e""]","[65, 453, 64, 453, 453, 689, 1730, 1730]","[996, 756, 889, 756, 756, 720, 1838, 1838]","[""{\""IsAbstract\"": 0.0, \""ClassLinesOfCode\"": 558.0, \""OverrideRatio\"": 0.4, \""TightClassCohesion\"": 0.044897959183673466, \""PublicFieldCount\"": 0.0}"", ""{\""IsAbstract\"": 0.0, \""ClassLinesOfCode\"": 558.0, \""OverrideRatio\"": 0.4, \""TightClassCohesion\"": 0.044897959183673466, \""PublicFieldCount\"": 0.0}"", ""{\""IsAbstract\"": 0.0, \""ClassLinesOfCode\"": 455.0, \""OverrideRatio\"": 0.10526315789473684, \""TightClassCohesion\"": 0.1161524500907441, \""PublicFieldCount\"": 0.0}"", ""{\""MethodLinesOfCode\"": 195.0, \""LocalityRatio\"": 0.006329113924050633, \""CyclomaticComplexity\"": 72.0, \""ParameterCount\"": 0.0, \""MaxCallChain\"": 3.0}"", ""{\""MethodLinesOfCode\"": 195.0, \""LocalityRatio\"": 0.006329113924050633, \""CyclomaticComplexity\"": 72.0, \""ParameterCount\"": 0.0, \""MaxCallChain\"": 3.0}"", ""{\""MaxCallChain\"": 2.0, \""LocalityRatio\"": 0.11764705882352941, \""ParameterCount\"": 2.0, \""CyclomaticComplexity\"": 6.0, \""MethodLinesOfCode\"": 18.0}"", ""{\""LocalityRatio\"": 0.0, \""MaxCallChain\"": 2.0, \""ParameterCount\"": 4.0, \""CyclomaticComplexity\"": 19.0, \""MethodLinesOfCode\"": 65.0}"", ""{\""LocalityRatio\"": 0.0, \""MaxCallChain\"": 2.0, \""ParameterCount\"": 4.0, \""CyclomaticComplexity\"": 19.0, \""MethodLinesOfCode\"": 65.0}""]","[""df17cb0418910337b992ea435ba0f9a31062c861"", ""df17cb0418910337b992ea435ba0f9a31062c861""]","[""LongParameterList"", ""FeatureEnvy""]","[""0f02402eba1bc8f96d4f984a4ceac2ea"", ""15930d8e4727a02d3039dd099ed22670""]","[160, 160]","[208, 208]","[""PARAMETER_COUNT > 1.243991552978231"", ""CALLS_TO_org.apache.derby.impl.services.cache.CacheEntry > 4""]"
Researcher 1,apache_derby,20518,"[""Extract Method"", ""Extract Method"", ""Extract Method"", ""Extract Method"", ""Extract Method"", ""Extract Method""]","[""org.apache.derbyTesting.functionTests.tests.jdbcapi.DatabaseMetaDataTest"", ""org.apache.derbyTesting.functionTests.tests.jdbcapi.DatabaseMetaDataTest.testGetBestRowIdentifier2()"", ""org.apache.derbyTesting.functionTests.tests.jdbcapi.DatabaseMetaDataTest.assertBestRowIdentifierMetaDataResultSet(ResultSet,boolean)"", ""org.apache.derbyTesting.functionTests.tests.jdbcapi.DatabaseMetaDataTest.testGetBestRowIdentifier()"", ""org.apache.derbyTesting.functionTests.tests.jdbcapi.DatabaseMetaDataTest.verifyBRIResults(ResultSet,String,boolean)""]","[""70fb06d172886bfc858232e08ecce80c0f380633"", ""70fb06d172886bfc858232e08ecce80c0f380633"", ""70fb06d172886bfc858232e08ecce80c0f380633"", ""70fb06d172886bfc858232e08ecce80c0f380633"", ""70fb06d172886bfc858232e08ecce80c0f380633"", ""70fb06d172886bfc858232e08ecce80c0f380633"", ""70fb06d172886bfc858232e08ecce80c0f380633"", ""70fb06d172886bfc858232e08ecce80c0f380633""]","[""GodClass"", ""ComplexClass"", ""SpaghettiCode"", ""FeatureEnvy"", ""LongMethod"", ""FeatureEnvy"", ""LongParameterList"", ""LongMethod""]","[""977278b19bb89a3a1b36e34474c32f2f"", ""53d808d9cd20d4adab33fb5b3845d235"", ""248b1c935ae8620a3c5984a641085097"", ""d9249517d922a5612a436922a58dfc2f"", ""fcf8bef4a1e83b270987053993f3592d"", ""2b0eadf14ac2a9ad045a9e84b8cee74f"", ""e8594ca446ef926a0b4285133c656868"", ""f1b677b5ed108ab76dff2fc4bf36cc7e""]","[65, 453, 64, 453, 453, 689, 1730, 1730]","[996, 756, 889, 756, 756, 720, 1838, 1838]","[""{\""IsAbstract\"": 0.0, \""ClassLinesOfCode\"": 558.0, \""OverrideRatio\"": 0.4, \""TightClassCohesion\"": 0.044897959183673466, \""PublicFieldCount\"": 0.0}"", ""{\""IsAbstract\"": 0.0, \""ClassLinesOfCode\"": 558.0, \""OverrideRatio\"": 0.4, \""TightClassCohesion\"": 0.044897959183673466, \""PublicFieldCount\"": 0.0}"", ""{\""IsAbstract\"": 0.0, \""ClassLinesOfCode\"": 455.0, \""OverrideRatio\"": 0.10526315789473684, \""TightClassCohesion\"": 0.1161524500907441, \""PublicFieldCount\"": 0.0}"", ""{\""MethodLinesOfCode\"": 195.0, \""LocalityRatio\"": 0.006329113924050633, \""CyclomaticComplexity\"": 72.0, \""ParameterCount\"": 0.0, \""MaxCallChain\"": 3.0}"", ""{\""MethodLinesOfCode\"": 195.0, \""LocalityRatio\"": 0.006329113924050633, \""CyclomaticComplexity\"": 72.0, \""ParameterCount\"": 0.0, \""MaxCallChain\"": 3.0}"", ""{\""MaxCallChain\"": 2.0, \""LocalityRatio\"": 0.11764705882352941, \""ParameterCount\"": 2.0, \""CyclomaticComplexity\"": 6.0, \""MethodLinesOfCode\"": 18.0}"", ""{\""LocalityRatio\"": 0.0, \""MaxCallChain\"": 2.0, \""ParameterCount\"": 4.0, \""CyclomaticComplexity\"": 19.0, \""MethodLinesOfCode\"": 65.0}"", ""{\""LocalityRatio\"": 0.0, \""MaxCallChain\"": 2.0, \""ParameterCount\"": 4.0, \""CyclomaticComplexity\"": 19.0, \""MethodLinesOfCode\"": 65.0}""]","[""1a2a78d2b75092e6d49a8215d2ad607883aa0dbf"", ""1a2a78d2b75092e6d49a8215d2ad607883aa0dbf"", ""1a2a78d2b75092e6d49a8215d2ad607883aa0dbf"", ""1a2a78d2b75092e6d49a8215d2ad607883aa0dbf""]","[""SpaghettiCode"", ""ComplexClass"", ""GodClass"", ""LongMethod""]","[""e513e633bdc311525ccb84afd04da622"", ""61352f560b61d888490da48b9ed7c572"", ""0d57de5d87e7f70675ef7aad690d7c45"", ""97eb8461c7a5570bec5eeb4886faca72""]","[60, 60, 60, 3205]","[4600, 4600, 4600, 3447]","[""LONG_METHODS_CONNECTED = 19"", ""CC = 11.0"", ""CLOC > 500, TCC < 0.42023279267513525"", ""MLOC > 7.9366573574726615""]"
Researcher 1,apache_derby,20535,"[""Extract Method"", ""Extract Method"", ""Extract Method"", ""Extract Method""]","[""org.apache.derby.impl.services.cache.ClockPolicy"", ""org.apache.derby.impl.services.cache.ClockPolicy.shrinkMe()"", ""org.apache.derby.impl.services.cache.ClockPolicy.isEvictable(CacheEntry,Holder,boolean)"", ""org.apache.derby.impl.services.cache.ClockPolicy.rotateClock(CacheEntry,float,boolean)""]","[""270394a09fddda0ea9ffa2330956c5f399ab840f"", ""270394a09fddda0ea9ffa2330956c5f399ab840f"", ""270394a09fddda0ea9ffa2330956c5f399ab840f"", ""270394a09fddda0ea9ffa2330956c5f399ab840f"", ""270394a09fddda0ea9ffa2330956c5f399ab840f"", ""270394a09fddda0ea9ffa2330956c5f399ab840f"", ""270394a09fddda0ea9ffa2330956c5f399ab840f""]","[""FeatureEnvy"", ""FeatureEnvy"", ""ClassDataShouldBePrivate"", ""FeatureEnvy"", ""FeatureEnvy"", ""FeatureEnvy"", ""FeatureEnvy""]","[""5b0a6c0e93e86b4e08e572258d2f72fd"", ""c773c5dd84c9580dd8f89b07ffa845d2"", ""ca3d844f7b39fb65cef64bf84e9ba6d1"", ""8d59b298f8de886bc366609282a39d80"", ""6b4708995818df9c635609bb3ab0a35b"", ""706c9302dd8042a0119cee4f7d40e621"", ""aeecffbfecbdf2e3c78cb43b1c3d6d29""]","[312, 297, 74, 284, 228, 241, 269]","[327, 310, 428, 295, 239, 252, 282]","[""{\""MaxCallChain\"": 1.0, \""LocalityRatio\"": 0.0, \""ParameterCount\"": 0.0, \""CyclomaticComplexity\"": 1.0, \""MethodLinesOfCode\"": 6.0}"", ""{\""MaxCallChain\"": 1.0, \""LocalityRatio\"": 0.0, \""ParameterCount\"": 0.0, \""CyclomaticComplexity\"": 1.0, \""MethodLinesOfCode\"": 6.0}"", ""{\""IsAbstract\"": 0.0, \""ClassLinesOfCode\"": 97.0, \""OverrideRatio\"": 0.08333333333333333, \""PublicFieldCount\"": 8.0, \""TightClassCohesion\"": 0.5494505494505495}"", ""{\""MaxCallChain\"": 1.0, \""LocalityRatio\"": 0.0, \""ParameterCount\"": 0.0, \""CyclomaticComplexity\"": 1.0, \""MethodLinesOfCode\"": 5.0}"", ""{\""MaxCallChain\"": 1.0, \""LocalityRatio\"": 0.0, \""ParameterCount\"": 0.0, \""CyclomaticComplexity\"": 1.0, \""MethodLinesOfCode\"": 5.0}"", ""{\""MaxCallChain\"": 1.0, \""LocalityRatio\"": 0.0, \""ParameterCount\"": 0.0, \""CyclomaticComplexity\"": 1.0, \""MethodLinesOfCode\"": 5.0}"", ""{\""MaxCallChain\"": 1.0, \""LocalityRatio\"": 0.0, \""ParameterCount\"": 0.0, \""CyclomaticComplexity\"": 1.0, \""MethodLinesOfCode\"": 6.0}""]","[""0b57378ce7dc26f084b7750493bc259ee665f3e2"", ""0b57378ce7dc26f084b7750493bc259ee665f3e2"", ""0b57378ce7dc26f084b7750493bc259ee665f3e2"", ""0b57378ce7dc26f084b7750493bc259ee665f3e2"", ""0b57378ce7dc26f084b7750493bc259ee665f3e2"", ""0b57378ce7dc26f084b7750493bc259ee665f3e2""]","[""SpaghettiCode"", ""DispersedCoupling"", ""LongMethod"", ""IntensiveCoupling"", ""LongMethod"", ""FeatureEnvy""]","[""db59e9f1eafb2d5698d0a91f5e972cad"", ""6a1239a39599b8dbb4e654022599a400"", ""9e6de1b0d5803e0f975886211ad1d554"", ""ddf6e47aecaca015f332e367f7399576"", ""328302df9d10a3bcf8a8cc68d7d2d951"", ""bc3911099b4b5884a086588d4973995e""]","[31, 565, 565, 356, 356, 356]","[661, 660, 660, 470, 470, 470]","[""LONG_METHODS_CONNECTED = 2"", ""CINT > 8.0, CDISP > 0.5, CC > 1.0"", ""MLOC > 8.179232886996653"", ""CINT = 15.0, CDISP = 0.4, CC > 1.0"", ""MLOC > 8.178639621873474"", ""CALLS_TO_org.apache.derby.impl.services.cache.CacheEntry > 4""]"
Researcher 1,apache_derby,20572,"[""Extract Method"", ""Extract Method"", ""Extract Method"", ""Extract Method"", ""Extract Method"", ""Extract Method"", ""Extract Method"", ""Extract Method"", ""Rename Method"", ""Rename Method"", ""Rename Method"", ""Rename Method"", ""Rename Method"", ""Rename Method"", ""Pull Up Method"", ""Pull Up Method"", ""Extract Method"", ""Extract Method"", ""Rename Method"", ""Rename Method"", ""Extract Method"", ""Extract Method"", ""Rename Method"", ""Rename Method"", ""Extract Method"", ""Extract Method"", ""Extract Method"", ""Extract Method"", ""Extract Method"", ""Extract Method"", ""Extract Method"", ""Extract Method"", ""Extract Method"", ""Extract Method""]","[""org.apache.derbyTesting.functionTests.tests.replicationTests.ReplicationRun.runStateTest(String,String,String,String,int,String)"", ""org.apache.derbyTesting.functionTests.tests.replicationTests.ReplicationRun"", ""org.apache.derbyTesting.functionTests.tests.replicationTests.ReplicationRun.masterLoadURL(String)"", ""org.apache.derbyTesting.functionTests.tests.replicationTests.ReplicationRun.runLoad(String,String,String,String,int,String)"", ""org.apache.derbyTesting.functionTests.tests.replicationTests.ReplicationRun.startLoad(String,String,String,boolean,String,String,int)"", ""org.apache.derbyTesting.functionTests.tests.replicationTests.ReplicationRun.masterURL(String)"", ""org.apache.derbyTesting.functionTests.tests.replicationTests.ReplicationRun.startMaster_ij(String,String,int,String,int,String)"", ""org.apache.derbyTesting.functionTests.tests.replicationTests.ReplicationRun_Local_StateTest_part2.startSlave(String,int,String,String,int)"", ""org.apache.derbyTesting.functionTests.tests.replicationTests.ReplicationRun_Local_StateTest_part2"", ""org.apache.derbyTesting.functionTests.tests.replicationTests.ReplicationRun_Local_StateTest_part2._startSlave(String,int,String,String,int)"", ""org.apache.derbyTesting.functionTests.tests.replicationTests.ReplicationRun_Local_StateTest_part2.stopSlave(String,int,String,String,int)"", ""org.apache.derbyTesting.functionTests.tests.replicationTests.ReplicationRun_Local_StateTest_part2._stopSlave(String,int,String,String,int)"", ""org.apache.derbyTesting.functionTests.tests.replicationTests.ReplicationRun_Local_StateTest_part2.failOver(String,int,String,String,String)"", ""org.apache.derbyTesting.functionTests.tests.replicationTests.ReplicationRun_Local_StateTest_part2._failOver(String,int,String,String,String)"", ""org.apache.derbyTesting.functionTests.tests.replicationTests.ReplicationRun_Local_StateTest_part2.getConnection(String,int,String,String,String)"", ""org.apache.derbyTesting.functionTests.tests.replicationTests.ReplicationRun.getConnection(String,int,String,String,String)"", ""org.apache.derbyTesting.functionTests.tests.replicationTests.ReplicationRun.runTestOnSlave(String,String,String,String,int,String)"", ""org.apache.derbyTesting.functionTests.tests.replicationTests.ReplicationRun.slaveURL(String)"", ""org.apache.derbyTesting.functionTests.tests.replicationTests.ReplicationRun_Local_StateTest_part2.executeQuery(Connection,String)"", ""org.apache.derbyTesting.functionTests.tests.replicationTests.ReplicationRun_Local_StateTest_part2._executeQuery(Connection,String)"", ""org.apache.derbyTesting.functionTests.tests.replicationTests.ReplicationRun.startMaster_direct(String,String,int,String,int)"", ""org.apache.derbyTesting.functionTests.tests.replicationTests.ReplicationRun_Local_StateTest_part2.startMaster(String,int,String,String,String,int)"", ""org.apache.derbyTesting.functionTests.tests.replicationTests.ReplicationRun_Local_StateTest_part2._startMaster(String,int,String,String,String,int)"", ""org.apache.derbyTesting.functionTests.tests.replicationTests.ReplicationRun.runTest(String,String,String,String,int,String)"", ""org.apache.derbyTesting.functionTests.tests.replicationTests.ReplicationRun.getMasterConnection()"", ""org.apache.derbyTesting.functionTests.tests.replicationTests.ReplicationRun.bootMasterDatabase(String,String,String,String,int,String)"", ""org.apache.derbyTesting.functionTests.tests.replicationTests.ReplicationRun.stopSlave_ij(String,String,String,int,String)"", ""org.apache.derbyTesting.functionTests.tests.replicationTests.ReplicationRun.stopMaster_ij(String,String,String,int,String)""]","[""d928ea97f2a6d49a8ceb9d130d2ef1a8e1440e79"", ""d928ea97f2a6d49a8ceb9d130d2ef1a8e1440e79"", ""d928ea97f2a6d49a8ceb9d130d2ef1a8e1440e79"", ""d928ea97f2a6d49a8ceb9d130d2ef1a8e1440e79"", ""d928ea97f2a6d49a8ceb9d130d2ef1a8e1440e79"", ""d928ea97f2a6d49a8ceb9d130d2ef1a8e1440e79"", ""d928ea97f2a6d49a8ceb9d130d2ef1a8e1440e79"", ""d928ea97f2a6d49a8ceb9d130d2ef1a8e1440e79"", ""d928ea97f2a6d49a8ceb9d130d2ef1a8e1440e79"", ""d928ea97f2a6d49a8ceb9d130d2ef1a8e1440e79""]","[""SpaghettiCode"", ""ComplexClass"", ""FeatureEnvy"", ""FeatureEnvy"", ""ComplexClass"", ""FeatureEnvy"", ""FeatureEnvy"", ""FeatureEnvy"", ""FeatureEnvy"", ""FeatureEnvy""]","[""8c0784d3f4293fc312a26f7b3d5a7788"", ""7632160dc1bf1eea4e3d3d47d22448d6"", ""13d681acb310d9f22109c630bddaa78e"", ""a088e6ce0d5ede7d20a515be96200c84"", ""ca4874f5988c54bf0909731795c24fab"", ""6bd9ee540799ab0ad1ea03b3f0bc4550"", ""a3016c8d1f1c2705b7805a4c0e816e2d"", ""5aac4c7f587ec953f608203b1e36bc0c"", ""d16a2b5af00e381c652d2e91095de2f0"", ""bfa7b11f8b8aef4bdb4f163cd1b48626""]","[66, 625, 269, 475, 277, 427, 161, 113, 318, 583]","[701, 699, 316, 516, 409, 473, 202, 159, 360, 623]","[""{\""IsAbstract\"": 0.0, \""ClassLinesOfCode\"": 374.0, \""OverrideRatio\"": null, \""TightClassCohesion\"": 0.8333333333333334, \""PublicFieldCount\"": 0.0}"", ""{\""IsAbstract\"": 0.0, \""ClassLinesOfCode\"": 374.0, \""OverrideRatio\"": null, \""TightClassCohesion\"": 0.8333333333333334, \""PublicFieldCount\"": 0.0}"", ""{\""LocalityRatio\"": 0.0, \""MaxCallChain\"": 2.0, \""ParameterCount\"": 0.0, \""CyclomaticComplexity\"": 4.0, \""MethodLinesOfCode\"": 27.0}"", ""{\""LocalityRatio\"": 0.0, \""MaxCallChain\"": 2.0, \""ParameterCount\"": 0.0, \""CyclomaticComplexity\"": 4.0, \""MethodLinesOfCode\"": 23.0}"", ""{\""IsAbstract\"": 0.0, \""ClassLinesOfCode\"": 331.0, \""OverrideRatio\"": null, \""PublicFieldCount\"": 0.0, \""TightClassCohesion\"": 0.14285714285714285}"", ""{\""LocalityRatio\"": 0.0, \""MaxCallChain\"": 2.0, \""ParameterCount\"": 0.0, \""CyclomaticComplexity\"": 4.0, \""MethodLinesOfCode\"": 26.0}"", ""{\""LocalityRatio\"": 0.0, \""MaxCallChain\"": 2.0, \""ParameterCount\"": 0.0, \""CyclomaticComplexity\"": 4.0, \""MethodLinesOfCode\"": 24.0}"", ""{\""LocalityRatio\"": 0.0, \""MaxCallChain\"": 2.0, \""ParameterCount\"": 0.0, \""CyclomaticComplexity\"": 4.0, \""MethodLinesOfCode\"": 27.0}"", ""{\""LocalityRatio\"": 0.0, \""MaxCallChain\"": 2.0, \""ParameterCount\"": 0.0, \""CyclomaticComplexity\"": 4.0, \""MethodLinesOfCode\"": 24.0}"", ""{\""LocalityRatio\"": 0.0, \""MaxCallChain\"": 1.0, \""ParameterCount\"": 0.0, \""CyclomaticComplexity\"": 4.0, \""MethodLinesOfCode\"": 23.0}""]","[""c5935add096a51f769aee0f6e3aac74c260b4212"", ""c5935add096a51f769aee0f6e3aac74c260b4212"", ""c5935add096a51f769aee0f6e3aac74c260b4212"", ""c5935add096a51f769aee0f6e3aac74c260b4212"", ""c5935add096a51f769aee0f6e3aac74c260b4212"", ""c5935add096a51f769aee0f6e3aac74c260b4212"", ""c5935add096a51f769aee0f6e3aac74c260b4212"", ""c5935add096a51f769aee0f6e3aac74c260b4212"", ""c5935add096a51f769aee0f6e3aac74c260b4212"", ""c5935add096a51f769aee0f6e3aac74c260b4212"", ""c5935add096a51f769aee0f6e3aac74c260b4212"", ""c5935add096a51f769aee0f6e3aac74c260b4212"", ""c5935add096a51f769aee0f6e3aac74c260b4212"", ""c5935add096a51f769aee0f6e3aac74c260b4212"", ""c5935add096a51f769aee0f6e3aac74c260b4212"", ""c5935add096a51f769aee0f6e3aac74c260b4212"", ""c5935add096a51f769aee0f6e3aac74c260b4212"", ""c5935add096a51f769aee0f6e3aac74c260b4212"", ""c5935add096a51f769aee0f6e3aac74c260b4212"", ""c5935add096a51f769aee0f6e3aac74c260b4212"", ""c5935add096a51f769aee0f6e3aac74c260b4212"", ""c5935add096a51f769aee0f6e3aac74c260b4212"", ""c5935add096a51f769aee0f6e3aac74c260b4212""]","[""LongParameterList"", ""LongParameterList"", ""FeatureEnvy"", ""LongParameterList"", ""LongParameterList"", ""ShotgunSurgery"", ""LongParameterList"", ""LongParameterList"", ""LongParameterList"", ""LongParameterList"", ""LongParameterList"", ""LongParameterList"", ""LongParameterList"", ""ShotgunSurgery"", ""LongParameterList"", ""SpaghettiCode"", ""ComplexClass"", ""LongParameterList"", ""DispersedCoupling"", ""LongParameterList"", ""LongMethod"", ""FeatureEnvy"", ""LongParameterList""]","[""dce17754295d276019ba2ddaba6c3ade"", ""a1ddc0f6f918ab379d7d8fb5d9d623b2"", ""12c64c3d24bdba58c55c8383b8467a59"", ""f2adc51e6bb8ec6e477f07b755fa72cb"", ""0b6a46cb20a6a4a74c56e842e1f39ff2"", ""ae4a971d15e0545e668480074b526b12"", ""fbe08c19971adc2ae9a3b213b51e5e24"", ""45f0ce5f59dca40c6d9a7e35d5221ac2"", ""db68b758c6dac8f4028b9620f15fb92b"", ""f459a7d8bd572d70a6a5e7ae0e0192e5"", ""71a7a1b2b5fca30c6b7a04e1970dd7dc"", ""9d1ebd4d8cf722804906f678a4612a73"", ""ae623407f4a1dccf4de4d14e5007f589"", ""47e7ed9ce3eefdbff497b40250ae7626"", ""1bf44b2578ef15364922030222e268dc"", ""e8ea4a9a374e0ea3d899d04fa8d25a46"", ""09ccd218baea0722d85c3c413650a9f7"", ""a44ace3140ba0f2d837d33ea9cdcff1f"", ""d37416fd3e3bb71caf25d2eb0faf9427"", ""0efa7b50fbfd8e4343beb41b32ddf50e"", ""8eaafbe8c2aba548e1f52a0be69525cc"", ""340a94716de9aa4b50d88e7dd0c80f0c"", ""2168613d533bc3534f47cac8b763d86b""]","[1281, 505, 505, 312, 674, 744, 744, 2789, 336, 288, 914, 357, 1411, 418, 418, 35, 35, 3465, 946, 946, 946, 946, 695]","[1317, 590, 590, 334, 742, 829, 829, 2845, 355, 310, 956, 380, 1451, 504, 504, 3503, 3503, 3475, 1021, 1021, 1021, 1021, 766]","[""PARAMETER_COUNT > 1.1944720985066999"", ""PARAMETER_COUNT > 1.1944720985066999"", ""CALLS_TO_org.apache.derbyTesting.functionTests.tests.replicationTests.Utils > 4"", ""PARAMETER_COUNT > 1.1944720985066999"", ""PARAMETER_COUNT > 1.1944720985066999"", ""CM > 8.0, CC > 6.0"", ""PARAMETER_COUNT > 1.1944720985066999"", ""PARAMETER_COUNT > 1.1944720985066999"", ""PARAMETER_COUNT > 1.1944720985066999"", ""PARAMETER_COUNT > 1.1944720985066999"", ""PARAMETER_COUNT > 1.1944720985066999"", ""PARAMETER_COUNT > 1.1944720985066999"", ""PARAMETER_COUNT > 1.1944720985066999"", ""CM > 8.0, CC > 6.0"", ""PARAMETER_COUNT > 1.1944720985066999"", ""LONG_METHODS_CONNECTED = 6"", ""CC = 11.0"", ""PARAMETER_COUNT > 1.1944720985066999"", ""CINT > 8.0, CDISP > 0.5, CC > 1.0"", ""PARAMETER_COUNT > 1.1953917533880227"", ""MLOC > 7.578442423129675"", ""CALLS_TO_org.apache.derbyTesting.functionTests.tests.replicationTests.Utils > 7"", ""PARAMETER_COUNT > 1.1765482829468539""]"
Researcher 1,apache_derby,20606,"[""Inline Method"", ""Inline Method"", ""Extract Method"", ""Extract Method""]","[""org.apache.derby.impl.sql.compile.CreateTriggerNode"", ""org.apache.derby.impl.sql.compile.CreateTriggerNode.bindReferencesClause(DataDictionary)"", ""org.apache.derby.impl.sql.compile.CreateTriggerNode.genColumnReferenceSQL(DataDictionary,String,String,boolean)"", ""org.apache.derby.impl.sql.compile.CreateTriggerNode.genColumnReferenceSQL(DataDictionary,String,String,boolean,int)""]","[""d928ea97f2a6d49a8ceb9d130d2ef1a8e1440e79"", ""d928ea97f2a6d49a8ceb9d130d2ef1a8e1440e79"", ""d928ea97f2a6d49a8ceb9d130d2ef1a8e1440e79"", ""d928ea97f2a6d49a8ceb9d130d2ef1a8e1440e79"", ""d928ea97f2a6d49a8ceb9d130d2ef1a8e1440e79"", ""d928ea97f2a6d49a8ceb9d130d2ef1a8e1440e79"", ""d928ea97f2a6d49a8ceb9d130d2ef1a8e1440e79"", ""d928ea97f2a6d49a8ceb9d130d2ef1a8e1440e79"", ""d928ea97f2a6d49a8ceb9d130d2ef1a8e1440e79"", ""d928ea97f2a6d49a8ceb9d130d2ef1a8e1440e79""]","[""SpaghettiCode"", ""ComplexClass"", ""FeatureEnvy"", ""FeatureEnvy"", ""ComplexClass"", ""FeatureEnvy"", ""FeatureEnvy"", ""FeatureEnvy"", ""FeatureEnvy"", ""FeatureEnvy""]","[""8c0784d3f4293fc312a26f7b3d5a7788"", ""7632160dc1bf1eea4e3d3d47d22448d6"", ""13d681acb310d9f22109c630bddaa78e"", ""a088e6ce0d5ede7d20a515be96200c84"", ""ca4874f5988c54bf0909731795c24fab"", ""6bd9ee540799ab0ad1ea03b3f0bc4550"", ""a3016c8d1f1c2705b7805a4c0e816e2d"", ""5aac4c7f587ec953f608203b1e36bc0c"", ""d16a2b5af00e381c652d2e91095de2f0"", ""bfa7b11f8b8aef4bdb4f163cd1b48626""]","[66, 625, 269, 475, 277, 427, 161, 113, 318, 583]","[701, 699, 316, 516, 409, 473, 202, 159, 360, 623]","[""{\""IsAbstract\"": 0.0, \""ClassLinesOfCode\"": 374.0, \""OverrideRatio\"": null, \""TightClassCohesion\"": 0.8333333333333334, \""PublicFieldCount\"": 0.0}"", ""{\""IsAbstract\"": 0.0, \""ClassLinesOfCode\"": 374.0, \""OverrideRatio\"": null, \""TightClassCohesion\"": 0.8333333333333334, \""PublicFieldCount\"": 0.0}"", ""{\""LocalityRatio\"": 0.0, \""MaxCallChain\"": 2.0, \""ParameterCount\"": 0.0, \""CyclomaticComplexity\"": 4.0, \""MethodLinesOfCode\"": 27.0}"", ""{\""LocalityRatio\"": 0.0, \""MaxCallChain\"": 2.0, \""ParameterCount\"": 0.0, \""CyclomaticComplexity\"": 4.0, \""MethodLinesOfCode\"": 23.0}"", ""{\""IsAbstract\"": 0.0, \""ClassLinesOfCode\"": 331.0, \""OverrideRatio\"": null, \""PublicFieldCount\"": 0.0, \""TightClassCohesion\"": 0.14285714285714285}"", ""{\""LocalityRatio\"": 0.0, \""MaxCallChain\"": 2.0, \""ParameterCount\"": 0.0, \""CyclomaticComplexity\"": 4.0, \""MethodLinesOfCode\"": 26.0}"", ""{\""LocalityRatio\"": 0.0, \""MaxCallChain\"": 2.0, \""ParameterCount\"": 0.0, \""CyclomaticComplexity\"": 4.0, \""MethodLinesOfCode\"": 24.0}"", ""{\""LocalityRatio\"": 0.0, \""MaxCallChain\"": 2.0, \""ParameterCount\"": 0.0, \""CyclomaticComplexity\"": 4.0, \""MethodLinesOfCode\"": 27.0}"", ""{\""LocalityRatio\"": 0.0, \""MaxCallChain\"": 2.0, \""ParameterCount\"": 0.0, \""CyclomaticComplexity\"": 4.0, \""MethodLinesOfCode\"": 24.0}"", ""{\""LocalityRatio\"": 0.0, \""MaxCallChain\"": 1.0, \""ParameterCount\"": 0.0, \""CyclomaticComplexity\"": 4.0, \""MethodLinesOfCode\"": 23.0}""]","[""a6f95866d866b55121220657cf2cb25110486f81"", ""a6f95866d866b55121220657cf2cb25110486f81"", ""a6f95866d866b55121220657cf2cb25110486f81"", ""a6f95866d866b55121220657cf2cb25110486f81"", ""a6f95866d866b55121220657cf2cb25110486f81"", ""a6f95866d866b55121220657cf2cb25110486f81"", ""a6f95866d866b55121220657cf2cb25110486f81""]","[""SpaghettiCode"", ""ComplexClass"", ""IntensiveCoupling"", ""MessageChain"", ""LongMethod"", ""FeatureEnvy"", ""LongParameterList""]","[""f2bda320e16b6b816f81473bd6ccd306"", ""37000e4947a027b193dceebdc65cedbc"", ""1dfe7be046e4568e69543715a7d4e6aa"", ""ccfc47c4e9369ca8bd15f39ae02c1c3e"", ""9a6762f2bd507d96147f2187501ac3b0"", ""e74121593e3d8e2abe3cddaace2c9043"", ""aebe88f72a371b20a4b5cdb99f90e213""]","[51, 51, 536, 536, 519, 510, 1094]","[1260, 1260, 952, 952, 641, 666, 1197]","[""LONG_METHODS_CONNECTED = 2"", ""CC = 11.0"", ""CINT = 28.0, CDISP = 0.4642857142857143, CC > 1.0"", ""MAX_CALL_CHAIN = 4.0"", ""MLOC > 8.104169696969771"", ""CALLS_TO_org.apache.derby.impl.sql.compile.QueryTreeNode > 5"", ""PARAMETER_COUNT > 1.183330410602007""]"
Researcher 1,apache_derby,20620,"[""Extract Method"", ""Extract Method"", ""Inline Method"", ""Inline Method""]","[""org.apache.derby.impl.sql.execute.AlterTableConstantAction"", ""org.apache.derby.impl.sql.execute.AlterTableConstantAction.updateStatistics(Activation)"", ""org.apache.derby.impl.sql.execute.AlterTableConstantAction.compressTable()"", ""org.apache.derby.impl.sql.execute.AlterTableConstantAction.compressTable(Activation)"", ""org.apache.derby.impl.sql.execute.AlterTableConstantAction.executeConstantAction(Activation)""]","[""5dfe6fa771e47cc0c9af2a17f06cb0b5bac29b9e"", ""5dfe6fa771e47cc0c9af2a17f06cb0b5bac29b9e"", ""5dfe6fa771e47cc0c9af2a17f06cb0b5bac29b9e"", ""5dfe6fa771e47cc0c9af2a17f06cb0b5bac29b9e""]","[""FeatureEnvy"", ""FeatureEnvy"", ""FeatureEnvy"", ""FeatureEnvy""]","[""0cd4a69d20bedc8688d7459b6762f350"", ""5310c2518577b95d1724176b8426030f"", ""8186b51a8c6af8b839f3093f70339c70"", ""c5fa1450c88b5aade3bd1456c7e1c9ea""]","[81, 119, 106, 96]","[94, 127, 114, 104]","[""{\""MaxCallChain\"": 3.0, \""MethodLinesOfCode\"": 10.0, \""ParameterCount\"": 1.0, \""CyclomaticComplexity\"": 4.0, \""LocalityRatio\"": 0.0}"", ""{\""MaxCallChain\"": 2.0, \""MethodLinesOfCode\"": 7.0, \""ParameterCount\"": 1.0, \""CyclomaticComplexity\"": 2.0, \""LocalityRatio\"": 0.25}"", ""{\""MaxCallChain\"": 2.0, \""MethodLinesOfCode\"": 7.0, \""ParameterCount\"": 2.0, \""CyclomaticComplexity\"": 2.0, \""LocalityRatio\"": 0.2}"", ""{\""MaxCallChain\"": 2.0, \""MethodLinesOfCode\"": 7.0, \""ParameterCount\"": 1.0, \""CyclomaticComplexity\"": 2.0, \""LocalityRatio\"": 0.0}""]","[""b1977cf5c05bb4b75ec3ef617b9fa44c2adf28bd"", ""b1977cf5c05bb4b75ec3ef617b9fa44c2adf28bd"", ""b1977cf5c05bb4b75ec3ef617b9fa44c2adf28bd"", ""b1977cf5c05bb4b75ec3ef617b9fa44c2adf28bd"", ""b1977cf5c05bb4b75ec3ef617b9fa44c2adf28bd"", ""b1977cf5c05bb4b75ec3ef617b9fa44c2adf28bd"", ""b1977cf5c05bb4b75ec3ef617b9fa44c2adf28bd"", ""b1977cf5c05bb4b75ec3ef617b9fa44c2adf28bd"", ""b1977cf5c05bb4b75ec3ef617b9fa44c2adf28bd"", ""b1977cf5c05bb4b75ec3ef617b9fa44c2adf28bd"", ""b1977cf5c05bb4b75ec3ef617b9fa44c2adf28bd"", ""b1977cf5c05bb4b75ec3ef617b9fa44c2adf28bd"", ""b1977cf5c05bb4b75ec3ef617b9fa44c2adf28bd""]","[""IntensiveCoupling"", ""LongMethod"", ""FeatureEnvy"", ""IntensiveCoupling"", ""LongMethod"", ""FeatureEnvy"", ""IntensiveCoupling"", ""LongMethod"", ""IntensiveCoupling"", ""LongMethod"", ""SpaghettiCode"", ""ComplexClass"", ""GodClass""]","[""54cd148ebb3f04238e21f9234b80da25"", ""d3f33667fd32ff5e6d73788cfc1414fd"", ""d4a746f585e14aef6380698afa41b9c3"", ""54cd148ebb3f04238e21f9234b80da25"", ""d3f33667fd32ff5e6d73788cfc1414fd"", ""d4a746f585e14aef6380698afa41b9c3"", ""524904b2d7c8f0f04b50e0f9062c5713"", ""4b30af0c6c2d4906205b4ab53e35e4a1"", ""524904b2d7c8f0f04b50e0f9062c5713"", ""4b30af0c6c2d4906205b4ab53e35e4a1"", ""3c975593f6a50cd5c71bebac179ea33b"", ""9124dcd8703db100c93c87b7ced0241e"", ""c6588047bdedfb938b8a3825b3c180c7""]","[1955, 1955, 1955, 1955, 1955, 1955, 268, 268, 268, 268, 83, 83, 83]","[2131, 2131, 2131, 2131, 2131, 2131, 621, 621, 621, 621, 2533, 2533, 2533]","[""CINT = 32.0, CDISP = 0.4375, CC > 1.0"", ""MLOC > 7.837528831130841"", ""CALLS_TO_org.apache.derby.iapi.sql.dictionary.TableDescriptor > 7"", ""CINT = 32.0, CDISP = 0.4375, CC > 1.0"", ""MLOC > 7.837528831130841"", ""CALLS_TO_org.apache.derby.iapi.sql.dictionary.TableDescriptor > 7"", ""CINT = 38.0, CDISP = 0.3684210526315789, CC > 1.0"", ""MLOC > 7.837528831130841"", ""CINT = 38.0, CDISP = 0.3684210526315789, CC > 1.0"", ""MLOC > 7.837528831130841"", ""LONG_METHODS_CONNECTED = 6"", ""CC = 47.0"", ""CLOC > 500, TCC < 0.4276029126892707""]"
Researcher 1,apache_derby,20623,"[""Extract Method"", ""Extract Method"", ""Extract Method"", ""Extract Method""]","[""org.apache.derby.impl.sql.depend.BasicDependencyMResearcher 1ger"", ""org.apache.derby.impl.sql.depend.BasicDependencyMResearcher 1ger.addDependency(Dependent,Provider,ContextMResearcher 1ger,TransactionController)"", ""org.apache.derby.impl.sql.depend.BasicDependencyMResearcher 1ger.addInMemoryDependency(Dependent,Provider,ContextMResearcher 1ger)"", ""org.apache.derby.impl.sql.depend.BasicDependencyMResearcher 1ger.addStoredDependency(Dependent,Provider,ContextMResearcher 1ger,TransactionController)""]","[""dc596b13c69420b5790c18872005420d6b743621"", ""dc596b13c69420b5790c18872005420d6b743621"", ""dc596b13c69420b5790c18872005420d6b743621"", ""dc596b13c69420b5790c18872005420d6b743621"", ""dc596b13c69420b5790c18872005420d6b743621"", ""dc596b13c69420b5790c18872005420d6b743621"", ""dc596b13c69420b5790c18872005420d6b743621"", ""dc596b13c69420b5790c18872005420d6b743621""]","[""FeatureEnvy"", ""FeatureEnvy"", ""ComplexClass"", ""FeatureEnvy"", ""FeatureEnvy"", ""FeatureEnvy"", ""FeatureEnvy"", ""FeatureEnvy""]","[""c61782033546348567ebc15dd5600880"", ""e50aeed4f34bc5fc2d21447be77a56eb"", ""d0a64322047912ccd1faaef20f2190e8"", ""a448176e77e4a200927a386f7018f54d"", ""0ae5d124209c67122ee0c46a9036cd30"", ""f3af2de154be44645e3a86c8d6cdda0b"", ""ad7a8f3a6216a95e480cd344568611a3"", ""e834808695bc1795f6e9a0f420c5843a""]","[681, 744, 371, 752, 704, 657, 673, 775]","[694, 750, 444, 765, 710, 663, 679, 781]","[""{\""ParameterCount\"": 2.0, \""MethodLinesOfCode\"": 10.0, \""LocalityRatio\"": 0.3333333333333333, \""CyclomaticComplexity\"": 4.0, \""MaxCallChain\"": 1.0}"", ""{\""ParameterCount\"": 3.0, \""MethodLinesOfCode\"": 5.0, \""LocalityRatio\"": 0.3333333333333333, \""CyclomaticComplexity\"": 2.0, \""MaxCallChain\"": 1.0}"", ""{\""IsAbstract\"": 0.0, \""ClassLinesOfCode\"": 456.0, \""OverrideRatio\"": null, \""TightClassCohesion\"": 0.0889240506329114, \""PublicFieldCount\"": 0.0}"", ""{\""ParameterCount\"": 3.0, \""MethodLinesOfCode\"": 10.0, \""LocalityRatio\"": 0.3333333333333333, \""CyclomaticComplexity\"": 4.0, \""MaxCallChain\"": 1.0}"", ""{\""ParameterCount\"": 2.0, \""MethodLinesOfCode\"": 5.0, \""LocalityRatio\"": 0.3333333333333333, \""CyclomaticComplexity\"": 2.0, \""MaxCallChain\"": 1.0}"", ""{\""ParameterCount\"": 2.0, \""MethodLinesOfCode\"": 5.0, \""LocalityRatio\"": 0.3333333333333333, \""CyclomaticComplexity\"": 2.0, \""MaxCallChain\"": 1.0}"", ""{\""ParameterCount\"": 2.0, \""MethodLinesOfCode\"": 5.0, \""LocalityRatio\"": 0.3333333333333333, \""CyclomaticComplexity\"": 2.0, \""MaxCallChain\"": 1.0}"", ""{\""ParameterCount\"": 3.0, \""MethodLinesOfCode\"": 5.0, \""LocalityRatio\"": 0.3333333333333333, \""CyclomaticComplexity\"": 2.0, \""MaxCallChain\"": 1.0}""]","[""7eb8268695821336631b85f1ebcadab95e28aee4"", ""7eb8268695821336631b85f1ebcadab95e28aee4"", ""7eb8268695821336631b85f1ebcadab95e28aee4"", ""7eb8268695821336631b85f1ebcadab95e28aee4""]","[""ComplexClass"", ""LongParameterList"", ""LongParameterList"", ""LongParameterList""]","[""07cb91662fea60a4bb09072493dce69f"", ""80bbc671e3effeca1083267add522964"", ""80bbc671e3effeca1083267add522964"", ""8cab6bbb16332c08ed4421871ed9cfac""]","[72, 133, 133, 204]","[1391, 157, 157, 232]","[""CC = 25.0"", ""PARAMETER_COUNT > 1.180098316698937"", ""PARAMETER_COUNT > 1.180098316698937"", ""PARAMETER_COUNT > 1.180098316698937""]"
Researcher 1,apache_derby,20632,"[""Extract Method"", ""Extract Method"", ""Extract Method"", ""Extract Method""]","[""org.apache.derby.impl.sql.catalog.DataDictionaryImpl.updateCurrentSequenceValue(TransactionController,RowLocation,boolean,Long,Long)"", ""org.apache.derby.impl.sql.catalog.DataDictionaryImpl"", ""org.apache.derby.impl.sql.catalog.DataDictionaryImpl.updateCurrentSeqValue(TransactionController,RowLocation,boolean,Long,Long,TabInfoImpl,int,int)"", ""org.apache.derby.impl.sql.catalog.DataDictionaryImpl.getSetAutoincrementValue(RowLocation,TransactionController,boolean,NumberDataValue,boolean)"", ""org.apache.derby.impl.sql.catalog.DataDictionaryImpl.computeIdentityRowLocation(TransactionController,TableDescriptor)""]","[""dc2941d6045de8ed539758dc8c81946d27cec1ae"", ""dc2941d6045de8ed539758dc8c81946d27cec1ae"", ""dc2941d6045de8ed539758dc8c81946d27cec1ae"", ""dc2941d6045de8ed539758dc8c81946d27cec1ae"", ""dc2941d6045de8ed539758dc8c81946d27cec1ae""]","[""FeatureEnvy"", ""ComplexClass"", ""GodClass"", ""LongMethod"", ""FeatureEnvy""]","[""9daa4f4fc158cceff45b3a863a20a1ae"", ""d0a64322047912ccd1faaef20f2190e8"", ""ad90ae9e3fdb46bda6502f6e0b5ede1e"", ""4bcf44395ae0c009906e7f50ad8ebd4b"", ""93d1a4754185c1e9850ae0947cdc87d3""]","[866, 371, 34, 898, 898]","[884, 444, -1, 942, 942]","[""{\""LocalityRatio\"": 0.125, \""MaxCallChain\"": 2.0, \""ParameterCount\"": 0.0, \""CyclomaticComplexity\"": 5.0, \""MethodLinesOfCode\"": 13.0}"", ""{\""IsAbstract\"": 0.0, \""ClassLinesOfCode\"": 456.0, \""OverrideRatio\"": null, \""TightClassCohesion\"": 0.0889240506329114, \""PublicFieldCount\"": 0.0}"", ""{\""IsAbstract\"": 0.0, \""ClassLinesOfCode\"": 627.0, \""OverrideRatio\"": null, \""PublicFieldCount\"": 0.0, \""TightClassCohesion\"": 0.06478715459297983}"", ""{\""LocalityRatio\"": 0.06060606060606061, \""MaxCallChain\"": 2.0, \""ParameterCount\"": 2.0, \""CyclomaticComplexity\"": 12.0, \""MethodLinesOfCode\"": 32.0}"", ""{\""LocalityRatio\"": 0.06060606060606061, \""MaxCallChain\"": 2.0, \""ParameterCount\"": 2.0, \""CyclomaticComplexity\"": 12.0, \""MethodLinesOfCode\"": 32.0}""]","[""729be573f884af9d6e4235ba78cf1b07c42d9173"", ""729be573f884af9d6e4235ba78cf1b07c42d9173"", ""729be573f884af9d6e4235ba78cf1b07c42d9173"", ""729be573f884af9d6e4235ba78cf1b07c42d9173"", ""729be573f884af9d6e4235ba78cf1b07c42d9173"", ""729be573f884af9d6e4235ba78cf1b07c42d9173"", ""729be573f884af9d6e4235ba78cf1b07c42d9173""]","[""LongParameterList"", ""SpaghettiCode"", ""ComplexClass"", ""ClassDataShouldBePrivate"", ""GodClass"", ""DispersedCoupling"", ""LongParameterList""]","[""ce2c3ce83792f5ecc19aa981810204dd"", ""7dff2048a8225ab3ed42c4b85a58ba16"", ""57e92d34fa250d5def40de45eee4dab1"", ""f0be238e7d2a9f0851e693a354a0c662"", ""1fbae94e26d0325a9b6a3a0d91a5f4ba"", ""e8530fc8624b42b91f46152088271b23"", ""c0491d39cab6a14584e340f2d351f974""]","[10382, 156, 156, 156, 156, 10484, 10484]","[10457, 11291, 11291, 11291, 11291, 10569, 10569]","[""PARAMETER_COUNT > 1.1759726007573748"", ""LONG_METHODS_CONNECTED = 17"", ""CC = 22.0"", ""PUBLIC_FIELD_COUNT = 3.0"", ""CLOC > 500, TCC < 0.4268867393916222"", ""CINT > 8.0, CDISP > 0.5, CC > 1.0"", ""PARAMETER_COUNT > 1.1761018420290978""]"
Researcher 1,apache_derby,20653,"[""Extract Method"", ""Extract Method"", ""Extract Method"", ""Extract Method""]","[""org.apache.derbyTesting.functionTests.tests.storetests.st_reclaim_longcol.test2(Connection,int,int,int)"", ""org.apache.derbyTesting.functionTests.tests.storetests.st_reclaim_longcol"", ""org.apache.derbyTesting.functionTests.tests.storetests.st_reclaim_longcol.wait_for_max_allocated(Connection,String,int)"", ""org.apache.derbyTesting.functionTests.tests.storetests.st_reclaim_longcol.test1(Connection,int,int)""]","[""3f49cbffff020134239962f1001b168c43c58acb"", ""3f49cbffff020134239962f1001b168c43c58acb""]","[""FeatureEnvy"", ""FeatureEnvy""]","[""e1c74dc7f8f91704831a14e5e6d13656"", ""5200848e5ca902182aa37714f1bb7fa4""]","[17, 32]","[30, 45]","[""CALLS_TO_net.jodah.lyra.internal.AbstractFunctionalTest > 8"", ""CALLS_TO_net.jodah.lyra.internal.AbstractFunctionalTest > 8""]","[""cf5ac0ccac801b7ebc2e8af7770d5a2010c2fcfd"", ""cf5ac0ccac801b7ebc2e8af7770d5a2010c2fcfd"", ""cf5ac0ccac801b7ebc2e8af7770d5a2010c2fcfd"", ""cf5ac0ccac801b7ebc2e8af7770d5a2010c2fcfd"", ""cf5ac0ccac801b7ebc2e8af7770d5a2010c2fcfd"", ""cf5ac0ccac801b7ebc2e8af7770d5a2010c2fcfd""]","[""LongParameterList"", ""LongMethod"", ""FeatureEnvy"", ""SpaghettiCode"", ""LongMethod"", ""FeatureEnvy""]","[""2903e54b6db0254b2cc748a2b5de3c84"", ""4a44c2f26043b58f2a84f2514edb4705"", ""6f43e33c3431a87e08ab46518c26ca0b"", ""6705cc6be1b7c1ed9f03ade53b54b598"", ""5c008872266ae321b171582f5c2422bc"", ""a9a50702f0c6b2764f7ef91c6519c2a6""]","[216, 216, 216, 40, 88, 88]","[374, 374, 374, 472, 214, 214]","[""PARAMETER_COUNT > 1.1758515579639652"", ""MLOC > 7.946705051286362"", ""CALLS_TO_java.sql.PreparedStatement > 13"", ""LONG_METHODS_CONNECTED = 2"", ""MLOC > 8.252503728956935"", ""CALLS_TO_org.apache.derbyTesting.functionTests.tests.store.BaseTest > 4""]"
Researcher 1,apache_derby,20658,"[""Extract Method"", ""Extract Method"", ""Extract Method"", ""Extract Method"", ""Extract Method"", ""Extract Method"", ""Extract Method"", ""Extract Method"", ""Extract Method"", ""Extract Method"", ""Extract Method"", ""Extract Method"", ""Extract Method"", ""Extract Method"", ""Extract Method"", ""Extract Method"", ""Extract Method"", ""Extract Method""]","[""org.apache.derbyTesting.functionTests.tests.replicationTests.ReplicationRun.verifySlave()"", ""org.apache.derbyTesting.functionTests.tests.replicationTests.ReplicationRun"", ""org.apache.derbyTesting.functionTests.tests.replicationTests.ReplicationRun.configureDataSource(String,String,int,String)"", ""org.apache.derbyTesting.functionTests.tests.replicationTests.ReplicationRun.waitForConnect(long,int,String,String,int)"", ""org.apache.derbyTesting.functionTests.tests.replicationTests.ReplicationRun._verifyDatabase(String,int,String,int)"", ""org.apache.derbyTesting.functionTests.tests.replicationTests.ReplicationRun.showCurrentState(String,long,String,String,int)"", ""org.apache.derbyTesting.functionTests.tests.replicationTests.ReplicationRun.masterLoadURL(String)"", ""org.apache.derbyTesting.functionTests.tests.replicationTests.ReplicationRun.serverURL(String,String,int)"", ""org.apache.derbyTesting.functionTests.tests.replicationTests.ReplicationRun.waitForSQLState(String,long,int,String,String,int)"", ""org.apache.derbyTesting.functionTests.tests.replicationTests.ReplicationRun.startMaster_direct(String,String,int,String,int)"", ""org.apache.derbyTesting.functionTests.tests.replicationTests.ReplicationRun.verifyMaster()"", ""org.apache.derbyTesting.functionTests.tests.replicationTests.ReplicationRun._testInsertUpdateDeleteOnMaster(String,int,String,int)""]","[""3f49cbffff020134239962f1001b168c43c58acb"", ""3f49cbffff020134239962f1001b168c43c58acb"", ""3f49cbffff020134239962f1001b168c43c58acb"", ""3f49cbffff020134239962f1001b168c43c58acb""]","[""FeatureEnvy"", ""FeatureEnvy"", ""FeatureEnvy"", ""FeatureEnvy""]","[""472222e1650accfc3832b8ef6d2f6de6"", ""6eee29525e10f26a0c1928dfff4a5e47"", ""727492c6f0a0c3fc560b172432e022c4"", ""1c390ec32d800ff95c496557388e5988""]","[17, 62, 47, 32]","[30, 75, 60, 45]","[""CALLS_TO_net.jodah.lyra.internal.AbstractFunctionalTest > 8"", ""CALLS_TO_net.jodah.lyra.internal.AbstractFunctionalTest > 8"", ""CALLS_TO_net.jodah.lyra.internal.AbstractFunctionalTest > 8"", ""CALLS_TO_net.jodah.lyra.internal.AbstractFunctionalTest > 8""]","[""61b02b72e27b874561a17bc74ff14870f170b216"", ""61b02b72e27b874561a17bc74ff14870f170b216"", ""61b02b72e27b874561a17bc74ff14870f170b216"", ""61b02b72e27b874561a17bc74ff14870f170b216"", ""61b02b72e27b874561a17bc74ff14870f170b216"", ""61b02b72e27b874561a17bc74ff14870f170b216"", ""61b02b72e27b874561a17bc74ff14870f170b216"", ""61b02b72e27b874561a17bc74ff14870f170b216"", ""61b02b72e27b874561a17bc74ff14870f170b216"", ""61b02b72e27b874561a17bc74ff14870f170b216"", ""61b02b72e27b874561a17bc74ff14870f170b216"", ""61b02b72e27b874561a17bc74ff14870f170b216"", ""61b02b72e27b874561a17bc74ff14870f170b216"", ""61b02b72e27b874561a17bc74ff14870f170b216"", ""61b02b72e27b874561a17bc74ff14870f170b216""]","[""LongParameterList"", ""LongParameterList"", ""LongParameterList"", ""LongParameterList"", ""IntensiveCoupling"", ""LongParameterList"", ""FeatureEnvy"", ""LongParameterList"", ""FeatureEnvy"", ""SpaghettiCode"", ""ComplexClass"", ""GodClass"", ""DispersedCoupling"", ""LongParameterList"", ""FeatureEnvy""]","[""224f586896403e259fd36381910d0ea1"", ""ed290148dbaddc393f7b017f18799960"", ""773a3ba1189fd2394908e484634003af"", ""0a13a4de9dbcde1e431b103fb39841c0"", ""ad5d16e176311d76db7ba38ecd2b1771"", ""86b18bab076febc41c558adb8c85619f"", ""f806d02e754a7da7838eb35e42c1a4c0"", ""cac8feeeee817d4baaa834d27e907fa8"", ""fad6646276c6e4a32ee414e4570dfab8"", ""e8ea4a9a374e0ea3d899d04fa8d25a46"", ""09ccd218baea0722d85c3c413650a9f7"", ""b6af47c56bb323d8c5e7b3d7602900b0"", ""d37416fd3e3bb71caf25d2eb0faf9427"", ""0efa7b50fbfd8e4343beb41b32ddf50e"", ""340a94716de9aa4b50d88e7dd0c80f0c""]","[437, 3115, 406, 381, 3087, 3087, 3087, 3335, 3335, 35, 35, 39, 946, 946, 946]","[483, 3128, 436, 405, 3114, 3114, 3114, 3362, 3362, 3503, 3503, 3192, 1021, 1021, 1021]","[""PARAMETER_COUNT > 1.176066888985522"", ""PARAMETER_COUNT > 1.176066888985522"", ""PARAMETER_COUNT > 1.176066888985522"", ""PARAMETER_COUNT > 1.176066888985522"", ""CINT = 11.0, CDISP = 0.45454545454545453, CC > 1.0"", ""PARAMETER_COUNT > 1.176066888985522"", ""CALLS_TO_java.sql.PreparedStatement > 4"", ""PARAMETER_COUNT > 1.176066888985522"", ""CALLS_TO_org.apache.derby.jdbc.ClientBaseDataSource > 6"", ""LONG_METHODS_CONNECTED = 6"", ""CC = 11.0"", ""CLOC > 500, TCC < 0.407300078351677"", ""CINT > 8.0, CDISP > 0.5, CC > 1.0"", ""PARAMETER_COUNT > 1.1953917533880227"", ""CALLS_TO_org.apache.derbyTesting.functionTests.tests.replicationTests.Utils > 7""]"
Researcher 1,apache_derby,20660,"[""Extract Method"", ""Extract Method"", ""Extract Method"", ""Extract Method""]","[""org.apache.derby.impl.tools.dblook.DB_Jar"", ""org.apache.derby.impl.tools.dblook.DB_Jar.doJars(String,Connection)"", ""org.apache.derby.impl.tools.dblook.DB_Jar.doHeader(boolean)"", ""org.apache.derby.impl.tools.dblook.DB_Jar.doCopy(String,String)""]","[""6ef3a5cd54cfacf43038706d15e37acd14e741c3"", ""6ef3a5cd54cfacf43038706d15e37acd14e741c3"", ""6ef3a5cd54cfacf43038706d15e37acd14e741c3"", ""6ef3a5cd54cfacf43038706d15e37acd14e741c3"", ""6ef3a5cd54cfacf43038706d15e37acd14e741c3""]","[""DispersedCoupling"", ""LongMethod"", ""FeatureEnvy"", ""SpaghettiCode"", ""ComplexClass""]","[""2b9c52a946c7d81b43416eb7a7396b2b"", ""0d440169c3bd1f376a82bcb20d37b3d0"", ""52ab8d0ccccbea04b7de9dd4190cd281"", ""2954dd0cdede05adc88ded62f4740ca4"", ""e67361e2cab6ce41aec7d220bccf0267""]","[149, 149, 149, 33, 33]","[190, 190, 190, 527, 527]","[""CINT > 8.0, CDISP > 0.5, CC > 1.0"", ""MLOC > 5.158730158730158"", ""CALLS_TO_net.jodah.lyra.config.Config > 4"", ""LONG_METHODS_CONNECTED = 2"", ""CC = 40.0""]","[""78c2db1dfb013500d6ec709df5384b9ade7f002a""]","[""FeatureEnvy""]","[""61da88b29f0e4e7d4df2506a7ce1b4b0""]",[187],[196],"[""CALLS_TO_org.apache.derby.impl.tools.dblook.Logs > 4""]"
Researcher 1,apache_derby,20672,"[""Extract Method"", ""Extract Method"", ""Inline Method"", ""Inline Method"", ""Inline Method"", ""Inline Method"", ""Extract Method"", ""Extract Method"", ""Extract Method"", ""Extract Method""]","[""org.apache.derbyTesting.functionTests.tests.replicationTests.ReplicationRun"", ""org.apache.derbyTesting.functionTests.tests.replicationTests.ReplicationRun.stopServer(String,String,String,int)"", ""org.apache.derbyTesting.functionTests.tests.replicationTests.ReplicationRun.runUserCommandLocally(String,String,File)"", ""org.apache.derbyTesting.functionTests.tests.replicationTests.ReplicationRun.startLoad(String,String,String,boolean,String,String,int)"", ""org.apache.derbyTesting.functionTests.tests.replicationTests.ReplicationRun.startOptionalLoad(Load,String,String,int)"", ""org.apache.derbyTesting.functionTests.tests.replicationTests.ReplicationRun.runUserCommandRemotely(String,String,String,String)"", ""org.apache.derbyTesting.functionTests.tests.replicationTests.ReplicationRun.runUserCommand(String,String)"", ""org.apache.derbyTesting.functionTests.tests.replicationTests.ReplicationRun.runUserCommandLocally(String,String,String)"", ""org.apache.derbyTesting.functionTests.tests.replicationTests.ReplicationRun.startServer(String,String,String,String,int,String)"", ""org.apache.derbyTesting.functionTests.tests.replicationTests.ReplicationRun.runUserCommandInThreadLocally(String,String,String)""]","[""24e020498f0ebbe569eefcc52ea59b1ec8eb3bc9"", ""24e020498f0ebbe569eefcc52ea59b1ec8eb3bc9"", ""24e020498f0ebbe569eefcc52ea59b1ec8eb3bc9"", ""24e020498f0ebbe569eefcc52ea59b1ec8eb3bc9"", ""24e020498f0ebbe569eefcc52ea59b1ec8eb3bc9"", ""24e020498f0ebbe569eefcc52ea59b1ec8eb3bc9"", ""24e020498f0ebbe569eefcc52ea59b1ec8eb3bc9"", ""24e020498f0ebbe569eefcc52ea59b1ec8eb3bc9"", ""24e020498f0ebbe569eefcc52ea59b1ec8eb3bc9""]","[""FeatureEnvy"", ""BrainClass"", ""SpaghettiCode"", ""ComplexClass"", ""GodClass"", ""BrainMethod"", ""IntensiveCoupling"", ""LongMethod"", ""FeatureEnvy""]","[""e74f457bbd4a5a3ce4fc5021e2a953ad"", ""afa1ef84f4ae9b8403f3d6881eeeb8f3"", ""ae79c0fc0252a34072318cb0f7f5dccb"", ""5e97adcd4e3b0a96cc5f4721bdf6484b"", ""e0f0444ec29d618a4dfb33f3b6d7d6e4"", ""11af7b5dbdfc75e0ec0db6b18202a135"", ""90a7e279d688654dc0ee04ad582319ea"", ""839d9502b3079f87bb178b1e44b378a4"", ""cc1638a3f964802bf18a1da5b631310b""]","[3713, 61, 69, 69, 69, 546, 546, 546, 873]","[3736, 7610, 8321, 8321, 8321, 863, 863, 863, 899]","[""CALLS_TO_org.apache.derby.impl.drda.DDMReader > 5"", ""BRAIN_METHODS = 1, WMC = 1153.0, TCC = 0.0"", ""LONG_METHODS_CONNECTED = 30"", ""CC = 18.0"", ""CLOC > 500, TCC < 0.42461234036739287"", ""MLOC > 100.44741483028392, CC > 6.762430136436645, MAX_NESTING > 5.0, NOAV > 6.0"", ""CINT = 52.0, CDISP = 0.11538461538461539, CC > 1.0"", ""MLOC > 6.417051904733773"", ""CALLS_TO_org.apache.derby.impl.drda.DDMReader > 5""]","[""f0951abae36bafeb3c64b57714ba8de819e0a911"", ""f0951abae36bafeb3c64b57714ba8de819e0a911"", ""f0951abae36bafeb3c64b57714ba8de819e0a911"", ""f0951abae36bafeb3c64b57714ba8de819e0a911"", ""f0951abae36bafeb3c64b57714ba8de819e0a911"", ""f0951abae36bafeb3c64b57714ba8de819e0a911"", ""f0951abae36bafeb3c64b57714ba8de819e0a911"", ""f0951abae36bafeb3c64b57714ba8de819e0a911"", ""f0951abae36bafeb3c64b57714ba8de819e0a911"", ""f0951abae36bafeb3c64b57714ba8de819e0a911"", ""f0951abae36bafeb3c64b57714ba8de819e0a911""]","[""LongParameterList"", ""LongMethod"", ""FeatureEnvy"", ""LongParameterList"", ""LongParameterList"", ""LongMethod"", ""FeatureEnvy"", ""LongParameterList"", ""SpaghettiCode"", ""ComplexClass"", ""GodClass""]","[""4d5cce9bb4ad006853395da36a34a345"", ""c17487b31b941f3a3b9d73d9bb90965d"", ""fbc8669d4cf364da716b01b58260f1b6"", ""146c7a004f99e59a8838fbf98ce74e65"", ""b1b80f600e171f34f3a65c292c9c7351"", ""b7dd96a9a341ada7d7fb58161720b13c"", ""c6d8ccdd9a2317424b7bc3f6b82a90db"", ""a0da2e3c89e2a8c4c3b779366fa2b7ae"", ""e8ea4a9a374e0ea3d899d04fa8d25a46"", ""09ccd218baea0722d85c3c413650a9f7"", ""b6af47c56bb323d8c5e7b3d7602900b0""]","[2160, 2160, 2160, 1531, 2024, 2024, 2024, 2167, 35, 35, 39]","[2298, 2298, 2298, 1546, 2085, 2085, 2085, 2224, 3503, 3503, 3192]","[""PARAMETER_COUNT > 1.1802749581157237"", ""MLOC > 7.873706514240143"", ""CALLS_TO_org.apache.derbyTesting.functionTests.tests.replicationTests.Utils > 14"", ""PARAMETER_COUNT > 1.1765482829468539"", ""PARAMETER_COUNT > 1.1755934486158597"", ""MLOC > 7.939657038407848"", ""CALLS_TO_org.apache.derbyTesting.functionTests.tests.replicationTests.Utils > 9"", ""PARAMETER_COUNT > 1.1755934486158597"", ""LONG_METHODS_CONNECTED = 6"", ""CC = 11.0"", ""CLOC > 500, TCC < 0.407300078351677""]"
Researcher 1,apache_derby,20674,"[""Extract Method"", ""Extract Method"", ""Extract Method"", ""Extract Method""]","[""org.apache.derby.client.am.Clob"", ""org.apache.derby.client.am.Clob.truncate(long)"", ""org.apache.derby.client.am.Clob.reInitForNonLocator(String)"", ""org.apache.derby.client.am.Clob.setStringX(long,String,int,int)""]","[""563eb578416833d606646d32a4c0c4ca6be48b12"", ""563eb578416833d606646d32a4c0c4ca6be48b12"", ""563eb578416833d606646d32a4c0c4ca6be48b12"", ""563eb578416833d606646d32a4c0c4ca6be48b12""]","[""LongParameterList"", ""LongMethod"", ""FeatureEnvy"", ""LongParameterList""]","[""126ee8043038f855b5530b6d2556f9dd"", ""b975a6f664340d9b8ccf9237637c42c6"", ""57f04ec614d4fe43bad10568a6be6732"", ""7a4ac1768fc6b17dc73cfd4807ce7ab3""]","[303, 303, 303, 45]","[386, 386, 386, 72]","[""PARAMETER_COUNT > 1.3008133694830923"", ""MLOC > 8.098893284145593"", ""CALLS_TO_org.apache.derbyTesting.functionTests.tests.store.BaseTest > 12"", ""PARAMETER_COUNT > 1.3008133694830923""]","[""c784df507ab6b6b8082377a5476f21bb1a7be0d0"", ""c784df507ab6b6b8082377a5476f21bb1a7be0d0"", ""c784df507ab6b6b8082377a5476f21bb1a7be0d0"", ""c784df507ab6b6b8082377a5476f21bb1a7be0d0""]","[""ComplexClass"", ""FeatureEnvy"", ""LongParameterList"", ""FeatureEnvy""]","[""e8d9194cc60f5200210ad0fe56099360"", ""999a3e2cc81fdbcc5e3aad75ceaa780f"", ""500c9d9660e79f8c4c826d7953865480"", ""e83403b13dd661ab36c0226b2eddb5d0""]","[32, 745, 560, 616]","[1073, 799, 596, 685]","[""CC = 12.0"", ""CALLS_TO_org.apache.derby.client.am.Lob > 7"", ""PARAMETER_COUNT > 1.2572991429168812"", ""CALLS_TO_org.apache.derby.client.am.Lob > 5""]"
Researcher 1,apache_derby,20697,"[""Extract Method"", ""Extract Method"", ""Extract Method"", ""Extract Method""]","[""org.apache.derbyTesting.functionTests.tests.jdbc4.PreparedStatementTest42.populateTable(Connection)"", ""org.apache.derbyTesting.functionTests.tests.jdbc4.PreparedStatementTest42"", ""org.apache.derbyTesting.functionTests.tests.jdbc4.PreparedStatementTest42.prepareInsert(Connection)"", ""org.apache.derbyTesting.functionTests.tests.jdbc4.PreparedStatementTest42.insertRow(PreparedStatement,int)""]","[""b0a922f1d4bdb26913408656bea8cbb75cfdff3c"", ""b0a922f1d4bdb26913408656bea8cbb75cfdff3c""]","[""FeatureEnvy"", ""FeatureEnvy""]","[""2339f7f4f29af33171e10836ae3adc36"", ""84c7bddf9c6c81e066fb81db21898349""]","[157, 230]","[193, 271]","[""CALLS_TO_org.apache.derby.impl.services.cache.CacheEntry > 5"", ""CALLS_TO_org.apache.derby.impl.services.cache.CacheEntry > 5""]","[""fc9b418d86b26971132218b15c6ce093d063dbec"", ""fc9b418d86b26971132218b15c6ce093d063dbec""]","[""ComplexClass"", ""ClassDataShouldBePrivate""]","[""b467c2257dd606f02504ebafd4b38fb6"", ""1164016028210d3d059215ce8a98036f""]","[48, 48]","[900, 900]","[""CC = 11.0"", ""PUBLIC_FIELD_COUNT = 3.0""]"
Researcher 1,apache_derby,20700,"[""Extract Method"", ""Extract Method"", ""Extract Method"", ""Extract Method"", ""Extract Method"", ""Extract Method"", ""Extract Method"", ""Extract Method""]","[""org.apache.derbyTesting.functionTests.tests.jdbc4.PreparedStatementTest42"", ""org.apache.derbyTesting.functionTests.tests.jdbc4.PreparedStatementTest42.vetProc(Connection)"", ""org.apache.derbyTesting.functionTests.tests.jdbc4.PreparedStatementTest42.assertUnimplemented(SQLException)"", ""org.apache.derbyTesting.functionTests.tests.jdbc4.PreparedStatementTest42.test_04_targetTypeIsNull()"", ""org.apache.derbyTesting.functionTests.tests.jdbc4.PreparedStatementTest42.vetSetObjectProc(Connection)"", ""org.apache.derbyTesting.functionTests.tests.jdbc4.PreparedStatementTest42.populateTable(Connection)""]","[""66a8763aec8c968a890cc5664797e686ea617785"", ""66a8763aec8c968a890cc5664797e686ea617785"", ""66a8763aec8c968a890cc5664797e686ea617785"", ""66a8763aec8c968a890cc5664797e686ea617785"", ""66a8763aec8c968a890cc5664797e686ea617785""]","[""SpaghettiCode"", ""ComplexClass"", ""GodClass"", ""FeatureEnvy"", ""LongMethod""]","[""e513e633bdc311525ccb84afd04da622"", ""61352f560b61d888490da48b9ed7c572"", ""0d57de5d87e7f70675ef7aad690d7c45"", ""bb0e36aa0ad2ec37d29c0380364eb25b"", ""97eb8461c7a5570bec5eeb4886faca72""]","[60, 60, 60, 3067, 3205]","[4600, 4600, 4600, 3116, 3447]","[""LONG_METHODS_CONNECTED = 19"", ""CC = 11.0"", ""CLOC > 500, TCC < 0.42023279267513525"", ""CALLS_TO_org.apache.derbyTesting.junit.BaseJDBCTestCase > 4"", ""MLOC > 7.9366573574726615""]","[""9f0c37aef1916a60ac622bf6d3604abe894b4d3f"", ""9f0c37aef1916a60ac622bf6d3604abe894b4d3f"", ""9f0c37aef1916a60ac622bf6d3604abe894b4d3f"", ""9f0c37aef1916a60ac622bf6d3604abe894b4d3f"", ""9f0c37aef1916a60ac622bf6d3604abe894b4d3f"", ""9f0c37aef1916a60ac622bf6d3604abe894b4d3f"", ""9f0c37aef1916a60ac622bf6d3604abe894b4d3f"", ""9f0c37aef1916a60ac622bf6d3604abe894b4d3f""]","[""LongMethod"", ""FeatureEnvy"", ""LongMethod"", ""SpaghettiCode"", ""ComplexClass"", ""ClassDataShouldBePrivate"", ""IntensiveCoupling"", ""LongMethod""]","[""e71370120323dddac1b1cf867172c642"", ""4df371135739f16a705a2777db9af1dc"", ""d534cb5aacd49396ed206a68f274e620"", ""6c576a3429113d029326616fedb3a0a6"", ""b467c2257dd606f02504ebafd4b38fb6"", ""1164016028210d3d059215ce8a98036f"", ""e33a06a6a226e8efb84e1cf331df10fe"", ""98191bc10d2cfc7cc37e8ec656bcb9dd""]","[591, 591, 643, 48, 48, 48, 439, 439]","[641, 641, 697, 900, 900, 900, 518, 518]","[""MLOC > 7.905675008811491"", ""CALLS_TO_java.sql.PreparedStatement > 6"", ""MLOC > 7.905675008811491"", ""LONG_METHODS_CONNECTED = 4"", ""CC = 11.0"", ""PUBLIC_FIELD_COUNT = 3.0"", ""CINT = 13.0, CDISP = 0.38461538461538464, CC > 1.0"", ""MLOC > 7.905675008811491""]"
Researcher 1,apache_derby,20712,"[""Rename Method"", ""Rename Method"", ""Extract Method"", ""Extract Method""]","[""org.apache.derbyTesting.functionTests.tests.i18n.UrlLocaleTest"", ""org.apache.derbyTesting.functionTests.tests.i18n.UrlLocaleTest.testInvalidTerritoryFormat(String)"", ""org.apache.derbyTesting.functionTests.tests.i18n.UrlLocaleTest.checkInvalidTerritoryFormat(String)"", ""org.apache.derbyTesting.functionTests.tests.i18n.UrlLocaleTest.testURLLocale()"", ""org.apache.derbyTesting.functionTests.tests.i18n.UrlLocaleTest.getReadWriteJDBCURL(String)""]","[""85b9e37caedde5b0be3150255678d46ce7d0400e"", ""85b9e37caedde5b0be3150255678d46ce7d0400e"", ""85b9e37caedde5b0be3150255678d46ce7d0400e"", ""85b9e37caedde5b0be3150255678d46ce7d0400e"", ""85b9e37caedde5b0be3150255678d46ce7d0400e"", ""85b9e37caedde5b0be3150255678d46ce7d0400e"", ""85b9e37caedde5b0be3150255678d46ce7d0400e"", ""85b9e37caedde5b0be3150255678d46ce7d0400e""]","[""SpaghettiCode"", ""ComplexClass"", ""IntensiveCoupling"", ""LongMethod"", ""FeatureEnvy"", ""IntensiveCoupling"", ""LongMethod"", ""FeatureEnvy""]","[""db59e9f1eafb2d5698d0a91f5e972cad"", ""854da44ec1c900085e94210007a83c4b"", ""6d86e64035a0a16bf2ff1ffd434792c2"", ""9e6de1b0d5803e0f975886211ad1d554"", ""2e6fb68b884ea000b15cd035c2571e86"", ""ddf6e47aecaca015f332e367f7399576"", ""328302df9d10a3bcf8a8cc68d7d2d951"", ""bc3911099b4b5884a086588d4973995e""]","[31, 31, 565, 565, 565, 356, 356, 356]","[661, 765, 689, 660, 689, 470, 470, 470]","[""LONG_METHODS_CONNECTED = 2"", ""CC = 15.0"", ""CINT = 14.0, CDISP = 0.42857142857142855, CC > 1.0"", ""MLOC > 8.179232886996653"", ""CALLS_TO_org.apache.derby.impl.services.cache.ClockPolicy.Holder > 5"", ""CINT = 15.0, CDISP = 0.4, CC > 1.0"", ""MLOC > 8.178639621873474"", ""CALLS_TO_org.apache.derby.impl.services.cache.CacheEntry > 4""]","[""8c41013721a4207a06d90c40615fb82a67ab1f2f""]","[""SpaghettiCode""]","[""f1dfd4d8b3822517ca614b3699057d16""]",[41],[320],"[""LONG_METHODS_CONNECTED = 2""]"
Researcher 1,apache_derby,20734,"[""Extract Method"", ""Extract Method"", ""Extract Method"", ""Extract Method""]","[""org.apache.derby.impl.sql.execute.ReferencedKeyRIChecker.isDuplicated(ExecRow)"", ""org.apache.derby.impl.sql.execute.ReferencedKeyRIChecker"", ""org.apache.derby.impl.sql.execute.ReferencedKeyRIChecker.isDuplicated(DataValueDescriptor,long)"", ""org.apache.derby.impl.sql.execute.ReferencedKeyRIChecker.doCheck(Activation,ExecRow,boolean)""]","[""8654374d4c7b5c6666b1136cea103994ee9240d2"", ""8654374d4c7b5c6666b1136cea103994ee9240d2"", ""8654374d4c7b5c6666b1136cea103994ee9240d2"", ""8654374d4c7b5c6666b1136cea103994ee9240d2"", ""8654374d4c7b5c6666b1136cea103994ee9240d2"", ""8654374d4c7b5c6666b1136cea103994ee9240d2"", ""8654374d4c7b5c6666b1136cea103994ee9240d2"", ""8654374d4c7b5c6666b1136cea103994ee9240d2"", ""8654374d4c7b5c6666b1136cea103994ee9240d2"", ""8654374d4c7b5c6666b1136cea103994ee9240d2"", ""8654374d4c7b5c6666b1136cea103994ee9240d2"", ""8654374d4c7b5c6666b1136cea103994ee9240d2"", ""8654374d4c7b5c6666b1136cea103994ee9240d2"", ""8654374d4c7b5c6666b1136cea103994ee9240d2"", ""8654374d4c7b5c6666b1136cea103994ee9240d2"", ""8654374d4c7b5c6666b1136cea103994ee9240d2"", ""8654374d4c7b5c6666b1136cea103994ee9240d2"", ""8654374d4c7b5c6666b1136cea103994ee9240d2"", ""8654374d4c7b5c6666b1136cea103994ee9240d2"", ""8654374d4c7b5c6666b1136cea103994ee9240d2"", ""8654374d4c7b5c6666b1136cea103994ee9240d2"", ""8654374d4c7b5c6666b1136cea103994ee9240d2"", ""8654374d4c7b5c6666b1136cea103994ee9240d2"", ""8654374d4c7b5c6666b1136cea103994ee9240d2"", ""8654374d4c7b5c6666b1136cea103994ee9240d2""]","[""LongParameterList"", ""LongParameterList"", ""FeatureEnvy"", ""LongParameterList"", ""ShotgunSurgery"", ""LongParameterList"", ""FeatureEnvy"", ""LongParameterList"", ""LongParameterList"", ""LongParameterList"", ""LongParameterList"", ""LongParameterList"", ""LongParameterList"", ""LongParameterList"", ""LongParameterList"", ""ShotgunSurgery"", ""LongParameterList"", ""FeatureEnvy"", ""SpaghettiCode"", ""ComplexClass"", ""DispersedCoupling"", ""LongParameterList"", ""LongMethod"", ""FeatureEnvy"", ""LongParameterList""]","[""dce17754295d276019ba2ddaba6c3ade"", ""a1ddc0f6f918ab379d7d8fb5d9d623b2"", ""12c64c3d24bdba58c55c8383b8467a59"", ""0b6a46cb20a6a4a74c56e842e1f39ff2"", ""ae4a971d15e0545e668480074b526b12"", ""fbe08c19971adc2ae9a3b213b51e5e24"", ""cc604f5565631d430f32e0af45d1f73d"", ""45f0ce5f59dca40c6d9a7e35d5221ac2"", ""71a7a1b2b5fca30c6b7a04e1970dd7dc"", ""2e9d73dd2864eed5e73e2e970fb3375a"", ""64787a97d647699bfe28a7ef20f41e5a"", ""a5f75d60ab653986992e8b19fd594b12"", ""ae623407f4a1dccf4de4d14e5007f589"", ""27c8e8454e93f4ef2fa194da02e7becc"", ""ca2f3afe49a6328c5ea4f171bd753a61"", ""47e7ed9ce3eefdbff497b40250ae7626"", ""1bf44b2578ef15364922030222e268dc"", ""b8617b6dcba8dc89b22a8514f3e701ef"", ""e8ea4a9a374e0ea3d899d04fa8d25a46"", ""09ccd218baea0722d85c3c413650a9f7"", ""d37416fd3e3bb71caf25d2eb0faf9427"", ""0efa7b50fbfd8e4343beb41b32ddf50e"", ""8eaafbe8c2aba548e1f52a0be69525cc"", ""340a94716de9aa4b50d88e7dd0c80f0c"", ""2168613d533bc3534f47cac8b763d86b""]","[1281, 505, 505, 674, 744, 744, 726, 2789, 914, 355, 380, 286, 1411, 310, 334, 418, 418, 394, 35, 35, 946, 946, 946, 946, 695]","[1317, 590, 590, 742, 829, 829, 815, 2845, 956, 378, 390, 308, 1451, 332, 353, 504, 504, 477, 3503, 3503, 1021, 1021, 1021, 1021, 766]","[""PARAMETER_COUNT > 1.1944720985066999"", ""PARAMETER_COUNT > 1.1944720985066999"", ""CALLS_TO_org.apache.derbyTesting.functionTests.tests.replicationTests.Utils > 4"", ""PARAMETER_COUNT > 1.1944720985066999"", ""CM > 8.0, CC > 6.0"", ""PARAMETER_COUNT > 1.1944720985066999"", ""CALLS_TO_org.apache.derbyTesting.functionTests.tests.replicationTests.Utils > 4"", ""PARAMETER_COUNT > 1.1944720985066999"", ""PARAMETER_COUNT > 1.1944720985066999"", ""PARAMETER_COUNT > 1.1943228579665834"", ""PARAMETER_COUNT > 1.1943228579665834"", ""PARAMETER_COUNT > 1.1943228579665834"", ""PARAMETER_COUNT > 1.1944720985066999"", ""PARAMETER_COUNT > 1.1943228579665834"", ""PARAMETER_COUNT > 1.1943228579665834"", ""CM > 8.0, CC > 6.0"", ""PARAMETER_COUNT > 1.1944720985066999"", ""CALLS_TO_org.apache.derbyTesting.functionTests.tests.replicationTests.Utils > 4"", ""LONG_METHODS_CONNECTED = 6"", ""CC = 11.0"", ""CINT > 8.0, CDISP > 0.5, CC > 1.0"", ""PARAMETER_COUNT > 1.1953917533880227"", ""MLOC > 7.578442423129675"", ""CALLS_TO_org.apache.derbyTesting.functionTests.tests.replicationTests.Utils > 7"", ""PARAMETER_COUNT > 1.1765482829468539""]","[""18a6fb272a26cab64131c81304162f4e3765d429""]","[""ComplexClass""]","[""47101af5e75e953c3cdc0916e9053c46""]",[42],[380],"[""CC = 13.0""]"
Researcher 2,apache_tomcat,20801,"[""Extract Method"", ""Extract Method"", ""Extract Method"", ""Extract Method""]","[""org.apache.catalina.javax.websocketWsInputStream"", ""org.apache.catalina.javax.websocketWsInputStream.read(byte,int,int)"", ""org.apache.catalina.javax.websocketWsInputStream.makePayloadDataAvailable()"", ""org.apache.catalina.javax.websocketWsInputStream.read()""]","[""b976fd86d019f78e26e74d2002dc1d5d870b85b1"", ""b976fd86d019f78e26e74d2002dc1d5d870b85b1"", ""b976fd86d019f78e26e74d2002dc1d5d870b85b1"", ""b976fd86d019f78e26e74d2002dc1d5d870b85b1"", ""b976fd86d019f78e26e74d2002dc1d5d870b85b1"", ""b976fd86d019f78e26e74d2002dc1d5d870b85b1"", ""b976fd86d019f78e26e74d2002dc1d5d870b85b1"", ""b976fd86d019f78e26e74d2002dc1d5d870b85b1""]","[""SpaghettiCode"", ""ComplexClass"", ""IntensiveCoupling"", ""MessageChain"", ""LongMethod"", ""FeatureEnvy"", ""DispersedCoupling"", ""LongParameterList""]","[""f2bda320e16b6b816f81473bd6ccd306"", ""37000e4947a027b193dceebdc65cedbc"", ""1dfe7be046e4568e69543715a7d4e6aa"", ""ccfc47c4e9369ca8bd15f39ae02c1c3e"", ""9a6762f2bd507d96147f2187501ac3b0"", ""e74121593e3d8e2abe3cddaace2c9043"", ""fae65a5766509d65b268df68fcd0bb3e"", ""f3e48c4d2d44eb9655a0dcd9588f5276""]","[51, 51, 536, 536, 519, 510, 626, 626]","[1260, 1260, 952, 952, 641, 666, 728, 728]","[""LONG_METHODS_CONNECTED = 2"", ""CC = 11.0"", ""CINT = 28.0, CDISP = 0.4642857142857143, CC > 1.0"", ""MAX_CALL_CHAIN = 4.0"", ""MLOC > 8.104169696969771"", ""CALLS_TO_org.apache.derby.impl.sql.compile.QueryTreeNode > 5"", ""CINT > 8.0, CDISP > 0.5, CC > 1.0"", ""PARAMETER_COUNT > 1.1833717550365601""]","[""1d82b675de58f50191ebf99f05bdcdf093c7d420"", ""1d82b675de58f50191ebf99f05bdcdf093c7d420"", ""1d82b675de58f50191ebf99f05bdcdf093c7d420""]","[""ComplexClass"", ""IntensiveCoupling"", ""MessageChain""]","[""e7e9dd27b950a8327c8bf43426789157"", ""14b7dcc500c30eda55d96b1d507068f6"", ""21e3c39534f2cf0523878895bcbfa02a""]","[24, 119, 119]","[146, 145, 145]","[""CC = 11.0"", ""CINT = 9.0, CDISP = 0.4444444444444444, CC > 1.0"", ""MAX_CALL_CHAIN = 4.0""]"
Researcher 2,apache_tomcat,20805,"[""Extract Method"", ""Extract Method"", ""Inline Method"", ""Inline Method"", ""Extract Method"", ""Extract Method"", ""Inline Method"", ""Inline Method""]","[""org.apache.catalina.startup.WebAnnotationSet.loadApplicationServletAnnotations(Context)"", ""org.apache.catalina.startup.WebAnnotationSet"", ""org.apache.catalina.startup.WebAnnotationSet.loadClass(Context,String)"", ""org.apache.catalina.startup.WebAnnotationSet.loadApplicationFilterAnnotations(Context)"", ""org.apache.catalina.startup.WebAnnotationSet.loadClassAnnotation(Context,String)"", ""org.apache.catalina.startup.WebAnnotationSet.addResource(Context,Resource)"", ""org.apache.catalina.startup.WebAnnotationSet.addResource(Context,Resource,String,String)"", ""org.apache.catalina.startup.WebAnnotationSet.loadApplicationListenerAnnotations(Context)""]","[""525fa450031af1ac2f10fbf7bc029e248be66a93"", ""525fa450031af1ac2f10fbf7bc029e248be66a93"", ""525fa450031af1ac2f10fbf7bc029e248be66a93"", ""525fa450031af1ac2f10fbf7bc029e248be66a93"", ""525fa450031af1ac2f10fbf7bc029e248be66a93"", ""525fa450031af1ac2f10fbf7bc029e248be66a93"", ""525fa450031af1ac2f10fbf7bc029e248be66a93"", ""525fa450031af1ac2f10fbf7bc029e248be66a93"", ""525fa450031af1ac2f10fbf7bc029e248be66a93"", ""525fa450031af1ac2f10fbf7bc029e248be66a93"", ""525fa450031af1ac2f10fbf7bc029e248be66a93"", ""525fa450031af1ac2f10fbf7bc029e248be66a93"", ""525fa450031af1ac2f10fbf7bc029e248be66a93""]","[""SpaghettiCode"", ""ComplexClass"", ""GodClass"", ""IntensiveCoupling"", ""LongMethod"", ""FeatureEnvy"", ""IntensiveCoupling"", ""LongMethod"", ""FeatureEnvy"", ""IntensiveCoupling"", ""LongMethod"", ""IntensiveCoupling"", ""LongMethod""]","[""3c975593f6a50cd5c71bebac179ea33b"", ""9124dcd8703db100c93c87b7ced0241e"", ""c6588047bdedfb938b8a3825b3c180c7"", ""a082fa4997a23a6aa24ee3b5ead8ea35"", ""cf70ff395df70b585e1537293a1639eb"", ""37a18c6d7edffa23560ed9664677c01f"", ""7d1b20bc9e785c56a214c57f31bd09c2"", ""76a9718ea3196dfc78dd8ae9b86e7758"", ""c7b78fc959dc4adfbc4494c636a98454"", ""524904b2d7c8f0f04b50e0f9062c5713"", ""4b30af0c6c2d4906205b4ab53e35e4a1"", ""524904b2d7c8f0f04b50e0f9062c5713"", ""4b30af0c6c2d4906205b4ab53e35e4a1""]","[83, 83, 83, 629, 629, 629, 2010, 2010, 2010, 268, 268, 268, 268]","[2533, 2533, 2533, 812, 812, 812, 2193, 2193, 2193, 621, 621, 621, 621]","[""LONG_METHODS_CONNECTED = 6"", ""CC = 47.0"", ""CLOC > 500, TCC < 0.4276029126892707"", ""CINT = 31.0, CDISP = 0.4838709677419355, CC > 1.0"", ""MLOC > 7.8383512722588975"", ""CALLS_TO_org.apache.derby.iapi.sql.dictionary.ConglomerateDescriptor > 4"", ""CINT = 36.0, CDISP = 0.4166666666666667, CC > 1.0"", ""MLOC > 7.8383512722588975"", ""CALLS_TO_org.apache.derby.iapi.sql.dictionary.TableDescriptor > 7"", ""CINT = 38.0, CDISP = 0.3684210526315789, CC > 1.0"", ""MLOC > 7.837528831130841"", ""CINT = 38.0, CDISP = 0.3684210526315789, CC > 1.0"", ""MLOC > 7.837528831130841""]","[""67a926c90e61206a6209214508dfee492fda4248"", ""67a926c90e61206a6209214508dfee492fda4248"", ""67a926c90e61206a6209214508dfee492fda4248"", ""67a926c90e61206a6209214508dfee492fda4248"", ""67a926c90e61206a6209214508dfee492fda4248""]","[""ComplexClass"", ""IntensiveCoupling"", ""LongParameterList"", ""LongMethod"", ""FeatureEnvy""]","[""42b702c4678590679c1b46ea81067630"", ""7f83da5aeacd503e62a7d753c20b6378"", ""e0c72f2c807fbe1161c8c0b6bffc1c32"", ""ae6b45a4118eab7ca670b7eeefd41d23"", ""3805965e4b7e60dac1eb102cb28073e7""]","[40, 304, 304, 304, 304]","[436, 405, 405, 405, 405]","[""CC = 13.0"", ""CINT = 21.0, CDISP = 0.42857142857142855, CC > 1.0"", ""PARAMETER_COUNT > 0.9482039469588349"", ""MLOC > 6.861233891552117"", ""CALLS_TO_org.apache.catalina.Context > 5""]"
Researcher 2,apache_tomcat,20819,"[""Extract Method"", ""Extract Method"", ""Extract Method"", ""Extract Method""]","[""org.apache.catalina.startup.ContextConfig"", ""org.apache.catalina.startup.ContextConfig.processAnnotationsJndi(URL,WebXml,boolean)"", ""org.apache.catalina.startup.ContextConfig.processAnnotationsWebResource(WebResource,WebXml,boolean)"", ""org.apache.catalina.startup.ContextConfig.webConfig()""]","[""525fa450031af1ac2f10fbf7bc029e248be66a93"", ""525fa450031af1ac2f10fbf7bc029e248be66a93"", ""525fa450031af1ac2f10fbf7bc029e248be66a93"", ""525fa450031af1ac2f10fbf7bc029e248be66a93"", ""525fa450031af1ac2f10fbf7bc029e248be66a93"", ""525fa450031af1ac2f10fbf7bc029e248be66a93"", ""525fa450031af1ac2f10fbf7bc029e248be66a93"", ""525fa450031af1ac2f10fbf7bc029e248be66a93"", ""525fa450031af1ac2f10fbf7bc029e248be66a93"", ""525fa450031af1ac2f10fbf7bc029e248be66a93"", ""525fa450031af1ac2f10fbf7bc029e248be66a93"", ""525fa450031af1ac2f10fbf7bc029e248be66a93"", ""525fa450031af1ac2f10fbf7bc029e248be66a93""]","[""SpaghettiCode"", ""ComplexClass"", ""GodClass"", ""IntensiveCoupling"", ""LongMethod"", ""FeatureEnvy"", ""IntensiveCoupling"", ""LongMethod"", ""FeatureEnvy"", ""IntensiveCoupling"", ""LongMethod"", ""IntensiveCoupling"", ""LongMethod""]","[""3c975593f6a50cd5c71bebac179ea33b"", ""9124dcd8703db100c93c87b7ced0241e"", ""c6588047bdedfb938b8a3825b3c180c7"", ""a082fa4997a23a6aa24ee3b5ead8ea35"", ""cf70ff395df70b585e1537293a1639eb"", ""37a18c6d7edffa23560ed9664677c01f"", ""7d1b20bc9e785c56a214c57f31bd09c2"", ""76a9718ea3196dfc78dd8ae9b86e7758"", ""c7b78fc959dc4adfbc4494c636a98454"", ""524904b2d7c8f0f04b50e0f9062c5713"", ""4b30af0c6c2d4906205b4ab53e35e4a1"", ""524904b2d7c8f0f04b50e0f9062c5713"", ""4b30af0c6c2d4906205b4ab53e35e4a1""]","[83, 83, 83, 629, 629, 629, 2010, 2010, 2010, 268, 268, 268, 268]","[2533, 2533, 2533, 812, 812, 812, 2193, 2193, 2193, 621, 621, 621, 621]","[""LONG_METHODS_CONNECTED = 6"", ""CC = 47.0"", ""CLOC > 500, TCC < 0.4276029126892707"", ""CINT = 31.0, CDISP = 0.4838709677419355, CC > 1.0"", ""MLOC > 7.8383512722588975"", ""CALLS_TO_org.apache.derby.iapi.sql.dictionary.ConglomerateDescriptor > 4"", ""CINT = 36.0, CDISP = 0.4166666666666667, CC > 1.0"", ""MLOC > 7.8383512722588975"", ""CALLS_TO_org.apache.derby.iapi.sql.dictionary.TableDescriptor > 7"", ""CINT = 38.0, CDISP = 0.3684210526315789, CC > 1.0"", ""MLOC > 7.837528831130841"", ""CINT = 38.0, CDISP = 0.3684210526315789, CC > 1.0"", ""MLOC > 7.837528831130841""]","[""527baba1736d3111596fb19dba367460fdb2808c"", ""527baba1736d3111596fb19dba367460fdb2808c"", ""527baba1736d3111596fb19dba367460fdb2808c"", ""527baba1736d3111596fb19dba367460fdb2808c"", ""527baba1736d3111596fb19dba367460fdb2808c"", ""527baba1736d3111596fb19dba367460fdb2808c"", ""527baba1736d3111596fb19dba367460fdb2808c"", ""527baba1736d3111596fb19dba367460fdb2808c""]","[""SpaghettiCode"", ""ComplexClass"", ""ClassDataShouldBePrivate"", ""GodClass"", ""DispersedCoupling"", ""FeatureEnvy"", ""IntensiveCoupling"", ""LongMethod""]","[""e793f4451c1a592370615b3c5a198607"", ""af28c6e13bdd320b850068a72aab2231"", ""55bb1fc1b4d1c0b2288663665fb615fd"", ""7628ef6afa559ce2cc0d3adb2b511c2c"", ""3ba8cbe38c5a4514a972d0fb2fda56a0"", ""94306d7bb45dad919435a418b4f5239f"", ""a22dfa2c16fc0555324d356795c1f69b"", ""89b84e10d5903f2487fe6ee7ece233f5""]","[111, 111, 111, 111, 1885, 1885, 1134, 1134]","[2610, 2610, 2610, 2610, 1917, 1917, 1313, 1313]","[""LONG_METHODS_CONNECTED = 12"", ""CC = 14.0"", ""PUBLIC_FIELD_COUNT = 2.0"", ""CLOC > 500, TCC < 0.48007932503269046"", ""CINT > 8.0, CDISP > 0.5, CC > 1.0"", ""CALLS_TO_org.apache.catalina.WebResource > 8"", ""CINT = 28.0, CDISP = 0.2857142857142857, CC > 1.0"", ""MLOC > 6.83012326656397""]"
Researcher 2,apache_tomcat,20827,"[""Inline Method"", ""Inline Method"", ""Extract Method"", ""Extract Method"", ""Inline Method"", ""Inline Method"", ""Extract Method"", ""Extract Method"", ""Rename Method"", ""Rename Method""]","[""org.apache.tomcat.util.net.AprEndpoint.Poller"", ""org.apache.tomcat.util.net.AprEndpoint.Poller.doPoll(long)"", ""org.apache.tomcat.util.net.AprEndpoint.Poller.run()"", ""org.apache.tomcat.util.net.AprEndpoint.Poller.addToPoller(long,int)"", ""org.apache.tomcat.util.net.AprEndpoint.Poller.doTimeout(long)"", ""org.apache.tomcat.util.net.AprEndpoint.Poller.removeFromPoller(long)"", ""org.apache.tomcat.util.net.AprEndpoint.Poller.getKeepAliveCount()"", ""org.apache.tomcat.util.net.AprEndpoint.Poller.getConnectionCount()""]","[""022cb5be9c6b398e5aac501450b19249b37e8b18"", ""022cb5be9c6b398e5aac501450b19249b37e8b18"", ""022cb5be9c6b398e5aac501450b19249b37e8b18"", ""022cb5be9c6b398e5aac501450b19249b37e8b18"", ""022cb5be9c6b398e5aac501450b19249b37e8b18"", ""022cb5be9c6b398e5aac501450b19249b37e8b18"", ""022cb5be9c6b398e5aac501450b19249b37e8b18"", ""022cb5be9c6b398e5aac501450b19249b37e8b18""]","[""SpaghettiCode"", ""ComplexClass"", ""DispersedCoupling"", ""LongParameterList"", ""FeatureEnvy"", ""DispersedCoupling"", ""LongParameterList"", ""FeatureEnvy""]","[""00634620d072b4d938de5eb2778a505d"", ""07cb91662fea60a4bb09072493dce69f"", ""c96a7d3c3fccc1dfb6a401b7584df3fd"", ""80bbc671e3effeca1083267add522964"", ""f072693fb1317c1a894e42e7089da09d"", ""c96a7d3c3fccc1dfb6a401b7584df3fd"", ""80bbc671e3effeca1083267add522964"", ""f072693fb1317c1a894e42e7089da09d""]","[72, 72, 114, 133, 114, 114, 133, 114]","[1391, 1391, 177, 157, 177, 177, 157, 177]","[""LONG_METHODS_CONNECTED = 3"", ""CC = 25.0"", ""CINT > 8.0, CDISP > 0.5, CC > 1.0"", ""PARAMETER_COUNT > 1.180098316698937"", ""CALLS_TO_org.apache.derby.catalog.Dependable > 5"", ""CINT > 8.0, CDISP > 0.5, CC > 1.0"", ""PARAMETER_COUNT > 1.180098316698937"", ""CALLS_TO_org.apache.derby.catalog.Dependable > 5""]","[""ebced56615fd7db95b22ffbc20a81be1281e2d25"", ""ebced56615fd7db95b22ffbc20a81be1281e2d25"", ""ebced56615fd7db95b22ffbc20a81be1281e2d25"", ""ebced56615fd7db95b22ffbc20a81be1281e2d25"", ""ebced56615fd7db95b22ffbc20a81be1281e2d25""]","[""BrainMethod"", ""IntensiveCoupling"", ""LongMethod"", ""FeatureEnvy"", ""ComplexClass""]","[""f1855a271dc7e0601c0cffb197137b12"", ""31f5d75549c374b465126de83e9fcae3"", ""77c94ec633d7391cd6557423bded2668"", ""7f52a0284a728acec7dea3ec48a1f849"", ""ad7eb915ee3e90266d6cf8ee7fc1ac44""]","[1585, 1585, 1585, 1585, 1248]","[1896, 1896, 1896, 1896, 1897]","[""MLOC > 89.359676119047, CC > 7.8403777564238055, MAX_NESTING > 5.0, NOAV > 6.0"", ""CINT = 33.0, CDISP = 0.36363636363636365, CC > 1.0"", ""MLOC > 6.875267202033578"", ""CALLS_TO_org.apache.tomcat.util.net.AprEndpoint.SocketList > 16"", ""CC = 73.0""]"
Researcher 2,apache_tomcat,20880,"[""Extract Method"", ""Extract Method"", ""Extract Method"", ""Extract Method"", ""Extract Method"", ""Extract Method""]","[""org.apache.catalina.mResearcher 1ger.MResearcher 1gerServlet"", ""org.apache.catalina.mResearcher 1ger.MResearcher 1gerServlet.deploy(PrintWriter,String,ContextName,String,boolean,StringMResearcher 1ger)"", ""org.apache.catalina.mResearcher 1ger.MResearcher 1gerServlet.writeDeployResult(PrintWriter,StringMResearcher 1ger,String,String)"", ""org.apache.catalina.mResearcher 1ger.MResearcher 1gerServlet.deploy(PrintWriter,ContextName,String,boolean,HttpServletRequest,StringMResearcher 1ger)"", ""org.apache.catalina.mResearcher 1ger.MResearcher 1gerServlet.deploy(PrintWriter,ContextName,String,StringMResearcher 1ger)""]","[""0be8cb5366ea646682c203026357c3f37afccd93"", ""0be8cb5366ea646682c203026357c3f37afccd93"", ""0be8cb5366ea646682c203026357c3f37afccd93"", ""0be8cb5366ea646682c203026357c3f37afccd93"", ""0be8cb5366ea646682c203026357c3f37afccd93"", ""0be8cb5366ea646682c203026357c3f37afccd93"", ""0be8cb5366ea646682c203026357c3f37afccd93"", ""0be8cb5366ea646682c203026357c3f37afccd93""]","[""DispersedCoupling"", ""LongParameterList"", ""SpaghettiCode"", ""ComplexClass"", ""ClassDataShouldBePrivate"", ""GodClass"", ""LongParameterList"", ""FeatureEnvy""]","[""78dfb92faceb184119e4cc201bad6ff6"", ""ce2c3ce83792f5ecc19aa981810204dd"", ""7dff2048a8225ab3ed42c4b85a58ba16"", ""57e92d34fa250d5def40de45eee4dab1"", ""f0be238e7d2a9f0851e693a354a0c662"", ""1fbae94e26d0325a9b6a3a0d91a5f4ba"", ""225f2988cb5c540d34117ab6608a5188"", ""e807910acbdd19b233a15728429012b8""]","[10382, 10382, 156, 156, 156, 156, 8835, 8835]","[10457, 10457, 11291, 11291, 11291, 11291, 8918, 8918]","[""CINT > 8.0, CDISP > 0.5, CC > 1.0"", ""PARAMETER_COUNT > 1.1759726007573748"", ""LONG_METHODS_CONNECTED = 17"", ""CC = 22.0"", ""PUBLIC_FIELD_COUNT = 3.0"", ""CLOC > 500, TCC < 0.4268867393916222"", ""PARAMETER_COUNT > 1.1759932578858818"", ""CALLS_TO_org.apache.derby.iapi.services.io.FormatableBitSet > 4""]","[""d8fc6df4135e3a200cbea1f4329e7fd156a166e2"", ""d8fc6df4135e3a200cbea1f4329e7fd156a166e2"", ""d8fc6df4135e3a200cbea1f4329e7fd156a166e2"", ""d8fc6df4135e3a200cbea1f4329e7fd156a166e2"", ""d8fc6df4135e3a200cbea1f4329e7fd156a166e2"", ""d8fc6df4135e3a200cbea1f4329e7fd156a166e2"", ""d8fc6df4135e3a200cbea1f4329e7fd156a166e2"", ""d8fc6df4135e3a200cbea1f4329e7fd156a166e2"", ""d8fc6df4135e3a200cbea1f4329e7fd156a166e2"", ""d8fc6df4135e3a200cbea1f4329e7fd156a166e2"", ""d8fc6df4135e3a200cbea1f4329e7fd156a166e2"", ""d8fc6df4135e3a200cbea1f4329e7fd156a166e2""]","[""IntensiveCoupling"", ""LongParameterList"", ""IntensiveCoupling"", ""LongParameterList"", ""LongMethod"", ""IntensiveCoupling"", ""LongParameterList"", ""LongMethod"", ""LongParameterList"", ""SpaghettiCode"", ""ComplexClass"", ""GodClass""]","[""58ddd7493e52b3561904cd4d14f9878f"", ""e3259baa723c50aeb1698aab27013034"", ""071ce4624b3d32b9e1709e4402d25726"", ""d61e572d856d2fd4bbf5b5266c885a0e"", ""b9bc1061056c0cc2d5846208bf569556"", ""da95219f5cf1ebeddebc6c8e350d38c5"", ""a44303e26a436e23bbf0faa0611ffa11"", ""094fa40f0f61aaee5d8086dbb640fafb"", ""53aaf790fcf791228fb42bf1d0ebebfe"", ""1434b7ffac84302178b2297ac9cfa81c"", ""d03dd66d53ec9c8d381aad5a4618109e"", ""d81c7d5588186f700b84773711c8d4d5""]","[727, 729, 785, 796, 796, 631, 631, 631, 900, 66, 66, 66]","[782, 793, 897, 912, 912, 726, 726, 726, 915, 1686, 1686, 1686]","[""CINT = 13.0, CDISP = 0.38461538461538464, CC > 1.0"", ""PARAMETER_COUNT > 0.9462862423472285"", ""CINT = 17.0, CDISP = 0.47058823529411764, CC > 1.0"", ""PARAMETER_COUNT > 0.9462862423472285"", ""MLOC > 6.874321358438148"", ""CINT = 17.0, CDISP = 0.4117647058823529, CC > 1.0"", ""PARAMETER_COUNT > 0.9462862423472285"", ""MLOC > 6.874321358438148"", ""PARAMETER_COUNT > 0.9414614907882141"", ""LONG_METHODS_CONNECTED = 8"", ""CC = 39.0"", ""CLOC > 500, TCC < 0.4808063174919667""]"
Researcher 2,apache_tomcat,20910,"[""Extract Method"", ""Extract Method"", ""Extract Method"", ""Extract Method"", ""Inline Method"", ""Inline Method""]","[""org.apache.tomcat.util.net.SocketWrapperBase.write(boolean,byte,int,int)"", ""org.apache.tomcat.util.net.SocketWrapperBase"", ""org.apache.tomcat.util.net.SocketWrapperBase.writeBlocking(byte,int,int)"", ""org.apache.tomcat.util.net.SocketWrapperBase.writeNonBlocking(byte,int,int)"", ""org.apache.tomcat.util.net.SocketWrapperBase.flush(boolean,boolean)"", ""org.apache.tomcat.util.net.SocketWrapperBase.flush(boolean)""]","[""14621ff2721d9ae552d5e8ed54fa777b413392c8"", ""14621ff2721d9ae552d5e8ed54fa777b413392c8"", ""14621ff2721d9ae552d5e8ed54fa777b413392c8"", ""14621ff2721d9ae552d5e8ed54fa777b413392c8"", ""14621ff2721d9ae552d5e8ed54fa777b413392c8"", ""14621ff2721d9ae552d5e8ed54fa777b413392c8"", ""14621ff2721d9ae552d5e8ed54fa777b413392c8"", ""14621ff2721d9ae552d5e8ed54fa777b413392c8"", ""14621ff2721d9ae552d5e8ed54fa777b413392c8""]","[""IntensiveCoupling"", ""LongParameterList"", ""LongMethod"", ""FeatureEnvy"", ""SpaghettiCode"", ""ComplexClass"", ""IntensiveCoupling"", ""LongMethod"", ""FeatureEnvy""]","[""a692bb7de25e381270cb937b1c7c2a79"", ""2903e54b6db0254b2cc748a2b5de3c84"", ""4a44c2f26043b58f2a84f2514edb4705"", ""6f43e33c3431a87e08ab46518c26ca0b"", ""6705cc6be1b7c1ed9f03ade53b54b598"", ""bd4f854964b76208fd23f0e78a2a9fc3"", ""3e8347502e464aa3cdb572ace722ec61"", ""5c008872266ae321b171582f5c2422bc"", ""a9a50702f0c6b2764f7ef91c6519c2a6""]","[238, 216, 216, 216, 40, 41, 88, 88, 88]","[452, 374, 374, 374, 472, 481, 236, 214, 214]","[""CINT = 9.0, CDISP = 0.3333333333333333, CC > 1.0"", ""PARAMETER_COUNT > 1.1758515579639652"", ""MLOC > 7.946705051286362"", ""CALLS_TO_java.sql.PreparedStatement > 13"", ""LONG_METHODS_CONNECTED = 2"", ""CC = 13.0"", ""CINT = 9.0, CDISP = 0.3333333333333333, CC > 1.0"", ""MLOC > 8.252503728956935"", ""CALLS_TO_org.apache.derbyTesting.functionTests.tests.store.BaseTest > 4""]","[""5a37fdb716f0ff812926667caa836177aa3bef7b""]","[""FeatureEnvy""]","[""410599a1ec35b3e4d95f5831d6aaee0d""]",[400],[433],"[""CALLS_TO_org.apache.tomcat.util.net.SocketWrapperBase<E> > 6""]"
Researcher 2,apache_tomcat,20956,"[""Extract Method"", ""Extract Method"", ""Rename Method"", ""Rename Method"", ""Extract Method"", ""Extract Method"", ""Extract Method"", ""Extract Method"", ""Extract Method"", ""Extract Method""]","[""org.apache.catalina.authenticator.jaspic.provider.modules.FormAuthModule"", ""org.apache.catalina.authenticator.jaspic.provider.modules.FormAuthModule.validate(MessageInfo,Subject)"", ""org.apache.catalina.authenticator.jaspic.provider.modules.FormAuthModule.handleNoLoginAction(Request,HttpServletResponse)"", ""org.apache.catalina.authenticator.jaspic.provider.modules.FormAuthModule.matchRequest(Request)"", ""org.apache.catalina.authenticator.jaspic.provider.modules.FormAuthModule.isMatchingSavedRequest(Request)"", ""org.apache.catalina.authenticator.jaspic.provider.modules.FormAuthModule.handleLoginAction(Request,HttpServletResponse)"", ""org.apache.catalina.authenticator.jaspic.provider.modules.FormAuthModule.isLoginActionRequest(Request)"", ""org.apache.catalina.authenticator.jaspic.provider.modules.FormAuthModule.submitSavedRequest(Subject,Request,HttpServletResponse)""]","[""4ee7918f4c0dd9a7b1718bc42224066bb7a8e299"", ""4ee7918f4c0dd9a7b1718bc42224066bb7a8e299"", ""4ee7918f4c0dd9a7b1718bc42224066bb7a8e299"", ""4ee7918f4c0dd9a7b1718bc42224066bb7a8e299"", ""4ee7918f4c0dd9a7b1718bc42224066bb7a8e299"", ""4ee7918f4c0dd9a7b1718bc42224066bb7a8e299"", ""4ee7918f4c0dd9a7b1718bc42224066bb7a8e299"", ""4ee7918f4c0dd9a7b1718bc42224066bb7a8e299"", ""4ee7918f4c0dd9a7b1718bc42224066bb7a8e299"", ""4ee7918f4c0dd9a7b1718bc42224066bb7a8e299"", ""4ee7918f4c0dd9a7b1718bc42224066bb7a8e299"", ""4ee7918f4c0dd9a7b1718bc42224066bb7a8e299"", ""4ee7918f4c0dd9a7b1718bc42224066bb7a8e299"", ""4ee7918f4c0dd9a7b1718bc42224066bb7a8e299"", ""4ee7918f4c0dd9a7b1718bc42224066bb7a8e299"", ""4ee7918f4c0dd9a7b1718bc42224066bb7a8e299"", ""4ee7918f4c0dd9a7b1718bc42224066bb7a8e299"", ""4ee7918f4c0dd9a7b1718bc42224066bb7a8e299"", ""4ee7918f4c0dd9a7b1718bc42224066bb7a8e299"", ""4ee7918f4c0dd9a7b1718bc42224066bb7a8e299""]","[""DispersedCoupling"", ""LongParameterList"", ""FeatureEnvy"", ""LongParameterList"", ""FeatureEnvy"", ""DispersedCoupling"", ""LongParameterList"", ""FeatureEnvy"", ""LongParameterList"", ""FeatureEnvy"", ""IntensiveCoupling"", ""LongParameterList"", ""FeatureEnvy"", ""SpaghettiCode"", ""ComplexClass"", ""GodClass"", ""DispersedCoupling"", ""LongParameterList"", ""LongMethod"", ""FeatureEnvy""]","[""b9864d00bf01b5ce29dcae259381112a"", ""224f586896403e259fd36381910d0ea1"", ""1dedb8dfb2502a982c03a023338b036b"", ""ed290148dbaddc393f7b017f18799960"", ""c6e68d67cf5faa071adf545411ad1c11"", ""eaafffaede170f18fca7f55fc6b7735c"", ""773a3ba1189fd2394908e484634003af"", ""d75b4dd47bd9ecfad3693951b273cfeb"", ""0a13a4de9dbcde1e431b103fb39841c0"", ""75d6de9858b7a071dde2ce5a7ab6b9be"", ""ad5d16e176311d76db7ba38ecd2b1771"", ""86b18bab076febc41c558adb8c85619f"", ""f806d02e754a7da7838eb35e42c1a4c0"", ""e8ea4a9a374e0ea3d899d04fa8d25a46"", ""09ccd218baea0722d85c3c413650a9f7"", ""b6af47c56bb323d8c5e7b3d7602900b0"", ""d37416fd3e3bb71caf25d2eb0faf9427"", ""0efa7b50fbfd8e4343beb41b32ddf50e"", ""8eaafbe8c2aba548e1f52a0be69525cc"", ""340a94716de9aa4b50d88e7dd0c80f0c""]","[437, 437, 437, 3115, 3119, 402, 406, 402, 381, 373, 3087, 3087, 3087, 35, 35, 39, 946, 946, 946, 946]","[487, 483, 487, 3128, 3136, 436, 436, 436, 405, 401, 3114, 3114, 3114, 3503, 3503, 3192, 1021, 1021, 1021, 1021]","[""CINT > 8.0, CDISP > 0.5, CC > 1.0"", ""PARAMETER_COUNT > 1.176066888985522"", ""CALLS_TO_org.apache.derby.jdbc.ClientBaseDataSource > 4"", ""PARAMETER_COUNT > 1.176066888985522"", ""CALLS_TO_org.apache.derby.jdbc.ClientBaseDataSource > 4"", ""CINT > 8.0, CDISP > 0.5, CC > 1.0"", ""PARAMETER_COUNT > 1.176066888985522"", ""CALLS_TO_org.apache.derby.jdbc.ClientBaseDataSource > 4"", ""PARAMETER_COUNT > 1.176066888985522"", ""CALLS_TO_org.apache.derby.jdbc.ClientBaseDataSource > 4"", ""CINT = 11.0, CDISP = 0.45454545454545453, CC > 1.0"", ""PARAMETER_COUNT > 1.176066888985522"", ""CALLS_TO_java.sql.PreparedStatement > 4"", ""LONG_METHODS_CONNECTED = 6"", ""CC = 11.0"", ""CLOC > 500, TCC < 0.407300078351677"", ""CINT > 8.0, CDISP > 0.5, CC > 1.0"", ""PARAMETER_COUNT > 1.1953917533880227"", ""MLOC > 7.578442423129675"", ""CALLS_TO_org.apache.derbyTesting.functionTests.tests.replicationTests.Utils > 7""]","[""6022c2d1937db51d05ce40ff208e9c9636c99335"", ""6022c2d1937db51d05ce40ff208e9c9636c99335""]","[""ComplexClass"", ""IntensiveCoupling""]","[""998f9be5d0893a1f2c562489ce132175"", ""4bf80d4f492d0b75ab6302f21b998c6d""]","[57, 104]","[632, 149]","[""CC = 13.0"", ""CINT = 15.0, CDISP = 0.4666666666666667, CC > 1.0""]"
Researcher 2,apache_tomcat,20959,"[""Extract Method"", ""Extract Method"", ""Extract Method"", ""Extract Method"", ""Extract Method"", ""Extract Method"", ""Extract Method"", ""Extract Method"", ""Extract Method"", ""Extract Method"", ""Pull Up Method"", ""Pull Up Method"", ""Pull Up Method"", ""Pull Up Method"", ""Pull Up Method"", ""Pull Up Method"", ""Extract Method"", ""Extract Method"", ""Inline Method"", ""Inline Method""]","[""org.apache.coyote.ajp.AjpProcessor"", ""org.apache.coyote.ajp.AjpProcessor.dispatch(SocketStatus)"", ""org.apache.coyote.ajp.AjpProcessor.flushBufferedWrite()"", ""org.apache.coyote.http11.Http11Processor"", ""org.apache.coyote.http11.Http11Processor.dispatch(SocketStatus)"", ""org.apache.coyote.http11.Http11Processor.dispatchEndRequest()"", ""org.apache.coyote.ajp.AjpProcessor.dispatchEndRequest()"", ""org.apache.coyote.http2.StreamProcessor"", ""org.apache.coyote.http2.StreamProcessor.dispatch(SocketStatus)"", ""org.apache.coyote.http2.StreamProcessor.flushBufferedWrite()"", ""org.apache.coyote.http11.Http11Processor.flushBufferedWrite()"", ""org.apache.coyote.AbstractProcessor"", ""org.apache.coyote.AbstractProcessor.dispatch(SocketStatus)"", ""org.apache.coyote.http2.StreamProcessor.dispatchEndRequest()"", ""org.apache.coyote.http2.StreamProcessor.process(SocketStatus)"", ""org.apache.coyote.http2.StreamProcessor.run()""]","[""6a53c94a2678153fb26f462b4df0c52b2da0922d"", ""6a53c94a2678153fb26f462b4df0c52b2da0922d"", ""6a53c94a2678153fb26f462b4df0c52b2da0922d""]","[""IntensiveCoupling"", ""LongMethod"", ""FeatureEnvy""]","[""782b4fb174d940a349329d1c7e9a0df2"", ""e5a38d3d384127bd322cc0a31ccf9647"", ""19356a3300620d11f8dfe371326d36b2""]","[51, 51, 51]","[151, 151, 151]","[""CINT = 18.0, CDISP = 0.2777777777777778, CC > 1.0"", ""MLOC > 7.93721962278708"", ""CALLS_TO_java.sql.ResultSet > 5""]","[""c4760089e640aa9763aca14f003f6d1c872d5982"", ""c4760089e640aa9763aca14f003f6d1c872d5982"", ""c4760089e640aa9763aca14f003f6d1c872d5982""]","[""ComplexClass"", ""DispersedCoupling"", ""FeatureEnvy""]","[""8738971dbdceb15534f90f05b6301e38"", ""7bd231fb328636d73fe6a5f4d28f59bc"", ""d5030ec8534d65fa05f1532bc7c3f36a""]","[41, 62, 62]","[579, 115, 115]","[""CC = 56.0"", ""CINT > 8.0, CDISP > 0.5, CC > 1.0"", ""CALLS_TO_org.apache.coyote.AbstractProcessor > 5""]"
Researcher 2,apache_tomcat,20971,"[""Extract Method"", ""Extract Method"", ""Extract Method"", ""Extract Method"", ""Move Attribute"", ""Move Attribute""]","[""org.apache.tomcat.util.net.openssl.OpenSSLEngine.pendingReadableBytesInSSL()"", ""org.apache.tomcat.util.net.openssl.OpenSSLEngine"", ""org.apache.tomcat.util.net.openssl.OpenSSLEngine.checkLastError()"", ""org.apache.tomcat.util.net.openssl.OpenSSLEngine.handshake()"", ""org.apache.tomcat.util.net.openssl.OpenSSLEngine.OpenSSLSession""]","[""02ac42cee63d0e7815c8075f85dbddcc31a6049f"", ""02ac42cee63d0e7815c8075f85dbddcc31a6049f"", ""02ac42cee63d0e7815c8075f85dbddcc31a6049f"", ""02ac42cee63d0e7815c8075f85dbddcc31a6049f"", ""02ac42cee63d0e7815c8075f85dbddcc31a6049f"", ""02ac42cee63d0e7815c8075f85dbddcc31a6049f"", ""02ac42cee63d0e7815c8075f85dbddcc31a6049f"", ""02ac42cee63d0e7815c8075f85dbddcc31a6049f"", ""02ac42cee63d0e7815c8075f85dbddcc31a6049f"", ""02ac42cee63d0e7815c8075f85dbddcc31a6049f"", ""02ac42cee63d0e7815c8075f85dbddcc31a6049f"", ""02ac42cee63d0e7815c8075f85dbddcc31a6049f"", ""02ac42cee63d0e7815c8075f85dbddcc31a6049f"", ""02ac42cee63d0e7815c8075f85dbddcc31a6049f""]","[""ShotgunSurgery"", ""LongParameterList"", ""LongMethod"", ""FeatureEnvy"", ""LongParameterList"", ""LongParameterList"", ""ShotgunSurgery"", ""LongParameterList"", ""LongMethod"", ""FeatureEnvy"", ""LongParameterList"", ""SpaghettiCode"", ""ComplexClass"", ""GodClass""]","[""43ea9b1f1d8a1e26ab71c1cf2f3f665a"", ""4d5cce9bb4ad006853395da36a34a345"", ""c17487b31b941f3a3b9d73d9bb90965d"", ""fbc8669d4cf364da716b01b58260f1b6"", ""45f0ce5f59dca40c6d9a7e35d5221ac2"", ""146c7a004f99e59a8838fbf98ce74e65"", ""b318fee72c983c211f98f1540ec2b9bd"", ""b1b80f600e171f34f3a65c292c9c7351"", ""b7dd96a9a341ada7d7fb58161720b13c"", ""c6d8ccdd9a2317424b7bc3f6b82a90db"", ""a0da2e3c89e2a8c4c3b779366fa2b7ae"", ""e8ea4a9a374e0ea3d899d04fa8d25a46"", ""09ccd218baea0722d85c3c413650a9f7"", ""b6af47c56bb323d8c5e7b3d7602900b0""]","[2160, 2160, 2160, 2160, 2789, 1531, 2170, 2024, 2024, 2024, 2167, 35, 35, 39]","[2298, 2298, 2298, 2298, 2845, 1546, 2287, 2085, 2085, 2085, 2224, 3503, 3503, 3192]","[""CM > 8.0, CC > 6.0"", ""PARAMETER_COUNT > 1.1802749581157237"", ""MLOC > 7.873706514240143"", ""CALLS_TO_org.apache.derbyTesting.functionTests.tests.replicationTests.Utils > 14"", ""PARAMETER_COUNT > 1.1944720985066999"", ""PARAMETER_COUNT > 1.1765482829468539"", ""CM > 8.0, CC > 6.0"", ""PARAMETER_COUNT > 1.1755934486158597"", ""MLOC > 7.939657038407848"", ""CALLS_TO_org.apache.derbyTesting.functionTests.tests.replicationTests.Utils > 9"", ""PARAMETER_COUNT > 1.1755934486158597"", ""LONG_METHODS_CONNECTED = 6"", ""CC = 11.0"", ""CLOC > 500, TCC < 0.407300078351677""]","[""4ad57e2e7ab291a5eec021edc7cf1808b2eb7e8a"", ""4ad57e2e7ab291a5eec021edc7cf1808b2eb7e8a"", ""4ad57e2e7ab291a5eec021edc7cf1808b2eb7e8a"", ""4ad57e2e7ab291a5eec021edc7cf1808b2eb7e8a"", ""4ad57e2e7ab291a5eec021edc7cf1808b2eb7e8a""]","[""DataClass"", ""ComplexClass"", ""SpaghettiCode"", ""ComplexClass"", ""GodClass""]","[""de7dce7c645e04cc573214b1f2903f3a"", ""d6c01d35ed82472c45da7937ae014890"", ""34ecc864453c184cc405232aaf01ccda"", ""78aa4e899089452c1f6040c86adc75ff"", ""150a03581d7f600c8aa6f60d1778c798""]","[1076, 1076, 56, 56, 56]","[1338, 1338, 1355, 1355, 1355]","[""WOC = 0.19047619047619047, NOPA = 0.0, NOAM = 17.0, WMC = 60.0"", ""CC = 11.0"", ""LONG_METHODS_CONNECTED = 3"", ""CC = 19.0"", ""CLOC > 500, TCC < 0.4877410010384323""]"
Researcher 2,apache_tomcat,20979,"[""Extract Method"", ""Extract Method"", ""Inline Method"", ""Inline Method""]","[""org.apache.catalina.loader.WebappClassLoaderBase"", ""org.apache.catalina.loader.WebappClassLoaderBase.findClassInternal(String)"", ""org.apache.catalina.loader.WebappClassLoaderBase.findResourceInternal(String,String)"", ""org.apache.catalina.loader.WebappClassLoaderBase.findResourceInternal(String,String,boolean)""]","[""02ac42cee63d0e7815c8075f85dbddcc31a6049f"", ""02ac42cee63d0e7815c8075f85dbddcc31a6049f"", ""02ac42cee63d0e7815c8075f85dbddcc31a6049f"", ""02ac42cee63d0e7815c8075f85dbddcc31a6049f"", ""02ac42cee63d0e7815c8075f85dbddcc31a6049f"", ""02ac42cee63d0e7815c8075f85dbddcc31a6049f"", ""02ac42cee63d0e7815c8075f85dbddcc31a6049f"", ""02ac42cee63d0e7815c8075f85dbddcc31a6049f"", ""02ac42cee63d0e7815c8075f85dbddcc31a6049f"", ""02ac42cee63d0e7815c8075f85dbddcc31a6049f"", ""02ac42cee63d0e7815c8075f85dbddcc31a6049f"", ""02ac42cee63d0e7815c8075f85dbddcc31a6049f"", ""02ac42cee63d0e7815c8075f85dbddcc31a6049f"", ""02ac42cee63d0e7815c8075f85dbddcc31a6049f""]","[""ShotgunSurgery"", ""LongParameterList"", ""LongMethod"", ""FeatureEnvy"", ""LongParameterList"", ""LongParameterList"", ""ShotgunSurgery"", ""LongParameterList"", ""LongMethod"", ""FeatureEnvy"", ""LongParameterList"", ""SpaghettiCode"", ""ComplexClass"", ""GodClass""]","[""43ea9b1f1d8a1e26ab71c1cf2f3f665a"", ""4d5cce9bb4ad006853395da36a34a345"", ""c17487b31b941f3a3b9d73d9bb90965d"", ""fbc8669d4cf364da716b01b58260f1b6"", ""45f0ce5f59dca40c6d9a7e35d5221ac2"", ""146c7a004f99e59a8838fbf98ce74e65"", ""b318fee72c983c211f98f1540ec2b9bd"", ""b1b80f600e171f34f3a65c292c9c7351"", ""b7dd96a9a341ada7d7fb58161720b13c"", ""c6d8ccdd9a2317424b7bc3f6b82a90db"", ""a0da2e3c89e2a8c4c3b779366fa2b7ae"", ""e8ea4a9a374e0ea3d899d04fa8d25a46"", ""09ccd218baea0722d85c3c413650a9f7"", ""b6af47c56bb323d8c5e7b3d7602900b0""]","[2160, 2160, 2160, 2160, 2789, 1531, 2170, 2024, 2024, 2024, 2167, 35, 35, 39]","[2298, 2298, 2298, 2298, 2845, 1546, 2287, 2085, 2085, 2085, 2224, 3503, 3503, 3192]","[""CM > 8.0, CC > 6.0"", ""PARAMETER_COUNT > 1.1802749581157237"", ""MLOC > 7.873706514240143"", ""CALLS_TO_org.apache.derbyTesting.functionTests.tests.replicationTests.Utils > 14"", ""PARAMETER_COUNT > 1.1944720985066999"", ""PARAMETER_COUNT > 1.1765482829468539"", ""CM > 8.0, CC > 6.0"", ""PARAMETER_COUNT > 1.1755934486158597"", ""MLOC > 7.939657038407848"", ""CALLS_TO_org.apache.derbyTesting.functionTests.tests.replicationTests.Utils > 9"", ""PARAMETER_COUNT > 1.1755934486158597"", ""LONG_METHODS_CONNECTED = 6"", ""CC = 11.0"", ""CLOC > 500, TCC < 0.407300078351677""]","[""bd3cd71dd8a40b02e1728d98a9c241ef630573ef"", ""bd3cd71dd8a40b02e1728d98a9c241ef630573ef"", ""bd3cd71dd8a40b02e1728d98a9c241ef630573ef"", ""bd3cd71dd8a40b02e1728d98a9c241ef630573ef"", ""bd3cd71dd8a40b02e1728d98a9c241ef630573ef"", ""bd3cd71dd8a40b02e1728d98a9c241ef630573ef"", ""bd3cd71dd8a40b02e1728d98a9c241ef630573ef"", ""bd3cd71dd8a40b02e1728d98a9c241ef630573ef""]","[""SpeculativeGenerality"", ""SpaghettiCode"", ""ComplexClass"", ""ClassDataShouldBePrivate"", ""GodClass"", ""LongMethod"", ""LongMethod"", ""FeatureEnvy""]","[""315b85560519662faced99d8f6a865d0"", ""150e7f295d6b57a51b21f452bcc99534"", ""19d25e573db4517abc68bc2a9834b1cf"", ""37af1467227348e6e941788a0fdd369b"", ""c8928c11f3e5d89b82873272b7dbc61d"", ""eaaad366039bfe5c06a1976fb5290151"", ""0b20f467d1ade5535518ce08f3c82e95"", ""5835e52bb096b422fe2a13e86af81e31""]","[83, 83, 83, 83, 83, 2361, 2541, 2541]","[2736, 2736, 2736, 2736, 2736, 2504, 2622, 2622]","[""IS_ABSTRACT = 1, CHILDREN_COUNT = 2"", ""LONG_METHODS_CONNECTED = 10"", ""CC = 25.0"", ""PUBLIC_FIELD_COUNT = 1.0"", ""CLOC > 500, TCC < 0.49176697471028613"", ""MLOC > 6.681869954934875"", ""MLOC > 6.682777062493791"", ""CALLS_TO_org.apache.catalina.WebResource > 4""]"
Researcher 2,apache_tomcat,20989,"[""Extract Method"", ""Extract Method"", ""Extract Method"", ""Extract Method"", ""Extract Method"", ""Extract Method"", ""Extract Method"", ""Extract Method""]","[""org.apache.catalina.authenticator.AuthenticatorBase"", ""org.apache.catalina.authenticator.AuthenticatorBase.invoke(Request,Response)"", ""org.apache.catalina.authenticator.AuthenticatorBase.getJaspicState(AuthConfigProvider,Request,Response)"", ""org.apache.catalina.authenticator.AuthenticatorBase.secureResponseJspic(Request,Response,JaspicState)"", ""org.apache.catalina.authenticator.AuthenticatorBase.authenticate(Request,HttpServletResponse)""]","[""4772c7ee2b0f7c59edf32db2f21294904e286293"", ""4772c7ee2b0f7c59edf32db2f21294904e286293"", ""4772c7ee2b0f7c59edf32db2f21294904e286293"", ""4772c7ee2b0f7c59edf32db2f21294904e286293"", ""4772c7ee2b0f7c59edf32db2f21294904e286293""]","[""ComplexClass"", ""FeatureEnvy"", ""LongParameterList"", ""LongMethod"", ""FeatureEnvy""]","[""e8d9194cc60f5200210ad0fe56099360"", ""999a3e2cc81fdbcc5e3aad75ceaa780f"", ""500c9d9660e79f8c4c826d7953865480"", ""aa85c78c4551f37c6cfc71d75b757ff2"", ""e83403b13dd661ab36c0226b2eddb5d0""]","[32, 745, 560, 616, 616]","[1073, 799, 596, 688, 685]","[""CC = 12.0"", ""CALLS_TO_org.apache.derby.client.am.Lob > 7"", ""PARAMETER_COUNT > 1.2572991429168812"", ""MLOC > 7.936971062789272"", ""CALLS_TO_org.apache.derby.client.am.Lob > 5""]","[""172e6c6fae7a228abb60c772cbe0492d4eafc817"", ""172e6c6fae7a228abb60c772cbe0492d4eafc817"", ""172e6c6fae7a228abb60c772cbe0492d4eafc817"", ""172e6c6fae7a228abb60c772cbe0492d4eafc817"", ""172e6c6fae7a228abb60c772cbe0492d4eafc817"", ""172e6c6fae7a228abb60c772cbe0492d4eafc817""]","[""IntensiveCoupling"", ""LongMethod"", ""FeatureEnvy"", ""SpaghettiCode"", ""ComplexClass"", ""ClassDataShouldBePrivate""]","[""5672e333724547bc3c4a854ef0ef4ad2"", ""3d8180d5a94019843cb6081683378390"", ""a314cadcea0af9490f09076037a2d684"", ""d1d157669b8e7233fa765352543f8264"", ""c6ef764e97029a8aa7876a2452f2d665"", ""8426367e24f008c7276c469be1024a24""]","[404, 404, 404, 52, 52, 69]","[583, 583, 583, 906, 906, 1194]","[""CINT = 31.0, CDISP = 0.45161290322580644, CC > 1.0"", ""MLOC > 6.859328599096234"", ""CALLS_TO_org.apache.catalina.Session > 4"", ""LONG_METHODS_CONNECTED = 2"", ""CC = 43.0"", ""PUBLIC_FIELD_COUNT = 2.0""]"
Researcher 2,apache_tomcat,20990,"[""Extract Method"", ""Extract Method"", ""Extract Method"", ""Extract Method"", ""Extract Method"", ""Extract Method""]","[""org.apache.coyote.http2.Http2UpgradeHandler.init(WebConnection)"", ""org.apache.coyote.http2.Http2UpgradeHandler"", ""org.apache.coyote.http2.Http2UpgradeHandler.processStreamOnContainerThread(Stream)"", ""org.apache.coyote.http2.Http2UpgradeHandler.push(Request,Stream)"", ""org.apache.coyote.http2.Http2UpgradeHandler.headersEnd(int)""]","[""1ed2c9984c48870c8a111712fa7e0488337adef9"", ""1ed2c9984c48870c8a111712fa7e0488337adef9"", ""1ed2c9984c48870c8a111712fa7e0488337adef9"", ""1ed2c9984c48870c8a111712fa7e0488337adef9""]","[""LongMethod"", ""FeatureEnvy"", ""ComplexClass"", ""ClassDataShouldBePrivate""]","[""f4c5ce01f72da97f84b6d211eecfe4f3"", ""dddb913b3235cdf1cc972793e01b3f5f"", ""b467c2257dd606f02504ebafd4b38fb6"", ""1164016028210d3d059215ce8a98036f""]","[205, 205, 48, 48]","[263, 263, 900, 900]","[""MLOC > 7.907439690916514"", ""CALLS_TO_java.sql.PreparedStatement > 5"", ""CC = 11.0"", ""PUBLIC_FIELD_COUNT = 3.0""]","[""66008c86384b8018385e64f0013779b19c19d8db"", ""66008c86384b8018385e64f0013779b19c19d8db"", ""66008c86384b8018385e64f0013779b19c19d8db"", ""66008c86384b8018385e64f0013779b19c19d8db"", ""66008c86384b8018385e64f0013779b19c19d8db"", ""66008c86384b8018385e64f0013779b19c19d8db""]","[""SpaghettiCode"", ""ComplexClass"", ""GodClass"", ""DispersedCoupling"", ""LongMethod"", ""FeatureEnvy""]","[""0bada4f61d4b25c2456f5bb7fa2934ba"", ""0095e6a35482ab134ef7267eed5d42b1"", ""cf5053ff7da90130354eaf88136ca66f"", ""ed134661cd074a4c4a601cfc12803edc"", ""2b6c31bb60d8ca9bec3e179acee410ef"", ""20407e84b5f3e3ced21449b85720d08c""]","[60, 60, 60, 171, 171, 171]","[1530, 1530, 1530, 256, 256, 256]","[""LONG_METHODS_CONNECTED = 6"", ""CC = 14.0"", ""CLOC > 500, TCC < 0.49286836990116256"", ""CINT > 8.0, CDISP > 0.5, CC > 1.0"", ""MLOC > 6.652768889982851"", ""CALLS_TO_org.apache.juli.logging.Log > 8""]"
Researcher 2,apache_tomcat,20992,"[""Extract Method"", ""Extract Method"", ""Extract Method"", ""Extract Method"", ""Extract Method"", ""Extract Method"", ""Extract Method"", ""Extract Method""]","[""org.apache.coyote.http11.Http11Processor"", ""org.apache.coyote.http11.Http11Processor.endRequest()"", ""org.apache.coyote.http11.Http11Processor.finishResponse()"", ""org.apache.coyote.http11.Http11Processor.action(ActionCode,Object)"", ""org.apache.coyote.http11.Http11Processor.flush()"", ""org.apache.coyote.http11.Http11Processor.ack()""]","[""23cf182504855cd40fac0786d361d35147434ab0"", ""23cf182504855cd40fac0786d361d35147434ab0"", ""23cf182504855cd40fac0786d361d35147434ab0"", ""23cf182504855cd40fac0786d361d35147434ab0"", ""23cf182504855cd40fac0786d361d35147434ab0"", ""23cf182504855cd40fac0786d361d35147434ab0"", ""23cf182504855cd40fac0786d361d35147434ab0"", ""23cf182504855cd40fac0786d361d35147434ab0"", ""23cf182504855cd40fac0786d361d35147434ab0""]","[""LongMethod"", ""FeatureEnvy"", ""LongMethod"", ""FeatureEnvy"", ""SpaghettiCode"", ""ComplexClass"", ""ClassDataShouldBePrivate"", ""LongMethod"", ""FeatureEnvy""]","[""e71370120323dddac1b1cf867172c642"", ""4df371135739f16a705a2777db9af1dc"", ""d534cb5aacd49396ed206a68f274e620"", ""b5879760f3b9498161a8634191b24c16"", ""6c576a3429113d029326616fedb3a0a6"", ""b467c2257dd606f02504ebafd4b38fb6"", ""1164016028210d3d059215ce8a98036f"", ""98191bc10d2cfc7cc37e8ec656bcb9dd"", ""2896660216e2df5f41bbf65cabe4cb80""]","[591, 591, 643, 643, 48, 48, 48, 439, 437]","[641, 641, 697, 708, 900, 900, 900, 518, 512]","[""MLOC > 7.905675008811491"", ""CALLS_TO_java.sql.PreparedStatement > 6"", ""MLOC > 7.905675008811491"", ""CALLS_TO_org.apache.derbyTesting.junit.BaseJDBCTestCase > 9"", ""LONG_METHODS_CONNECTED = 4"", ""CC = 11.0"", ""PUBLIC_FIELD_COUNT = 3.0"", ""MLOC > 7.905675008811491"", ""CALLS_TO_java.sql.PreparedStatement > 6""]","[""e9e9db27dbfb138a663c27a131146d16e6e9bc36"", ""e9e9db27dbfb138a663c27a131146d16e6e9bc36"", ""e9e9db27dbfb138a663c27a131146d16e6e9bc36"", ""e9e9db27dbfb138a663c27a131146d16e6e9bc36"", ""e9e9db27dbfb138a663c27a131146d16e6e9bc36"", ""e9e9db27dbfb138a663c27a131146d16e6e9bc36"", ""e9e9db27dbfb138a663c27a131146d16e6e9bc36""]","[""BrainClass"", ""SpaghettiCode"", ""ComplexClass"", ""GodClass"", ""IntensiveCoupling"", ""LongMethod"", ""FeatureEnvy""]","[""989f9997d407b2fa7b369c132fce2bf0"", ""48511c040e3b5b9310a556899c3e9c00"", ""88fc4cb4cab531c7b66b1febd2e98004"", ""d0e1bc791a1773d826c1506460e869b1"", ""8411b38206d0b85b67f23aa90b288aa9"", ""19e36edf3aa620c308f01bed82ca7f2d"", ""84ea868f9fe33d22a3b22a6bbf95ded5""]","[56, 56, 35, 56, 650, 650, 649]","[1697, 1697, 425, 1697, 886, 886, 937]","[""BRAIN_METHODS = 1, WMC = 259.0, TCC = 0.08067226890756303"", ""LONG_METHODS_CONNECTED = 5"", ""CC = 58.0"", ""CLOC > 500, TCC < 0.42040823562284796"", ""CINT = 56.0, CDISP = 0.26785714285714285, CC > 1.0"", ""MLOC > 6.641009277894996"", ""CALLS_TO_org.apache.coyote.AsyncStateMachine > 14""]"
Researcher 2,apache_tomcat,21001,"[""Extract Method"", ""Extract Method"", ""Rename Method"", ""Rename Method""]","[""org.apache.tomcat.util.net.SocketWrapperBase"", ""org.apache.tomcat.util.net.SocketWrapperBase.writeNonBlockingInternal(ByteBuffer)"", ""org.apache.tomcat.util.net.SocketWrapperBase.writeByteBufferNonBlocking(ByteBuffer)"", ""org.apache.tomcat.util.net.SocketWrapperBase.writeBlockingInternal(ByteBuffer)"", ""org.apache.tomcat.util.net.SocketWrapperBase.writeByteBufferBlocking(ByteBuffer)""]","[""7f17ba1a4e0e76bdd1aa0734b515ec5386e43824"", ""7f17ba1a4e0e76bdd1aa0734b515ec5386e43824""]","[""LongMethod"", ""FeatureEnvy""]","[""1e637023974d8258035d75d1a4179827"", ""28aaa76bed9f0810c8aa56e71f64e2d2""]","[61, 61]","[112, 112]","[""MLOC > 8.078322630861376"", ""CALLS_TO_java.sql.Statement > 9""]","[""b3335c3774d64349a9f23bb543dfac9e52fe3945""]","[""FeatureEnvy""]","[""ea9d537757667912a03f3e1d106c764c""]",[522],[537],"[""CALLS_TO_org.apache.tomcat.util.net.SocketWrapperBase<E> > 4""]"
Researcher 2,apache_tomcat,21006,"[""Extract Method"", ""Extract Method"", ""Extract Method"", ""Extract Method""]","[""org.apache.coyote.http2.Http2Parser.readContinuationFrame(int,int,int)"", ""org.apache.coyote.http2.Http2Parser"", ""org.apache.coyote.http2.Http2Parser.onHeadersComplete(int)"", ""org.apache.coyote.http2.Http2Parser.readHeadersFrame(int,int,int)""]","[""7f17ba1a4e0e76bdd1aa0734b515ec5386e43824"", ""7f17ba1a4e0e76bdd1aa0734b515ec5386e43824""]","[""LongMethod"", ""FeatureEnvy""]","[""1e637023974d8258035d75d1a4179827"", ""28aaa76bed9f0810c8aa56e71f64e2d2""]","[61, 61]","[112, 112]","[""MLOC > 8.078322630861376"", ""CALLS_TO_java.sql.Statement > 9""]","[""a6717dc1070c264b4b67323edcc58fcbd5d6477e"", ""a6717dc1070c264b4b67323edcc58fcbd5d6477e"", ""a6717dc1070c264b4b67323edcc58fcbd5d6477e"", ""a6717dc1070c264b4b67323edcc58fcbd5d6477e""]","[""SpaghettiCode"", ""ComplexClass"", ""IntensiveCoupling"", ""LongMethod""]","[""e69bf8a42b0cf2911c52a011e06f53f6"", ""7f3afa175faffef5f01d5e5b854dd9f9"", ""b3814b4ba8b082dacd28ffee19e9403e"", ""7d8a68f117d4babb164d320843eb3775""]","[29, 29, 197, 197]","[613, 613, 255, 255]","[""LONG_METHODS_CONNECTED = 3"", ""CC = 14.0"", ""CINT = 16.0, CDISP = 0.4375, CC > 1.0"", ""MLOC > 6.62315583781148""]"
Researcher 2,apache_tomcat,21024,"[""Move Attribute"", ""Move Attribute"", ""Extract Method"", ""Extract Method""]","[""org.apache.tomcat.util.net.NioEndpoint.Poller"", ""org.apache.tomcat.util.net.NioEndpoint"", ""org.apache.tomcat.util.net.NioEndpoint.Poller.add(NioChannel)"", ""org.apache.tomcat.util.net.NioEndpoint.Poller.add(NioChannel,int)""]","[""f3e70a15395d82cfd5c9f3c63a349d624453839f"", ""f3e70a15395d82cfd5c9f3c63a349d624453839f"", ""f3e70a15395d82cfd5c9f3c63a349d624453839f""]","[""ComplexClass"", ""DispersedCoupling"", ""FeatureEnvy""]","[""47101af5e75e953c3cdc0916e9053c46"", ""de0d710f7b2d2e60f8ef55b1e462ccfe"", ""e76314c86667892af366d614118cfd37""]","[42, 74, 74]","[380, 171, 171]","[""CC = 13.0"", ""CINT > 8.0, CDISP > 0.5, CC > 1.0"", ""CALLS_TO_org.apache.derby.iapi.sql.conn.LanguageConnectionContext > 4""]","[""b00d3c5fc243e5e223cc3ac1a296d08236b5ac3b"", ""b00d3c5fc243e5e223cc3ac1a296d08236b5ac3b""]","[""ComplexClass"", ""GodClass""]","[""3ee14b5219fdaa400bd29acd911c66cb"", ""9e4965a56a77764db1b07566e735f621""]","[861, 61]","[1400, 1714]","[""CC = 20.0"", ""CLOC > 500, TCC < 0.4808063174919667""]"
Researcher 2,apache_tomcat,21028,"[""Move Method"", ""Move Method"", ""Extract Method"", ""Extract Method""]","[""org.apache.catalina.valves.FastCommonAccessLogValve.backgroundProcess()"", ""org.apache.catalina.valves.AccessLogValve"", ""org.apache.catalina.valves.FastCommonAccessLogValve"", ""org.apache.catalina.valves.AccessLogValve.backgroundProcess()"", ""org.apache.catalina.valves.AccessLogValve.invoke(Request,Response)"", ""org.apache.catalina.valves.AccessLogValve.log(String)""]","[""7bd158f81cb9b77b681c43bdf9c13d03a3301282"", ""7bd158f81cb9b77b681c43bdf9c13d03a3301282"", ""7bd158f81cb9b77b681c43bdf9c13d03a3301282""]","[""FeatureEnvy"", ""FeatureEnvy"", ""FeatureEnvy""]","[""23c3a05cece65df2b4f4038d5378a449"", ""b627cea3eaa1c6d6314180a4827d6912"", ""bab811cfa8c57adde80d6086d0b3735f""]","[77, 127, 150]","[95, 148, 169]","[""{\""MaxCallChain\"": 1.0, \""LocalityRatio\"": 0.0, \""ParameterCount\"": 2.0, \""CyclomaticComplexity\"": 2.0, \""MethodLinesOfCode\"": 12.0}"", ""{\""MaxCallChain\"": 1.0, \""LocalityRatio\"": 0.0, \""ParameterCount\"": 1.0, \""CyclomaticComplexity\"": 5.0, \""MethodLinesOfCode\"": 14.0}"", ""{\""MaxCallChain\"": 2.0, \""LocalityRatio\"": 0.0, \""ParameterCount\"": 1.0, \""CyclomaticComplexity\"": 5.0, \""MethodLinesOfCode\"": 12.0}""]","[""7f2b061699ee61c732a8bc22666b4c987fefdd64"", ""7f2b061699ee61c732a8bc22666b4c987fefdd64""]","[""ComplexClass"", ""LazyClass""]","[""ae976a0720eb899d55efe2994cfa3c52"", ""27f702ff1822f5ab5b9be04865b7ff6f""]","[60, 22]","[2121, -1]","[""CC = 12.0"", ""CLOC < 9.0""]"
Researcher 2,apache_tomcat,21034,"[""Extract Method"", ""Extract Method"", ""Extract Method"", ""Extract Method""]","[""org.apache.tomcat.util.net.NioBlockingSelector.BlockPoller"", ""org.apache.tomcat.util.net.NioBlockingSelector.BlockPoller.remove(KeyAttachment,int)"", ""org.apache.tomcat.util.net.NioBlockingSelector.BlockPoller.wakeup()"", ""org.apache.tomcat.util.net.NioBlockingSelector.BlockPoller.cancelKey(NioChannel,SelectionKey)""]","[""7bd158f81cb9b77b681c43bdf9c13d03a3301282"", ""7bd158f81cb9b77b681c43bdf9c13d03a3301282"", ""7bd158f81cb9b77b681c43bdf9c13d03a3301282""]","[""FeatureEnvy"", ""FeatureEnvy"", ""FeatureEnvy""]","[""23c3a05cece65df2b4f4038d5378a449"", ""b627cea3eaa1c6d6314180a4827d6912"", ""bab811cfa8c57adde80d6086d0b3735f""]","[77, 127, 150]","[95, 148, 169]","[""{\""MaxCallChain\"": 1.0, \""LocalityRatio\"": 0.0, \""ParameterCount\"": 2.0, \""CyclomaticComplexity\"": 2.0, \""MethodLinesOfCode\"": 12.0}"", ""{\""MaxCallChain\"": 1.0, \""LocalityRatio\"": 0.0, \""ParameterCount\"": 1.0, \""CyclomaticComplexity\"": 5.0, \""MethodLinesOfCode\"": 14.0}"", ""{\""MaxCallChain\"": 2.0, \""LocalityRatio\"": 0.0, \""ParameterCount\"": 1.0, \""CyclomaticComplexity\"": 5.0, \""MethodLinesOfCode\"": 12.0}""]","[""7a235aff138fa285938d1804906f5557e0f193c9"", ""7a235aff138fa285938d1804906f5557e0f193c9"", ""7a235aff138fa285938d1804906f5557e0f193c9""]","[""SpaghettiCode"", ""ComplexClass"", ""LongMethod""]","[""73d14287dae0b87a331b8c91d30a176d"", ""ebcefec461273a312c9c55a100ba36fe"", ""2e6ffbfda095d4995199585aa53af510""]","[215, 215, 277]","[405, 405, 316]","[""LONG_METHODS_CONNECTED = 2"", ""CC = 15.0"", ""MLOC > 6.874321358438148""]"
Researcher 2,apache_tomcat,21045,"[""Rename Method"", ""Rename Method"", ""Rename Method"", ""Rename Method"", ""Rename Method"", ""Rename Method"", ""Extract Method"", ""Extract Method"", ""Rename Method"", ""Rename Method""]","[""org.apache.catalina.mbeans.JmxRemoteLifecycleListener.setRmiServerPort(int)"", ""org.apache.catalina.mbeans.JmxRemoteLifecycleListener"", ""org.apache.catalina.mbeans.JmxRemoteLifecycleListener.setRmiServerPortPlatform(int)"", ""org.apache.catalina.mbeans.JmxRemoteLifecycleListener.setRmiRegistryPort(int)"", ""org.apache.catalina.mbeans.JmxRemoteLifecycleListener.setRmiRegistryPortPlatform(int)"", ""org.apache.catalina.mbeans.JmxRemoteLifecycleListener.getRmiRegistryPort()"", ""org.apache.catalina.mbeans.JmxRemoteLifecycleListener.getRmiRegistryPortPlatform()"", ""org.apache.catalina.mbeans.JmxRemoteLifecycleListener.lifecycleEvent(LifecycleEvent)"", ""org.apache.catalina.mbeans.JmxRemoteLifecycleListener.createServer(int,int,HashMap,MBeanServer)"", ""org.apache.catalina.mbeans.JmxRemoteLifecycleListener.getRmiServerPort()"", ""org.apache.catalina.mbeans.JmxRemoteLifecycleListener.getRmiServerPortPlatform()""]","[""4f15aaddb54af30b64a863944f7244b2a94cb7cc"", ""4f15aaddb54af30b64a863944f7244b2a94cb7cc"", ""4f15aaddb54af30b64a863944f7244b2a94cb7cc"", ""4f15aaddb54af30b64a863944f7244b2a94cb7cc"", ""4f15aaddb54af30b64a863944f7244b2a94cb7cc"", ""4f15aaddb54af30b64a863944f7244b2a94cb7cc"", ""4f15aaddb54af30b64a863944f7244b2a94cb7cc""]","[""FeatureEnvy"", ""GodClass"", ""ComplexClass"", ""SpaghettiCode"", ""FeatureEnvy"", ""LongMethod"", ""LongParameterList""]","[""8680b2f02c6c2978cb47189e1bb6d0fe"", ""435c46db3ec0be0a0625124d241a74d7"", ""28ac281746c42a4abd28bd447a2eab4b"", ""def3ad3e0d30fdf4561eef514f2acb93"", ""42f74072fd925565af08480ffc330394"", ""611614be3c4e7dd9a7333730835cf7c3"", ""922ffdf7c990ca82433f72d7f88931dc""]","[1218, 59, 190, 50, 574, 574, 574]","[1237, 1594, 236, 683, 661, 661, 661]","[""{\""MethodLinesOfCode\"": 15.0, \""MaxCallChain\"": 3.0, \""ParameterCount\"": 1.0, \""CyclomaticComplexity\"": 4.0, \""LocalityRatio\"": 0.16666666666666666}"", ""{\""IsAbstract\"": 0.0, \""ClassLinesOfCode\"": 635.0, \""OverrideRatio\"": null, \""PublicFieldCount\"": 0.0, \""TightClassCohesion\"": 0.2178030303030303}"", ""{\""IsAbstract\"": 0.0, \""ClassLinesOfCode\"": 270.0, \""OverrideRatio\"": null, \""PublicFieldCount\"": 0.0, \""TightClassCohesion\"": 0.4380952380952381}"", ""{\""IsAbstract\"": 0.0, \""ClassLinesOfCode\"": 344.0, \""OverrideRatio\"": null, \""PublicFieldCount\"": 0.0, \""TightClassCohesion\"": 0.21645021645021645}"", ""{\""MethodLinesOfCode\"": 39.0, \""LocalityRatio\"": 0.3, \""ParameterCount\"": 4.0, \""CyclomaticComplexity\"": 12.0, \""MaxCallChain\"": 1.0}"", ""{\""MethodLinesOfCode\"": 39.0, \""LocalityRatio\"": 0.3, \""ParameterCount\"": 4.0, \""CyclomaticComplexity\"": 12.0, \""MaxCallChain\"": 1.0}"", ""{\""MethodLinesOfCode\"": 39.0, \""LocalityRatio\"": 0.3, \""ParameterCount\"": 4.0, \""CyclomaticComplexity\"": 12.0, \""MaxCallChain\"": 1.0}""]","[""ea6f489a8f66179eac32abb91440ecf37fcbcaed""]","[""DataClass""]","[""f264500597b7a351d35b289f680be352""]",[49],[366],"[""WOC = 0.1111111111111111, NOPA = 0.0, NOAM = 8.0, WMC = 30.0""]"
Researcher 2,apache_tomcat,21048,"[""Extract Method"", ""Extract Method"", ""Extract Method"", ""Extract Method""]","[""org.apache.catalina.tribes.membership.McastServiceImpl.send(boolean)"", ""org.apache.catalina.tribes.membership.McastServiceImpl"", ""org.apache.catalina.tribes.membership.McastServiceImpl.send(boolean,DatagramPacket)"", ""org.apache.catalina.tribes.membership.McastServiceImpl.receive()"", ""org.apache.catalina.tribes.membership.McastServiceImpl.memberDataReceived(byte)""]","[""aa04d8a9ab856ebb2297e81c7a0a19b2c3fbdbac"", ""aa04d8a9ab856ebb2297e81c7a0a19b2c3fbdbac"", ""aa04d8a9ab856ebb2297e81c7a0a19b2c3fbdbac"", ""aa04d8a9ab856ebb2297e81c7a0a19b2c3fbdbac"", ""aa04d8a9ab856ebb2297e81c7a0a19b2c3fbdbac""]","[""MessageChain"", ""LongParameterList"", ""LongParameterList"", ""MessageChain"", ""FeatureEnvy""]","[""62cc50869154bbb0e6cca7f4699aec84"", ""f4e337df9bfe2e5cd3d353298c5604a2"", ""c79d330f7cd88f2371d2a0452ce100ff"", ""3ded568c6141fb4178b91dc4bdabba86"", ""1d10f7e587072e4dd136e16ebee0884a""]","[275, 275, 293, 293, 367]","[284, 284, 306, 306, 393]","[""{\""MaxCallChain\"": 6.0, \""LocalityRatio\"": 1.0, \""ParameterCount\"": 4.0, \""CyclomaticComplexity\"": 1.0, \""MethodLinesOfCode\"": 3.0}"", ""{\""MaxCallChain\"": 6.0, \""LocalityRatio\"": 1.0, \""ParameterCount\"": 4.0, \""CyclomaticComplexity\"": 1.0, \""MethodLinesOfCode\"": 3.0}"", ""{\""MaxCallChain\"": 9.0, \""LocalityRatio\"": 1.0, \""ParameterCount\"": 4.0, \""CyclomaticComplexity\"": 1.0, \""MethodLinesOfCode\"": 3.0}"", ""{\""MaxCallChain\"": 9.0, \""LocalityRatio\"": 1.0, \""ParameterCount\"": 4.0, \""CyclomaticComplexity\"": 1.0, \""MethodLinesOfCode\"": 3.0}"", ""{\""MaxCallChain\"": 2.0, \""LocalityRatio\"": 0.0, \""ParameterCount\"": 2.0, \""CyclomaticComplexity\"": 6.0, \""MethodLinesOfCode\"": 16.0}""]","[""79514526610c922e98af9ba12cdb8eb4389ddf89"", ""79514526610c922e98af9ba12cdb8eb4389ddf89"", ""79514526610c922e98af9ba12cdb8eb4389ddf89""]","[""FeatureEnvy"", ""IntensiveCoupling"", ""FeatureEnvy""]","[""afa5c1196085ea7b02811120eafd3a22"", ""29bef1a0e33b6817b07ef9281fa5f3e1"", ""36a36998609f5190f98b79e49301045f""]","[485, 332, 332]","[506, 371, 371]","[""CALLS_TO_org.apache.juli.logging.Log > 4"", ""CINT = 9.0, CDISP = 0.3333333333333333, CC > 1.0"", ""CALLS_TO_org.apache.catalina.tribes.io.XByteBuffer > 4""]"
Researcher 2,apache_tomcat,21053,"[""Extract Method"", ""Extract Method"", ""Extract Method"", ""Extract Method"", ""Extract Method"", ""Extract Method""]","[""org.apache.catalina.startup.TldConfig.tldScanJar(File)"", ""org.apache.catalina.startup.TldConfig"", ""org.apache.catalina.startup.TldConfig.processTldsInFileSystem(String)"", ""org.apache.catalina.startup.TldConfig.getJarPaths()"", ""org.apache.catalina.startup.TldConfig.scanJar(JarURLConnection)"", ""org.apache.catalina.startup.TldConfig.execute()""]","[""aa04d8a9ab856ebb2297e81c7a0a19b2c3fbdbac"", ""aa04d8a9ab856ebb2297e81c7a0a19b2c3fbdbac"", ""aa04d8a9ab856ebb2297e81c7a0a19b2c3fbdbac"", ""aa04d8a9ab856ebb2297e81c7a0a19b2c3fbdbac"", ""aa04d8a9ab856ebb2297e81c7a0a19b2c3fbdbac""]","[""MessageChain"", ""LongParameterList"", ""LongParameterList"", ""MessageChain"", ""FeatureEnvy""]","[""62cc50869154bbb0e6cca7f4699aec84"", ""f4e337df9bfe2e5cd3d353298c5604a2"", ""c79d330f7cd88f2371d2a0452ce100ff"", ""3ded568c6141fb4178b91dc4bdabba86"", ""1d10f7e587072e4dd136e16ebee0884a""]","[275, 275, 293, 293, 367]","[284, 284, 306, 306, 393]","[""{\""MaxCallChain\"": 6.0, \""LocalityRatio\"": 1.0, \""ParameterCount\"": 4.0, \""CyclomaticComplexity\"": 1.0, \""MethodLinesOfCode\"": 3.0}"", ""{\""MaxCallChain\"": 6.0, \""LocalityRatio\"": 1.0, \""ParameterCount\"": 4.0, \""CyclomaticComplexity\"": 1.0, \""MethodLinesOfCode\"": 3.0}"", ""{\""MaxCallChain\"": 9.0, \""LocalityRatio\"": 1.0, \""ParameterCount\"": 4.0, \""CyclomaticComplexity\"": 1.0, \""MethodLinesOfCode\"": 3.0}"", ""{\""MaxCallChain\"": 9.0, \""LocalityRatio\"": 1.0, \""ParameterCount\"": 4.0, \""CyclomaticComplexity\"": 1.0, \""MethodLinesOfCode\"": 3.0}"", ""{\""MaxCallChain\"": 2.0, \""LocalityRatio\"": 0.0, \""ParameterCount\"": 2.0, \""CyclomaticComplexity\"": 6.0, \""MethodLinesOfCode\"": 16.0}""]","[""d14348025f94341c5a61f9f1e961c60321fd87c5"", ""d14348025f94341c5a61f9f1e961c60321fd87c5"", ""d14348025f94341c5a61f9f1e961c60321fd87c5"", ""d14348025f94341c5a61f9f1e961c60321fd87c5""]","[""ComplexClass"", ""IntensiveCoupling"", ""LongMethod"", ""FeatureEnvy""]","[""99da0d5b25545ee1e391134b5f467b13"", ""9b416092d6e5bafe342020ce90437121"", ""37fe48847364ea501b27cd769cf8d51a"", ""0916c91a123582dcc620ae619cf44777""]","[52, 370, 370, 370]","[640, 430, 430, 430]","[""CC = 11.0"", ""CINT = 9.0, CDISP = 0.4444444444444444, CC > 1.0"", ""MLOC > 6.384466823010099"", ""CALLS_TO_org.apache.juli.logging.Log > 6""]"
Researcher 2,apache_tomcat,21054,"[""Extract Method"", ""Extract Method"", ""Inline Method"", ""Inline Method""]","[""org.apache.catalina.startup.TldConfig.scanJar(JarURLConnection)"", ""org.apache.catalina.startup.TldConfig"", ""org.apache.catalina.startup.TldConfig.tldScanJar(File)"", ""org.apache.catalina.startup.TldConfig.processTldsInFileSystem(String)"", ""org.apache.catalina.startup.TldConfig.execute()""]","[""af38917c2e2edbd1ff8f3443ca851fb179503b37"", ""af38917c2e2edbd1ff8f3443ca851fb179503b37"", ""af38917c2e2edbd1ff8f3443ca851fb179503b37"", ""af38917c2e2edbd1ff8f3443ca851fb179503b37"", ""af38917c2e2edbd1ff8f3443ca851fb179503b37"", ""af38917c2e2edbd1ff8f3443ca851fb179503b37"", ""af38917c2e2edbd1ff8f3443ca851fb179503b37""]","[""ComplexClass"", ""IntensiveCoupling"", ""MessageChain"", ""FeatureEnvy"", ""IntensiveCoupling"", ""MessageChain"", ""FeatureEnvy""]","[""e7e9dd27b950a8327c8bf43426789157"", ""363c88ae4960c54634a9fd4a0cc27974"", ""19875db0dfedc3d7962f3b89c91713bb"", ""4747c24343dcb99dbded06e017586b86"", ""49f0379414e127c204f619844a3d58ac"", ""5706cbf87918b4799509c0ded1a9b654"", ""57a9f101d78a75def9c48e40c72feef2""]","[24, 112, 112, 112, 68, 68, 68]","[146, 159, 159, 159, 109, 109, 109]","[""CC = 11.0"", ""CINT = 11.0, CDISP = 0.45454545454545453, CC > 1.0"", ""MAX_CALL_CHAIN = 4.0"", ""CALLS_TO_org.apache.catalina.websocket.WsFrame > 10"", ""CINT = 11.0, CDISP = 0.45454545454545453, CC > 1.0"", ""MAX_CALL_CHAIN = 4.0"", ""CALLS_TO_org.apache.catalina.websocket.WsFrame > 10""]","[""8ecc444737d18d87d293964e0e66442ec75f8943"", ""8ecc444737d18d87d293964e0e66442ec75f8943"", ""8ecc444737d18d87d293964e0e66442ec75f8943""]","[""ComplexClass"", ""IntensiveCoupling"", ""FeatureEnvy""]","[""99da0d5b25545ee1e391134b5f467b13"", ""ab5388b2c806344630b29a2b668f537c"", ""e075b9858d25acbdf1cf9e15ac182f2b""]","[52, 288, 377]","[640, 335, 426]","[""CC = 11.0"", ""CINT = 9.0, CDISP = 0.4444444444444444, CC > 1.0"", ""CALLS_TO_org.apache.juli.logging.Log > 4""]"
Researcher 2,apache_tomcat,21058,"[""Extract Method"", ""Extract Method"", ""Extract Method"", ""Extract Method"", ""Extract Method"", ""Extract Method"", ""Extract Method"", ""Extract Method"", ""Extract Method"", ""Extract Method""]","[""org.apache.catalina.startup.ContextConfig.applicationWebConfig()"", ""org.apache.catalina.startup.ContextConfig"", ""org.apache.catalina.startup.ContextConfig.getContextWebXmlSource()"", ""org.apache.catalina.startup.ContextConfig.getHostWebXmlSource()"", ""org.apache.catalina.startup.ContextConfig.getWebXmlSource(String,String)"", ""org.apache.catalina.startup.ContextConfig.defaultWebConfig()"", ""org.apache.catalina.startup.ContextConfig.parseWebXml(InputSource,WebXml)""]","[""87b68476a7262d77504a2298fcc6c43950cfbaa3"", ""87b68476a7262d77504a2298fcc6c43950cfbaa3"", ""87b68476a7262d77504a2298fcc6c43950cfbaa3"", ""87b68476a7262d77504a2298fcc6c43950cfbaa3"", ""87b68476a7262d77504a2298fcc6c43950cfbaa3"", ""87b68476a7262d77504a2298fcc6c43950cfbaa3"", ""87b68476a7262d77504a2298fcc6c43950cfbaa3"", ""87b68476a7262d77504a2298fcc6c43950cfbaa3"", ""87b68476a7262d77504a2298fcc6c43950cfbaa3""]","[""ComplexClass"", ""IntensiveCoupling"", ""LongMethod"", ""FeatureEnvy"", ""IntensiveCoupling"", ""LongMethod"", ""FeatureEnvy"", ""FeatureEnvy"", ""FeatureEnvy""]","[""42b702c4678590679c1b46ea81067630"", ""b93aaf0a5215460d38438fb453481c7f"", ""12b9f0fa68a8a2c2cc924b8d3a3e8beb"", ""87ab908c332d3342b138608fdbe043e5"", ""b93aaf0a5215460d38438fb453481c7f"", ""12b9f0fa68a8a2c2cc924b8d3a3e8beb"", ""87ab908c332d3342b138608fdbe043e5"", ""dede91246995e8e40f8934d9b1d4ef86"", ""dede91246995e8e40f8934d9b1d4ef86""]","[40, 253, 253, 253, 253, 253, 253, 89, 89]","[436, 364, 364, 364, 364, 364, 364, 132, 132]","[""CC = 13.0"", ""CINT = 21.0, CDISP = 0.38095238095238093, CC > 1.0"", ""MLOC > 6.860470910676364"", ""CALLS_TO_org.apache.catalina.deploy.NamingResources > 5"", ""CINT = 21.0, CDISP = 0.38095238095238093, CC > 1.0"", ""MLOC > 6.860470910676364"", ""CALLS_TO_org.apache.catalina.deploy.NamingResources > 5"", ""CALLS_TO_org.apache.catalina.Wrapper > 4"", ""CALLS_TO_org.apache.catalina.Wrapper > 4""]","[""a5b512b26cec25323c7639a7cc8990c790ea5c38"", ""a5b512b26cec25323c7639a7cc8990c790ea5c38"", ""a5b512b26cec25323c7639a7cc8990c790ea5c38"", ""a5b512b26cec25323c7639a7cc8990c790ea5c38"", ""a5b512b26cec25323c7639a7cc8990c790ea5c38"", ""a5b512b26cec25323c7639a7cc8990c790ea5c38"", ""a5b512b26cec25323c7639a7cc8990c790ea5c38""]","[""IntensiveCoupling"", ""FeatureEnvy"", ""MessageChain"", ""SpaghettiCode"", ""ComplexClass"", ""GodClass"", ""FeatureEnvy""]","[""3021c2abb12061a9d55a4231a02a5106"", ""bec820a615c557d23e8c0224d376a8ef"", ""2902cb0149d35d995f8bc8258f2b4d12"", ""e793f4451c1a592370615b3c5a198607"", ""af28c6e13bdd320b850068a72aab2231"", ""7628ef6afa559ce2cc0d3adb2b511c2c"", ""0adc7e04fe92a233fae0040fff0b315e""]","[1733, 1733, 1791, 111, 111, 111, 1299]","[1789, 1789, 1830, 2610, 2610, 2610, 1340]","[""CINT = 9.0, CDISP = 0.4444444444444444, CC > 1.0"", ""CALLS_TO_org.apache.juli.logging.Log > 5"", ""MAX_CALL_CHAIN = 5.0"", ""LONG_METHODS_CONNECTED = 12"", ""CC = 14.0"", ""CLOC > 500, TCC < 0.48007932503269046"", ""CALLS_TO_org.apache.tomcat.util.digester.Digester > 4""]"
Researcher 2,apache_tomcat,21069,"[""Extract Method"", ""Extract Method"", ""Extract Method"", ""Extract Method""]","[""org.apache.catalina.loader.WebappClassLoader.clearReferences()"", ""org.apache.catalina.loader.WebappClassLoader"", ""org.apache.catalina.loader.WebappClassLoader.clearReferencesJdbc()"", ""org.apache.catalina.loader.WebappClassLoader.clearReferencesStaticFinal()""]","[""87b68476a7262d77504a2298fcc6c43950cfbaa3"", ""87b68476a7262d77504a2298fcc6c43950cfbaa3"", ""87b68476a7262d77504a2298fcc6c43950cfbaa3"", ""87b68476a7262d77504a2298fcc6c43950cfbaa3"", ""87b68476a7262d77504a2298fcc6c43950cfbaa3"", ""87b68476a7262d77504a2298fcc6c43950cfbaa3"", ""87b68476a7262d77504a2298fcc6c43950cfbaa3"", ""87b68476a7262d77504a2298fcc6c43950cfbaa3"", ""87b68476a7262d77504a2298fcc6c43950cfbaa3""]","[""ComplexClass"", ""IntensiveCoupling"", ""LongMethod"", ""FeatureEnvy"", ""IntensiveCoupling"", ""LongMethod"", ""FeatureEnvy"", ""FeatureEnvy"", ""FeatureEnvy""]","[""42b702c4678590679c1b46ea81067630"", ""b93aaf0a5215460d38438fb453481c7f"", ""12b9f0fa68a8a2c2cc924b8d3a3e8beb"", ""87ab908c332d3342b138608fdbe043e5"", ""b93aaf0a5215460d38438fb453481c7f"", ""12b9f0fa68a8a2c2cc924b8d3a3e8beb"", ""87ab908c332d3342b138608fdbe043e5"", ""dede91246995e8e40f8934d9b1d4ef86"", ""dede91246995e8e40f8934d9b1d4ef86""]","[40, 253, 253, 253, 253, 253, 253, 89, 89]","[436, 364, 364, 364, 364, 364, 364, 132, 132]","[""CC = 13.0"", ""CINT = 21.0, CDISP = 0.38095238095238093, CC > 1.0"", ""MLOC > 6.860470910676364"", ""CALLS_TO_org.apache.catalina.deploy.NamingResources > 5"", ""CINT = 21.0, CDISP = 0.38095238095238093, CC > 1.0"", ""MLOC > 6.860470910676364"", ""CALLS_TO_org.apache.catalina.deploy.NamingResources > 5"", ""CALLS_TO_org.apache.catalina.Wrapper > 4"", ""CALLS_TO_org.apache.catalina.Wrapper > 4""]","[""271d83a3c4503223c4d06459f5231a776865b2ac"", ""271d83a3c4503223c4d06459f5231a776865b2ac"", ""271d83a3c4503223c4d06459f5231a776865b2ac"", ""271d83a3c4503223c4d06459f5231a776865b2ac"", ""271d83a3c4503223c4d06459f5231a776865b2ac"", ""271d83a3c4503223c4d06459f5231a776865b2ac"", ""271d83a3c4503223c4d06459f5231a776865b2ac""]","[""BrainClass"", ""SpaghettiCode"", ""ComplexClass"", ""ClassDataShouldBePrivate"", ""GodClass"", ""LongMethod"", ""FeatureEnvy""]","[""e72b059394d80d481ecb7b467a2421fa"", ""6262ce80aa9081f6fa082b972e7310d7"", ""196cb4a294ca464d557135e06a49eab4"", ""a1f05753fa578a8d7787c84655b4fa0d"", ""29a5efe23f2d2eb4f62c633efd95ac9c"", ""d46b2ca3e762db063150be51c9832af9"", ""514a7bb2d01a92204556b33cae669fc6""]","[73, 73, 73, 73, 73, 1827, 1827]","[3168, 3168, 3168, 3168, 3168, 1901, 1901]","[""BRAIN_METHODS = 1, WMC = 458.0, TCC = 0.10048309178743961"", ""LONG_METHODS_CONNECTED = 13"", ""CC = 13.0"", ""PUBLIC_FIELD_COUNT = 1.0"", ""CLOC > 500, TCC < 0.48007932503269046"", ""MLOC > 6.874321358438148"", ""CALLS_TO_org.apache.juli.logging.Log > 6""]"
Researcher 2,apache_tomcat,21097,"[""Extract Method"", ""Extract Method"", ""Extract Method"", ""Extract Method"", ""Extract Method"", ""Extract Method"", ""Extract Method"", ""Extract Method""]","[""org.apache.catalina.session.MResearcher 1gerBase"", ""org.apache.catalina.session.MResearcher 1gerBase.destroyInternal()"", ""org.apache.catalina.session.MResearcher 1gerBase.closeRandomFile()"", ""org.apache.catalina.session.MResearcher 1gerBase.getRandom()"", ""org.apache.catalina.session.MResearcher 1gerBase.createRandomSeed()"", ""org.apache.catalina.session.MResearcher 1gerBase.getRandomBytes(byte)"", ""org.apache.catalina.session.MResearcher 1gerBase.setRandomFile(String)""]","[""4618e42968e29d1049b2c6fb70189fcc1b1a4c0e"", ""4618e42968e29d1049b2c6fb70189fcc1b1a4c0e"", ""4618e42968e29d1049b2c6fb70189fcc1b1a4c0e"", ""4618e42968e29d1049b2c6fb70189fcc1b1a4c0e"", ""4618e42968e29d1049b2c6fb70189fcc1b1a4c0e"", ""4618e42968e29d1049b2c6fb70189fcc1b1a4c0e"", ""4618e42968e29d1049b2c6fb70189fcc1b1a4c0e"", ""4618e42968e29d1049b2c6fb70189fcc1b1a4c0e""]","[""SpaghettiCode"", ""ComplexClass"", ""ClassDataShouldBePrivate"", ""GodClass"", ""LongMethod"", ""FeatureEnvy"", ""IntensiveCoupling"", ""LongMethod""]","[""e793f4451c1a592370615b3c5a198607"", ""af28c6e13bdd320b850068a72aab2231"", ""55bb1fc1b4d1c0b2288663665fb615fd"", ""7628ef6afa559ce2cc0d3adb2b511c2c"", ""0e7acc496b3a08fe9f6425241c96707e"", ""9cd424f8d7a789655e0ee223c762f9bb"", ""a22dfa2c16fc0555324d356795c1f69b"", ""89b84e10d5903f2487fe6ee7ece233f5""]","[111, 111, 111, 111, 1918, 1918, 1134, 1134]","[2610, 2610, 2610, 2610, 1970, 1970, 1313, 1313]","[""LONG_METHODS_CONNECTED = 12"", ""CC = 14.0"", ""PUBLIC_FIELD_COUNT = 2.0"", ""CLOC > 500, TCC < 0.48007932503269046"", ""MLOC > 6.818674884437523"", ""CALLS_TO_org.apache.tomcat.util.res.StringMResearcher 1ger > 4"", ""CINT = 28.0, CDISP = 0.2857142857142857, CC > 1.0"", ""MLOC > 6.83012326656397""]","[""9de5b036c094f0378d06bdec7ae96db75ae3a06a"", ""9de5b036c094f0378d06bdec7ae96db75ae3a06a""]","[""ComplexClass"", ""GodClass""]","[""97466b0eeb7ea8ea87f90c54e7598338"", ""f6e13883eac9613daecf0410be900853""]","[56, 60]","[1434, 1506]","[""CC = 14.0"", ""CLOC > 500, TCC < 0.4406466403853435""]"
Researcher 2,apache_tomcat,21116,"[""Extract Method"", ""Extract Method"", ""Extract Method"", ""Extract Method"", ""Extract Method"", ""Extract Method"", ""Extract Method"", ""Extract Method""]","[""org.apache.tomcat.util.net.jsse.JSSESocketFactory.init()"", ""org.apache.tomcat.util.net.jsse.JSSESocketFactory"", ""org.apache.tomcat.util.net.jsse.JSSESocketFactory.getTrustMResearcher 1gers()"", ""org.apache.tomcat.util.net.jsse.JSSESocketFactory.createSSLContext()"", ""org.apache.tomcat.util.net.jsse.JSSESocketFactory.configureSessionContext(SSLSessionContext)"", ""org.apache.tomcat.util.net.jsse.JSSESocketFactory.getKeyMResearcher 1gers()""]","[""33c0210cf9f81765dc4db22c6a5e040a57f76290"", ""33c0210cf9f81765dc4db22c6a5e040a57f76290"", ""33c0210cf9f81765dc4db22c6a5e040a57f76290"", ""33c0210cf9f81765dc4db22c6a5e040a57f76290"", ""33c0210cf9f81765dc4db22c6a5e040a57f76290""]","[""DispersedCoupling"", ""FeatureEnvy"", ""DispersedCoupling"", ""LongMethod"", ""ComplexClass""]","[""4dc068d39900157ee5482529ae4fdfcd"", ""9f393b389188e24ede7a693de1ffeeb7"", ""699b2703b566f6cf998ebd48363579b6"", ""77c94ec633d7391cd6557423bded2668"", ""ad7eb915ee3e90266d6cf8ee7fc1ac44""]","[1337, 1337, 1233, 1585, 1248]","[1373, 1373, 1335, 1896, 1897]","[""CINT > 8.0, CDISP > 0.5, CC > 1.0"", ""CALLS_TO_org.apache.tomcat.util.net.AprEndpoint > 4"", ""CINT > 8.0, CDISP > 0.5, CC > 1.0"", ""MLOC > 6.875267202033578"", ""CC = 73.0""]","[""9011d1d577d4b20d3b6934f494c1c99473017c4c"", ""9011d1d577d4b20d3b6934f494c1c99473017c4c"", ""9011d1d577d4b20d3b6934f494c1c99473017c4c"", ""9011d1d577d4b20d3b6934f494c1c99473017c4c""]","[""ComplexClass"", ""FeatureEnvy"", ""FeatureEnvy"", ""IntensiveCoupling""]","[""43043e0c060de51d1e98626fffad5b9d"", ""408ac31e5478a5b286a4b52231c62ce3"", ""b55f609c6bd43c31864e7fe610a3f544"", ""c32821c330e476aff5202930b25afb6f""]","[70, 492, 524, 423]","[800, 506, 543, 465]","[""CC = 15.0"", ""CALLS_TO_org.apache.tomcat.util.net.AbstractEndpoint > 4"", ""CALLS_TO_org.apache.tomcat.util.net.AbstractEndpoint > 4"", ""CINT = 9.0, CDISP = 0.3333333333333333, CC > 1.0""]"
Researcher 2,argouml,21197,"[""Extract Method"", ""Extract Method"", ""Extract Method"", ""Extract Method""]","[""uci.gef.Fig"", ""uci.gef.Fig.endTrans"", ""uci.gef.Fig.damage"", ""uci.gef.Fig.startTrans""]","[""33c0210cf9f81765dc4db22c6a5e040a57f76290"", ""33c0210cf9f81765dc4db22c6a5e040a57f76290"", ""33c0210cf9f81765dc4db22c6a5e040a57f76290"", ""33c0210cf9f81765dc4db22c6a5e040a57f76290"", ""33c0210cf9f81765dc4db22c6a5e040a57f76290""]","[""DispersedCoupling"", ""FeatureEnvy"", ""DispersedCoupling"", ""LongMethod"", ""ComplexClass""]","[""4dc068d39900157ee5482529ae4fdfcd"", ""9f393b389188e24ede7a693de1ffeeb7"", ""699b2703b566f6cf998ebd48363579b6"", ""77c94ec633d7391cd6557423bded2668"", ""ad7eb915ee3e90266d6cf8ee7fc1ac44""]","[1337, 1337, 1233, 1585, 1248]","[1373, 1373, 1335, 1896, 1897]","[""CINT > 8.0, CDISP > 0.5, CC > 1.0"", ""CALLS_TO_org.apache.tomcat.util.net.AprEndpoint > 4"", ""CINT > 8.0, CDISP > 0.5, CC > 1.0"", ""MLOC > 6.875267202033578"", ""CC = 73.0""]","[""8f98e628eceb8e2fdd33630396d222ee7ccd33fb"", ""8f98e628eceb8e2fdd33630396d222ee7ccd33fb""]","[""ClassDataShouldBePrivate"", ""FeatureEnvy""]","[""5e17a93cc482175c5e49910f49c9eee7"", ""127b5ce2e77c04f3d131ca1063a00ab3""]","[32, 296]","[599, 296]","[""{\""IsAbstract\"": 0.0, \""ClassLinesOfCode\"": 306.0, \""OverrideRatio\"": null, \""PublicFieldCount\"": 1.0, \""TightClassCohesion\"": 0.07654127481713689}"", ""{\""MaxCallChain\"": 1.0, \""LocalityRatio\"": 0.0, \""ParameterCount\"": 0.0, \""CyclomaticComplexity\"": 2.0, \""MethodLinesOfCode\"": 3.0}""]"
Researcher 2,argouml,21205,"[""Extract Method"", ""Extract Method"", ""Extract Method"", ""Extract Method"", ""Extract Method"", ""Extract Method""]","[""uci.uml.ui.GoModelToAssociation"", ""uci.uml.ui.GoModelToAssociation.getChild"", ""uci.uml.ui.GoModelToAssociation.getChildren"", ""uci.uml.ui.GoModelToAssociation.getChildCount"", ""uci.uml.ui.GoModelToAssociation.getIndexOfChild""]","[""d93a871fbf3705ee00a7dabb4279ecec924a3ec4"", ""d93a871fbf3705ee00a7dabb4279ecec924a3ec4"", ""d93a871fbf3705ee00a7dabb4279ecec924a3ec4"", ""d93a871fbf3705ee00a7dabb4279ecec924a3ec4"", ""d93a871fbf3705ee00a7dabb4279ecec924a3ec4"", ""d93a871fbf3705ee00a7dabb4279ecec924a3ec4"", ""d93a871fbf3705ee00a7dabb4279ecec924a3ec4"", ""d93a871fbf3705ee00a7dabb4279ecec924a3ec4"", ""d93a871fbf3705ee00a7dabb4279ecec924a3ec4"", ""d93a871fbf3705ee00a7dabb4279ecec924a3ec4"", ""d93a871fbf3705ee00a7dabb4279ecec924a3ec4"", ""d93a871fbf3705ee00a7dabb4279ecec924a3ec4"", ""d93a871fbf3705ee00a7dabb4279ecec924a3ec4""]","[""SpaghettiCode"", ""ComplexClass"", ""GodClass"", ""DispersedCoupling"", ""LongParameterList"", ""LongMethod"", ""FeatureEnvy"", ""IntensiveCoupling"", ""LongParameterList"", ""LongMethod"", ""FeatureEnvy"", ""DispersedCoupling"", ""LongParameterList""]","[""1434b7ffac84302178b2297ac9cfa81c"", ""d03dd66d53ec9c8d381aad5a4618109e"", ""d81c7d5588186f700b84773711c8d4d5"", ""dacd321dc007b9bc92e4add0d899e42d"", ""d61e572d856d2fd4bbf5b5266c885a0e"", ""b9bc1061056c0cc2d5846208bf569556"", ""b92a47e72645797f84db3ac2d12335fb"", ""da95219f5cf1ebeddebc6c8e350d38c5"", ""a44303e26a436e23bbf0faa0611ffa11"", ""094fa40f0f61aaee5d8086dbb640fafb"", ""3467b8fcc3100f36d115ca1f643edd70"", ""7682cffb41ac656aa44c581e6f5c0e53"", ""e3259baa723c50aeb1698aab27013034""]","[66, 66, 66, 796, 796, 796, 802, 631, 631, 631, 621, 735, 729]","[1686, 1686, 1686, 912, 912, 912, 926, 726, 726, 726, 732, 799, 793]","[""LONG_METHODS_CONNECTED = 8"", ""CC = 39.0"", ""CLOC > 500, TCC < 0.4808063174919667"", ""CINT > 8.0, CDISP > 0.5, CC > 1.0"", ""PARAMETER_COUNT > 0.9462862423472285"", ""MLOC > 6.874321358438148"", ""CALLS_TO_org.apache.tomcat.util.res.StringMResearcher 1ger > 9"", ""CINT = 17.0, CDISP = 0.4117647058823529, CC > 1.0"", ""PARAMETER_COUNT > 0.9462862423472285"", ""MLOC > 6.874321358438148"", ""CALLS_TO_org.apache.tomcat.util.res.StringMResearcher 1ger > 8"", ""CINT > 8.0, CDISP > 0.5, CC > 1.0"", ""PARAMETER_COUNT > 0.9462862423472285""]","[""418a515a9002b3481ee69e40ac8672b44f2f1435"", ""418a515a9002b3481ee69e40ac8672b44f2f1435""]","[""FeatureEnvy"", ""FeatureEnvy""]","[""1b73f3863216eb745add1525031293bd"", ""10e306299afdee6f46dda2edcef0f568""]","[113, 48]","[125, 60]","[""{\""MethodLinesOfCode\"": 8.0, \""MaxCallChain\"": 1.0, \""ParameterCount\"": 1.0, \""CyclomaticComplexity\"": 3.0, \""LocalityRatio\"": 0.0}"", ""{\""LocalityRatio\"": 0.0, \""ParameterCount\"": 2.0, \""CyclomaticComplexity\"": 5.0, \""MethodLinesOfCode\"": 12.0, \""MaxCallChain\"": 1.0}""]"
Researcher 2,argouml,21224,"[""Move Attribute"", ""Move Attribute"", ""Extract Method"", ""Extract Method"", ""Extract Method"", ""Extract Method"", ""Move Attribute"", ""Move Attribute"", ""Move Attribute"", ""Move Attribute""]","[""org.argouml.kernel.Project"", ""org.argouml.uml.ui.ActionSaveProject"", ""org.argouml.uml.ui.ActionSaveProject.trySave"", ""org.argouml.uml.ui.ActionSaveProjectAs.trySave"", ""org.argouml.uml.ui.ActionSaveProjectAs"", ""org.argouml.uml.ui.ActionSaveProjectAs.getNewFile""]","[""ff21649bd0b06e248d90ca820202f822081f3989""]","[""FeatureEnvy""]","[""40115cc62b44acb1a07d7ed5777ea927""]",[352],[400],"[""CALLS_TO_org.apache.tomcat.util.buf.ByteBufferHolder > 4""]","[""383f04328166cf23d65bff714448c792fa94b0bb"", ""383f04328166cf23d65bff714448c792fa94b0bb"", ""383f04328166cf23d65bff714448c792fa94b0bb"", ""383f04328166cf23d65bff714448c792fa94b0bb"", ""383f04328166cf23d65bff714448c792fa94b0bb"", ""383f04328166cf23d65bff714448c792fa94b0bb"", ""383f04328166cf23d65bff714448c792fa94b0bb""]","[""FeatureEnvy"", ""SpaghettiCode"", ""ComplexClass"", ""ClassDataShouldBePrivate"", ""GodClass"", ""FeatureEnvy"", ""FeatureEnvy""]","[""a2a8d5517d5c62ac85abfb13418dc01d"", ""3e037ad8bbc199a4f9436d1f811550cc"", ""a5d8c6dd6c4e101438d79cf43379cee4"", ""f4068142930528628c266503eab3f2e4"", ""a923c9e6dc2c6f22c48a86a9a3ec4282"", ""3521172f9a72572b9e37677f8f421114"", ""55cbc78063eaa4fcf136ab9bada74fbc""]","[69, 60, 832, 60, 63, 71, 74]","[180, 926, 887, 926, 1027, 141, 104]","[""{\""MethodLinesOfCode\"": 45.0, \""LocalityRatio\"": 0.0, \""CyclomaticComplexity\"": 8.0, \""ParameterCount\"": 1.0, \""MaxCallChain\"": 2.0}"", ""{\""IsAbstract\"": 0.0, \""ClassLinesOfCode\"": 500.0, \""OverrideRatio\"": null, \""TightClassCohesion\"": 0.050921861281826165, \""PublicFieldCount\"": 14.0}"", ""{\""IsAbstract\"": 0.0, \""ClassLinesOfCode\"": 500.0, \""OverrideRatio\"": null, \""TightClassCohesion\"": 0.050921861281826165, \""PublicFieldCount\"": 14.0}"", ""{\""IsAbstract\"": 0.0, \""ClassLinesOfCode\"": 500.0, \""OverrideRatio\"": null, \""TightClassCohesion\"": 0.050921861281826165, \""PublicFieldCount\"": 14.0}"", ""{\""IsAbstract\"": 0.0, \""ClassLinesOfCode\"": 552.0, \""OverrideRatio\"": null, \""TightClassCohesion\"": 0.04886128364389234, \""PublicFieldCount\"": 14.0}"", ""{\""MethodLinesOfCode\"": 48.0, \""LocalityRatio\"": 0.0, \""CyclomaticComplexity\"": 13.0, \""ParameterCount\"": 1.0, \""MaxCallChain\"": 3.0}"", ""{\""LocalityRatio\"": 0.0, \""MaxCallChain\"": 3.0, \""ParameterCount\"": 0.0, \""CyclomaticComplexity\"": 5.0, \""MethodLinesOfCode\"": 19.0}""]"
Researcher 2,argouml,21227,"[""Extract Method"", ""Extract Method"", ""Extract Method"", ""Extract Method""]","[""org.argouml.uml.MMUtil.buildOperation"", ""org.argouml.uml.MMUtil"", ""org.argouml.uml.MMUtil.buildAttribute""]","[""ff21649bd0b06e248d90ca820202f822081f3989""]","[""FeatureEnvy""]","[""40115cc62b44acb1a07d7ed5777ea927""]",[352],[400],"[""CALLS_TO_org.apache.tomcat.util.buf.ByteBufferHolder > 4""]","[""84a6b1c3b22087230526dab3331cabc35692a0dd""]","[""FeatureEnvy""]","[""8fd3987138b3c9f043c7f54b3a070772""]",[446],[458],"[""{\""LocalityRatio\"": 0.0, \""MaxCallChain\"": 2.0, \""ParameterCount\"": 1.0, \""CyclomaticComplexity\"": 1.0, \""MethodLinesOfCode\"": 10.0}""]"
Researcher 2,argouml,21229,"[""Extract Method"", ""Extract Method"", ""Extract Method"", ""Extract Method"", ""Extract Method"", ""Extract Method""]","[""org.argouml.uml.ui.UMLTextField"", ""org.argouml.uml.ui.UMLTextField.insertUpdate"", ""org.argouml.uml.ui.UMLTextField.handleEvent"", ""org.argouml.uml.ui.UMLTextField.removeUpdate"", ""org.argouml.uml.ui.UMLTextField.changedUpdate""]","[""711d8e3637b6e2416c6ea543816135104b9b8e3d"", ""711d8e3637b6e2416c6ea543816135104b9b8e3d"", ""711d8e3637b6e2416c6ea543816135104b9b8e3d"", ""711d8e3637b6e2416c6ea543816135104b9b8e3d"", ""711d8e3637b6e2416c6ea543816135104b9b8e3d""]","[""SpaghettiCode"", ""ComplexClass"", ""IntensiveCoupling"", ""LongMethod"", ""FeatureEnvy""]","[""f1aa4a5142718ec018119ca7c9f27b25"", ""998f9be5d0893a1f2c562489ce132175"", ""4bf80d4f492d0b75ab6302f21b998c6d"", ""4ffb846832700db72bad394eb844eba9"", ""05fb0610b4ce15504db6da9308fafc3d""]","[61, 57, 104, 104, 104]","[669, 632, 149, 161, 190]","[""LONG_METHODS_CONNECTED = 4"", ""CC = 13.0"", ""CINT = 15.0, CDISP = 0.4666666666666667, CC > 1.0"", ""MLOC > 6.68791252093383"", ""CALLS_TO_org.apache.juli.logging.Log > 12""]","[""ea6f470330a40effd56a11bc16ded2a6b1321a45"", ""ea6f470330a40effd56a11bc16ded2a6b1321a45""]","[""FeatureEnvy"", ""ComplexClass""]","[""13ee35f59e5553be6e97c1161069ae42"", ""a67f6edd26d5a27278a780960d3cf395""]","[408, 118]","[422, 225]","[""{\""LocalityRatio\"": 0.2, \""MaxCallChain\"": 2.0, \""ParameterCount\"": 0.0, \""CyclomaticComplexity\"": 2.0, \""MethodLinesOfCode\"": 7.0}"", ""{\""IsAbstract\"": 0.0, \""ClassLinesOfCode\"": 73.0, \""OverrideRatio\"": 0.0, \""TightClassCohesion\"": 0.22727272727272727, \""PublicFieldCount\"": 0.0}""]"
Researcher 2,argouml,21234,"[""Inline Method"", ""Inline Method"", ""Extract Method"", ""Extract Method""]","[""org.argouml.uml.generator.ParserDisplay.findMsgRoot"", ""org.argouml.uml.generator.ParserDisplay.parseMessage"", ""org.argouml.uml.generator.ParserDisplay"", ""org.argouml.uml.generator.ParserDisplay.walk""]","[""711d8e3637b6e2416c6ea543816135104b9b8e3d"", ""711d8e3637b6e2416c6ea543816135104b9b8e3d"", ""711d8e3637b6e2416c6ea543816135104b9b8e3d"", ""711d8e3637b6e2416c6ea543816135104b9b8e3d"", ""711d8e3637b6e2416c6ea543816135104b9b8e3d""]","[""SpaghettiCode"", ""ComplexClass"", ""IntensiveCoupling"", ""LongMethod"", ""FeatureEnvy""]","[""f1aa4a5142718ec018119ca7c9f27b25"", ""998f9be5d0893a1f2c562489ce132175"", ""4bf80d4f492d0b75ab6302f21b998c6d"", ""4ffb846832700db72bad394eb844eba9"", ""05fb0610b4ce15504db6da9308fafc3d""]","[61, 57, 104, 104, 104]","[669, 632, 149, 161, 190]","[""LONG_METHODS_CONNECTED = 4"", ""CC = 13.0"", ""CINT = 15.0, CDISP = 0.4666666666666667, CC > 1.0"", ""MLOC > 6.68791252093383"", ""CALLS_TO_org.apache.juli.logging.Log > 12""]","[""374354d3d64336b9d84479fdb02a3f45cfe962ee"", ""374354d3d64336b9d84479fdb02a3f45cfe962ee"", ""374354d3d64336b9d84479fdb02a3f45cfe962ee"", ""374354d3d64336b9d84479fdb02a3f45cfe962ee"", ""374354d3d64336b9d84479fdb02a3f45cfe962ee"", ""374354d3d64336b9d84479fdb02a3f45cfe962ee"", ""374354d3d64336b9d84479fdb02a3f45cfe962ee"", ""374354d3d64336b9d84479fdb02a3f45cfe962ee""]","[""MessageChain"", ""FeatureEnvy"", ""LongMethod"", ""SpaghettiCode"", ""RefusedBequest"", ""ComplexClass"", ""GodClass"", ""FeatureEnvy""]","[""763fe0e97efe23dd0121aef4553a329d"", ""f05aa7c02f5dde47e413ec2a69dc1ff6"", ""9564b7174e3906bee951df4fdd892061"", ""9c9e7c4c4af966339524749e7a9c7325"", ""5bda39f7c09bbe35f1bbecd8528d2a4a"", ""79aece39a8460563d30615760079c868"", ""11d217c5c4502de050a99b907d368f44"", ""a3c49f5d6cf64d1ff5c57072dcc67718""]","[2015, 2015, 2015, 155, 155, 182, 155, 2609]","[2581, 2581, 2581, 2109, 2109, 295, 2109, 2618]","[""{\""MethodLinesOfCode\"": 311.0, \""MaxCallChain\"": 4.0, \""ParameterCount\"": 2.0, \""CyclomaticComplexity\"": 107.0, \""LocalityRatio\"": 0.07111111111111111}"", ""{\""MethodLinesOfCode\"": 311.0, \""MaxCallChain\"": 4.0, \""ParameterCount\"": 2.0, \""CyclomaticComplexity\"": 107.0, \""LocalityRatio\"": 0.07111111111111111}"", ""{\""MethodLinesOfCode\"": 311.0, \""MaxCallChain\"": 4.0, \""ParameterCount\"": 2.0, \""CyclomaticComplexity\"": 107.0, \""LocalityRatio\"": 0.07111111111111111}"", ""{\""IsAbstract\"": 0.0, \""ClassLinesOfCode\"": 963.0, \""OverrideRatio\"": 0.5333333333333333, \""TightClassCohesion\"": 0.0026455026455026454, \""PublicFieldCount\"": 0.0}"", ""{\""IsAbstract\"": 0.0, \""ClassLinesOfCode\"": 963.0, \""OverrideRatio\"": 0.5333333333333333, \""TightClassCohesion\"": 0.0026455026455026454, \""PublicFieldCount\"": 0.0}"", ""{\""IsAbstract\"": 0.0, \""ClassLinesOfCode\"": 963.0, \""OverrideRatio\"": 0.5333333333333333, \""TightClassCohesion\"": 0.0026455026455026454, \""PublicFieldCount\"": 0.0}"", ""{\""IsAbstract\"": 0.0, \""ClassLinesOfCode\"": 963.0, \""OverrideRatio\"": 0.5333333333333333, \""TightClassCohesion\"": 0.0026455026455026454, \""PublicFieldCount\"": 0.0}"", ""{\""MethodLinesOfCode\"": 8.0, \""MaxCallChain\"": 2.0, \""ParameterCount\"": 2.0, \""CyclomaticComplexity\"": 3.0, \""LocalityRatio\"": 0.0}""]"
Researcher 2,argouml,21244,"[""Extract Method"", ""Extract Method"", ""Extract Method"", ""Extract Method""]","[""org.argouml.model.ModelFacade"", ""org.argouml.model.ModelFacade.isConstructor"", ""org.argouml.model.ModelFacade.isStereotype"", ""org.argouml.model.ModelFacade.isSingleton""]","[""679401356aed7c50a455fa73c0d0b24a06117384"", ""679401356aed7c50a455fa73c0d0b24a06117384"", ""679401356aed7c50a455fa73c0d0b24a06117384"", ""679401356aed7c50a455fa73c0d0b24a06117384"", ""679401356aed7c50a455fa73c0d0b24a06117384"", ""679401356aed7c50a455fa73c0d0b24a06117384"", ""679401356aed7c50a455fa73c0d0b24a06117384"", ""679401356aed7c50a455fa73c0d0b24a06117384"", ""679401356aed7c50a455fa73c0d0b24a06117384"", ""679401356aed7c50a455fa73c0d0b24a06117384"", ""679401356aed7c50a455fa73c0d0b24a06117384"", ""679401356aed7c50a455fa73c0d0b24a06117384"", ""679401356aed7c50a455fa73c0d0b24a06117384"", ""679401356aed7c50a455fa73c0d0b24a06117384"", ""679401356aed7c50a455fa73c0d0b24a06117384"", ""679401356aed7c50a455fa73c0d0b24a06117384"", ""679401356aed7c50a455fa73c0d0b24a06117384""]","[""DispersedCoupling"", ""LongMethod"", ""BrainClass"", ""SpaghettiCode"", ""ComplexClass"", ""GodClass"", ""SpaghettiCode"", ""ComplexClass"", ""DispersedCoupling"", ""LongMethod"", ""FeatureEnvy"", ""SpaghettiCode"", ""ComplexClass"", ""GodClass"", ""DispersedCoupling"", ""LongMethod"", ""FeatureEnvy""]","[""3b1942063d8d0f25e3e0c96f39a2d912"", ""7cc0e656fa02e44a71330e9c3da909e9"", ""989f9997d407b2fa7b369c132fce2bf0"", ""48511c040e3b5b9310a556899c3e9c00"", ""88fc4cb4cab531c7b66b1febd2e98004"", ""d0e1bc791a1773d826c1506460e869b1"", ""cea0562618edec357888576da010fca9"", ""8738971dbdceb15534f90f05b6301e38"", ""8618470922917a36f436bd922872bb97"", ""f9a126b1ee1b349f44d3b16395728ef5"", ""a539ae1623ed3672a5405c6143ad931d"", ""da9c9846479fb9cde0aeffd9dc96712f"", ""8e84b2b747e5944bb7312a705e6e12b6"", ""eed9ea865a5968d35e56bf1cacd66821"", ""9ad7f1344721c7bd398ceac26bb17edf"", ""2273a1ba03714c3f97972b4895b6bd9b"", ""c2e4955a0896339690be814dafb0adf3""]","[620, 620, 56, 56, 35, 56, 43, 41, 403, 403, 403, 55, 36, 55, 1697, 1697, 1697]","[665, 665, 1697, 1697, 425, 1697, 494, 579, 448, 448, 448, 1357, 410, 1357, 1742, 1742, 1742]","[""CINT > 8.0, CDISP > 0.5, CC > 1.0"", ""MLOC > 6.692972548249224"", ""BRAIN_METHODS = 1, WMC = 259.0, TCC = 0.08067226890756303"", ""LONG_METHODS_CONNECTED = 5"", ""CC = 58.0"", ""CLOC > 500, TCC < 0.42040823562284796"", ""LONG_METHODS_CONNECTED = 2"", ""CC = 56.0"", ""CINT > 8.0, CDISP > 0.5, CC > 1.0"", ""MLOC > 6.692972548249224"", ""CALLS_TO_org.apache.coyote.AbstractProcessor > 7"", ""LONG_METHODS_CONNECTED = 5"", ""CC = 25.0"", ""CLOC > 500, TCC < 0.43751361778444253"", ""CINT > 8.0, CDISP > 0.5, CC > 1.0"", ""MLOC > 6.692972548249224"", ""CALLS_TO_org.apache.coyote.AbstractProcessor > 7""]","[""c3531170e1ad18e30167615e72bbc41ba25033d0""]","[""FeatureEnvy""]","[""eb287d6b96aa109217c8d0f1aa056ec3""]",[291],[312],"[""{\""MaxCallChain\"": 1.0, \""MethodLinesOfCode\"": 11.0, \""ParameterCount\"": 2.0, \""CyclomaticComplexity\"": 4.0, \""LocalityRatio\"": 0.0}""]"
Researcher 2,argouml,21281,"[""Inline Method"", ""Inline Method"", ""Extract Method"", ""Extract Method""]","[""org.argouml.ui.explorer.PerspectiveConfigurator.PerspectiveConfigurator"", ""org.argouml.ui.explorer.PerspectiveConfigurator"", ""org.argouml.ui.explorer.PerspectiveConfigurator.initPersPanel"", ""org.argouml.ui.explorer.PerspectiveConfigurator.makeListeners""]","[""679401356aed7c50a455fa73c0d0b24a06117384"", ""679401356aed7c50a455fa73c0d0b24a06117384"", ""679401356aed7c50a455fa73c0d0b24a06117384"", ""679401356aed7c50a455fa73c0d0b24a06117384"", ""679401356aed7c50a455fa73c0d0b24a06117384"", ""679401356aed7c50a455fa73c0d0b24a06117384"", ""679401356aed7c50a455fa73c0d0b24a06117384"", ""679401356aed7c50a455fa73c0d0b24a06117384"", ""679401356aed7c50a455fa73c0d0b24a06117384"", ""679401356aed7c50a455fa73c0d0b24a06117384"", ""679401356aed7c50a455fa73c0d0b24a06117384"", ""679401356aed7c50a455fa73c0d0b24a06117384"", ""679401356aed7c50a455fa73c0d0b24a06117384"", ""679401356aed7c50a455fa73c0d0b24a06117384"", ""679401356aed7c50a455fa73c0d0b24a06117384"", ""679401356aed7c50a455fa73c0d0b24a06117384"", ""679401356aed7c50a455fa73c0d0b24a06117384""]","[""DispersedCoupling"", ""LongMethod"", ""BrainClass"", ""SpaghettiCode"", ""ComplexClass"", ""GodClass"", ""SpaghettiCode"", ""ComplexClass"", ""DispersedCoupling"", ""LongMethod"", ""FeatureEnvy"", ""SpaghettiCode"", ""ComplexClass"", ""GodClass"", ""DispersedCoupling"", ""LongMethod"", ""FeatureEnvy""]","[""3b1942063d8d0f25e3e0c96f39a2d912"", ""7cc0e656fa02e44a71330e9c3da909e9"", ""989f9997d407b2fa7b369c132fce2bf0"", ""48511c040e3b5b9310a556899c3e9c00"", ""88fc4cb4cab531c7b66b1febd2e98004"", ""d0e1bc791a1773d826c1506460e869b1"", ""cea0562618edec357888576da010fca9"", ""8738971dbdceb15534f90f05b6301e38"", ""8618470922917a36f436bd922872bb97"", ""f9a126b1ee1b349f44d3b16395728ef5"", ""a539ae1623ed3672a5405c6143ad931d"", ""da9c9846479fb9cde0aeffd9dc96712f"", ""8e84b2b747e5944bb7312a705e6e12b6"", ""eed9ea865a5968d35e56bf1cacd66821"", ""9ad7f1344721c7bd398ceac26bb17edf"", ""2273a1ba03714c3f97972b4895b6bd9b"", ""c2e4955a0896339690be814dafb0adf3""]","[620, 620, 56, 56, 35, 56, 43, 41, 403, 403, 403, 55, 36, 55, 1697, 1697, 1697]","[665, 665, 1697, 1697, 425, 1697, 494, 579, 448, 448, 448, 1357, 410, 1357, 1742, 1742, 1742]","[""CINT > 8.0, CDISP > 0.5, CC > 1.0"", ""MLOC > 6.692972548249224"", ""BRAIN_METHODS = 1, WMC = 259.0, TCC = 0.08067226890756303"", ""LONG_METHODS_CONNECTED = 5"", ""CC = 58.0"", ""CLOC > 500, TCC < 0.42040823562284796"", ""LONG_METHODS_CONNECTED = 2"", ""CC = 56.0"", ""CINT > 8.0, CDISP > 0.5, CC > 1.0"", ""MLOC > 6.692972548249224"", ""CALLS_TO_org.apache.coyote.AbstractProcessor > 7"", ""LONG_METHODS_CONNECTED = 5"", ""CC = 25.0"", ""CLOC > 500, TCC < 0.43751361778444253"", ""CINT > 8.0, CDISP > 0.5, CC > 1.0"", ""MLOC > 6.692972548249224"", ""CALLS_TO_org.apache.coyote.AbstractProcessor > 7""]","[""cd71660946aed51c6e2d62ef97b0cdadc18949b2""]","[""FeatureEnvy""]","[""2e5497cb02344b071bb8acc15459b7ff""]",[288],[317],"[""{\""MethodLinesOfCode\"": 16.0, \""MaxCallChain\"": 2.0, \""ParameterCount\"": 0.0, \""CyclomaticComplexity\"": 1.0, \""LocalityRatio\"": 0.0}""]"
Researcher 2,argouml,21285,"[""Extract Method"", ""Extract Method"", ""Extract Method"", ""Extract Method""]","[""org.argouml.kernel.Project.addMember"", ""org.argouml.kernel.Project"", ""org.argouml.kernel.Project.addModelMember"", ""org.argouml.kernel.Project.addDiagramMember""]","[""679401356aed7c50a455fa73c0d0b24a06117384"", ""679401356aed7c50a455fa73c0d0b24a06117384"", ""679401356aed7c50a455fa73c0d0b24a06117384"", ""679401356aed7c50a455fa73c0d0b24a06117384"", ""679401356aed7c50a455fa73c0d0b24a06117384"", ""679401356aed7c50a455fa73c0d0b24a06117384"", ""679401356aed7c50a455fa73c0d0b24a06117384"", ""679401356aed7c50a455fa73c0d0b24a06117384"", ""679401356aed7c50a455fa73c0d0b24a06117384"", ""679401356aed7c50a455fa73c0d0b24a06117384"", ""679401356aed7c50a455fa73c0d0b24a06117384"", ""679401356aed7c50a455fa73c0d0b24a06117384"", ""679401356aed7c50a455fa73c0d0b24a06117384"", ""679401356aed7c50a455fa73c0d0b24a06117384"", ""679401356aed7c50a455fa73c0d0b24a06117384"", ""679401356aed7c50a455fa73c0d0b24a06117384"", ""679401356aed7c50a455fa73c0d0b24a06117384""]","[""DispersedCoupling"", ""LongMethod"", ""BrainClass"", ""SpaghettiCode"", ""ComplexClass"", ""GodClass"", ""SpaghettiCode"", ""ComplexClass"", ""DispersedCoupling"", ""LongMethod"", ""FeatureEnvy"", ""SpaghettiCode"", ""ComplexClass"", ""GodClass"", ""DispersedCoupling"", ""LongMethod"", ""FeatureEnvy""]","[""3b1942063d8d0f25e3e0c96f39a2d912"", ""7cc0e656fa02e44a71330e9c3da909e9"", ""989f9997d407b2fa7b369c132fce2bf0"", ""48511c040e3b5b9310a556899c3e9c00"", ""88fc4cb4cab531c7b66b1febd2e98004"", ""d0e1bc791a1773d826c1506460e869b1"", ""cea0562618edec357888576da010fca9"", ""8738971dbdceb15534f90f05b6301e38"", ""8618470922917a36f436bd922872bb97"", ""f9a126b1ee1b349f44d3b16395728ef5"", ""a539ae1623ed3672a5405c6143ad931d"", ""da9c9846479fb9cde0aeffd9dc96712f"", ""8e84b2b747e5944bb7312a705e6e12b6"", ""eed9ea865a5968d35e56bf1cacd66821"", ""9ad7f1344721c7bd398ceac26bb17edf"", ""2273a1ba03714c3f97972b4895b6bd9b"", ""c2e4955a0896339690be814dafb0adf3""]","[620, 620, 56, 56, 35, 56, 43, 41, 403, 403, 403, 55, 36, 55, 1697, 1697, 1697]","[665, 665, 1697, 1697, 425, 1697, 494, 579, 448, 448, 448, 1357, 410, 1357, 1742, 1742, 1742]","[""CINT > 8.0, CDISP > 0.5, CC > 1.0"", ""MLOC > 6.692972548249224"", ""BRAIN_METHODS = 1, WMC = 259.0, TCC = 0.08067226890756303"", ""LONG_METHODS_CONNECTED = 5"", ""CC = 58.0"", ""CLOC > 500, TCC < 0.42040823562284796"", ""LONG_METHODS_CONNECTED = 2"", ""CC = 56.0"", ""CINT > 8.0, CDISP > 0.5, CC > 1.0"", ""MLOC > 6.692972548249224"", ""CALLS_TO_org.apache.coyote.AbstractProcessor > 7"", ""LONG_METHODS_CONNECTED = 5"", ""CC = 25.0"", ""CLOC > 500, TCC < 0.43751361778444253"", ""CINT > 8.0, CDISP > 0.5, CC > 1.0"", ""MLOC > 6.692972548249224"", ""CALLS_TO_org.apache.coyote.AbstractProcessor > 7""]","[""3dace6eaedf427e3f1074e22c6cff91936c445ed"", ""3dace6eaedf427e3f1074e22c6cff91936c445ed""]","[""ComplexClass"", ""FeatureEnvy""]","[""a5d8c6dd6c4e101438d79cf43379cee4"", ""5a891a9d873e4efa2b77b61f934508ac""]","[832, 371]","[887, 400]","[""{\""IsAbstract\"": 0.0, \""ClassLinesOfCode\"": 500.0, \""OverrideRatio\"": null, \""TightClassCohesion\"": 0.050921861281826165, \""PublicFieldCount\"": 14.0}"", ""{\""MethodLinesOfCode\"": 16.0, \""LocalityRatio\"": 0.2, \""ParameterCount\"": 1.0, \""CyclomaticComplexity\"": 5.0, \""MaxCallChain\"": 1.0}""]"
Researcher 2,argouml,21292,"[""Extract Method"", ""Extract Method"", ""Extract Method"", ""Extract Method"", ""Inline Method"", ""Inline Method"", ""Extract Method"", ""Extract Method""]","[""org.argouml.uml.diagram.static_structure.layout.ClassdiagramLayouter"", ""org.argouml.uml.diagram.static_structure.layout.ClassdiagramLayouter.layout"", ""org.argouml.uml.diagram.static_structure.layout.ClassdiagramLayouter.setupLinks"", ""org.argouml.uml.diagram.static_structure.layout.ClassdiagramLayouter.rankAndWeightNodes"", ""org.argouml.uml.diagram.static_structure.layout.ClassdiagramLayouter.add"", ""org.argouml.uml.diagram.static_structure.layout.ClassdiagramLayouter.placeNodes""]","[""9d297a3c281b50f29bc8bb79df3c94a6599b7db4"", ""9d297a3c281b50f29bc8bb79df3c94a6599b7db4"", ""9d297a3c281b50f29bc8bb79df3c94a6599b7db4"", ""9d297a3c281b50f29bc8bb79df3c94a6599b7db4"", ""9d297a3c281b50f29bc8bb79df3c94a6599b7db4"", ""9d297a3c281b50f29bc8bb79df3c94a6599b7db4"", ""9d297a3c281b50f29bc8bb79df3c94a6599b7db4""]","[""FeatureEnvy"", ""SpaghettiCode"", ""ComplexClass"", ""GodClass"", ""IntensiveCoupling"", ""FeatureEnvy"", ""DataClass""]","[""a042a084ef60246682dd3cd4e41345af"", ""34ecc864453c184cc405232aaf01ccda"", ""78aa4e899089452c1f6040c86adc75ff"", ""150a03581d7f600c8aa6f60d1778c798"", ""68a33cfbd5b3d5bdf4f4c116a83add7c"", ""bb198e52a292104d159d3449e6958955"", ""de7dce7c645e04cc573214b1f2903f3a""]","[623, 56, 56, 56, 919, 919, 1076]","[646, 1355, 1355, 1355, 945, 945, 1338]","[""CALLS_TO_org.apache.tomcat.jni.SSL > 4"", ""LONG_METHODS_CONNECTED = 3"", ""CC = 19.0"", ""CLOC > 500, TCC < 0.4877410010384323"", ""CINT = 9.0, CDISP = 0.4444444444444444, CC > 1.0"", ""CALLS_TO_org.apache.tomcat.jni.SSL > 5"", ""WOC = 0.19047619047619047, NOPA = 0.0, NOAM = 17.0, WMC = 60.0""]","[""6fa7891e91d42cfd4c7439e7138d38e828d0b39c"", ""6fa7891e91d42cfd4c7439e7138d38e828d0b39c"", ""6fa7891e91d42cfd4c7439e7138d38e828d0b39c"", ""6fa7891e91d42cfd4c7439e7138d38e828d0b39c""]","[""FeatureEnvy"", ""FeatureEnvy"", ""FeatureEnvy"", ""FeatureEnvy""]","[""f928491ee351ca1f8175ef7314db7f68"", ""70a4a315f916607ab65bc53c5afcefc1"", ""1f4103957696d65c7c6b2a6e8a078bb9"", ""dee448d90da5daac08229888dc597fed""]","[578, 108, 492, 514]","[625, 116, 512, 567]","[""{\""LocalityRatio\"": 0.0, \""MaxCallChain\"": 2.0, \""ParameterCount\"": 0.0, \""CyclomaticComplexity\"": 9.0, \""MethodLinesOfCode\"": 29.0}"", ""{\""MethodLinesOfCode\"": 2.0, \""MaxCallChain\"": 1.0, \""ParameterCount\"": 1.0, \""CyclomaticComplexity\"": 1.0, \""LocalityRatio\"": 0.0}"", ""{\""LocalityRatio\"": 0.2727272727272727, \""MaxCallChain\"": 1.0, \""ParameterCount\"": 0.0, \""CyclomaticComplexity\"": 3.0, \""MethodLinesOfCode\"": 12.0}"", ""{\""LocalityRatio\"": 0.0, \""MaxCallChain\"": 2.0, \""ParameterCount\"": 0.0, \""CyclomaticComplexity\"": 7.0, \""MethodLinesOfCode\"": 28.0}""]"
Researcher 2,argouml,21307,"[""Extract Method"", ""Extract Method"", ""Extract Method"", ""Extract Method""]","[""org.argouml.uml.ui.ActionGenerateOne.actionPerformed"", ""org.argouml.uml.ui.ActionGenerateOne"", ""org.argouml.uml.ui.ActionGenerateOne.getCandidates"", ""org.argouml.uml.ui.ActionGenerateOne.shouldBeEnabled""]","[""9d297a3c281b50f29bc8bb79df3c94a6599b7db4"", ""9d297a3c281b50f29bc8bb79df3c94a6599b7db4"", ""9d297a3c281b50f29bc8bb79df3c94a6599b7db4"", ""9d297a3c281b50f29bc8bb79df3c94a6599b7db4"", ""9d297a3c281b50f29bc8bb79df3c94a6599b7db4"", ""9d297a3c281b50f29bc8bb79df3c94a6599b7db4"", ""9d297a3c281b50f29bc8bb79df3c94a6599b7db4""]","[""FeatureEnvy"", ""SpaghettiCode"", ""ComplexClass"", ""GodClass"", ""IntensiveCoupling"", ""FeatureEnvy"", ""DataClass""]","[""a042a084ef60246682dd3cd4e41345af"", ""34ecc864453c184cc405232aaf01ccda"", ""78aa4e899089452c1f6040c86adc75ff"", ""150a03581d7f600c8aa6f60d1778c798"", ""68a33cfbd5b3d5bdf4f4c116a83add7c"", ""bb198e52a292104d159d3449e6958955"", ""de7dce7c645e04cc573214b1f2903f3a""]","[623, 56, 56, 56, 919, 919, 1076]","[646, 1355, 1355, 1355, 945, 945, 1338]","[""CALLS_TO_org.apache.tomcat.jni.SSL > 4"", ""LONG_METHODS_CONNECTED = 3"", ""CC = 19.0"", ""CLOC > 500, TCC < 0.4877410010384323"", ""CINT = 9.0, CDISP = 0.4444444444444444, CC > 1.0"", ""CALLS_TO_org.apache.tomcat.jni.SSL > 5"", ""WOC = 0.19047619047619047, NOPA = 0.0, NOAM = 17.0, WMC = 60.0""]","[""20b9b773f1b9af8d47e5930085f150bbb3251f6a""]","[""FeatureEnvy""]","[""f7e9f824ee7dc5419dbef31a80e6150e""]",[80],[98],"[""{\""MethodLinesOfCode\"": 11.0, \""LocalityRatio\"": 0.0, \""ParameterCount\"": 0.0, \""CyclomaticComplexity\"": 4.0, \""MaxCallChain\"": 2.0}""]"
Researcher 2,argouml,21309,"[""Move Method"", ""Move Method"", ""Pull Up Method"", ""Pull Up Method"", ""Extract Method"", ""Extract Method""]","[""org.argouml.uml.diagram.static_structure.ui.FigInterface"", ""org.argouml.uml.diagram.static_structure.ui.FigClassifierBox"", ""org.argouml.uml.diagram.static_structure.ui.FigClass"", ""org.argouml.uml.diagram.static_structure.ui.FigClassifierBox.unhighlight""]","[""a5cdfa2c956e5cc59fa391e98007be2593f5fb6e"", ""a5cdfa2c956e5cc59fa391e98007be2593f5fb6e"", ""a5cdfa2c956e5cc59fa391e98007be2593f5fb6e"", ""a5cdfa2c956e5cc59fa391e98007be2593f5fb6e"", ""a5cdfa2c956e5cc59fa391e98007be2593f5fb6e"", ""a5cdfa2c956e5cc59fa391e98007be2593f5fb6e"", ""a5cdfa2c956e5cc59fa391e98007be2593f5fb6e"", ""a5cdfa2c956e5cc59fa391e98007be2593f5fb6e"", ""a5cdfa2c956e5cc59fa391e98007be2593f5fb6e""]","[""SpeculativeGenerality"", ""SpaghettiCode"", ""ComplexClass"", ""ClassDataShouldBePrivate"", ""GodClass"", ""LongMethod"", ""IntensiveCoupling"", ""LongMethod"", ""FeatureEnvy""]","[""315b85560519662faced99d8f6a865d0"", ""150e7f295d6b57a51b21f452bcc99534"", ""19d25e573db4517abc68bc2a9834b1cf"", ""37af1467227348e6e941788a0fdd369b"", ""c8928c11f3e5d89b82873272b7dbc61d"", ""eaaad366039bfe5c06a1976fb5290151"", ""c453d719418eef2bfeaa6ab5f8b2a6ef"", ""3d7b7ee88b2065b9160ab7dc8f405b73"", ""4fe3650c563ef81db7ce72a81387c0fe""]","[83, 83, 83, 83, 83, 2361, 2520, 2520, 2520]","[2736, 2736, 2736, 2736, 2736, 2504, 2655, 2655, 2655]","[""IS_ABSTRACT = 1, CHILDREN_COUNT = 2"", ""LONG_METHODS_CONNECTED = 10"", ""CC = 25.0"", ""PUBLIC_FIELD_COUNT = 1.0"", ""CLOC > 500, TCC < 0.49176697471028613"", ""MLOC > 6.681869954934875"", ""CINT = 11.0, CDISP = 0.45454545454545453, CC > 1.0"", ""MLOC > 6.681111331220257"", ""CALLS_TO_org.apache.catalina.WebResource > 8""]","[""ef0be8b931051ed1898d9d97d2aa6c41cddf85dc"", ""ef0be8b931051ed1898d9d97d2aa6c41cddf85dc"", ""ef0be8b931051ed1898d9d97d2aa6c41cddf85dc"", ""ef0be8b931051ed1898d9d97d2aa6c41cddf85dc"", ""ef0be8b931051ed1898d9d97d2aa6c41cddf85dc""]","[""SpeculativeGenerality"", ""SpaghettiCode"", ""GodClass"", ""ComplexClass"", ""FeatureEnvy""]","[""a9a79f630b94403c2fd07a4891b57e41"", ""866b4958f5a10a7c9cfe18c97a3c4a6a"", ""b14a6f7604d4eea35fdd16570684ee79"", ""7ba0a413ae55ba2d264757ed22947732"", ""d19f1baad939b13aa006a79fe90743c0""]","[34, 54, 74, 435, 190]","[98, 511, 1461, 501, 206]","[""{\""IsAbstract\"": 1.0, \""ClassLinesOfCode\"": 20.0, \""OverrideRatio\"": 0.011764705882352941, \""TightClassCohesion\"": 1.0, \""PublicFieldCount\"": 0.0}"", ""{\""IsAbstract\"": 0.0, \""ClassLinesOfCode\"": 293.0, \""OverrideRatio\"": 0.225, \""TightClassCohesion\"": 0.21904761904761905, \""PublicFieldCount\"": 1.0}"", ""{\""IsAbstract\"": 0.0, \""ClassLinesOfCode\"": 546.0, \""OverrideRatio\"": 0.5454545454545454, \""PublicFieldCount\"": 0.0, \""TightClassCohesion\"": 0.013071895424836602}"", ""{\""IsAbstract\"": 0.0, \""ClassLinesOfCode\"": 293.0, \""OverrideRatio\"": 0.225, \""TightClassCohesion\"": 0.21904761904761905, \""PublicFieldCount\"": 1.0}"", ""{\""LocalityRatio\"": 0.0, \""MethodLinesOfCode\"": 10.0, \""ParameterCount\"": 0.0, \""CyclomaticComplexity\"": 3.0, \""MaxCallChain\"": 1.0}""]"
Researcher 2,argouml,21334,"[""Extract Method"", ""Extract Method"", ""Extract Method"", ""Extract Method"", ""Extract Method"", ""Extract Method""]","[""org.argouml.uml.cognitive.critics.CrUML"", ""org.argouml.uml.cognitive.critics.CrUML.setResource"", ""org.argouml.uml.cognitive.critics.CrUML.getLocalizedString"", ""org.argouml.uml.cognitive.critics.CrUML.setupHeadAndDesc"", ""org.argouml.uml.cognitive.critics.CrUML.getClassSimpleName""]","[""a5cdfa2c956e5cc59fa391e98007be2593f5fb6e"", ""a5cdfa2c956e5cc59fa391e98007be2593f5fb6e"", ""a5cdfa2c956e5cc59fa391e98007be2593f5fb6e"", ""a5cdfa2c956e5cc59fa391e98007be2593f5fb6e"", ""a5cdfa2c956e5cc59fa391e98007be2593f5fb6e"", ""a5cdfa2c956e5cc59fa391e98007be2593f5fb6e"", ""a5cdfa2c956e5cc59fa391e98007be2593f5fb6e"", ""a5cdfa2c956e5cc59fa391e98007be2593f5fb6e"", ""a5cdfa2c956e5cc59fa391e98007be2593f5fb6e""]","[""SpeculativeGenerality"", ""SpaghettiCode"", ""ComplexClass"", ""ClassDataShouldBePrivate"", ""GodClass"", ""LongMethod"", ""IntensiveCoupling"", ""LongMethod"", ""FeatureEnvy""]","[""315b85560519662faced99d8f6a865d0"", ""150e7f295d6b57a51b21f452bcc99534"", ""19d25e573db4517abc68bc2a9834b1cf"", ""37af1467227348e6e941788a0fdd369b"", ""c8928c11f3e5d89b82873272b7dbc61d"", ""eaaad366039bfe5c06a1976fb5290151"", ""c453d719418eef2bfeaa6ab5f8b2a6ef"", ""3d7b7ee88b2065b9160ab7dc8f405b73"", ""4fe3650c563ef81db7ce72a81387c0fe""]","[83, 83, 83, 83, 83, 2361, 2520, 2520, 2520]","[2736, 2736, 2736, 2736, 2736, 2504, 2655, 2655, 2655]","[""IS_ABSTRACT = 1, CHILDREN_COUNT = 2"", ""LONG_METHODS_CONNECTED = 10"", ""CC = 25.0"", ""PUBLIC_FIELD_COUNT = 1.0"", ""CLOC > 500, TCC < 0.49176697471028613"", ""MLOC > 6.681869954934875"", ""CINT = 11.0, CDISP = 0.45454545454545453, CC > 1.0"", ""MLOC > 6.681111331220257"", ""CALLS_TO_org.apache.catalina.WebResource > 8""]","[""864f697d41aca1afee5777ece73ccc0d79558398"", ""864f697d41aca1afee5777ece73ccc0d79558398""]","[""FeatureEnvy"", ""FeatureEnvy""]","[""08945554b902e57e7067e3f58faf0008"", ""0230d13f142d1eac91e39135281798d4""]","[77, 230]","[89, 240]","[""{\""MaxCallChain\"": 2.0, \""LocalityRatio\"": 0.0, \""ParameterCount\"": 1.0, \""CyclomaticComplexity\"": 1.0, \""MethodLinesOfCode\"": 3.0}"", ""{\""LocalityRatio\"": 0.0, \""MaxCallChain\"": 2.0, \""ParameterCount\"": 0.0, \""CyclomaticComplexity\"": 1.0, \""MethodLinesOfCode\"": 3.0}""]"
